;Player_Name;Transcription_Text
1389;LIAM;I've spent the last ten minutes while he's kicking that guy's ass to find a soldier or somebody in the crowd to bet.
1390;SAM;A young boy?
1391;LIAM;I'm not you.
1392;LIAM;(laughter) 200 gold on Grog.
1393;LIAM;Somebody in the crowd.
1394;MATT;Make a persuasion check.
1395;TALIESIN;All right.
1396;LIAM;14.
1397;MATT;Going around, you're hard-pressed to find somebody who at this moment in time is interested in betting any money against the goliath that helped save the city.
1398;MATT;You find one gentleman who seems a little interested and he gives you this sidelong, sleazy grin.
1399;MATT;Tell you what, not 200 gold, but I'll put 50 down.
1400;LIAM;That's not worth it.
1401;LIAM;75 gold?
1402;MATT;Step away, halfie.
1403;LAURA;Oh!
1404;LAURA;I heard it.
1405;LAURA;I give him the evil eye.
1406;MATT;He's too focused on the current bout at hand.
1407;MATT;At this table, you can now see Vedmeyer and the woman guard sits down.
1408;MATT;Someone's like, Oh, Trisha's wrestling.
1409;TRAVIS;Her name's Trisha?
1410;TRAVIS;Trish the Dish.
1411;MATT;Vedmeyer, again with his chains against the wood as he sits down with a smile.
1412;MATT;He gives her a grin and nod.
1413;MATT;She's just-- intensity towards him the whole time.
1414;MATT;You can see there's a little bit of intensity to win, but you also see spite in that look.
1415;MATT;You see that she knows what he's done and this victory means more to her than otherwise.
1416;MATT;The two of them-- first match, she pushes and gets the upper hand.
1417;MATT;A three-quarter view perspective, she's tensing herself, you hear the muscle tensing beneath the armor itself, the metal creaking as her whole upper torso begins to push into it.
1418;MATT;She begins to push it back--
1419;LAURA;Yeah!
1420;LAURA;Trish the Dish!
1421;ALL;Trish the Dish!
1422;ALL;Trish the Dish!
1423;MATT;As you guys are shouting this and keeping it going, she gets pushed back again into a defensive position.
1424;MATT;You see the blood rushing to her face, but he himself is starting to look really intense.
1425;MATT;You can see there's surprise in his face from the battle she's giving.
1426;MATT;She (groans) pushes him back to the center, this back and forth, the crowd is starting to get really intense.
1427;MATT;You can see the shouting, the cheering, gets really quiet as everyone is now breathlessly watching this bout.
1428;MATT;She pushes to three-quarters-- He rallies his own strength, but it's not enough, as she (impact sound) onto the table.
1429;MATT;As she releases, she goes, You deserve that, and much more.
1430;MATT;She gets up and walks away.
1431;MATT;The tankard is held out for her.
1432;MATT;She pushes it aside and cracks her knuckles as she steps away.
1433;MATT;Vedmeyer is there staring at his hand.
1434;MATT;Hmm.
1435;MATT;Fitting.
1436;MATT;It's a real pity, I was looking forward to fighting you.
1437;TRAVIS;Well, get used to disappointment, shithead.
1438;MATT;At which point, his chains are tightened and the guards lift him up again off of his seat and he gets led off back into the crowd.
1439;LAURA;Yeah, walk away, you beardless bastard.
1440;MATT;As everyone gathers in now, you can now see more discussions and people are starting to really place bets down now on the outcome of this circumstance.
1441;MATT;The barmaid comes up again.
1442;MATT;You, champion Grog, sit down.
1443;MATT;And you, champion Trisha, sit down.
1444;MATT;As the final round of this show of majestic might happens now.
1445;MATT;Hands clasped, please.
1446;TRAVIS;If I may, thank you for your service to this city.
1447;TRAVIS;That last round was a true pleasure to watch.
1448;MATT;Her face goes from hardened to soft for a minute as she reaches out and clasps you, not hand in hand, but forearm to forearm, and gives you a solid shake.
1449;MATT;I've done so little.
1450;MATT;You've done far more.
1451;MATT;But we all must do our part to keep the city safe.
1452;TRAVIS;Aye.
1453;MATT;But right now, I'm going to have to destroy you.
1454;LAURA;I kind of love Trish the Dish.
1455;MARISHA;I know, I like her, too.
1456;MATT;Her clasp on your forearm slides back, keeping your hand.
1457;MATT;Both of you tense muscles, we're talking Predator vs. Schwarzenegger.
1458;TRAVIS;(Schwarzenegger accent) Yah, what's the matter, Dylan?
1459;TRAVIS;You guys ate too many pretzels?
1460;MATT;(laughs) Just like that.
1461;MATT;As the crowd begins to shout different names, you can see people going, Trish, Trish, Trish, Grog, Grog, Grog.
1462;MATT;The voices are starting to grow and grow as both of you are standing there focusing on each other.
1463;MATT;You can see her tightly bunned dark brunette hair, you can see these green eyes piercing through, looking straight into yours with a bit of sly smirk on the side of her face.
1464;MATT;You can see a little bit of a scar on the outside of her face that's longtime healed and you can see she's definitely seen her share of battle, just from the complexion and the intensity in her face.
1465;MARISHA;She's one of us.
1466;MATT;For the final round, let this show of might begin!
1467;MATT;Strength check.
1468;TRAVIS;Eight.
1469;MATT;As the moment of tension hits, you can sense there's definitely a balance, both of you are keeping at bay.
1470;MATT;She cocks her head curiously and forces you down to the three-quarter back position.
1471;MATT;Go ahead and make another strength check.
1472;LAURA;Come on, Grog!
1473;LAURA;Oh my god.
1474;TRAVIS;Six.
1475;LIAM;It's that sword's influence.
1476;TRAVIS;Yeah, it's laughing in the Bag of Holding.
1477;MATT;She brings you right down to the edge of the table and you can see in her face, there's this genuine look of surprise, like she probably could have finished you, but she feels like there's a trick or there's something to it that she can't be beating you this easy.
1478;TRAVIS;I'm so surprised by what's happening.
1479;TRAVIS;I use Intimidating Presence on her.
1480;MARISHA;Oh shit.
1481;MATT;(laughs) Okay.
1482;MATT;Go ahead and make an intimidation check.
1483;TRAVIS;Fuck.
1484;MATT;Does this have to be during a rage?
1485;TRAVIS;12.
1486;TRAVIS;I'll go into a rage for it.
1487;MATT;(laughing) It may have to be.
1488;MATT;Let's see.
1489;LAURA;(laughing) Why weren't you raging the whole time?
1490;TRAVIS;I was hoping I wouldn't need it!
1491;MATT;No, you don't have to be in a rage for it, but you can choose to, if you want.
1492;TRAVIS;it doesn't add anything to my strength roll, right?
1493;MATT;A 12 for intimidation?
1494;MATT;Well, what do you want to do to try and intimidate her?
1495;MATT;She's about to finish you off on this table.
1496;TRAVIS;I'm like, oh!
1497;TRAVIS;(grunts) and I bite down on my tongue and blood just starts to pour out of the corner of my mouth.
1498;LAURA;Oh, gross!
1499;MATT;She sees this, and her eyes go wide for a second.
1500;MATT;She pulls back and for a brief moment, you feel her grip loosen ever so slightly.
1501;MATT;Go ahead and make the next strength check with advantage.
1502;TRAVIS;Fuck.
1503;TRAVIS;(laughing) It's unreal.
1504;TRAVIS;11.
1505;MATT;11?
1506;TRAVIS;The other one was a one.
1507;MATT;"Well, I'm glad you had advantage on that; she rolled a five."
1508;MATT;So you do manage to (groans) force her back up.
1509;MATT;You're still in a bad place, but you manage to pull out of that circle and you can see now her intensity hits and she realizes she's not going to go soft on you at all going forward.
1510;MATT;But as the blood pools down your chin, you can feel the iron-y taste swishing around in your mouth and you can see there's a little bit of a quiver to her.
1511;MATT;She's still spooked by this whole circumstance, but she's trying her best.
1512;MATT;Go ahead and make another strength check.
1513;TRAVIS;She's battle-worn.
1514;TRAVIS;19.
1515;LAURA;That's good!
1516;MATT;That's good.
1517;MATT;She has disadvantage on these because of the fright.
1518;MATT;I'm giving her that, but even still, she still rolls a 17.
1519;MATT;What did you roll, total?
1520;TRAVIS;19.
1521;MATT;19.
1522;MATT;You guys keep it-- she's still holding you there, you're not able to gain any ground.
1523;MATT;You're really impressed by this display she's giving you.
1524;MATT;Roll again.
1525;TRAVIS;Do I have advantage?
1526;TRAVIS;No.
1527;MATT;No.
1528;TRAVIS;12.
1529;MATT;12?
1530;MATT;Okay.
1531;MATT;She forces you back down--
1532;SAM;I step forward and I sing a song of inspiration.
1533;MATT;What are you singing?
1534;SAM;I sing, (sings) let's go raging now, everybody's learning how, come on on a rampage with me!
1535;TALIESIN;Come on on a rampage with me!
1536;MATT;All right, take a d10 inspiration, as you hear the song break through the intensity and you know that Scanlan's presence alone in itself and his fine ditties means that you can do this.
1537;TRAVIS;Fine ditties!
1538;LIAM;Show us your ditties!
1539;TRAVIS;16.
1540;MATT;16?
1541;LAURA;With the ten inspiration.
1542;MATT;With the ten?
1543;MATT;Okay.
1544;MATT;It's good you did that.
1545;MATT;You force her back up, she starts like, really pushing into it and you can see now the sweat's dripping off of her brow, her eyes are quivering.
1546;MATT;Make another check.
1547;MATT;How long does that last?
1548;TRAVIS;Seven.
1549;MATT;Seven.
1550;MATT;Hold on.
1551;LAURA;You should switch.
1552;SAM;Grog, what are you doing?
1553;SAM;!
1554;TRAVIS;(laughing) I don't know!
1555;TRAVIS;They're so low!
1556;TRAVIS;It was all those free rolls during the two weeks when I rolled 20--
1557;SAM;Oh my god, do you really have hand herpes?
1558;SAM;(laughter)
1559;MATT;What did you roll?
1560;TRAVIS;Seven.
1561;MATT;Seven.
1562;MATT;Yeah, she still beats you.
1563;MATT;So, at this point, you're pushed down.
1564;MATT;She gives you this look--
1565;TRAVIS;This is unreal.
1566;MATT;Yeah.
1567;MATT;Of intense anger-- and her face softens and she gives you a nod of respect.
1568;MATT;(thud) Releases her grip and pulls away, holds her arms up, crowd goes wild.
1569;MATT;The drink is slammed in front of her, the ale swishing and spilling over the side.
1570;MATT;She takes it in one hand and slides it forward and hands it to you.
1571;LAURA;Aw, she's a good lady.
1572;TRAVIS;You are a true warrior and I hope you'll continue to protect this city with that strength.
1573;MATT;I intend to.
1574;MATT;She gives you a nod, walks around, accepts her coin purse and steps back into the rest of the celebration.
1575;TRAVIS;I walk away (coughs), coughing (coughs), trying not to cry.
1576;TRAVIS;(coughs) I take my tankard and splash it on my face.
1577;TRAVIS;Oh, it's just ale.
1578;TRAVIS;It's just ale.
1579;TRAVIS;(sobs)
1580;SAM;It's okay, Grog.
1581;SAM;Let's go get you drunk.
1582;MATT;As this is happening, a courier comes up dressed in colors that are reminiscent of the courier service that travels through Emon, through Westruun.
1583;MATT;There's a certain type of overcoat they wear that gives you the inclination that they've traveled from nearby civilization.
1584;MATT;Steps up with a rolled up sequence of letters and a small box that is wrapped up.
1585;MARISHA;Oh look, the young boy you ordered, Scanlan.
1586;MATT;He's in his mid-20s.
1587;MATT;(laughter) He's asking around.
1588;MATT;Looking for a Percival and a Vox Machina.
1589;MATT;Percival?
1590;TALIESIN;I'm Percival.
1591;MATT;You're Percival?
1592;TALIESIN;Yes.
1593;MATT;I'm to deliver this to you.
1594;MATT;He hands you the small box.
1595;MATT;I have here two small letters.
1596;MATT;And hands them over both to you.
1597;MATT;There's a small, thin one that is actually written to Percival, and there's one addressed to Vox Machina.
1598;TALIESIN;I was going to sit here and watch you roll them.
1599;MARISHA;Presentation's lost.
1600;MATT;That's fine.
1601;SAM;I just noticed Taliesin's outfit, by the way.
1602;LAURA;We were supposed to wear pajamas.
1603;TALIESIN;I wore my pajamas.
1604;TALIESIN;My muppet pajamas.
1605;MATT;Yeah, the week got busy and we forgot.
1606;TRAVIS;You don't want me in my pajamas because they're--
1607;MATT;That one's to you and the other one's to Vox Machina.
1608;SAM;(sings) Letters, we've got letters.
1609;TALIESIN;Oh, this is quite interesting.
1610;TALIESIN;Vox Machina, a little bird tells me you have been playing the heroes again.
1611;TALIESIN;Keep this up, and the whole world will end up indebted to you.
1612;TALIESIN;Please accept this small gift in the spirit of Winter's Crest, as a token of my enduring gratitude.
1613;TALIESIN;Perhaps it will prove useful in a difficult moment.
1614;TALIESIN;In the meantime, I look forward to a fuller account of your deeds reaching us in Vasselheim.
1615;TALIESIN;A joyous Crest to you all.
1616;TALIESIN;It seems you have earned it.
1617;TALIESIN;Lillith.
1618;LAURA;Oh!
1619;TALIESIN;P.S., Zahra sends her greetings.
1620;SAM;(dreamily) Zahra.
1621;MARISHA;The tieflings!
1622;SAM;We had quite a night together.
1623;SAM;Just braiding each other's hair.
1624;TALIESIN;I tuck the private note away and put it in my pocket.
1625;TRAVIS;Yeah, there's another one, right?
1626;MATT;There is a box, yes.
1627;LAURA;Oh, is it big enough to hold a giant carpet?
1628;TALIESIN;Perhaps a small ice egg.
1629;MATT;It's about that big in your hands.
1630;TALIESIN;We open the box.
1631;MATT;You open the gift.
1632;MATT;Inside, there are two--
1633;SAM;Check it for traps!
1634;MATT;(laughs) Make a reflex save-- no.
1635;MATT;As you open it, you see inside there are two crystalline stones that both identically look like that.
1636;LAURA;Okay.
1637;TALIESIN;It's been a while since we had a visual aid.
1638;MATT;Yeah, it's nice when you have a really good artist, apparently.
1639;MATT;But two stones like this.
1640;MATT;They are called Gate Stones.
1641;SAM;Gate Stones?
1642;MATT;The two stones are essentially linked.
1643;MATT;One is placed wherever you like and the other is kept with you.
1644;MATT;A single individual, just an individual, not a group, can take a minute to concentrate on one stone and be instantly transported to where the other stone is, with the stone.
1645;TRAVIS;Badass.
1646;LIAM;One-way ticket.
1647;MATT;Essentially, yeah.
1648;TRAVIS;You take it with you and you can zoom back to wherever you left it.
1649;SAM;There are two stones in this box?
1650;MATT;Yeah.
1651;MATT;They are the two that are linked.
1652;TRAVIS;A person or linked?
1653;MATT;No, there is a single set.
1654;MARISHA;So this is a get out of jail free card.
1655;SAM;Or a bamf-in-Pike card.
1656;MATT;There's multiple situational uses for it, depending.
1657;MATT;But apparently this has been painstakingly either enchanted, constructed, and sent by Lillith for you.
1658;LIAM;They're all from Lillith?
1659;MATT;Yeah, the letters and those two stones.
1660;SAM;From Lillith and Zahra?
1661;MATT;And Zahra, both of them, essentially.
1662;MARISHA;Yeah, Lillith doesn't have the other stone?
1663;LIAM;For a little arcane booty call?
1664;TALIESIN;I don't know what you're talking about.
1665;TRAVIS;Please?
1666;TALIESIN;No.
1667;LAURA;I don't think I've ever seen Percy giggle before.
1668;TRAVIS;Are you blushing?
1669;TALIESIN;No.
1670;TALIESIN;It's cold.
1671;TALIESIN;Very cold.
1672;TRAVIS;It's a new demon, isn't it?
1673;TRAVIS;The blushing demon!
1674;TALIESIN;She was great, wasn't she?
1675;SAM;Lillith is a true friend.
1676;SAM;Zahra, as well.
1677;TALIESIN;Zahra is great, as well.
1678;MATT;You hear murmurs now, people mentioning the pie-eating contest starting soon.
1679;SAM;Vex and Vax!
1680;LAURA;All right, we'll give it a go.
1681;MATT;As you guys make your way over there, we're going to go ahead and go to our break.
1682;MATT;We're at the middle point here, yeah.
1683;MATT;So it's going to be a longer break guys, because we've got a little present for you.
1684;MATT;I know for a while we've been talking about this work we've been doing on a pre-stream story of Vox Machina's adventures that you guys hadn't had a chance to really experience.
1685;MATT;So, through all of us doing our individual narration, as well as the wonderful Wendy Sullivan doing incredible work on 50 pieces of art for this, and using music from actually some of our Critters that sent us some great musical tracks, we have been able to present to you over the next 20 minutes, the story of Vox Machina, the beginning.
1686;MATT;So, enjoy guys, we'll see you here in a moment.
1687;TRAVIS;Yeah!
1688;MATT;The grandest of adventures often stem from humble beginnings.
1689;MATT;The story of Vox Machina is one such a tale.
1690;MATT;They begin as a ragtag group of mercenaries in the swamp town of Stillben, eking out a living, when a job board posting brings them to Fendril Vas, the wealthy head of a small merchant empire.
1691;MATT;Hired to investigate new competition in town called The Myriad, the path eventually leads them into a chamber housing a planar rift, pulling the group into the plane of the stillborn god Crysa-Thul.
1692;MATT;It is revealed that the contract was a ruse to feed the party to the undead, fetal deity.
1693;MATT;Upon destroying the abomination, the party returns to repay Fendril's deceit with a blade to the throat.
1694;LAURA;Weeks pass, and Grog the barbarian hasn't been seen since suddenly leaving for the city of Westruun.
1695;LAURA;Heading there in search of him, the party meets his childhood friend, and their new companion: the gnome cleric, Pike.
1696;LAURA;Grog apparently hasn't been acting normally, and had marched off on his own through the Bramblewood towards the ominous mountain, Gatshadow.
1697;LAURA;The party followed, dispensing with a troop of roadside thieves along the way, and wound their way toward the mountain.
1698;LAURA;Deep within, they encountered an abandoned subterranean city and eventually a crypt housing a mind-controlled Grog, the reanimated corpse of his father Strongjaw, and a dying mage attempting a ritual to Lichdom.
1699;LAURA;Our heroes slayed the mage, but not before he could complete the ritual and embed his phylactery into Grog's chest.
1700;LAURA;Returning to town in search of aid, they find there are few of enough knowledge or power to ascertain the nature of Grog's wound.
1701;LAURA;Also, rumors of missing children begin to reach the party's ears.
1702;LAURA;While contemplating all this at a local inn, the party is approached by a mysterious elf named Drez Vina who wishes to pay handsomely for the party to infiltrate an archmage's tower, and retrieve a particular brass box within.
1703;LAURA;Pushing forward in the hopes of speaking with this archmage, the party accepts, and passes through arcane trap after trap to reach the top of the tower, deciding not to steal from the archmage but instead parley with him for his aid.
1704;LAURA;The tower's keeper, Realmseer Eskil Ryndarien, agrees to help and sends the party to collect two items he requires for the ritual: the skull of a nightmare and the heart of a nymph.
1705;LAURA;The caveat: their defeated foe is indeed a lich now, and in merely two weeks, he will be reborn within Grog!
1706;LAURA;They travel north to the Umbra Hills, wrestle with a small cult to slay their infernal messenger and his nightmare steed, and find a fresh companion in Percy, newly freed from imprisonment.
1707;LAURA;From there, the party rushes south to the Frostweald, a forest shrouded in eternal winter.
1708;LAURA;Battling past basilisks, the party finds a single, unfrozen pool where they coax a nymph from her dimensional sanctuary.
1709;LAURA;Talking their way out of battle, Grog enters the sanctuary with the nymph, and returns holding a jewel gifted by the beautiful creature: the heart of the nymph.
1710;LIAM;Traveling back to the archmage, the ritual is completed and the phylactery destroyed in time, but not without some lingering necromancy branded within Grog.
1711;LIAM;They are suddenly approached by the mysterious elf again, saying his master is unhappy with the broken contract, and he demands that either the debt be paid, or the party complete a more difficult contract in its place.
1712;LIAM;The party accepts, and heads into the Shade Barrow, an ancient druid burial chamber that was purchased and renovated by an eccentric lord who made it his own tomb.
1713;LIAM;Fighting the denizens of the barrow, they locate the tomb and the iron golem guarding it.
1714;LIAM;Successfully defeating the golem, they tear the Arcane Cortex from its chest and return it to Drez to square their debt.
1715;LIAM;After a bit of R and R, a clean-shaven dwarf named Grimthorne propositions the group to enter a nearby, underground fighting ring, even offering to represent them.
1716;LIAM;The party agrees and, not surprisingly, manages to pull off a victory.
1717;LIAM;With the holiday of Winter's Crest arriving, the town bustles with preparation for a festival, during which a strange blue crystal is delivered in the name of Archmage Eskil.
1718;LIAM;This crystal suddenly detonates, freezing the entire populace of Westruun in ice-- though the party is protected by a sudden ally in the streets.
1719;LIAM;In a last-ditch arcane effort, a mystic merchant named Noja manages to shield the group from harm.
1720;LIAM;And where the crystal previously rested now stood a pale, nude woman of white hair and frail physique.
1721;LIAM;She opens a portal and leaps through, the party giving chase into what seems like an icy, frozen world, chaotic and elemental in nature.
1722;LIAM;They catch up to the woman, who then reveals her true self: a great white dragon.
1723;LIAM;Weakened by her premature rebirth, the party manages to defeat her, and upon returning to Westruun, discover its people released from their icy prison.
1724;LIAM;With the archmage Eskil Ryndarien now on trial for the attack on Westruun, the party intercedes and proves his innocence.
1725;LIAM;In thanks, Eskil uses his talents to investigate the source of the blue crystal, revealing the powerful society of thieves, known as the Clasp, responsible for its delivery.
1726;LIAM;Vax, having previously been a member of the Clasp, knows the main headquarters lies within the capital city of Emon, and Vox Machina sets out for the west.
1727;ASHLEY;Upon arriving in the sprawling metropolis of Emon, the party continues to hear of children disappearing, and reports of a black-haired, golden-eyed boy befriending them before they vanish.
1728;ASHLEY;While investigating, they do a few odd jobs, one of which unexpectedly leads them to the home of Syldor, Vex and Vax's father, and his new wife and child.
1729;ASHLEY;Awkwardness aside, Syldor is here as ambassador to Syngorn, the elven city of their origin, to seek aid from the Sovereign Uriel Tal'Dorei.
1730;ASHLEY;However, the political climate of Emon is tense with a recent, failed attempt on the royal family's life making Uriel unreachable at the moment.
1731;ASHLEY;Syldor's connection within the Council has now gone missing, and his mission stands at a complete standstill.
1732;ASHLEY;He hires the party to look in on this missing ally, Sir Gregory Fince, and get his ear back to Syngornian business.
1733;ASHLEY;Vox Machina finds Sir Gregory's home dark and still, pushing them to infiltrate and investigate.
1734;ASHLEY;Within, they discover a dark presence in the home, leading them into a battle with demons in the basement.
1735;ASHLEY;The battle won, Sir Gregory's tortured corpse is found, as are his notes about the attempted assassination on Uriel and his family.
1736;ASHLEY;It seems that since the attempt, the royal family has grown strange and withdrawn, keeping Uriel from the council most hours, and his wife now demanding she attend all meetings, whispering in the Sovereign's ear and scoffing at the others who defy their decree.
1737;ASHLEY;A General Krieg thwarted the attempt, and is mentioned often.
1738;ASHLEY;The party decides to inquire with him.
1739;ASHLEY;On their way out of the basement, half of the party falls into a trap, tumbling into a cistern and are flushed deep below into a subterranean river system.
1740;ASHLEY;The trapped party members-- Vex, Keyleth, Grog, Tiberius, and Percy-- come to rest on a small island in the vast Crystalfen Lake, home to a terrible aboleth!
1741;ASHLEY;Barely escaping, they eventually discover the base remnants of an ancient town, long toppled, and a small hut that contains a clever hag named Trysta.
1742;ASHLEY;Tiberius finds one of his prized artifacts and makes a dangerous deal to acquire it.
1743;ASHLEY;The party barters for information on how to escape, which Trysta will give... in exchange for their aid in slaying a newly nested denizen that threatens her work.
1744;ASHLEY;The party agrees, climbing to the very top of the Crystalfen Cavern to do battle with an umber-hulk.
1745;ASHLEY;The fight goes south when Grog is tossed from the cavern ceiling, nearly dying upon impact with the island, but victory is eventually theirs.
1746;ASHLEY;Returning, Trysta shows them a hidden staircase that exits into the Graveyard District of Emon.
1747;TRAVIS;The other members-- Vax, Pike, and Scanlan-- set out to find where the cistern could have drained to.
1748;TRAVIS;Scanlan leaves to seek out a map of the sewers, while Vax and Pike notice they are being followed through the town.
1749;TRAVIS;Leading the pursuers into an alley, the shadowed figures attack, eventually knocking them both out.
1750;TRAVIS;Vax and Pike awaken within the Clasp's headquarters, meeting with one of their leaders, or Spirelings, named Modeth.
1751;TRAVIS;The Clasp had Sir Gregory's home under surveillance, as bad political stuff can be difficult for the way the Clasp does business, and when our heroes were spotted leaving, they had to be interrogated.
1752;TRAVIS;Vax reveals his membership to the Clasp sect in Westruun, and Modeth calls for a test of their skills and intent.
1753;TRAVIS;Pike and Vax are then forced to do battle with a chained chimera in the Clasp's arena.
