;Player_Name;Transcription_Text
3040;MATT;You put a healing potion-- What healing potion is it?
3041;LIAM;This is a potion of healing greater.
3042;LIAM;4d4 plus four.
3043;MATT;Okay.
3044;MATT;4d4 plus four you heal.
3045;TALIESIN;4d4 plus four (coughs).
3046;TRAVIS;Just you, right?
3047;LAURA;Yeah.
3048;MATT;Quazirat, that's the end of your turn.
3049;LIAM;That's the end of turn, yes.
3050;MATT;All right.
3051;MATT;That brings us to-- unless there's anything else you want to do.
3052;LIAM;That was action.
3053;LIAM;Wait, hold on.
3054;LIAM;I will use bonus action to do Second Wind on myself.
3055;MATT;Okay, sorry, didn't mean to cut you off there, sorry.
3056;LIAM;No, that's fine.
3057;LIAM;That's three, yes.
3058;MATT;All right, that brings us to Greldamine?
3059;MATT;It's your turn.
3060;MATT;The rest of your allies come in, two of them being dragged in, burned and unconscious.
3061;MATT;One of them slowly comes to consciousness as the potion is applied and the dragon is in the room behind roaring now.
3062;MATT;The whole chamber shakes and quakes and you watch as bits of rock begin to fall in the mine shaft that you're in.
3063;MATT;What are you doing?
3064;LAURA;Who else is still in the room?
3065;MATT;All of your allies haven't quite caught up to you, they're about ten feet away from you, but they're coming into the tunnel that you're in.
3066;LAURA;Ten feet away?
3067;LAURA;He is?
3068;MATT;Yes.
3069;LAURA;I'm going to run towards him because he's still unconscious, he's being dragged, right?
3070;MATT;Correct.
3071;LAURA;I'm going to run towards him, ten feet, give him a greater healing potion, 4d4 plus four.
3072;TRAVIS;Oh yeah, you roll that.
3073;LAURA;No, you roll it.
3074;MATT;Whichever, as long as somebody rolls, it's fine.
3075;TRAVIS;Oh my god, I can't grab it.
3076;TRAVIS;Stop it.
3077;TRAVIS;This is the slipperiest dice ever.
3078;TRAVIS;Damn.
3079;TRAVIS;12.
3080;LAURA;Plus four.
3081;LAURA;16.
3082;LAURA;And then I'm going to use the remainder of my movement to run back into the tunnel.
3083;MATT;You go rushing back down the tunnel.
3084;MATT;(yelling)
3085;LAURA;(yelling)
3086;MATT;That brings us to your turn, Lohkor.
3087;MATT;You come to consciousness coughing from the vial of healing potion.
3088;TRAVIS;(yelling) Double dash!
3089;MATT;Half of your movement to get up.
3090;MATT;Then you do the rest of your movement and then dash.
3091;MATT;You go screaming past your gnome friend.
3092;MATT;You haven't seen a person in plate move so quickly.
3093;MATT;That ends your turn.
3094;MATT;It is now the dragon's turn.
3095;MATT;To your luck, the breath weapon does not regenerate.
3096;MATT;The dragon is going to take swipes at each of you.
3097;MATT;That's a 24 versus you.
3098;LIAM;Only hits a little bit, though.
3099;MATT;Okay.
3100;MATT;And then against you.
3101;MATT;That's a 15.
3102;JENNIFER;17.
3103;MATT;As both claws strike out to slam into both of you down on the ground, you manage to dive out of the way.
3104;MATT;You feel the impact behind you.
3105;MATT;You almost don't get to your feet as you catch.
3106;MATT;You turn around, though, and you see the arms and legs splayed underneath the dragon claws of your Draenei friend, Quazirat.
3107;LIAM;Everything's going to be fi--
3108;MATT;That is 15 points of slashing damage.
3109;LIAM;Yes, okay.
3110;LAURA;Are you still alive?
3111;LIAM;Yeah, you know, always living.
3112;MATT;There's no room in here to do a tail attack, unfortunately.
3113;MATT;So it can't make that.
3114;MATT;That ends the dragon's turn.
3115;MATT;Your turn, Jennifer.
3116;JENNIFER;Okay.
3117;JENNIFER;So I decide what we're going to do?
3118;MATT;All your friends are running out that way.
3119;MATT;The dragon seemingly can't get into this size of the chamber.
3120;JENNIFER;I'm running.
3121;MATT;You go bolting out there.
3122;LAURA;Good thing you got that dagger, though!
3123;JENNIFER;Yes!
3124;MATT;You're holding the dagger like, Yay!
3125;MATT;(yelling) You go running and you catch up to the rest of them.
3126;MATT;You're bolting past the mage.
3127;MATT;Full on double dash.
3128;MATT;You go past your paladin friend.
3129;MATT;That ends your turn.
3130;MATT;That brings us to Bundle.
3131;TALIESIN;I'm running.
3132;TALIESIN;No, I'm out!
3133;MATT;You go bolting, dwarven legs catching up to the rest of them.
3134;MATT;That brings us to the top.
3135;MATT;Quazirat?
3136;LIAM;I'm going to flee from the dragon.
3137;MATT;Make a wisdom saving throw.
3138;LIAM;We'll see how we do!
3139;TRAVIS;Oh shit!
3140;TALIESIN;I'm so excited!
3141;LIAM;It's a big 13!
3142;MATT;Exactly?
3143;MATT;What's the DC on the sword?
3144;LIAM;12.
3145;MATT;So you succeed!
3146;LIAM;Let's get the hell out of here, you guys!
3147;MATT;You resist the magical influence of the YOLO that's thrown upon you by Adventure--
3148;LIAM;Blessed Blade of the Thrill Seeker.
3149;MATT;Adventurefury.
3150;MATT;Blessed Blade of the Thrill Seeker.
3151;LIAM;Eh, too much hassle!
3152;LIAM;Go!
3153;MATT;I believe he's wielding an adventure sword.
3154;MATT;As you guys are bolting behind, rushing as fast as you can, you hear the rumbling and the roar of the dragon and the heavy inhale once more.
3155;MATT;As the head begins to push its way into the cavern behind you, the impact, the cavern shaking, you two who are running the fastest notice before anyone else does, the ground gives out beneath you.
3156;MATT;You both go into a freefall as the strength of the ground dissipates beneath your form.
3157;MATT;The rest of you see this happen just as you reach the edge and you watch as the tunnel is falling and collapsing beneath you as you all begin to tumble down into darkness.
3158;MATT;Right as that gout of fire is released, you watch above you as you spin into shadow, the flames completely engulf the cavern where you once were.
3159;MATT;Strangely, the collapse saved you!
3160;MATT;As you plummet down, whack!
3161;MATT;I need everyone to make an acrobatics check to see if you can manage to lessen the impact of the fall.
3162;LAURA;Natural 20!
3163;TALIESIN;Not a natural 20, but 20.
3164;MATT;You take four points of bludgeoning damage.
3165;TRAVIS;14.
3166;MATT;Four points of bludgeoning damage.
3167;TALIESIN;20.
3168;MATT;Four points of bludgeoning damage.
3169;JENNIFER;19.
3170;MATT;Four points of bludgeoning damage.
3171;LIAM;24.
3172;MATT;Four points of bludgeoning damage.
3173;MATT;You guys all managed to lessen the impact of the fall.
3174;LAURA;What happened to Reeksus?
3175;MATT;He is nowhere to be seen.
3176;MATT;Who knows what his fate was.
3177;MATT;Probably very toasty.
3178;TRAVIS;Can I Cure Wounds on myself?
3179;MATT;Yeah!
3180;TRAVIS;Cure Wounds!
3181;MATT;Go for it.
3182;MATT;By the way, you now have that.
3183;LIAM;See what you got.
3184;LIAM;Ooh!
3185;LAURA;Read it out loud!
3186;JENNIFER;Kingslayer.
3187;JENNIFER;Dagger.
3188;JENNIFER;Artifact.
3189;JENNIFER;Requires attunement slot.
3190;JENNIFER;One-handed weapon.
3191;JENNIFER;Once commissioned by the orc warlock Gul'dan for his assassin Garona, this blade has seen many a death at its hands.
3192;JENNIFER;One of a pair, the other has been lost to time.
3193;JENNIFER;You gain +3 to all attack and damage rolls made with this weapon.
3194;JENNIFER;When you hit an enemy, they suffer an extra 1d8 poison damage and make constitution save (DC 14) or become poisoned until the end of your next turn.
3195;TALIESIN;That's mean!
3196;LAURA;Attune to that shit!
3197;JENNIFER;It was hard to get.
3198;TALIESIN;Worth it!
3199;LIAM;She needs 20 minutes with that.
3200;LIAM;So we should probably, you know.
3201;LAURA;We could rest up.
3202;TALIESIN;I'll do a Mass Healing Word.
3203;LAURA;Do you want to?
3204;LAURA;Or we could use our hit dice.
3205;LAURA;If we take a short rest while she attunes.
3206;TALIESIN;We could use our hit dice, or I could do, yeah.
3207;LAURA;We might need that later.
3208;TRAVIS;Yeah, do the hit dice.
3209;MATT;You guys glance around the space you're in.
3210;LAURA;Oh, yeah.
3211;LAURA;We need to actually do that.
3212;MATT;As you guys are having this conversation, you look around.
3213;MATT;What faint bit of light you carry with your torch light or the Light spell to look around at the space around.
3214;MATT;You seem to have slipped down into a small crevasse that is partially broken open.
3215;MATT;You're hidden in this small, collapsed portion where a lot of it is filled with the loose rock.
3216;MATT;Beyond it, you can see a flickering, orange glow.
3217;MATT;As you approach and glance up the side, make a perception check, whoever is at the front of that.
3218;TRAVIS;I've got it.
3219;TRAVIS;Advantage.
3220;TRAVIS;Blue fungus!
3221;TRAVIS;That was crap all around.
3222;TRAVIS;Nine.
3223;TRAVIS;Ten.
3224;LAURA;That's terrible.
3225;MATT;As you come inside, you see a circular chamber.
3226;MATT;More hexagonal, I guess.
3227;MATT;Stone-built, constructed.
3228;MATT;Most everything else here has been natural.
3229;MATT;This has some cavernous feel, but has some structure to it.
3230;MATT;This entire chamber is filled with knickknacks, gold pieces, random boxes, collected odds and ends, and mounds of wax ending in numerous lit candles.
3231;MATT;The entire chamber: hundreds of lit candles.
3232;MATT;The most romantic of chambers you've seen.
3233;MATT;Large, small.
3234;MATT;This is the mass of where candle storage is for this subterranean cavern network.
3235;MATT;That's all you're able to make out from this point.
3236;TRAVIS;Well, there's a shitload of wax ahead.
3237;LAURA;Should we sit down and heal ourselves?
3238;TRAVIS;Yeah.
3239;TRAVIS;I think the coast is clear.
3240;LAURA;Okay.
3241;TALIESIN;Actually, I can do a thing that might help.
3242;TALIESIN;Where's the thing where I can make it so we all get max healing no matter what?
3243;MATT;That's a 3rd-level spell.
3244;MATT;That is--
3245;TALIESIN;Beacon of Hope?
3246;LAURA;No, I don't think you have it.
3247;TALIESIN;It's Beacon of Hope.
3248;TALIESIN;So I'm going to cast Beacon of Hope on everybody so for the next minute, I suppose it's just-- will this work for hit dice?
3249;MATT;Not on hit dice, no.
3250;TALIESIN;Never mind.
3251;MATT;Beacon of Hope is for spells and effects that heal you.
3252;MATT;The hit dice is resting for an extended period of time.
3253;TALIESIN;We'll just do the hit dice.
3254;TALIESIN;It's been so long!
3255;LIAM;Where are you at?
3256;LAURA;All right!
3257;TALIESIN;Wow, that was awful.
3258;LAURA;I'm back, baby!
3259;TALIESIN;Boy, I'm not.
3260;MATT;As you guys are completing your short rest, a new sound perks your ears as you're resting.
3261;MATT;You all stop for a moment and listen.
3262;MATT;It's the sound of a soft violin.
3263;MATT;Echoey.
3264;MATT;In the direction of where the candles are being stored.
3265;LAURA;Can I peek through the little thing?
3266;MATT;(violin playing) Make a perception check.
3267;LIAM;I don't like that music.
3268;TRAVIS;Yeah.
3269;LIAM;I don't like it.
3270;LAURA;17 plus five is 22.
3271;MATT;As you come to the edge and you glance past the first few rows of wax and candle mounds, you can see in the distance a number of piles of collected unlit candles that line the walls.
3272;MATT;To the back of this 30-foot diameter chamber, a large lump wax throne stands, crowned with a dozen wide candles all flickering as they wreathe a sitting, larger, more rotund than average kobold, wearing leather armor that cannot seem to contain his bulging belly, now freed from the bursting leather plates around his torso.
3273;MATT;A white, wild chinstrap beard marks his chin line, as a large metallic crown of cobbled golds, silvers, and iron adorn his head, fused with a tall window lantern that shines brighter than a lantern should.
3274;MATT;You see shifting movement from within the lantern, like the light source seems to be moving of its own accord, almost alive.
3275;MATT;A smaller, elderly kobold stands next to this wax throne with a tiny violin, and he's playing music as the kobold king sitting on the throne has his eyes partially closed, listening.
3276;MATT;You see, through the shadows of the flickering candlelight, amongst the various piles beyond your vision, apparently other kobolds are also in the chamber rummaging around, moving, organizing, placing goods they've received.
3277;MATT;That's what you see.
3278;LAURA;How far away is the throne?
3279;MATT;It's about 25 feet from you.
3280;LAURA;(whispering) You guys, the king is right there!
3281;LAURA;Lots of other dudes in there too.
3282;TRAVIS;Does the staff have any suggestions?
3283;LAURA;Hey, Aluneth!
3284;LAURA;Should we attack?
3285;MATT;If you feel confident in your power, then destroy them and siphon their magic.
3286;MATT;Feed on what power they've got.
3287;LAURA;Can I do that with you?
3288;MATT;Of course, my darling.
3289;JENNIFER;What's he saying?
3290;LAURA;Aluneth is saying: destroy them!
3291;JENNIFER;Can you do that?
3292;LAURA;I don't know.
3293;MATT;Can you do that?
3294;LAURA;Yeah!
3295;MATT;Then prove that you're worthy of my gifts.
3296;LAURA;Yeah!
3297;LAURA;Should I do a Fireball at the king?
3298;TRAVIS;Who's playing the violin?
3299;LAURA;An old kobold next to him.
3300;TRAVIS;I thought it was a little gnome?
3301;MATT;It's a tiny, elderly kobold who's like (squeaky violin music)
3302;LIAM;I've seen you two in action.
3303;LIAM;What if she fires and you follow with fire?
3304;LAURA;I'll let her do the first attack, because you get assassinate, and then I'm going to Fireball immediately after that.
3305;TALIESIN;And I'll Sacred Flame as well.
3306;JENNIFER;Am I assassinating the king?
3307;JENNIFER;Should we assess first the power of these other kobold around him?
3308;LAURA;Fuck it!
3309;JENNIFER;All right, let's do it.
3310;JENNIFER;Eyes on the prize.
3311;JENNIFER;Crossbow's ready.
3312;MATT;Make a stealth check as you approach the edge and begin to get to a place where you can--
3313;JENNIFER;19.
3314;LIAM;No, it's not, it's much higher.
3315;LIAM;30.
3316;MATT;You feel comfortable enough stepping from the crack in the wall, and then diving below the first row of large, heavy, wax mounds.
3317;MATT;You ready your crossbow across your forearm, aiming it for the king's soft under throat.
3318;MATT;As you prepare yourself, the music comes to a halt from the violinist, and the king turns to him.
3319;MATT;Thank you.
3320;MATT;This earthquake has made me ever so nervous.
3321;MATT;Do you take your shot?
3322;MATT;You have advantage on your attack, so you get to roll twice.
3323;LIAM;That's cocked.
3324;LIAM;So what's the higher one?
3325;JENNIFER;27.
3326;MATT;That definitely hits, go ahead and roll damage.
3327;JENNIFER;That's this one?
3328;LIAM;You're doing crossbow?
3329;LIAM;1d6.
3330;LIAM;Roll a cube.
3331;LIAM;Three plus your sneak attack damage.
3332;LIAM;And we're going to double this when you're done, because you're an assassin hitting in the dark.
3333;MATT;It is considered a critical hit because he is unaware.
3334;LIAM;(counting) 37, because you're an assassin.
3335;LAURA;Fireball!
3336;MATT;(choking) It reaches up and turns as you release the Fireball into the room.
3337;MATT;The violinist starts playing again, looks back and barely pulls the bow away and goes, Oh no!
3338;MATT;as the entire room bursts into flame.
3339;MATT;Go ahead and roll your 8d6 damage.
3340;LIAM;Every kobold is the best in this game.
3341;LAURA;How many?
3342;LAURA;8d6?
3343;LAURA;Oh jeez.
3344;LAURA;24.
3345;MATT;Okay, so 24.
3346;LAURA;Oh!
3347;LAURA;Plus two!
3348;LAURA;26, because I'm attacking with Aluneth.
3349;MATT;Four of the ten kobolds in the room are destroyed as the explosion hits.
3350;MATT;You hear a bunch of screams in the corner as a number of them are annihilated.
3351;MATT;As you can see, the throne itself is melting in the wake of it.
3352;MATT;King Togwaggle.
3353;MATT;A three does not make it.
3354;MATT;So that's 26 fire damage to him.
3355;MATT;And the violinist is ashes.
3356;MATT;As the flames subside, you watch as there's a kobold shaped skeleton clutching a now burning violin that tumbles into a pile on the ground.
3357;MATT;At which point, the other kobolds jump out, damaged and burning looking to King Togwaggle as he's sitting there, the edges of his chin beard burning and curled up.
3358;MATT;He has this giant shovel that he has resting at his side.
3359;MATT;And he glances up at his crown and goes Rakanishu, it looks like company we has.
3360;MATT;And You!
3361;MATT;No!
3362;MATT;Take!
3363;MATT;Candle!
3364;MATT;Slams the shovel onto the ground and stands up.
3365;MATT;Everyone roll initiative.
3366;TRAVIS;Oh my god.
3367;TRAVIS;What the hell?
3368;TRAVIS;What's Rakanishu?
3369;MATT;All righty.
3370;MATT;Wow, okay.
3371;MATT;So, 25 to 20, anybody?
3372;LAURA;22.
3373;TALIESIN;21!
3374;MATT;Oh wow, look at that!
3375;TALIESIN;It finally happened.
3376;TRAVIS;Finally happened.
3377;MATT;All righty.
3378;MATT;Then 20 to 15?
3379;TRAVIS;18.
3380;MATT;15 to ten?
3381;JENNIFER;13.
3382;LIAM;Big ten, my man.
3383;MATT;All right.
3384;MATT;Greldamine, you're up first.
3385;MATT;You finished shooting the fireball, they're all now pulling out pickaxes and going (yelling) and they're all turning.
3386;MATT;They can see you and they can see you and the rest of you, currently now stuck in this hole in the wall right now.
3387;MATT;You're all locked in this pincered position.
3388;LIAM;Let's go, wee one.
3389;LAURA;Okay, ooh.
3390;LAURA;How close are they all to each other?
3391;MATT;They're all about 15 feet from each other.
3392;LAURA;Fireball!
3393;MATT;All right!
3394;MATT;Roll the damage.
3395;MATT;Togwaggle does make his save this time.
3396;LAURA;34.
3397;MATT;34, all right.
3398;MATT;So that's 17 points of fire damage to Togwaggle.
3399;MATT;And the rest of the kobolds (explosion) (screaming).
3400;MATT;Annihilated.
3401;TRAVIS;The one syllable protest!
3402;MATT;Their pickaxes tumble off and some are stuck into the stonework.
3403;MATT;Surrounding, beginning to melt wax elements have now melted even further and are now beginning to coat the ground with soft molten wax.
3404;MATT;The entire chamber is now becoming a sticky wax base.
3405;LAURA;Oh.
3406;LAURA;I may have melted all of our loot that we were supposed to take back.
3407;LIAM;It'll form back together though.
3408;LAURA;Yeah, he's getting his wax back, that's the important part!
3409;LAURA;I am going to back away from the little crack in the wall and hide against the wall.
3410;MATT;So you're now moving out of the crack of the wall and moving into the chamber?
3411;LAURA;No.
3412;MATT;There's a giant, hexagonal, circular chamber, and the small crack in the wall where you guys were hiding.
3413;LAURA;All of us in this teeny crack?
3414;MATT;Yes.
3415;MATT;Except for you, you're actually outside of it and by one of the mounds that is slowly melting in front of you.
3416;LAURA;Okay, I guess I will step outside of the crack and try to hide behind a mound of something.
3417;MATT;Okay, so you dart off to one of the mounds.
3418;MATT;You don't have any action to do a hide check, unfortunately.
3419;MATT;Using it for cover, hopefully.
3420;MATT;That ends your turn.
3421;MATT;Bundle, you're up.
3422;LIAM;Everybody say crack as much as you can.
3423;ALL;Crack!
3424;TALIESIN;Just for fun, let's do-- where is it?
3425;TALIESIN;I keep losing everything I'm doing.
3426;TALIESIN;I'm going to do a very standard Guiding Bolt.
3427;TALIESIN;And a Sacred Flame attack.
3428;TALIESIN;I'm going to go for a two-fer on the big kahuna.
3429;MATT;Those are technically both actions.
3430;TALIESIN;Oh they're both actions?
3431;TALIESIN;I thought it was a bonus, never mind.
3432;TALIESIN;This is so hard to do, it's been so long since I've done this.
3433;MATT;It's okay.
3434;MATT;Guiding Bolt?
3435;LAURA;(singing) Guiding Bolt up the butt!
3436;TALIESIN;I'll do a standard Guiding Bolt at this guy, and see what happens.
3437;MATT;Okay.
3438;MATT;Make a ranged spell attack against King Togwaggle.
3439;TALIESIN;Here we go, Guiding Bolt.
3440;TALIESIN;That's a 19.
3441;MATT;Plus?
3442;TALIESIN;Guiding Bolt is a 25.
3443;MATT;That'll hit, go ahead and roll damage.
3444;TALIESIN;That's 4d6 radiant.
3445;TALIESIN;Ooh!
3446;TALIESIN;16 points of radiant damage.
3447;MATT;Okay, and the next hit against him has advantage.
3448;TALIESIN;Yeah, the next hit against him has advantage, and yeah, I'm going to give myself a quick Healing Word as a bonus action because I'm really low.
3449;MATT;Okay.
3450;MATT;As a reaction, King Togwaggle's going to go ahead and use Vengeance of Rakanishu.
3451;MATT;After the Guiding Bolt slams into King Togwaggle, he lifts up his giant shovel in his hand and you watch as the interior of the lantern crown that he has begins to brighten and suddenly your chest bursts into flame.
3452;MATT;You suffer 14 points of fire damage and you are considered on fire.
3453;MATT;Until you spend an action to put it out, you're going to take 1d6 fire damage every turn.
3454;TALIESIN;All right.
3455;TALIESIN;I am at 29 points of health, that's okay.
3456;MATT;All righty, so that ends your turn?
3457;TALIESIN;Yeah.
3458;MATT;All right, suddenly you watch across the chamber which you hadn't noticed before, there is a door that slams open and from the inside, from what little of bit you can see it looks like some sort of a latrine or like an open piss pot room.
3459;MATT;Four kobolds start rushing out into the center of the chamber, their feet getting stuck in the wax, so they'll only be able to move at half their speed so they can't get up to anybody.
3460;MATT;They take their pickaxes and throw them!
3461;MATT;So they're going to throw three at you and three at you.
3462;MATT;Technically you guys would both have a little bit of cover because you're behind those, so I'd give a plus two to your AC for each of you.
3463;MATT;So the first three against you.
3464;MATT;That is going to be a 16, what's your armor class?
3465;LAURA;I did Mage Armor, so I've got 16.
3466;MATT;Correct, so with the plus two, it does not hit.
3467;MATT;The first one is deflected off the armor.
3468;MATT;Oh, that's going to be a natural 19, so that hits you.
3469;MATT;You suffer nine points of piercing damage as one pickaxe hits you in the chest, clavicle area, you're like (grunt).
3470;MATT;The third one's going to throw and that is a 19.
3471;LAURA;That hits.
3472;MATT;So you take seven points piercing damage from a second pickaxe that jams you in like the hip area, it falls out, but the wound's open.
3473;MATT;The three against you.
3474;MATT;That's going to be a 15 plus four, that's 19?
3475;JENNIFER;I'm 17, I don't have any pluses, right?
3476;LAURA;Plus two!
3477;JENNIFER;Okay, so 19.
3478;MATT;Plus two, so 19, so it hits you exactly.
3479;MATT;So you take six points of piercing damage as one pickaxe grazes you across the neck and shoulder.
3480;MATT;It hurts, you can feel the welt picking up.
3481;MATT;Second one is going to go ahead and strike you, that is going to be an 11.
3482;MATT;So, no.
3483;MATT;That one you dodge out of the way, and a third and final one is going to come for you.
3484;MATT;That is a natural 20!
3485;MATT;As you dodge out of the way and come around, there is one that takes both hands (grunt) (whooshing) and as you spin around to hear the scream it hits you right in the forehead.
3486;MATT;That's a six, that's 12, plus three.
3487;MATT;You take 15 points of piercing damage as your head is ringing from the impact of the pickaxe.
3488;MATT;Your vision blurs and doubles for a second as you right yourself and clutch onto the soft wax.
3489;MATT;You fall into a little bit, and pull yourself out.
3490;MATT;That's going to end the kobolds' turn, now it's King Togwaggle's turn.
3491;MATT;King Togwaggle is going to rush forward, currently it's only the three of you visible because nobody's come out of the chamber yet.
3492;MATT;So he's going to rush forward and get between the two of you and make a shovel strike on each of you.
3493;MATT;So the first one against you, that's a 27.
3494;LAURA;Oh god!
3495;MATT;I rolled a natural 19.
3496;MATT;You take--
3497;LAURA;He's at disadvantage though, because I'm a gnome.
3498;LAURA;I'm very small.
3499;MATT;No.
3500;MATT;That is 15 points of damage, as the shovel hits you upside your head, and then attacking you.
3501;MATT;That is a 16 plus eight, that's 24.
3502;MATT;That hits you.
3503;MATT;That's an eight plus six, that's 14 points of bludgeoning damage.
3504;TALIESIN;(groans)
3505;MATT;Ending their turn, it now comes to you.
3506;TRAVIS;Can I push out of the crevice and run at King Togwaggle?
3507;MATT;You push out and he's right there.
3508;MATT;You guys are all clustered right on the outside so he's easily within range.
3509;TRAVIS;I can get right on him?
3510;MATT;Yeah.
3511;TRAVIS;Can I use my Hammer of Justice, Target a creature within 15 feet of you to make a constitution saving throw against your spell save DC or become stunned until the next round on my next turn?
3512;MATT;Yes you can.
3513;MATT;All right, so.
3514;MATT;That is an 11.
3515;MATT;What's your--
3516;TRAVIS;13!
3517;TRAVIS;Yes!
3518;MATT;So as you step out of the crevice, you summon the radiant energy granted to you from the divine, and you watch as this giant radiant hammer, summoned from the sky, slams down and strikes the top of King Togwaggle's head.
3519;MATT;The crown goes off to the side for a second and he's like (grunting).
3520;MATT;He can't make words, his bell is rung.
3521;MATT;So he's stunned until the end of your next turn.
3522;TRAVIS;Yeah!
3523;MATT;All right, that's your action.
3524;MATT;You're there and you're up engaged with him.
3525;MATT;That finishes your turn.
3526;MATT;All right, you're up, Aerwin.
3527;LAURA;With stunned, if you hit him does it break the stun?
3528;LAURA;Or he's--
3529;MATT;No, he's stunned, and attacks against him have advantage and melee attacks against him I'll double check, I'm pretty sure auto-crit.
