;Player_Name;Transcription_Text
0;MATT;Hello, and welcome to this evening's episode of Critical Role! We'll be with you in just a second. Unfortunately we're down a Travis Willingham tonight, but in Grog's stead we have the rest of the party venturing forth into the Emberhold after just recently discovering Lady Kima. We shall see what happens very shortly, but in the meantime, let's go ahead and give you guys some character backstory.|[dramatic music]
1;ASHLEY;Pike grew up on the outskirts of town, near the Bramblewood. Her ancestors were a family of deep gnomes with quite an unfavorable reputation. Thievery, destruction, and trickery left them with the curse of the last name Trickfoot. Sarenrae, the goddess of healing and redemption, had other plans for Pike's great-great-grandfather Wilhand, who left his family at a young age after a dream, a dream that changed the course of the Trickfoot family.|Wilhand devoted his life to Sarenrae, and pledged from then on that him and his family would live a life of service and devotion. As a child, Pike seemed to have an affinity to heal. Whether it was animals, people, or even flowers, she felt she had a purpose in making things whole that had once been broken. She studied and learned the ways to heal through divine magic. She lived a peaceful life, quiet and simple, until one day Wilhand was captured and almost killed by a group of goliath barbarians. One of the goliaths took a stand against the murder of the innocent gnome, and he himself was beaten, bloodied, and left for dead, abandoned by his herd. Wilhand went to Pike for help. She prayed and healed this barbarian as best she could, bringing him back to life. When he awoke, she discovered his name was Grog Strongjaw.|After that, they were the best of friends, a rather unlikely pair. Little did she know that in a few years' time Grog would soon return the favor and bring her back from the clutches of death.|(roaring, crunch) After being killed in battle, Pike felt angry. She wanted to be stronger so that it would never happen again. She spent four months at sea, training with the men and women aboard a ship called the Broken Howl. Gripping her holy symbol in one hand, and her morningstar in the other, this time, Pike is ready.
2;TRAVIS;Right, listen up! If you have ale, then you have a friend in Grog Strongjaw. A goliath of towering height and size, this barbarian has an appetite for the two great loves in his life: combat, women, and ale. Wait... Easily the brains of the group, Grog is often consulted for his vast knowledge of shapes, colors, and shiny things.|Also ale. In his early years, armed with his two-handed great axe, Grog often enjoyed proving his might amongst the ranks of his family's wandering herd. But after coming upon an unsuspecting elderly gnome in the woods, he objected to the killing of such an innocent life.|A creature of impulse, Grog felt only pity for this terrified little thing. His disobedience cost him dearly. Beaten bloody and banished by the herd leader, his uncle Kevdak, Grog was abandoned and left to die. Exiled from his herd, it was then that the relative of the very gnome he fought to save, saved him. It was the kindness of a gnome cleric named Pike that healed Grog, bringing him back from death's edge. And they have remained close friends ever since. Most nights, Grog can be found challenging entire taverns to wrestling matches! Or accompanying Scanlan to the nearest house where you pay for lady favors. Also ale.
3;MARISHA;A first impression of Keyleth would leave you with little information on the half-elven druid. You might even think that her social awkwardness due to her sheltered upbringing is kind of sweet. Of course, it would be unwise to underestimate her based on first impressions.|Under that unintimidating petite frame is a vicious beast waiting to be unleashed, whose natural powers have made even the fiercest of champions pee their pants. Literally. (laughs) Born to the Air tribe of the Ashari people, Keyleth was raised with a deep love of nature and the elemental magics. It is her people's inherent duty to protect the delicate areas in Tal'Dorei, where the four elemental planes begin to bleed with this realm. Since she was a little girl, she had quite a knack for air manipulation and beast-shaping abilities. Well, if you consider kittens and flying squirrels to be little beasts.|Which, I do. Anyways, it wasn't long before the headmaster of the tribe, her father, Korren, realized her true prodigious abilities and she was inveterated to succeed him as the next headmaster.|Just like that, her jovial childhood was stripped and replaced with endless spell memorization, teachings from ancient traditions, and exceedingly high expectations. Every druid leader to be must embark on a journey to seek out the sister tribes in order to introduce and establish respect amongst the fellow headmasters. They call this the Aramente, or Noble Odyssey. When her father felt she was ready, he set her on the path to truly discovering herself, not knowing when, or if she will ever return. As she hiked down the mountain towards Stillben, she meditated on the task ahead.|Part of the Aramente is proving yourself a strong warrior, a valiant protector, and a wise and compassionate leader. With this knowledge, one thought plays in repeat in her mind: is she even worthy?
4;TALIESIN;Percy was the third of seven children, born to a noble family who lived far to the north, in the ancient castle of Whitestone.|With so many siblings to share the burdens of lordship, Percy turned his attentions to the sciences, engineering and naturalism. One day, a mysterious couple, named Lord and Lady Briarwood, came to court. During a feast held in their honor, the Briarwoods violently took control of the castle, killing or imprisoning everyone who would stand in their way. Percy awoke chained in the dungeon, only to be freed by his younger sister.|Together they fled, chased by the Briarwoods' men.|As they ran, Percy's sister took several arrows to the chest and fell. Percy kept running, eventually jumping into a freezing river and floating unconscious to freedom. He did not remember waking up on a fishing boat. He barely remembered the next two years, as he slowly made his way as far south as possible. Then, one night, Percy had a dream. A roaring cloud of smoke offered him vengeance against those who destroyed his family.|When he awoke, Percy began to design his first gun. (gunshot)
5;SAM;Oh, you haven't heard of Scanlan Shorthalt? Well, gird your loins, ladies, because he has his eye on you. A talented musician, master of disguise, and dashingly handsome in his own mind, Scanlan sings songs almost as much as he sings his own praises. Born a poor gnome, Scanlan used his endless charm and soaring tenor voice to croon for coin and support his single mother. One day he was discovered by a half-orc promoter, and joined Dr.|Dranzel's Spectacular Traveling Troupe where he learned the ways of the world, and honed his skills as a bard extraordinaire. A loner much of his life, Scanlan has never quite come to terms with the violent death of his mother at the hands of a goblin invasion. While his years on the road provided many, shall we say, educational experiences with the opposite sex, deep down Scanlan yearns for the one thing he's never known: the true love of a fellow gnome. Still, Scanlan considers himself a lover first, performer second, and fighter distant third. On the battlefield, he'll support his allies, but rarely draws blood unless it's to protect fellow gnome, Pike. Count on Scanlan for a hearty laugh, a rollicking song, and a twinkle in his eye that melts hearts and makes the females swoon.
6;ORION;Greetings and salutations. I am Tiberius Stormwind. I hail from a town called Ty'rex, located in the heart of Draconia, born from a politically respected family. At the age of 15, I succeeded in passing the Sorcerer's Rite, showing prodigy-like control of my magic. The judges and the Draconian High Council were amazed at how powerful my spells were for how long I had been training. At 20 years old, I was the youngest appointed member of the Magic Guild in Draconian history. For the next few years, I almost went mad from the malaise of being a guild member, as it's rather boring. However, one day I happened upon a chamber, unused for quite some time. In the room were stacks of books and maps of the surrounding cities and areas around the known world. For months I would frequent the chamber, and learned of artifacts from legend. After a long period of research, I made a list of artifacts that caught my eye. I brought these findings to the high council and was told that all of the information in the chamber I had stumbled upon was either believed to be fiction, or unsolvable mysteries, and hence were lost forever. I found those answers to be unacceptable. A year later I devised a ruse and managed to convince the city council to lend support in me leaving Draconia on a mission of peace and diplomacy for the surrounding kingdoms, going from town to town and making friends and allies, in and for the name of Draconia. Being a red dragonborn, I had quite the task on my hands in that respect, but it was exactly what I needed, so I could explore the world and find these artifacts, as I felt the truth was out there. Some may describe me as buffoonish, but I say poppycock to all that. I am much sharper than most give me credit for. I just don't pay attention to things sometimes. I've also been known to be rather cunning, loyal, happy-go-lucky, and well, dangerous. I can't help but show my true scales every now and then. But overall, I think I'm quite friendly for a dragonborn.
7;LIAM;Never entirely welcome in the company of elves or men, Vax'ildan learned at a young age to skip past formality, preferring instead to invite himself in your door. Along with twin sister Vex'ahlia, Vax was born by a chance encounter between elven royalty and human peasantry. Raised by their mother in their early years, the twins were eventually sent off to their father in the elven capital of Syngorn, but their cool reception among the elves there never warmed, and their time in the capital didn't last. The siblings stole away one autumn night and set out on the open road. After a few years of wandering, they eventually decided to return to their mother, and journeyed back to the lands of their youth. But instead of finding their childhood home, they returned to a pile of rubble. Their mother was gone, their home burned to ash. Pressing the townspeople for answers, they learned of the day the dragon came. With their ties all severed, Vax'ildan and his sister set out to find their fortune together in Tal'Dorei. An outsider since birth, Vax quickly learned to solve life's challenges in his own particular way, often by sidestepping them entirely. And when his knack for circumventing adversity isn't enough, the way of blades the elves schooled him in more than makes up the difference.
8;LAURA;Like so many half-elves, Vex'ahlia has spent most of her life suffering the cool reception of a people who don't fully accept her.|Born of a human mother and an elven father who only later in life took an interest in their existence, Vex'ahlia and her twin brother Vax'ildan quickly realized the only people they could truly rely on in this world were each other.|It was at the age of ten when the two were taken from their mother, and brought to live in Syngorn, the isolated elven city for which their father was an ambassador. He quietly took them in, but always kept an icy distance, and after too many years of disdainful looks, the pair decided to leave his indifference behind, and set out on their own. Vax took to the cities, stealing small trinkets and learning the ways of the thief, while Vex kept to the woods. She preferred the isolation. Always the keen observer, she learned to hunt and to track, to spy and to shoot. And through a series of fateful events, earned herself a companion in the form of a bear, her own stolen Trinket, to fight alongside her and protect her fiercely. Also, he is adorable, and gives expert massages.|[dramatic music]
9;MATT;Hello everyone, and welcome back to the next episode of Critical Role. We unfortunately are down one Grog this evening, as I mentioned before.
10;ALL;(distressed noises)
11;MATT;We are missing him terribly. We'll see what terrors will transpire in his absence. However, though! We do have some fun things to announce real fast: first off, we're still giving away promo kits for every 50 subscribers we get, so we'll be having those randomly drawn from everyone in the chat room every time 50 subscribers are joined to the channel, I guess you would say.|Also, every ten subscribers we're giving away Steam keys for different games, so also cool giveaways, which is kind of fun. I want to take a moment also to mention our... charity, there, that's the word I was looking for, it's been a long day.|(laughter)|Our charity, 826LA, which we're putting up links in the chat room for you guys if you're able to donate. It's a fantastic program that tutors children, helps with creative writing and general literacy skills. It's a wonderful program, you can look it up at 826LA, you should Google it, find the website, it has all the information you need. It's a really great charity and we're still pushing that through our show every week, so thank you for all who have donated, and if you have the opportunity to, I highly recommend it. Also! I wanted to let you guys know we have-- Marisha wants to mention a cool sponsor tonight or at least a promotional push we're pushing.
12;MARISHA;Yes! Yes! Friends of the show, Espionage Cosmetics, hooked us all up with some awesome nerdy manicures. We'll tweet pictures of our nails, so yes, we're all wearing awesome nails and we're going to be doing a giveaway from Espionage.|Their tabletop bath bombs, which are awesome d20s--
13;MATT;d10s, technically.
14;MARISHA;Oh, d10s-- No, there's a d20! There's a d10 and there's a percentile die!
15;MATT;No, you're right! I saw the wrong side of it, my apologies. Forget I said anything.
16;MARISHA;So yes, and we'll probably also go ahead and throw in a Critical Role signed picture as well with this. What you have to do is tweet @EspionageMakeup, is their twitter, @EspionageMakeup and #CriticalRole, and tell them what your favorite character is from Critical Role and who your favorite nail wraps are today and then we'll pick at half-time a winner.
17;MATT;Indeed. So fantastic. I may have some more stuff down the road we'll be able to talk about but in the meantime, let's go ahead and get everyone caught up to speed with what has transpired recently on Critical Role. So the party, to give you a quick overview for those who have just joined us, they were given a mission to seek out a female halfling paladin named Lady Kima of Vord, who had been missing, going on a vision quest, apparently seeking some deep, dark evil that had begun to simmer and grow beneath the dwarven city of Kraghammer. The party managed to make their way to the city, delve deep within its caverns to discover an entire series of caves, and what eventually led to the Underdark itself. A subterranean landscape of terror and darkness.|After a series of battles with some duergar, which are kinda ashy-skinned evil dwarven offshoot people, characters, and a few brushes with some illithids or mind flayer creatures, they managed to befriend one, or I should say, ally with one named Clarota. Who has been traveling with them, who has apparently been kicked away from his society and wishes reentry to save them from the kind of ominous presence of this unseen, barely spoken entity called K'vorn. K'varn.|(laughter)|Long day. Long day. So upon traveling deep into the recesses--
18;SAM;Don't worry Matt, you just have to talk for three straight hours.
19;MATT;(laughs) I know. I know.|(laughter)
20;MARISHA;Your day is just getting started.
21;MATT;I know. But yes, so they have now, after a series of battles, found their way into the magma-covered, kind of obsidian jagged caverns where the Emberhold, the duergar fortress currently resides, where they believe Lady Kima was. Upon finding a way in, unfortunately announcing their presence to the fortress itself, they managed to find Lady Kima in a torture chamber beneath Emberhold, save her, slay her oppressor, and now they have, after a tenuous alliance was made-- as Lady Kima and their mind-flayer friend Clarota are very much at odds-- a very tenuous alliance was forged. And they now journey back up to the main basement floor, or main base floor of the Emberhold proper. And that's where we left off last time. So, hope you can absorb all that, guys. (laughs)
22;SAM;We are inside this fortress.
23;MATT;Correct.
24;SAM;We are moving towards the armory. We're trying to find the armory or something, is that right?
25;MATT;You're trying to find, essentially-- Lady Kima has mentioned she wants to find the rest of her equipment that she says is either in an armory, or she mentioned a vault. And also she knows-- she mentioned something about vengeance to those who run the keep. So she stormed up.
26;LAURA;We're following her, right?
27;MATT;You've followed her back into the base floor of the Emberhold itself. You all currently are now back kinda where you started after you snuck into the side passage of the Emberhold.
28;LAURA;And she said she would lead the way to the vault?
29;SAM;Can we be quiet for a second and see if there's any footsteps around us or guards marching around? Are we in immediate peril or do we have a second?
30;MATT;Certainly. Everyone go ahead and make an immediate perception roll.
31;SAM;Okay.
32;LAURA;So fast!
33;MARISHA;Website went live, if you want to announce that now or later.
34;MATT;Later. Two?
35;LAURA;No, 22! (laughs)
36;LIAM;28.
37;ASHLEY;13.
38;TALIESIN;24.
39;ORION;Fail.
40;SAM;Ten. (laughs)
41;MATT;That's a fail! All right, so-- You've got to be ready!
42;MARISHA;27!
43;MATT;Okay.|(laughter)
44;SAM;I'm sure he'll give you half of that.
45;MATT;Nearly at the ready. All right, so as you all take a moment and kind of steel yourselves, your ears perk up and you can hear what sounds like echoes of distant footsteps down hallways, far out of sight. You hear some movement across the stone ceiling above you that eventually comes to a stop. And you wait for about a minute, and the entire place is now in a very eerie silence.
46;LIAM;They know we're here, still.
47;LAURA;But they don't know where we are.
48;LIAM;No.
49;ORION;Maybe they went to sleep?
50;TALIESIN;Lady Kima, do you remember where the vault is? Do you remember how we can get back there?
51;MATT;"Kima turns to you, her eyes still peering back, and she's creeping towards the edge of the hallway. She looks back at you, briefly, and says, ""I've only seen half of this stronghold before they captured me. As far as I know, probably somewhere on the second floor."""
52;LAURA;What floor are we on now?
53;MATT;"""The ground floor."""
54;LIAM;The ground floor.
55;LAURA;Right, cool.
56;ASHLEY;So it's just one up? (laughter)
57;MATT;"""Apparently."""
58;LIAM;Were there stairs-- When we went down that set of stairs there, was there also stairs going up right there, or stairs going up?
59;MATT;There were stairs-- Right there? No. There were stairs going up in the first room you entered.
60;LAURA;Oh, right! So we could go back in the little storage room.
61;LIAM;We could.
62;LAURA;And go up.
63;LIAM;We should just spend the next three hours in the storage room.
64;LAURA;Let's go in the storage room and go up.
65;LIAM;Lady Kima, allow me to take a peek around the corner, see what's going on.|So I'm gonna go stealth.
66;MATT;Okay, go ahead and roll stealth.
67;LIAM;And inch past her. That's good. 29.
68;MATT;29? All right. She begrudgingly steps back.|You can see there's that eagerness to get in some sort of a fray or to feel somebody else bash along the side of this greatsword that she borrowed from you guys. She lets you pass. You creep up along the edge. As you do, you see-- back here there is, in the middle of this hallway, a series of doorways, and what looks to be a large room in the center of the chamber where two duergar currently stand.
69;LIAM;I turn back to the group.
70;TALIESIN;(whispers) How about the other way?
71;SAM;Why don't we just kill them?
72;LIAM;Isn't that a corner-- a dead-on corner right there?
73;MATT;This is another hallway.
74;LIAM;Another hallway.
75;SAM;Let's go kill the duergar.
76;LAURA;How dark is it in here? Is it like--
77;MATT;No. It's pretty dark in here. Like, with low light vision, you're able to see maybe a good 30 to 40 feet ahead of you. There are a few of those red crystal clusters that give off a little bit of light, incrementally, but duergar themselves, you've gotten to the point where you see they like it very, very dark. They actually aren't needing light. This is more of a courtesy to guests they may have.
78;LAURA;So potentially, brother, we could take them both out if you throw your knife and I do an arrow.
79;ORION;Wait, didn't we see further past that, 'cause that's where Grog did the-- (crushing noise)
80;SAM;No, this is the area that we haven't been in yet.
81;LIAM;I just put up a hand, and then slip around this direction and slip down this second hallway that you revealed.
82;MATT;"All right. As you step past, you do see, this room here is a little ajar; the inside looks to be a storage room. There's just a series of boxes, barrels, and various--"
83;LAURA;(gasps) Maybe you can put yourself in a box and walk around.
84;MARISHA;(gasps) Yes! Metal Gear Solid it!
85;LIAM;I continue to creep away from my sister, specifically.
86;MATT;All right, you glare down the side of this hallway. It leads to two other smaller rooms down the way, with a split towards the back end. There does not appear to be anybody visible in that hall.
87;LIAM;All right, I got this, I'm going to keep going.
88;SAM;Wait, what about us!?
89;LAURA;Why are you doing this?
90;MATT;All right, so you go past this way.
91;SAM;Jesus. Two duergar, we can take them out in a second!
92;MATT;Now this hallway, there appears to be an opening to this room, no doorway.
93;LAURA;Everybody wait while my brother goes on a field trip.
94;MATT;And this additional room, you do not currently see an entrance.
95;LIAM;An opening that's not a doorway? Or--
96;MATT;I mean, there isn't a door in the way, it's just an opening.
97;LIAM;The door is open. All right, so I'm going to press against the wall, up to the edge, wait for five seconds, see if I can hear anything, and then if not, curve around and peek in.
98;MATT;Perception roll.
99;LIAM;20.
100;MATT;20. You take a moment and listen. You hear what sounds like a light crackling of some sort of a fire? And the occasional dull ring of metal being hit against metal.
101;SAM;What was it? Metal against metal?
102;LIAM;Okay, I'm going to get low to the ground, and peek in the door.
103;MATT;All right. Peeking through, you do see, indeed, it is some sort of a smithy, with two kilns, or two anvils, set up, a work table in the center, and there is one lone duergar that, apparently, in the middle of his work, has not been paying attention to any of the ruckus going on around, and is just in the middle of hitting some sort of long, thick piece of black iron, and it's just, (ting ting), sweat dripping down the front of his brow, the room itself is-- even against the corner of the doorway, you can tell the temperature is a lot warmer on the inside.
104;LIAM;And his back is to me, currently?
105;MATT;It's kinda to the side to you. He's currently looking-- working out the anvil, banging down.
106;LIAM;So this way?
107;MATT;Yes.
108;LIAM;Oh, but I see the door on the other side, so I take the earring--
109;SAM;Oh, why don't you just keep going forever?
110;LIAM;-- take the earring and I whisper to my sister, (whispers) follow along.
111;LAURA;Oh. I've been invited on the field trip, guys!
112;SAM;Just you?
113;LAURA;Just me!
114;SAM;Come on!
115;LAURA;Who else can stealth?
116;MARISHA;I'm a stealthy panther right now.
117;LAURA;Do you wanna be something and pop in my pocket? (laughs) That sounded wrong.
118;MATT;You haven't had a short rest yet, and you do--
119;MARISHA;(clears throat) I was gonna say, I'm still a cat form. But I can accompany you.
120;LAURA;I should not go with you, I can't stealth for shit right now.|(laughter)|I rolled a seven.
121;LIAM;(whispers) Send Scanlan up.
122;LAURA;(whispers) Scanlan.
123;SAM;Huh, what?
124;LAURA;My brother's calling for you.
125;MATT;"You feel the oppressive force of Clarota's voice in your heads simultaneously say, ""I can also accompany."""
126;ASHLEY;Good plan. Good plan, Clarota.
127;SAM;All right. I'll step ahead and go invisible.
128;MATT;All right, so mark off your next Invisibility spell. As you vanish, Clarota also kind of waves his hand for a moment, and his image disappears the same way Scanlan's did.
129;SAM;Ooh! He does that too?
130;MATT;Apparently.
131;LAURA;What did he do?
132;SAM;He went invisible! (sings) We're walking down a hall, nobody's watching us.|(laughter)
133;MATT;As you're humming to yourself--
134;SAM;Oh no!
135;MATT;You make your way down and eventually towards the back of where Vax is pressed against the--
136;LIAM;I can feel Scanlan's flute pressing into my buttocks.
137;SAM;That's not my flute! (laughter)
138;LIAM;So I turn to them, and then I start-- I pass the door.
139;MATT;Okay.
140;LIAM;I'm gonna go around the corner to that other door.
141;MATT;All right.
142;LIAM;And now I'm going to stab the duergar in the neck.
143;MATT;All right! Go ahead and roll for an attack!
144;LIAM;Natural 20, natural 20! (cheering)
145;MATT;That's how you start the game.
146;MARISHA;It's a good day! I feel like it's gonna be a good day.
