;Player_Name;Transcription_Text
1670;MATT;12? Scanlan (boof) on the ground right next to you, thankfully just missing the bottom stair, which would have hurt even worse in the back, but through the slight toss you take six points of damage. The fall. A real crick in your back in your back in your shoulder from the impact. You get up.
1671;SAM;Thanks Grog, thanks.
1672;LIAM;I'm gonna scoop a hand under his head and give him a slap on both sides.
1673;SAM;(huffs) What are we looking at?
1674;LIAM;Listen to me. I'm gonna try to do the talking in here, because I know these people a little. But if that fails, I need you. All right?
1675;SAM;You-- me? Yes, just do my thing?
1676;LIAM;I need you on ice for a little while, all right, so just stay between me and my sister.
1677;SAM;Okay. Yes, yes, sir.
1678;LIAM;Five locks?
1679;MATT;Five locks, yes.
1680;LIAM;I want to perception check for traps and for Thieves' Cant and anything else.
1681;MATT;Okay.
1682;LIAM;That's all right, 20.
1683;MATT;Okay. Looking about the locks, none of them look to be trapped. You do notice that there is a bit of scratching on the wood next to each lock.|Each one is a different language. What languages do you speak?
1684;LIAM;I speak Elvish, Common, Abyssal.
1685;LAURA;You speak the same languages as me.
1686;MATT;It's like you grew up together.
1687;LAURA;Oh, I also speak Undercommon.
1688;MATT;Okay. Looking at it, Abyssal-- you do recognize two of them, and it's the top one and the bottom one. And both of them, the equivalent in Common would be a phrase like: enter, or pass.
1689;ASHLEY;Is one of them in Underdark?
1690;MATT;No Undercommon, no.
1691;LAURA;What about Draconic?
1692;MATT;Underdark would be Undercommon.
1693;TALIESIN;Celestial? Elven?
1694;MATT;Nothing in Elven.
1695;ASHLEY;Dwarvish?
1696;MATT;There is a Dwarvish one.
1697;TRAVIS;Oh, oh! I have a Belt of Dwarvenkind that lets me read Dwarvish.
1698;MATT;If you could read.|(laughter)
1699;LAURA;But that's okay, Pike can read Dwarvish.
1700;SAM;It sounds like the Abyssal ones are the ones that you have to do.
1701;LIAM;There's five of them.
1702;SAM;Yeah, but those say 'enter'.
1703;TALIESIN;We don't know what the other ones say, though.
1704;MATT;All right. So. There is the one in the middle, is in Dwarven. The two of you recognize it. You walk up and say: that's Dwarven, but that's as far as you actually understand. You know it's Dwarven. Go ahead and make an intelligence check, just go for it. Roll a d20 and add your modifier.
1705;TRAVIS;For intelligence?
1706;MATT;Yeah.
1707;TRAVIS;(laughs) Nine.
1708;LAURA;You have a negative two modifier? (laughs)
1709;MATT;You-- It's Dwarvish. You know Dwarvish?
1710;ASHLEY;I do.
1711;MATT;Okay. Coming up behind Grog and you whisper to him and let him have the moment. You recognize the rune and it's the Common equivalent of entry, enter.
1712;LIAM;None of them are in Elvish?
1713;MATT;No, none of them are in Elvish.
1714;MARISHA;Sylvan?
1715;MATT;There's no Elvish whatsoever.
1716;TRAVIS;"This word in Dwarvish means ""gentry""."
1717;MATT;Does anyone know Goblin?
1718;LAURA;Don't you know Goblin, Scanlan?
1719;SAM;I fucking hate goblins, that doesn't mean I know their language.
1720;MATT;And does anyone know Primordial?
1721;MARISHA;I do.
1722;TALIESIN;You know Primordial?
1723;MATT;The fourth one on the bottom. You have the top one and the bottom one, which you read. The middle one in Dwarvish, which you guys read. The fourth one is a Primordial phrase that says the equivalent, and it is a language of guttural, elemental sounds. It is a no, a stop, a general halt type.
1724;SAM;Shit. Don't do that lock.
1725;LIAM;So we that leaves one left and we don't know what says. There's no Thieves' Cant on this door?
1726;LAURA;So wait, the top one is a yes. The middle one is a yes. The bottom one is a yes.
1727;MATT;The second one down.
1728;LAURA;We don't know.
1729;MATT;The second one down you do know, that's the one that says no.
1730;SAM;The B-slot we don't know.
1731;LIAM;So all together there's five locks and we know four of them?
1732;MATT;You know four of them, yes.
1733;ASHLEY;Is there any way to try to figure out what it says?
1734;MATT;Outside of not knowing the language or any magical means that would allow you to.
1735;LIAM;I look at the two in Abyssal. They say 'entry', is that right?
1736;MATT;Correct.
1737;LIAM;And I already checked for traps and there were no traps, just locks
1738;MATT;No, you have not checked for traps on this one.
1739;LIAM;Do I need to check each lock?
1740;MATT;You would.
1741;LIAM;Fuck.
1742;SAM;Why don't you just check the two that are unknown to us, that are negative?
1743;MARISHA;Do you want an enhancement of your abilities?
1744;LIAM;Yeah.
1745;MARISHA;Okay. You use dexterity, right? I give him Cat's Grace? I cast Enhance Ability on him.
1746;SAM;You're making this shit up.
1747;MARISHA;Kind of, yeah.
1748;MATT;All right. So Keyleth reaches out and you feel your form become even more-- So you have advantage now on dexterity checks for as long as she remains concentration on the spell.
1749;LIAM;So we got Abyssal, Abyssal, Dwarven in the middle and--
1750;MATT;Primordial on the second to last.
1751;LIAM;And the Primordial says no, yeah?
1752;MATT;Correct.
1753;LIAM;The Abyssals say yes and the Dwarven said what?
1754;LAURA;Yes. They all say enter, entry.
1755;LIAM;So I want to try to pick the three that I know. Two Abyssals and the Dwarven say entry. And I have advantage on.
1756;LAURA;Did you check for traps?
1757;LIAM;I did. I checked for traps, right?
1758;MATT;You're rolling right now to check for traps.
1759;LIAM;I'm rolling right now to check for traps.
1760;MATT;All right, go for it.
1761;LIAM;So the top is Abyssal. Here I go.
1762;LAURA;Natural 20!
1763;MATT;The top one is locked, but it is not trapped.
1764;SAM;Go for the middle.
1765;LIAM;No, I'm gonna unlock that.
1766;MATT;Okay, go for it. With advantage.
1767;LIAM;With advantage.
1768;LAURA;Balls!
1769;LIAM;Four, so that's okay. This is lock-pick, right? 23.
1770;MATT;23. Not a very complicated lock, the top one (click). Comes off without a problem.|Perfectly silently, you just pull the latch back.|(creaks)
1771;LIAM;All right. I'm gonna go down to the bottom, to the Abyssal at the bottom. Checking for traps.
1772;LAURA;Natural 20!
1773;MATT;You don't have advantage on checking for traps.
1774;LIAM;Oh, I thought you said I did.
1775;MATT;No, for making the checks you do. This is for dexterity, checking for traps is a perception roll.
1776;LIAM;Perception's 20.
1777;MATT;Okay. Bottom one, not trapped.
1778;LIAM;All right. Dwarven in the middle. Checking for traps.
1779;MATT;Go for it.
1780;LIAM;20.
1781;MATT;That one is also not trapped.
1782;LIAM;All right. That's three, the fourth one was Primordial.
1783;LAURA;Yes, and don't--
1784;LIAM;20.
1785;MATT;That one is trapped.
1786;LIAM;And the Primordial said no.
1787;MARISHA;Yeah. In their language it's pronounced huh-gluf.
1788;LIAM;But what does it mean? We've got three traps.
1789;SAM;What the fuck is wrong with you? The ones that say no are trapped! How is this hard to understand?!
1790;LIAM;That is 26, the last one.
1791;MATT;The second one? The one that--
1792;LIAM;That we don't know what it is.
1793;MATT;You've seen scribbles like this before. It appears to be some sort of goblinoid language but none of you actually understand what it says. Does appear to be trapped.
1794;LIAM;Does appear to be trapped.
1795;LAURA;How about you don't unlock those ones.
1796;TRAVIS;No, no, don't tell him.
1797;LIAM;I'm not alone, and this affects you, asshole.
1798;ASHLEY;Unlock the ones that are not trapped.
1799;MARISHA;You already popped the top lock and nothing happened, right?
1800;LIAM;So there's two that are trapped. I'm going to attempt to disarm the two that are trapped.
1801;TRAVIS;Yeah, do that.
1802;SAM;What are you doing?
1803;LIAM;This affects you, you dark sword-wielding dick!
1804;TRAVIS;No, I'm serious, you had a good thought!
1805;SAM;Why would you do that? Do the ones that aren't trapped first.
1806;LIAM;Everybody wait, wait, wait, wait. Everybody please walk up the stairs ten feet, please.
1807;ASHLEY;No!
1808;LIAM;Yeah, walk up the stairs. Ten feet.
1809;LAURA;I'm walking away.
1810;LIAM;You're all gonna see it.
1811;SAM;What are you doing?
1812;LIAM;I'm gonna try to open the door, you little asshole. But I don't want you to get burned while I get burned.
1813;SAM;I won't be burned because you're not gonna mess with the traps! Just do the ones that aren't trapped!
1814;TRAVIS;I walk forward and I grab Scanlan and everybody and I back everybody up ten feet.
1815;LAURA;Try the ones that aren't trapped first, please?
1816;SAM;All right. I'm gonna quickly inspire him. I'm gonna read him a limerick.
1817;MATT;Go for it.
1818;SAM;I knew a goliath in Whitestone Who lived in a very, very fine home 'Til one day a wizard, or maybe a large lizard Burned it and left him alone.
1819;LIAM;Okay. So of the five at the top and the bottom and the middle, it's Abyssal, Abyssal, Dwarven. And I checked those for traps and there aren't any so I'm gonna unlock them, all right. So for the top one.
1820;SAM;You did the top already.
1821;LIAM;Check for traps or?
1822;ALL;You unlocked it.
1823;MATT;You unlocked the top one. And the latch came open without a problem.
1824;LAURA;Do the middle one.
1825;LIAM;Can I use what I just rolled for the middle one?
1826;TRAVIS;Make sure you disarm the other two.
1827;LIAM;There's too many people talking, I don't know what's going on. I don't know what's going on. Yeah, I just rolled a ten twice, and that's a 23.
1828;MATT;23? (clicking) The middle one opens.|(creaking)
1829;LIAM;Now the bottom one-- shush!
1830;MATT;Go for it.
1831;LIAM;Okay. (laughs) 29.
1832;MATT;29. The bottom one you-- It's a different type of latch that's actually a rod that pushes into the door. You manage to find a break in the wood where it's split and you put an instrument and you pull the latch open. So those three are now currently unlocked.
1833;LAURA;Try pushing the door.
1834;TRAVIS;No, no, think of your team, make sure they're all disarmed.|(laughter)
1835;LIAM;So here's where we don't know what's going on. We got number one, number three, and number five are untrapped, unlocked. Number two and number four are trapped, but I'm just pushing the door open?
1836;LAURA;Do whatever you want to do.
1837;LIAM;But I don't have to make the decision on my own, because you're all ten feet away from me.
1838;LAURA;Try disarming them, sure, why not? Do your thing
1839;TRAVIS;(singing) Follow your heart, don't blow up your head to solve those fucking locks. Do it, man.
1840;MARISHA;You've got advantage, so why not, fuck it.
1841;MATT;Vax. What is your choice? What do you wish to do in this moment? You have three untrapped locks open, two locks that seem to be trapped. One of which said no.
1842;LIAM;Yeah, I'm gonna open it.
1843;MATT;You push the door open. As you push on the door, the two locks on there give no resistance.|Seems they were both false locks and as the door opens you get the feeling that perhaps the traps were based on the attempt to pick them, or disarm.
1844;LAURA;Good job, good job, brother.
1845;ASHLEY;High five.
1846;LIAM;No high fives.
1847;ASHLEY;Just maybe-- just like a touch then.
1848;LIAM;Here.
1849;ASHLEY;Okay.|(laughter)
1850;MATT;You're now looking into a familiar very dark hallway with very low light by a few torch sconces that just flicker. The material used to keep them burning, pretty low and the embers are starting to drift into a small pile of soot on the stone floor beneath them. You can smell the remaining smoke and scent of burning wood. To the right of you is a hallway that continues down to where Spireling Modeth once lived before you cut his head off. The doors are closed to that room and it curves off to the left down a long hallway.|To the left of where you currently are, the hallway continues into darkness and turns around the corner into shadow.
1851;LIAM;Okay, so there was a cell that we were in, and there was a larger room where we were surrounded by Modeth and a lot of people.
1852;ASHLEY;But there were a lot of hallways
1853;TALIESIN;Do we smell anything?
1854;MATT;You smell the residue of burnt wood and tinder. Nothing beyond that.
1855;LAURA;Do I see any tracks that look like they could have been from an elf, an old guy with some battle scars.
1856;MATT;Make a survival check.
1857;TRAVIS;Oh, I could do those too. Can I help her with that?
1858;MATT;No. Sorry, her ranger tracking training is far beyond anything you as a barbarian have attempted. Though you are good at tracking naturally as a barbarian, you could attempt to make a roll on your own. But it wouldn't be helping her with it.
1859;LAURA;21.
1860;MATT;Okay. Looking about the stone floor, you do see scuff marks and where dust has been pushed aside by boots. Many footfalls have come through this area, but there's no way to really ascertain any recent traffic or direction.
1861;LAURA;I would have had to roll a 20, I bet.
1862;LIAM;While we're waiting, I'm gonna throw my hood over one shoulder and I'm gonna undo my sleeves so that-- Oh, the Clasp is back here, isn't it?
1863;LAURA;Just take your shirt off. Show it to the world. I'm gonna cast Pass without a Trace on all of us.
1864;MARISHA;So wait, are there two different directions?
1865;MATT;Yeah, so the right or the left.
1866;MARISHA;Can I ascertain if there's any type of draft or any--?
1867;MATT;Percival already tried that.
1868;MARISHA;Oh, you already tried?
1869;LIAM;So, here's what I'm thinking. I mean, we could sneak through here and this one's going to sound like a herd of--
1870;LAURA;Not necessarily. I just cast Pass Without a Trace.
1871;SAM;Don't disparage her, she's wonderful and beautiful.
1872;LIAM;Our chances of sneaking through here are low. I could try to talk us through. This guy's a threat to them because the kingdom wants him and they're housing him. And that is not really financially viable. So I feel like perhaps we talk our way out of this. We don't have to go in banging an evil sword, not that we have one.
1873;LAURA;Yeah, we're down here, obviously we belong.
1874;LIAM;I belong. And I will vouch for you.
1875;LAURA;Beautiful. Let's do it.
1876;MARISHA;I definitely would rather not fight the entire thieves' guild.
1877;SAM;We're not sneaking, then? 'Cause if we did sneak, we could-- Don't you have Fly or something?
1878;LIAM;We're in a very thin hallway right now.
1879;SAM;All she'd have to do is fly just off the-
1880;LAURA;I've got no flying. I used my only flying potion.
1881;SAM;All right. All right, so we're talking our way out of it?
1882;LIAM;"I'm gonna call out. I'm calling out, ""Member of the Clasp entering. I need to parlay."""
1883;MATT;A moment passes and you see stepping out of both sides of the hallway a number of hooded figures. Five. Ten. 15 individuals then begin to close in, all hoods up, cloaks around them, you can see through the dim light the crest of chins.|Those of you that have darkvision, you can see some features, they all are humanoid, around human height, a few that are smaller, whether they be younger or halfling or gnomish in origin, you can't really make out their details in this circumstance, but they all close in as you guys all stand there in the center of the hallway.
1884;LIAM;I do start unlacing, and I say, I'm one of you. And I show the tattoo on my back.
1885;MATT;As this happens, you can see there's a part in the crowd, and one much larger than the rest of the members of the Clasp steps forward, pushing others out of the way. You see a very thick square jaw piercing out from underneath the shadowed hood, and the hand pulls it back and as you can now see the crooked pointed ears, snarling nose and underbite of a mostly orcish half-orc, one you've encountered once before--
1886;LIAM;It's Modeth?
1887;MATT;"No, no. Modeth was human, you killed Modeth.|The orc steps forward and looks about the group and goes, (grunts) ""Seems like you stumbled into an early grave."""
1888;LIAM;I didn't stumble, I've been here before.|I've a fucked up past with this organisation but I've come to tell you-- And I'm pointing at the tattoo.
1889;MATT;He reaches out and grabs your arm and spins you around to look at the tattoo on your back violently. Like a ragdoll. You're being treated like a child. (grunts) Releases you for a second, as you fall off-balance for a second but catch yourself. He has his other hand at his belt side, and you can see what looks to be the the pommel of the dagger at the ready and he goes--
1890;LIAM;Sovereign Uriel knows you have Daxio here.|Uriel wants him. You are in danger. This whole organisation is in danger with him here.
1891;MATT;"""Silence! Who else knows you're here?"""
1892;LAURA;Not a soul.
1893;MATT;"""Wait a second. I do know you. Customs department, wasn't it?"""
1894;SAM;I've been promoted since then. I'm now a supervisor of-- it was a ruse. I apologise for it.
1895;MATT;"""As we found out. So you break back into our facility--"""
1896;LAURA;We didn't exactly break in, we just kind of-- I'm just shutting up.
1897;SAM;He's a member of the Clasp. He gained entry the way that you do.
1898;MATT;"""He brings in outsiders after being warned not to return with them. Yet you say you are here for a-- who was it?"""
1899;LIAM;Do you care that the Emperor knows you're holding a person he wants?
1900;MATT;"""He won't be held for long. You can tell the Emperor he's not a worry of ours soon."""
1901;LAURA;Where's he going?
1902;LIAM;He's a traitor to the kingdom. Uriel wants him, you are bringing danger upon this house.
1903;MATT;"""Uriel's useless."""
1904;LAURA;Uriel has a lot of gold and will probably give a reward.
1905;MATT;"(laughs) ""We have our hand in their coffers whether we get a reward or not."""
1906;SAM;Not the kind of reward he's already offering you. We come bearing an offering from Sovereign Uriel himself in exchange for this man. I reach into my bag and I produce--
1907;ASHLEY;No gold. No money.
1908;SAM;The very elegantly carved box I had made that contains the magical blue shard that we discovered many, many years ago, and I open it just for a moment and close it and say, this is the Shard of Kara. It is a magical item that can grant the user one wish, any wish.
1909;LAURA;But Scanlan, you said we were going to keep that for ourselves.
1910;SAM;I did. But it's clear that this man knows who we are and why we've come.
1911;LAURA;No.
1912;SAM;As a last resort we are cleared to offer this to you in exchange for your prisoner, or is he-- are you holding him as a prisoner or--?
1913;MATT;He shushes you. Make a deception check.
1914;LAURA;Can I help him? Can I assist that?
1915;MATT;You know what, you would be, so go ahead and that would give you advantage on this, so--
1916;SAM;Deception or persuasion?
1917;MATT;This is deception.
1918;SAM;32.
1919;TALIESIN;What in the living--
1920;MATT;"""Let me see your box."""
1921;LAURA;Oh, well.
1922;MATT;"""Hush!"""
1923;SAM;It is activated by a secret chant that we will only tell you once we are safe and the prisoner-- or keep-- I don't know. Are you keeping him as a prisoner or--
1924;MATT;He waves his hand and shushes you.
1925;SAM;All right, as soon as we get the man, you get the chant.
1926;MATT;"""Daxio, huh? (huffs) He just paid us a rather large sum of money to produce documentation and acquire transit to Ank'harel. We've kept him here while we've prepared his documentation and we're to send him on his way through our tunnels to the docks. So you're asking us to betray a client of the Clasp?"""
1927;LIAM;And avoid the hammer of the Empire.
1928;TRAVIS;And keep the money at the same time.
1929;MARISHA;Sounds to me like you just won twice.
1930;MATT;He reaches his hand out for the box.
1931;SAM;Where is he? Where is he? All right, here.|You can inspect it, scan it for magic if you'd like.
1932;MATT;Takes the box and hands it to one of his compatriots, who takes it and inspects it and pulls out a small glass, puts it over his eye--
1933;MARISHA;Can I Druidcraft a little bit and Druidcraft a little bit of breeze seeping from the box?
1934;TALIESIN;I pull out a small note that I hold in my right hand.
1935;MATT;Make a sleight-of-hand check.
1936;MARISHA;Sleight of hand?
1937;LAURA;Ah, damn it.
1938;MARISHA;Oh! Did you see that? That was awesome.|21.
1939;MATT;21. You mutter beneath your breath and swivel your hand for a second as he hands-- the other individual inspecting it with the glass monocle looking piece. (whoosh) Wind drifts around it and you can see the wood itself almost shimmer as if the grain of the wood is moving in a pattern.
1940;TALIESIN;I hold up a beautiful elegant note that I show in my hand and put it in my breast pocket.
1941;MATT;"""Very well. We have him in holding, awaiting his documents. I'll show you. I'll leave the door open, we'll clear the halls. Do what you must. We will not be involved. You have an hour."""
1942;LAURA;That's all we need.
1943;MATT;"""What is your password?"""
1944;TALIESIN;Once he is free, then you get-- in our custody, then you get the note.
1945;LAURA;We'll leave it outside the door.
1946;MATT;(chuckles) He puts his hand like this and other individuals of the Clasp back out and leave into the hallway behind you and he leads you to follow him and--
1947;MARISHA;I say, careful. Do not open that box without the password or else it will melt your eyeballs from inside your head.|(laughter)
1948;MATT;Make a deception check.
1949;TRAVIS;Unnecessary.
1950;LAURA;He was going for it!
1951;LIAM;We had the mark!
1952;SAM;Is this deception, what is this?
1953;MARISHA;11.
1954;MATT;He takes a few steps and turns and looks at you.
1955;MARISHA;You never know, it acts in mysterious ways.
1956;MATT;(box lid creaks)
1957;MARISHA;Oh, shit!
1958;MATT;Opens the box. Inspects the piece of blue crystal--
1959;MARISHA;Can I Druidcraft a gust coming out of it?
1960;MATT;I would not recommend it.
1961;MARISHA;Okay!
1962;MATT;"He looks over at the gentleman who inspected it earlier and nods his head. ""Accepted."" And they continue walking forward."
1963;TRAVIS;Lucky fucking druid.
1964;MATT;It is the piece you put in the actual--
1965;SAM;It's a blue shard that we found in-- long, long ago-- it's real crystal and it's real magic.
1966;MATT;Yes. I know what that is.
1967;SAM;Because I don't.
1968;MATT;Well, it was sufficient upon inspection for this.
1969;SAM;Okay.
1970;LAURA;Whoa, I think it opens a portal to another plane.
1971;SAM;I don't know what it is, but it's magic.
1972;MARISHA;Is it the one we got at last Winter's Crest? That one? The one that we were using shards of it to carve through dimensions? Cool.
1973;MATT;It had a few uses. So as you guys move into the hallway, a bunch of the Clasp members leave, you're led down a couple of doors on the left and right. You guys recognise these, these are the holding cells that you guys were held shortly after your battle.
1974;ASHLEY;Yep, we were held in these cells.
1975;MATT;"So the cell on the left is closed, the cell on the right is closed. He walks up to that cell, and without even a bit of noise pulls out a keyring, unlocks it and puts the keys away.|(grunts) Turns around and the rest of the Clasp scatter out of the hallway. He puts the box away in his cloak and he says, ""One hour. Do as you must."""
1976;LIAM;I take the keys. We've got two to choose from?
1977;MATT;He's at the door. He unlocked one for you guys.
1978;LIAM;No, no. But there's two cells? Or has he opened the cell that he's in?
1979;MATT;There are three cells in this hallway. The middle cell is the one that he led you to and unlocked for you.
1980;LIAM;Okay, thanks.
1981;MATT;And he steps away, looks at the rest of you guys--
1982;TRAVIS;There are five blocks on each side.
1983;MATT;-- and then vanishes down the hallway. So it's now just you guys in this hallway.
1984;LAURA;Did you give him the password?
1985;TALIESIN;I have not given him the password yet.
1986;MATT;No, because he already opened the box.
1987;LIAM;Daxio, we've got your papers, c'mon.
1988;MATT;I just, because I foresee something possibly happening here.
1989;LAURA;I think we were saying the password made it work.
1990;TRAVIS;I think he knows we're full of shit.
1991;LAURA;I think he knows it's super powerful magic anyway and he doesn't give a shit and he's taking it anyway.
1992;TALIESIN;That's good, because man, this was some bullshit.
1993;MATT;So. All right. So, you guys are all gathered in this hallway. Who is standing where?
1994;TALIESIN;Where did he leave from?
1995;MATT;You guys entered this direction and they scattered this way.
1996;LIAM;I'm going to lock eyes with Grog and motion him towards one side of the door, and I'm gonna take the other.
1997;LAURA;Can you Wall of Stone the other side of the hallway? Just to block them from coming down that hallway again. Can you block, Wall of Stone that other side?
1998;MARISHA;I'm going to go ahead and block in the entryway for good measure.
1999;MATT;Right here?
2000;LAURA;I thought the one he left through.
2001;MATT;Okay, they left this way. Okay, so you wall this off?
2002;MARISHA;Yeah. Why not?
2003;MATT;There is now a wall of stone in the middle of that hallway.
2004;SAM;Hope we don't have to leave that way, but she can just dispel it.
2005;MARISHA;I mean, we can get it out.
2006;MATT;All right, so, who is standing where? Is there any particular placement you guys wish to--
2007;TRAVIS;Vax and I are on either side of the door.
2008;MATT;All right, so you guys are here. All right.
2009;MARISHA;So is this leading into something crazy?
2010;LAURA;Into his cell.
2011;MARISHA;Into a labyrinth? Or just his cell?
2012;MATT;As far so you know, a cell.
2013;MARISHA;As far as we know, just a cell.
2014;LAURA;He just completely took an expensive thing and left us to rot, pretty much, I think.
