;Player_Name;Transcription_Text
552;ASHLEY;We're in the Feywild. Where did you just come from?
553;LIAM;I'm not entirely sure. I died. Did you know that?
554;ASHLEY;I did know that. We're trying to figure out how to save you.
555;LIAM;What are you going to do?
556;ASHLEY;I don't know.
557;LIAM;Sorry, I'm a little confused.
558;ASHLEY;That's okay.
559;MATT;The naturally sensitive ears, even in a sleeping state, that are Vex's, being the wild hunter you are, you hear a suddenly loud voice below that catches your attention, and your eyes flicker open.
560;LIAM;Oh, fuck.
561;LAURA;I get up and run down.
562;MATT;Darting down the tree rapidly. You watch as your sister falls into the foliage. There you see before you, your brother. Clothes-less.
563;LIAM;I thought you died. I watched you die.
564;LAURA;It's a trick! It's a trick. It's a trick of the Feywild.
565;LIAM;I'm sorry I'm naked. Come here. I'm all right.
566;MATT;He's physical. He's cold. But he's there.
567;LAURA;How are you here?
568;LIAM;I don't know. I died.
569;LAURA;I know. I didn't see it. I died, too.
570;LIAM;But you're back.
571;LAURA;So are you.
572;LIAM;I'm so glad you're back. Don't cry.
573;LAURA;I have your armor, and Keyleth-- are you all right? Are you really here?
574;LIAM;Yeah, I'm really here.
575;LAURA;Can I roll an insight check to make sure it's actually him?
576;MATT;Sure.
577;LAURA;20.
578;MATT;20? Right as you've known your brother, there doesn't seem to be anything that tells you otherwise.
579;ASHLEY;Vax? Can I put my hand on his chest and see if I feel a heartbeat?
580;MATT;Now as you notice, now that you've lost focus from the fact that he's there, you can see where previously, there was a small, darkened spot on his chest that looked like a bruise of some kind that never quite went away, it has expanded a bit to be almost in the shape of wings across the front of the chest.
581;ASHLEY;Do I feel a heartbeat?
582;MATT;You listen closely. Make a medicine check.
583;LIAM;What's the matter, Pike?
584;ASHLEY;That's a natural 20.
585;MATT;Oh shit. You get close, and to get close to where his heart is, you have to pull him down a bit.
586;LAURA;There's a dick, and he's naked.
587;LIAM;And she's really short.
588;MATT;With gnomish size right now, this is getting all sorts of weird.
589;SAM;Just come down.
590;LIAM;Listen, I'm a cleric. It's nothing I haven't seen before.
591;ASHLEY;I see them all the time.
592;SAM;She's a doctor. It's fine.
593;LIAM;You clear diseases.
594;MATT;You hear a very faint, slow heartbeat. It's there. (slow heartbeat)
595;TRAVIS;Oh, it's that slow? That's like Lance Armstrong sleeping slow.
596;SAM;It's three BPM.
597;ASHLEY;Okay.
598;LAURA;Does he sound weird?
599;ASHLEY;I can't figure it out. Sometimes when people are very athletic, they have very slow heart rates. You're very in shape. I'm going to climb up the tree and wake up Keyleth.
600;LAURA;Tell her to bring the armor down.
601;TALIESIN;Is anybody else waking up at this point?
602;MATT;Percival, you've got a pretty decent perception. At this point, with the sound and the shifting up and down the tree, and you guys are pretty alert by nature, you all start coming to.
603;TRAVIS;I'm not perceptive at all.
604;MATT;Except for Grog. You're snoring.
605;SAM;I've got one perception. Oh, it's passive.
606;MATT;You're both asleep.
607;ASHLEY;Come down from the tree real quick.
608;MARISHA;What's going on, Pike?
609;ASHLEY;Everything's okay.
610;MARISHA;Pike, I need you to tell me before I come around this corner and see.
611;ASHLEY;I grab her hand. It's okay. Come with me.
612;MARISHA;I am not coming with you until you tell me, Pike.
613;ASHLEY;Vax is at the bottom of the tree.
614;TALIESIN;I grab my stuff, and I immediately run down the tree.
615;MARISHA;I clutch onto Vax's armor.
616;LIAM;I don't know.
617;LAURA;She sent you back.
618;LIAM;Yeah.
619;LAURA;She's my new favorite.
620;TALIESIN;Vex, I need you to step away from him.|Vax, if it is you, I hope you understand, and please, just for a second, thank you.
621;LIAM;Fred, it's fine.
622;TALIESIN;We're fighting the perversion of death itself. This is what I would do to torture us.|Let's figure this out before we hand him back anything that's older than we are.
623;LIAM;I hand the armor over to my sister.
624;MATT;The armor's still being clutched by Keyleth.
625;LIAM;Oh, I didn't get it yet? I thought she put it in my hands. All right.
626;TALIESIN;I'm keeping some distance.
627;LIAM;You created a temple for me. You know who I serve.
628;TALIESIN;Oh, I believe you're you. I just have to make sure what brought you back. I don't even know if you would know yet. Pike, does he have a heartbeat? Is he undead?
629;ASHLEY;He has a heartbeat.
630;TALIESIN;Have you tried Turn Undead?
631;LIAM;You would know if there's evil in my heart.
632;TALIESIN;It's not your heart I'm worried about.
633;LIAM;You would know if there's evil in my heart.
634;LAURA;He's fine.
635;LIAM;You would.
636;TALIESIN;If he's not, you will not survive this.
637;MATT;You actually haven't seen Keyleth yet. She's still up in the tree.
638;LIAM;I'm very confused.
639;MATT;It's okay.
640;LAURA;They were talking up in the tree.
641;TALIESIN;I'm sure it's going to be fine. Let's just take a minute and reflect on every terrible thing that's happened over the last 24 hours and be careful for once. I'm so sorry.
642;LIAM;No. He's absolutely right. This is insane.
643;TALIESIN;This is madness.
644;ASHLEY;Vax, what do you like to do with my hair?
645;LIAM;(weak laughter)
646;TALIESIN;It's him in there. Let's just make sure that it's him that is the rest of him.
647;LAURA;What do you mean, he's a lich or something?
648;TALIESIN;Could Vecna put Vax into something designed to hurt us? I believe it's Vax. It's the rest of it.
649;ASHLEY;Do you remember anything from when you woke up?
650;LIAM;I remember hitting the ground, and I remember watching you die, and then it was her face again.
651;LAURA;The Raven Queen?
652;LIAM;Yeah.
653;TALIESIN;What would happen to him if you tried to Turn Undead?
654;LIAM;Go ahead.
655;LAURA;What if he is, though?
656;TALIESIN;If anything awful happens, he should survive it.
657;LIAM;Go ahead. Get it out of the way. I'm not worried about it.
658;ASHLEY;I know, but what if it does something--
659;LIAM;If I'm undead, then I shouldn't be here with you, all of you.
660;TALIESIN;If you're dead, we'll just have to be extra careful, and we'll have a little more understanding of what's happening.
661;LIAM;Where is Keyleth?
662;TALIESIN;When has a random miracle ever just happened? If we work for a miracle, that's one thing, but this sort of thing doesn't end up on your doorstep. You know that.
663;ASHLEY;Vax?
664;LAURA;Will he survive it? I don't think he is undead.
665;ASHLEY;I don't, either.
666;LAURA;But I don't want him to be able to be turned against us. He looks normal.
667;TALIESIN;Does he?
668;LIAM;You used to give me wet willies in Abyssal class. It's me.
669;LAURA;I know it's you.
670;ASHLEY;You have something new on your chest.
671;LIAM;What? Oh shit. Well, that's extra.
672;ASHLEY;Keyleth?
673;MARISHA;Will you come here for a second? Okay.
674;ASHLEY;I climb back up the tree.
675;MARISHA;I could hear everything that's going on because it's down the tree.
676;ASHLEY;Are you okay?
677;MARISHA;No, I'm super not okay. What's going on? What the fuck is going on?!
678;LAURA;Keyleth, we can hear you.
679;MARISHA;Fuck all of you! For a fucking second, just tell me.
680;ASHLEY;I was watching, and then I saw him walk out of the tree of sorts, and I think it's him, and he's obviously naked.
681;MARISHA;I have his armor.
682;ASHLEY;Okay. Maybe you would be able to tell, to see what's going on. I think you should come down.|It will be okay.
683;MARISHA;Okay. You go first. I'll follow you.
684;ASHLEY;Okay.
685;MARISHA;I follow her down.
686;MATT;Okay. You come down, and there, next to Vex and Percival, at a distance of a few feet, you see the pale body standing before you of Vax'ildan, breathing.
687;LIAM;Hi.
688;TALIESIN;I'm so sorry.
689;MATT;You guys wake up, slowly, from all of this.
690;TALIESIN;I cannot wait for you both to be angry with me later.
691;ASHLEY;Okay.
692;MARISHA;Does he feel cold?
693;MATT;Colder than you remember, yeah.
694;LAURA;Oh god, he's undead.
695;MARISHA;Is it you? I thought I killed you.
696;LIAM;You?
697;MARISHA;I could have done more.
698;LIAM;No. Nobody could have done more for me. No.
699;MARISHA;You're cold.
700;LIAM;Am I? I probably should put some clothes on, then.
701;MARISHA;I put my ear up to his chest.
702;MATT;Make a medicine check.
703;MARISHA;Natural 18. 24.
704;MATT;You hear the faint, slow heartbeat.
705;MARISHA;Okay. I give him back the armor.
706;TALIESIN;No!
707;MARISHA;Percy.
708;TALIESIN;Not yet.
709;LIAM;I'm not taking it.
710;TALIESIN;Thank you. Not yet.
711;MARISHA;How long do we have you? What do you remember? Anything?
712;LIAM;Well, you can guess some of it.
713;MARISHA;No, we fucking can't!
714;LAURA;We have no fucking idea what's going on.
715;MARISHA;As far as I'm concerned, you can drop dead in front of our faces right now, and it wouldn't be much different than the past 24 hours.
716;LIAM;You all have seen her, the same as I have.
717;LAURA;We haven't talked to her like you have.
718;MARISHA;We saw her face.
719;LAURA;"What did she say? Did she send you back? Did she say, ""oh, you're going to be undead."""
720;LIAM;She did not say I'm a fucking ghoul.
721;ASHLEY;Vax, you're going to be okay. Take my hand. This is going to be okay. We're going to figure this out.
722;LIAM;Yeah.
723;TRAVIS;Where did everybody go?
724;SAM;Good morning!
725;ASHLEY;Grog.
726;MARISHA;Surprise.
727;TRAVIS;What? I go down.
728;LIAM;Hey. What's up, Poobah?
729;TRAVIS;Is this real?
730;TALIESIN;We're not sure.
731;LAURA;We're figuring it out.
732;LIAM;Ooh.
733;TRAVIS;I need to pee.
734;SAM;I come down and join everybody.
735;LIAM;Hi.
736;SAM;I look in my pocket to where I was keeping the dust that was Vax. Is there anything there?
737;MATT;Still filled with dust.
738;LIAM;What is that?
739;SAM;This is you.
740;LAURA;Oh fuck.
741;LIAM;What?
742;TALIESIN;Let's not even begin to have this discussion if we don't have to.
743;SAM;I feel like I should still keep this.
744;ASHLEY;Keep it just in case. I'm going to cast Turn Undead.
745;MATT;You Channel Divinity: Turn Undead.
746;MARISHA;Wait. What?
747;MATT;As you say that, she takes her holy symbol and clutches it, and you watch as there's this divine flash and this emanating force, this low hum. As it billows out, and you've seen her use it before. Clutching Vax in your hand, you feel the warmth pass over you. No seeming effect.
748;ASHLEY;Vax, I don't know how you did it, or how she did it, but something's happened.
749;LIAM;She's like Sarenrae.
750;TALIESIN;I think that we can be physically optimistic. Go.
751;LIAM;Pike, she's a god.
752;ASHLEY;I've never seen anything like this before in my life.
753;TALIESIN;We have to figure out where you came from, 'cause you're in a pouch.
754;ASHLEY;You're there, and you're here.
755;SAM;Wait, have we tried-- hey. Can you cut your hand? Do you bleed?
756;LIAM;Can someone lend me a knife?
757;MARISHA;I gave you back your armor and shit.
758;LIAM;I didn't take it.
759;LAURA;I'm going to take Whisper and cut him.
760;MARISHA;He's got a cloak over him.
761;LAURA;I'm going to cut you right here.
762;MATT;You cut him. It's a sharp pain, and you watch as it bleeds.
763;LAURA;Red?
764;MATT;Yeah.
765;LAURA;Sorry. I cast Cure Wounds.
766;TALIESIN;This is looking better, all things considered.
767;LIAM;I don't know.
768;LAURA;I'd already laid claim on your boots. I'd come to grips with everything, and I'd decided I was going to wear them.
769;LIAM;I was about to tell you everything she told me, but I've changed my mind.|(laughter)
770;TALIESIN;I'm going to fall down on the ground.
771;SAM;How did this happen?
772;TRAVIS;I was asleep, and now you're here.
773;SAM;You made a deal with your god, or something?
774;LIAM;Years ago.
775;LAURA;Years ago?
776;LIAM;Year and a half ago.
777;ASHLEY;What did you say? What was your deal?
778;MARISHA;You're here until the job's complete, right? Or she feels that you've paid your service, I feel like I remember you telling me in bedside chat at some point in time over the 15 months?
779;TALIESIN;TMI.
780;TRAVIS;You need to work on your intimacy.|(laughs)
781;LIAM;She was a bit more specific. She doesn't like our new play pal.
782;LAURA;Vecna?
783;LIAM;Yeah.
784;LAURA;I know. She hates him.
785;TALIESIN;Problem. We were not effective.
786;LAURA;Was Keyleth right? If we defeat him, do you go away?
787;ASHLEY;Or maybe you're free from that deal?
788;SAM;If we defeat him, do you go away?
789;MARISHA;Or is your soul yours again?
790;LAURA;Just answer the question!
791;LIAM;It was death or come back and help you.
792;TRAVIS;Oh fuck. Oh shit.
793;SAM;So if we win, you lose.
794;LIAM;That's one way of looking at it.
795;SAM;Well, that's a brave choice.
796;TRAVIS;Yeah.
797;MARISHA;Are her deals final?
798;LIAM;I don't have a lot of experience with other gods making deals, darling. But I want you to live a long time. And I want you two to live a long time and be happy. And I want you to get a halfway decent relationship with your daughter. I want you to lead many people. I want you to change the world. I want you to do all the things I know you can do. Forget it.|Grog, I just want you to be free.
799;TRAVIS;Thank you, New Vax.
800;LIAM;So much better than the old Vax. Look, any one of us could die at any time! We have died.|Some of us more than once. It's a miracle that I'm here now.
801;LAURA;Put your armor on.
802;SAM;I don't mind it. It's fine.
803;MARISHA;So that's it? Your purpose is to make sure that the rest of us find long, happy lives at the cost of your own?
804;LIAM;I've lived a very good life.
805;LAURA;She's not my favorite anymore.
806;LIAM;And it's not just us. The dragons were a test. This fucking lunatic, this dead thing. He's not setting up a theme park, guys.
807;LAURA;We need to get back.
808;MARISHA;We need to talk to the Raven Queen.
809;TALIESIN;We need a plan.
810;MARISHA;We need help.
811;TALIESIN;We do need help.
812;SAM;We have Vax now. No matter what happens later, this was a brave choice. I'm not sure I would have made the same, but we're stronger together, and thank you for coming back. It's a harder choice to come back. It's easier to walk away. I know this. Thank you for coming back.
813;TRAVIS;Yeah, it's not like we have no agency, right? We've been hit with bigger problems. We'll work this one until we can't, anymore.
814;TALIESIN;We'll all try and keep each other alive.
815;LIAM;Yeah.
816;MARISHA;I don't accept this as a closed contract.
817;TRAVIS;Yeah, me neither.
818;SAM;Maybe this will make you more fun to be around, too. You used to have this death wish, but now it's done. Now you pop a beer.
819;LIAM;Don't set your expectations too high.
820;TALIESIN;I was about to say, we can give him that pouch, and then he could have perfect proof.
821;TRAVIS;If you wear clothes, is the deal null and void?
822;LIAM;No, I have to be naked all the time.
823;MATT;It's interesting, Vax. As Scanlan says those words, you realize--
824;TRAVIS;I have to be naked.|(laughter)
825;MATT;It's part of your new multi-class.
826;MARISHA;Does he get a bonus to AC?
827;MATT;Level five paladin, level 12 rogue, level one nudist.|(laughter)|Unarmored defense. You had it, and now he has it, too.
828;MARISHA;Streaker's sprint.
829;MATT;The words he said about always having a death wish, and now the death wish is over.|There's a strength in you, a confidence, an assurance that wasn't there before. That fear of death is gone. As he says that, for the first time, while you raced towards death previously, it was out of fear, and out of martyr-like purpose.|It's just confidence now. And that's where we're going to take a break.
830;TRAVIS;Oh damn! Free Willy.
831;MATT;"We'll be back here in just a minute. We'll continue from here so we can get a drink and a restroom break. We have our giveaway. Fantastic zebrawood deck box from our friends at Wyrmwood.|It's got a little card to tell you it's zebrawood.|One lucky winner's going to get this when we come back from the break, so if you want to be part of this giveaway, go over to the Twitch chat and enter when it's requested by the chat, enter the word ""raven."" We'll have a winner for you when we get back."
832;SAM, TRAVIS;That's so raven.
833;MATT;That's so raven, guys. All righty. Cool.|We'll see you guys here in a few minutes.|[break]|That's so late. You were so late on that.
834;LIAM;Change the rules of the game. Wait until the countdown's done, then you say something foul.
835;MATT;Welcome, guys, back to Critical Role. The chat room winner of our fantastic Wyrmwood deck box is NightMist1. NightMist1, congratulations.|Denobo will contact you for your information, and we'll get that to you asap. Well done. All righty, everyone. So there, figuring out the scenario revolving the return of Vax'ildan to Vox Machina, and slowly learning some of the scenario around it and the discussions that took place. (burps) Pardon.|(laughter)
836;TRAVIS;Battling it the last two seconds.
837;SAM;It's his birthday. He can do whatever he wants.
838;MATT;Goddamn right.
839;LAURA;That's going to be a t-shirt.
840;LIAM;I got this, I got this, (fake belch).
841;MATT;I have no ego anymore. I learned early to stomp that out. All righty, so as you put your equipment and armor back on, minus your haste boots.
842;TRAVIS;And your other equipment away.
843;LIAM;God, the grass is really cold.
844;LAURA;Here, you can have these old boots of mine.
845;LIAM;Thank you.
846;SAM;Wow. Ice cold.
847;MARISHA;I admire how you're really sticking to that. I'm in awe. I'm impressed.
848;SAM;It's super greedy.|(laughter)
849;LAURA;I thought we knew this about me already.
850;LIAM;These are better. They're Velcro.
851;SAM;Oh, good.
852;TRAVIS;I think we should call out to the werewolves.
853;SAM;You think we should call out to the werewolves for what purpose?
854;TRAVIS;We need diamonds.
855;LAURA;We don't need diamonds anymore.
856;TRAVIS;"All last night, ""we need diamonds."" Huge discussion. Took forever."
857;LAURA;We don't need them anymore.
858;TALIESIN;Then you suggested we sleep, and suddenly we don't need diamonds anymore.
859;LIAM;Why did we need diamonds?
860;SAM;We were going to buy your soul back for a lot of diamonds.
861;LIAM;That makes no sense.
862;LAURA;It was a high-cost spell.
863;MARISHA;Attempt to resurrect you. Don't worry about it.
864;LAURA;Good to know in the future, though. I'm going to save every diamond we find.
865;TALIESIN;We should probably-- I get the distinct impression this is--
866;TRAVIS;We should still call the werewolves.
867;SAM;Just because?
868;TRAVIS;How often are you in the Feywild? It's like going to Philadelphia and not eating a cheesesteak.
869;TALIESIN;We technically go to the Feywild about once a year, at this point. At least, some of us.|But since we are here... I'm not going to pretend I have a plan. I don't know what we're going to do. We are frighteningly outmatched.
870;MARISHA;We should probably get back very quickly, before too much time passes.|We've already slept here.
871;SAM;If we go back, where are we going? Where were we?
872;LAURA;I feel like we were in Wildemount, but I have no idea.|Where are the places that are winter?
873;MARISHA;Vasselheim?
874;LIAM;We can't do this alone.
875;LAURA;What about Artagan? That's his name, right?
876;LIAM;That's a start.
877;SAM;Who?
878;LAURA;Artagan.
879;MARISHA;The guy who messed with us for three days?
880;LAURA;Yeah, but he was really powerful.
881;TRAVIS;Oh, yeah. He was. I bet if we call the werewolves, he will show up, as well. I'll just howl for them real quick.
882;TALIESIN;It's not like we can stop you.
883;TRAVIS;True. (howls)
884;MATT;Make a performance check.|(laughter)
885;TRAVIS;Damn it! 13.
886;MATT;There isn't much space for it to really echo, as the trees absorb a lot of the sound, but you howl. It's cathartic. You wait. You don't hear any response.
887;TRAVIS;I love Teen Wolf. I know every line in that fucking movie. Michael J. Fox.
888;LIAM;Artagan is a good start. We need...
889;LAURA;The help of the gods.
890;LIAM;Higher powers here, yes.
891;LAURA;Sarenrae.
892;LIAM;That's a start.
893;ASHLEY;I can ask. That doesn't mean we're going to get it.
894;LIAM;Pickle, I actually mean a little more than that.
895;ASHLEY;What do you mean?
896;LIAM;Well, we have one god heavily in our corner, but we need to go and beseech the help of others.|We are not enough, in this instance. We need to fucking go and talk to Sarenrae.
897;SAM;Go?
898;LAURA;How do we go and talk to Sarenrae? Vasselheim?
899;MARISHA;Is it possible?
900;LAURA;Where is Sarenrae?
901;ASHLEY;You have a very different connection with your god.
902;LIAM;You can take us anywhere.
903;LAURA;What, a plane? A heaven plane? A god plane?
904;TALIESIN;Oh my god.
905;TRAVIS;That doesn't exist, right?
906;LIAM;The gods? You don't think the gods exist, after all you've seen, Grog?
907;TRAVIS;That's a very long discussion, but I meant actual location for them.
908;MARISHA;I thought gods were supposed to be all omnipresent and whatnot.
909;ASHLEY;19.
910;MATT;19. The creator gods, the prime gods, the creators of Exandria, when they left the Prime Material Plane and left the realm of the elemental planes and the divine gate was crafted to separate their powers from the Prime Material for fear of causing another calamity and wiping out mortal existence on this realm, many of them withdrew and crafted realms where they reside, where they, themselves, harness their energies of creation and where the souls that fall under their spheres of influence come to upon being passed. The Raven Queen is responsible for ushering that transition.|You do know that Sarenrae exists on a plane like this, and she's not the only god that exists on this one particular plane.
911;LAURA;So how do we go there? Would they kill us?
912;MARISHA;Knock, knock, hello? I bamfed into your universe. I don't know.
913;TALIESIN;We wouldn't come by if it weren't an emergency.
914;LIAM;What else have we been doing for the last year and a half but knocking on different dimensional doors?
915;MARISHA;I do like New Vax's tenacity.
916;SAM;Would we be accepted there? I've done some things in my life that are less than heavenly.
917;LIAM;Where could you not talk your way into, Scanlan Shorthalt?
918;SAM;That's true.
919;MARISHA;It does immediately become the concern that I can't get us anywhere unless I have some sort of item, generally a tuning fork or some sort of attuned item to that plane to get us there.
920;LIAM;We start in Vasselheim.
921;MARISHA;You said your god, the Raven Queen, she's the one who transitions people.|Maybe she can help.
922;LAURA;Does Pike have anything attuned to Sarenrae, though?
923;LIAM;Oh, to Sarenrae? I don't think they're in the same place.
924;MATT;Ashley, were you about to ask a question?
925;ASHLEY;Shit, what was I going to say?
926;SAM;Is her symbol attuned?
927;MATT;Being attuned to a deity isn't being attuned to a plane of existence, and those things can be-- the attunement process. You don't know much about what that would entail, but you imagine that would have something to do with a place of very strong holy worship of that particular deity.
928;LIAM;I'm going to assume that sometime in the last year and a half, these two have told you that I dipped into a bathtub full of blood.
929;SAM;I was gone.
930;LAURA;No, you weren't.
931;LIAM;You just weren't paying attention, buddy.|The temples in Vasselheim are old. The oldest, including the temple that you helped pull out of the dirt. If anywhere is attuned to the gods, it is Vasselheim.
932;TRAVIS;Ooh! What about Kord? I'm wearing his oven mitts.
933;LIAM;There you go.
934;TRAVIS;Oh shit.
935;MARISHA;Does that mean I should go talk to Melora?
936;TRAVIS;Are we straight-up god recruiting? Is that what you mean? Do gods talk to each other?
937;LAURA;Yeah, the Raven Queen and Sarenrae are best buds, aren't they?
938;MARISHA;I feel like when you're in the same clique, when you're on the same level, everyone talks, right?
939;LAURA;It's a small group of people. They have to.
940;TALIESIN;I think what Vax is trying to say is we need patrons.
941;LAURA;Patrons.
942;TALIESIN;We need patronage.
943;TRAVIS;What do you mean?
944;TALIESIN;We're not enough. We are not enough for this. We are going to all die horribly if we try anything like that again.
945;TRAVIS;We need them with us, or they're going to imbue us--
946;TALIESIN;I don't know.
947;LIAM;Pelor lives here.
948;LAURA;Lives here in the Feywild?
949;LIAM;Pelor.
950;TALIESIN;Oh god.
951;LIAM;All of us, your family.
952;TALIESIN;We have to deal with this.
953;MARISHA;So we have a short list, is what we're saying.
954;TALIESIN;We need to get a slightly longer list, and we have to start begging. We are going to owe favors. We are going to owe our lives. We are going to lose.
955;LAURA;Are we really going to pledge allegiance to a bunch of different gods? That's what we're going to do?
956;TRAVIS;That could be cool.
957;TALIESIN;We'll see.
958;MARISHA;Do we each get different suits, matching suits, but in different colors? God powers?
959;TRAVIS;No, you're taking it too-- relax a little.|Do you want some ale?
960;LAURA;Like Captain Planet?
961;TRAVIS;Who's your god going to be? Is there a god of mischief or song or cubes?
962;MATT;Make a religion check.
963;SAM;A religion check? 14. Do I add my jack-of-all?
964;MATT;Yeah, you do.
965;SAM;17.
966;MATT;17. There is the Moon Weaver.
967;SAM;The Moon Weaver?
968;TRAVIS;(singing) Oh, moon weaver!
969;MATT;She is the god of moonlight and the autumn season, as well as the patron of illusions and misdirection.
970;LAURA;Who is that?
