;Player_Name;Transcription_Text
2004;MATT;You will do.
2005;MATT;I am Aluneth and together, we will do great things.
2006;MATT;And that's where we're going to take a break.
2007;TRAVIS;Ooh!
2008;TRAVIS;You've got sentient weapons in this thing!
2009;TRAVIS;The little gems are floating in a triangle?
2010;MATT;They're held aloft by some mystical power.
2011;LAURA;Fancy!
2012;MATT;I'll show you pictures of it.
2013;TRAVIS;Nicely done!
2014;TRAVIS;Your baptism is going well!
2015;JENNIFER;Sorry about trying the narrative thing!
2016;JENNIFER;I was like: Oh shit!
2017;MATT;No, it's all good!
2018;MATT;First time in, you just figure it out.
2019;MATT;You're doing great.
2020;JENNIFER;Oh, there's a wall there!
2021;MATT;Thank you guys so much.
2022;MATT;We're going to to go break.
2023;MATT;We'll be back in a few minutes.
2024;MATT;Rest, get drinks.
2025;MATT;We have some fun stuff at the break for you to watch.
2026;MATT;You get to check out, if you haven't seen it, the song I sing for this expansion.
2027;MATT;Pretty sure it's coming up.
2028;LAURA;Notebooks in the store!
2029;MATT;Yep!
2030;JENNIFER;Where's the notebook?
2031;LIAM;Show the Feywild!
2032;TALIESIN;Now I want to do Russian now.
2033;MATT;We'll be back here in a few minutes.
2034;MATT;We'll see you then.
2035;MATT;[break] Welcome back, everybody.
2036;MATT;Before we dive in, the winner of the Wyrmwood giveaway is flashfletch33.
2037;MATT;So congratulations, flashfletch33.
2038;MATT;Danoba will get your contact info and we'll get that off to you ASAP.
2039;MATT;Also, I was just notified that the chat had discovered: back when vanilla launch happened, I was one of the people waiting at the midnight launch of World of Warcraft outside of a cold Best Buy in Irvine many years ago, and started my long trek on the RP server Silverhand at launch.
2040;MATT;I discovered today via fatalcake23 in the chat that there is both a Vox Machina and a Slayer's Take guild on the server I started on, which is so weird and full circle.
2041;MATT;Yeah, we used to play on that server.
2042;TALIESIN;Yeah, you dragged me onto Silverhand!
2043;MATT;Yeah, so that's kind of cool.
2044;MATT;So hi, everybody on Silverhand and those guilds and beyond.
2045;TALIESIN, MATT;It's been a while.
2046;LIAM;We are such fake nerds.
2047;TRAVIS, TALIESIN;Totes fake.
2048;TRAVIS;I just want to go deadlift right now.
2049;JENNIFER;I aspire to nerd.
2050;MATT;You aspire what?
2051;JENNIFER;I aspire to nerd.
2052;MATT;All right.
2053;MATT;So as we come back in, you have acquired--
2054;LAURA;Yay!
2055;LAURA;Should I read it out loud?
2056;MATT;If you'd like to.
2057;LAURA;I have acquired Aluneth.
2058;LAURA;This ancient, extremely powerful staff was once owned by Aegwynn.
2059;LAURA;Egwin.
2060;LAURA;Agewin.
2061;MATT;Sure.
2062;LAURA;The only female guardian of Tirisfal.
2063;LAURA;This staff carries a mind far more ancient than most things in Azeroth.
2064;LAURA;My spell attack rolls gain a +3 to hit.
2065;LAURA;Whenever I deal damage, I deal two additional hit points of force damage.
2066;LAURA;That's amazing.
2067;MATT;As you're clutching the staff, as it speaks to you in your mind: Together, we will do great things.
2068;MATT;But you must survive.
2069;MATT;So: be smart.
2070;MATT;Stay alive.
2071;MATT;And perhaps ditch these unnecessary dregs.
2072;LAURA;They're pretty cool, actually.
2073;LAURA;Well, some of them.
2074;TRAVIS;Who's cool?
2075;LAURA;What?
2076;TALIESIN;Well, I'm cool.
2077;LAURA;What are you talking about?
2078;LIAM;What are you doing?
2079;LIAM;Did you eat mushrooms?
2080;TRAVIS;You said They're pretty cool.
2081;LIAM;You were talking out loud to no one.
2082;LAURA;Oh, no!
2083;LAURA;It's the staff!
2084;LAURA;It has a voice!
2085;JENNIFER;What did it say?
2086;JENNIFER;I heard it.
2087;LAURA;It said that I'm really amazing and that I'm going to do good things.
2088;LAURA;I think that it's like a really powerful weapon.
2089;LAURA;It's like the kind of thing you take with you for several levels at least.
2090;TALIESIN;How did we agree that you get the epic loot drop?
2091;TRAVIS;Staff of flirting.
2092;JENNIFER;He wouldn't speak to me.
2093;JENNIFER;I'm too tall.
2094;LAURA;That's probably what it is.
2095;LIAM;I think it's your own positive nature, speaking to you from yourself.
2096;LAURA;That's possible.
2097;LAURA;My mama and papa are very proud of me.
2098;LIAM;I mean, that's up to you and them.
2099;LIAM;I don't know shit about that.
2100;JENNIFER;Is he you?
2101;LAURA;Is it a he?
2102;LAURA;I don't know.
2103;JENNIFER;Is he you?
2104;LAURA;Oh, him?
2105;LAURA;Not staff.
2106;LAURA;I'm confused.
2107;MATT;Your perceptive Night Elf sense picks out the air becoming more sulfurous as you progress.
2108;MATT;You all begin to feel a bit uncomfortable in your armor as the temperature gets warmer and warmer.
2109;MATT;As this tunnel descends slightly and then comes to an abrupt leveling point, you can see a faint orange glow begin to fill the chamber before you as the pathway opens up to a large, cavernous dome.
2110;MATT;The floor of this new chamber is cracked, with dark soot, and brittle, black rock.
2111;MATT;The room seems to maintain its own atmospheric, reddish-orange glow across the entirety of the roof.
2112;MATT;Roughly 30 feet into this chamber, you get a glance at the source of light as the rocky floor suddenly drops off into a river of roiling, molten magma.
2113;MATT;The heat at this point is extremely intense, causing you to squint as you back away from the edge.
2114;MATT;There's a series of pillars that rise from the lava into platforms.
2115;MATT;In fact, it looks like at one point, two wide stone bridges that were perpendicular, meeting in the center, once reached across this lava field, both from where you stand and then one on two opposite ends of this cavern, where you can see openings on the opposite end to the right of where you are, and then to the left, it appears a portion of it has collapsed and closed it off.
2116;MATT;These bridges, however, through time and erosion, have fallen in parts.
2117;MATT;And to give you a visual perspective of what you're glancing at, you entered from this chamber.
2118;MATT;These are the existing platforms still.
2119;MATT;The shaded elements represent ones that are down in the lava, and resting there.
2120;MATT;There's a slight alcove over here, there's a number of dotted bits here and here, this appears to have collapsed, and there's an opening here and an opening here.
2121;MATT;You're currently on this platform.
2122;TALIESIN;See, this would have been an appropriate place to build bridges that are kind of iffy.
2123;TALIESIN;Two of them, even.
2124;LAURA;Yeah.
2125;LAURA;Hey, Reeks?
2126;MATT;What?
2127;LAURA;Which direction is your king?
2128;MATT;Uh-- And he bends forward and tries to get one hand up, and the finger goes like--
2129;LAURA;Hey, look!
2130;LAURA;Your hands are working again!
2131;MATT;Ow!
2132;MATT;(laughter)
2133;LIAM;Mind over matter.
2134;MATT;They mostly just let me through.
2135;LAURA;Oh, Okay, well, we'll figure it out.
2136;TRAVIS;Now, now, you know King Tagwaggle will be very disappointed--
2137;MATT;Togwaggle!
2138;TRAVIS;Togwaggle will be very disappointed if we are not brought before him.
2139;MATT;Wait.
2140;MATT;Across.
2141;MATT;And the finger, the broken hand, tries to lift up.
2142;MATT;Across.
2143;MATT;I remember!
2144;MATT;That way.
2145;MATT;That way to Togwaggle.
2146;LAURA;Straight across?
2147;MATT;Yes.
2148;TALIESIN;I want to take a quick insight check and give him an eye.
2149;TALIESIN;I don't trust this one.
2150;TALIESIN;That's not bad.
2151;TALIESIN;That's a 16.
2152;MATT;16?
2153;MATT;Kind of hard to read.
2154;MATT;You get the sense that something doesn't sit right with the way he's saying it.
2155;LIAM;Aerwin, do you see anything hinky in this room?
2156;LIAM;Anything off?
2157;LIAM;Bad?
2158;MATT;You can make a perception check if you like.
2159;JENNIFER;I'd like to make a perception check.
2160;TRAVIS;Can I join her with my heightened senses from my blue fungi?
2161;MATT;You may.
2162;MATT;With advantage.
2163;LIAM;What's that?
2164;LIAM;Okay, that's 16, plus perception.
2165;JENNIFER;So, 23.
2166;TRAVIS;18.
2167;MATT;All right.
2168;MATT;So as you both glance over, you notice the part that's collapsed and taken down that portion of the bridge, there is no way through.
2169;MATT;It is completely sealed off.
2170;MATT;You both notice simultaneously, on the central cross platform in the center of the chamber, where you see across the broken center there's a bunch of scraps of metal.
2171;MATT;Empty shells of armor plates that have been left there and have long been covered in dust and soot.
2172;MATT;You notice with your fair vision that the small alcove on the far end of the upper corner that's down near the surface of the lava, it appears to be two figures lying down in the shadows there.
2173;MATT;You can't make out much more detail than that, but there appears to be two humanoid entities that are currently resting on that platform.
2174;LAURA;They're laying a trap.
2175;LAURA;I'll bet you anything.
2176;JENNIFER;We need to get closer.
2177;TALIESIN;With darkvision, could I see them?
2178;MATT;At this distance, no.
2179;MATT;You'll probably have to get closer to the central platform to get a better view.
2180;TALIESIN;All right.
2181;TALIESIN;I'm going to try and go for the central platform.
2182;LAURA;Wait!
2183;LAURA;But you just said there's a big pile of metal in the middle, and two creatures hiding!
2184;LAURA;What if they're waiting to explode the middle?
2185;LIAM;And we're standing here talking in this chamber.
2186;JENNIFER;Could I take some of my ball bearings and go across?
2187;JENNIFER;I have my ball bearings in my pocket to trip them, and go across and try to get closer.
2188;MATT;You could throw them out in front of you to try and see if it hits them.
2189;JENNIFER;No, I'll have them with me in case I need them as a defense.
2190;JENNIFER;Can I sneak across to see them?
2191;MATT;Okay.
2192;MATT;So you pull out your small pouch of ball bearings, hold them in your hand.
2193;MATT;Go and make a stealth check.
2194;LIAM;That's good.
2195;LIAM;You're going to be good.
2196;JENNIFER;23.
2197;MATT;That's not bad.
2198;MATT;You have to leap across to get to the smaller platform that's going up, because there are the breaks in it.
2199;MATT;What's your strength?
2200;MATT;Ten?
2201;JENNIFER;Zero.
2202;MATT;Right, so maximum ten.
2203;MATT;So you get about a 10-foot jump across that way.
2204;MATT;It's about a 10-foot jump to get to that smaller platform.
2205;MATT;You, keeping low, using the balls of your feet, make a leap for it, just catching the edge ever so carefully.
2206;MATT;If you can make an acrobatics check to use your momentum to tumble onto it.
2207;LIAM;Acrobatics, you say?
2208;JENNIFER;12 total.
2209;MATT;12!
2210;MATT;Okay.
2211;MATT;You barely use your momentum to not tumble backward towards the molten rock below.
2212;MATT;Using your shoulder, you roll, and using your momentum you come to the other side of that and leap a second time towards that other side of that platform.
2213;MATT;I need you to make one more check for me.
2214;JENNIFER;13.
2215;MATT;13.
2216;MATT;All right.
2217;MATT;So you leap, tumble, and you make your way across the platform.
2218;MATT;As you stand there, looking around, you get a quick glance down into that little alcove below as you take in the circumstance.
2219;MATT;You see there, there are two figures.
2220;MATT;They are armored, they are lying down, and they are skeletal.
2221;MATT;They are long burned away.
2222;MATT;The flesh is gone.
2223;MATT;They long died there.
2224;MATT;Either they were trapped and couldn't find a way out and slowly starved or dehydrated, but there's nothing but a pile of their equipment, their weapons, their armor, and bone.
2225;MATT;At this point, the floor below you gently rumbles a bit, and you watch as some of the metal scraps scrape across the ground on their own.
2226;MATT;They leap up into the air and form bracers, some sort of large, thick pieces of armor, separate, as molten rock shoots up and flame ignites, filling the center of the empty armor into a large, elemental-like enemy made of fire and magma within the armor.
2227;MATT;You watch as this magma rager, appearing, giving this flexing roar, goes charging towards you.
2228;MATT;What are you doing?
2229;JENNIFER;Am I doing this?
2230;MATT;Well, you're definitely not hidden from it yet.
2231;MATT;You have to hide first.
2232;JENNIFER;Okay.
2233;JENNIFER;Strength is not my thing.
2234;JENNIFER;I think I'm going to run.
2235;MATT;Okay.
2236;MATT;So you run back the opposite direction, leap, head across the way.
2237;MATT;Go ahead and make an acrobatics check.
2238;JENNIFER;22.
2239;MATT;Fine.
2240;MATT;You spin, roll off your shoulder, leap, a second time on the other side, and make one more acrobatics check.
2241;JENNIFER;16.
2242;MATT;Not a problem.
2243;MATT;You make it across to the other side and you watch as this large, raging elemental stops at the edge, scoots back, and stands there, waiting, on the center platform.
2244;JENNIFER;Well, at least now we know.
2245;LAURA;That's intimidating.
2246;LAURA;What about the two things laying in wait?
2247;LAURA;Were they setting a trap?
2248;JENNIFER;They were skeletons.
2249;JENNIFER;They were done.
2250;JENNIFER;They were dead.
2251;LAURA;They were undead?
2252;JENNIFER;They're dead.
2253;LAURA;Just dead.
2254;JENNIFER;They were regular dead.
2255;LIAM;Well, that's iffy.
2256;LIAM;You know.
2257;LIAM;But also tempting.
2258;LIAM;Because what did they have when they died?
2259;LAURA;We should definitely check it out.
2260;LIAM;I can chuck you over.
2261;LAURA;But there's a giant flame monster.
2262;LIAM;Well, yeah.
2263;LIAM;First one thing, then the other.
2264;LAURA;How are we going to beat him?
2265;TRAVIS;I could stun him.
2266;LAURA;You think that would work?
2267;TRAVIS;Might.
2268;TRAVIS;We'd have to be fast.
2269;TRAVIS;And no one could fall.
2270;LIAM;I'm not going to fall.
2271;TRAVIS;Why did you think I was saying that you would fall?
2272;LIAM;You were staring straight at me.
2273;TRAVIS;Was I?
2274;LIAM;Oh, yes.
2275;TRAVIS;One of us could fall.
2276;LIAM;Now you seem sarcastic, because you're rolling your eyes.
2277;LAURA;I'm not very good at jumping, but I can cast Fly on myself.
2278;JENNIFER;(gasps) She is invisible.
2279;JENNIFER;She has invisibility.
2280;TRAVIS;Yeah, I think we have to get to-- did you trust Skeever?
2281;LAURA;Reeks?
2282;TRAVIS;Yeah.
2283;LAURA;Well... Hey, that's a good point.
2284;LAURA;Reeks?
2285;MATT;Yes?
2286;LAURA;Why didn't you warn us about the giant monster in the middle there?
2287;MATT;Sorry, I forgot.
2288;LAURA;Did you?
2289;MATT;Yes.
2290;LAURA;What happened to your voice?
2291;MATT;What?
2292;JENNIFER;Did they die from the monster in the middle because they are on the far side?
2293;JENNIFER;Or did they die trying to get out that entrance because it is not really an entrance?
2294;LAURA;That's deep.
2295;LAURA;Maybe they just fell, and they couldn't climb back up.
2296;TRAVIS;They had to have gotten there for a reason, right?
2297;LIAM;There are these big bruisers floating there, staring at us.
2298;MATT;Just staring at you, yeah.
2299;LIAM;You can fly.
2300;LAURA;Yeah!
2301;LIAM;I have seen you do it so many times.
2302;LIAM;Can't you skirt the edge of this room and go over there?
2303;LIAM;You don't need to go through this guy.
2304;LAURA;Over to the alcove?
2305;LIAM;Sure, see if there is anything worth, you know.
2306;LIAM;This is what we live for.
2307;LAURA;I can try.
2308;TRAVIS;Fly fly away.
2309;TRAVIS;Fly far away.
2310;LIAM;I am not going, too much hassle.
2311;MATT;Be careful.
2312;MATT;It's dangerous.
2313;MATT;Big fire thing.
2314;LAURA;Okay.
2315;LAURA;What did you say?
2316;MATT;Big fire thing.
2317;LAURA;Yeah, how do you make him go back to sleep?
2318;MATT;Don't let him know you came.
2319;LAURA;Okay.
2320;LAURA;Tell you what, Lohkor.
2321;LAURA;Will you hold his leash, please?
2322;TRAVIS;Sure!
2323;LAURA;I'm going to fly!
2324;LAURA;I know exactly how to do it.
2325;MATT;You cast it on yourself.
2326;MATT;It's a concentration for I believe up to an hour?
2327;LAURA;Ten minutes!
2328;MATT;Ten minutes.
2329;MATT;Even better.
2330;LAURA;Sure, yeah, I'm going to fly.
2331;LAURA;And I'm going to try to go over to that little alcove and see what happens.
2332;MATT;All right.
2333;MATT;So you watch as the tiny gnome suddenly takes off and begins gliding across the roof of this magma area.
2334;LAURA;And I'm giving the creature a wide berth.
2335;LIAM;Look, Laura, you're finally doing it.
2336;MATT;As you're doing it, you watch as the magma rager stares and tracks her as she goes.
2337;MATT;And as you head across the way, it shifts to the very edge of the platform, almost tensing at the border and watches as you slowly descend towards this platform.
2338;MATT;As you come down, make a perception check.
2339;LAURA;17.
2340;MATT;Glancing, you look down.
2341;MATT;Yeah, they are charred and long dead.
2342;MATT;The armor appears to be burned away.
2343;MATT;There are a few pieces of equipment that have lasted okay, although covered in black soot.
2344;MATT;There's a couple of small satchels that are left there and looks like they were back to back.
2345;MATT;Just hoping for help or trying to find a way off, and eventually, they expired.
2346;LAURA;I'm sorry you had a tragic ending.
2347;LAURA;I'm going to keep flying around them.
2348;LAURA;I don't want to touch my feet to the ground, in case something comes out of the ground.
2349;LAURA;But I'm going to dig through all of their shit and see what I can find.
2350;MATT;Make an investigation check.
2351;TRAVIS;Wow.
2352;TRAVIS;One.
2353;LAURA;Goodbye.
2354;MATT;Okay.
2355;MATT;Glancing through, most of it falls apart as you grasp it.
2356;MATT;The armor crumples and falls apart as you touch the armor.
2357;MATT;The only thing that catches your attention because it is the one piece of equipment that is shining amongst the rest, is in one of the sheaths.
2358;MATT;There is a blade, that as you pull it out, it's got this beautifully wicked metal that curves into a point at the end, like a forked point.
2359;MATT;It's got a bit of an energy pulse gem in the center of where the hilt is.
2360;MATT;And as you reach over to look at it, it looks pristine untouched by time.
2361;MATT;(burps) Pardon me!
2362;MATT;A little effervescent tonight, apparently!
2363;MATT;The soot wipes off of it cleanly.
2364;LAURA;I hold it aloft.
2365;LAURA;I found a weapon.
2366;LAURA;I'll bring it back over to you guys.
2367;LIAM;I also talk to you.
2368;MATT;At this point, Aluneth does whisper and say You've already found a weapon.
2369;MATT;This is of no use to you.
2370;LAURA;I'm not going to keep it.
2371;LAURA;I'm going to give it away.
2372;MATT;Good.
2373;MATT;The sooner, the better.
2374;MATT;Goes silent.
2375;MATT;You watch as, coasting over, blade forth, the magma rager still tensing against the edge as she flies overhead.
2376;LAURA;I wave it towards the creature as I fly by, but I don't get close enough to really do anything.
2377;MATT;Greldamine finally lands on the ground, presenting the blade.
2378;LIAM;What kind of blade?
2379;LIAM;How big is this thing?
2380;MATT;It's a longsword.
2381;MATT;It's big for a longsword, but it does technically act as a longsword.
2382;LAURA;Which one of you would like this beautiful blade?
2383;TRAVIS;I would like to see it.
2384;LIAM;I would also, but I would do roshambo with you.
2385;TRAVIS;Yep.
2386;LIAM;Okay.
2387;LIAM;Best out of three, or just one time?
2388;TRAVIS;One time.
2389;TRAVIS;Throw on four.
2390;LIAM;On four?!
2391;LIAM;I have intelligence of eight.
2392;TRAVIS;Throw on three.
2393;LIAM;Throw on three?
2394;TRAVIS;Throw on one.
2395;LIAM;Why are you changing it on me?
2396;LIAM;Let's do it on two.
2397;LIAM;We go one, two, shoot.
2398;LIAM;Okay?
2399;LIAM;All right.
2400;LIAM;One, two, shoot!
2401;LIAM;Oh shit, two papers.
2402;LIAM;We go again.
2403;LIAM;One, two, shoot!
2404;LIAM;Give me that shit.
2405;MATT;It's a very fine blade.
2406;JENNIFER;What's the name of her sword again?
2407;MATT;Aluneth.
2408;LAURA;It's a staff.
2409;JENNIFER;Sorry.
2410;JENNIFER;Does Aluneth have anything to say about where we are?
2411;LAURA;Oh mighty Aluneth, do you have anything to say about where we are?
2412;LIAM;You seem very crazy right now.
2413;LAURA;It talks, I swear.
2414;MATT;The voice comes back in from the aether.
2415;MATT;I do despise these subterranean regions.
2416;MATT;I don't recognize where we are.
2417;MATT;This world has changed quite a bit since I last walked its surface.
2418;LAURA;Yes.
2419;JENNIFER;How long since you walked its surface?
2420;LAURA;How long since you walked its surface?
2421;LAURA;I mean, I know, I've heard about Aluneth before.
2422;LAURA;It's very ancient.
2423;MATT;Of course you have.
2424;MATT;I don't know, generations.
2425;LAURA;Long time.
2426;TALIESIN;Could you fly over to the--
2427;MATT;Do you wish to attune to the weapon?
2428;LIAM;Hell yeah.
2429;LIAM;I am attuned to nothing, so I will attune to this.
2430;LAURA;You want me to go over to the collapse?
2431;TALIESIN;Yeah, lead the creature over to that section.
2432;LAURA;Oh, okay!
2433;LAURA;I'm going to fly over to the collapsed area, because I've still got a little time left, right?
2434;MATT;Okay, so you coast over to the collapsed area.
2435;LAURA;And I land.
2436;LAURA;Now what do you want me to do?
2437;TALIESIN;I'm going to try and cast Hold Person on the creature.
2438;LAURA;Wait, I'll wave my arms so he walks toward me.
2439;MATT;Make an intelligence check.
2440;TALIESIN;God, it won't work on him, will it?
2441;MATT;Yeah, so the creature heads over and it's focused on you.
2442;MATT;What'd you get?
2443;TALIESIN;I got 20.
2444;MATT;20.
2445;MATT;You get the sense that Hold Person mainly affects small humanoid creatures.
2446;MATT;A large elemental like this would not be held by a spell.
2447;LAURA;Is an elemental considered a monster?
2448;MATT;It's considered a monster.
2449;TRAVIS;Creature, though.
2450;MATT;So you discovered your weapon.
2451;LIAM;Yes.
2452;LIAM;This was made for me.
2453;LIAM;Should I be describing this to the table?
2454;LIAM;Yes, this is called Adventurefury, Blessed Blade of the Thrillseeker.
2455;LIAM;This weirdly pristine longsword is encased in meticulous, almost gaudy, gold scrolling and rune-like carvings that spell out phrases like, Carpe Diem, like your shirt with donut, and You only live once.
2456;LIAM;You gain plus two to all attacks and damage rolls made with this weapon.
2457;LIAM;You are immune to fear and, if you ever attempt to flee from danger, you must make a wisdom saving throw, DC 12.
2458;LIAM;On a failure, you instead rush toward the challenge in hopes of glory.
2459;LIAM;YOLO!
2460;TRAVIS;Yes!
2461;TRAVIS;That's a great item!
2462;MATT;It's Adventurefury, Blessed Blade of the Thrillseeker.
2463;TRAVIS;Oh my god!
2464;TRAVIS;Damn!
2465;LAURA;Is that an actual blade in the game?
2466;MATT;(chuckling) No.
2467;LAURA;Please make it an actual weapon in the game.
2468;MATT;It's an inside joke.
2469;LIAM;For Argus and for LRJenkins1234.
2470;TRAVIS;I could try to stun him if we all wanted to make a break for one side or the other.
2471;TRAVIS;I'm not sure if it would work, so, any other ideas?
2472;JENNIFER;Which side?
2473;LAURA;Straight through, I think!
2474;LAURA;I mean, that's what Reek said.
2475;TRAVIS;Wasn't Reek lying?
2476;LAURA;No!
2477;LAURA;He's very trustworthy.
2478;JENNIFER;I think there's something on the other side that we don't know.
2479;JENNIFER;We need to know.
2480;TRAVIS;I cast Zone of Truth.
2481;MATT;Okay.
2482;MATT;What's your spell DC?
2483;MATT;Oh, 13, right?
2484;MATT;Nope.
2485;LAURA;Yay!
2486;TRAVIS;Cheeker-- what's his name?
2487;TRAVIS;Oh, right, Reek.
2488;MATT;Reeksus.
2489;TRAVIS;Do you really know the way back to Tagwaggle?
2490;MATT;I do, yes!
2491;TRAVIS;Which direction is it?
2492;MATT;That would be (straining) right!
2493;LAURA;He lied to me!
2494;TRAVIS;He did.
2495;TRAVIS;I'm sure it's nothing personal, though!
2496;MATT;I'm bad with directions!
2497;LAURA;He's telling the truth!
2498;LAURA;Do you like us?
2499;LAURA;Aww.
2500;LAURA;Do you like me?
2501;TRAVIS;No, he has to answer.
2502;MATT;I endure you!
2503;LAURA;I'll take it!
2504;MATT;I endure you.
2505;LIAM;Hey, Shakira, do you fear me?
2506;MATT;(panicked wimper)
2507;LIAM;Good, that's all that matters.
2508;LIAM;Let's go.
2509;LAURA;I think I'm running out of my ten minutes.
2510;MATT;You're getting down to the last couple of minutes.
2511;LAURA;I need to stand up and I need to fly away from this place, or else I'm going to be stranded on this side!
2512;TALIESIN;You can land wherever we need to be.
2513;LAURA;Yeah, that's what I'm going to do, but I want to fly around to the other side.
2514;MATT;Okay, so you coast around to this platform over here and land on the opposite side of the bridge.
2515;MATT;The magma rager spins and is flexing in the direction of where you are.
2516;TRAVIS;While the Zone of Truth is still active, Bundle, what are you the most afraid of?
2517;MATT;Make a wisdom saving throw.
2518;TALIESIN;Oh!
2519;TALIESIN;That's a 24.
2520;MATT;Answer as you feel.
2521;TALIESIN;Not you.
2522;TALIESIN;Not even a little.
2523;TALIESIN;You're so soft and squishy.
2524;TRAVIS;No, see, if it was a spider, then I could take care of it for you.
2525;TRAVIS;I don't want to leave you in an awkward situation.
2526;JENNIFER;Should we leave you two alone?
2527;TALIESIN;No.
2528;MATT;Yes!
2529;TALIESIN;Well, you only live once.
2530;LAURA;What are you going to do?
2531;TRAVIS;Do it.
2532;TALIESIN;I'm going to make a run for it.
2533;TALIESIN;Fuck it.
2534;MATT;What's your strength?
2535;TALIESIN;My strength is 16.
2536;MATT;16?
2537;MATT;That's easy enough for you.
