;Player_Name;Transcription_Text
1434;MATT;(laughs) It will come into play.
1435;TRAVIS;(cries)
1436;ORION;So the goal is to shoot an arrow into this-- like the Death Star?
1437;MATT;Essentially, yeah.
1438;LAURA;Yeah.
1439;ORION;Okay, cool. As I see her ready, I'm going to hold up my hand with my ring and point it right at that hole.
1440;MATT;To do--
1441;LAURA;So you can deflect it if I--
1442;ORION;I got your back.
1443;LAURA;All right, thanks, Tiberius.
1444;ORION;Get it, Vex.
1445;MATT;All right, and you're going to--
1446;SAM;I'm going to inspire her. With inspiration.|I'll sing, (sings) Ooh ooh, shut up and shoot that hole! Your arrow is my destiny, yeah I said,
1447;ALL;(sings) Ooh ooh, shut up and shoot that hole! (laughs)
1448;MATT;And with that, you feel your focus, you wait, you breathe in, you breathe out, you breathe in, you breathe out in pattern with the slamming of the piston against the ceiling.
1449;LAURA;Oh, I'm so nervous.
1450;ASHLEY;Get it, get it, get it, you're going to do it.
1451;MATT;You let out all your breath and you hold, hold, hold, waiting between heartbeats, and then (twwt), release. Go ahead and make your attack roll.
1452;LAURA;I'm going to roll the fancy one we got last week.
1453;LIAM;Get it, girl. Get it.
1454;LAURA;All right. (laughs) Oh, no. Okay. I add my attack bonus?
1455;MATT;Yes, you do.
1456;SAM;Plus an inspiration.
1457;LAURA;Plus an inspiration dice?
1458;MATT;Plus a d10.
1459;ORION;Oh, shit.
1460;MARISHA;(whispering) It's so quiet.
1461;ORION;I know.
1462;LAURA;Oh, that's awesome! Okay. 35.|(yelling)
1463;TRAVIS;Good inspiration.
1464;MATT;As you release the arrow, you see the pillars slamming. The pillar comes down just as the arrow crests over it, past another pillar that just barely manages to miss it by a segment.
1465;ORION;I cast Telekinesis to swoop it up.|(whoosh)
1466;SAM;Oh, god.
1467;ORION;Just to help and guide it.
1468;ASHLEY;No, but it's already gone in.
1469;TRAVIS;We don't need it! We don't need it!
1470;LAURA;Oh, let me just see if I got it first!
1471;LIAM;She rolled a 35, we don't need shit.
1472;ORION;It's going in there, anyway. I don't even have to roll.
1473;MATT;So. As the pillar pulls down, the arrow goes cascading forward. Go ahead and make a d20 roll with the +5 modifier.
1474;ORION;Sweet. That's 17.
1475;MATT;17? Okay. So as the arrow makes its way, it ricochets off the bottom edge of the actual hole and immediately bends itself upward, the shaft bending. As it begins to start heading up the hole, there's a sudden force of arcane energy that slams it even harder up into the top of this tiny little slit.
1476;TRAVIS;Yeah, good.
1477;MATT;As it goes up there, you hear what sounds like a splintering of wood and metal. Then you hear metal grinding. You start seeing bits and chunks of grinding metal begin to pour out of the hole and the pillars begin to (scraping stone).
1478;LAURA;Hey.
1479;ASHLEY;Yeah.
1480;TRAVIS;Nice shot!
1481;ASHLEY;Yeah, Vex!
1482;MATT;Eventually coming to a halt.
1483;MARISHA;A wrench in the machine.
1484;TALIESIN;I could have done it.
1485;LAURA;You totally could have done that.
1486;TALIESIN;I could have made that shot.
1487;SAM;Next room's yours.
1488;TALIESIN;Yes, next room, next room's all mine.
1489;ORION;That was one of those impossible things, right?
1490;MATT;Pretty damn close to impossible.
1491;ORION;I knew it.
1492;LAURA;Nice.
1493;MARISHA;(laughs) Pretty damn close to impossible.
1494;SAM;All right, let's go across and heal our rogue.
1495;TRAVIS;Yeah, we walk across.
1496;LAURA;Yeah, all right.
1497;LIAM;As they come to the other side, I clutch my broken rib and injuredly hold a hand up and give a half-assed high-five to my sister. (grunts)
1498;LAURA;Good job getting slammed into the roof like that.
1499;LIAM;Yeah, you're welcome.
1500;LAURA;Yeah.
1501;MATT;All right.
1502;MARISHA;So can we take a short rest to heal up and then also a short rest to take a short rest in real life?
1503;MATT;You can. We're going to go ahead and stop here. You're now taking a short rest.
1504;LAURA;Okay.
1505;MATT;You guys take a moment. If you want to go ahead and heal up using any of your hit dice, you're able to, Vax.
1506;MARISHA;I'm going to do that.
1507;SAM;Me, too.
1508;MATT;And on that note, we're going to go ahead and take our five-minute break here, guys.
1509;TRAVIS;Cool.
1510;SAM;Five.
1511;MATT;While the party takes a short rest, we're taking a five-minute rest. We've got to be done by ten tonight with the stream, so.
1512;SAM;Let's do it.
1513;LAURA;Woo.
1514;MATT;So we're going to take a five-minute break.
1515;SAM;True five. True five.
1516;MATT;Orion, if you want to go ahead and come over, we're going to go ahead and give you guys-- yes, sir?
1517;ZAC;Bring them on up.
1518;MATT;Okay, yeah, so we're going to go ahead and introduce our guests and give them an overview of the charity that we have currently on the stream tonight.
1519;TRAVIS;That was great work, though.
1520;LAURA;Yes.
1521;MARISHA;Oh my god, I rolled two eights in a row.
1522;TALIESIN;Nice!
1523;MARISHA;That's awesome.
1524;MATT;I'm going to pass this over to Orion.
1525;ORION;Okay.
1526;MATT;Come on over. Gonna enjoy my chickens.
1527;SAM;Don't forget to go to Teespring and buy our T-shirts.
1528;LAURA;Oh, let-- no! We haven't even talked about it at all!
1529;MATT;Yes! By the way, our T-shirts are on Teespring. We'll have six more days.
1530;SAM;Six more days.
1531;MARISHA;They also just went up on our website, on critrole.com. So you can go to our website and find the link.
1532;MATT;All right, guys, we'll see you in a little bit. Meanwhile, take it away.
1533;SAM;I'm going to tweet the Teespring link right now.
1534;ZAC;Lucas, go fullscreen.
1535;MARISHA;Sam is tweeting it.
1536;ORION;Give me that chair.
1537;ZAC;Cool. Are you good, man?
1538;ORION;Yeah.
1539;ZAC;Sweet.
1540;ORION;We had points. We had points. Are we standing for this?
1541;TAYLOR;Yeah.
1542;ORION;Tell me that for the chat thing. Hi, everybody! Orion Acaba here and Taylor Carol. This is our special guest. And he's with GameChanger, and he has a couple of things to say for this particular awesome charity that we are working with today with SquareEnix and the Deus Ex anniversary.
1543;TAYLOR;Yeah.
1544;MARISHA;Taylor!
1545;TAYLOR;Well, first of all, on behalf of GameChanger, I just want to say what a blast it is to be with you guys. Personally, I've never watched D&D before. You guys have made me a huge fan.
1546;ORION;Yes.
1547;TAYLOR;And, yeah. So a little bit of backstory about GameChanger. About nine years ago, I was diagnosed terminal form of cancer. I was given about two weeks left to live, but thankfully it's been a long two weeks. I'm totally healthy now.|(cheers)|Thank you. But when I was sick, the most incredible thing that I saw was the impact that video games had on the people and on the children that were fighting cancer and other rare diseases.|And witnessing the incredible good of the game community of video games. My dad and I resolved to make an organization that used and capitalized on that incredible good of the video games, of the gaming community, to help those suffering from rare diseases. And so one year later, GameChanger charity was born, and we started out just collecting games from the incredible gaming community, giving them back to kids suffering from rare diseases. And seven years later it evolved into what we have now. Now we're sponsored with some incredible gaming organizations like Square.|A huge thanks to them for partnering with us for this awesome campaign. But yeah, today we go into hospitals and do things called GameChanger days where we go and we bring food for the staff, for the families, for the kids suffering from rare diseases. We bring them gaming packages so they can bond together. We provide college scholarships, and we really just try and provide hope and inspiration-- the same hope and inspiration that games really provided me when I was sick.
1548;ORION;Yeah. That's awesome. And we here at--
1549;TAYLOR;Oh, thank you. No, thank you guys.
1550;ORION;And we here at Critical Role really love organizations like yours, which is why when we started talking, it was such a nice partnership for you to come on and tell us about this organization. Tell everybody where they can find to help, if they wanted to send to GameChanger.
1551;TAYLOR;Yeah, GameChanger. Yeah.
1552;ORION;Yeah, where would they go for that, to check it out?
1553;TAYLOR;To support GameChanger, to learn more about what we do, you can visit www.gamechangercharity.org, and if you go to our website, you can see our campaign with Deus Ex.|You can go online and if you donate anything more than a dollar, you get a free copy, a director's cut--
1554;ORION;Oh! Well, awesome. That's cool.|I'll probably do that too.|It sounds like it's pretty sweet. And I want to thank you, the rest, with all of us. I'm doing this because I'm currently fighting cancer.|I have-- I don't have that bad of a trek to go through, but it is very inconvenient and painful, but hearing stories like you. I mean, you're 20. He has a beautiful singing voice. He's a singer. And you're going to Harvard, is that what's going on?
1555;TAYLOR;I am, yeah, I'm a rising junior.
1556;ORION;Stupid doctors, they don't know shit.|But people like you inspire me, because up until a few months ago, I didn't need any of that kind of inspiration. So it's great, and your organization's great, so we just wanted to thank you for coming on and speaking with everybody and letting everybody know, and we'll be working together in the future, too, and we'll be doing lots of fun stuff, so yeah. Check these guys out, please.
1557;LAURA;Donate, donate.
1558;ASHLEY;What are you studying at Harvard?
1559;TAYLOR;I am an English concentrator.
1560;ORION;Whoa.
1561;MARISHA;Nice.
1562;TAYLOR;Yeah, yeah.
1563;LAURA;I don't even know what that means.
1564;ORION;Hold on a second. Do you mean like you concentrate on English?
1565;TAYLOR;(English accent) English primarily.
1566;ORION;Oh, very good. Okay, cool.|That's like my second language.
1567;TAYLOR;You guys have to teach me better accents.|I love all of your accents.
1568;ORION;(laughs) Any other questions for our guest, guys?
1569;ZAC;I'd like to let everybody know, the mods all have access to the GameChanger command in the chatroom, so if you guys are watching and are not in the chat, just join the chat really quick and you guys will be able to get that link for the donation link to get Deus Ex and anything over a dollar and you get a copy of the game. We're going to go ahead and let that run all the way throughout the rebroadcast and throughout the weekend, so mods, just keep spamming that throughout the chat.
1570;LAURA;So donations tonight are going to GameChanger, yeah?
1571;ORION;Yeah.
1572;ZAC;It's up to you guys whether or not you want 826LA to go to GameChanger because the link right now just goes to Critical Role, so it's up to you guys for where it goes from there.
1573;ORION;So we can do that.
1574;LAURA;Awesome. I think donations tonight will definitely go to GameChanger, yeah.
1575;ORION;Yeah, so that's what we'll do. Awesome!
1576;TAYLOR;Thank you all.
1577;ORION;Right now. That's the decision.
1578;TAYLOR;Go team.
1579;MARISHA;Tell them it's the last day.
1580;ORION;And this is our last day. Is that right?
1581;TAYLOR;Yes, so this is the last day to get your copy--
1582;ORION;For the Deus Ex thing.
1583;ZAC;Okay, then I will not let it run over the weekend.
1584;ORION;Yeah. But again, dude, thank you for coming on.
1585;TAYLOR;Hey, thank you.
1586;ORION;And we'll break because I have to pee really bad. But thank you so much.
1587;TAYLOR;Thank you.
1588;ZAC;So guys, just to be clear, all of your donations tonight will go towards GameChanger, but if you want a copy of the game, just go and donate a dollar on the link that we have access to in the chatroom. And just so you guys know, there will not be time for them to read messages tonight after the show. Lucas and I both have to catch a flight, so sorry. We'll get to them next time.
1589;TAYLOR;Anything more than a dollar.
1590;ZAC;Anything more than a dollar, to be clear.|Anything more than a dollar.
1591;ASHLEY;Go donate. Just do it!
1592;ZAC;Listen to Ashley. We're also really close to another giveaway, guys. If you guys subscribe, I think we're only like ten away from another giveaway, a large giveaway, which is a signed Player's Handbook and a signed photo of the cast.|And every 50 we'll do a giveaway until the show's over tonight. We will not be going late, so just keep in mind, guys, don't send Geek & Sundry messages upset that your message wasn't read.|We'll get to it next time. We appreciate you guys donating and Lucas, go ahead and go to drop cam.|Yeah, go drop cam.|[break]
1593;MATT;Welcome back.
1594;ZAC;I had a really quick announcement before we get back into the game. The winner is Paula Konito, so congratulations--
1595;MARISHA;Paula Konito!
1596;MATT;Paula Konito, congrats!
1597;MARISHA;Paula Konito!
1598;ZAC;-- and I understand that we crashed their website for donations--
1599;MATT;(laughs)
1600;ASHLEY;What?
1601;ZAC;So congratulations, guys, for crashing the website, but what is not crashed is our donation link, so if you scroll down and click on the 826LA link, all of the donations that are made tonight they've said will go to GameChanger
1602;LAURA;Yeah, the portion of the donations that would normally go to 826LA tonight are going to go to GameChanger.
1603;ZAC;So just scroll down on the channel page, click on 826LA or the donate link that's being spammed in the chat room, and all of those donations will go to GameChanger. And they let us know before they left, they just got 10,000 more Deus Ex keys, so we will let that run throughout the weekend.
1604;TRAVIS;That's amazing.
1605;LAURA;Oh, awesome.
1606;ORION;Nice!
1607;ZAC;So the mods will keep spamming that throughout the weekend and you guys can donate throughout the rebroadcast and things like that for a one-dollar Deus Ex code.
1608;LAURA;Anything over a dollar.
1609;ZAC;Anything over a dollar, yeah.
1610;MATT;That's so awesome.
1611;ZAC;One-oh-one! Enjoy Deus Ex.
1612;MATT;Yeah! Thank you guys so much.
1613;LAURA;It would be good if you donated more than one dollar, if you want.
1614;TALIESIN;It's still needed.
1615;MATT;The Critters are strong. The Critters are legion.
1616;TRAVIS;It is. They are.
1617;MATT;It's amazing the things we can do.
1618;ORION;It is on. YES.
1619;TALIESIN;There are Critters in the walls.
1620;MARISHA;They're in the god--
1621;MARISHA, TALIESIN;-- damn walls!
1622;TALIESIN;Thank you for being there with me on that.
1623;MATT;All righty, so! Back into the fray.
1624;LAURA;Oh, god, okay.
1625;MATT;You guys, after finishing your short rest, healing up various wounds in that circumstance--
1626;SAM;(plays note on flute) (laughter)
1627;MATT;You make your way, playing a fancy little ditty on the flute. You make your way down this long, long staircase. You continue down for, I'd say, probably a good hundred feet or so before you start encountering, I'll say, a mild change in the scenery, at least. What was normally just a musty hallway is becoming thicker and thicker coated with large spiderwebs.
1628;LAURA;Ugh.
1629;TRAVIS;Awesome.
1630;ORION;Everything's so sticky.
1631;ASHLEY;Spiders!
1632;MATT;You manage to push through and cut through, but it gets to the point where it's just so matted you guys are having to bushwhack your way through as if you had a machete.
1633;TALIESIN;I'm not taking off my mask.
1634;TRAVIS;Can I turn to one of those (clears throat) Scalebearers and ask if they've ever dealt with any umber-hulks in this region.
1635;MATT;"Scalebearer Vorak gives kind of a curious look to your question. Scalebearer Desona looks to you and says, """"No, I don't believe they exist in this region. Nor this close to the surface, as far as I know."""""
1636;TRAVIS;Right. That's important, isn't it.
1637;ORION;Are the spiderwebs-- are they becoming more as we traverse--
1638;MATT;Yes, they're getting thicker and thicker.
1639;ORION;Okay, so I'm going to make my way towards the front of the group because I'm noticing this and I'm going to do a Fire Breath, and I'm going to instantly cast Control Flame and catch as much as I can of it, and start spinning it, burning the webs as we go.
1640;MATT;Okay. Very cool. So, Tiberius steps forward and breathes a heating breath of dragon fire out of his mouth. As it cascades forward, burning through the nearby webs, he casts a secondary spell and captures it and begins to shape it, almost like it's a fiery clay in the middle of the air. And he utilizes it in a very similar way to how he uses Telekinesis and begins to use that rolling fire to burn through the webbing as you guys continue down the stairway.
1641;LAURA;Nice.
1642;TALIESIN;That's convenient.
1643;MARISHA;At least it'll be disinfected.
1644;ORION;Mm-hm-hm. Fire cleans all.
1645;MATT;It also leaves a terrible stench. Burning web has this awful kind of--
1646;TRAVIS;Burnt hair?
1647;MATT;It's similar. Burnt hair with burnt plastic, if you can think of it-- it's awful.
1648;LAURA;What's plastic?
1649;MATT;This is more for your own player knowledge, sensory knowledge.|(laughter)|The sound of crackling of the nearby webbing that's slowly retracting and burning and melting is immediately joined by the sound of a low clicking.|(groaning)
1650;LAURA;I stealth immediately.
1651;MARISHA;Oh, that frickin' sound. Do we-- I can try to cast Pass Without a Trace on all of us, if we want to sneak through here.
1652;LAURA;Oh, yeah, that would be good!
1653;MARISHA;Do you want to try to sneak through?
1654;TRAVIS;Yeah, do it.
1655;MARISHA;I cast Pass Without a Trace.
1656;TRAVIS;Now let's vogue.|This changes every time!
1657;ORION;Sweet!
1658;MATT;All right, so Pass Without a Trace is cast, while you two both make stealth rolls.
1659;LAURA;So, with the Pass Without a Trace?
1660;MATT;With the Pass Without a Trace, yes.
1661;LAURA;31.
1662;ORION;(quietly, to Marisha) Is my magic on stealth, too?
1663;LIAM;24.
1664;MATT;With the plus ten?
1665;LIAM;Plus ten from what? Say again?
1666;LAURA;Pass Without a Trace.
1667;MATT;Keyleth cast Pass Without a Trace.
1668;LIAM;Oh, 34.
1669;MATT;All right. You guys dart off to the side, kind of using the remnants of the web to block your physical forms. The boiling fire that has been placed ahead of you is starting to reflect small little points of reflected light throughout the shadows in the distance that are moving towards you as you see giant hairy arachnid legs.
1670;ORION;I back up! I have my cloak on. And I'm going to go ahead and cast Stoneskin. That's what I do right now.
1671;MATT;You cast Stoneskin? I'm going to go ahead and ask--
1672;MARISHA;I'm also going to cast Stoneskin.
1673;LAURA;Can I cast, while they're coming-- where did I write it down?
1674;SAM;I'm going to go invisible.
1675;LAURA;Never mind, I can't find my spell.
1676;SAM;This is exciting, guys. There's a board of some sort.
1677;LAURA;I cast Entangle on the ground.
1678;MATT;In front?
1679;LAURA;Yeah.
1680;SAM;You have-- you can cast things?
1681;LAURA;(quickly) Yeah, yeah, yeah!
1682;ORION;(quietly) Yeah, she's a ranger, she can cast stuff.
1683;TRAVIS;Apparently.
1684;TALIESIN;As long as it's at range.
1685;SAM;Grog, you've got a beard spell.
1686;TRAVIS;I do.
1687;TALIESIN;That was my terrible joke and I wish I hadn't. Now I'm embarrassed.
1688;TRAVIS;I can also cast Flatulence.
1689;SAM;And you have Frenzied Rage.
1690;MATT;All right. You can now see skittering off to the side what appear to be a series of large arachnid-like creatures. As you cast Entanglement, you can--
1691;LAURA;I'm reading it now.
1692;MATT;Go ahead and read the spell.
1693;ORION;Did I manage to catch with the Control Flame my entire Fire Breath when I did that? And I'm controlling it still?
1694;MATT;Currently you are.
1695;LAURA;Oh, that's not what it was. That's the wrong spell. Sorry, sorry, it's Spike Growth, is the spell.
1696;SAM;Spikes growth?
1697;LAURA;I cast Spike Growth.
1698;MATT;Spike Growth, okay, that is different.
1699;LAURA;Yes, which is-- the ground in a 20-foot radius centered on a point within range twists and sprouts hard spikes and thorns. It's difficult terrain for the duration, but anybody that can see me casting it doesn't take damage to it, it's only the people that don't see me casting it.
1700;MARISHA;Dope.
1701;SAM;Really?
1702;MATT;All right.
1703;LAURA;Yeah. Any creature that can't see the area at the time the spell is cast must make a wisdom check.
1704;ORION;Cool.
1705;SAM;All right, but can they see the area?
1706;MATT;They can see the area.
1707;LAURA;Oh. Well, that's not quite the same thing, then, what I saw. (yells) Forget it, my spell is stupid!
1708;SAM;No, no!
1709;ORION;It's fine, just not in a hallway with stairs.
1710;LAURA;I know!
1711;SAM;It's fine, just stick to arrows, really.
1712;ASHLEY;She can do so much more than just arrows!
1713;ORION;As I see this, can I release my Control Flame and let the Fire Breath just happen, and not control it anymore?
1714;MATT;Looking into your spell now. Oh, Control Flames is a cantrip. You are able to control just enough fire to burn away the things. It wouldn't actually do any damage if released. Control Fire kind of like captures an element of it.
1715;ORION;Okay. So that's what I was using, the element of what I did.
1716;MATT;Yeah.
1717;ORION;So I used it so I could have the fire.
1718;MATT;Exactly.
1719;ORION;Got it.
1720;MATT;You set it as a catalyst to it.
1721;LAURA;They can see the ground.
1722;MATT;They can.
1723;LAURA;Then no, don't cast it.
1724;TRAVIS;Doesn't it mess up the ground if we try to walk through it?
1725;LAURA;Not you guys, but they--
1726;MARISHA;But they're spiders. They're probably not that wise.
1727;ORION;Can I cast something else?
1728;MATT;No. Right now everyone rolls initiative.
1729;ORION;Damn it!
1730;ASHLEY;Ugh.
1731;MATT;There are only so many things you can do here, Tiberius.
1732;ORION;I know, but I like doing lots of things.
1733;MATT;I know you do.
1734;MARISHA;That's not bad! I'll take that.
1735;SAM;I lost my dice.
1736;LAURA;That's my punishment.
1737;TRAVIS;Fuck, yeah.
1738;TALIESIN;I love my new stats.
1739;LAURA;I don't think that should count.
1740;TALIESIN;I rolled terribly this time but my stats are good.
1741;SAM;Every time, every time.
1742;ORION;What?
1743;SAM;I've never rolled a double digit initiative roll, ever.
1744;MATT;Oh, Scanlan, but you roll when it counts.
1745;TRAVIS;Just Wil Wheaton roll every time you do initiative.
1746;TALIESIN;Is that what we're calling it? Wheatoning?
1747;TRAVIS;Yeah, Wheatoning.
1748;LAURA;Wheatoning? Yeah.
1749;TALIESIN;All right.
1750;TRAVIS;Wheatoning.
1751;SAM;(announcer voice) Wha-Wha-Wheaton.
1752;MATT;All right, so. 25-20.
1753;ASHLEY;Natural 20.|(yelling)|I don't think that ever happens when it's like damage or something.
1754;MATT;That's okay.
1755;LAURA;23.
1756;ASHLEY;I'm gonna go with it.
1757;MATT;Okay, so 23. Grog, what have you got?
1758;TRAVIS;21.
1759;MATT;Okay, so we've got Vex, Grog, and Pike, what's your dex? What's your initiative bonus?
1760;ASHLEY;Nothing.
1761;MATT;Nothing, so 20. All right. 20 to 15?
1762;MARISHA;17.
1763;MATT;17, Keyleth.
1764;ORION;15.
1765;TALIESIN;16.
1766;MATT;All right, Percy. Tiberius. Vax?
1767;LAURA;He's gone.
1768;MATT;Has left the screen.
1769;TRAVIS;Oh, really?
1770;SAM;Great.
1771;ASHLEY;Last.
1772;MATT;I'm going to consider that a low initiative.
1773;MARISHA;Oh-ho-ho-ho.
1774;ORION;He just went to go poop.
1775;SAM;Seven!
1776;MATT;Seven for Scanlan.
1777;ORION;Or deal with--
1778;MATT;All right, we'll get to his turn when we get to it.
1779;ASHLEY;(yells) Vax!
1780;MATT;It's okay. All right, Vex.
1781;MARISHA;Wait, there he is.
1782;SAM;He's holding a cat.
1783;ORION;He has a cat.
1784;SAM;It's Trinket! It's Trinket!
1785;MATT;What did you roll for initiative?
1786;LIAM;That is a 16.
1787;MATT;16?
1788;ORION;Okay.
1789;TRAVIS;Get your head out of your ass.
1790;SAM;He's Dr. Evil.|(laughter)
1791;MATT;All right, Vex.
1792;LAURA;Me?
1793;MATT;Yes.
1794;LAURA;Oh! I'm going to cast Conjure Barrage at all of the spiders coming at us.
1795;MATT;All righty.
1796;LAURA;I'm going to Hunter's Mark whatever one looks the biggest.
1797;MATT;Okay, from this position you will also hit Tiberius to hit all the spiders.
1798;LAURA;Oh, where am I?
1799;MATT;You're right here.
1800;LAURA;Oh.
1801;TRAVIS;You gotta do what you gotta do. (laughs) Sorry.
1802;MATT;I mean, you could--
1803;LAURA;I'm going to move to where I'm in the middle of them. I'm still kind of stuck.
1804;MATT;Right there?
1805;MARISHA;Get it!
1806;LAURA;Yeah, and then I'll Conjure Barrage from there.
1807;MATT;Okay.
1808;TRAVIS;(quietly) Don't encourage it.
1809;LAURA;I cast Hunter's Mark on the biggest one I see.
1810;MATT;Okay, this one here is one of the larger ones.
1811;LAURA;Okay.
1812;MATT;So I'm going to go ahead and mark that one.|So go ahead and-- Conjure Barrage does what damage?
1813;TRAVIS;(quietly) Hate it.
1814;LAURA;It does 3d8 on all creatures.
1815;MATT;Do they get a saving throw?
1816;LAURA;They get-- yes, they do. They get half-damage if they save.
1817;MATT;Mmkay. What's the DC on your spells?
1818;LAURA;(in a funny gruff voice) My DC is 14.
1819;ORION;(laughs)
1820;MATT;All righty.
1821;ORION;(mimicking Laura's gruff voice) MemememememeME.
1822;MARISHA;What's your DC, girl?
1823;LAURA;Okay.
1824;MARISHA;What's yo digits? Gimme those stats.
1825;MATT;Okay, all you need--
1826;LAURA;Do I need to roll for attack?
1827;MATT;Only this one makes it.
1828;LAURA;Oh, sweet!
1829;MATT;No, the barrage just happens. They're all caught in it.
1830;LAURA;Okay, cool.
1831;MATT;So all of them take full damage, except for this one takes half damage, so go ahead and roll the damage on that.
