;Player_Name;Transcription_Text
1170;TALIESIN;I think if I might translate. What my friend here is trying to relate is that, perhaps when the dust has settled, your salvation may either be found in the withering corpse or cackling smile of a creature that you are subservient to, who will take great delight in your destruction. Or perhaps in those you've aided who will feel grateful.
1171;MARISHA;It's up to you, Raishan.
1172;TALIESIN;And I will advise her to take no revenge until all cards are on the table.
1173;MATT;"""""Well. Good."""""
1174;MARISHA;Clearly you are the type of person who looks for answers in other people. You are clearly unaware of accepting any fault or any result of your actions. Why don't you start fresh? Do you really want Thordak to have another sway over you? Another gift, another favor, that he's given you? That he is going to hold over you for all of eternity? Do you really want that? You're stronger than that.
1175;MATT;"""""That's why we're working to watch him fall."""""
1176;MARISHA;Are we?
1177;MATT;"(chuckles) """"If you need not my help, just let me know."""""
1178;MARISHA;Oh no, Raishan. We don't need your help.|Let me say that right now. This all depends on what you want out of the end of the deal.
1179;MATT;"""""I wish to be given unfettered, unbothered, unwatched control over the corpse upon his death to extract the information I need. I will leave your very sphere of existence and understanding until the end of your days."""""
1180;LIAM;What happens if we say no to that?
1181;MATT;"""""Oh, then I'll find another way."""""
1182;MARISHA;Spoiler alert: we're saying no to that.
1183;TALIESIN;Unfettered I'm fine with. It's unwatched--
1184;MATT;"""""Then watch! Watch, for all I care. It will be Greek to you anyway."""""
1185;MARISHA;She's taken way too much. She doesn't get to leave!
1186;TALIESIN;She's already left.
1187;TRAVIS;Yeah, I walk over around the table towards Asum. I try and poke her in the shoulder. Him.
1188;MATT;It passes through the form.
1189;TALIESIN;This is the deal that we are offered.|This is the deal that's on the table. We are in a tenuous position of power.
1190;SAM;You can stop poking, Grog.
1191;TRAVIS;She's not here!
1192;LAURA;That's crazy.
1193;SAM;Give her one more good poke.
1194;TALIESIN;How do we get in contact with you when we know when we move and how?
1195;MATT;"""""Well, what is your next step through your journey?"""""
1196;TALIESIN;That is the question. Now that everything's on the table, I'm sorry to shock everyone. I was hoping not to be the cause of it.|I was hoping that it was time for everything to be on the table. But this is actually what we're dealing with. This is the complexity. This is the battlefield.
1197;TRAVIS;So we have to rally our forces to us, and we have to do some really smart recon. Do we make her a part of that or no?
1198;TALIESIN;No, the more distance that we keep, the better.
1199;SAM;From her?
1200;TALIESIN;Yes. She will probably be, I imagine, in our way on occasion.
1201;LIAM;But no one make any mistake. She's lying to our faces. She is not telling us what she wants or what she wants to do. You have a whole plan!
1202;MATT;"""""Assume what you will."""""
1203;LIAM;Shut the fuck up! You've been droning on for an hour! Shut the fuck up. You're not telling us what you want. You fucking shit bag. Fuck you!
1204;MATT;"""""Keep great company."""""
1205;LIAM;Does anyone really believe that this is all going to be fixed if we work with her?
1206;MARISHA;I say we take a recess. Gather our thoughts. Raishan, my offer still stands. If you want to come and find me, I know you know how.|Maybe we can commune with Melora together.
1207;MATT;"""""You do not comprehend the magics that you even speak of. It's cute. Look, I agree. Distance is of aid to us at the moment. If anything, I should probably cut off the information of Vorugal's fall. I should speak with the Cinder King and still establish my allegiance from his perspective."""""
1208;TALIESIN;Can you cut off that information? I would imagine that would be far too much.
1209;MATT;"""""Cut it off, no. But I can attempt to guide the fury, if you will."""""
1210;LAURA;Will he know it was us?
1211;MATT;"""""I can guarantee it."""""
1212;TRAVIS;Can you keep him from attacking Whitestone?
1213;MATT;"""""For a time, maybe."""""
1214;MARISHA;Can you guide his fury in a way that would be beneficial to the plan?
1215;MATT;"""""If I knew what the plan was, yes."""""
1216;MARISHA;You were saying ideally, if we could get him away?
1217;TALIESIN;I don't think we're going to get him away--
1218;SAM;We're going to do recon. We're going to send out word to gather our forces-- where?
1219;TALIESIN;What if he knew where we were?
1220;TRAVIS;We don't know yet.
1221;SAM;Let's find out, let's pick a place.
1222;TALIESIN;What if you knew where we were? What if we found a place? We pick our battleground. He discovers where we're hiding.
1223;MARISHA;And Raishan rats us out.
1224;TALIESIN;And Raishan discovers this information.
1225;MARISHA;Would certainly put you in the good graces of the Cinder King.
1226;MATT;Raishan takes a moment and thinks.
1227;TALIESIN;You are searching for us right now, are you not?
1228;MATT;"""""I am indeed, but Thordak has been using us as the attack."""""
1229;LIAM;Yeah, he's not going to leave his nest.
1230;LAURA;So what if we kill you?
1231;MATT;"""""What do you mean?"""""
1232;LAURA;How does Thordak know you're alive?
1233;MATT;"""""Because I check in every now and then to remind him."""""
1234;LAURA;What if he sends you out, and we kill you?
1235;MARISHA;And you never come back? He'd be forced to be the one to have to leave the battlefield.
1236;TALIESIN;If he knew where you were headed.
1237;MARISHA;You're a clever girl. I'm sure you can make a ruse to make you look convincingly dead.
1238;TALIESIN;You wouldn't even have to tell us where you were hiding. You could just hide. And we could ready ourselves.
1239;MATT;"""""That is an idea. Hmm. Take your recess.|I'll take mine. There may be something to this plot."""""
1240;MARISHA;And we can all assume that when we exit this room, that our tenuous alliance is still that. Correct?
1241;MATT;"""""I would hope that there's no more errant blade pokery?"""""
1242;TALIESIN;Now that I know your tricks.
1243;LAURA;We do it to everyone. Don't worry.
1244;TALIESIN;We actually do, now that I think about it.
1245;MARISHA;Yeah, that's kind of true.
1246;LIAM;We're also not alone here. Allura, how does this sit with you?
1247;MATT;"Allura is sitting right now, she's listening to everything with her hands crossed. Shakes her head and goes, """"To be perfectly honest, this bothers me a great deal. But the fact that Whitestone still stands does speak volumes at the least."""""
1248;TALIESIN;It does.
1249;MATT;"""""With the cards being in our favor."""""
1250;TALIESIN;It's not the first devil I've made a deal with.
1251;MATT;"""""No."""""
1252;LAURA;Doesn't always turn out well, Percival.
1253;TALIESIN;Doesn't always turn out terribly, either.
1254;MATT;"""""Regardless, I have a lot to think about. As do we all."""" And Allura slowly turns her head and looks up, probably for the first time since she sat down, to the illusory Raishan's Asum form.|""""Asum lives, then?"""" """"Indeed he does. Indeed he does."""" And Allura turns her head back and goes--"
1255;MARISHA;Can I do an insight check?
1256;MATT;Go for it.
1257;MARISHA;Does she know if Asum is up to something no good? 25, I think? Better double check that. 25.
1258;MATT;25? Okay. It's hard to read the demeanor of Raishan in general. It's this middle ground of neutral expression with a half-cocked grin.|Information flows at this consistent rate of being generally difficult to read. The beat of hesitation is meant for emphasis, more than covering, if that makes any sense. So it seems to have an honesty to it, if you could read any honesty from Raishan.
1259;LAURA;Raishan, now that we know you're you, do you have to continue the ruse of being Asum, or can you bring him here?
1260;MATT;"""""I can certainly bring him here if you'd like. However, he is doing quite a lot of good with the Clasp, and Brom and Tofor underneath Emon right now, and they've managed to save many lives and continue to do so."""""
1261;LAURA;Maybe you could pop him over then? Just for a little bit.
1262;MATT;"""""Well--"""""
1263;LAURA;You're quite powerful.
1264;MATT;"""""What do you have need for Asum?"""""
1265;LAURA;I want to hear what's going on with the Clasp. I want to see for myself that he's alive.
1266;TALIESIN;We're actually going to have to have a conversation with the Clasp, because we're going to purge the city once the dragon is gone.
1267;MATT;"""""Why don't you go see him yourself?"""""
1268;TRAVIS;No, I like her idea. I want to see him here.
1269;LIAM;Yeah. I feel a little better here. It would go a long way to earning some trust.
1270;MATT;"""""Well, make your choice. Either I intercept and begin to work towards Thordak's ruse and set a space that convinces him perhaps I've fallen into your hands, or I go retrieve your friend from Emon. I'm not your errand boy, and we have a limited time here. Which is more important?"""""
1271;TRAVIS;Sure you are. You are our errand boy. We are your vessel to what it is you want. So get busy, and do it quickly. After all, you're very powerful. But that changes day by day, doesn't it?
1272;MATT;"""""So, Emon it is. Very well. Back in a day."""""
1273;TALIESIN;We will start figuring out and discussing a place for the final battle. We will find a place that is advantageous. Your input, if you feel the urge to give it, is always welcome.|At least to me.
1274;MATT;"""""It's going to be very difficult to pry the Cinder King from his nest."""""
1275;TALIESIN;Your supposed death will go far for that.
1276;MATT;"""""If anything, but I have no guarantees."""""
1277;TALIESIN;As long as everything is on the up and up, and as long as we do not catch you in deep deceit.
1278;LIAM;(whispers) Good luck with that.
1279;TALIESIN;We will make sure that the plan moves in the direction it is meant to.
1280;MATT;"""""One day then."""""
1281;TRAVIS;One day.
1282;MATT;And the image (disappearing noise).
1283;TALIESIN;He's going to send Asum to us.
1284;TRAVIS;So Allura, so it's clear: Seeker Asum is Raishan.
1285;TALIESIN;And has been since Raishan's appearance in Whitestone.
1286;MARISHA;And we didn't know until 48 hours ago? Tops?
1287;TALIESIN;Now, can we maybe make sure that everybody in the room is who they say they are?
1288;SAM;Go stab everyone, Percy. One at a time.
1289;MATT;As you say that, everyone pulls back from the table.
1290;LAURA;I'm a dragon too! (evil laugh)
1291;LIAM;Hi. Larkin.
1292;MATT;There he is!
1293;TALIESIN;I apologize. I didn't know what else to do.
1294;LAURA;You thought you were going to stab him!
1295;LIAM;Yes you did, Percival.
1296;LAURA;That was not a play!
1297;TRAVIS;"Yeah, let's be real about it. """"No tricks in this room!"""""
1298;LIAM;Yeah, you shifted gears very quickly there.
1299;LAURA;No tricks.
1300;TALIESIN;I've told no lies in this room.
1301;LIAM;Uh-huh.
1302;TRAVIS;(fake cough) Whiff!
1303;TALIESIN;I tell that creature no lies. Ever. That is a green dragon. There is no tricking it, there is no deceiving it. There is just telling as much truth as you can get away with.
1304;MATT;"As you're talking, you feel a tug on your right arm. And you look over and you see Cassandra, who has come over to your side and is pulling on your sleeve with a very intense look in her eye. She goes, """"Percival. I can watch Whitestone. I can get the people fed. I can keep the people armed. I can organize the day to day. I can't keep it safe from that."""""
1305;TALIESIN;Which is why I would ask everyone to please not antagonize it.
1306;MATT;"""""Percival. Percival! I don't know what you dragged us into in this, but I need you to pull us out of it. I can't do this."""""
1307;TALIESIN;I've moved the battle. That is the best that I know how.
1308;MATT;"""""How long have you known?"""""
1309;TALIESIN;Two days.
1310;LAURA;Not long, Cassandra.
1311;TALIESIN;Two days.
1312;SAM;Maybe three.
1313;MARISHA;We were forced.
1314;TALIESIN;The day before we left to kill the white dragon.
1315;SAM;There's a time difference.
1316;LAURA;And if we had told any of you, your life would have been in danger.
1317;TALIESIN;This was the best way I knew to keep her from destroying this city outright. This was the best way that kept her from telling the red dragon where we are. And the longer that we can keep her a tenuous ally, the longer Whitestone will stand.
1318;SAM;When she does come back with Asum, this plan that we started in on-- it's a good one?
1319;TALIESIN;I think so.
1320;SAM;"Well, we have Raishan convince Thordak that we're amassing forces in Kymal or something.|Thordak sends Raishan to get us. We """"kill"""" Raishan."
1321;LAURA;Mm-hmm.
1322;SAM;And then Thordak comes to check on our dead bodies?
1323;TALIESIN;We send word of a dead dragon.
1324;SAM;How can that plan fail?
1325;LIAM;I mean, I'm not the only one who thinks she's more dangerous than he is at this point.
1326;LAURA;Oh yes. I think if we give her access to Thordak's body afterwards, we're asking for a lot of trouble.
1327;TALIESIN;Which is why if Keyleth can figure out a way to cure her of this disease, it takes a big card off the table.
1328;LIAM;We've got 24 hours.
1329;MARISHA;I have ideas.
1330;TALIESIN;We have more than that, because it's going to take quite a while. That's how long we have to make a plan.
1331;LAURA;Question. What if we do actually just kill her?
1332;SAM;Raishan?
1333;LAURA;When we fake that we're killing her, what if we kill her?
1334;MARISHA;Just actually kill her?
1335;TALIESIN;She's going to be expecting that, and it will not work.
1336;TRAVIS;And she's super slippery. She just totally like evaded Percy's sneak stabby-stab.
1337;LIAM;Is there anyone around right now?
1338;MATT;Oh yeah, no. Allura, Drake--
1339;LIAM;20, natural 20! For perception.
1340;MATT;For perception?
1341;LIAM;"Yeah. I said, """"Is anyone around?"""" and I rolled a 20."
1342;MATT;You guys are still in the war room.
1343;LIAM;I know, but you know what I'm talking about.|You know what I'm talking about.
1344;MATT;Oh!
1345;LIAM;There it is, it's right there. Invisible fucking Larkin dwarf dragon.
1346;MATT;You don't see anybody else around.
1347;LIAM;All right. That's a 20.
1348;LAURA;Should we continue this conversation downstairs?
1349;TALIESIN;First, is everybody who they say they are? Please, if you would be so kind.
1350;TRAVIS;Oh yeah, Allura. Can we light your sage real quick, make sure everybody's on the up and up?
1351;MATT;"Allura sits up and says, """"Well, I mean, it makes sense. Asum is the one that requested we not move the war room down to the--"""""
1352;TALIESIN;So why don't we move the war room now?
1353;MATT;"""""I think that would be the best, yes. Let us all adjourn to the new space at the ziggurat. That should at least keep things honest."""""
1354;TRAVIS;Yeah.
1355;MATT;Allura picks her robes up and--
1356;SAM;Grog, your beard might go away.
1357;LAURA;(gasps) No!
1358;TRAVIS;No, it's in there.
1359;TALIESIN;It just won't grow while he's down there.
1360;LIAM;I mean for science, right? Let's go. You look really good without a beard, Grog. I've always thought so.
1361;TRAVIS;You shut up, you.|(laughter)|We can go down there, I don't care.
1362;TALIESIN;All right.
1363;MATT;Okay. You guys make your way down to the ziggurat. The guards come and start carrying chairs and other elements of the war room.|Eventually, you're all led down through the tunnels, which have been a little more refined and given an actual more comfortable path past the now-defunct whitestone refinery that the Briarwoods had originally established. You enter the ziggurat room. It has more lighting to it than it previously did. A number of torches now line the walls, the sconces that are lit as the guards progress upward. You can see the reflection to the green glass-like Whitestone material that permeates the outside of the ziggurat. And not right by it, but partially upward there's a small wooden platform that's been where the main base of operations for research and study is here. You see a number of desks set out. It's been built alongside of the large pyramid-type structure. And eventually, you all adjourn up into that space. As you go up there, you all feel a significant drop in enchantment. All of your magical items, all of everything, gradually fades in this space. So, Grog, you actually feel your musculature-- the Titanstone Gauntlets themselves, the effect begins to completely fade back to your classic, Grog-like strength.
1364;TRAVIS;I feel totally fine.
1365;LAURA;Are the walls still like people?
1366;MATT;Oh, do you want to go to the top of the ziggurat and check?
1367;MARISHA;Oh.
1368;TALIESIN;Not yet. After the meeting.
1369;MARISHA;Did they have like a clean-up crew down there?
1370;TALIESIN;"It's a guy on a scaffold with a scrub brush going, """"Ew. Ew."""""
1371;LAURA;They're really clean naked bodies now.
1372;LIAM;Brush cleaning out the fingernails.
1373;MATT;At this point, they're looking around.|Everyone who's journeyed with you towards this new meeting place, the ziggurat, is of the same physicality they were at the meeting room. Any illusions that would have been cast aside or dispelled at this point seem to not be present. So everyone is, by all intents and purposes, who they say they are.
1374;SAM;Okay.
1375;TALIESIN;And this also means it would probably be impossible to scry in this room.
1376;MARISHA;Yes.
1377;MATT;"Allura nods. """"Yes, actually. Yes."""""
1378;TALIESIN;Excellent. This is where all talk must happen now.
1379;LAURA;Where it should have been happening.
1380;TALIESIN;So now you know what we've been dealing with for the past 72 hours. She did help with the death of that dragon. In fact, I doubt we would have survived without her aid. She could have very easily left us there to die.
1381;LAURA;It's true. She actually revealed her entire form during the battle. Which is quite diseased.
1382;TALIESIN;At least it appeared diseased.
1383;MARISHA;She's definitely not as strong as the others, but far more clever.
1384;TALIESIN;And she knows where we are. And what our plans are. And every inch of this place. Including this thing.
1385;MATT;"""""Well then, what do you presume we do?"""""
1386;SAM;We don't really have a choice, we have to work with her to some extent. We can make it hard for her, and we can be assholes to her, and go tell her to get Asum for us. But other than that, we have to work with her.
1387;LIAM;What's the benefit of working with her?
1388;SAM;Because if we don't, she can destroy Whitestone whenever she feels like it.
1389;LIAM;What if we tell her we're going to fake her death, and then we kill her for real?
1390;SAM;That's fine, if she ever gets close enough for us to kill her.
1391;TALIESIN;She's not going to.
1392;TRAVIS;She evaded it really easy.
1393;SAM;"Why would she need to come face to face with us in that plan, ever? She could say, """"I'm going to go meet them in Kymal. Oh, I died!"""""
1394;TALIESIN;Our best bet is maybe-- hopefully enough of us still have our strength. Maybe at the end if she has been ravaged by the red dragon.
1395;TRAVIS;I agree.
1396;LAURA;And then we try to defeat her after that?
1397;TRAVIS;I agree. Our play is the finish line.|That's it. Not a moment before.
1398;LAURA;But we have to beat her to it. If she gets a hold of that stone--
1399;MARISHA;It's what she wants.
1400;LAURA;Yes.
1401;TALIESIN;Our hope is to break the stone.
1402;MARISHA;We can't break the stone.
1403;TALIESIN;Only because no one has.
1404;SAM;If we draw Thordak to us, at least we control the battlefield. She could still be lying in wait to pounce on his body the second we kill him.
1405;LIAM;If. We have to hope that she's actually going to fight with us. She's done it once. We don't know that she's going to do it again. We don't know.
1406;MARISHA;They mentioned moving the stone that shouldn't have been able to have been moved.|Correct? They moved it inside of Thordak, and then Thordak left with the stone in him, right?
1407;TALIESIN;Yes, which I don't think should have been possible.
1408;MARISHA;Right. So how did they do it? Because I'm also looking at another thing that is supposedly immovable.
1409;LAURA, MARISHA, TALIESIN;Supposedly.
1410;TALIESIN;Oh, it's possible. Nothing is impossible.
1411;LAURA;Are you suggesting we put the vortex of doom inside one of us?
1412;MARISHA;Kind of, yeah. That's what I was--
1413;MATT;"Allura immediately puts her hands up and goes, """"No! No. No. No."""""
1414;MARISHA;There's got to be a way to move it.
1415;SAM;To do what, though?
1416;MATT;"""""This is an absence of magic. It is a void of magic. It is a maw that devours magic. The enchantment that we put within Thordak is pure magic."""""
1417;LIAM;And you've been working on it for months, and you are smarter than us.
1418;MATT;"""""Well."""""
1419;LAURA;Right. No way to transport it? None at all?
1420;MARISHA;It could be the only thing that could break the stone!
1421;LAURA;Think about it. If we could get that stone next to the vortex, he'd be fucked.
1422;MATT;"""""Right! So what, we take a few wooden two by fours and push it along? Look, everything I know, everything I've studied, everything I've spent my entire life working for is useless near that."""""
1423;LAURA;This is a temple to Ioun, right?
1424;MATT;"""""It was."""""
1425;LAURA;The goddess of knowledge?
1426;SAM;Sure.
1427;MATT;"""""The only person I know of who rightfully worshipped Ioun was Brom."""""
1428;LAURA;Brom?
1429;SAM;Of the Clasp?
1430;MATT;"""""Arbiter Brom. He was of the council with us."""""
1431;LAURA;And he's in Emon, potentially?
1432;MATT;"""""According to Raishan. With Tofor and--"""""
1433;LAURA;Brom's with Asum?
1434;MATT;"""""Yes."""""
1435;TALIESIN;What holds it there? It's a shame we can't open a giant door and push it down here.
1436;MARISHA;What did you just say?
1437;TALIESIN;We can't do it.
1438;MARISHA;What? Say it again, one more time?
1439;TALIESIN;It's a shame we can't open a giant door and push the dragon in here.
1440;SAM;How on earth could we--?
1441;TALIESIN;We couldn't do it. It won't work.|Because that side of the door won't open by its very nature. No door can be opened to this room.|No one can get in or out without someone walking.
1442;LAURA;You couldn't have used the gate scroll in here.
1443;TALIESIN;I'm trying to even conceive of a machine that could move this. But I don't understand why it's here in the first place.
1444;SAM;I don't think the secret to defeating Thordak is moving this thing.
1445;TALIESIN;It's a shame we couldn't. We have a line in the sand of how close we can get to this thing with magic, correct?
1446;MATT;"""""This way."""" And she leads you back down the ziggurat, out to the entrance where you guys entered this large chamber. And about 20 or so meters back, you can see there is a specific wooden support beam that is structured within this tunnel. And on that beam, elements of it are painted black. And she goes, """"This is the perimeter in which the siphon devours magic inward."""""
1447;MARISHA;How big is it? How big is it, roughly?
1448;MATT;What, the--?
1449;MARISHA;Perimeter.
1450;MATT;"""""I'd say it'd take a half-mile?"""""
1451;MARISHA;Damn, this place is really big. And it's encased in stone, yeah? Kind of, right? Were we encased in whitestone? Right?
1452;TALIESIN;In stone. I've got a terrible idea.
1453;MARISHA;Tell me!
1454;TALIESIN;What happens to magical creatures when they enter the circle? Have we experimented at all to find out what would happen to a magical creature? A creature whose very essence is magic?
1455;MATT;"""""I don't know."""""
1456;TALIESIN;(sighs) There's no humane way to do this.
1457;SAM;Sure there is! Kiki, get a fey creature in here.
1458;LAURA;Yeah, that's what I was thinking, send him in.
1459;MARISHA;Oh yeah, they die and they go right back to their plane.
1460;SAM;No, I think they just die.
1461;TALIESIN;And even if they do go back to their plane, they may not be able to in there, they may wither and actually die. I just wanted to put that on the table.
1462;MARISHA;Are you trying to make me feel better about any of this?
1463;TALIESIN;I don't want to lie to you about this.|I've been practicing intense levels of honesty, if not telling the whole truth.
1464;TRAVIS;Sidebar. Do we have all the Vestiges that the sphinx told us about?
1465;SAM;No.
1466;TRAVIS;What else is there?
1467;SAM;There's one in the Fire Plane.
1468;LIAM;Something for Pickle.
1469;MARISHA;The Dawn Martyr. Dawn Martyr?
1470;TRAVIS;I know I'm not the smartest one in the group, but we don't know what the fuck we're talking about with this little sphere. Why don't we go find that last Vestige and see what it turns up?
1471;LAURA;I don't know if we have a lot of time--
1472;TALIESIN;We have time. In a day.
1473;MARISHA;I mean, only if we--
1474;TALIESIN;In a day she returns. We chose a place, we move our forces in there. We have days where she could be looking for us, and then when she disappears it's going to take a day or two for him to really find out. It will be about three to four days before anything actually happens.
1475;SAM;What are we doing, going after this Vestige when-- can any of us even use it?
1476;MARISHA, LAURA;Pike.
1477;TRAVIS;Well, I can. Kima might. I'm not much for poetry, but it seems sort of poetic that Thordak came from the Fire Plane, and the last Vestige we're looking for is in the Fire Plane.
1478;MARISHA;Also, we might be able to find some information on the stone.
1479;LAURA;This is true.
1480;SAM;The Fire Plane isn't just like Dallas.
1481;TALIESIN;It actually is quite like Dallas. I think that's a very reasonable comparison.
1482;SAM;It's a horrible place where we could all die.
