;Player_Name;Transcription_Text
1319;MATT;Okay. You guys begin making your way towards the direction that Vex saw the guard. You start pushing through the crop, making your way to the edge, and at the point where these high crops end, it opens up into what looks like a heavy root-based field. Potatoes, carrots, things that are beneath the ground. You guys see across the way the two other farmers that were out there, the one that you saw being loosely beaten, they're both filling satchels and emptying them into two larger carts that are put up to horses, one of them a larger pony. You see what appears to be another hulking humanoid, taller than an average person, skin slightly gray, a smattering of tattoos across the body. You recognize--
1320;LIAM;And best we can tell, he's the only guard? The only one?
1321;TRAVIS;No, there's two. There's two.
1322;LAURA;I have an idea!
1323;SAM;Wait, he was about to tell us who it is.
1324;MATT;From what you can see, you actually recognize this individual.
1325;TRAVIS;Fucking nipple tassels!
1326;MATT;This is an individual that you knew quite a ways ago, a young goliath who was still about a half a foot shorter than you when you knew him. He was named Horace, because he hated it, and Kevdak gave him this name and you actually, at some point in the past, recall even giving Horace a good beating. A little of the smaller of the goliaths you've encountered. This is years later. This punk kid, and he was kind of a punk, has grown up now, and is still smaller than you by a size, but still seems to be every bit of an agitating little bitch you remember, from the way that he's treating these people.
1327;TRAVIS;Is he holding anything?
1328;MATT;Not in his hand at the moment, no, but he does have across the back what looks to be some sort of large blade sheathed.
1329;LAURA;Can I give my idea?
1330;TRAVIS;Yep.
1331;LAURA;What if we ask Reginald to call for help, like he needs this fuck's help, and then he comes over, and then we spring a trap on him.
1332;MARISHA;That's not a bad idea.
1333;LAURA;I can use Hide in Plain Sight on us, and hide us, and make us look like we're part of the crops.
1334;TRAVIS;I love it.
1335;LAURA;To set an ambush.
1336;TRAVIS;I love it.
1337;LIAM;And the goal is to question this guy or to take him out? To question, yeah?
1338;TRAVIS;We're going to ask him questions, and if he makes a peep-- Hold on, before we do that. Can you see the other guard that was out here?
1339;MATT;Glancing about, because it is a pretty open area, you can see the secondary guard is walking away, looking to check one of the other homesteads. There is a farmhouse.
1340;TRAVIS;It's like Kansas, right, it's flat?
1341;MATT;Yep, it's flat farmland on the outside of Westruun. As soon as you break the south side of the Bramblewood, it's just plain.
1342;TRAVIS;What distance would you put him at? How far away would you put him? 100 yards?
1343;LAURA;The other guard?
1344;MATT;I'd say the other guard's probably a good 400 feet.
1345;TRAVIS;Do it.
1346;LAURA;Yeah?
1347;TRAVIS;Do it.
1348;LAURA;Can I take a minute to camouflage us and then tell Reginald to call him over?
1349;MATT;Yeah.
1350;TRAVIS;When he comes over, I grab him. Nobody do anything that's loud.
1351;LAURA;Got it.
1352;MATT;Okay. So, as you all take a moment, stepping into parts of the stalks of the edge of this land, Vex, you go ahead and start taking up leaves, patches of dirt, mud from freshly watered ground, and you start smattering the rest of the group with it. You guys are going full Arnold from Predator. You begin to blend into the vicinity.
1353;MARISHA;Question. Could I work with Percy?
1354;TALIESIN;Yes?
1355;MARISHA;I have Entangle learned today. Could we fashion a quick Entangle trap, where when the guy steps into it he'll be entangled? Or I could maybe just be prepared for it?
1356;MATT;You can be prepared for it when it happens.
1357;MARISHA;I'll be prepared for it.
1358;TALIESIN;I'm going to draw her a little sketch of something that would spring, that you can make out of wood.
1359;MATT;The spell expends when cast, so it's more of waiting to release it. To make it as part of a set trap, that would be a consumable trap you would have to construct.
1360;MARISHA;All right. I'll just be prepped with it.
1361;MATT;Okay. So you guys all have hidden.
1362;LAURA;Reginald.
1363;MATT;"He's behind you guys, watching all of this happen. """"Yes?"""""
1364;LAURA;Act like you're still picking and act like you hurt your ankle, and call for help from that guard over there. We'll protect you.
1365;MATT;"""""Promise?"""""
1366;TRAVIS;Yeah, I promise.
1367;MARISHA;And try and maybe keep a bit of a distance, because I'm going to be doing a trap here. It's going to be 20 feet. You don't want to be in it.
1368;LAURA;Just step back and call for help.
1369;MARISHA;Just step back, all right?
1370;MATT;"So you guys are all working on the very edge of where these crop fields begin. Reginald pushes through a little bit, and goes, """"Ow! Ow! Ow!"""" You hear in the distance a voice go, """"Hey you! What's your problem?"""" He goes, """"My ankle!"""" And he starts hobbling into the crop. """"You shut your trap! It's your fucking ankle! What's that stupid-- Oh, you--"""" (grunts) He starts lumbering up. """"I'm going to teach you about letting a peep out of that stupid maw of yours! I'm going to beat that face so hard it can't make a noise ever again! Stupid git!"""""
1371;TALIESIN;And now.
1372;MARISHA;(whoosh)
1373;LAURA;The minute he's in the high crops so he's out of visual from the other guard.
1374;MATT;Okay. So as soon as he steps into the high crop area.
1375;MARISHA;I'm waiting for Percy's cue.
1376;TALIESIN;Now!
1377;MATT;All right. So what are the specifics of the Entanglement spell?
1378;MARISHA;20 feet.
1379;SAM;It always works and it catches whoever you want!
1380;MARISHA;It always works...
1381;MATT;All of a sudden all of the crops, all of the large stalks and vines start (whoosh) wrapping around his body.
1382;LAURA;Shit, mother bitch!
1383;SAM;What's wrong?
1384;LAURA;That's a bit obvious.
1385;MARISHA;Is it obvious?
1386;MATT;It's once he's inside the area, so it's not like the wall on the outside.
1387;LAURA;Okay. I was picturing all the plants suddenly losing their shit.
1388;MATT;No, just the ones in the immediate vicinity.
1389;SAM;Like a used car lot?
1390;MATT;Okay, so he's going to attempt to make a strength saving throw.
1391;LIAM;I'm going to squat at the edge of the high crops and keep an eye on the other guard who was walking off just to make sure he's oblivious.
1392;MATT;Make a perception check, if you could, Vax.|Surprised so he has disadvantage on the saving throw. What's the DC?
1393;MARISHA;Me? 19.
1394;MATT;19? That's a failure. All right, and what?
1395;LIAM;28.
1396;MATT;"28! Yeah, Vax, keeping an eye, the guard doesn't seem to have kept notice and continues walking off towards the distant farmhouse. The plants all wrap around his body and he: """"What's this? Stupid-- """""
1397;TRAVIS;I run over and I tackle him, knock him to the ground, put my hand over his mouth, punch him in the forehead. Punch him again. Punch him a third time. And I barely lift my hand.
1398;MATT;"""""You motherfucker-- """""
1399;TRAVIS;Punch him again.
1400;MATT;At this point, now he's got blood pouring out of the corner of the eye. One eye has gone a little red from burst vessels. You can see it starting to swell up already. Blood's now pouring out the side of the nose where you've hit it, and he's still fighting even though the plants have kept him entangled. As soon as the calm comes to him (heavy breathing).
1401;TRAVIS;(sing-song) Horace.
1402;MATT;"The eyes go wide and all the tension in the body loosens. """"Fucking hell."""""
1403;TRAVIS;(muffled) Fucking hell.
1404;MATT;"You're still holding his face? (muffled) """"Fucking hell."""""
1405;TRAVIS;I'm going to move my hand. If you make a sound, wash, rinse, repeat, yeah? Nod.|Shut the fuck up.
1406;MATT;He spits a couple teeth out the side of his mouth.
1407;TRAVIS;You're looking big.
1408;MATT;"""""You're supposed to be dead. You're supposed to be fucking dead. I watched you beaten to death.|Why the fuck are you still alive?"""""
1409;TRAVIS;Yeah, right. Funny thing about me. So look, who else is out in this field with you right now?
1410;MATT;"""""No one. It's me and Cole, but Cole's heading back to the city. We have other ones passed out around, but most of them stay in town, especially during the day. That's where the festivities are."""""
1411;LAURA;Festivities?
1412;MATT;"""""Do you want back in? You're alive, man. Now's the time. It's a good time for the herd."""""
1413;TRAVIS;Yeah, no I want back in, for sure. That's what I've come here for: to come back in. But here's the thing. It's a bit of a surprise, right? Other people haven't seen me. You like a good surprise, right, Horace?
1414;MATT;"""""Yeah?"""""
1415;TRAVIS;Yeah. I thought you might. Here's my question: have you seen my cousin Zanror? Is he in the city?
1416;MATT;"""""Probably, aye."""""
1417;TRAVIS;Right. And what about Kevdak?
1418;MATT;"""""Kevdak stays in the city, as well. Up at the old Margrave's place, actually. Turned it into his palace. Want me to take you?"""""
1419;TALIESIN;Before we go any further, what do I roll if I want to find out if Horace really does like surprises? I'm not kidding.
1420;MATT;Make an insight check. All of you guys are still hidden, by the way, unless you want to do something.
1421;TALIESIN;No, I'm just watching.
1422;LAURA;And we gained another plus ten, so now we have plus 20 to all of our stealth, by the way, from that Hide in Plain Sight.
1423;SAM;Wait, what?
1424;LAURA;We have Pass Without a Trace, which adds plus ten, Hide in Plain Sight adds plus ten.|That's what I camouflaged us fucking for.
1425;SAM;How do you have all these things?
1426;MATT;All of you guys make another stealth check with plus 20.
1427;MARISHA;Natural 20, so 40. Actually, I have a stealth of seven.
1428;LAURA;46.
1429;TALIESIN;43.
1430;MARISHA;47.
1431;MATT;You guys have never been seen.|Retroactively, no one's ever seen you in your entire lives.
1432;TALIESIN;I could fire my gun, at this point, and they'd be like, oh, rain's coming.
1433;MATT;If it was Bad News, it would still probably break stealth.
1434;TALIESIN;Well, if it was Bad News, yeah.
1435;MATT;"Okay, unless you rolled a one. Yeah, no.|(laughs) Horace hasn't seen anyone.|""""I could take you in."""""
1436;TRAVIS;Right, listen. I was going to pounce on this poor farmer over here, but I saw you were obviously keeping your eye on him. Why are you doing that?
1437;MATT;"""""Which one are you talking about? Reggie?"""""
1438;TRAVIS;Yeah. Old Broken Foot over here.
1439;MATT;"(laughs) """"He's a little bitch, that one is.|No, but you know what? I caught him sniffing around. I think he's keeping some gold hidden."""""
1440;TRAVIS;Really? Gold? This poor farmer?
1441;MATT;"""""Twisted his arm a couple of times."""""
1442;TRAVIS;Have you?
1443;MATT;"""""We could do this for old times' sake. Each take an arm, pull until he tells us."""""
1444;TRAVIS;Oh, like wishbone?
1445;MATT;"""""Yeah."""""
1446;TRAVIS;Yeah, that does sound like a good idea.|Here's my thing. Why are you guys in this city? It's not really our thing to be in civilized places.
1447;MATT;"""""Here's the thing. Let me get loose here for a minute. I'm feeling a bit uncomfortable."""""
1448;TRAVIS;No, I don't think I will, Horace.
1449;MATT;"""""Okay. We were heading up north. We took out a small caravan just south of the road cuts, near the Silvercut Way, and all of a sudden out of the sky, we saw these streaking dragons come through.|Largest I've ever seen. Dangerous as the day's long. So we fled. We watched them come here and tear into this city. Rend it, destroy it, smoke and flames and ice and all sorts of craziness. And they kept going. We figured, dragons come, didn't take the spoils, there's plenty of spoils for us.|More than we could ever dream of. Most of it's pretty well-guarded, but there couldn't be much left over there. So we gathered up who we had, and mind you, the herd's swelled a bit since you left, my friend. We conquered another wandering tribe last year. Zanror took the head of their leader and commanded them to join. We're about a hundred strong these days."""""
1450;TRAVIS;Jesus.
1451;MARISHA;Fuck.
1452;MATT;"""""Pecking order. Still us goliaths at the top. We got all sorts of other piddly men."""""
1453;TRAVIS;Really?
1454;MATT;"""""Half-men, half-orcs. A few brutalized elves here and there. They make cooking easy. Anyway, we took that moment and we rushed into the town. Took it before the day was over. Killed all who didn't bow before Kevdak himself. Days of revelry ensued, my friend. Oh, you missed out. Wine, women, gold.|We took what we wanted until one of them dragons came back. Black one. Scary. Killed a lot of us.|We weren't so much a hundred strong then, but by the end of that we had 50 or 60 to our name before the anger finally stopped. Kevdak bent a knee and made an offering to this dragon."""""
1455;TRAVIS;Kevdak did?
1456;MATT;"""""I know. But trust me, you see a beast this size... it was survival through a mutual discussion, if you will. Promised our might to its worship, gathered our spoils, deliver it every now and then. We got to have the leftovers. We rule the city in its stead. Not a bad deal. Doesn't watch. We leave it what we find-- most of it, at least, we keep a little on the side-- and we live like kings here.|Westruun is now property of the herd."""""
1457;TRAVIS;Well, it sounds really good.
1458;MATT;"""""You've missed out, and there's quite a few openings now, since we've lost a few of the less than strong folk. You look strapping. I'm sure Kevdak would be more than happy to have you back."""""
1459;TRAVIS;I do. I've actually brought a few gifts.
1460;LAURA;(whispering) I notch an arrow.
1461;TRAVIS;I unsheathe Craven Edge.
1462;MATT;"""""That's a good blade."""""
1463;TRAVIS;Isn't it. And I ask out loud, are you hungry?
1464;MATT;"""""It's been probably half a day since breakfast. Aye. Why?"""" His expression begins to shift as realization begins to dawn on his face."
1465;TRAVIS;I pull it back. I stick the point in between his ribcage, and I drive it up through him.|(shocked noises)
1466;MATT;Before he can say a word-- he tries to speak through the pain, but it's met with the gurgle as various bodily fluids fill the inside of his lungs and throat.
1467;TRAVIS;Oh, more?
1468;MATT;The blade, now, you can see (choking noise) peeks through the back of the mouth as his eyes go ever so dull, the rest of the blood flow pouring out the sides of his mouth.
1469;TRAVIS;Pity that, acid reflux.
1470;LAURA;Grog! Oh shit. Good job, there.
1471;MARISHA;Vex?
1472;MATT;As this is happening, the blood that has filled the mouth begins to seep back into the mouth. The trails are still there, but what was once filled to the brim has been slowly recessed, swallowed. Not by the unmoving body of Horace, but the dark blade itself now drawing from the inside.
1473;LAURA;What the fuck is that sword, Grog?
1474;TRAVIS;What?
1475;LAURA;What is your sword doing?
1476;TRAVIS;Nothing. It takes in the strength of who it slays.
1477;LAURA;It takes in the blood?
1478;TRAVIS;Did it do that?
1479;LAURA;Grog.
1480;TRAVIS;What?
1481;SAM;You killed him. Was he related to you in some way?
1482;TRAVIS;I don't know. I remember him. He was always a little shit.
1483;MARISHA;Grog, do you remember killing him five seconds ago?
1484;TRAVIS;Who?
1485;MARISHA;Oh no. You guys.
1486;LAURA;The little dude. Your little friend?
1487;TRAVIS;Horace?
1488;LAURA;You killed him. On purpose?
1489;TRAVIS;Sure.
1490;LAURA;You wanted to?
1491;TRAVIS;Yeah, he was going to go tell about us.
1492;MARISHA;You were conscious of that?
1493;TRAVIS;What?
1494;MARISHA;Is it me?
1495;SAM;You're using too-big words.
1496;TRAVIS;So listen, right? Either we stay and do some recon, or we take out the other guy that's walking back to the city. Really shouldn't be a problem. But if they're all in there, 50 strong, I don't think we're quite ready for that. The sneaky fucks in our group could go take a look, if you're feeling randy.
1497;SAM;What would be our mission?
1498;TRAVIS;Info only.
1499;SAM;You killed this one quite easily.
1500;MARISHA;Very easily.
1501;TRAVIS;Yeah, but that's because we did it as a group.
1502;MARISHA;Did we?
1503;LAURA;Could we wait until nightfall?
1504;SAM;I'm going to check out his body. See if there's any booty on his body.
1505;LAURA;Well, as soon as we move, we won't be camouflaged in this crop anymore. We'll lose that.
1506;MARISHA;Yeah, we won't look like crops.
1507;MATT;As the stalks unwind, leaving his defiled body and you draw the blade free, Scanlan, you find, across the body, there is a simple, slightly chipped-but-still-functional greatsword that was sheathed in the back, wrapped in a haphazard hide that functioned as a scabbard. Mostly just leather pants, a few furs, looks to be a bone necklace and a bone bracelet around the wrist which looks to be teeth, human teeth. About 27 gold pieces in total change.
1508;TRAVIS;How far are we from the city here?
1509;MATT;About a five-minute walk.
1510;TRAVIS;Five-minute walk. That's not far.
1511;LAURA;Keyleth, can you use your powers to suck him into the ground so that nobody sees him?
1512;TALIESIN;I honestly don't think they're going to find him, anyway.
1513;LAURA;I use my abilities and try to camouflage the body so that nobody finds him.
1514;MATT;You pull him up into one of the walls of the plant stalks and set him in there, mounding up whatever bits of fallen leaves and dirt you can.|He's pretty well-hidden.
1515;MARISHA;I use my Druidcraft to grow some flowers on top of the dirt.
1516;MATT;Some flowers come up there. Some of the local leaves from the stalks bend down and help cover him up.
1517;TALIESIN;Leave a couple of his human teeth that he's collected--
1518;SAM;I'll leave all his human teeth, I'm not gonna take that shit.
1519;MARISHA;Great, so very successful trip. Stopping down.
1520;LAURA;Reggie?
1521;LIAM;His partner's still long-gone.
1522;TRAVIS;That guard?
1523;LAURA;The other guard, yeah?
1524;MATT;"The guard's gone. Reggie's still sitting there, watched this whole thing happen. Looking at you and goes, """"You did good. You did good."""""
1525;TRAVIS;I know I did. Just imagine what we'll do to the rest of them.
1526;MATT;"""""Thank you. Thank you."""""
1527;SAM;Are we going to do anything to the rest of them?
1528;LAURA;Right now?
1529;TALIESIN;I think we're going to go take a look.
1530;TRAVIS;I don't mind you taking a look, but be careful.
1531;TALIESIN;We can also still turn into mist.
1532;MARISHA;We can.
1533;LAURA;They can't hurt us when we're mist.
1534;SAM;We can all mist and go into the city and check it out.
1535;LAURA;See what we see.
1536;TALIESIN;Be fast and stealthy.
1537;LAURA;Can we stealth while we're misting?
1538;SAM;It doesn't matter if they see us, they can't do anything to us.
1539;MATT;Yeah, it would be being conscious of the cloud patterns in the sky, moving with the wind in a way where you become less noticeable as something strange. So it's possible.
1540;LAURA;Let's try that, so we can spy on the city! Get closer in.
1541;TRAVIS;It feels kind of cheap.
1542;LAURA;Why?
1543;TRAVIS;I don't know.
1544;LAURA;At least if we go in, Grog, we can see what we're up against.
1545;TRAVIS;Yeah, but can't we use our eyes? Just as they are. Do we have to turn to smoke this time?
1546;MARISHA;Why would we not?
1547;TRAVIS;It feels a little cowardly.
1548;LAURA;It's not cowardly, Grog, it's safe.
1549;SAM;You can stay behind.
1550;LIAM;What if Vex and I went as mist, just the two of us, quickly? Just the two of us.
1551;TRAVIS;Yeah, that's fine.
1552;TALIESIN;I may join you two for this as well.
1553;LAURA;All right.
1554;MARISHA;And what are the rest of us going to do? Just wait? Me, Scanlan, and Grog?
1555;TRAVIS;You can turn into a cloud, and float in there, and see what you want to see, but I'm not turning into mist when my herd is inside that city. If I go in, I'm going in.
1556;SAM;As Grog.
1557;TRAVIS;Yeah.
1558;MARISHA;So why don't we just not go in right now?
1559;SAM;Why don't you all go in, I'll stay back with Grog.
1560;TRAVIS;Thank you.
1561;LAURA;All right.
1562;TALIESIN;Not crazy-ish.
1563;MATT;All right, the four of you convert into mist form, crest up over the edge and start drifting your way over the top of Westruun, leaving Scanlan, Grog, and Reginald amongst the crops.
1564;TRAVIS;Reginald, you want some ale?
1565;MATT;"""""Do you have some?"""""
1566;TRAVIS;No, I do, yeah, hold on. Get the cask out, pour him a cup.
1567;MATT;He drinks thirstily, both because he seems genuinely thirsty, and second, it seems like he could use a long, hard drink.
1568;TRAVIS;Pace yourself, son, there's a lot that's here.
1569;MATT;"""""I've been drinking longer than you've been alive, friend."""" Just (guzzles)."
1570;TRAVIS;Wow. Another?
1571;MATT;"""""Yeah."""""
1572;TRAVIS;I'll keep them coming.
1573;MATT;And, for that, we'll take a quick break, come back here. See you guys here in a few minutes, and we'll continue this story. See you in a minute! [break]
1574;TALIESIN;Cock goblin.
1575;MATT;Welcome back! Ha ha, they got it on stream! Sorry, Liam, we're not as good as you are at it.|So, guys, quick note before we get back into the game. Apparently, the shirt link wasn't working earlier, it is working now. They got it functional, so go ahead and hop on now while you can. Returning from the break, as Grog and Scanlan sit, waiting to hear back from the rest of the team, traversing over towards Westruun, seeking information in their mist forms. The two of you remain behind. The four of you guys who are in mist form, where are you going?
1576;LAURA;Can we stealthily head towards a pocket of people? Do we see a crowd of people being held?
1577;MATT;This is your mist form?
1578;LAURA;This is my mist form.
1579;MATT;Ocean. I like it. I'd like you guys to make stealth checks.
1580;LAURA;Stealth checks!
1581;MARISHA;Do we still have Pass Without a Trace?
1582;LAURA;Yes! 39.
1583;LIAM;42.
1584;TALIESIN;33.
1585;MARISHA;24.
1586;MATT;You guys make your way across the rest of the fields. You head over Cole, you can see walking his way to the outside of the western side of the city. You come towards the bottom of the gate. You can see the rigid, small fence structure you noticed when you were far away from the city becomes more clearly visible. It is a series of spears and pikes that are set up as a barrier or a barricade to the outside world to Westruun. You do see adorned atop a number of them a few heads, varying sizes, various people, various ages.
1587;MARISHA;Does this appear to be goliath-built?
1588;MATT;It's hard to say. It looks built.
1589;LAURA;And the spikes are facing inward towards the city, or outward?
1590;MATT;Outwards. There are breaks in it, but essentially it's partially a pseudo-defense mechanism, it's more as a warning, it's a point of intimidation.
1591;MARISHA;So does it look pretty jerry-rigged?
1592;MATT;Yeah. It's not anything too classically designed.
1593;LIAM;No flying buttresses?
1594;MATT;Not quite, no.
1595;TALIESIN;Doric columns, oh my god! Awful! Tacky!
1596;MATT;You coast over the outside wall and glance down within. You can see there are people wandering the town, townsfolk that are out in the streets. Many of them are in pairs or groups, two to four people, appear to be traveling from one place to another. Most of them are accompanied by one or two armed individuals. Some of the people have chains around their neck. You do see a number of these buildings are in ruins, patchwork places. Some are just crushed. Some appear to have been melted down, like the wood or stonework itself has been dissolved into a pile of matter.|You see places where fires have broken out and some places have burned into a giant cluster of ash and broken wood. A quick memory glance at this height, you start looking for specific areas that you recall from memory. One: you glance over and see where you first came to meet Pike, where she and Wilhand lived. That area is the area of town that was, apparently, salvaged from the battle. It still stands, there appears to be very minimal impact. As you give yourself enough closeness to check in, the red brick homestead of Wilhand does appear to be standing.
1597;LAURA;Can we see Wilhand anywhere?
1598;MATT;At this distance, no. You also note, towards the shopping district of Westruun, there is the shop of Abjurist Noja, one of your first enchanter friends who protected you during your first Winter's Crest.
1599;MARISHA;Yeah! He cast the protection spell on us!
1600;TALIESIN;This is making me feel very old.
1601;MATT;His structure is still standing as well. A few buildings around did not fare so well, but his shop and a number of other ones adjacent to it seem to still be standing. You can't really tell if they're functional, or how busy they are, or if anyone's doing anything with them, but that's still there. You do notice, though, at numerous parts of the street, there are just piles and piles of burnt wood and ash, like they're large burn piles that were set at different periods of time and have long since burned. Little bits of white, post-burning plumes that still smolder over the past few days. You're not quite sure what these piles contained at the time they were set ablaze.|There is still the worship district here. You have the various temples. Best you can glance, a few of them have been partially toppled. There is damage to some of the buildings. Still too far away to make out any specific details beyond that, some of the structures having taken a hit in previous conflicts. You're not sure from which source.
1602;LAURA;What about the mayor's house where we heard Horace--?
