;Player_Name;Transcription_Text
1395;MATT;You know of Amelia, though you-- No, you did see her last night. You hadn't seen her in a while. She was one of the people that was still in the town. She was peripheral to the battle with the dragon, but fled as soon as she saw it.|Unfortunately, dragons have that effect on people.|She was a little shamed by it, but you calmed her down. But you do know that she's safe and reachable.
1396;PATRICK;Yeah, she's around.
1397;LAURA;Where is everyone staying within the town? Are they scattered about or are they staying in a central location?
1398;PATRICK;We've organized places for people to sleep if they don't have places for themselves.|It's makeshift, but-- because it's been a couple of days, at this point?
1399;MATT;Yeah, it's been almost two days since the initial encounter.
1400;PATRICK;Right, so we've got triage camps set up.|I will say, some people are going to stay no matter what, and they have the right to stay, and that's their choice. I imagine some people will come back and rebuild here, but most people, they are ready to go. They miss their families.
1401;LAURA;An entire city.
1402;TALIESIN;We can build a dragon shelter. At the very least, that is something we can do.
1403;MARISHA;But these people are prisoners here. They feel like they're prisoners in their own home, and that's not a home.
1404;TRAVIS;Then we let them make their choice.
1405;TALIESIN;They'll do what they're going to do, but we can give them an option if things get hairy.
1406;LAURA;Let's make our way toward them, then.
1407;MATT;"Okay. You guys make your way towards town.|The largest concentration of survivors that you've been keeping tabs on actually aren't that far from Wilhand's home, in the area where most of the temples are constructed, which is generally considered one of the oldest and most protected areas of Westruun. There are two inns that are basically now ramshackle homes for sleep. There's bedspreads across the entire floor, all the tables and chairs have been moved out, and it's now just a giant room where people who had their homes destroyed come and sleep, not because it's comfortable, but because there's comfort and safety in numbers. People have gathered what belongings they still had that are worth anything or they might need for a journey. Many of them are still gathering bits of dried food and fruit and whatever, preparing for whatever the next step of their travels may be. But you probably have the bulk of the people in the town, other than a few older, very stubborn folks that are like, ""I'm going to stay in my home!"" The folks that stayed at Mt. St. Helens, where you're like, come on, guys, seriously? (laughter)"
1408;PATRICK;There's always some.
1409;MATT;"There's always some. But yeah, so as you approach and the door swings open to the first tavern, as you introduce them too, a few of the folks perk up. A few children who couldn't sleep look over. Two of the kids that recognize you run up, ""Uncle Kerrek!"" They run up and grab the side of your legs. Your chain mail clanks and you pick them up."
1410;ASHLEY;I look around for Wilhand.
1411;MATT;Wilhand is not amongst this group. Wilhand probably stayed safe within his home, which kept him safe up to this point, so far.
1412;TRAVIS;Do we see Amelia?
1413;MATT;Looking about, yes, you do see Amelia. She is asleep right now, though.
1414;SAM;Wake her up! Tell her her dad's dead!
1415;MARISHA;Hey, hey. It's really important. I need to tell you right now.
1416;ASHLEY;We see her?
1417;MATT;You see her. She's asleep. It's later in the day from the travel, you guys went down the mountain to even get here after you woke up in the morning. You spent most of the day getting back to Westruun, so you're getting pretty close to sunset. The group has been set off for the evening's travel toward the top of Gatshadow. She appears to have fallen asleep early.
1418;PATRICK;I'll start a few things, and I'll spread the word. Everybody could really use a bit of a party here. We don't have many resources, but I'm betting there's enough liquor for everybody to get good and drunk tonight.
1419;MATT;Oh yeah.
1420;PATRICK;"That's the resource there's always an abundance of at this point. We'll kind of put the word out, and honestly, I don't need to organize it. I can just say, ""Dragon's dead, and they did it. We're going to throw them a party tonight."" And I'm just going to let that happen."
1421;MATT;"And with each chain of that word spreading, the energy immediately lifts up within the room, and the building adjacent, and folks that were either resting or in a state of perpetual anxiousness suddenly brighten up, even with the dirt-smeared faces, you can see smiles poking out as people begin coming into the room to see those who slew the dragon that threatened them. People start coming up and shaking your hands, individuals who haven't seen you guys for years, people that lived down the street and gave you a passing hello in the younger days of your youth, are now coming up to you with a look of absolute appreciation and thanks. Just as that energy picks up, the wine and the ale begin to go throughout the area as stores of them beneath the taverns that were not found by the herd, as there were only so many members of the herd and a larger number of actual inns and taverns throughout the town, people start grabbing cups. Even some of the kids start coming up with cups, and the parents are like, ""Hmm, a little."" It's New Year's, you can have a sip."
1422;TALIESIN;It's medieval times, everybody drinks.
1423;MATT;Without much worry at that point, everyone's getting nice and liquored up, and happiness has ensued. Some folks pull out some meager instruments. There aren't a lot of extremely practiced bards, so your ears tweak a little at the sound of imperfect music, but there is honesty and joy coming from it, so you choose not to lend any sort of constructive criticism to the performers.|(laughter)
1424;TALIESIN;You sent the last of the decent bards out of town. It's all on you.
1425;LAURA;Can I hang out outside? I want to keep my eye on the skies.
1426;MATT;Yeah, not a worry. Go ahead and make a perception check.
1427;TALIESIN;I was about to say I was going to join you. I've had my fill of party.
1428;LIAM;Yes, I'm sure you were.
1429;LAURA;Wait, what is that? 32.
1430;LIAM;That's okay.
1431;MATT;32? All right. You look about the sky. It is clear. The dark clouds that had loomed towards the top of Gatshadow have since blown away. The starry night sky now spreads infinitely above you, and for the first time in a long time, knowing that the immediate danger is no longer chasing you, you take a minute to appreciate the sheer beauty of the view that Westruun always had. This brief moment to allow yourself to exhale helps remind you what all this is worth, and the importance of moments like this. You can hear the laughter behind you within the inn. You can hear the music.|You can hear the kids chuckling and telling jokes.|People clinking glasses together. And in this tiny little microcosm of a moment here, you let yourself silently smile, and really know what all of this is worth.
1432;TALIESIN;I'm going to join--
1433;MARISHA;About that time I reach and grab Percy's hand before he leaves the door. Percy. Percy!
1434;TALIESIN;What?
1435;MARISHA;This is giving me a lot of anxiety.|There's a lot of people here.
1436;TALIESIN;Is it about your feelings about Vax? Is that the whole problem right now?
1437;MARISHA;No.
1438;TALIESIN;I really don't--
1439;MARISHA;There's so many people calling us heroes.
1440;TALIESIN;Yes.
1441;MARISHA;We're not heroes.
1442;TALIESIN;We pretty much are, actually. I hate to tell you this.
1443;MARISHA;No. We're not, we're terrible people.|We're terrible people. Why are they telling us this? Oh, god. Oh, god, if I have to shake one more townsperson's hand. Oh, god. I feel like I was cursed. I was cursed. I don't want any of this. I don't want any of this!
1444;PATRICK;Do I spot that?
1445;MATT;You do. As you guys are having this conversation, Kerr walks over with a rosy grin on his face.
1446;PATRICK;Is this your first time?
1447;MARISHA;(hyperventilating) Hi. I'm Keyleth. Do you want to step outside?
1448;LAURA;I come back inside.
1449;PATRICK;Let's step outside.
1450;MARISHA;Okay!
1451;MATT;You guys pass Vex as she steps back into the tavern, passing you guys.
1452;LAURA;Pat her on the back. Drunk? Already?
1453;MARISHA;No, not enough.
1454;TALIESIN;Panic attack.
1455;MATT;As you step outside with Kerr, the cold night air comforting to you, hitting your face, hitting your lungs. It helps the breathing slow, and you have a moment of control over your emotions.
1456;MARISHA;(groan) Does the nausea always happen? Is that always a thing?
1457;PATRICK;Is it the people, or is it the fact that you have finally realized how pointless it all is? (surprised laughter)
1458;MARISHA;Maybe it's the fact that I feel like I've been lied to my entire god damn life, and it's all crashing down upon me right now.
1459;SAM;She's druish.
1460;MARISHA;So druish. So yeah, you could say-- how about a little bit of column A and a little bit of column B?
1461;PATRICK;Yeah.
1462;MARISHA;Yeah.
1463;PATRICK;Yeah.
1464;MARISHA;Yeah. How did you deal with it?
1465;PATRICK;I found other places where I could do good things.
1466;MARISHA;Really?
1467;PATRICK;Yeah.
1468;MARISHA;Like what?
1469;PATRICK;Like, I make wagon couples. The thing that hooks--
1470;MARISHA;Oh. I don't know exactly what you said.
1471;PATRICK;You have a wagon.
1472;MARISHA;Sure.
1473;PATRICK;And then you have a horse.
1474;MARISHA;Right, yeah.
1475;PATRICK;And then something needs to hook the horse to the wagon.
1476;MARISHA;Got you.
1477;PATRICK;And if you have a bad one of those, it breaks, and so people need good ones of those.
1478;MARISHA;I don't know at all what you just told me. I'm not going to lie. But I think I get the message.
1479;PATRICK;I'm guessing that you are bothered by the fact that no matter what you do, you seem to end up destroying more things than you fix.
1480;MARISHA;Yes! Jeez, you're like the first person-- no one else gets it.
1481;PATRICK;They don't get it, do they?
1482;MARISHA;No, they don't.
1483;PATRICK;No.
1484;MARISHA;Is that it? That's it? We will destroy everything we touch? We will cause more harm than good? We will carve a path of destruction and make it seem like we're doing good, and then people will worship us because they think we're heroes, when in the back of my head I'm thinking about all the death that has come by our hands?
1485;PATRICK;That can be a lot of it. I'm not going to lie to you about that.
1486;MARISHA;Yeah, you know, Kerr, you're not really helping make me feel better about this. I'm not going to lie.
1487;PATRICK;Well I imagine that your friends will tell you a lot of things that would make you feel real good. But I'm not one for short term solutions. I think that you're right. I think that you've obviously put a lot of thought into this.
1488;MARISHA;So much thought. I swear I've gotten nosebleeds. Keep going. That's beside the point.
1489;PATRICK;And I've known people like you before.|People who are very sensitive to this sort of thing. I have been the sort of person you are. And it's not simple. Your friend who lived here for a while, the big one, what's his name?
1490;MARISHA;Grog. Yeah.
1491;PATRICK;Right. He doesn't have this. He has the opposite of this. It's all good for him, right? And you're kind of jealous, aren't you?
1492;MARISHA;I so badly wish I could have what he has.
1493;PATRICK;But somebody has to look at the big picture. And sometimes that's us, and usually it's unpleasant. But somebody needs to do it.
1494;MARISHA;So you're saying this is my curse? This is my duty?
1495;PATRICK;I'm saying that-- (long pause). I'm saying that if you aren't careful, it will rip you apart from the inside, but that's not a long-term solution. That's just another piece of destruction. You need to find a way to live with the fact that you do what you can, because that's what you can control. And sometimes bad things happen anyway, and so you just have to decide where you're going to pick your hill. You find your hill. Everybody gets one hill, and you plant your flag and you can die on that one. But you have to be careful, because you only get one. If you're really unlucky, you get more than one.
1496;MARISHA;And what if the ultimate problem is that I feel like I've had zero control from the start, since birth? I didn't want any of this. I didn't want my abilities. I didn't know I was special until now. And I so desperately just want to be normal. I want to go back to being ignorance and bliss.
1497;PATRICK;Then I do have a momentary, short-term solution for you.
1498;MARISHA;Shoot.
1499;PATRICK;It's actually there, and I will get you another one.|(laughter)|It will help a little bit for now. It will smooth out some of the rough edges long enough for us to talk for a while. Because I've been down this road. Okay? The thing is, you're not wrong, and you're not crazy, but it's not hopeless, either.
1500;MARISHA;Okay. Thank you.
1501;PATRICK;I'll do maybe one of these. It feels like she wants one of these.
1502;MARISHA;Yeah, yeah.
1503;PATRICK;I can read that.
1504;MARISHA;I give in. Yeah. Yeah. You know, Kerr.
1505;PATRICK;Yes?
1506;MARISHA;Even surrounded--
1507;SAM;He stabbed you in the back.|(laughter)
1508;LIAM;The Chroma Conclave sends its regards! (laughter)
1509;MARISHA;So Game of Thrones.
1510;MATT;As he brings you into a warm hug, and at first, there is the resistance because this is a person you don't know.
1511;MARISHA;Yeah, and my headdress is a little wonky.
1512;MATT;A little wonky due to the drink, due to not concentrating. However, as much as you travel with your friends, this stranger has seemingly come to you with more wisdom and understanding of your continuous predicaments than anybody has in a long time, if at all, and you give into the hug and realize just how nice it is to have somebody understand.
1513;MARISHA;I was pretty much going to say that in character, but yeah, that's pretty much what I feel.
1514;MATT;Sorry.
1515;MARISHA;No, no, that's-- I wasn't-- Yeah. Yeah. I tell Kern--
1516;SAM;Kern?
1517;MARISHA;Car. Kerr.
1518;MATT;Somewhere in that neighborhood.
1519;MARISHA;Care Bear. I tell Kerr, even surrounded by friends, I often feel so alone. Thank you for being a friend, even though we just met.
1520;PATRICK;I get that.
1521;MATT;He brings you in. Gets you another drink.
1522;PATRICK;Actually, I'll bring another drink out to her.
1523;MATT;Oh, perfect. All right.
1524;MARISHA;It's crowded inside.
1525;TALIESIN;I stumble outside for a bit as well at this point.
1526;SAM;Meanwhile, I'm telling my table a story about how I won a cannonball contest last night.
1527;MATT;They are enraptured.
1528;SAM;It was in a dragon's lair! I was amazing.|(laughter)
1529;LAURA;Is Amelia awake at this point?
1530;MATT;Amelia has woken up due to the sound and noise, and she's wandering about with a drink in her hand now.
1531;ASHLEY;All right. We'll walk over to her.
1532;TRAVIS;I'll stay with you, but just behind you.
1533;LAURA;Amelia?
1534;MATT;"""Hi, yes! Thank you again for releasing me from the terrible stocks. I really appreciate that. Thank you for everything you've done for Westruun."""
1535;LAURA;Well, thank you for everything you've done.|I've heard amazing things about you and your family.
1536;MATT;"""We're meager folk. We come from very simple roots. I--"" And she takes a big, long sip of her flagon, sets it down on the table and wipes her mouth. ""Truth be told, I-- as soon as I saw that dragon, I ran straight away. I didn't-- You guys are the heroes. I didn't do anything."""
1537;LAURA;I sit down next to her.
1538;ASHLEY;I sit down next to her, too. (whispers) Should we just wait till the morning?
1539;LAURA;We have to do it right now. So. We knew-- your father is Reginald.
1540;MATT;"""Yes. Have you seen him?"""
1541;LAURA;Yes. He-- I take her hands. One of the bravest men I've ever had the honor of meeting.
1542;MATT;There's recognition in her eyes. Her head pulls back a bit. Her expression goes stoic as she sinks in the wordless reality that you've just bestowed upon her.
1543;LAURA;I know this can be-- I know how hard this is to hear. But none of this would have happened, none of this celebration would be possible without him. He sacrificed himself, so that all of us could live, and he spoke your name in the end. He wanted nothing more than for you to be taken care of.
1544;MATT;"(long pause) ""That sounds like Dad."" Wipes her eyes."
1545;LAURA;Would you like to pray, Pike?
1546;ASHLEY;I don't know if you're a woman of faith, but--
1547;MATT;"""What faith do you belong to?"""
1548;ASHLEY;I follow Sarenrae.
1549;MATT;"""Then, for the night, as do I."" She reaches over and takes her flagon, and the tears are streaming down her face in spite of her smile, and she looks to you both, and looks to you. ""To Reginald. To Dad."""
1550;TRAVIS;To Reggie.
1551;ASHLEY;To Reggie.
1552;MATT;And she starts weeping into her hands.
1553;TRAVIS;Amelia. You should also know, your father was a man of a few tricks. He told us that he had been saving this up for whenever you were old enough, but I think you should have it now. I hand her 400 gold pieces.
1554;MATT;"She looks up for a moment. ""How? How did-- they took everything."""
1555;LAURA;He hid it.
1556;MATT;"""This could help a lot of us. Okay."""
1557;TRAVIS;I think he knew you would do well with it.
1558;LAURA;Dear, there's more coming to the town. You take care of yourself.
1559;MATT;"(deep breath) ""We'll take care of each other. I think that's what he'd want."""
1560;TRAVIS;Aye.
1561;MATT;She grabs her flagon again and takes a big old sip, sets it down. Her eyes are dried a little bit. She wipes the last away.
1562;TRAVIS;I pour my flagon into hers.
1563;MATT;She laughs and drinks of it again.|Definitely embraced the idea that she's going to get really drunk tonight. She begins joining in, singing with the music. And the rest of the party picks up as the celebration once again fills the air. The rest of the folks gathering around.|(birds tweeting) Don't know why there were birds in that track.|(laughter)
1564;ASHLEY;Is it morning?
1565;MATT;There will be a lot of partying through the night, so probably it's an eventuality. However, we will take this moment to take a quick break to the restroom. We will return here for the next bit of this adventure, so we'll be right back here in a few minutes, guys. Stick around.|(cheering) [break]|Welcome back. So as you return here, bellies full, the evening of drinks, rabble-rousing, and stress release through conversation and laughter carries through until the morning light comes.|Everyone wakes up extremely hungover, but in a way that is well-earned and still worthy of the evening that transpired before it. You all come to consciousness, about midday at this time now.
1566;LAURA;Whoa.
1567;MATT;You all slept in after what happened.
1568;LIAM;I actually spent the night in a field with Reginald.
1569;SAM;Ew.
1570;MATT;You did.
1571;LIAM;That's your brain, man. I sat next to his body, waiting for people to come back, they never did. I piled some of Keyleth's flowers on his chest, and then I fell asleep, in the field, six feet away from him. Party!
1572;MARISHA;Did you think we were going to--
1573;LIAM;Yeah, well.
1574;MARISHA;Never mind.
1575;LIAM;I don't know.
1576;LAURA;Oh. Shit.
1577;LIAM;I don't know what I thought, but that's what I did.
1578;LAURA;Why didn't you check up on the earring, dude?
1579;LIAM;I wanted some space.
1580;MATT;So as you all come around to the breakfast morning, food is being cooked up within the kitchen by some of the various villagers that have taken up to help out with what they can in the area.|You start realizing that Vax is nowhere to be found and as this conversation begins to progress, he eventually finds you guys and waltzes into the groaning room of semi-conscious Westruun denizens.
1581;LAURA;(yawns) Where were you?
1582;LIAM;Getting a good night's sleep on a field of grass. How are you doing?
1583;MARISHA;We had a bender.
1584;LIAM;You need some water?
1585;MARISHA;Yeah.
1586;LIAM;Can you make some?
1587;LAURA;In that endless jug? Or does it only make beer and mayonnaise?
1588;MARISHA;Say water to the endless jug.
1589;TRAVIS;Yeah, it makes water.
1590;SAM;It seems like a waste.
1591;TRAVIS;Give me water like the ocean!
1592;SAM;Oh, no, no, no!
1593;TALIESIN;No!
1594;MATT;The jug is now filled with water to the top.
1595;TRAVIS;Yeah, look! Water.
1596;LAURA;Is it saltwater?
1597;MARISHA;I dip my finger in and take a taste.
1598;MATT;It is saltwater.
1599;LAURA;(groans) Damn it, Grog.
1600;TRAVIS;Did I do it wrong?
1601;SAM;You did it wrong.
1602;TALIESIN;You should try that, though. See if you like it.
1603;TRAVIS;Is there anybody else sleeping in the room?
1604;MATT;There are a few folks that are probably still sleeping off the drinking, but I'd say the majority of the folks have woken up in various states of grogginess.
1605;TRAVIS;(whispers) Hey, should we wake up the rest of the people with this?
1606;SAM;The people who've lost their city? You're going to prank them?
1607;TRAVIS;Well, I'm feeling a bit salty this morning.|(laughter)|I go outside and I dump it.
1608;MARISHA;I cast a Create Water spell so we can all have some water.
1609;MATT;Okay.
1610;LAURA;We should probably call everyone in the town to talk.
1611;MARISHA;Yeah, we should have a big meeting, let them decide what they want to do with the rest of their fucking lives.
1612;TALIESIN;What did you have to drink last night?
1613;LAURA;Is there a bartender or somebody that's running the inn that everyone's staying at? Or is it kind of makeshift--
1614;MATT;It's just kind of makeshift. However, whoever who once ran this place is no longer here, probably left with the first or second wave of evacuees. Everyone here is just kind of doing their part to keep it going.
1615;LAURA;Can I grab someone nearby that looks like they're up and about and actually accomplishing things?
1616;MATT;Yeah. There's an older woman who did not drink but just was around last evening who's done most of the cleaning-- and even though there's no reason to clean, she's still just kind of going through the motions of wiping down the counters and putting things away properly.
1617;LAURA;Dear heart, um--
1618;MATT;"""Yes?"""
1619;LAURA;Could you spread the word that there's going to be a town meeting?
1620;MATT;"""A town meeting? What for?"""
1621;LAURA;So we can talk about how to keep everyone safe, dear.
1622;MATT;"""All right."""
1623;LAURA;Yes. As soon as possible, can everyone meet here?
1624;SAM;No, the central--
1625;LAURA;In the center of town.
1626;SAM;Where we killed Kevdak.
1627;LAURA;Where the goliaths, where the barbarians-- sorry, Grog-- where all the mean people were.
1628;MATT;"""All right, I'll get the word out."" And she puts away a couple of towels and grabs a couple of people near her, and the three of them saunter out into the main walkway."
1629;SAM;Also, I don't know if he remembers, but sometime in our revelry last night, I asked Kerr if he could-- I gave him a sheath, just a sheath of a sword-- and I asked him if he could make just a little-- there's some metal components to it-- I was asking him if he could just make a little secret compartment on it. Like a place that you could hide a little vial or a little powder or a little note or something, just in the side of the sheath.
1630;PATRICK;What are the odds that I would make a total hash of that? (laughter)|I'm imagining I don't do that much delicate work.
1631;MATT;No. But also, how much did you drink last night?
1632;PATRICK;Oh, right! Yeah, I can totally do that.
1633;MATT;So, how much-- how drunk were you?
1634;PATRICK;You know, I probably was pretty modest.|I probably drank with her, to be social. And then I probably just kind of prowled and made sure nothing got out of hand and everyone was okay.|Yeah, I probably-- I'll take a shot at it. How attached to this sheath are you?
1635;TALIESIN;(snickers)
1636;SAM;Yes. Extremely.
1637;PATRICK;Extremely.|(laughter)|I'll see what I can do.
1638;LIAM;Just nail a sock on the side of it, it'll be great.|(laughter)
1639;SAM;I don't make the best decisions.
1640;MATT;Especially while drinking. You find your way back to your forge, which is still functional. It was not one of the buildings that fell on the initial attack. You heat it up late into the evening. It doesn't require a lot because it's smaller work. Go ahead and make a blacksmithing check with your proficiency bonus. Plus, with this, it would be dexterity. Because it's very, very minute work.
1641;SAM;Could I have inspired him?
1642;MATT;You could. Yes! You can very much do that.
1643;SAM;I will give him a limerick to inspire him with.
1644;MATT;Drunken Scanlan limerick, here we go!
1645;SAM;"Have you heard the legend of Shale? One eye, elderly, frail? To a black dragon, she told, ""You may be ancient, but I'm old!"" And somehow lived to tell the tale.|(cheering)"
1646;MATT;Go and take your d10 inspiration dice, if you want to add that to the roll.
1647;PATRICK;All right. So, just proficiency bonus--
1648;MATT;Plus your dex bonus.
1649;PATRICK;Yeah, my vast dex bonus. 16.
1650;MATT;16. That's not bad. It's not the finest craftsmanship in the world, and what once was a very, very beautifully detailed sheath to a weapon now has a somewhat hammered, dented element to it that you probably want to hide with a silk or something. It's an imperfection in what was a previously a perfect element, but it is functional. It is a small compartment that actually has a tiny metal slot that can be moved closed or open with your thumb.
1651;SAM;Great!
1652;MATT;It's functional. It's not pretty, but it is functional.
1653;PATRICK;We focus on function here.
