;Player_Name;Transcription_Text
680;TALIESIN;Especially with the head thing. It's quite nice.
681;MARISHA;Yeah, this is awesome. Does he still have the blessing?
682;MATT;The blessing has faded by now.
683;TALIESIN;You should get that tattooed in permanently.
684;MARISHA;Yeah.
685;SAM;That's a good idea.
686;TALIESIN;That's a really good idea.
687;MARISHA;I can draw on you with the remaining remnants. That way you have it there, always.
688;SAM;I love it.
689;MARISHA;Okay. I try to draw the outline of the remaining glyph on his head.
690;MATT;So you take some ash and charcoal from the nearby rubble and loosely draw the symbol on his forehead. Roll a dexterity check.
691;MARISHA;Okay. Straight dex? Don't fuck me, Gil! 14.
692;MATT;14. It's passable.
693;MARISHA;Yeah, that right there. That's perfect.|Get that tattooed.
694;SAM;All right. It's going to happen. I feel like we should all get a tattoo to commemorate this.
695;TALIESIN;On the forehead?
696;LAURA, MARISHA;Definitely on the forehead.
697;LIAM;Well, maybe in different places. We don't all need to get it in the same place. Maybe on a theme, but not the exact same thing?
698;LAURA;We already all got tattoos, didn't we?
699;TALIESIN;Well, we got tattoos. That's all that matters.
700;TRAVIS;No, we didn't.
701;MARISHA;I'm not sure what we're talking about anymore.
702;LAURA;No, I thought we got them in character.
703;MARISHA;No, he got them.
704;LIAM;I got one. And I got one.
705;LAURA;Oh, we got the Slayer's Take.
706;MARISHA;Wait, we're branded, and then I've got mine, and then he has his.
707;LIAM;I have the burnt hand on my back. Elven. No, it's not mostly healed. Scanlan Shorthalt! You don't need a gun to look cool. You are the Meat Man. You are Burt Reynolds. You are a fucking hero.
708;SAM;I'm going to throw it away. Wrist Pocket! (laughter)
709;MATT;Make a sleight of hand check.
710;SAM;Nine. 12.
711;MATT;12?
712;MARISHA;Bullshit! My passive perception is 21.
713;MATT;Yeah, you guys totally see him. It's the worst example--
714;LIAM;That's the trick I do for my eight-year-old!
715;TALIESIN;Look at it go! Wow! (laughter)
716;TRAVIS;You caught it?! You threw it--
717;SAM;Around the world.
718;TRAVIS;Oh my god! (laughter)|I faint.|(laughter)
719;LAURA;Hey, while he's out, should we get this sword off him?
720;LIAM;Why?
721;LAURA;Because it seems like he's a little weird from it. Nobody else feels that way?
722;TALIESIN;I think so.
723;TRAVIS;(gasps) You're so strong. What'd I miss?
724;LAURA;Nothing.
725;MARISHA;We were talking about you. I mean, we were talking about-- sorry, I'm still working on it.
726;LAURA;Yeah, no, it's getting better. Should we get off of the titan, maybe?
727;SAM;It could fall.
728;TALIESIN;Does anyone want to start walking towards the city to see how bad it really is?
729;LAURA;We'll have to get through the titan, or we can fly down. Outside of that, I don't know.
730;SAM;How many of us can fly? Well, I guess we could take a couple of trips on the carpet.
731;TALIESIN;We've got a carpet. Some of us have wings.
732;LIAM, MARISHA;My wings are gone.
733;MATT;"Yeah, your wings are gone. Pike's wings are gone. You guys have your broom; you have the carpet."
734;SAM;So we can take three trips on the carpet, or something?
735;TALIESIN;We can ride on the broom.
736;MARISHA;Have we taken a short rest, at this point?
737;MATT;Yeah, you guys would have taken a short rest, at this point.
738;MARISHA;My beast shape's back.
739;MATT;I'll say for the purposes of when you were helping with the ritual that he was casting, because that's an hour long, that would have been a short rest, easy.
740;LIAM;What are you going to be?
741;MARISHA;Well, what do you want to fly in on? What do you want?
742;LIAM;Dragon?
743;MARISHA;I can't do that. I can do anything in the animal kingdom.
744;TRAVIS;Before we go down, before we leave, what about Sylas?
745;LAURA;(gasps) Sylas.
746;MARISHA;He flew away.
747;LAURA;Right, but he's repairing somewhere.
748;TRAVIS;They have coffins, right?
749;LIAM;We deduced that it doesn't take him that long to come back together. And it's been--
750;MATT;Not terribly long.
751;LIAM;But we're right at that cutoff point.
752;MATT;Maybe.
753;TALIESIN;Try to scry on him! He's probably having a bad day. There's enough time.
754;MARISHA;I'll scry on him.
755;TALIESIN;There's a gold dragon that should be--
756;MARISHA;Oh, I haven't used any of my 5th-level spells!
757;LAURA;Do you have Daylight, still? Something with sun? I guess sunlight would take him out, because it's during the day.
758;MARISHA;Yeah. I still have 3rd-level spells. Yep.|I also have my 6th-level spells. I have Sunbeam learned, which is dope.
759;LIAM;That's all you need.
760;MARISHA;Okay, I'm going to scry on him.
761;TALIESIN;Grog, do you want to trade boots, by the way, again?
762;MATT;Okay, and he's used all of his resistances.
763;TALIESIN;We don't have to, if you really like them.
764;MARISHA;He's used all of his legendary resistances? Is that what that was?
765;MATT;Yeah. That is a natural 19 plus seven wisdom save. So that's a 26.
766;MARISHA;Oh my god!
767;SAM;He beat your scry?
768;MARISHA;He rolled a natural 19?
769;MATT;Natural 19.
770;LAURA;You can't do it?
771;MARISHA;I can do it again. Can I do it again?
772;MATT;If you have another spell slot for it.
773;MARISHA;I do it again!
774;MATT;Natural 16 plus seven. So that's a 23.
775;SAM;That wins.
776;LAURA;Can I try to cast Locate Object on the pants he was wearing?
777;LIAM;That's amazing!
778;LAURA;They're an object.
779;TALIESIN;She has seen them.
780;LAURA;I've seen them!
781;TALIESIN;They're very nice.
782;MATT;Let me consult the verbiage of--
783;LIAM;This is amazing, and I love you. That is amazing!
784;TALIESIN;That is the greatest thing I've ever heard. Locate Pants. I would like to scry upon the pants. The pantalones.
785;LIAM;On his loafers.
786;MATT;Okay. All right, cool. And you have a 2nd-level spell slot for this?
787;LAURA;Yes.
788;MATT;So as you complete the spell and try to focus as hard as you can on the pants of Lord Sylas Briarwood--
789;TALIESIN;He has pajamas he changes into.
790;LIAM;They're Batman pajamas.
791;MATT;Nothing.
792;LAURA;Nothing? He's definitely recovering naked.|Fuck! Nothing.
793;MARISHA;No pants?
794;LAURA;No pants.
795;LIAM;He's in the buck!
796;MARISHA;You guys! He's shirt-cocking somewhere! (laughter)
797;MATT;"He prepared! He knew! ""It's the only way they won't find me!"" He pulls his tearaways off and chucks them."
798;TRAVIS;Just goes up and says hi to people.
799;MARISHA;Flashing innocents through all the city!
800;MATT;It's his dominate action.
801;TRAVIS;Yeah, right!
802;LAURA;We're going to have to worry about him at some point.
803;SAM;Not now.
804;MARISHA;I can try and scrying eye him. I also still have one more 5th-level spell.
805;LAURA;Yeah, but how are we going to take him out if you use all your spells to find him?
806;MARISHA;I have a 6th.
807;TRAVIS;Maybe we let him go.
808;LIAM;She's saying you got one more shot, and we still have some sunlight.
809;LAURA, MARISHA;One more time.
810;MATT;Well, you used the scrying eye before you took the long rest in the Feywild, or was it after?
811;LIAM;That was for finding the Sword of Kas, wasn't it, before we slept?
812;MATT;Yeah, that would have been before. Yeah, okay. So you can use it.
813;MARISHA;But I'm using my 5th-level spell first.
814;MATT;Okay, you are?
815;MARISHA;Yeah, I'm using my 3rd.
816;MATT;That's a natural seven.
817;SAM;That could work.
818;MATT;As you close your eyes and focus, trying desperately to find the location of Sylas Briarwood, your vision pulls back and is thrust past the titan, and there's a flash of movement.|You're suddenly seeing trees. You're sensing somewhere in the thick forest of the Vasper Timberlands. And there, you focus on rapidly flapping bat wings.
819;MARISHA;Still trying to get back? He's still trying to get back!
820;MATT;You don't know. He's in the forest somewhere. He's in a deep forest with bits of snow around him. And you're only catching glimpses of it as he goes through the shadowed underbrush.
821;MARISHA;No type of landmark?
822;MATT;Just trees, endless trees.
823;LAURA;He's running away.
824;TALIESIN;I would run if I were him.
825;SAM;Deal with him another day.
826;MARISHA;He's in the Vasper forest.
827;LIAM;Well, we'll never see him again.
828;TALIESIN;He may finally have had enough.
829;MARISHA;Do you ever think there's a chance for Lady Briarwood to come back?
830;LAURA;I don't think so.
831;TRAVIS, LIAM;Never say never.
832;TALIESIN;Never say never, but probably not.
833;LAURA;I mean, if we can bring people back, they might be able to.
834;TRAVIS;That's a good point.
835;TALIESIN;He would have to work very hard to make it happen.
836;TRAVIS;We're going to live a life of paranoia, aren't we?
837;TALIESIN;Well, we knew that going in.
838;SAM;We'll be okay.
839;LAURA;So do we go see the leaders here?
840;SAM;Yeah. Let's go.
841;TALIESIN;Let's go see who's left.
842;MATT;All right.
843;SAM;To the platinum temple?
844;MATT;"As you guys are having this conversation, around the corner, you see there's a few of the eagle riders that are getting on their eagle back and flying off. There is one figure that stays behind and that turns around and begins to walk your direction. In the chaos, you hadn't noticed that when Vecna had been dispelled, the force cage that had maintained and locked in J'mon Sa Ord had vanished. You see them turn around and look towards you in humanoid form. They approach with the long, jet-black hair, the darkened skin, the beautiful coal-like ember eyes. Tall, almost as tall as Grog, though lithe in form and simply clothed. J'mon approaches. ""Well, I'm certainly impressed. I apologize to have not been as much help as I had hoped."""
845;LAURA;That was a shitty spell he cast.
846;MATT;"""It seems to be his forte. Nonetheless, the least I can do is offer you a way into the city."""
847;TRAVIS;That would be lovely.
848;MATT;"""I would like to speak with the council that remains, as well. Come with me."" J'mon turns around and steps about 20 feet away before the wings sprout out of their back and stretch to each side. You see the large brass dragon form expand, the claws (impact) onto the ground. As they turn their head back over their shoulder, the deep voice of the dragon form: ""Hop on."""
849;LAURA;I'm going to hold on to Velora. And Trinket, I swear it's going to be the last time, buddy. I'm not going to keep making you go in this necklace much more.
850;MATT;(bear grunts) Licks the side of your cheek.|And closes his eyes, waiting for it.
851;LAURA;Ooh, I love him so much.
852;MATT;Into the necklace.
853;LIAM;And as Vax and Keyleth get situated on J'mon's back, I whisper in her ears: I was going to say eagle. Giant eagle.
854;MARISHA;Yeah. That's good to know.
855;TRAVIS;I pick up Pike and put her on my shoulders. Get on the dragon.
856;MATT;"Okay. Pike climbs up, now wingless. ""Thank you."" Grabs onto the belt you have across your chest."
857;TRAVIS;Yeah.
858;MATT;All right. So do you all climb up onto J'mon's back?
859;SAM;Absolutely.
860;MATT;"All right. J'mon, in Devo'ssa form, then begins to run at a fast speed towards the edge of the city. Eventually, the wings begin to flap, and with one giant thrust of wind, ascends. And once again, you feel the wind rocket through your hair, as was your entry towards the titan. You begin to crest over the edge of Thar Amphala, over the titan, and down towards the center of Vasselheim, the wind roaring past your face, your cloaks whipping behind you. You have a bird's-eye view of the city that you've essentially saved. And really, did so through a quick jaunt to the Feywild.|The Braving Grounds still, while in severe disarray and flames still burn, most everything's under control now. Whatever remains of the remnant cultists, warriors, and undead have either been destroyed, captured, or run out of the city. As you pick up 40, 50 feet over the rooftops, you see as hundreds of survivors have haphazardly armed Bastions, as civilians of Vasselheim have picked up whatever arms were available, of soldiers in the streets, children holding the hands of their families, all glance up and point at the majestic brass dragon that coasts not more than maybe 40, 50 feet ahead, signifying once more a symbol of hope and victory. You hear the shouts behind you.|As you begin to make your way around the Heaven's Stair mountain and then up, gliding over the steps leading up towards the platinum sanctuary.|As you begin to glide up, you can see the steps are littered with broken bone, splatters of blood, broken bodies and silvered armor, and familiar black sludge, connoting the remains of slain gloomstalkers. The immediate ground conflict is over here and has been for some time. The stillness is now occupied with clusters of wounded riders and platinum warriors that now rest atop the apex of the stair and the sanctuary platform itself before you approach the entryway in the pillars. As you ascend, floating up, Devo'ssa lands right at the top of the stair as all the soldiers and medics who are in the process of handling the wounded, gathering the dead, all stop and look at the majestic brass dragon form as they lower themselves to allow each of you to carefully step off.|As you do, you watch as the chatter, the conversation, the quiver of worry, the intensity of the recovery, comes to stillness as each of the soldiers, even those who have seen better days, stand up with a look of acknowledgment, greeting you as you arrive, and all give a respectful bow of the head or kneel to you as you approach and pass by. In the stillness, you begin to walk towards the opening of the sanctuary, the doors open already, and glance over your shoulder to see that J'mon has retaken their human form and is now walking at your side.|Entering the sanctuary, you can see folks are rushing around a bit, and they notice your arrival, as well, but are also trying to make sure that everything is accounted for, and there's a bit of hustle and bustle. The old Scalebearer Yon, who greeted you first to Vasselheim, approaches quickly. ""Oh, goodness me! Hello? You're well.|You've looked better, but so have we. That's fine.|I have questions to ask. But perhaps it's best that-- come with me."" And darts back towards the central meeting chambers of the Platinum Sanctuary. You can see the circle of pillars that surround the wide marbled floors of the center chamber where all these council meetings have previously taken place. You can see battle has taken place here. While most of the bodies or the wounded or dead have been removed at this point, you can see there are elements of chipped and broken stone and marble. You can see scattered remains and blood stains at points towards the entryway. But most of it appears to have been halted at the entryway. All of the combat has halted within the sanctuary. Glancing past, you can see most of the council you met last is not here. They're probably handling their various portions of the city. But you do see amongst a number of inner guardians of the sanctuary Highbearer Vord, who himself looks like he's seen a bit of a fray, and Allura Vysoren to his side.|Both harried, but alive. As soon as you begin to approach, their conversation comes to a halt. As Allura turns and sees you all, her face brightens and she immediately rushes up, tossing any sort of formalities to the side, and runs up. Before she can give you a hug, she sees the child in your arms."
861;LAURA;She's all right.
862;MATT;"""I'm so glad."""
863;MARISHA;Yeah, group hug!
864;MATT;She pulls you in, and you all bundle into this big group hug, heaving breaths of relief cascade through your grouping. You hear the throat clear behind as Vord goes, (clears throat).
865;TRAVIS;Decorum.
866;LAURA;How's Kima?
867;MATT;"""I assume she's well. She's been doing what she does best, which is wander the streets, destroying things that she doesn't like. I've been keeping a close eye from a distance as best I can.|She seems all right."""
868;TALIESIN;Any word from Gilmore in the last hour?
869;MATT;"""No, why?"""
870;MARISHA;"He was in the tower. He was a decoy; we almost slayed him."
871;LAURA;He'd been taken.
872;LIAM, TALIESIN;He's all right.
873;SAM;Do we know where he teleported off to?
874;MARISHA;We sent him off with Cassandra.
875;TALIESIN;Into the woods.
876;LAURA;Into the wood.
877;SAM;Don't worry, it's a big woods. It'll be okay.
878;LIAM;This city still stands. You have carried out a miracle.
879;MATT;"""I've done nothing. Word seems to--"" And at that point, she gets cut off by Highbearer Vord, who steps forward, his arms crossed. ""Word seems to have spread, and I wish not to celebrate prematurely. I have reports that you were there, that you did battle with this ancient beast. What is your assurance? What is your confidence that this is indeed over, and we're not lulled into a false sense of security?"""
880;TRAVIS;We're pretty sure he's alive and well. You know, he's a threat right now. (whispering) What, do we have proof?
881;LAURA;Oh, proof.
882;TALIESIN;I've never known a true sense of security. I'm not entirely sure.
883;SAM;The proof is we're here and we're alive.
884;LAURA;And that titan has stopped moving.
885;LIAM;I am the champion of the Raven Queen. And she has allowed me to track his every movement for a while now.
886;MATT;"""I recall you mentioning that when we last met."""
887;LIAM;He's gone.
888;TRAVIS;There was a process. We had trammels.
889;LAURA;You remembered the word.
890;TRAVIS;Yes.
891;MARISHA;Do I still have the remains of the broken trammel or did it shatter?
892;MATT;No, that shit shattered. It turned to dust.
893;LAURA;Yeah, glitter bomb. Oh, glitter-bomb Vecna! I like the idea that he got glitter-bombed.
894;MATT;"""That was my good eye!"" (laughter)|All right. You see, as you guys are discussing, the Highbearer's eyes lock to Vax's, and you see softness return to his face. The tension, the unknowing, begins to subside with a smile, comes across his stilted, older elvish visage. ""You all. There was a time I did not look past your beginnings. I am ashamed at my misjudgment."" He looks around as folks begin to gather. He acknowledges J'mon, who's approached. They've bowed, carefully. ""Many heroes rose to challenge this day. Many we've lost. And many others that remain to remember them. Let us vow to never forget those who gave everything so that we could still stand here to remember. You, Vox Machina, stand as that beacon of hope upon which we all we hold. You may not fully understand the scope of what you have done but I assure you, we do. And we will. We humble of Vasselheim are eternally in your debt. As is much of the ignorant world, perhaps. On behalf of Silver Talon's Reach, I thank you for everything."" The rest of the room who's begun to gather now, you see other soldiers that were waiting outside as you first approached have begun to filter in. And as you glance back towards the entry hallway of the Platinum Sanctuary, you see faces. People that greeted you in. People hearing these words resounding in silence, and they all begin to bow low."
895;LAURA;This is weird.
896;SAM;Should we say something?
897;TRAVIS;Ask for money?
898;LAURA;They haven't done our fees, right?
899;MARISHA;I'm supremely uncomfortable.
900;SAM;You are the leader of your people. Maybe you should say something.
901;MARISHA;What?
902;SAM;You're a leader!
903;MARISHA;No! But I'm not a leader of these people.
904;LAURA;You've been giving us really good inspirational speeches. Get up and say something.
905;TALIESIN;Get up and say something.
906;LAURA;Say something really awesome.
907;TALIESIN;Just tell people it was brilliant and great.
908;MARISHA;Okay. I step forward.
909;MATT;So as you stand here amongst this procession of warriors, people that now look up and don't see Keyleth the druid, they see the Voice of the Tempest. They see one of the as-to-probably-be-remembered saviors of the city and beyond. All eyes are on you as Highbearer Vord steps away.
910;LIAM;I'm still holding your hand.
911;MARISHA;(chuckles, sighs) The bravery of Vasselheim remains evident on this day, and you all should be proud that your reputation of a city unfallen by invasion or attack remains, and that is only because of the faith and the bravery and the strength of the citizens of this amazing city.|We of Vox Machina are proud and honored to have fought by every single one of you, and we vow to continue to stand by your side through the rest of our days. Huzzah!
912;ALL;Huzzah! (cheering)
913;ASHLEY;Hey, can you hear me?
914;MATT;With a wave of cheers that roar from within these marbled halls that echo, boom and reverberate--
915;MARISHA;To 1,000 years of Vasselheim! Huzzah!
916;MATT;Cheers and cries and fists raise and Pike's cheering--
917;ASHLEY;Yay! (laughter)
918;MATT;"You see Velora pull away from Allura's arm, who's come by to help you carry her, and she: (weakly) ""Yay."" And Allura looks to you with an absolute look of respect and pride. Even the Highbearer seems to be taken by the words. Shit, everyone in the room gets temporary hit points, practically."
919;MARISHA;Yeah! 20 hit points now.
920;MATT;The sun-glass roof, which currently has been sitting within the shadow of the mountain, the sunlight begins to peak past and glide its way across the marble floor as everyone's cheering and the room now, which once was in shadow of the mountain, is now lit up with sunlight. Now you can see the glittering armor that peeks through the dirt, the grime, the blood, shining and sparkling on each of you, across Pike's beautiful armor, across all the warriors that stand here, across the Scalebearer's design, across your hair. The room is filled with light and though you sense the presence of probably Bahamut, glancing down you can't help but think that this is also the approving glance of Pelor, perhaps a bit of the Everlight. As the cheers begin to fade, the crowd begins to pull away.|Conversations progress, thank-yous are given, people come up to you. And eventually you guys begin to step out of the Sanctuary and there you look down across the upper platform, looking down over the city. You can see the Birthheart, the Duskmeadow, pillars of smoke rising up as the sun now hangs high in the sky.|A cold sensation takes you in the chest, Vax. A small pain.|A second one. And your eyes shoot over across to the Raven's Crest, damaged but still standing. You turn around to look at the rest of your family and as you guys look at his face, in but a flash you can see this dark shape behind him. This looming black cloak, this lithe dress that cascades down into a bell and drags across the ground. And there you see the form of the Raven Queen, porcelain mask, long dark hair behind, as her hands slowly creep over the shoulders of Vax'ildan.
921;TALIESIN;I walk to step in between.
922;MATT;In between the two of them?
923;TALIESIN;Yes.
924;MATT;"While the lips do not move on this mask, the voice in your head says, ""You've done well, but do not approach. This is not for you."""
925;MARISHA;No.
926;TALIESIN;Do you recall what you told me once?
927;MATT;No response. Do you continue to walk?
928;TALIESIN;I do.
929;MATT;Make a wisdom saving throw.
930;LIAM;Percy.
931;TALIESIN;No. No, that's-- actually, you know what? Hey, that's right. I'm going to Resolve that.
932;LIAM;Freddie.
933;TALIESIN;This is not about you. That's a 19, 22.
934;MATT;That does not do it.
935;TALIESIN;Damn it. I have a 19.
936;MATT;"I know. Muscles lock into place and you find yourself held there on your third step. The voice, which is omnipresent in your mind, all about, continues. Soothing. Cold, distant but still soothing. The mask slowly looks down towards you.|""You have done well, my champion. The skein of destiny has tugged in your wake, and even this victory culminates with the crossing of a few fate-touched souls. By your hand, your bravery, your sacrifice, you ensure a future for all you love and all who will come to love you and what you've done. You may never know the import of your time here, but take solace in the knowledge that you will see the ripples of your actions carry hope for generations to come. My Vax'ildan. It is time. Say your goodbyes, then come join my side."" And the hands pull away. She stands there."
937;SAM;Now? We don't even get a night together or anything?
938;MARISHA;It's not fair.
939;LAURA;We've got a really long time to be alive.|You've got an infinite time. What's a few more years?
940;MARISHA;"He sacrificed himself in your name; you remain the only ascended. And yet he still loses?"
941;MATT;"""He does not lose. The gifts I gave, indeed all of your patrons gave, were so that you,"" and you watch as her hands extend almost impossibly long around her, ""and everyone here still stands.|I understand selfishness. I understand the impulse of mortality. But I would hope that you understand that the actions that you've allowed Vax'ildan in this sacrifice are far larger. But we made a deal.|With power comes a price."""
942;MARISHA;I'm not ready.
943;LIAM;You're ready for your people.
944;MARISHA;Not without you.
945;LIAM;I am so very proud of you, and so grateful for everything you gave to me. You are going to be a strong leader and a wise leader.
946;MARISHA;I'll find you. I promise. I'll see you again.
947;LIAM;I'll never be that far away.
948;MARISHA;Forever.
949;LIAM;And ever and always.|Boys. My brothers... I love you.
950;SAM;We love you, too. Thank you for everything.|If you want us to fight her, just say jenga, and we will.
951;LIAM;Maybe from the other side. Someday, just for shits and giggles.
952;TRAVIS;Can I ask, are you afraid?
953;LIAM;I'm going to go visit my mother, and I'll see all of you again. Freddie.
954;TALIESIN;I do not accept this.
