;Player_Name;Transcription_Text
1114;MATT;You hear Grog belch in the distance and it echoes through the open walkway of the city's streets. Yeah, it's pretty fantastic. You catch up to the party, and you guys make your way to the outside of the Diamond Nest Tavern, a familiar tavern to all of you as you've been here once or some of you twice before. However, during this time, the front doors are open, in the middle of the afternoon, and you can hear from the inside the laughter, bustle and movement of people, and music playing very loudly from the interior, it sounds like various instruments cross-playing and the occasional cheer as glasses and steins clink on the inside.
1115;LIAM;I'm gonna throw up my hood, and I'm gonna pull out my other cloak, the red one, and I'm putting it over Pike, putting the hood over Pike's head.
1116;LAURA;You have two extra cloaks? You gave me one and then you have another one?
1117;TRAVIS;It's like Dumb and Dumber with the gloves.
1118;MATT;Which cloak are you giving her, then?
1119;LIAM;Oh, the Mountebank.
1120;MATT;Okay. And you're keeping which one?
1121;LIAM;The displacer cloak I've been wearing. I just don't want you to be seen.
1122;ASHLEY;Am I invisible?
1123;MATT;No. (laughter)
1124;TRAVIS;Just say yes! Just say yes!
1125;SAM;Where's Pike? Where did Pike go?
1126;ASHLEY;Hey! Nobody can see me! (clanking noises)
1127;MATT;Your features are better hidden by this cloak, just because it's big and not currently designed for someone of your stature.
1128;LIAM;You gotta pull it round your cheeks.
1129;MARISHA;I was gonna say, what does the clientele of the bar look like?
1130;MATT;"Well, as you guys step inside, the clientele here appears to be regular; the equivalent of like a blue-collar work staff, like, a lot of folks that are you know, sleeves rolled up to the elbows, dirt on the face, gentlemen who are part of either construction crews, or stone workers, masonry, probably work within the actual district in the process of moving plots, or building, you know, small mausoleums, things like that within the actual confines of the district. You see across the way there's a live band playing, of which, you know, they're no one really of note at first, however, Scanlan, you do recognize two of the individuals on the far side of the bar. In the band. There is an individual named Kent Plucker, who is a halfling bard, currently on the lute, which you had traveled with previously, for quite some time along with the other individual you recognize, a rowdy-looking but well-dressed half-orc violinist named named Dr. Dranzel.|(cheering)|A half-orc. Black hair slicked back, well-dressed with a really rough-looking angry chin. Aside from the attire and the dress would look the meanest, and leaning more towards the orc side than the human side, but very well-dressed, with a violin over the chin that looks so tiny by his massive frame, but he's playing away and it is glorious."
1131;LIAM;Have we heard of these individuals and these--
1132;MATT;You've heard whispers from Scanlan long ago about just his travel, but you don't speak--
1133;SAM;My troupe.
1134;LIAM;Oh, I forgot about Dran.
1135;TRAVIS;Oh! We forgot about Dre.
1136;MARISHA;(laughing) Dr. Dre! (laughter)
1137;LIAM;60 seconds late, ladies and gentlemen.
1138;SAM;It's my troupe.
1139;ASHLEY;This is amazing.
1140;SAM;It's my troupe!
1141;TRAVIS;Wanna go say hi?
1142;SAM;Of course I want to go say hi, but I don't want to distract us from our mission.
1143;LAURA;No no no, do your shit Scanlan, we'll just look around.
1144;ASHLEY;How about you ask to jump in for a tune?
1145;MARISHA;Yeah, you know, we never get to see you play, Scanlan, not to your full capacity!
1146;LIAM;I plant my foot firmly into his arse and just shove him towards the two guys.
1147;SAM;I haven't seen them for a while. I don't know how they'll react to seeing me.
1148;MATT;As you're getting that word out, you're shoved forward, stumbling, almost being tripped by a few of the patrons, but as you stop and look up, you see before you a young, cute gnomish girl with very short pixie-brown hair, currently playing the flute. She looks over at you and gives you a winky grin. To the right of her you see a rather rotund human male, with a bushy blond beard and raggedy hair who currently has a series of small percussion drums around him and just hitting around, and to the other side of the small gnome girl you see a half-elven, more mature woman, in the later years for a half-elven woman, hair tied into a very, very tight bun, and she is in the process of singing this wondrous tune that matches this improvisational feel of the band. Currently Kent is not paying attention and is on the far right side, but behind them all, towering over, just by stature, is Dr. Dranzel with his violin, and as you stumble forward he looks over and just gives you a smile and keeps playing.|(laughter)
1149;SAM;Mind if I jump in?
1150;MATT;"""It would be an honor! Scanlan Shorthalt, ladies and gentlemen! Jump into the fray!"""
1151;SAM;Feast your eyes, feast your ears, on quite a traveling troupe of musicians, and one humble gnome who is so lucky and humbled to join them.|Please, keep the tips flowing for us, and your waitresses!
1152;MATT;And with that, the current song comes to a close, they all lift their instruments expectantly and look towards you.
1153;SAM;Let's play our old standard. And a oney and a twoey and a oney and a twoey.
1154;MATT;What instrument do you pull out?
1155;LIAM;Vuvuzela.
1156;SAM;I'm gonna pull out the flute, the flute, I'm gonna play the flute for a while. 'Cause I don't wanna, the singer sounds good, I don't wanna rain on her parade.
1157;MATT;Yeah, no worries. So you pull out your flute and other gnomish girl with her flute as well gives you a look, and you guys start weaving together this flute duel, almost like Flight of the Bumblebees but two conflicting sides-- Go ahead and make a perform check if you could.
1158;SAM;I've never done one of these before.|Something tells me it might not go well.
1159;TRAVIS;It's gonna be great!
1160;MARISHA;I go and I get as many ales as I can carry and start handing them to those guys.
1161;MATT;Okay. No worries.
1162;SAM;22.
1163;MATT;As you guys begin to build this perpetual symphony of-- it's almost jazz flute almost in this improvisational feel to it.
1164;SAM;(flute noises)
1165;MATT;The drums build, you can see Dr. Dranzel is tapping his foot to it and he gets this really fast fiddle sound out of a classic violin, the whole room begins to gather around and cheer.|Vex.
1166;MARISHA;Here, have a drink. Yeah!
1167;LIAM;Another whisper. Two whispers!
1168;SAM;Jesus.|(laughter)|Ashley is subtly massaging Laura's ass.
1169;ASHLEY;For inspiration.
1170;LAURA;I keep an eye on him and make sure he doesn't-- any of us.
1171;MATT;Okay. Gotcha. All right, so. As the song builds, builds, builds, people are cheering and shouting, and you bring the drinks over, Keyleth, and you set them down.
1172;SAM;Can me and the other flutist end with an impossibly long held note?
1173;MATT;Make another perform check.
1174;SAM;33.
1175;MATT;"And with that, you both inhale, almost like through eye contact you knew it was coming. Hold, and hold, and you can see her eyes start to get tense and bloodshot, her face starts turning beet red, all the rest of the music stops and everyone just gathers around, the air leaves the room as everyone seems to lean in, and eventually she gives up and exhales and inhales sharply, dizzied by it but still smiling and you can only imagine the blurred romantic tunnel vision she has in your direction, as you carry it for about three seconds more and then end with a trill at the end. The whole room just rouses in cheers and clapping, you can now see coppers and silvers and a few gold are being thrown onto the floor in front of you, there's a small bucket at the base of the small stage platform and Dr. Dranzel then stands up, takes his hat off of the ground next to him, and bows, as the rest of the group bows before as well. You know the drill, you've done this for quite some time. Everyone cheers, a few more drinks, even though you bought rounds for everyone, other people are buying rounds and bringing it up. And it's been a while since you've done a performance of this magnitude, and it makes you feel good, and at that point you feel a hand clasp your shoulder and Dr. Dranzel leans in, ""It's good to see you again, Shorthalt. It's been a while."""
1176;SAM;Yes it has, sir, yes it has.
1177;MATT;"""Haven't lost your edge."""
1178;SAM;I'm a little rusty, but I trust you'll keep me honest through this.
1179;MATT;"""Honest? We've always been honest. Come! Drink. Eat with us."" And they all put their instruments up, as he says: ""We've just finished our set. Let's catch up. It's been some time, I'd like to hear of your journeys and tell you of some of ours."""
1180;SAM;Absolutely. I'll be back in a while, fellows.
1181;ASHLEY;Good job, Scanlan!
1182;MATT;"""Oh are these, are these your friends?"""
1183;SAM;Oh yes, these are my traveling companions and--
1184;TRAVIS;I'm his bodyguard. He's very popular.
1185;MATT;"""You can afford a bodyguard of that magnitude?"""
1186;SAM;Oh, I've done quite well, thanks to your tutelage.
1187;MATT;"""Well great, great, well, come on, you don't all need to stay away! Have your friends sit with us."""
1188;SAM;They can join us?
1189;MATT;"""Certainly!"" He goes and calls over, he goes, ""Kaylie, Zed, help me with the tables."" And the gnome and the rotund bearded human rush off and start grabbing a couple of the tables and they cram them in the corner, so now you basically have built this monopoly on the far corner of the tavern now, where all of you guys can sit around and cluster."
1190;SAM;Kaylie, that was some fine playing. I might have a tip or two about breath control.
1191;MATT;"""Sorry, not all of us are quite as old and seasoned as the others."" (jeering and laughter)"
1192;SAM;Well, I've learned quite a thing or two in my years and, it might interest you to take a little private tutoring session sometime.
1193;MATT;"""Scanlan Shorthalt. You know, I've heard quite a bit about you."""
1194;SAM;My legend is spread far and wide, I'm sure.
1195;MATT;"""Indeed. And I know better than most ladies that may cross your path."""
1196;SAM;"You may change your ""tune."" (noncommittal groans)|Grog, a little help over here."
1197;LIAM;You had us, and then you lost us.
1198;ASHLEY;Can I give him inspiration? Somehow?
1199;MATT;How?
1200;ASHLEY;I don't know.
1201;MATT;What would you like to do to make Scanlan look better in this circumstance?
1202;TALIESIN;Perhaps help him with his pitch.
1203;ASHLEY;Yeah.
1204;SAM;It's lovely to meet you anyway.
1205;LIAM;Vex once helped Grog in a very specific way.
1206;ASHLEY;I will-- the man, the myth, and the legend, is true. So, in case you wanted to find out-- (laughter)
1207;MATT;She gives you a look over, looks over at Scanlan.
1208;SAM;"Yeah. Yeah that, we're close, we're tight, she and I and-- she's come back for more.|MATT ""A holy woman?"""
1209;MARISHA;Oh shit!
1210;SAM;She's got holes in all the right places.|(groaning)|I don't know what I'm doing here!
1211;MATT;"She actually at that point goes (laughs), turns around, ""Doctor! You weren't kidding. This one's certainly a card."" And she gives you a wink, and passes a drink your way across the table. As the crowd simmers down, people go back about their business, and the drinks are brought to the table and scattered about, the rest of you find your seats, and sitting around, they gather up the coin that was taken, and Kent, who sits down next to Dr. Dranzel, looks over and says: ""Ah, it's been a while, Scanlan. I'm glad to see you. Glad you could join us. It was like old times. It was nice."""
1212;SAM;"""It was nice. What have you fellows been doing for these years?"""
1213;MATT;"""Well, we just finished up coming out here and playing for Winter's Crest. We made a good deal of money, we're on our way out and figured we'd finish up a few of these gigs."" And Dr.|Dranzel kicks in and says, ""Emon, these days, seems to be doing all right. Paid us well for our time here and, well, you've earned a little coin yourself from this."" And he takes a little handful of coins from the pile they had amassed and chucks it over your way. It's like 25 gold."
1214;SAM;Oh, well, thank you, but I can't possibly accept this.
1215;MATT;"""Fair enough!"" And he scoops it back.|(laughter)"
1216;SAM;You deserve it. It's your gig, you booked it.|I'm just playing here for the night.
1217;MATT;"""Ah, you're fine."" At this point, you guys notice a small halfling boy, definitely not an adult, probably in his late teens, comes up to the edge of the table, you know, big eyes and softer features, and he's dressed a little inconspicuously, comes up.|""Doctor. Good performance, good performance."" and he claps and looks about the rest of the table.|And Doctor's like, ""It's fine, boy, they're friends."" At which point the boy nods, looks about the rest of you, lifts up a small satchel and unloads it on the table next to Dr.|Dranzel, and you see spill out a much larger collection of coppers, silver, rings, bits of jewelry, a few loose coin purses, and Dr. Dranzel reaches over and pats him on the head. ""Good boy, Samson, good boy."""
1218;LAURA;Nice haul, Samson.
1219;MATT;"""Thanks,"" and he looks about awkwardly and expectantly and---"
1220;SAM;Still up to the old tricks, I see, Doctor.
1221;MATT;"""Hey, when business is good, Scanlan, when business is good."" And he reaches over and grabs a small bit of the gold coin and puts it into Samson's hands and goes, ""Go buy yourself some toys,"" and pats him on the back, and the boy runs off excitedly. He quickly looks about and takes a bunch of the gold and scoops it into a small satchel at his side and hands it off to Kaylie.|Kaylie takes it. Kaylie, who at this point has been introduced as the gnomish girl who you saw her grabbing the table. She takes the satchel and whisks her hand for a moment and the satchel just vanishes in her grasp in a little puff of smoke."
1222;SAM;I like this girl.
1223;MATT;"""Huh. So the company you're keeping seems to be formidable."""
1224;LAURA;We are.
1225;MATT;"""What can we call you?"""
1226;SAM;We call ourselves Vox Machina.
1227;MATT;"""Sounds really formal."""
1228;LAURA;(laughs) You can call us The S.H.I.T.s.
1229;MATT;"""I like that much better!"" (laughter) ""That's the Scanlan I know. Shits it is. So, Shits, what do you do? What's your trade? What are you tugging around with this sorry sap for?"""
1230;SAM;They're powerful warriors, killers, assassins, magic wielders. Not quite as ornery as a bunch as musicians, but still pretty amazing people. We've had quite a few adventures the past few years.
1231;LAURA;Scanlan's a kingslayer.
1232;MARISHA;It's true.
1233;SAM;He might not believe you or really anything about me.
1234;LIAM;You doubt the cube?
1235;MATT;There aren't a lot of kings in these lands.
1236;SAM;But there's one fewer now.
1237;MATT;"(laughs) ""All right, Kingslayer. So I take it you're all experienced in a little skullduggery from time to time, yes?"""
1238;TRAVIS;(laughs)
1239;TALIESIN;Grog, it doesn't mean what you think it means.
1240;TRAVIS;Oh.
1241;MATT;"""We're thinking of shoving off. We recently got a tip, if you're interested. Word came about about a dickhead with too much change in his basement---"""
1242;LAURA;(laughs) Are you leaning on something, Doctor?
1243;MATT;Yes. I'm leaning on the back of a chair that I see in my imagination. (shouts) It's my window! Go with it!
1244;ASHLEY;I got it, I got it, I got it! (laughter)
1245;LIAM;There's a very short man, right there.
1246;TALIESIN;He's in a cast. He's been playing with a cast the entire time.
1247;MATT;Towards the back of the tavern, there's a small wooden thing. He's lounging, he's a casual guy, the Doctor.
1248;LIAM;His name is Jonathon.
1249;MATT;No. It is Doctor Dranzel.
1250;SAM;Please, Vex, a little respect, he's a physician.|(laughter)
1251;MATT;"""Anyway."""
1252;SAM;A tip about a dickhead.
1253;MATT;"""Word came about a dickhead who has too much change in his basement. It's weighing down his personality. You wanna help this poor old withered man alleviate this burden?"""
1254;SAM;You mean steal from him?
1255;MATT;"""No! I mean, help it go to good hard-working folk who deserve it more."""
1256;SAM;What kind of a dickhead is he?
1257;MATT;"""I haven't dealt with him personally. People have told me he's a bit of a thorn in the side of, well, any lively folk. Especially those of an artistic persuasion."""
1258;MARISHA;What's his name?
1259;MATT;"""Don't know the name. But I know where he lives. We've looked at the place, cased it if you will. There could be a few ways in. Unfortunately, we've become a little higher profile during our stay here than we expected and I don't know if we're quite as skilled in the realm of shadow-walking."""
1260;LAURA;Doctor, we're quite skilled but we have a bit of a name for ourselves as well. I'm afraid we may not be able to help you out.
1261;MATT;"""Right, very well."""
1262;TALIESIN;We're quite the opposite of low profile.
1263;MATT;"""Well, not to worry. Figured I'd pass it your way."""
1264;SAM;If we were to pursue it, what would your take be?
1265;MATT;"""Well, based on a finder's fee, and based on the relationship we've had all these years, our troupe would be happy to take a 40% cut."""
1266;SAM;And this is a vast sum of money we might find?
1267;MATT;"""From what I've heard, sizeable enough for me to want to include someone the likes of you.|You know I don't like to include outsiders so regularly."""
1268;SAM;Well, I'm not quite an outsider. Yes, them.|Well, we could investigate, if you give us an address or description.
1269;MATT;"""All right, all right."""
1270;LIAM;I haven't been paying close attention, but who is this mark?
1271;LAURA;He didn't say his name.
1272;LIAM;Don't know his name, he's just a dickhead.|That's all you know?
1273;LAURA;What district does he live in?
1274;TRAVIS;No, no, no. The old man wants to redistribute his wealth and we would be the vessel by which he would do that.
1275;MATT;"""You've got a smart bodyguard on your hands, too! (laughs) What's your name?"""
1276;TRAVIS;Grog.
1277;MATT;"""That's a good name. Yeah. Speaks of intelligence."""
1278;MARISHA;Insight check?
1279;MATT;Sure.
1280;MARISHA;29.
1281;LAURA;Wow, that's a good insight check.
1282;MARISHA;I rolled a 19.
1283;LAURA;Secrets, secrets.
1284;MARISHA;I get secrets!
1285;SAM;Pike, thank you for being my wingman back there.
1286;ASHLEY;You're welcome, but how come you never told us about Dr. Dranzel? Did you forget about him?
1287;SAM;I told you--
1288;ASHLEY;Did you forget about Dr. Dranzel?
1289;TRAVIS;You forgot about Dranzel. Those motherfuckers act like they forgot about Dranzel.|(laughter)
1290;TALIESIN;This is my favorite thing ever.
1291;MATT;"""But no worries."""
1292;MARISHA;So you're just, out of the good of your heart, wanting to redistribute a little bit of funds to help out a few less fortunate people, that's all you have in this?
1293;MATT;"""Yeah!"""
1294;MARISHA;Really?
1295;MATT;"""We're all rather less fortunate than this dickhead, and I don't see why a little off his table wouldn't even be noticed, probably."""
1296;MARISHA;And where exactly did you find this information? On this dickhead?
1297;TRAVIS;I think he said he asked him.
1298;MARISHA;You asked him? What?
1299;TRAVIS;No, no the old man asked him: oh, I need to redistribute.
1300;MATT;I have my reasons, my connections, my friends here, and I've been told that his estate has been abandoned for some time, actually.
1301;SAM;Keyleth, this is an old friend of mine, who I trust very much. He saved me when I was troubled and taught me much about the ways of performing and charming. He has my full trust.
1302;MARISHA;Well, if I know anything about your skills, Scanlan, I think it says a lot about Dr.|Dranzel. So--
1303;SAM;I'll take that as a compliment.
1304;MARISHA;You're welcome. Forgive me if I'm--
1305;TALIESIN;I think we obviously-- any friend of Scanlan is a friend of ours and I think if Dr.|Dranzel here-- may I call you Dr. Dranzel?
1306;MATT;"""You may."""
1307;ASHLEY;Can I call you Dr. Dra?
1308;TALIESIN;That has a really nice ring to it.
1309;MATT;"""Sounds to me unfinished and rather sloppy.|Just Doctor is fine."""
1310;ASHLEY;All right. Sorry.
1311;TALIESIN;Professor Dranzel.
1312;MATT;"""Yes? Doctor. Doctor."""
1313;TALIESIN;Dr. Dranzel, and I want to know if you're really a doctor later, but I think, perhaps, maybe there's a little tidbit of information about this that you're holding back with because-- I would understand. We're new. We don't really know each other. We're not really on that friendship level yet, but my point is, we could be friends like that. We could be-- I'm trying to see if this works.
1314;MATT;Make a persuasion check.
1315;TALIESIN;You know what I'm doing. I'm attempting Friends.
1316;MATT;Oh, interesting.
1317;TALIESIN;I'm attempting.
1318;MATT;Okay, okay. Good to know this. All right, then. What saving throw does he get for that one?
1319;TALIESIN;I get advantage on charisma rolls.
1320;MATT;Oh, right, right. Okay, okay. Yep, go for it.
1321;TALIESIN;Am I just rolling charisma?
1322;MATT;You're rolling a persuasion with advantage.
1323;TALIESIN;Oh, persuasion roll with advantage. Oh, that's nice. 23.
1324;MATT;"Okay. He looks to you and goes, ""We don't know who it is. We've been told it's in the Cloudtop District. It's a red brick building. It's been abandoned for over a year and apparently it's been well boarded up. But from what I've been told, quite a lot of wealth is down there. But it's a bit dangerous of an entry. We have no way of getting into the Cloudtop, but these myths keep finding our ears."""
1325;TALIESIN;If it's the house that I think it is, it's already been--
1326;LAURA;Pillaged?
1327;TALIESIN;Pillaged. Pillaged is a good word. The rumors were not incorrect but--
1328;SAM;What house is this?
1329;TALIESIN;Do you remember with the agon-day with our utler-bay?
1330;SAM;I don't speak Latin.
1331;LAURA;Pretty sure it's already been cleaned out.
1332;MATT;"""That's unfortunate."""
1333;LAURA;Unless you're hearing things we don't know about.
1334;MATT;"""I know that a few individuals have tried to make their way in. Came out with hefty sums of gold but seemed to be a bit spooked."""
1335;LIAM;I'm gonna pull up a chair and sit down in front of him. Hi, there. My name's Greg. Greg.|Yeah, I'm Scanlan's friend, Craig.
1336;MATT;"""Hello, Greg. All right, Craig."""
1337;LIAM;Scanlan might be able to help you with this.|I'll definitely be able to help you with this, but I'm not going to do anything unless I know something more, so if you want to go into the house, if you want me to break us into the house, which I can certainly do, I really need to know a little bit more. Your chances of getting whatever you're after inside raise if you're honest with me. And I don't feel yet like you're being honest with me, so I want to help you, but I don't think I can and without me, I'm sorry, I'm sorry, but we're not getting in the house, so is there anything else you wanna tell me about--?
1338;MATT;"""That's all I know. All I know is they've had a few other of the thieving persuasion have made their way in before and they came out with a decent chunk of change, given that they could only be in there for a short time."""
1339;LIAM;I'm gonna insight check. That is a 19.
1340;MATT;He's hard to read, but the best you can tell is he's been pretty clear with you. And at this point as you're looking at him, his eyes go--
1341;TALIESIN;And this is the point where I buy you a beer. And I put the coin down.
1342;MATT;"(laughs) ""You're a tricky one. All right, you've got yourself some talented compadres."""
1343;SAM;Well, they can't play as well as you, but they're pretty good.
1344;MATT;"He takes the coin. Takes the drink. ""Well, you know where it is. You know what it looks like.|If you're interested in finding your way in and come out with anything, we'll be here about another week."""
1345;LAURA;All right. How long have you been here?
1346;MATT;"""Probably been here about two weeks now. Two and a half weeks."""
1347;LAURA;Hmm. Have you noticed-- I'm sure you've seen many people come in and out, but an older gentleman dressed much nicer than he should be in an establishment like this?
1348;MATT;"You describe Riskel to him? Riskel's elven. Thin features, older. Has some battle scars, but long-ish hair kept behind his ears. And as you describe it, he goes, ""Yes, yes actually. We had a gentleman like that who came in here a couple of times about a week ago, and last saw a few days ago."""
1349;LAURA;A few days ago?
1350;MATT;"""Yeah! He came in and watched one of our performances. Tipped us rather well!"" (chuckles)"
1351;LAURA;Did he?
1352;MATT;"""Seemed a bit hurried."""
1353;LAURA;Yes. Did you see where he went?
1354;MATT;"""No, I assumed he was staying here at the tavern."""
1355;LAURA;Really? Are there rooms here?
1356;MATT;"""Yeah. Just upstairs, they have rooms here."""
1357;TALIESIN;You should see if there's rooms downstairs.
1358;LAURA;Yeah. I get up and leave the table and go talk to the barkeep.
1359;SAM;Do you guys want us to create some sort of distraction while you go search the place?
1360;LAURA;I'm going to talk to the barkeep and talk about rooms, potentially, first.
1361;SAM;For us?
1362;LAURA;Just seeing what they have available, and what's being rented right now.
1363;SAM;Because we know he's downstairs.
1364;MARISHA;Yeah, I was going to say, he was going to go downstairs. I'll go with Team Downstairs.
1365;TALIESIN;Team Downstairs it is.
1366;ASHLEY;Team Downstairs.
