;Player_Name;Transcription_Text
2120;MATT;Even just walking through here, though you feel confident in your placement, the presence here you're still getting used to, and it's something about the air, or you feel just a little dizzy as you're still adjusting to the heat, to the placement, to the strange ever-so-faintly non-Euclidian structure to the landscape around you.
2121;MATT;It's forcing you to consciously right your posture and pay more attention to your surroundings than you normally would.
2122;MATT;There's just something about the presence here that's unwelcoming.
2123;MATT;You can see there are a number of other streets that head in any direction.
2124;MATT;It's hard to tell which way is further into the city and which is further out, it's so vast.
2125;MATT;Even the City of Brass or Ank'harel in their size, none of them seem to really scrape the surface of the sheer immensity of the City of Dis by comparison.
2126;LIAM;This should be easy.
2127;TALIESIN;I wouldn't know from reading anything, I wouldn't have a vague idea of where to go?
2128;TALIESIN;I have a theory at the moment, but it's pretty light.
2129;MATT;From what you read, it was mostly about the structure of the society, there was no well-written cartographer's experience--
2130;TALIESIN;Hitchhiker's Guide to the City of Dis.
2131;TALIESIN;I say we head to the tower.
2132;LAURA;The tower's in every direction.
2133;TALIESIN;So, whichever direction it is, that's the way we'll head.
2134;TRAVIS;Wow.
2135;TRAVIS;That's true.
2136;LIAM;So it's that way.
2137;MARISHA;And also that way!
2138;LIAM;Some people go both ways.
2139;TALIESIN;I feel like if I were going to build a giant tower that couldn't be ignored, I would have that be the center of anything and every place.
2140;TALIESIN;It may not even matter.
2141;LIAM;Let's take a stroll and see a lay of the land.
2142;MARISHA;As we start taking a stroll, can I do a nature check to see if I can spot any native beasts, insects, etc.?
2143;MARISHA;Native animals, birds.
2144;MATT;Make a nature check.
2145;MARISHA;Critters, and the usual.
2146;MATT;Sure.
2147;MATT;This would be more perception, actually because you're trying to pick up details in the scenery.
2148;MARISHA;Perception check?
2149;MATT;Nature to understand if you knew what they were.
2150;MARISHA;That's a shithole roll: 14.
2151;MATT;14?
2152;MARISHA;Total.
2153;MATT;You do, occasionally, catch what looks to be some element of small, flying, buzzing pests, but they're different than what you're used to.
2154;MATT;The brief glances you get of one that comes nearby, it seems to have eight sets of wings and some horrid-looking pincers on the front and looks like a nasty denizen of the scenery.
2155;MATT;And immediately, you're like, Ugh!
2156;TRAVIS;I lean over to Vex, and I say, oi.
2157;TRAVIS;In an effort to blend in, should we just kill a random person?
2158;LAURA;I feel like only if it's called for, yeah?
2159;TRAVIS;I just thought of it, so does that mean it's called for?
2160;TRAVIS;Is that what you do here?
2161;LAURA;No, probably not just yet.
2162;TRAVIS;They might really like it here.
2163;LAURA;I know, they could, but they also thrive on order.
2164;TRAVIS;Oh.
2165;LAURA;And I feel like that's a little out of order.
2166;TRAVIS;Right.
2167;TRAVIS;I'm glad I asked you.
2168;LAURA;Me too.
2169;TRAVIS;Okay.
2170;LAURA;Keep doing that.
2171;TRAVIS;Asking you?
2172;LAURA;Yeah.
2173;LIAM;Why is our life so much like Vaudeville?
2174;MARISHA;You do like the theater.
2175;LIAM;That's true.
2176;MARISHA;Do you think a Pass Without a Trace spell would be beneficial here?
2177;LAURA;It's concentration.
2178;TALIESIN;Why try to be complicated?
2179;LIAM;Let's just own this.
2180;TALIESIN;Let's own it.
2181;LIAM;Take a walk.
2182;LIAM;Percival.
2183;TALIESIN;No fear!
2184;LIAM;Strut!
2185;TALIESIN;I strut.
2186;LAURA;(gasps) Maybe we can drop a little bit of dust of tracelessness behind us, though, so we're-- no?
2187;TALIESIN;No, let's not make a scene.
2188;TALIESIN;I'm going to look for signs to look for the sorts of people who are walking around, if there seems to be a flow of traffic, if people seem to be going in a direction, coming from a direction.
2189;MATT;Okay!
2190;TALIESIN;Getting a sense of the city.
2191;MATT;While heading towards the tower?
2192;TALIESIN;While heading towards the tower to make sure that I am trying to get a lay of the land so maybe I can see if we should veer off in a direction.
2193;TALIESIN;I'm also looking for humans, someone who might speak Common.
2194;LIAM;And, are there stores, are there businesses?
2195;LIAM;Are these all non-descript buildings, or does it all just look like the same shit?
2196;LIAM;Or is it--
2197;MATT;They are varying, but there's nothing here that looks like a welcoming shopfront.
2198;MATT;The structures are varied, but any of the signs or any of the scrollings that you see chiseled into the stonework and metal is not a language--
2199;LIAM;So, it's like a hellish financial district, there's just nothing there.
2200;MATT;Loosely, yeah.
2201;MATT;It looks like Detroit on Halloween.
2202;LIAM;Purge!
2203;TRAVIS;Love you, Detroit.
2204;TALIESIN;It's been a while.
2205;MATT;Yeah, man.
2206;MATT;Devil's Night, it's great.
2207;LIAM;Hell.
2208;MATT;So, you follow.
2209;MATT;As Doty's (stomping) behind Tary, staying as close to the middle of all of you guys and shielding himself between your various bodies.
2210;MATT;You continue to follow Percival as you step through, paying attention.
2211;MATT;Go ahead and make an investigation check.
2212;LAURA;I'm going to keep an eye out for anybody that looks like they're noticing us too much, anything.
2213;LIAM;Yeah, same.
2214;LAURA;Of course.
2215;TRAVIS;Natural snitch.
2216;TALIESIN;Yes, of course.
2217;MARISHA;Natural snitch!
2218;MATT;You are--
2219;TALIESIN;-- a problem.
2220;MATT;You are a problem.
2221;TALIESIN;I may have to-- I'm aware that there's a lifespan on this die, that I may eventually need to put it away.
2222;LIAM;We are in hell.
2223;LIAM;If it's going to come out anywhere--
2224;TRAVIS;If you roll one more natural 20, it's just going to dissolve into gold dust and float away.
2225;TALIESIN;Heads.
2226;MATT;It's okay.
2227;MATT;One of these days, your contract will come to me.
2228;TALIESIN;I'm well aware.
2229;LIAM;If you lift up Taliesin's mohawk, you can see the little tiny, little points.
2230;LIAM;Little horns.
2231;MARISHA;Yep.
2232;MATT;Or the maze.
2233;MATT;You walk for the next ten or so minutes.
2234;MATT;Two things you notice, looking for patterns and elements of the city around.
2235;MATT;There does seem to be a general direction of, not individuals as such, but a lot of these fleshy masses, which you've read about in the book, they're referred to as lemures.
2236;MATT;They are fallen damned souls that have been tortured into this specific form that are the lowest base level of devil that exists here.
2237;MARISHA;Just a fleshy mass, Liam.
2238;LIAM;I want to go to bed.
2239;MATT;But a lot of them seem to be going in this certain direction.
2240;MATT;It's difficult to maintain focus on the direction of the tower if you have to avert your eyes.
2241;MATT;However, if you're looking in a particular direction, it doesn't follow your vision when you move, it's whenever you have to look away and change your perspective on the horizon, that's when it appears elsewhere.
2242;MATT;So, you assert yourself in a direction and maintain that way.
2243;MATT;After about ten, 15 minutes, there's no discernable gaining of distance on the tower.
2244;LIAM;Oh, for fuck's sake.
2245;TALIESIN;In that case, I'm going to find a lemure and inquire sternly of directions.
2246;MATT;Okay.
2247;MARISHA;Sternly?
2248;MATT;As you're walking, you see there are three of them currently that are chained together with two of these weird black, jagged spiked collar and midsection bands that are jammed into their sides and they're all joined and the hooks and the chains are screwed into the side of this building.
2249;MATT;They do not appear to be currently attended at the moment.
2250;MATT;And, as you approach one is there like (gurgling).
2251;TALIESIN;Kuthok.
2252;MATT;(pained gurgling)
2253;TALIESIN;Marketplace.
2254;MATT;(pained gurgling)
2255;TALIESIN;Point.
2256;LIAM;That is fucking disgusting.
2257;MATT;There is no language.
2258;MATT;It looks like it can't really communicate.
2259;LAURA;Oh god.
2260;MARISHA;Wow.
2261;LAURA;That's really sad.
2262;MARISHA;It kind of is.
2263;TALIESIN;Well, that's depressing.
2264;TALIESIN;All right.
2265;TALIESIN;What building are they currently chained to?
2266;MATT;It's about a three-story tall, long tower.
2267;MATT;It's long on one side and then half the size on the other, and it juts up like a monolith that comes from these two hooks at the top.
2268;MATT;There's no signs or particular language on its exterior, but there does appear to be a doorway, a big, black metal iron doorway that is closed maybe a foot to the left of them.
2269;MATT;You're--
2270;LAURA;Does it look like people are coming in and out of that building?
2271;MATT;If you wait a moment, you can find out.
2272;LAURA;Maybe we can post up and see, or just walk on in.
2273;TALIESIN;I wouldn't recommend walking on in.
2274;LIAM;We're walking and nothing's changing.
2275;LIAM;Do we want to stay put for a while and see what happens?
2276;LAURA;Well, our surroundings are changing, we're just not--
2277;MATT;(crashing noise) At this point, the door shifts open with a slam, there's a burst of phosphorous-type clouded fume that drifts out from the interior as, curling down, looming from the inside, another one of those large, lanky, skeletal-looking devils with the giant scorpion tail lurches out, and sees all of you clustered over, and begins to rush up quickly and grabs the side of where the hook is jammed into the wall and just breaks it out with its bare strength, and yanks the lemures closer.
2278;MATT;(speaks Infernal) You see its jaw almost seems to disconnect and unhinge for a moment as it gets impossibly long and its tongue (slurping noise) and begins to just walk away from you guys down the road, dragging these lemures behind it from the chains.
2279;LAURA;As soon as he opened the door, I wanted to get a look inside of where he came out.
2280;MATT;Perception check.
2281;LAURA;It was almost a 20, but it was a 25.
2282;MATT;25?
2283;MATT;You get a very brief glance on the inside.
2284;MATT;Very dark, red light seems to slightly light the interior.
2285;MATT;It looks almost like a shelf of some kind.
2286;MATT;That's as much of a view as you got.
2287;MATT;It was just some sort of a shelf, bit of furniture in the side there.
2288;LAURA;Fuck.
2289;LIAM;Hotis, where the fuck are you?
2290;LAURA;Where's a fucking place we can have a stupid feast?
2291;MARISHA;If we can get to a safe, quiet place, I can do a Locate Creature spell and see if I can find him.
2292;MARISHA;I can also scry on him, but I need to--
2293;LAURA;You need something--
2294;MARISHA;Something not in this back alley of a street.
2295;LIAM;Did that devil who just left leave the door wide open, or did it shut it?
2296;MATT;No, the door slammed open and as it walked towards you guys, slammed it shut behind it.
2297;TALIESIN;Which way did the creature go?
2298;MATT;Loosely the same direction as where you were walking for the tower.
2299;LAURA, TALIESIN;Keep walking in that direction--
2300;TALIESIN;See if we can gently catch up, just to the vague periphery, so if I can see them, then great, and if not, oh well.
2301;MATT;Are you following this group?
2302;MATT;Is that what's going on?
2303;TALIESIN;(indecisive noise) From a gentle long distance, and not with great intent.
2304;MARISHA;Was he talking to the lemures, or to us?
2305;MATT;Talking to you guys.
2306;MARISHA;To back the fuck off?
2307;MARISHA;Okay.
2308;MATT;You were clustered around, apparently, his charge or--
2309;MARISHA;His, yeah, his people.
2310;MARISHA;Back the fuck off from my people, yeah.
2311;TALIESIN;That was a chain devil?
2312;MATT;No, this was a bone devil.
2313;TALIESIN;That was a bone devil?
2314;TALIESIN;All right.
2315;MATT;I can show you what that looks like.
2316;TRAVIS;Yeah yeah yeah yeah yeah yeah yeah!
2317;MARISHA;This means I could theoretically turn into him now that I've met them, right?
2318;MATT;Technically, yeah.
2319;TALIESIN;That won't go poorly.
2320;MARISHA;Nope!
2321;TRAVIS;Get.
2322;TRAVIS;The fuck.
2323;TRAVIS;Out of my nightmares.
2324;TALIESIN;(Minnesotan accent) Hello, we're from outta town, y'know?
2325;LAURA, MARISHA, TALIESIN;(Minnesotan accent) Oh, don't ya know?
2326;MARISHA;(Minnesotan accent) Yo, I got my Polaroid with me.
2327;MATT;Oh, hello.
2328;ALL;Oh, hello.
2329;TRAVIS;And we all fall out.
2330;TALIESIN;And we all die.
2331;TALIESIN;Too much Fargo lately.
2332;MATT;As you tail this from a distance, go ahead and make a stealth check, Percival.
2333;TALIESIN;Well, that's-- 15.
2334;MATT;Okay.
2335;TALIESIN;I'm not-- (indecisive noise) Keeping my distance.
2336;MARISHA;He's D-Rollin'.
2337;LAURA;They see me-- no.
2338;MARISHA;I love Laura bailing so fast.
2339;MATT;As you guys are following Percival's lead along the roads here, the heat is starting to really crawl under your armor-- those of you who are wearing it, you're fine, Grog.
2340;MATT;You watch as the lemures are dragged off into an alley to the right.
2341;TALIESIN;If they go to an alley, then I'm not going to go down an alley.
2342;TALIESIN;I'm going to walk by and maybe look down the alley from across the street, but I'm not-- I'm trying to stay on main roads.
2343;MATT;You make a large arc around and glance over.
2344;MATT;You can see them being pulled down the alleyway, and then to the left around the corner.
2345;TALIESIN;No-- That feels like a trap to me.
2346;TALIESIN;That feels like the sort of thing I would do if I wanted to shank someone in an alley.
2347;LIAM;I've done that, actually, that's true.
2348;TALIESIN;I knew you had.
2349;LAURA;Do I see any buildings that look like people are coming in and out raucously?
2350;MATT;Not yet, no.
2351;LIAM;What if we walked for a while and looked back.
2352;LIAM;Let's give it ten minutes, and then we'll figure something out.
2353;TALIESIN;We'll take a left at the next main thoroughfare.
2354;MATT;Okay.
2355;LAURA;He's going to keep an eye out for anybody watching us.
2356;MATT;Perception check.
2357;LAURA;While I'm looking for buildings.
2358;LIAM;27.
2359;MATT;Okay.
2360;MATT;You do hear the occasional screech in the air, as you see these winged entities in the distance just (screeching).
2361;MATT;As they just dive through and around the top of the city.
2362;MARISHA;Do we recognise what they are?
2363;MARISHA;Are they wyverns?
2364;MARISHA;What are they?
2365;MATT;No, there's a humanoid aspect to their bodies but they're just beyond the general red glow of the city to make out their details.
2366;MARISHA;I'm going to try and start focusing on that for the next walk.
2367;MARISHA;When one gets down close, I want to see if I can see what it is?
2368;MATT;Okay.
2369;MATT;Some of them look to be imps.
2370;MATT;Armored imps.
2371;MATT;These tiny little things that dive through.
2372;MATT;Some appear to be larger.
2373;MATT;Some have long tails that draw behind them, their giant leathery wings, and they just glide through.
2374;MATT;You get a glance at one that seems to have a human torso and legs that are hanging at its sides as it swoops through, like a sentinel just watching over the city.
2375;MATT;A lot seem to be doing arcs to and from the tower as you watch these patterns--
2376;LAURA;I could fly up in the air and see if I can spot a market.
2377;MARISHA;I could Beast Shape into something that's natural--
2378;LIAM;That's better.
2379;TALIESIN;Is it?
2380;LIAM;Better?
2381;LIAM;Well, I don't like anybody going up.
2382;MATT;Ten minutes' travel, Percival, by the way?
2383;MATT;Still not anywhere near closer to the tower.
2384;MARISHA;Weird thought: what if we try to walk away from the tower?
2385;TALIESIN;There is no walking away from the tower.
2386;LIAM;This is stupid.
2387;LIAM;What if I think about being in front of the tower?
2388;MATT;Do you just think about it?
2389;LIAM;Yeah.
2390;LIAM;That's it.
2391;MATT;Okay, so you walk towards the tower, but thinking about being there.
2392;MATT;So you guys keep walking for a bit.
2393;MATT;You get about two blocks before you see the next major road turns to the right, and there you can see, this road you've been on, which seemed sparse as far as the denizens of the City of Dis-- As soon as this big roadway opens to the right of you, the buildings seem to grow larger and taller, and they seem to almost twist and collide the higher they get.
2394;MATT;They're all constructed from metal and iron, but there's almost an organic, natural curvature at times that seems warped, causing a few to almost seem to collide and jut into each other at their peak.
2395;MATT;Many of them have these big, black metal chains that dangle from the outside, and giant, evil-looking hooks mounted onto the front of the buildings, some of which currently hold lemures that sit there and writhe on it, like a punishment for something they did.
2396;MATT;In the roads themselves, a lot of them have pikes jutting up, and it looks like sections of the road cracked open, and there are natural rock spikes and formations that have protruded out from the ancient construct of the city.
2397;MATT;But people just walk around them as they go.
2398;MATT;And you do see more people down this way.
2399;MATT;You see more of those devil-like creatures, you see a few tieflings in the distance.
2400;MATT;You see a few humans.
2401;MATT;You see a few fair-skinned folk wandering through.
2402;MATT;You see that same bone devil that earlier you saw emerge from the side alleyway about two blocks up, still clutching those three other lemures behind it by chain.
2403;MATT;It walks up to another bone devil that seems to be sitting off to the side, and is in the process of scratching the side of its horrible, bony chin and jaw.
2404;MATT;It comes up to it, and they both speak and snarl.
2405;MATT;You cannot read their lips, because they don't really have lips, and you don't know Infernal.
2406;MATT;But they both almost become a unit, and walking side-by-side head further down that path, with the three chained lemures behind them.
2407;MATT;Glancing over, you do see, as you've been focusing on the ground and around you, look up, and the tower has shifted position down to the end of that roadway.
2408;MATT;You thinking of it--
2409;LAURA;Was that what did it?
2410;MATT;No.
2411;MATT;It's still the same distance it ever has been.
2412;MATT;In the process of losing its sight from your peripheral, due to other buildings closing off your vision-- As soon as you lose sight of it entirely and reassess where your vision is on the horizon, there the tower is once more.
2413;LIAM;Does it always feel like it's dead ahead of us, all the time?
2414;LAURA;No, it's always off to the side, right?
2415;MATT;It changes.
2416;MATT;As soon as you become aware of the horizon, it becomes oriented wherever that awareness is.
2417;LAURA;How about I watch any of the people, the humanoids, or anything like that, that are together-- Can I see them talking, does it look like any of them are speaking Common, if I'm trying to read their lips--
2418;MATT;They're quite a ways away from you.
2419;MATT;You're not able to make out any detail.
2420;LAURA;I'll walk in the direction, just get in the area that they're in, so that I can try to read their lips.
2421;MARISHA;Once again, I want to keep an eye out, because I had a shitty perception check, for any birds, bats, beasts that I see flying?
2422;MATT;No birds, no bats, no beasts.
2423;MATT;There isn't a whole lot of indigenous wildlife within the Hells, it seems.
2424;MATT;Or at least nothing that would be considered a beast.
2425;MARISHA;Insects?
2426;MATT;Even the insect you saw earlier, or the insect-like creature, it had twisted, fiendish qualities to it on a very micro scale.
2427;LIAM;That was an ambassador.
2428;MARISHA;It probably was!
2429;MARISHA;That's the thing, it probably was!
2430;LIAM;I'm going to trail my sister by like ten feet and watch her back.
2431;MATT;You're moving closer to get a view of lip-reading.
2432;MATT;What's everyone else doing?
2433;TRAVIS;Is the ground as hot as the walls are?
2434;MATT;It is.
2435;MATT;Even as you're walking, you've grown somewhat accustomed to the uncomfortable heat that your boots are currently mustering.
2436;MATT;Thankfully, you guys are wearing footwear designed to endure environmental hazards, or magical footwear, for some of you.
2437;MATT;But you imagine if you were to stand still for too long in one place, it would probably end up damaging any sort of regular footwear worn.
2438;TRAVIS;Jesus.
2439;TRAVIS;It's like a parking lot in Texas.
2440;TALIESIN;Venice in August.
2441;TALIESIN;Beach, not--
2442;TRAVIS;Is there anything about the humans in particular?
2443;TRAVIS;Are they wearing anything unusual, or do they have any company with them that might denote why they're allowed to roam about?
2444;MATT;The two that you see ahead of you, a man and a woman, the man has stark white hair that is almost wet, and brushed very tight to the back of the skull, with a series of black and red markings or tattoos, or some sort of scar, that goes across one side of his face.
2445;MATT;A very, very thick nose piercing that connects to a chain that links to the back of his ear and is wearing layered, black leather armor.
2446;MATT;The woman, who is currently conversing with him on the other side, has long black hair with a shock of white that curls to the front.
2447;MATT;Her skin is a deep reddish brown, tan color, and her armor is a dull gray, like a cloth-patterned armor?
2448;MATT;But she seems to have at her side a very wicked-looking scimitar that is hanging at her belt, and she rests her arm on it, casually.
2449;MATT;You look just past them, and you can see they have two sacks resting on the ground as they're having this conversation, and a cage.
2450;TRAVIS;Empty?
2451;MATT;The cage is not empty, there is something inside, but you're not quite close enough to make out any details.
2452;MATT;You can just see there is a cage and some shape inside.
2453;MATT;You make a perception check.
2454;LAURA;That's cocked.
2455;LAURA;(deep voice) 27.
2456;MATT;I will say make a stealth check as well.
2457;MATT;This is to both get close enough to witness their conversation but not be noticed as overtly trying to--
2458;LAURA;17.
2459;MATT;Okay.
2460;LAURA;That was bad.
2461;MATT;You saddle up and instinctually go to lean on the wall.
2462;MATT;And go (winces).
2463;MATT;This is not conducive to your usual casual tactics.
2464;MATT;But you pay attention and you catch bits and pieces of their conversation.
2465;MATT;They're arguing about price.
2466;MATT;They are both talking about how much it's worth.
2467;MATT;Is it even worth bringing it here?
2468;MATT;We've come this far.
2469;MATT;We already have the offer.
2470;MATT;Might as well go through with it.
2471;MATT;One of them talks about how they hate the Fetters.
2472;LAURA;The Fetters?
2473;MATT;The Fetters.
2474;TRAVIS;(whispers) I bet it's one of those little dudes we had.
2475;MATT;Then one of them goes, let's get going, this place makes me feel uncomfortable.
2476;LAURA;I still can't see what they have in the cage?
2477;MATT;You can glance just barely past and you can see what looks to be some sort of a humanoid.
2478;MATT;Naked.
2479;MATT;You can't make out much more detail.
2480;MATT;You can't tell if it's male or female.
2481;MATT;It appears to be medium- to light-skinned.
2482;MATT;You can't get much detail beyond that from this distance, unfortunately.
2483;MARISHA;How big is this cage?
2484;MATT;It's maybe four foot by three foot.
2485;MATT;A little smaller, actually.
2486;MATT;It would be more like three foot by two foot, because it looks pretty cramped.
2487;LAURA;I'm going to walk up to them.
2488;LAURA;Before they walk away.
2489;MATT;As they both start turning to walk, one of them--
2490;LAURA;I'm going to be casual as I do it.
2491;LAURA;I just walk up.
2492;MATT;You can see there is a couple of chains fixed to the front of this cage and there is a handle of some kind that the guy lifts.
2493;MATT;There are small wheels you can now see that are fixed onto the cage that you can now see as it rolls--
2494;LAURA;I don't even look at the cage at all, like I don't give a shit about it.
2495;LAURA;And I walk up and I say--
2496;MATT;The woman immediately turns and sees you, and her hand moves from resting on the pommel of the blade to grasping the handle.
2497;LIAM;Same.
2498;LAURA;Oh!
2499;LAURA;Are you with me?
2500;LIAM;Ten feet behind you.
2501;LAURA;I signal at you to come over.
2502;LAURA;I don't want to look like I'm talking to the people, yet.
2503;LAURA;I'm just walking in their direction, and I lean over to my brother and say, God I hate this place, don't you?
2504;LIAM;Yep.
2505;LIAM;Pretty much.
2506;LAURA;(exhales) It's so hot.
2507;LAURA;I wish we were back home.
2508;LIAM;Everything fucking looks the same.
2509;LAURA;Right.
2510;LIAM;Nondescript bullshit.
2511;LAURA;I make eye contact with the woman as I say it.
2512;MATT;Make a subtle deception check.
2513;MATT;They are intensely paranoid, it seems.
2514;LAURA;30-- no, 20-- 21.
2515;MATT;She stands there, and keeps watching you.
2516;MATT;The guy who was pulling the cage stops, turns around and looks.
2517;MATT;You can see the chain swing and dangle for a second before coming to a stop as he glances back, his eyes iris-less.
2518;MATT;Just dark pupils with white around them.
2519;MATT;And he just-- not a snarl, but a very intense stare, he doesn't seem to be put at ease, but he's definitely paying attention.
2520;MATT;(cell phone rings)
2521;LAURA;Can I help you?
