;Player_Name;Transcription_Text
432;ASHLEY;I put it in the box.
433;MATT;You close the box.
434;SAM;I don't trust that thing.
435;TALIESIN;The burrowing eyeball?
436;TALIESIN;Are you sure?!
437;TALIESIN;(laughter)
438;TRAVIS;Holy shit!
439;SAM;I mean, I don't trust it near us.
440;ASHLEY;That's my favorite thing you've ever said.
441;SAM;Percy, I think you need to give it to me to hold.
442;TALIESIN;I think that's a terrible idea.
443;SAM;No, I can take care of it better than you.
444;TALIESIN;What makes you think that?
445;SAM;Just give it to me.
446;SAM;Trust me.
447;TALIESIN;You're bleeding out your eye right now!
448;SAM;I want revenge on this eye.
449;SAM;Give it to me so I can get revenge!
450;ASHLEY;Hold on.
451;ASHLEY;I cast Cure Wounds for his eye.
452;MATT;Yeah.
453;MATT;The eye wasn't removed from the socket, but the damage that was around it seems to have healed up from the mild Cure Wounds.
454;MATT;There's still the drying blood that has pooled down the cheek, but it appears that most of the initial damage has been sealed.
455;ASHLEY;Do you want me to hold it?
456;TALIESIN;I kind of want you to hold it.
457;SAM;I think I should hold it.
458;ASHLEY;I feel like I'm going to hold onto it in case it tries to attach itself to you again and you pull out your eyeball again.
459;TALIESIN;Yes, and that thing should be difficult to get out of.
460;TALIESIN;It it is a big case.
461;SAM;What if it can still hear us?
462;SAM;Sense where we are?
463;TRAVIS;"It's an eyeball; it doesn't have ears."
464;SAM;That is true.
465;SAM;That is a very good point.
466;TALIESIN;Well, if we're really amused by it, we just set off the light crystal that's in there and let it blind itself in there for a while.
467;TALIESIN;That would be funny.
468;TALIESIN;We have bigger problems.
469;TALIESIN;Diamonds.
470;TALIESIN;And Delilah.
471;TRAVIS;Oh yeah, she still goes in the bag, right?
472;TALIESIN;Oh, yeah.
473;TALIESIN;We're going to want to have a word with her later.
474;MARISHA;Even beyond the diamonds.
475;TALIESIN;Vex.
476;TALIESIN;Vex.
477;TALIESIN;He needs you here, now.
478;TALIESIN;I need you here.
479;TALIESIN;We're not done.
480;TALIESIN;This is not over yet.
481;TALIESIN;We are in trouble.
482;TALIESIN;We need to find a city.
483;TALIESIN;The two of you, I need both of you here.
484;LAURA;Of course, darling.
485;MARISHA;This was supposed to be a weekend trip.
486;TALIESIN;Nothing is ever what it's supposed to be.
487;MARISHA;Just a weekend trip.
488;TALIESIN;I know.
489;TALIESIN;Let's get this done.
490;MARISHA;Even after we find 25,000 gold pieces worth of diamonds, I've never brought anyone back before, and this is versus the Raven Queen.
491;MARISHA;How do we know if his soul is even available for return?
492;TALIESIN;How do we know that she is against us?
493;TALIESIN;This was Vecna.
494;TALIESIN;She may still be with us.
495;LAURA;I can't believe I left his soul over there, alone.
496;ASHLEY;We didn't.
497;LAURA;I did.
498;LAURA;I came back.
499;TALIESIN;We're not done.
500;MARISHA;Maybe we should talk to the Raven Queen.
501;TRAVIS;How do you do that?
502;LAURA;There's a temple in Vasselheim, and there's a temple in Whitestone.
503;MARISHA;Same way that he did.
504;TALIESIN;We need to find diamonds.
505;TALIESIN;Can we find them while we're here?
506;TALIESIN;Can we find them where we are?
507;LAURA;I don't know how you find diamonds in the Feywild.
508;TRAVIS;Percy, don't you know the Feywild?
509;TALIESIN;Where are we?
510;TRAVIS;Do we see any structures off in the distance, or is it all just overgrowth?
511;MATT;You are in the center, or at least completely surrounded by enclosed, dense, bluish-purple forest.
512;MATT;You cannot see above the canopy.
513;MATT;What little bit of light is visible seems to be from a bioluminescence beneath the fog.
514;MATT;As you pushed below, you could see what appeared to be bits of fungus that grew out of the forest floor.
515;MATT;The slowly dying off and decomposing leaves and fallen branches.
516;MATT;It's almost like this underlit glow, but you don't see any structures, no signs of civilization.
517;MATT;You have no idea where you are.
518;MATT;You've not been to this part of the Feywild.
519;MARISHA;Maybe our werewolf friends are still around.
520;TRAVIS;Yeah, I was going to say I have a terrible idea.
521;TRAVIS;I think they wanted to leave, so what if they know of some hidden treasure trove around here?
522;TRAVIS;That could, you know, tit for tit.
523;LAURA;I might be able to buy diamonds, as well.
524;LAURA;If we go to a city.
525;SAM;If we rest, I may be able to make them.
526;LAURA;25,000 gold worth of diamonds.
527;SAM;How big is that?
528;LAURA;It could be a lot of smaller diamonds.
529;SAM;But how big?
530;SAM;How many?
531;LAURA;I'll pull out one diamond that I have that's worth 1,500 gold.
532;TALIESIN;I feel within a tinker theory is how figuring out how much diamonds--
533;LAURA;We would need 20 more of these.
534;MATT;It can range based on the purity of the diamond, how well it's been cut.
535;MATT;You can make an intelligence check, if you'd like.
536;TALIESIN;That'll do.
537;TALIESIN;I feel like this would be in the wheelhouse.
538;LAURA;I have to blow my nose again.
539;TALIESIN;God, I am rolling just the worst.
540;TALIESIN;13.
541;MATT;13.
542;MATT;I mean, that's a lot of diamonds.
543;MATT;That can range, depending on the purity and where in the world they're found.
544;MATT;There's a standard amount when it comes to magic practices that aren't tailored to the cultural variations of cost.
545;MATT;You couldn't ask somebody, Sell me these diamonds, but for six times the cost, you know.
546;MATT;It wouldn't help the spell occur.
547;MATT;That's the general equivalent to the amount of diamonds that are consumed required for his spell.
548;MATT;You've never seen that many diamonds in one place.
549;MARISHA;We don't have a body, so we're basically making a diamond Vax.
550;TALIESIN;I know where there are diamonds.
551;LAURA;Where?
552;SAM;I can make them.
553;SAM;We just need an animal.
554;ASHLEY;How much can you make?
555;SAM;As much as the animal.
556;TRAVIS;Ooh, the bigger the animal, the bigger the diamonds?
557;MARISHA;I can make animals.
558;SAM;I mean, I know you're grieving, but we could give Trinket up for this.
559;MARISHA;I can make animals.
560;LAURA;Scanlan.
561;SAM;It was worth a try.
562;LAURA;You're such a shithead.
563;TALIESIN;There is a second thought, if this does not go well.
564;TALIESIN;Which was-- there was one place where we saw that many diamonds in one place before: Thordak.
565;TRAVIS;Surely they've cleaned all that up by now, right?
566;TALIESIN;Yes, but not everything left the city.
567;TALIESIN;There's enough there.
568;TALIESIN;It didn't get randomly distributed.
569;TALIESIN;I'm sure that they have it, and I'm sure that we can make a deal.
570;TRAVIS;Take a loan?
571;TALIESIN;I have something worth money.
572;TRAVIS;Was it a bad idea?
573;SAM;Taking out a loan?
574;TRAVIS;Yeah!
575;SAM;To buy diamonds?
576;LAURA;We have gold.
577;LAURA;We have plenty of gold.
578;MARISHA;What did Kraghammer mine?
579;MARISHA;What was their deal?
580;MATT;All sorts of things.
581;MATT;Many precious metals, gems, stone that was used for crafting, hewing into various forms of masonry.
582;MATT;Anything that could be reaped from beneath the Cliffkeep Mountains, that's what Kraghammer specialized in.
583;MARISHA;What if we go to a mine?
584;MARISHA;We could go straight to a source, buy direct?
585;LAURA;We could go to Kraghammer and buy, or we could try doing what Scanlan said.
586;SAM;We could try mine first, and if it doesn't work-- but I need to rest.
587;SAM;I can't do anything today.
588;LAURA;Should we get back to our world?
589;TALIESIN;We go to Kraghammer, rest there.
590;MARISHA;We can't.
591;MARISHA;We have to sleep before, unless there's a portal nearby that we can get through.
592;LAURA;Did you send us to the pond?
593;LAURA;I thought you took us to the pond.
594;MARISHA;It has to be nearby.
595;MARISHA;Plane Shift is general.
596;MARISHA;I pick an area, and it gambles where it's going to drop us.
597;MATT;And did you specify the location?
598;MARISHA;I did!
599;MARISHA;I said the Shademirk Bog and the pond, the glade.
600;MARISHA;I found the page in my notes and rambled all the names off very quickly in a panic.
601;MATT;What's interesting, when last you were in the Shademirk, you recall this being a very oil-thickened forest.
602;LAURA;Oh, you took us to where Saundor was.
603;LAURA;You didn't take us to the pond with the chick?
604;MATT;Correct, this is the Shademirk.
605;MATT;This is where you battled with Saundor.
606;MATT;However, the forest you're in now, if this is indeed the same location, it seems to have vastly recovered from the corruption that Saundor's presence gave, which is why it's both unfamiliar to you and not as oppressive as the last time you visited.
607;MARISHA;Didn't we-- nope.
608;MARISHA;I Plane Shifted us out.
609;LAURA;We have to spend the night here.
610;LAURA;Vecna's in our world.
611;TALIESIN;Vecna's in a box.
612;LAURA;How much power does he get from that eye?
613;TALIESIN;More than all of us combined, I'd imagine.
614;TRAVIS;If it burrows in the ground, it can't break out of the box, right?
615;TALIESIN;I don't know.
616;LAURA;Open the box and see what it's doing.
617;TALIESIN;We can look in the box without.
618;SAM;Give it to me.
619;SAM;I'll take care of it.
620;SAM;I'll send it away to a place where only I can get it.
621;ASHLEY;Can I take a peek?
622;MATT;Yeah, you open it up.
623;MATT;You hold it back and hold the door open.
624;TALIESIN;There's a glass thing so we can look through the glass.
625;MATT;Immediately, glancing in, you see it staring right back at you.
626;MARISHA;(horrified wail)
627;LAURA;"Don't send it to another plane; that's very fucking weird."
628;SAM;But it's a personal plane.
629;SAM;It's my plane.
630;LAURA;Are you sure nobody else can ever get into it?
631;SAM;I am not.
632;LAURA;Then no.
633;SAM;I don't know how this works.
634;SAM;"My daughter taught me this spell; I've never used it before."
635;LAURA;Then, fuck it, we're not doing it.
636;SAM;It goes into a little pocket dimension!
637;SAM;Is what she told me.
638;SAM;I don't even know what that means!
639;LAURA;That's really weird.
640;TALIESIN;What if it's the Vecna dimension?
641;SAM;Here, let's try something.
642;SAM;Just give me something, I'll send it there now.
643;SAM;I don't know what that'll do.
644;ASHLEY;How will we know it's there?
645;SAM;Give me Trinket.
646;LAURA;No!
647;LAURA;Stop it!
648;SAM;I can't do Trinket.
649;SAM;It has to be less than five pounds.
650;TRAVIS;Less than five pounds?
651;SAM;Yes.
652;ASHLEY;It has to be something small?
653;SAM;Yeah.
654;MARISHA;No!
655;MARISHA;No, don't consider it Pike, no!
656;SAM;Give me anything.
657;TRAVIS;Do you want a pair of manacles?
658;SAM;Sure!
659;TRAVIS;Here's a pair of manacles.
660;SAM;All right.
661;SAM;I will use Wrist Pocket!
662;MATT;You watch as he holds the manacles and does a flourish with his hand and they vanish from sight.
663;ASHLEY;How do you know if they're there?
664;SAM;I don't know where they are!
665;SAM;I literally have no idea, but watch this!
666;MATT;They seem to apparate immediately into his grasp.
667;SAM;I don't know how I even do that!
668;LAURA;Cool.
669;LAURA;We're not using a random-ass magic trick on an eyeball.
670;ASHLEY;Did you just point at me and tell me to come to you so you can make me disappear and come back?
671;SAM;No!
672;SAM;The eye!
673;SAM;I can get rid of the eye!
674;ASHLEY;No, it makes me nervous, Scanlan.
675;ASHLEY;I want to keep our... eyes on it.
676;ASHLEY;(laughter) Fuck off!
677;SAM;Maybe we should vote on this.
678;SAM;Should we give it to me?
679;SAM;Who says aye?
680;TALIESIN;You can buy my vote.
681;SAM;I don't have that much.
682;TALIESIN;Yes, you do.
683;TALIESIN;You can buy my vote.
684;SAM;I don't have enough.
685;LAURA;Are there any animals around?
686;MATT;Make a nature check.
687;LAURA;Natural 20.
688;MATT;You're familiar with forests, definitely, and you can see telltale signs of scurrying, telltale signs of track marks in the ground, feces left behind by living creatures.
689;MATT;You do see signs of things that live throughout these forests everywhere.
690;LAURA;Anything that looks like it would be the size of an adult deer or something?
691;TRAVIS;Doe, a deer?
692;TRAVIS;A female deer?
693;LAURA;I'm thinking a male deer.
694;LAURA;Yes, a stag.
695;LAURA;A white stag.
696;LAURA;Any stag, really, just an animal that's big.
697;MATT;You see a number of tracks that would resemble creatures of that size or larger.
698;MATT;Some seem bear-like, some seem larger than that, though similar claws and heavy footprints.
699;MATT;Some that are smaller and skittery.
700;MATT;You see there was a small cluster of what might be deer-like creatures, but you're not quite sure what the tracks are.
701;MATT;There's plenty of life that wanders through here.
702;MATT;Apparently, since you've arrived, none that seem bold enough to approach you too closely in this clustered clearing you're in.
703;MATT;Can't even call it a clearing, because you maybe have a total of ten feet you're all crammed into at this time.
704;TRAVIS;If we howl, right?
705;ASHLEY;Are we down?
706;LAURA;Yeah, we haven't healed since--
707;TALIESIN;We are wrecked.
708;ASHLEY;How's everybody doing?
709;LAURA;I'm low.
710;SAM;Aren't you low, Pike?
711;SAM;Like 11 or something.
712;LAURA;I mean, we're about to rest.
713;LAURA;You're probably super low.
714;ASHLEY;I think am, let's see if I wrote it down here.
715;ASHLEY;Oh, yeah!
716;ASHLEY;I forgot!
717;ASHLEY;I'm almost dead.
718;LAURA;Trinket's unconscious still in my necklace.
719;ASHLEY;Okay.
720;LAURA;He's unconscious.
721;LAURA;I pop him out, if you're going to heal us.
722;MATT;(magic noise)
723;TRAVIS;Aw, buddy.
724;LAURA;I start crying again.
725;SAM;I turn him into diamonds.
726;LAURA;You dick!
727;LAURA;You're such an asshole.
728;MATT;All right, so what are you guys doing?
729;LAURA;Pike's going to heal us.
730;TALIESIN;Heal and sleep.
731;LAURA;I'm going to kill something.
732;TALIESIN;Let Keyleth make something big.
733;MATT;What are you casting, Pike?
734;ASHLEY;Mass Cure Wounds.
735;MATT;Mass Cure Wounds?
736;MATT;All right, go for it.
737;LAURA;Will it work on a magical animal, or does it have to be a real animal?
738;SAM;No, it can work on anything, I think.
739;SAM;I've never turned anything into diamonds.
740;TRAVIS;If I had that, I'd be doing that all the time.
741;SAM;You're right.
742;SAM;In retrospect, I should have been doing this literally every day.
743;SAM;I just learned the spell a week ago.
744;TRAVIS;Why are you dealing drugs?
745;TRAVIS;Just be like boop!
746;SAM;Yeah, but look at this!
747;SAM;It's gone!
748;SAM;It's back!
749;SAM;Cool, right?
750;TRAVIS;And think how useful that will come in the bedroom.
751;TRAVIS;Manacles!
752;TRAVIS;Nobody?
753;TRAVIS;Cool.
754;LAURA;I was like, pocket dimension?
755;ASHLEY;You all heal 31 points.
756;ASHLEY;It's something.
757;MARISHA;31?
758;MARISHA;All of us?
759;MATT;Everyone healed 31.
760;MATT;Trinket gets up, (bear grumbling).
761;LAURA;Yeah.
762;LAURA;Hey, Trink.
763;SAM;You guys need more healing?
764;SAM;I could try to give us more.
765;LAURA;We're going to rest.
766;LAURA;Are we safe to leave fucking-- there's nothing we can do, at this point-- to leave Vecna in the world.
767;LAURA;We can't do anything!
768;TALIESIN;We have one problem at a time.
769;TALIESIN;We have Delilah, and we will deal with--
770;MARISHA;What do you want to do with Delilah?
771;MATT;She's been stuffed into the Bag of Holding.
772;TALIESIN;We're going to talk to her.
773;TALIESIN;We're going to see what we can learn.
774;TALIESIN;We're going to be very thoughtful about what we talk to her about, and we're going to find a way of making sure that this is the last time we put her in the ground.
775;TALIESIN;By hook or by crook.
776;LAURA;Don't cry on camera and then have to blow your nose a bunch!
777;SAM;She says to a nearby tree.
778;ASHLEY;Should we try killing an animal and seeing how many diamonds you get out of it?
779;SAM;I can't try anything today.
780;LAURA;Okay, we have to wait.
781;TALIESIN;Tomorrow, we go to Kraghammer, we make an animal.
782;LAURA;We don't have the mansion tonight.
783;SAM;No.
784;ASHLEY;Do you want to Speak with Dead before bed, or do you want to sleep on it?
785;TRAVIS;"We don't need the mansion; I got all my hit points."
786;TRAVIS;I'm good.
787;TALIESIN;I don't think I'm in the right mind to even think of anything to say to her that isn't just rage, at the moment.
788;LAURA;We need to get up in a tree.
789;LAURA;I don't know what's in this area.
790;LAURA;I saw some tracks that didn't look friendly.
791;TALIESIN;Let's get up there.
792;TRAVIS;Aren't these trees dangerous in their own right?
793;TALIESIN;They seem like they've quieted down.
794;LAURA;"We healed this forest; it should thank us."
795;TRAVIS;Okay.
796;TRAVIS;Did the bow talk to the trees or anything?
797;TRAVIS;Fenthras.
798;MATT;Interesting.
799;MATT;With the natural 20 nature check you made earlier: there is, I don't want to say, not a kinship, but a sense of understanding between you and the surrounding forest.
800;MATT;"It's hard to explain, and you haven't really had this sense before; this is more a Keyleth territory of having this connection with nature."
801;MATT;But it's because you wield Fenthras and were responsible in a large way for cleansing this landscape, that as you begin to approach and look for trees for a place to sleep, you watch as one tree, the branches seem to bend down to form a small ladder.
802;MATT;You watch as the boughs above separate and create an easy-to-lay-down cluster of branches and leaves.
803;TALIESIN;Small miracles.
804;MARISHA;They like us now.
805;LAURA;Thank you.
806;TRAVIS;"You guys crash; I'll take first watch."
807;LAURA;I'm going to pull the armor up so we can keep it.
808;LAURA;Did you want--
809;MARISHA;Yeah.
810;MARISHA;We cuddle between the armor.
811;TALIESIN;That's weird.
812;TALIESIN;I'm not getting into it.
813;MARISHA;That's the saddest thing.
814;MATT;That's pretty sad.
815;MATT;All right.
816;MATT;The rest of you find yourselves to a night's rest, seemingly protected for the time being by the surrounding Shademirk Forest, no longer the Shademirk Bog.
817;MATT;And unconsciousness takes you, Grog taking first watch.
818;MATT;Now, I'm going to ask you guys, if you wouldn't mind, to step into the kitchen.
819;TRAVIS;What, me?
820;SAM;Everybody but Grog?
821;MATT;Everybody but Liam.
822;LAURA;Oh fuck me running.
823;LAURA;We're jacking off.
824;MARISHA;Jacking off.
825;MARISHA;Oh man.
826;ASHLEY;No, I feel like you're going to make plans.
827;LAURA;What are you going to do while we're not in here?
828;TRAVIS;Go.
829;SAM;A whole new show.
830;LIAM;Spin-off.
831;MATT;All right, we're getting Liam back in here.
832;MATT;Shoo.
833;MATT;No, we'll probably have you back in.
834;MATT;Getting tangled?
835;MARISHA;Don't die forever.
836;MATT;We'll wait for them to leave the room.
837;MATT;Vax'ildan.
838;MATT;As your eyes dart back and forth, glancing upward at the sky above, snow hitting and stinging your paralyzed eyes, you see the terrible lich above you, a flash of green, then darkness.
839;MATT;Floating without weight, without temperature.
840;MATT;"You glance around in the surrounding shadow and cannot see anything; your hands before you, nothing."
841;MATT;It is just void, darkness.
842;MATT;You will yourself to see something, anything, and in an instant, you begin to glow.
843;MATT;Your form becomes visible around you.
844;MATT;You can now see your body, nude and held aloft in this dark space, emanating this soft, vibrant orangish-white light.
845;MATT;As the light begins to emanate and cast away the darkness, you also see what appears to be a tangling of some sort of web: strands of silk that also begin to glow with a similar light as to your form that holds you tightly in your position.
846;MATT;You struggle, but you're held firm.
847;MATT;You think you yell out, but as you glance upward to shout for help, you see the shadows now curl back to reveal the familiar sight of a massive white porcelain woman's face.
848;MATT;Eyeless, yet staring straight at, if not through you.
849;MATT;Her presence, imposing as it may be, soothes you as her giant hand, larger than a house, a palace, it seems, almost, emerges from below and gives you a ground to step on, your feet finding purchase in the center of her dark palm.
850;MATT;As your feet touch her palm, the silk web seems to loosen.
851;MATT;You cast off the threads and fall to your hands and knees.
852;MATT;You take a moment, and you hear that soft voice once more.
853;MATT;My champion, you return to me and tear a swath through the tapestry.
854;MATT;Please, be calm.
855;MATT;My sight can pierce many veils, but you've been hidden from my sight in recent days, and I am worried what foulness has turned its intent upon us.
856;MATT;Now, here you come to me, your very thread frayed and soul transitioning.
857;MATT;An unexpected destiny for my beautiful fate-touched.
858;MATT;One of her fingers curls through your hair at the back of your head.
859;MATT;Tell me what you have seen.
860;LIAM;Your enemy.
861;MATT;I have many enemies.
862;LIAM;Vecna.
863;MATT;What does this Vecna intend?
864;LIAM;He's come... he's come back to our world.
865;LIAM;My home.
866;LIAM;My family is in danger.
867;LIAM;The world is in danger.
868;MATT;How so?
869;MATT;How can one man be this dangerous?
870;MATT;What does he intend?
871;MATT;What have you learned?
872;LIAM;I don't know.
873;MATT;I wonder why he guards my sight.
874;MATT;Well.
875;MATT;She goes into quiet contemplation for a moment.
876;MATT;You see the strands of hair that emanate from the sides of the mask slowly shifting like waves on an ocean.
877;MATT;This Vecna comes to your world to be a king?
878;LIAM;That or grind us all into dust.
879;MATT;This is historical.
880;MATT;Mortals continuously intend to find others to grind into dust.
881;MATT;If this being has the power to block my sight, he has power beyond a mortal realm.
882;MATT;Did you see anything?
883;MATT;Anything else?
884;LIAM;We traveled to the Shadowfell.
885;LIAM;There was a tower, and he had servants.
886;LIAM;He had powerful servants.
887;LIAM;A woman that we've fought before, and another, a man, a creature.
888;LIAM;I don't know.
889;LIAM;With a blade, a dark blade.
890;LIAM;And he was too powerful for us.
891;LIAM;He crushed us.
892;MATT;And in your short spark with him, you learned nothing more of his plan?
893;MATT;No hint of what he's plotting?
894;LIAM;He threw me to the ground the first second he laid his eye on me.
895;LIAM;He murdered my sister.
896;LIAM;I thought we had come to an arrangement.
897;MATT;We have.
898;LIAM;Where is my sister?
899;MATT;She lives, still.
900;MATT;She is beyond my influence.
901;MATT;However, your body is ash, and your soul is steeped in the divine energies that uphold the paths between life and death.
902;MATT;You've earned your eternal rest.
903;MATT;The mask begins to recede into the darkness.
904;LIAM;No.
905;LIAM;No!
906;LIAM;Come back.
907;LIAM;No!
908;LIAM;I will not leave them behind.
909;LIAM;I want to help them, still.
910;MATT;The faint gray of the mask that begins to fade into shadow stops and comes back even brighter, vibrant, almost.
911;MATT;You sense the mystery of the Raven Queen shift from this entity that dodges and weaves to instead a pillar of power of life and death that is both awe-striking and awe-fearing.
912;MATT;And for a moment, you realize how small you are in her presence.
913;MATT;You truly see, to seek this, to bring it to its end?
914;LIAM;Whatever it takes.
915;MATT;Your resolve is admirable.
916;MATT;Your love of your chosen family is vibrant.
917;MATT;What I offer you is the power to see this conflict through to its end.
918;MATT;You will be briefly beyond the very grasp of death, and I will hold back any attempt for you to transition.
919;MATT;You will be a bulwark of my power in cold flesh, walking between heartbeats, unstoppable.
920;MATT;You will have the power to walk once more with Vox Machina, with your sister, with your Keyleth.
921;MATT;And should you use this power wisely, perhaps save Exandria, save them, save her.
922;MATT;But when it's done and this foul, undying king lies dead or sealed, you will return to me, my champion, evermore.
923;MATT;The imposing image now shifts and changes.
924;MATT;In an instant, the giant being is now the simple woman, the mask you once saw removed now missing.
925;MATT;And there, the somewhat sad, beautiful pale face of the Raven Queen as she steps forward.
926;MATT;The silence is broken by the sounds of her footsteps across nothing.
927;MATT;(footsteps) Her hand comes up.
928;MATT;Warm.
929;MATT;You weren't expecting, as it traces across your brow and curves across to your chin and pulls it up.
930;MATT;Do you accept my gift?
931;LIAM;You have such loneliness in your eyes.
932;MATT;Perhaps you will keep me company when you come back to me.
933;MATT;Do you accept?
934;LIAM;I do.
935;MATT;Then so be it.
936;MATT;You, whose nature bucks destiny, my beautiful thing.
937;MATT;Go.
938;MATT;Share what you have shared with me with others like me.
939;MATT;Take what you can learn of this Vecna's plans, for if he can block his intent from one, who knows what he plots against the other powers beyond the gate?
940;MATT;Learn from them.
941;MATT;Ask them.
942;MATT;You have my blessing.
943;MATT;They have theirs to give, as well, and they may be all that stands between the ruin of this world and you.
944;MATT;Let their blessings turn the tides, Vax'ildan.
945;MATT;But use your time wisely, for corruption like this waits for no one.
946;MATT;Now.
