;Player_Name;Transcription_Text
1136;MATT;That's not bad. You have to leap across to get to the smaller platform that's going up, because there are the breaks in it. What's your strength? Ten?
1137;JENNIFER;Zero.
1138;MATT;Right, so maximum ten. So you get about a 10-foot jump across that way. It's about a 10-foot jump to get to that smaller platform. You, keeping low, using the balls of your feet, make a leap for it, just catching the edge ever so carefully. If you can make an acrobatics check to use your momentum to tumble onto it.
1139;LIAM;Acrobatics, you say?
1140;JENNIFER;12 total.
1141;MATT;12! Okay. You barely use your momentum to not tumble backward towards the molten rock below.|Using your shoulder, you roll, and using your momentum you come to the other side of that and leap a second time towards that other side of that platform. I need you to make one more check for me.
1142;JENNIFER;13.
1143;MATT;13. All right. So you leap, tumble, and you make your way across the platform. As you stand there, looking around, you get a quick glance down into that little alcove below as you take in the circumstance. You see there, there are two figures. They are armored, they are lying down, and they are skeletal. They are long burned away.|The flesh is gone. They long died there. Either they were trapped and couldn't find a way out and slowly starved or dehydrated, but there's nothing but a pile of their equipment, their weapons, their armor, and bone. At this point, the floor below you gently rumbles a bit, and you watch as some of the metal scraps scrape across the ground on their own. They leap up into the air and form bracers, some sort of large, thick pieces of armor, separate, as molten rock shoots up and flame ignites, filling the center of the empty armor into a large, elemental-like enemy made of fire and magma within the armor. You watch as this magma rager, appearing, giving this flexing roar, goes charging towards you. What are you doing?
1144;JENNIFER;Am I doing this?
1145;MATT;Well, you're definitely not hidden from it yet. You have to hide first.
1146;JENNIFER;Okay. Strength is not my thing. I think I'm going to run.
1147;MATT;Okay. So you run back the opposite direction, leap, head across the way. Go ahead and make an acrobatics check.
1148;JENNIFER;22.
1149;MATT;Fine. You spin, roll off your shoulder, leap, a second time on the other side, and make one more acrobatics check.
1150;JENNIFER;16.
1151;MATT;Not a problem. You make it across to the other side and you watch as this large, raging elemental stops at the edge, scoots back, and stands there, waiting, on the center platform.
1152;JENNIFER;Well, at least now we know.
1153;LAURA;That's intimidating. What about the two things laying in wait? Were they setting a trap?
1154;JENNIFER;They were skeletons. They were done.|They were dead.
1155;LAURA;They were undead?
1156;JENNIFER;They're dead.
1157;LAURA;Just dead.
1158;JENNIFER;They were regular dead.
1159;LIAM;Well, that's iffy. You know. But also tempting. Because what did they have when they died?
1160;LAURA;We should definitely check it out.
1161;LIAM;I can chuck you over.
1162;LAURA;But there's a giant flame monster.
1163;LIAM;Well, yeah. First one thing, then the other.
1164;LAURA;How are we going to beat him?
1165;TRAVIS;I could stun him.
1166;LAURA;You think that would work?
1167;TRAVIS;Might. We'd have to be fast. And no one could fall.
1168;LIAM;I'm not going to fall.
1169;TRAVIS;Why did you think I was saying that you would fall?
1170;LIAM;You were staring straight at me.
1171;TRAVIS;Was I?
1172;LIAM;Oh, yes.
1173;TRAVIS;One of us could fall.
1174;LIAM;Now you seem sarcastic, because you're rolling your eyes.
1175;LAURA;I'm not very good at jumping, but I can cast Fly on myself.
1176;JENNIFER;(gasps) She is invisible. She has invisibility.
1177;TRAVIS;Yeah, I think we have to get to-- did you trust Skeever?
1178;LAURA;Reeks?
1179;TRAVIS;Yeah.
1180;LAURA;Well... Hey, that's a good point. Reeks?
1181;MATT;"""Yes?"""
1182;LAURA;Why didn't you warn us about the giant monster in the middle there?
1183;MATT;"""Sorry, I forgot."""
1184;LAURA;Did you?
1185;MATT;"""Yes."""
1186;LAURA;What happened to your voice?
1187;MATT;"""What?"""
1188;JENNIFER;Did they die from the monster in the middle because they are on the far side? Or did they die trying to get out that entrance because it is not really an entrance?
1189;LAURA;That's deep. Maybe they just fell, and they couldn't climb back up.
1190;TRAVIS;They had to have gotten there for a reason, right?
1191;LIAM;There are these big bruisers floating there, staring at us.
1192;MATT;Just staring at you, yeah.
1193;LIAM;You can fly.
1194;LAURA;Yeah!
1195;LIAM;I have seen you do it so many times. Can't you skirt the edge of this room and go over there? You don't need to go through this guy.
1196;LAURA;Over to the alcove?
1197;LIAM;Sure, see if there is anything worth, you know. This is what we live for.
1198;LAURA;I can try.
1199;TRAVIS;Fly fly away. Fly far away.
1200;LIAM;I am not going, too much hassle.
1201;MATT;"""Be careful. It's dangerous. Big fire thing."""
1202;LAURA;Okay. What did you say?
1203;MATT;"""Big fire thing."""
1204;LAURA;Yeah, how do you make him go back to sleep?
1205;MATT;"""Don't let him know you came."""
1206;LAURA;Okay. Tell you what, Lohkor. Will you hold his leash, please?
1207;TRAVIS;Sure!
1208;LAURA;I'm going to fly! I know exactly how to do it.
1209;MATT;You cast it on yourself. It's a concentration for I believe up to an hour?
1210;LAURA;Ten minutes!
1211;MATT;Ten minutes. Even better.
1212;LAURA;Sure, yeah, I'm going to fly. And I'm going to try to go over to that little alcove and see what happens.
1213;MATT;All right. So you watch as the tiny gnome suddenly takes off and begins gliding across the roof of this magma area.
1214;LAURA;And I'm giving the creature a wide berth.
1215;LIAM;Look, Laura, you're finally doing it.
1216;MATT;As you're doing it, you watch as the magma rager stares and tracks her as she goes. And as you head across the way, it shifts to the very edge of the platform, almost tensing at the border and watches as you slowly descend towards this platform. As you come down, make a perception check.
1217;LAURA;17.
1218;MATT;Glancing, you look down. Yeah, they are charred and long dead. The armor appears to be burned away. There are a few pieces of equipment that have lasted okay, although covered in black soot. There's a couple of small satchels that are left there and looks like they were back to back.|Just hoping for help or trying to find a way off, and eventually, they expired.
1219;LAURA;I'm sorry you had a tragic ending. I'm going to keep flying around them. I don't want to touch my feet to the ground, in case something comes out of the ground. But I'm going to dig through all of their shit and see what I can find.
1220;MATT;Make an investigation check.
1221;TRAVIS;Wow. One.
1222;LAURA;Goodbye.
1223;MATT;Okay. Glancing through, most of it falls apart as you grasp it. The armor crumples and falls apart as you touch the armor. The only thing that catches your attention because it is the one piece of equipment that is shining amongst the rest, is in one of the sheaths. There is a blade, that as you pull it out, it's got this beautifully wicked metal that curves into a point at the end, like a forked point. It's got a bit of an energy pulse gem in the center of where the hilt is. And as you reach over to look at it, it looks pristine untouched by time. (burps) Pardon me! A little effervescent tonight, apparently! The soot wipes off of it cleanly.
1224;LAURA;I hold it aloft. I found a weapon. I'll bring it back over to you guys.
1225;LIAM;I also talk to you.
1226;MATT;"At this point, Aluneth does whisper and say ""You've already found a weapon. This is of no use to you."""
1227;LAURA;I'm not going to keep it. I'm going to give it away.
1228;MATT;"""Good. The sooner, the better."" Goes silent.|You watch as, coasting over, blade forth, the magma rager still tensing against the edge as she flies overhead."
1229;LAURA;I wave it towards the creature as I fly by, but I don't get close enough to really do anything.
1230;MATT;Greldamine finally lands on the ground, presenting the blade.
1231;LIAM;What kind of blade? How big is this thing?
1232;MATT;It's a longsword. It's big for a longsword, but it does technically act as a longsword.
1233;LAURA;Which one of you would like this beautiful blade?
1234;TRAVIS;I would like to see it.
1235;LIAM;I would also, but I would do roshambo with you.
1236;TRAVIS;Yep.
1237;LIAM;Okay. Best out of three, or just one time?
1238;TRAVIS;One time. Throw on four.
1239;LIAM;On four?! I have intelligence of eight.
1240;TRAVIS;Throw on three.
1241;LIAM;Throw on three?
1242;TRAVIS;Throw on one.
1243;LIAM;Why are you changing it on me? Let's do it on two. We go one, two, shoot. Okay? All right.|One, two, shoot! Oh shit, two papers. We go again.|One, two, shoot! Give me that shit.
1244;MATT;It's a very fine blade.
1245;JENNIFER;What's the name of her sword again?
1246;MATT;Aluneth.
1247;LAURA;It's a staff.
1248;JENNIFER;Sorry. Does Aluneth have anything to say about where we are?
1249;LAURA;Oh mighty Aluneth, do you have anything to say about where we are?
1250;LIAM;You seem very crazy right now.
1251;LAURA;It talks, I swear.
1252;MATT;"The voice comes back in from the aether. ""I do despise these subterranean regions. I don't recognize where we are. This world has changed quite a bit since I last walked its surface."""
1253;LAURA;Yes.
1254;JENNIFER;How long since you walked its surface?
1255;LAURA;How long since you walked its surface? I mean, I know, I've heard about Aluneth before.|It's very ancient.
1256;MATT;"""Of course you have. I don't know, generations."""
1257;LAURA;Long time.
1258;TALIESIN;Could you fly over to the--
1259;MATT;Do you wish to attune to the weapon?
1260;LIAM;Hell yeah. I am attuned to nothing, so I will attune to this.
1261;LAURA;You want me to go over to the collapse?
1262;TALIESIN;Yeah, lead the creature over to that section.
1263;LAURA;Oh, okay! I'm going to fly over to the collapsed area, because I've still got a little time left, right?
1264;MATT;Okay, so you coast over to the collapsed area.
1265;LAURA;And I land. Now what do you want me to do?
1266;TALIESIN;I'm going to try and cast Hold Person on the creature.
1267;LAURA;Wait, I'll wave my arms so he walks toward me.
1268;MATT;Make an intelligence check.
1269;TALIESIN;God, it won't work on him, will it?
1270;MATT;Yeah, so the creature heads over and it's focused on you. What'd you get?
1271;TALIESIN;I got 20.
1272;MATT;20. You get the sense that Hold Person mainly affects small humanoid creatures. A large elemental like this would not be held by a spell.
1273;LAURA;Is an elemental considered a monster?
1274;MATT;It's considered a monster.
1275;TRAVIS;Creature, though.
1276;MATT;So you discovered your weapon.
1277;LIAM;"Yes. This was made for me. Should I be describing this to the table? Yes, this is called Adventurefury, Blessed Blade of the Thrillseeker.|This weirdly pristine longsword is encased in meticulous, almost gaudy, gold scrolling and rune-like carvings that spell out phrases like, ""Carpe Diem"", like your shirt with donut, and ""You only live once."" You gain plus two to all attacks and damage rolls made with this weapon. You are immune to fear and, if you ever attempt to flee from danger, you must make a wisdom saving throw, DC 12. On a failure, you instead rush toward the challenge in hopes of glory. YOLO!"
1278;TRAVIS;Yes! That's a great item!
1279;MATT;It's Adventurefury, Blessed Blade of the Thrillseeker.
1280;TRAVIS;Oh my god! Damn!
1281;LAURA;Is that an actual blade in the game?
1282;MATT;(chuckling) No.
1283;LAURA;Please make it an actual weapon in the game.
1284;MATT;It's an inside joke.
1285;LIAM;For Argus and for LRJenkins1234.
1286;TRAVIS;I could try to stun him if we all wanted to make a break for one side or the other. I'm not sure if it would work, so, any other ideas?
1287;JENNIFER;Which side?
1288;LAURA;Straight through, I think! I mean, that's what Reek said.
1289;TRAVIS;Wasn't Reek lying?
1290;LAURA;No! He's very trustworthy.
1291;JENNIFER;I think there's something on the other side that we don't know. We need to know.
1292;TRAVIS;I cast Zone of Truth.
1293;MATT;Okay. What's your spell DC? Oh, 13, right? Nope.
1294;LAURA;Yay!
1295;TRAVIS;Cheeker-- what's his name? Oh, right, Reek.
1296;MATT;"""Reeksus."""
1297;TRAVIS;Do you really know the way back to Tagwaggle?
1298;MATT;"""I do, yes!"""
1299;TRAVIS;Which direction is it?
1300;MATT;"""That would be (straining) right!"""
1301;LAURA;He lied to me!
1302;TRAVIS;He did. I'm sure it's nothing personal, though!
1303;MATT;"""I'm bad with directions!"""
1304;LAURA;He's telling the truth! Do you like us? Aww. Do you like me?
1305;TRAVIS;No, he has to answer.
1306;MATT;"""I endure you!"""
1307;LAURA;I'll take it!
1308;MATT;I endure you.
1309;LIAM;Hey, Shakira, do you fear me?
1310;MATT;(panicked wimper)
1311;LIAM;Good, that's all that matters. Let's go.
1312;LAURA;I think I'm running out of my ten minutes.
1313;MATT;You're getting down to the last couple of minutes.
1314;LAURA;I need to stand up and I need to fly away from this place, or else I'm going to be stranded on this side!
1315;TALIESIN;You can land wherever we need to be.
1316;LAURA;Yeah, that's what I'm going to do, but I want to fly around to the other side.
1317;MATT;Okay, so you coast around to this platform over here and land on the opposite side of the bridge. The magma rager spins and is flexing in the direction of where you are.
1318;TRAVIS;While the Zone of Truth is still active, Bundle, what are you the most afraid of?
1319;MATT;Make a wisdom saving throw.
1320;TALIESIN;Oh! That's a 24.
1321;MATT;Answer as you feel.
1322;TALIESIN;Not you. Not even a little. You're so soft and squishy.
1323;TRAVIS;No, see, if it was a spider, then I could take care of it for you. I don't want to leave you in an awkward situation.
1324;JENNIFER;Should we leave you two alone?
1325;TALIESIN;No.
1326;MATT;"""Yes!"""
1327;TALIESIN;Well, you only live once.
1328;LAURA;What are you going to do?
1329;TRAVIS;Do it.
1330;TALIESIN;I'm going to make a run for it. Fuck it.
1331;MATT;What's your strength?
1332;TALIESIN;My strength is 16.
1333;MATT;16? That's easy enough for you. You run and leap, big dwarven strong legs. You leap across. You land on the center platform, at which point the magma rager turns to face you. What are you doing?
1334;TALIESIN;I'm going to cast Sacred Flame, which I know will do very little on him, but it might temporarily irritate him. I'm going to run the opposite direction.
1335;MATT;Okay, Sacred Flame. So he makes a dexterity saving throw. No, it's an action to do that.
1336;TALIESIN;Oh, it's an action to do that? Should I burn my action running?
1337;MATT;To dash? You can, if you want to. Okay, you go running as it goes charging toward you. It's going to go ahead and attempt to make a charge-slam attack. That is going to be a 23 to hit.
1338;TALIESIN;Oh my god, yeah, that hits.
1339;MATT;Double ones on the attack, so only six points of bludgeoning damage.
1340;TALIESIN;I can live with that.
1341;MATT;Six points of fire damage.
1342;TALIESIN;I can live with that too.
1343;MATT;As it slams into you, you immediately get pushed 15 feet back into the air. You arc backwards. As you're falling back, you can look, you're edging toward where the central platform where you were before you go to the middle one, and off to the side where the lava is. Go ahead and make an acrobatics check.
1344;TALIESIN;God, if I have to do an action, I hope I can get an action before this happens. Acrobatics check, oh god.
1345;TRAVIS;Why'd you give the Snitch back?!
1346;TALIESIN;Because I'm an idiot! 20.
1347;MATT;20? You barely manage to catch yourself on the edge and roll back up (straining) onto the platform. The magma rager is right there staring at you, its burning coal magma eyes angrily staring at your dwarven form.
1348;TALIESIN;So where am I now?
1349;MATT;You are now currently right here in the center, yeah.
1350;LAURA;Oh, he ran backwards?
1351;MATT;He slammed into him as he ran toward him and pushed him back onto the middle platform. At least he didn't fall in.
1352;LAURA;Okay, I have an idea. Is he considered fighting us right now, or is he just staring?
1353;MATT;I mean, in theory, it can't seemingly do anything at you from range, so he's waiting for somebody to come to his platform. If you decide to then assault him on the middle platform, there'd be an initiative roll. But right now it doesn't seem to have any means of attacking at range.
1354;LAURA;Okay, then I'm going to cast Charm Monster on the creature.
1355;MATT;Okay. So this is your 4th-level?
1356;LAURA;It is.
1357;MATT;It rolled a four, so it does not succeed.
1358;LAURA;Woo! You love us! We're really great! Let us pass!
1359;MATT;You watch as its intense expression toward the dwarf slackens and it flexes its shoulders and then roils back to the center platform and then looks over toward you with a nod.
1360;LAURA;Your mama loves you very much. Your papa's very proud of you. Come on, you guys.
1361;TRAVIS;Doesn't seem so scary! Across.
1362;MATT;All right, so your strength, your strength.|What's your strength?
1363;JENNIFER;Ah, zero. Or ten, sorry, ten.
1364;LAURA;Nobody attack him, guys. If anybody touches him, this is going to break.
1365;MATT;Yeah, so the three of you make it across fine without any issue. Go ahead and make an acrobatics check for me.
1366;LIAM;20. Natural 20.
1367;MATT;I'll let that go for all of them. With a natural 20, seeing this happen and watching them all dart across, you begin to do hand-over-feet, full-on handspring-style leaping over the platforms past the rager. You all make it over to the side platform, meeting up with your mage friend as the magma rager's still sitting there, resting in the center, looking toward you for some sort of an order.
1368;TRAVIS;I did have Reeksus with me.
1369;MATT;(screeching) (impact) He's being dragged and slammed like some horrible, slow-motion yo-yo.
1370;TALIESIN;I did a quick Cure Wounds back to 41.
1371;LAURA;Can you talk, magma monster?
1372;MATT;You hear it emitting some sort of sound, but it sounds like a heavy bonfire and rocks banging together.
1373;LAURA;You know what friends do? They dance.|Friends dance with each other. We should dance.
1374;MATT;So as you step up to the edge of the platform, begin to gnome-dance, the rager--
1375;LIAM;Is it the Warcraft dancing animation?
1376;LAURA;Yeah.
1377;MATT;There's this large elemental covered in armor that's pseudo-getting down with this tiny mage gnome on the edge of the platform as the lava glows from underneath, uplighting him.
1378;LAURA;I guess we can go, you guys. See you later.
1379;MATT;As you walk away, it slowly stops dancing and goes back to rest in the center of the platform. All righty, that was a unique solution.
1380;TRAVIS;Reeksus, now that your lies are through, lead the way. Quietly!
1381;LIAM;We are problem solvers!
1382;MATT;"""Quietly is the key here! Shh!"""
1383;LIAM;Aw, I don't feel bad. Why is that?
1384;MATT;"""Big thing lives ahead!"""
1385;LIAM;Not Toddlewaddle? Something else?
1386;MATT;"""Togwaggle beyond. This is big dragon!"""
1387;LIAM;What did you say?
1388;MATT;"""Dragon!"""
1389;TRAVIS;I have actually not gone up against a dragon. I just want to put that out there.
1390;TALIESIN;They're not bad. Well, I mean, I hear they're not bad.
1391;LAURA;Have you ever seen a dragon in person?
1392;TALIESIN;No, no. I mean, well, no. Well, no.
1393;TRAVIS;Reeksus, one dragon? Just one?
1394;MATT;"""One dragon. Not too bad for you, right?"""
1395;LAURA;Have you ever seen a dragon?
1396;JENNIFER;Yes. Well, my grandfather, he told me tales of them, yes.
1397;LAURA;Okay.
1398;JENNIFER;We choose the shadows in the presence of dragons.
1399;TRAVIS;Yes, let's stealth for a minute.
1400;MATT;As you guys press down through the darkened grade, the heat subsides slightly. You feel the breeze now, this pulsing breeze through the tunnel, rhythmic almost, as you turn into an open cavern, a magnificent natural pocket of geodes and crystals, beautiful blue and green crystals refracting patches of luminous fungus into these faint kaleidoscopes that permeate the entirety of this entryway. There's a visible exit across the chamber and slightly to the left, where you can see in the middle is a glittering mass, piles upon piles of gold coins, punctuated by gems of all colors peeking through this hoard. As you enter and look about, it is more money than any of you have ever seen. There atop this mound, you see lying the gargantuan, curled form of a sleeping red dragon, arms crossed, head resting there, (snoring).
1401;JENNIFER;Creature hasn't acted in combat yet?
1402;LIAM;Yeah, but I have to share. Speaking in accent, but out of game. As a former rogue, boo-hoo, this one is asking me if assassinate is good in this moment to get a special surprise attack on gargantuan-sized dragon. Yes.
1403;JENNIFER;He doesn't know I'm here.
1404;MATT;It's true.
1405;TRAVIS;Is she asking Quazi, or is she asking Vax?
1406;LIAM;You would almost definitely hit dragon, but it would be like taking donut and hitting side of Empire State Building. Absolutely you will hit, absolutely. You will take off half of one scale of dragon. I mean, you can do it. This is Dungeons & Dragons. Do whatever you like, but I'm just saying, the game will end in two minutes.
1407;MATT;Technically, it's Kobolds & Catacombs.
1408;JENNIFER;Point made.
1409;LIAM;I am curious to see.
1410;TRAVIS;It's still sleeping. What else do we see in this--?
1411;MATT;Make a perception check.
1412;TRAVIS;Okay. With advantage still? Blue fungus still?
1413;MATT;You do, yeah.
1414;TALIESIN;You're a fun guy.
1415;TRAVIS;Thank you, Taliesin. 19.
1416;MATT;19. Glancing about, you can see that the crystals across the room appear to have been either naturally grown, or some have been placed with some sort of faint, magical light behind them that, when it refracts, it actually acts as a light source within the chamber, almost intentionally so to make the place prettier.|Looking throughout this large cluster of coins on the floor, you can see broken bits of furniture and decor, things that have been jammed into there and bent slightly, like vases and sculptures.|Various pieces of art that are scattered in this horde. What does catch your eye is there is a beautiful, jagged-looking dagger with a series of red gems across the blade, a chain affixed to its pommel that is currently resting partially jammed underneath one of the hands of the sleeping dragon.
1417;LIAM;Tempting, tempting.
1418;TRAVIS;I bet he's a heavy sleeper.
1419;LIAM;Yes. If anyone's going to fuck with that shit, it's going to be you, but it's still a big if.
1420;JENNIFER;I'm in.
1421;TRAVIS;Yes!
1422;LIAM;I also have a question about this item that I'm attuned to. Let's say that this one's not crazy enough to grab dagger and we just want to go by. This says that, if you ever attempt to flee from danger, you make wisdom save. Does sneaking by--?
1423;MATT;Avoiding is different than fleeing.
1424;LIAM;I just wanted to triple check. Part of me thinks it would be hilarious to see me rush in, but--
1425;MATT;"Oh, believe me, part of me thinks it'd be hilarious, too. But distinctive; fleeing is different. If the dragon were to be awakened and engage you, it might be a different deal, but slaying a sleeping creature is no glory."
1426;LIAM, MATT;YOLO.
1427;TRAVIS;Are there any other exits out of this room?
1428;MATT;Currently, from what you view, no. The rest of the chamber appears to be the home to where this dragon is. You do not see an exit and it seems strange that a dragon of this size would find its way in or out.
1429;TRAVIS;Not to be a stickler for our contract, but do we see any candles?
1430;MATT;Looking around with your perception bit, you glance around, and you can see there is a trail of flecks of wax that lead across the left side of the chamber into the exit where it goes. So it looks like whatever has been transporting the mass of candles went that direction.
1431;LAURA;Great, there's the exit.
1432;TALIESIN;I'm going to start making my way that direction no matter what.
1433;LAURA;Sneaking, sneaking. As stealthy as possible.
1434;MATT;Who's sneaking first?
1435;TALIESIN;Sure.
1436;MATT;Make a stealth check, please.
1437;TALIESIN;That's all right. 19.
1438;MATT;As you make your way slowly around the edge of the chamber, carefully stepping gingerly on your dwarven toes, with a sudden snort, it shifts slightly. As it blows hot air from its nostrils, a few coins glitter and come to rest. Stillness.|Your breath is held. Slowly you exhale as it does not appear to have disturbed the dragon. You slowly make your way the rest of the way across the chamber and you're now standing at the archway for the tunnel that extends beyond to the next area.|Who's next?
1439;LIAM;I elbow the gnome and lip sync, and I say, chain.
1440;LAURA;No, no.
1441;LIAM;I know.
1442;LAURA;Don't do it! Okay. Are you going? Okay, I'm going to try to go.
1443;MATT;Okay, make a stealth check.
1444;LIAM;You all need to go through because, you know, I'm so big and heavy.
1445;LAURA;Once you're through, and then she's got to go last because she's going to try and steal that dagger.
1446;MATT;What'd you roll?
1447;LAURA;13.
1448;MATT;13, okay. As you slowly make your way through, there's a slight shift to the dragon's neck position as it turns (snorting). One eye slightly opens and you watch as the interior secondary lid flicks a little bit and a voice, (grunting). And it instinctually lobs out a jet of flame in your direction. I need you to make a dexterity saving throw, please.
1449;LAURA;Ten!
1450;TRAVIS;That's a lot of dice.
1451;MATT;You take 38 points of fire damage.
