;Player_Name;Transcription_Text
1371;MATT;"""""The books you require, we keep in the cellar. So, please, after you."""" It's a staircase.|(all laughs)"
1372;TALIESIN;No! I'm committed!
1373;MATT;(laughs) You're just going down--
1374;LIAM;Then an escalator!
1375;MATT;You're dog paddling your way through the darkness. You guys descend and the trap door closes behind you and it is pitch black. You have no vision, you can see in the vicinity, the stairs go down maybe 20 feet, however as soon as the trap door closes, a soft glow emanates from behind you and you can see there is some sort of a dangling wristband with a small glass marble that hangs at the end that is now glowing with a soft candlelight, and Kusuo is holding his arm in front of him as it dangles like a candle, and he slowly brushes past you and leads the way down before the stairs stop and level off into an open chamber, a square room, the cellar as he called it. There, inside, you see candelabras flickering in the corners, there's four of them, two near you and two on the far side. Within the shadowed, subterranean chamber, you see shelves and locked cases throughout. Some cases are glass, some are almost crate-like, but they have locks on the sides, and on these shelves it isn't books stacked to each end, each book is facing forward, and seems to be placed deliberately, and some of them are chained in, some of them have chains that dangle from the piece-- this is where all the secret books are kept.|This is the private collection.
1376;TALIESIN;Books that want to get out.
1377;MATT;"As soon you guys enter the space, two monks of the Cobalt Soul spin out of the corners and immediately stand in the defensive position with their arms out in front of them, and then as soon as they see Kusuo smiles and nods, they put their guard down, arms together, and they bow for Kusuo.|Kusuo turns back over the shoulder, """"Do not worry, this is Wailen and Sura, they are assigned to watch over. So, stand aside, help our guests."""" He walks forward and leads you through some of these cases, and you look and they're made of different woods, some of them seem to have been brought from different locations, and there are scroll cases, there are giant wads of ancient parchment that are clustered together and bound with some sort of a leather strip, you can see tomes all across the way of different fronts and sizes, and some of them are very old and ruined. And in the back right corner of this chamber, you see Kusuo pulls what you didn't notice before, and that jangling sound you were hearing before is a giant ring of over a hundred keys that he pulls off of his neck.|He turns it and begins just thumbing through the keys, very quickly, like he knows exactly what he's doing. Catches one key, looks at it, and walks over to one of the cases in that corner of the room and just undoes the locks, but they're a different key for each lock, and he goes and finds each one. First try, knows exactly where they go.|As each lock is taken, he opens the case and on the inside you smell this scent of dust and ash, and there are four books in there, two of which look damaged, but they all look very old, and he reaches in and grabs two of them. One of them is one of the damaged ones, one of them is not. """"You seek information on Orcus?"""" Sets one tome down on one of the nearby closed cases. """"And the Nine Hells."""" Places the other next to it."
1378;TALIESIN;I just try and see if I can discern what the other two books are just from looking in and being a nerd.
1379;MATT;They don't have any labelling on the cover.
1380;TALIESIN;Oh, nothing. All right. Fascinating.|Thank you. I suppose we'll sit, and get to it.
1381;MATT;"""""Very well."""""
1382;TALIESIN;And I sit down and I open the book.
1383;MARISHA;Yes. Which one are you opening?
1384;TALIESIN;Before I touch it, this doesn't react poorly to people handling it, does it? There's no--
1385;MATT;"He arcs an eyebrow towards you. """"No, part of our distinct training is to disable any sort of wards should you wish to research."""""
1386;TALIESIN;Excellent.
1387;MARISHA;Which one are you opening, Percy?
1388;TALIESIN;I open the first one just to look into--
1389;MARISHA;The Orcus one?
1390;MATT;Do you speak Abyssal?
1391;TALIESIN;I do not speak Abyssal.
1392;MATT;The Orcus tome you aren't able to read. It is all in Abyssal.
1393;TALIESIN;Do you speak Abyssal? And the other book--
1394;MATT;The other book?
1395;TALIESIN;-- I open up the Nine Hells, take a look.
1396;MATT;That one is actually written in Common.
1397;TALIESIN;Okay.
1398;MARISHA;Weird question.
1399;MATT;Yes.
1400;MARISHA;Abyssal.
1401;MATT;Yes.
1402;MARISHA;I know creatures who are from the Abyss, right? I've encountered them?
1403;MATT;You have encountered demons in your past, yes.
1404;MARISHA;If I do a Shapechange into a demon, can I then read Abyssal?
1405;MATT;Lemme look at the spell real fast.
1406;SAM;You're going to change into a pit fiend in the library?
1407;MARISHA;I would let him know! I would give him like a disclaimer.
1408;TALIESIN;I'm going to show you a really weird birthmark, don't panic.
1409;LAURA;I mean, if he really was a demon, why would he need to do research?
1410;TALIESIN;Who is my father?! I don't know.
1411;LAURA;Genealogy of the Nine Hells!
1412;MATT;It does not specify, but it says you gain the abilities.
1413;LIAM;I think I've read it says you keep the same intellect, though, right?
1414;MATT;Yeah, you keep the same intellect.
1415;MARISHA;You keep the same mental stats.
1416;MATT;Correct.
1417;MARISHA;But you get the abilities--
1418;MATT;Yeah, you retain all your skills and saving throw and proficiencies, in addition to gaining those of the creature.
1419;MARISHA;In addition.
1420;MATT;You don't know.
1421;MARISHA;I don't know.
1422;SAM;Might as well try!
1423;TALIESIN;I'm going to take a moment also before this happens, open the Common book, take a moment, and gently ask the good sir if they have a reading glass around, because I still don't have any reading glasses.
1424;MATT;"(laughs) He gives a curious look. """"But of course."""" And he snaps his fingers, and the other monks, he just darts off for a second and then returns a moment later with a small wooden case that opens up, and on the inside there are four different types and thickness of reading glass you can go through. You find one that'll work okay."
1425;TALIESIN;Perfect. I'm going to let you deal with this other end of things, because I'm going to sit and read.
1426;MARISHA;What was that demon guy we encountered? Does he have a name?
1427;TALIESIN;Phil.
1428;SAM;You mean the pit fiend, or--?
1429;LAURA;Oh, you mean like Senokir?
1430;LIAM;No, he was a genasii.
1431;MARISHA;The pit fiend was a devil. Who was the guy who lied to us, and you said devil at one point, and he was actually a demon.
1432;LAURA;You said he was a demon and he was actually a devil.
1433;MATT;That was a glabrezu. That was what killed Pike.
1434;TALIESIN;What about the basement way back when?
1435;TRAVIS;Where we found you?
1436;TALIESIN;Yeah, remember?
1437;LAURA;The succubus?
1438;MATT;That was after you found Percy. This was in the palace of Emon.
1439;LAURA;What about the succubus?
1440;LIAM;The succubus. And that thing with the bones.
1441;MARISHA;Succubus are-- yeah.
1442;LAURA;We did kill a succubus.
1443;MATT;You did, yeah.
1444;LIAM;In Krieg's house.
1445;MARISHA;And they're demons, right?
1446;MATT;They are fiends. You're not sure. You don't have enough knowledge-- Are you trained in religion?
1447;MARISHA;No.
1448;TALIESIN;But you could ask me. Well, I'm not--
1449;MATT;Yeah. You're not too familiar. Part of this research is learning the distinguishing factors between fiends. You don't have a whole lot of knowledge of that.
1450;MARISHA;Okay. You know what? You're reading the book on the Nine Hells. That'll tell us what fiends there are.
1451;TALIESIN;All right.
1452;MARISHA;Right?
1453;MATT;Maybe.
1454;TALIESIN;Maybe. I'm reading the book.
1455;MARISHA;Read the book.
1456;MATT;Okay. There we go.|(all laugh)
1457;LIAM;Saviors of the universe, we are.
1458;MATT;So.
1459;TALIESIN;Do you know the dewey decimal system?
1460;MARISHA;Yes. (laughs)
1461;MATT;What're you trying to find? Do you want to just read all the information? It'll take you--
1462;TALIESIN;I'm skipping specifically through Orcus, and also since she mentions what she's--
1463;MATT;There's no Orcus in this book. This is about the Nine Hells.
1464;TALIESIN;Oh, I'm so sorry. Hierarchies. I'm trying to get a general overlay of some of the information if there's a natural enemy for the rakshasas.|Any weaknesses, where we can find them.
1465;MATT;Okay. You do know there is a very strong infernal hierarchy of all the hells.
1466;TALIESIN;I'm also seeing what the book also specializes in.
1467;MATT;Yes, that's what it looks like as he's reading.|It's a very rigid power structure here. And the whole purpose of most devils is to try and gain power and ascend their rank by proving themselves stronger or tearing others down to take their position.
1468;TALIESIN;So anyone lower would be an enemy, anyone higher would probably--
1469;MATT;Well, they'll work together because it is a lawful evil society. It is a society that only functions because of its structure.|So it is tyrant and underlings. And underlings will work and serve things they hate that are more powerful in hope of gaining the favor, especially since higher devils can bequeath lower devils the chance to ascend to a higher tier.
1470;TALIESIN;Are there stories of anybody defeating a rakshasa before?
1471;MATT;You glance through, and rakshasas, like any other devil, can be killed. If you can go to it and kill it. But there are many tiers here. There are archdevils at the top. That are the rulers of each-- essentially the top ranks. There are greater devils below them. Greater devils include horned devils, erinyes, which you've encountered, pit fiends, which you've encountered, and ice devils. And they are the greatest of the devils below the archdevils. Then you have lesser devils, which are like imps, spine devils, bearded devils, barbed devils, chain devils, bone devils. You've got all these names, you get some drawings and sketches of some of these creatures, and they all look awful. Lowest in this rank are lemures.|Lemures are the souls of people that have passed, who have either done enough evil deeds that they fall under the sway of one of the archdevils. Most of them are acquired by making a deal with a devil. A contract. They're big into contracts.|Their power structure is based on what sort of souls, what power they can gain, what people they can sway, what people they can convince to--
1472;TALIESIN;Lemures are infernal Pokemon, is basically what you're getting to.
1473;MATT;"Yeah. Once a soul has come under the sway of a devil and is brought to the Nine Hells, it either can become just a lost wandering soul used as a source of energy; most of them convert into lemures which are the low-level slaves. They're ever-tortured, flesh masses that--"
1474;TALIESIN;So like The Scream?
1475;MATT;Yeah.|They're the tortured souls of the Nine Hells. If a lemure does manage to do good enough work over an extended period of time it can ascend into a lesser devil, by pleasing its masters, by whatever it may be. There is a chance, that's how devils ascending are brought to a higher station.
1476;TALIESIN;There's a few that have crawled their way up.
1477;MATT;Yeah, and the pit fiend you killed probably returned and got demoted.
1478;LAURA;Ooh, to a lesser? Like they get turned into something smaller?
1479;MATT;"If something really powerful and cool that was given a station was suddenly walking through the street and killed by a bunch of people in the city and came back and was like, """"they killed me,"""" they'd be like, """"you're weak obviously"""". Reading the structure, you probably really ruined that guy's day. (laughs)"
1480;TALIESIN;He's probably going to have centuries getting his shit back together. He's probably really pissed.
1481;MATT;Yeah, you basically made him lose his house, and his dog, and his wife. You turned him into a country song.
1482;TALIESIN;Do they talk about anything like the children that we saved? The effect of angelic, angelic, why those little angel children--
1483;MATT;There is very little talk about celestial blood, divas, other than the fact that there's been a long-standing battle since the founding. Since the prime gods and betrayer gods divided early in the creation of Exandria and--
1484;TALIESIN;There's no talk about using celestial power as some sort of weapon against these creatures.
1485;MATT;Not celestial power necessarily, but some of the entities are susceptible to various divine magics and abilities, and that is a strong back and forth between the two sides. The big war is between the devils and the demons. The Abyss, which is the nature of chaos and evil and driven hunger at whatever cost, versus the power-hungry devils, which build structure, dominance, expanding their territory, and ruling through structure and power.
1486;TALIESIN;Okay, so within evil, there is chaos versus order is kind of the internal conflict of evil.
1487;MATT;Yes, those are the two sides, devils versus demons.
1488;TALIESIN;All right. This is all very useful.
1489;MATT;But there are many tiers of the hells and nine--
1490;MARISHA;Does it mention any Abyssal fiends that they particularly hate that we might have encountered?
1491;TALIESIN;Flipping. I'm just going to keep skimming.
1492;LIAM;While he's skimming could we jump back for just thirty seconds?
1493;MATT;Sure.
1494;TALIESIN;Actually I'm happy to time-pass and we'll revamp that.
1495;MATT;I just want to make sure that we don't get lost on this somewhere.
1496;LIAM;Just 30 seconds before we go in, I'm like I should have the book. I'll carry the book in, give me the book.
1497;LAURA;I thought you took the book.
1498;LIAM;I don't carry books.
1499;LAURA;No, you have the book. I thought you were lying to the guy.|You actually have the book, right?
1500;LIAM;You took the book when we left--
1501;LAURA;I didn't take the book, I thought you took the book.
1502;LIAM;Are you fucking kidding me?
1503;LAURA;Are you fucking serious?
1504;LIAM;Fuck.
1505;TALIESIN;Can we direct people to the Benny Hill steampunk theme song.
1506;MARISHA;(sings Yakety Sax)
1507;LAURA;Let's go to the library.
1508;MATT;All right, meanwhile.
1509;MARISHA;So were we supposed to take the book? Or were they supposed to take the book?
1510;TALIESIN;I thought you said that we were taking the book.
1511;MARISHA;Well, I also thought we were going to the Reserve and now we're in the library.
1512;MATT;Are you unveiling the book?
1513;TALIESIN;No, we are not. We have it, we have not unveiled it.
1514;LAURA;We're heading to the library.
1515;MATT;Okay.
1516;TALIESIN;I'm going to keep reading while they head, you guys if you want to--
1517;MARISHA;I'm so confused on our plan.
1518;MATT;There are many things you learn. One, the first layer of Avernus, which is the first layer of the hell. It is a terrible blackened rocky wasteland, rivers of blood. It's a bad place.|Usually, you have to travel from each layer into the next one. There are very few portals that'll lead to the Hells. Usually, any that do start at Inverness and you have to work your way in. That area is ruled by Zariel, which is the Archduchess of Avernus. This is also the realm of Tiamat.
1519;TALIESIN;Ah, yeah, okay!
1520;MATT;You glancing through and trying to find things that catch your attention. This is a large tome. You could spend days and days researching this but you don't have a lot of time. You are looking for specific things. Dis is the second layer of the Nine Hells. It is a labyrinth of canyons, wedged between sheer mountains, filled with iron ore. There are iron roads that span through the canyons with a series of bridges that lead over these giant crevasses and this dark landscape. The ruler of the second layer and the lord currently is Dispater.
1521;TRAVIS;Dispater?
1522;MATT;Yes. Dispater, which is--
1523;LAURA;Similar to James Spader.
1524;LIAM;Yeah.|(all laugh)
1525;MATT;Yeah. Just half-cousin. Talks kind of like him, too, it's really creepy.
1526;MARISHA;So, it's the realm of Dis and the leader is--
1527;TALIESIN, MARISHA;Dispater.
1528;MATT;Yeah.
1529;TALIESIN;They're not that clever.
1530;MARISHA;And the first layer of Hell is also referred to as the layer of Inyimenemo-- what?
1531;MATT;Avernus.
1532;MARISHA;Avernus.
1533;MATT;However, what does catch your attention immediately is on Dis there is a city called the Iron City of Dis that is a massive metropolis, primarily where most extra-planar entities travel to do business. It is in many cases an open market.
1534;TALIESIN;So, probably safer.
1535;MATT;It's one of the safer areas for a mortal to walk through, comparatively-- it's still in one of the Hells. But because it is such a center for business, it's a popular location for extra-planar travelers, it's a popular place for succubi, incubi to travel, it's a popular place for rakshasas. It specifically brings up hags, creatures that deal in business, deal in exchanges, deal in contracts. Beyond the usual devil ones, a lot of them tend to go to the Iron City of Dis.
1536;TALIESIN;Okay. I'm marking that-- I'm putting a pin on my Pinterest board.
1537;MARISHA;Atlas Obscura that shit.
1538;TALIESIN;Atlas Obscura the hell out of the City of Dis.
1539;MATT;I can give you the rest of this to read on the break, if you'd like because it's a lot of information, but that's the one that sticks out to you.
1540;TALIESIN;I don't want to kill Travis.
1541;MATT;No. In looking specifically for the mention of rakshasas, there are sections about the creatures and talking about their history and how they originally stemmed from the Hells and burst out of the prime plane. It goes into their history there, the rest of it doesn't have as much in correlation to where you would look for such a creature. They do exist on multiple layers of the Hells.
1542;TALIESIN;City of Dis seems to be the winner.
1543;MATT;At the very least, a place where you can get information that can lead you elsewhere.
1544;TALIESIN;I'm very excited.
1545;MARISHA;Any information on how to get there?
1546;LAURA, LIAM;(sing) We built Dis city on--
1547;TALIESIN;Inter-planar travel.
1548;MARISHA;I can Plane Shift there. I do a very detailed look at what the Iron City of Dis seems like--
1549;TALIESIN;I'll sketch a little bit of it out of the book, as well.
1550;MATT;Okay, cool. And there are some descriptors in there, some mild sketches. One thing it does speak of is the Tower. The Iron Tower of Dispater which is, essentially, this massive central structure to the city where the actual archdevil himself looks down upon the city and keeps watch over most business that he can.
1551;LIAM;Great stealth roll.
1552;MATT;Good job, thank you.|(all laugh)
1553;TALIESIN;Dagger, dagger.
1554;LIAM;Thank you.
1555;MATT;While you guys are completing your research-- Taryon and Grog! What are you guys doing?
1556;SAM;Do you have the book? (all laugh)
1557;TRAVIS;Which book?
1558;SAM;Never mind. Let's go find a place to buy some potions.
1559;TRAVIS;All right. Are you accustomed to buying things?
1560;SAM;Very much so.
1561;TRAVIS;Oh. Do you have a personal shopper?
1562;SAM;I actually do, yes.
1563;TRAVIS;Nice. Well, show me how it's done.
1564;SAM;All right, I'll take you under my wing, so to speak.
1565;TRAVIS;Yeah, I'm a bit big so I don't know how you're going to do that.
1566;SAM;Doty, join us!
1567;MATT;And as you guys walk through the streets, everyone stares. Partially because you are a bright shiny beacon of finely polished gems and armor flanked by a massive bearded goliath and whatever the fuck Doty is.
1568;SAM;Hello, hi, greetings, good day, good afternoon, don't mind them, they're my friends! Hahahaha!
1569;TRAVIS;Wow.
1570;MATT;"About five minutes of walking before two armored Bastions come up in their piecemeal leather and scale breastplate armor with their heavy fur cloaks over their shoulders, holding spears. """"You!"""""
1571;SAM;Uh!
1572;MATT;"""""You walk with strange company. What's your business here in Vasselheim?"""""
1573;SAM;We are wandering merchants, trying to find some textiles to buy to resell in other lands.|That's all. Don't mind my traveling companions.|They're my protectors. I travel as a merchant with a lot of coin, so I found these two at a leper colony and nursed them back to health. It was also a gym, a muscle-man place, so they're really buff.|But they're also lepers. And that explains their matted hair.
1574;MATT;Make a deception check, please.
1575;TALIESIN;You get to experience this as a normal person now. I'm so excited.
1576;SAM;What, deception?
1577;MATT;Yeah.
1578;SAM;Ooh, I better use Luck. Ooh, no, that's worse.|(all laugh)|So do I use the higher one, or just the second one?
1579;MATT;I'll double check.
1580;LAURA;I think you have to use the second roll.
1581;SAM;Well, it don't matter.
1582;MATT;You choose.
1583;SAM;Okay, ten.
1584;MATT;Total of ten.
1585;SAM;Yeah.
1586;MATT;"He leans in real fast. """"Oh wow, that's got to be unfortunate. Being so buff and so filled with leprosy."""""
1587;SAM;It is their cross to bear. That's why this one doesn't even talk, and this one is a leper of few words.
1588;MATT;He leans back, and the two guards watch you and nod and step back to let you continue to pass.
1589;SAM;Thank you. Might I inquire from you fine gentleman where we might find some medicine or healing potions? These lepers are set to relapse.|That way? All right. I'll head that way then. Good day to you. Keep warm.
1590;MATT;As you guys keep walking, they slowly close behind you and just begin to follow from about 30 feet back.
1591;TRAVIS;That was amazing. Have you ever lied to anybody before?
1592;SAM;Never. I think I have a talent for it though.|I just felt the words coming out and I went with it.
1593;TRAVIS;It was a thrill, right?
1594;SAM;It was thrilling. It was exciting. And they were going with it. They were eating it up. I had them right where I wanted them. I could've told them fucking anything. It was great, right?
1595;TRAVIS;Yeah.
1596;SAM;Wow.
1597;TRAVIS;On a scale from one to two, how do you think it went?
1598;SAM;I mean, two's the higher of the two, right? Oh, you don't know.|(all laugh)|I feel good.
1599;TRAVIS;Nice, yeah.
1600;SAM;"Now, remember, if anyone asks you, just go (moans in pain) """"I'm a leper"""", or something like that."
1601;TRAVIS;(moans in pain) I'm a leper.
1602;SAM;That's good.
1603;TRAVIS;Yeah, good. Are they following us now?
1604;SAM;Oh, I hadn't looked.
1605;MATT;You turn around, right at them, and 30 feet back they're walking and they just stop as you stop.
1606;TRAVIS;Still think it went well?
1607;SAM;(whispers) I think they're following us.
1608;TRAVIS;Really?
1609;SAM;What do we do?
1610;TRAVIS;You know, it was probably you told such a good story, they're just fascinated by you now.
1611;SAM;What do I do? I've never been followed by guards before.
1612;TRAVIS;You should probably act casual. Or you could drop some money on the ground, and let all the people run and collect it, and make a diversion. It's up to you.
1613;SAM;Are there people around?
1614;MATT;There's a few.
1615;TRAVIS;Just dump all your money on the ground.|They'll come out of the houses, the woodworks.
1616;SAM;I was warned about you and money. I won't listen to that. But I will try to act casual. I will just take off my gigantic, diamond-encrusted helmet. Let my hair down.
1617;TRAVIS;How long is his long, blonde hair?
1618;MATT;Just past the shoulders.
1619;TRAVIS;Just free-flowing? No fancy braids or buns or anything?
1620;MATT;No, just free-flowing, perfectly arced in the front, except pulled back because of the helmet. It's glorious. It's Bee Gee-tastic.
1621;SAM;(loudly) Ah, what a day, am I right?
1622;TRAVIS;You're talking real loud.
1623;SAM;(softly) That's what casual people do.
1624;TRAVIS;No. They don't.
1625;SAM;They don't care what people think.
1626;TRAVIS;Volume control, real important.
1627;SAM;Okay. (loudly) Ah, just want to take a load off and just rest here for a while. Not going anywhere, just sitting here and acting real boring, right?
1628;TRAVIS;Yep. How are we going to stay here and find the health potions at the same time?
1629;SAM;Guide me. You've been doing this longer.
1630;TRAVIS;No, you're really doing well. I'm learning a lot right now. Clearly, you are a well-traveled man of mystery.
1631;SAM;All right, I've read about situations like this, right? We just need to create a diversion.|While the guards are diverted, we run away, fast as we can, right?
1632;TRAVIS;I literally told you about that one minute ago.
1633;SAM;Yes.|(all laugh)|Here's my plan.
1634;MATT;Grog, make a perception check.
1635;TRAVIS;15.
1636;MATT;You're getting close to the exterior of the building pointed to by the guards, and you recognize it. It's the place where you've previously purchased potions.
1637;TRAVIS;Look, I hate to interrupt, right. Do you think you've done anything wrong?
1638;SAM;Illegal?
1639;TRAVIS;Yeah. Have you done anything wrong?
1640;SAM;I don't think so, no.
1641;TRAVIS;You've never been here before?
1642;SAM;Well, we are traveling around with an arcane being. I don't know if that's illegal.
1643;TRAVIS;Yeah, it's totally fine. Look, this place is where the goods are.
1644;SAM;You mean potions and magical items?
1645;TRAVIS;All sorts of stuff. I don't even know if his inventory has improved since we've last been here, but he will give you a really great deal, and it'll give you a chance to prove to me how good of a salesman you are.
1646;SAM;All right. But how do we shake the uards-gay?
1647;TRAVIS;What?
1648;SAM;Well, that came out weird. Didn't think that through.|(all laugh)
