;Player_Name;Transcription_Text
634;MATT;"You sleep, but uneasily, as all of these realizations swirl in your head. Eventually sleep takes you, but it is not an easy sleep. Just enough to function. Barely. Vax. As you yourself have attempted to stave off sleep for many days, pushing yourself to your limits, it finally takes its toll, and you drift off into a deep, deep slumber. In that slumber, you find yourself in darkness. Echoes of a distant voice, muffled, as if underwater. Crash. The darkness is shattered into a thousand black feathers, and you find yourself falling, falling. Falling towards what seems to be a tangled net of glowing threads.|You're afraid you might impact at such a speed, but before you do, you slow and come to a stop before this extremely prominent glowing weave, this infinite tapestry in all directions. You are uncertain of the meaning of this moment when a large cold hand reaches past your shoulder and grasps a thread right before your face, this singular glowing thread, pulsing with light like a heartbeat. You follow the arm over your shoulder, and glance up directly into the massive form of the Raven Queen: porcelain face like a mask, long jet-black hair, her body encasing you like a physical cage. Your eyes follow the arm back to the thread that she carries between her massive fingers. She tugs it, ever so gently, and it causes waves to ripple through the tapestry into infinity. Her voice fills your mind, both calm but cold. """"This is you, my champion. You are fate-touched. The choice is yours. Rebirth or ruin. Maker or martyr. Conqueror, tyrant, or nothing."""" She plucks the thread from the weave, snapping it. You plummet into the hole left behind it, falling faster and faster into the dark.|Losing control, you turn around and see the Raven Queen, disappearing into the distance, growing smaller and smaller, until suddenly, nothing.|Grog. You fall into a deep snore, heavy, heavy snore, after drinking the wine, climbing up walls, you've had an exhausting day of--"
635;TRAVIS;Sleeping in the sand pit.
636;MATT;Okay, you are face down.
637;TRAVIS;Like a beach, just (snore).
638;MATT;It's great. You've drooled into the sand, and it's clustered around your beard. It's horrifying. But in the middle of snoring, this restful sleep also comes into your mind, and you find yourself walking alone. A long hallway, into blinding light. You have to cover your face, it's so bright, but you push forward because you know there's only one way to go. You cannot see, but you can hear around you and sense the hallway's ended, and there's now space around you. You cannot see, but you sense an arena, gladiatorial in nature. You can hear the distant whisper and hum of crowds cheering.
639;SAM;Phillip! Phillip!
640;MATT;"You sense others around you, closing in suddenly. A voice, ever-whispering in your ear, says, """"Release me."""" Still blinded, eyes closed, on instinct, you pull the cold, dark blade from your back and swing wide, over and over again, feeling the shuddering shock of each impact, your strength matched by the razor-like edge of your weapon, cleaving down any who would approach. The high of adrenaline is incredible, and you laugh aloud at the sheer thrill of your own power."
641;TRAVIS;(laughs triumphantly)
642;MATT;"The light subsides and your vision returns.|You look to see hundreds of people dead at your feet. Farmers, children. You see Pike, motionless, cast among the carnage. You want to scream, but instead you laugh, against your own judgment and intent, like you're locked within yourself and have no control. And as you look up from the pile of corpses at your feet, you see a towering figure before you, cast in furs and bone, standing even a head and a half's height above you, is Kevdak, looking down at you with pride. The entire herd steps up beside him, staring at you atop your throne of corpses, and the herd kneels. Kevdak bows, looking up at you, smiling. """"You. You have finally made me proud, Grog."""" You wake up (gasp), spittle and sand and grit mashed against your face. Who knows how long it's been, but it's been a while since you've had a dream, let alone one like that.|Now, as you all eventually come to in the morning, having your evening's rest, you've recovered your hit points, your spells, all of the usual good stuff, in a fantastic mansion. Maybe not the most fantastic rest for some of you, but a fantastic mansion. You all eventually find your way to the breakfast nook, which is as extravagant as you would imagine a Scanlan-based breakfast nook would be."
643;TALIESIN;Green marble, silver tiling. Sorry, carry on.
644;MARISHA;Crystal chandelier.
645;SAM;Waffle presses.
646;MATT;There's a fantastic breakfast feast already prepared, rows of servants along the walls waiting eagerly to attend to you guys as you sit down, pouring fresh juices. It smells fantastic, and most of you look rested, except for a handful.
647;SAM;Eat! Drink!
648;LAURA;I come skipping into the room, for sure.
649;TALIESIN;Good morning.
650;SAM;You're looking delighted and delightful.
651;LAURA;What a beautiful day it is!
652;MARISHA;Do you have wine and ale at the breakfast buffet?
653;SAM;Sure, sure. There's mimosas, there's--
654;MARISHA;I'll have a mimosa.
655;TALIESIN;You've never heard of breakfast beer?
656;SAM;Breakfast beer? Sure. There's milk from a cow with a broken nose.
657;LAURA;Oh, that is so sad. Can you heal it? Can it be healed?
658;SAM;It'll be fine. When we leave this place, all these people die, anyway.
659;TALIESIN;You're supposed to churn the milk after it leaves the cow.
660;LAURA;Wait, Scanlan, can we store things here, or does it all disappear as soon as we leave?
661;SAM;I don't know.
662;MATT;You haven't tried it before.
663;LAURA;We should leave something inconsequential.
664;SAM;We'll leave Trinket, and then we'll try it again, and if Trinket's still here, we'll know.
665;MARISHA;Schrodinger's Trinket.
666;SAM;It's just-- no?
667;LAURA;No.
668;SAM;All right. We'll leave the broom and see if it's still here.
669;LAURA;No, no, no, let's not.
670;TALIESIN;What broom?
671;SAM;Oh, Vex, is there something you'd like to admit to the rest of the group? They'll see you use it sooner or later.
672;MATT;You hear a voice go (grunt). Trinket's over there, face covered in breakfast food, trying to sit at one of the edges of the table like a person, the actual bowing of the wooden bench that Trinket's on, you hear the creaking as he moves around in it.
673;LAURA;Thank you, Scanlan, for making me feel...|So, guess what! I can fly! A-plus!
674;TALIESIN;How did that happen?
675;MARISHA;I had a really weird night, too. What happened in your... because, I mean, flight?
676;LAURA;Did you have a weird night? Do you want to tell us about it?
677;MARISHA;No, I want to hear about your night.
678;TALIESIN;I think you go first.
679;MARISHA;I want to learn how you fly.
680;LAURA;Okay. So I sort of kind of tricked Gern, I'm a terrible person.
681;SAM;Gern, our friend.
682;TRAVIS;You swallowed that last part. What did you say?
683;LAURA;I sort of kind of, this is the worst...|took something that wasn't mine? In a way. I mean, I was holding on to it, and then I slipped, and it fell into the Bag of Holding.
684;TRAVIS;Why is that bad?
685;TALIESIN;You stole from a candlemaker?
686;LAURA;I stole from a necromancer.
687;TALIESIN;Slash candlemaker.
688;LAURA;Yes. No, he was a nice guy.
689;SAM;I think we should hear Vax's opinion of this.
690;MARISHA;Vax, I think you were a bad influence.
691;LIAM;I can't judge. I've done my share in the past. I thought you were a little overly nice to him.
692;TALIESIN;I mean, to be fair, we did steal a carpet once.
693;LAURA;We did.
694;SAM;Did we steal that? I thought it was just a--
695;MARISHA;We used that in an emergency.
696;TRAVIS;We commandeered it.
697;LAURA;We took it, Scanlan, and we didn't tell Allura.
698;TALIESIN;And then never gave it back.
699;SAM;That's true.
700;LAURA;We're terrible.
701;LIAM;I don't think any of us can judge you, Vex'ahlia, but it does strike me as a little bit odd, if nothing else.
702;LAURA;I know. I know, I'm afraid these rogue tendencies I've been learning from you, brother, maybe rubbed off a little bit. No, I just, I know I shouldn't have.
703;TRAVIS;I don't care.
704;LAURA;I wanted to return it right away, and then he wandered off. That's a lie, I didn't want to return it. But I did want to pay him!
705;TRAVIS;I don't think you wanted to do that either.
706;LAURA;No, I did! I did, I wanted to pay him! But he wandered away, and then I didn't pay him, and now I have this broom that I stole, and there's really no way to return it. Well, I probably could find him, but I don't want to because now I can fly, you guys.
707;TRAVIS;Are you going to re-gift it?
708;LAURA;No. I'm going to keep it.
709;MARISHA;What do you say, Percy? I think it's kind of funny.
710;TALIESIN;Are you honestly asking my opinion? You said what?
711;LAURA;Actually, Percy, do you know-- I know you can build things and make things wonderful.
712;TALIESIN;Can you show me? What is this thing, what did you steal? What is this thing?
713;LAURA;I pull out the broom and I lift up in the air.
714;MATT;You guys watch as Vex all of a sudden (whoosh) takes off above the breakfast room.
715;TRAVIS;Sweet!
716;MARISHA;All right, that is pretty cool, Vex.|That's pretty badass.
717;TALIESIN;I don't know if I approve of the metaphor, but that's--
718;LIAM;What happens when you shoot a couple arrows from up there?
719;TRAVIS;Yeah, shoot me with an arrow!
720;MARISHA;Yeah, shoot some arrows!
721;TALIESIN;Okay, you're not holding onto the broom anymore.
722;LAURA;No, I've been practicing! I've been practicing!
723;MARISHA;I reach on the table and I grab what I'm sure is a whole chicken sitting there.
724;SAM;Sure.
725;MARISHA;And I hold it up and I go--
726;TALIESIN;Has it not occurred to you that you're not going to be able to fly?
727;LAURA;No, no, no, look! I'm not holding on, Percy! Look at me, not holding on!
728;MARISHA;Okay, Vex, ready? Ready, Vex? Vex?
729;TALIESIN;Oh, dear.
730;MARISHA;Trust.
731;SAM;Watch your eyes. Watch your eyes.
732;MARISHA;Trust Vex!
733;MATT;All right, Laura, I want you to go ahead and, first, roll a dexterity check.
734;LAURA;Okay. Shut up! 13.
735;MATT;13, okay. You almost slip off the broom in the process of drawing the arrow from the quiver.|You catch yourself and just barely manage to pull back and fire. I want you to go ahead and roll an attack with disadvantage.
736;LAURA;Oh, man, disadvantage. Okay.
737;MARISHA;Please, god, may your aim be true today, Vex.
738;LAURA;16.
739;MATT;16. (impact) The arrow does get relatively close to your hand, but it does stick into the turkey.
740;MARISHA;She did it! I hand the chicken to Scanlan.
741;SAM;I start eating.
742;TALIESIN;I pull the arrow out of the chicken.
743;LIAM;Do it again! And I throw the chicken closest to me into the air.
744;LAURA;Oh, shit.
745;SAM;A moving target!
746;LAURA;Oh, god, okay.
747;MATT;Okay, make another dexterity check.
748;LAURA;Okay.
749;SAM;There's lots of chickens, by the way.
750;LAURA;Shit balls. 13.
751;MATT;13. Okay, this time, you start falling off and you catch yourself entirely. The arrow just goes wide, you don't even get a chance to nock it in the bow.
752;LAURA;Mother bitch, I really need to work on this! Okay.
753;MARISHA;It'll take some practice.
754;TALIESIN;I don't think this is-- this may be an engineering issue.
755;LAURA;Yes, Percy, this is the thing. Can you build a seat on this?
756;TALIESIN;I pull out my notepad and start sketching.
757;LAURA;What if you could build a seat, and then I can sit on it instead of trying to sit on this tiny little stick?
758;TALIESIN;Let me--
759;SAM;Tinker?
760;TALIESIN;Tinker.
761;MARISHA;You know, beyond it being an engineering issue, it might be a greed issue first.
762;LAURA;Really?
763;MARISHA;Look--
764;LAURA;How's that mimosa treating you?
765;MARISHA;It's phenomenal. It's been a long few weeks. I don't care. I don't care. We're never going to see Gern again. I have so many other things to care about.
766;SAM;Oh, no, she's day drunk again.
767;LAURA;Oh, no, are you already drunk, Keyleth?
768;MARISHA;No! I'm just, it's been a long few-- Look.
769;TRAVIS;Oh, Jesus!
770;MARISHA;I don't care anymore.
771;TRAVIS;How many was that? Just one, right? We've been here for five minutes.
772;LAURA;I float down.
773;MARISHA;No! I just don't want you to die.
774;LAURA;I float down eye-level, but I'm still floating.
775;MARISHA;I don't want you to die. I don't want you to die because of your greed. I don't care that you have-- You look amazing. Doesn't she look amazing?
776;TALIESIN;Like a real hoverboard, is there a chance this one might set on fire as well?
777;LAURA;Why are you trying to be an asshole?
778;TALIESIN;Sorry.
779;LAURA;Here's the thing, Keyleth. I'm not afraid to die anymore. I came to this realization. I've seen the other side. I've come to terms with it.
780;MARISHA;Well, that's phenomenal that you've come to terms with it! I don't know about the rest of us in the room that all watched you die, though.
781;TALIESIN;I feel too guilty to say no to her. I'm perfectly content to let this go.
782;TRAVIS;It is pretty sweet, flying around like that.
783;LAURA;It's pretty wonderful.
784;MARISHA;It's really cool.
785;TALIESIN;She's an adult. Deep levels of arrested development, but an adult nonetheless.
786;MARISHA;I don't care about the broom.
787;SAM;Keyleth, Vex swore to me that she would only use it for good.
788;LAURA;That's right. I'm not going to steal anything while I'm riding on it.
789;TALIESIN;Where would you put it, anyway? You can't let go.
790;MARISHA;Just don't get into trouble, I guess.
791;LAURA;I'll practice as much as I can, and Percy's going to help me.
792;TALIESIN;Yes.
793;LAURA;So I can be stable on this thing.
794;TALIESIN;I may need some money, but we'll put something together.
795;LAURA;I will give you all the money you want.
796;LIAM;Are you going to carry that on your back?
797;LAURA;Maybe.
798;LIAM;You'll look like a Byroden chimney sweep.
799;LAURA;But I feel so good.
800;MARISHA;You got out, you came out on top this time. It might not happen next time.
801;LAURA;I start eating while sitting on the broom.
802;MARISHA;All right. I think she's listening to me.
803;SAM;I think you broke through.
804;MARISHA;I think I did.
805;TALIESIN;I think you're learning to let people be people.
806;MARISHA;I don't care anymore.
807;SAM;Oh, look, look! Another round of chickens has just arrived for us to eat.
808;MARISHA;Oh, chicken!
809;SAM;I don't know what breakfast is, so I just keep commanding them to make chickens.
810;MATT;So much chicken, guys.
811;LAURA;Where should we head to?
812;SAM;What is our next-- Shoot, I kept a to-do list for us, but I didn't bring it tonight.
813;TRAVIS;(burps)
814;SAM;Oh. I thought you were going to say something. That was a belch?
815;TRAVIS;Yeah.
816;LAURA;Did you want to head back to-- Actually, Keyleth, you said something weird happened last night for you as well.
817;MARISHA;Yeah. Cerkonos stopped by.
818;LAURA;Yeah? I look at my brother. All right, cool. Keep going.
819;MARISHA;Not... As my elder. He stopped by as my respected elder. Do you all remember the name Raishan?
820;TALIESIN;Yes.
821;LAURA;That's one of the dragons.
822;MARISHA;Apparently she's our little infiltrator.
823;LAURA;What do you mean?
824;MARISHA;She came to the Fire Ashari, she came to Pyrah, about four years ago, and the Ashari, being the adoptive people that we are, they took her in.
825;LAURA;They adopted a dragon?
826;MARISHA;They adopted a dragon.
827;LAURA;How?
828;TALIESIN;Do they think she's the one who sabotaged the rift?
829;MARISHA;They do. They were unaware that she was a dragon.
830;SAM;Does that make her the leader or something? Is that how all the dragons got through? I'm still not quite sure.
831;TALIESIN;It makes her the instigator, at the very least.
832;MARISHA;It makes her fairly close to Thordak, it would seem. Apparently, when she came to the Fire Ashari, she was about 15 years old, and...
833;SAM;As a dragon?
834;TALIESIN;Visually.
835;MARISHA;As a human woman.
836;LAURA;So she was making it seem like she was 15.
837;MARISHA;She was making it seem like she was 15, and they started realizing that she possessed powers far beyond anything that they had seen before, and then these powers began to exceed anything beyond our druidic capabilities. And it would seem that they realized that too late.
838;SAM;Did they say anything about her goals, or motivations? Her ambitions?
839;MARISHA;Cerkonos said one day they woke up and the mountain was spewing fire, and was angry with lava, and when he went to investigate it, she was there, ripping open the rift. And that was when everything happened. When he came to consciousness, everything was destroyed, so that's all he saw. And she was gone. But we know where she went next.
840;TRAVIS;Where?
841;SAM;To Emon.
842;LAURA;Oh, eventually.
843;SAM;Kill everybody.
844;LAURA;Right. Totally. That day. The day.
845;MARISHA;I was trying to skip exposition, I thought you guys could fill in the blanks.
846;TALIESIN;We thought you had new information beyond that and would maybe want to add. It was certainly set up that way.
847;MARISHA;Thank you. I'll work on that next time.
848;TALIESIN;It was very leading.
849;LAURA;Okay, well that's good to know.
850;SAM;So perhaps we should inquire if you think this-- Raishan?
851;MARISHA;Raishan.
852;SAM;Has tried to pretend to be a human woman in any other place? Should we ask around, or was it just the one ruse here to gain entry for her companions?
853;MARISHA;I'm not sure.
854;SAM;All right. Well, don't trust anyone.
855;MARISHA;Don't trust anyone.
856;LAURA;Got it.
857;MATT;"Servant rushes forward, """"More chicken, sir?"""""
858;SAM;Keep it coming.
859;MATT;"""""Right away."""""
860;LAURA;Do you guys have vegetables, maybe? Any vegetables?
861;MATT;"""""Vegetables, sir?"""""
862;SAM;I forgot to tell them to make them. Sorry.|It's all chicken.
863;MATT;"""""Chicken it is."""""
864;LAURA;Cool. Chicken and mimosas, it's my favorite breakfast.
865;MARISHA;And waffles.
866;SAM;Oh, waffles too? Chicken and waffles, that's right. Maybe someone else should be in charge of the food next time we come here. My tastes are a little--
867;TALIESIN;Base?
868;LAURA;Little?
869;SAM;Singular.
870;MARISHA;And one thing that this does confirm is that this has been a plan that's been in the process for a very, very long time.
871;SAM;No, I just came up with the chicken this morning when I woke up.
872;LAURA;Where are we going next, you guys?
873;SAM;Grog had some brass knuckles to get. Was that a thing? Did we get those?
874;TRAVIS;No. We haven't gotten those yet. But there's other things to explore.
875;SAM;All right. Wait, did we have to go make a trip to anyone else's homeland? How's Whitestone?
876;LAURA;We need to talk to a sphinx. A sphinx's boyfriend.
877;SAM;Oh, that's right. Maybe that should be our next--
878;MARISHA;What was his name? Hang on.
879;SAM;And what were we trying to get there? Another one of the articles of confederation?
880;MARISHA;We need the Titanstone Knuckles of Kord, which Kevdak has.
881;TRAVIS;Yep.
882;LAURA;That's with your tribe.
883;TRAVIS;Yeah.
884;SAM;Okay, but then there's the sphinx.
885;LIAM;Time for a family reunion, Grog.
886;SAM;What's that, Vax?
887;LIAM;I said it's time for a family reunion, Grog.|Are you ready for that, or do you want to put that off a bit?
888;TRAVIS;Oh, no, I mean. Whenever. It's. You know.
889;LAURA;So do you want to go now, or do you want to maybe swing by somewhere?
890;TALIESIN;It's either that or the library, I imagine.
891;TRAVIS;You want to go to the library?
892;TALIESIN;I was just saying that it's either that or the library.
893;SAM;So it's Grog's herd or the sphinx to get something.
894;LAURA;We'll remember.
895;SAM;On the way. And then, or, TBD, find something else to do. I guess Grog's thing is the most promising. We know that there's Knuckles there, we know that there's people we'll know there.
896;LAURA;Well, it's all actually around Westruun, right? Aren't your people around Westruun?
897;TRAVIS;You know, they roam.
898;LAURA;So we have to find them.
899;TRAVIS;Yeah.
900;LAURA;Last time we ran into them, wasn't it on the way to Kraghammer?
901;TALIESIN;From Westruun.
902;MARISHA;Odessa's mate is south of the Frostweald.
903;LAURA;I think it was.
904;TRAVIS;Was it?
905;LIAM;Yeah, it was. On the way to Kraghammer, that's right.
906;SAM;Is Frostweald near Kraghammer as well?
907;LAURA;The Frostweald is--
908;MATT;South of Westruun.
909;LAURA;South of Westruun, yes.
910;TALIESIN;So let's make our way to Westruun, I suppose, then.
911;SAM;And that's in the direction of both Grog's herd and the Frostweald?
912;LAURA;Potentially? Well, Grog would know.
913;TRAVIS;What?
914;LAURA;Cool. Yes, I think Grog really wants to go.
915;SAM;Yeah, we should probably go there.
916;LAURA;Yeah.
917;SAM;Let's do that.
918;MATT;Your herd wanders all across the Silvercut Roadway, that whole area to the west of Westruun, south of Kraghammer, east of Emon, that vicinity.
919;TRAVIS;They wander there.
920;LAURA;Around there.
921;TRAVIS;Yep.
922;LAURA;Okay.
923;TRAVIS;But look, I was thinking. It might be a thing when we find them, right? So picture this.|Me, and then a lot of other me's, and they're all really big and angry. So if we want to do anything else before that happens--
924;SAM;You think they'll attack us? But we're with you! You're our ally!
925;TRAVIS;Yeah, and I'm a super cool, awesome, fun guy, but we didn't really leave in the best terms.
926;LAURA;Oh, weren't you--
927;TRAVIS;Ass-kicked, yeah. All left for dead, pretty much.
928;MARISHA;You know what, Grog, it's been a while.|Why exactly were you beat up and kicked out of your herd?
929;TRAVIS;Right, so I was a bit younger, and we were wandering through the woods, and we came upon this little old bearded thing, right? And he was carrying groceries, like food and stuff, and everybody was a little hammered from boozing, and they were like, hey, let's kill the little thing, and we'll string him up and see what his insides look like! And normally I'm like, yay, I'll wear him as a hat! But he looked really sweet, and I felt bad, so I said we shouldn't do that. And...|They didn't like that answer. My uncle in particular, he didn't like that, so he made me fight my cousin, his son.
930;LAURA;And?
931;TRAVIS;That wasn't bad, I handled that. It was not a problem.
932;MARISHA;Okay. So they might have a grudge about that.
933;TRAVIS;No, there's no grudge. They pretty much think I'm dead, because after I whooped his son's ass, he whooped my ass.
934;LAURA;Oh.
935;TRAVIS;Yeah.
936;TALIESIN;We have a thing for that.
937;SAM;We do?
938;TALIESIN;Can I borrow your hat?
939;SAM;Of course you can borrow my hat.
940;LAURA;The Hat of Disguise?
941;TALIESIN;If you don't want to have an immediate confrontation with your family, there's no particular reason why they have to know you're alive yet at all.
942;SAM;You could wear this hat. Might not fit on your head, you could maybe put it on one of your knuckles.
943;TRAVIS;I'm not hiding from my herd.
944;TALIESIN;You were giving off the impression of one who is looking forward to putting something off.
945;TRAVIS;I was, was I?
946;TALIESIN;You were. You're not anymore, as if you've been dared, somehow.
947;LAURA;Very big.
948;SAM;If you're too scared to do it, we can go elsewhere. Sorry, I will never say that again.
949;TRAVIS;No, I'm excited to go. I want to go. We should go. You know, what we need is the wolf.
950;LAURA;The wolf?
951;TRAVIS;Yeah. We need--
952;LAURA;Oh, the wolf in Whitestone?
953;TRAVIS;Yeah. Don't they smell shit? He could help us find them.
954;LAURA;Well, Trinket can smell.
955;MARISHA;And I can also theoretically turn into a wolf to help us find things.
956;TRAVIS;I mean, if you want to. I don't know how long it's been since he's seen a she-wolf, so, you know.
957;LIAM;Grog.
958;MARISHA;I was talking as in--
959;TRAVIS;I mean, it's very generous.
960;LIAM;Just out of curiosity, we weren't going to walk in and negotiate with your uncle. He's not going to give us these Knuckles. He's a proud owner of them, yes?
961;TRAVIS;Yep.
962;LIAM;And how many are in the herd, roughly?
963;TRAVIS;What's a number bigger than five?
964;LAURA;Six?
965;TRAVIS;Yeah, it's like six.
966;MARISHA;You mean it's like at least six? Or possibly more than six? How fast actually is the reproduction process of goliaths?
967;TALIESIN;Are there more people in your herd or fingers on your hand?
968;LIAM;I hold up Scanlan's hands and then I hold up my hands behind them so that all 20 fingers are waggling. Grog, are there more than this many in your herd?
969;TRAVIS;Yeah, six.
970;LAURA;Okay.
971;TALIESIN;He's counting hands, not fingers.
972;LAURA;Oh. I hold up mine, too.
973;SAM;We all hold up our hands.
974;LAURA;How many hands is that?
975;LIAM;We're doing rakshasa hands. Grog, is there more of them than rakshasa hands?
976;TRAVIS;That's closer, yeah. It's been a long time.
977;MARISHA;Yeah, this could be bad. This could be bad.
978;TALIESIN;We could attempt to steal them.
979;LAURA;Steal from the goliaths? That could work.
980;MARISHA;How easy is that?
981;LAURA;Does he wear them all the time? Does he put them in a chest?
982;TRAVIS;I mean, they're pretty smart, they're like me.
983;LAURA;Yeah. You're right.
984;LIAM;"I don't think it's going to be pretty no matter what we do, but I actually think trying to steal them might be a better angle than going toe-to-toe with """"six"""" goliaths. I just did air quotes."
985;LAURA;If six is the right number.
