;Player_Name;Transcription_Text
296;LIAM;I know, but we want it to work. We want her to die. And if you and I do it, it's not going to happen. Her being sick is still up here. We need the others. I really want to use both my arms to take her, but I can't. I take her by the arms. And we need the others. If I thought we could do it-- Listen to me. I love you, and if you ask me again, I will go with you. But I don't think it will work. I think you and I will die. I think Raishan will spit on our bodies. You will not get what you want. And then Thordak won't die. No one will be happy. I understand--
297;MARISHA;I just want this to be over.
298;LIAM;I want this to be over.
299;MARISHA;Okay.
300;LIAM;"We need to stay with the others; there's--"
301;MARISHA;Okay. Okay. I understand.
302;LIAM;"Listen to me; if you tell me to go in, I will go in. But there's strength with the others.|After this, if you tell me to go in, you say the word. It's not like I haven't tried to throw my life away already. You think I wouldn't do it for you?"
303;MARISHA;I feel like it's very telling when Grog has more patience than I. (sighs) Okay.
304;LIAM;Hey. It'll happen.
305;MARISHA;I just don't want to wait so long that she gets the upper hand on us. The longer we wait, the more she learns about us. The more we're letting her in, the more we're revealing. I feel like the longer we wait, the closer is her inevitable betrayal.
306;LIAM;"Pulls her in and touch foreheads. I don't think we're going to be waiting for long; I really don't."
307;MARISHA;Okay. Let's catch up with the others.
308;LIAM;Yeah. Yeah.
309;MATT;The rest of you, what have you been up to?
310;SAM;I pull Percy aside and say, we can kill her right now.
311;LIAM;Ugh! It's a tiger!
312;TALIESIN;Well?
313;SAM;Well, we got to go to the treasury.
314;TALIESIN;We have to go to the treasury.
315;SAM;And then what? Who do we need to check in with? Everyone, right? Gilmore and Kash and--
316;LAURA;We've got a couple hours.
317;TALIESIN;We have a couple hours. We need to talk to people. We need to find out where this meeting's being held, if it's being held downstairs or if it's being held in the battle room.
318;LAURA;It won't be if Asum has anything to say about it.
319;TALIESIN;Well, maybe he won't.
320;SAM;And what is this meeting? I know that we have to have a conversation with Asum.
321;MARISHA;Yeah, but what is this about?
322;TALIESIN;"This meeting may be the beginning of something very violent or this may be the start of something; I don't know. But be prepared perhaps that this meeting may be on moment."
323;TRAVIS;(singing) Be prepared.
324;TALIESIN;Don't think about it. Don't plan. Don't have any thoughts in your head.
325;LAURA;Improvise. We're good at that.
326;TALIESIN;You can't lie about anything. Do not lie to her about anything. And one of the ways we can lie best is by truthfully saying we have no plans against her right now because we have no plans against her right now. The more we talk, the more she will be able to perceive our deceptions, if we have any. Be very careful. This is going to be very dangerous. There's going to be a lot of improvisation.
327;LAURA;I hate knowing that she's going to be able to hear all of our plans.
328;MARISHA;(sighs)
329;TALIESIN;Honestly, we should have assumed that they could hear all of our plans from the beginning.
330;LAURA;Yes.
331;TALIESIN;(sighs) My fault, really. Well, we are very good at being spied on.
332;SAM;Yes, well, we like to talk.
333;TALIESIN;And even if we do, even if we were to get rid of her, there's no sense in believing that they still don't know everything we're doing.
334;SAM;All right. Then we'll see what he proposes and take it from there.
335;TALIESIN;And let's hope that we're downstairs, and if we're not downstairs, there's still options.
336;LAURA;All right.
337;MATT;Grog, you've finally caught up with the group. You've managed to drop off your large amount of dragon hide in return.
338;TRAVIS;Holy shit, that skin weighs a ton. Good thing I'm strong as fuck. What'd I miss?
339;SAM;Is there a cold place in the treasure room? Wait, this hide is going to be cured, or smoked, or something, whatever you do. Stretched?
340;LAURA;It's got scales all over it. I mean that stays, right? It doesn't have to be kept cold?
341;MATT;I mean, it probably should be.
342;LAURA;Kept cold.
343;MATT;It probably should be attended to in a short amount of time, like in the next week or so, before it's really--
344;LAURA;Would it be an armorer, or a blacksmith, or-- who works with dragonhide?
345;SAM;Taliesin, what's the old fashioned word for the guy who does the hide stuff?
346;LIAM;Tanner.
347;SAM;A tanner! Thank you!
348;LAURA;Is there a tanner in Whitestone?
349;TALIESIN;One would assume we have a tanner in Whitestone.
350;MATT;There are a few tanners, yeah.
351;TRAVIS;Is it super cold where I dropped off the hide? Like is it below ground?
352;MATT;It's below ground. Yeah, it's not--
353;TRAVIS;A bit chilly?
354;MATT;Comparatively. Whitestone in general is a pretty chilly place, so yeah.
355;SAM;But not like a fake-bake. We want a real tanner, right?
356;LIAM;Hey, while they're talking about all this, can I stealth away?
357;MATT;Yes, you can. Make a stealth check.
358;LIAM;I'll use Luck. 28.
359;MATT;What was that?
360;LIAM;28.
361;MATT;28. Okay, yeah. You vanish without anybody else noticing your disappearance.
362;LIAM;I would like to go as quickly as I can towards Gilmore's house.
363;MATT;Okay.
364;LAURA;He's cheating on you, Keyleth.
365;MARISHA;(laughs) Look, it's 2016.
366;TRAVIS;Did we decide what we do about Raish--?
367;LAURA;(shushing)
368;TALIESIN;Seeker Asum?
369;TRAVIS;Yeah.
370;TALIESIN;We're going to talk, we're going to listen, and we're going to be prepared for anything.
371;TRAVIS;Okay, so we're not (death noises and farts)?
372;LAURA;Not just yet.
373;TALIESIN;We're going to talk, we're going to listen, and be prepared for anything.
374;SAM;Was that last sound the sound of Seeker Asum's bowels?
375;TRAVIS;It's open to interpretation.
376;SAM;Okay. After he dies, letting it all out?
377;TRAVIS;Yeah. Just want to be fancy. I lean that way but, you know. Cannot speak for other people.
378;TALIESIN;The work speaks for itself, really.
379;MATT;Fair enough. Vax, as you rush down towards the homestead that Gilmore had made here in Whitestone, the door is closed. There's a large pile out front of ruined furniture that's been jammed into this collection. Presumably from the last encounter they had when the incursion of assassins made their way in. But the door's closed, and seemingly locked.
380;LIAM;(knocks)
381;MATT;A few moments pass, no response.|(Mario coin sound)
382;LIAM;That's him, that's magic!
383;MATT;But you find a cool coin.
384;LIAM;(knocks)
385;MATT;"Yeah. Eventually you hear a little rustling, and you hear a voice, muffled, from the upper floor say, """"Confound it, I'll be right down!"""""
386;LIAM;I'm so scared of this with that hair on your head.
387;LAURA;Yeah.
388;MATT;"You hear some footsteps, and then eventually the door (unlocking sound). You hear the unlocking mechanism. The door swings open a little bit. And you see, you know, morning robe, chest open, curly chest hair poking out. A very groggy bedhead.|Gilmore opens the door. """"Yes, can I help-- Oh.|Good morning."""" (laughter)"
389;TRAVIS;I don't know what to do.
390;LIAM;Why did I do this? Tonight?
391;MARISHA;Now you know why.
392;LIAM;Hey, this is not fair. Can I come in to talk? Quickly, I have to head back to the others.
393;MATT;"""""Of course. Would you like some tea?"""""
394;LIAM;No. I don't even have time, I just want to talk to you.
395;MATT;"""""I'd like some tea. Come on in, come on in."""""
396;LIAM;All right.
397;MATT;"He ushers you to enter, and leads you to one of the small chairs. And he walks back into the kitchen, shouting over his shoulder, """"So! Vax'ildan, please. Tell me what's on your mind."""""
398;LIAM;You know, we're getting closer to the end game here.
399;MATT;"(laughs) """"I certainly hope so. It's taken a couple years off my lifespan."""""
400;LIAM;We just killed another one of the dragons.
401;MATT;"""""Really?!"""""
402;LIAM;Yeah.
403;MATT;"""""How many is that for you now? Three?"""""
404;LIAM;It is three.
405;MATT;"""""Making a name for yourself. I'm proud of you."""" A few moments pass, and silence. And Gilmore walks back out, clutching a small tray with a few teacups. And as he's walking, he's twirling his finger and you can see a little spiral of flame encircling the tea kettle as it begins to heat up.|He brings it over, sets it down on the table.|Pulls his robe in and sits down across from you on this low slung tea table. Takes a bit and sips it.|""""So, what brings you here this early in the morning, friend?"""""
406;LIAM;I think I might be dead in a couple of days.|So I came here to apologize. If you think I have no feelings for you, you're kidding yourself. I care for you very deeply. I have for a long time.|And I don't think I've treated you fairly. But I wasn't playing games. Shaun. It's been a little weird lately, and I understand why, but I want you to know that I love you as a dear, dear friend, and I really don't think I'm going to be here in a few days. And I would hate to think that I would be--
407;MATT;"""""Shh. That's far too fatalistic for the Vax'ildan that I-- number one. Number two, you have nothing to apologize for. Look, everything's on fire around us all the time. We all jump at whatever bit of comfort finds its way before us.|And at the same time, I appreciate your honesty.|And I'm thankful for the connection that we do have. And yes, heartbreak comes. But heartbreak goes. It's part of life. It just means that I need to find somebody who's a little more my speed."""""
408;LIAM;That guy'll be fast.
409;MATT;"""""He better be. Don't worry about it. Go.|Kill a dragon. Another. Kill two more. Kill six more, I don't care! Just know that you're coming back, because I need you and your friends to keep pimping out my name."""""
410;LIAM;Sure. Whoever gets you will be a very lucky man.
411;MATT;"""""I know. I know."""""
412;LIAM;Love you.
413;MATT;"""""I know. You sure you don't want any tea?"""""
414;LIAM;I'm really nauseous right now. I almost didn't come here.
415;MATT;"""""I'm glad you did."""" He takes your cup.|""""Waste not, want not. (sips) Now go! Stop being uncomfortable in front of me! I need to get my morning--"""""
416;LIAM;Yeah. Yes.
417;MATT;"""""--situated."""""
418;LIAM;Goodbye.
419;MATT;He stands there. Waves his hand and the door opens on its own.
420;LIAM;I leave.
421;MATT;"He takes you by the shoulder real fast before you leave, and turns around and goes, """"'Till next time. Say it."""""
422;LIAM;'Till next time.
423;MATT;"""""All right. Go."""" And you feel a little pat on your backside, on the way out. He sits there holding his tea, watching you leave.|Door slams behind you. You make your way back."
424;LIAM;I'm sorry I made you do that in that skullcap, Matt.
425;MATT;Look, I don't have to look at this. I'm fine! (laughter)|From my perspective, this is easy.
426;LIAM;All I saw was a very handsome man.|(laughter)
427;TRAVIS;Training. This is all training. It's training at a thousand times gravity.
428;MATT;(laughs) It totally is! Like performing arts with the weights on.
429;LIAM;Been doing this since the 80s and 90s, man.
430;LAURA;We need to find Kashaw. Before the meeting, yes?
431;MARISHA;Yeah, I set off. To find Kashaw with Vex.
432;MATT;All right. Asking around quickly, he is back in the room where he's been staying in Whitestone.|You go back to his door. It's closed.
433;MARISHA;(knocks)
434;LAURA;Kash?
435;MATT;Nothing.
436;LAURA;(loudly) Are you sleeping?
437;MATT;Nothing.
438;SAM;Break down the door.
439;MARISHA;Kash?
440;LAURA;I'm going to jiggle the lock. Is it locked?
441;MATT;It's not locked.
442;LAURA;I open it. Just a crack, and look in.
443;MARISHA;I hope you're not naked!
444;LAURA;Shh.
445;MATT;As you open it up, there's no light on the inside, but the light does come in as you slowly open the door with a (squeaks). You can see he's halfway out of his armor, passed out on his back, on the bed. He's one arm out, snoring loudly like he was too tired to make it all the way, and (snores).
446;LAURA;Should we let him sleep or should we talk to him?
447;MARISHA;I don't know.
448;LAURA;He snores.
449;MARISHA;Wow.
450;LAURA;You know, my brother doesn't snore.
451;MARISHA;No, I know.
452;TRAVIS;Ew.
453;MARISHA;No, I mean I don't--
454;LAURA;No, just don't, just don't.
455;MARISHA;Just don't worry about it.|(laughter)
456;TALIESIN;I love you, Travis.
457;LIAM;You thought I'd be the one to fuck up.|(laughter)
458;LAURA;Do I have any like stones or any like rocks or anything in my bag or--
459;MARISHA;You're going to throw a rock at him?
460;LAURA;Yeah, just to see if he wakes up.
461;MARISHA;We can't just poke him? That seems so weird, though.
462;SAM;You're an archer.
463;LAURA;Well, I don't want to kill him.
464;MARISHA;Why don't we just tap on his shoulder?
465;LAURA;I'll sneak in, tap his shoulder, come back out, see if he wakes up.
466;MARISHA;Oh, that's what I want to do.
467;LAURA;I don't want him to know that, you know--
468;MARISHA;That we did that? Sure. I'll stand on the outside and look unsuspecting.
469;LAURA;I want to sneak in and tickle his little foot and walk out.
470;MATT;Well, he still has his boots on.
471;LAURA;Shit.
472;MATT;It's more like his upper torso, he got partway out of that.
473;LAURA;All right, I tickle his hands.
474;MATT;Okay so you're opening his palm--
475;LAURA;Tickle his hands and then go back really fast to the doorway.
476;MATT;Okay, you tickle his hand. No response.
477;LAURA;Fucking--
478;MATT;(snores)
479;LAURA;I flick his nose.
480;MATT;As soon as you flick his nose and you start to back away, there's a blur of motion as suddenly he comes leaping out of the bed (grunts) and goes over and grabs his spear, his hand reaches for nothing in the air, and slings it forward in your direction, (whoosh) bypassing by your face by a few inches. And he looks still half awake, going (startled noises).
481;MARISHA;Oh Kash, oh hi. Fancy meeting you here.|Shit.
482;MATT;"""""Yeah, it's my room."""""
483;MARISHA;I keep doing that.
484;LAURA;"I know; it's awkward."
485;LAURA, MARISHA;Hi.
486;MATT;"""""Hi."""" And he throws his spear to the side."
487;LAURA;Oh good, I was wondering if--
488;MARISHA;Yeah, I hope we didn't-- I hope you weren't sleeping.
489;MATT;"""""I hope I wasn't either. Sure, all right, I'm glad you're here because it took me a long-ass time to get here."""" And he sits up in the bed and-- or he sits down back on the bed and reaches over and pulls out one of his packs and brings out a couple of rolls of paper. """"Okay, so I talked to Vanessa and got two contracts that we could take up for this."""""
490;LAURA;Okay.
491;MATT;"""""We got one here,"""" and he pulls it out, """"This is for two indigenous creatures to the region that you were talking about over by Wildemount. One is a purple worm matron."""""
492;LAURA;Ooh, that sounds big.
493;MATT;"""""Supposedly. Shit's dangerous. Careful. This one is for a Storm Giant. This one is a little harder to get a hold of apparently."""""
494;LAURA;They're so hard to get a hold of. We should probably focus on the other one.
495;MARISHA;Mm-hmm.
496;LAURA;Unless Vorugal's already dead.
497;MARISHA;Yeah, wouldn't that be crazy if he was already dead?
498;LAURA;What would we do with these contracts if he is? Just wondering about that.
499;MATT;"""""Get out of my room."""""
500;MARISHA;Kash.
501;MATT;"""""Just get out."""""
502;MARISHA;Kash.
503;MATT;"""""Get out of my room."""""
504;MARISHA;Look--
505;LAURA;Your help has been--
506;MARISHA;Not overlooked.
507;MATT;"""""Out. Of my room."""""
508;LAURA, MARISHA;We should probably go.
509;LAURA;Do you want these back--
510;MATT;"""""Out of my room."""""
511;LAURA;I'm going to set them down on the ground.
512;MATT;"""""Out of my room."""""
513;MARISHA;You know, we could--
514;MATT;"""""Get out of my room."""""
515;LAURA;By the way, you might want to get like a mouthguard or something because you snore a little.
516;MATT;"You leave him in silence and darkness.|(yelling) """"Out of my room!"""""
517;LAURA;Keyleth, we should go.
518;MARISHA;Okay. Okay. We'll see you later.
519;LAURA;Keyleth.
520;MARISHA;What?
521;LAURA;Come here.
522;MARISHA;Okay.
523;LAURA;And I take her around a corner. He kissed me.
524;MARISHA;Kash?
525;LAURA;No! God no! Percy!
526;MARISHA;Like right now?
527;LAURA;Percival!
528;MARISHA;Did I miss something?
529;LAURA;No.
530;MARISHA;What? Percy?
531;LAURA;Yeah!
532;MARISHA;(squeals)
533;LAURA;I know.
534;MARISHA;That's good, right?
535;LAURA;I mean I know you guys are like--
536;MARISHA;No!
537;LAURA;Pretty close and I don't know if that's weird.
538;MARISHA;Why are you asking me?
539;LAURA;I don't know, you're like his sister, kind of.
540;MARISHA;He's not my twin brother.
541;LAURA;This is true. How are things with you and Vax? Thanks for bringing it up. Is it good?
542;MARISHA;I still worry if you care.
543;LAURA;"I care; of course I care."
544;MARISHA;Yeah, you say that.
545;LAURA;I hug her. Well not your antlers in my face.
546;MARISHA;Oh, sorry, sorry, that happens a lot. I'm very happy for you.
547;LAURA;Hey thanks. We should go look at the treasury.
548;MARISHA;Okay, let's go to the treasury. We should go victory shopping.
549;LAURA;Oh my god.
550;MARISHA;Yeah.
551;LAURA;Do you think he'd mind if we-- I mean we have so much money, we don't even need to do that.
552;MARISHA;I mean it's basically our money, though, right?
553;LAURA;Yeah. No. It's--
554;MARISHA;Yeah. Okay.
555;MATT;All right, so you guys wander your way off--
556;MARISHA;You know, Vex, I feel like you might be a bad or good influence on me. I'm not sure, but I like it.
557;LAURA;It's all good.
558;MARISHA;Okay.
559;MATT;Scanlan, Grog, Percival. What are you guys doing?
560;TALIESIN;Life is failing the Bechdel Test so hard right now.
561;MARISHA;Yeah.
562;LAURA;So bad.
563;TALIESIN;Sorry. (laughs) Carry on.
564;LAURA;Sometimes they do talk about boys.
565;MARISHA;They are like 50% of--
566;TALIESIN;No, I did not see that coming.
567;TRAVIS;We don't really need to like check in with anything.
568;SAM;You mean do you have the gold?
569;TRAVIS;Well I mean I-- yeah.
570;SAM;We should probably divvy it up, don't you think?
571;TRAVIS;What? What? What?
572;TALIESIN;No, no, no.
573;TRAVIS;But it's really a lot to hold onto your person. I mean, it's a bag of gold--
574;SAM;No, but we should all replenish our personal--
575;TALIESIN;You can have some pocket money, but--
576;SAM;Yes, yes, yes.
577;TRAVIS;Yeah. How much do you want? You don't have it. I have it.
578;SAM;5000. We have hundreds.
579;TRAVIS;Yeah, if you want 5000. Do you have good credit?
580;SAM;Do I have good credit?
581;TRAVIS;Yeah.
582;SAM;I've never misspent a single coin.
583;TRAVIS;Can I have your last four pay stubs, please? (laughter)
584;SAM;Here's two of them right here.
585;TRAVIS;Hey! That's good enough! Have 5000 gold!
586;MATT;As Grog gives you 5000 gold, which weighs roughly a hundred pounds--
587;SAM;Shit!
588;MATT;It weighs more than you do.
589;LAURA;5000 gold is a hundred pounds?
590;TRAVIS;And it's probably about 1000 because I can't count to 5000.
591;MATT;Yeah. He starts divvying it out until it's like larger than you in a pile in the center of the room.
592;TALIESIN;Well what are you going to do with it?
593;SAM;All right, all right. I'm going to give some back.
594;TRAVIS;Are you really?
595;SAM;Why don't you give me ten platinum.
596;TALIESIN;No! Absolutely--
597;SAM;(chuckles) It's the same! It's the same!
598;TRAVIS;Why not?
599;LIAM;Ten platinum?
600;TALIESIN;Ten platinum is an awful lot.
601;TRAVIS;But he can carry ten. That's easier.
602;LIAM;Sure.
603;TRAVIS;Hold on, let me consult Blackstone.
604;LIAM;Ten or ten thousand?
605;TALIESIN;(stage whisper) Don't do it!
606;TRAVIS;Yep. Stoneblack says it's all right.
607;SAM;You're with us. You're with us.
608;TALIESIN;I am!
609;TRAVIS;I take the gold. I put it back in.
610;TALIESIN;No!
611;TRAVIS;And I give him ten platinum, which is actually six.
612;MATT;So you get six platinum from Grog, which is roughly sixty gold.
613;TRAVIS;One. Three. Seven. Eight. Nine. 40. Ten.
614;SAM;That's it?
615;TRAVIS;Yep.
616;TALIESIN;Excellent.
617;SAM;And give me 500 gold, as well.
618;TALIESIN;No!
619;SAM;Of course. I need money.
620;TRAVIS;It's really heavy. How about I give you 20 more platinum?
621;SAM;Great. That sounds good.
622;TRAVIS;And I give him four more.
623;SAM;(laughs) Give me 50 more platinum.
624;TRAVIS;50?
625;SAM;Yes.
626;TRAVIS;All right. I give you one more.
627;SAM;Thank you. 11 platinum.
628;MATT;Perfect.
629;TALIESIN;I'm going to try to find Allura. I'm going to leave them to their madness. I'm going to try and find Allura and Cassandra or anybody I can find in the castle at this point.
630;MATT;"Okay. As you walk around, nobody else who's supposed to be meeting has gathered yet. However, Cassandra is awake and in the process of going through some papers. She has her personal guard at her side and two guards at the door and you can see she's getting herself prepared for the meeting. As you enter the room, the door partially ajar, you see her still down currently thumbing through notes. Her hair is still in disarray and pulled back haphazardly. And she's wearing her morning gown and without even looking up goes, """"Percival. Glad you've arrived and still in one piece."""""
631;TALIESIN;Yes. And down one dragon.
632;MATT;"""""I have to tell you, I'm very impressed."""""
633;TALIESIN;Thank you. Two more to go. It's going to get a little heavier at this point.
634;MATT;"""""Indeed. That's what our meeting is about."""""
635;IPHONE;What was that, again?
636;TALIESIN;What was that, again?
637;MATT;"""""Sorry, I need to go fire some of my guards.|They're making a nuisance. Continue, please."""""
638;TALIESIN;Two more to go. I fear that it's possible that Whitestone itself may eventually be a target of an attack. I feel it may be inevitable.
639;MATT;"""""That is, actually, what our meeting is about. Prevent that from happening."""""
640;TALIESIN;Quickly to check. I would know what languages Cassandra spoke, correct?
641;MATT;What languages do you know?
642;TALIESIN;Elven, Celestial, Common.
643;MATT;She knows Elven and Common. She does not know Celestial.
644;TALIESIN;Okay.
645;MATT;That was more your hobby.
646;TALIESIN;I figured. That was my guess. I wanted to confirm.
647;MATT;Yeah.
648;TALIESIN;"I hand her a small slip of paper that I have written in Elven: """"Be prepared for anything today. Keep silent."""""
649;MATT;"She gives you a very keen look. And you can see Cassandra. As much as she is the healthiest you've seen her physically, her eyes have dark circles over them. It looks like she's been very harried by the events of these past few weeks.|Understandably so. But she takes and looks over the sheet and goes, """"Well, very well. Should be an interesting meeting then."""""
650;TALIESIN;I think so.|I do think so. It's good to see you taking command.
651;MATT;"""""It's good to see you, and I look forward to you sharing some of the burden soon."""""
652;TALIESIN;Yes.
653;MATT;"""""Right?"""""
654;TALIESIN;Quite possibly.
655;MATT;"""""Right?"""""
656;TALIESIN;We will discuss whence the dragons are taken care of.
657;MATT;"""""Good."""""
658;TALIESIN;We will discuss, at the very least, relieving you of some of this burden.
659;MATT;"""""Good."""""
660;TALIESIN;I know it is not fair.
661;MATT;"""""Whatever is fair in this life? The wonders of lordship and ladydom."""""
662;SAM;I'm going to run off and try to find Jarett.
663;MATT;Okay. Do you wish to come? Anything else you want to bring to this conversation?
664;TALIESIN;No, I'm fine with that. My last thing is, I'm going to quickly run and have a quick conversation privately with-- I assume we have some sort of royal jeweler of some kind, or somebody who does some of the ornamental work.
665;MATT;No one who lives on site per se, but there are two individuals that your family generally used for various forms of jewel craft.
666;TALIESIN;I'm going to write and send a letter off for that.
667;MATT;Okay. No worries. Scanlan, what are you going to do? Looking for Jarett?
668;SAM;Looking for Jarett.
669;MATT;"Okay. You head outside of the main castle, down to where the training barracks are for Whitestone. And you can see Jarett's already out there, with a small, metallic platter on his lap, scarfing up some food real fast. He's gotten his day started relatively early and as soon as you approach, mouth's already full. """"Mmm! Scanlan! It's good to see you."""""
670;SAM;Good to see you too! What're you enjoying there?
671;MATT;"(laughs) """"The usual gruel that you find in this city."""""
672;SAM;Oh, I thought it might be something, meat-based that you could have popped up a bit with your spice.
673;MATT;"""""Oh, well trust me, I've used it on the eggs and it makes it bearable. Whitestone is not well known for its cuisine from what I can tell. Everything's gray and lacks flavor."""""
674;SAM;I'll invite you over to my house some time, give you a proper chicken dinner.
675;MATT;"""""All right, I will happily take you up on that offer, thank you."""""
676;SAM;Wanted to check in on (lowers voice) the task we talked about?
677;MATT;"""""The task?"""""
678;SAM;You know, the mission we discussed.
679;MATT;"""""Remind me again?"""""
680;SAM;I don't want to talk about it out in the open.|But you know there was some illicit--
681;MATT;"""""Oh!"""""
682;SAM;Items of medicine.
683;MATT;"""""Yes, I sent a request through someone I know."""""
684;SAM;Sent a request?! You're using other people? I trust you, I don't trust other people!
