;Player_Name;Transcription_Text
1566;MARISHA;Well, if you cast Pass Without a Trace, it's a concentration spell--
1567;SAM;You won't be able to swim very fast, though.
1568;LAURA;If what?
1569;SAM;She can't use Alter Self and Pass Without a Trace.
1570;MARISHA;Is Alter Self a concentration spell?
1571;SAM;Yes.
1572;MARISHA;Oh.
1573;MARISHA;I could cast Pass Without a Trace, though.
1574;LAURA;Okay.
1575;MARISHA;I did bring it today.
1576;LAURA;Oh, good.
1577;LAURA;All right.
1578;MARISHA;I could-- yeah.
1579;MARISHA;Wait.
1580;TRAVIS;Are there any seashells on the floor that I could find?
1581;TRAVIS;Pretty shells?
1582;TALIESIN;I've already got a small bag of them, if you want to keep them--
1583;TRAVIS;I don't want yours.
1584;MATT;So Alter Self is a what-level spell?
1585;TALIESIN;We could trade later.
1586;MARISHA;One.
1587;MARISHA;Two.
1588;MATT;You have three second-level spells you can cast.
1589;MATT;And two thirds.
1590;MATT;So you'd have to use one of your third-level spells to do that.
1591;SAM;Yeah.
1592;TALIESIN;Also a skipping stone.
1593;MARISHA;Right.
1594;MATT;Technically, you could do--
1595;SAM;I need one for me.
1596;TALIESIN;You didn't think of that, did you?
1597;SAM;So four of them.
1598;MATT;You are correct.
1599;LAURA;You're a rider?
1600;TRAVIS;I'm a whale.
1601;MARISHA;Animal Shapes takes my concentration, so I can't do that.
1602;MARISHA;But you could cast it--
1603;SAM;You could just have Water Breathing, and be riding a whale.
1604;SAM;But if you get tossed from the whale, can you swim?
1605;LAURA;I mean, I can swim.
1606;LAURA;What if you give me the coin--
1607;SAM;And then you can use it if you need it.
1608;LAURA;-- and if things get hairy, then I use it, and then we drop Pass Without a Trace.
1609;TALIESIN;If it's hairy, we won't need Pass Without a Trace at all.
1610;MARISHA;I can go ahead and cast Animal Shapes on her, but it takes a turn, a round, for me to-- an action to change her into something else, so can I cast it on her, but leave her as Vex for now?
1611;LAURA;I'm not gonna be an animal.
1612;MARISHA;No, I know.
1613;MATT;You assume the form of a different creature for the duration.
1614;MATT;A creature different from herself.
1615;MATT;Of the beast variety.
1616;MARISHA;Okay.
1617;MARISHA;Never mind.
1618;TALIESIN;We've got a plan.
1619;LAURA;We're fine!
1620;MARISHA;'Cause we need Pass Without a Trace for her, right?
1621;LAURA;Yeah, so I'll get a coin, I'll cast it, go in, if things get bad, I'll use the coin.
1622;MARISHA;You can cast the coin.
1623;MARISHA;Okay.
1624;MARISHA;All right.
1625;SAM;You're a whale.
1626;TALIESIN;I'm going to be a whale, we've got some rope here, it's going to be your job once I'm a whale to create at least a couple handholds with a harness.
1627;TALIESIN;You know how to use knots, right, you can do some basic--
1628;SAM;I know every knot in the book.
1629;TALIESIN;I knew you would.
1630;SAM;The double-sloop.
1631;SAM;The reverse-cowgirl.
1632;SAM;I know 'em all.
1633;SAM;I've got the itsy-bitsy spider.
1634;TALIESIN;Keep going.
1635;SAM;I know the rusty trombone.
1636;SAM;I've got--
1637;LAURA;The old Alaskan pipeline.
1638;SAM;Yep.
1639;SAM;Got the figure eight, the figure four, the hidden figures.
1640;TALIESIN;The Dallas two-step.
1641;SAM;I've got a bunch of 'em, yep.
1642;TALIESIN;The sweet Caroline?
1643;SAM;Oh, yes.
1644;SAM;That one.
1645;SAM;That one's good.
1646;SAM;(all laugh)
1647;TALIESIN;Good for tension.
1648;TALIESIN;I'm also gonna grab-- I should not be allowed to drink this.
1649;TALIESIN;I'm going to take you aside really quickly and give you the extra set of goggles and the bead.
1650;LIAM;What do you want me to do with these?
1651;LIAM;Just keep them safe?
1652;TALIESIN;Just in case.
1653;TALIESIN;I'm-- you know how I get with my hunches.
1654;LIAM;Okay.
1655;TALIESIN;You'll know, if we need them, we have them.
1656;TALIESIN;Just an extra set.
1657;LIAM;All right, Freddie.
1658;MARISHA;Uvenda, these beads.
1659;MATT;Yes?
1660;MARISHA;Can you guys also track where we are based on them?
1661;MATT;No, unfortunately.
1662;MARISHA;No.
1663;MATT;The magic is only localized.
1664;MARISHA;All right.
1665;MATT;We've recovered as many as we could from previous scouts that have fallen.
1666;MARISHA;I go ahead and I Druidcraft one of my bark bracelets to put around her.
1667;MARISHA;For scrying, if you need it.
1668;MATT;All right.
1669;MATT;Thank you.
1670;SAM;Bigly man over there, do you want a coin in case you lose your whale form?
1671;TRAVIS;Yeah.
1672;SAM;What about you, Percival?
1673;TALIESIN;I'll take one just in case.
1674;SAM;All right.
1675;TRAVIS;What does it do?
1676;SAM;You say, 'Alter Self!'
1677;SAM;and slam it against your body and it'll make you with gills and stuff.
1678;SAM;Does he speak-- he speaks Common, right?
1679;SAM;He understands what I'm saying?
1680;TALIESIN;Well.
1681;TRAVIS;What does it do?
1682;SAM;Make big, big hit, say 'Alter Self'--
1683;TRAVIS;What's the matter with you?
1684;TRAVIS;Why are you talking like that?
1685;TALIESIN;That was everything I could've hoped for.
1686;LIAM;He does speak Fucking-with-you.
1687;LIAM;Very well.
1688;SAM;All right, I guess I'll make four coins.
1689;MATT;Okay.
1690;SAM;And pass them out to Percy, Little Elf Boy, Little Elf Girl, and Jumbo.
1691;MATT;All right.
1692;LIAM;Hi.
1693;LIAM;My name is Vax.
1694;SAM;Oh.
1695;LIAM;That's short for Vax'ildan.
1696;SAM;Have you heard the Legend of Taryon Darrington?
1697;LIAM;From you, yes, I have.
1698;LIAM;It's a good tale.
1699;SAM;Good, then, we're equals.
1700;LIAM;That is my sister.
1701;LIAM;Her name is Vex'ahlia.
1702;LIAM;You can call her Vex.
1703;LIAM;Some people call her Vax.
1704;LAURA;That's true.
1705;SAM;That's very confusing.
1706;LAURA;Yeah, you can call us by anything, we'll both respond.
1707;TALIESIN;At first, yes.
1708;SAM;Okay.
1709;SAM;Okay.
1710;SAM;Were your parents fond of you, because to name them that similar would be-- just quite annoying, growing up, you must've gotten confused constantly.
1711;LIAM;I walk away.
1712;LIAM;(all laugh)
1713;LAURA;I follow suit.
1714;MATT;About this time, as you've seen Uvenda's been looking out patiently, the water nearby at the very edge of one of the reef drop-offs splashes out, and you watch as a figure darts out and lands and shakes off, and what you see there looks to be a very, very dark-skinned, stocky dwarf, wearing the same goggles and throat bead there.
1715;MATT;Sorry about the delay.
1716;MATT;He wanders up and pulls his goggles off and rustles his hair a bit.
1717;MATT;Hello.
1718;MATT;So you're the ones traveling to the Aerie today?
1719;MATT;Waverider Durent.
1720;MATT;Pleasure to meet you.
1721;MATT;And he reaches over and grabs-- as he takes your hand-- you put it out to extend it, he grasps it and gives a firm shake.
1722;MATT;You see he's got very, very short dirty-blonde hair--
1723;MARISHA;Durent?
1724;SAM;Yeah.
1725;MATT;And a beard that is just tattered and knotted from not being kept or combed through.
1726;MARISHA;So someone you would find at Venice Beach.
1727;MATT;Kind of, yeah.
1728;MATT;He's the Venice Beach dwarf, basically.
1729;LAURA;(gasps) That's awesome.
1730;MATT;Straight-up, actually, now that you point it out.
1731;LIAM;Just finished going up the ropes and down.
1732;MATT;All right, I'm taking you down to the Aerie.
1733;MATT;You ready?
1734;LAURA;I think so.
1735;TALIESIN;Sure.
1736;MARISHA;Are you gonna be with us the whole time, or are you just getting us there?
1737;MATT;Well, I'm just getting you to the door.
1738;MARISHA;Of course.
1739;SAM;Wait, there's a door?
1740;TALIESIN;Oh, now we're really in trouble.
1741;LAURA;This is where we're gonna check out the lodestones, before we go through the door.
1742;TRAVIS;Right, yeah.
1743;TRAVIS;Knew it.
1744;TRAVIS;Making sure you knew.
1745;MARISHA;There's doors to the other planes.
1746;MARISHA;That's our people's job.
1747;MATT;It's a figure of speech.
1748;SAM;We're going to another plane?
1749;ALL;Yes.
1750;SAM;Oh my.
1751;SAM;Okay.
1752;SAM;This is great.
1753;SAM;This is great.
1754;MATT;Oh, you look really excited.
1755;SAM;I am.
1756;MATT;You shouldn't be.
1757;MATT;Now, come on.
1758;MATT;See you've got your equipment.
1759;MATT;And takes his goggles and puts them back on.
1760;MATT;They're bulbous, they're just these giant domes that make you look fly-like.
1761;TALIESIN;I love it.
1762;LIAM;Nice.
1763;MATT;Okay.
1764;MATT;Now.
1765;MATT;Follow suit.
1766;MATT;He looks over.
1767;MATT;Thank you, Uvenda.
1768;MATT;Of course.
1769;MATT;Take care of them.
1770;MATT;That's not my job.
1771;MATT;And dives into the water.
1772;MARISHA;I go in first.
1773;SAM;Wait, don't you have to make some of us--
1774;MARISHA;Oh, right.
1775;LAURA;No, no, no, wait, how long does it last?
1776;TRAVIS;Right at the fucking start.
1777;MARISHA;Are we doing this now?
1778;LAURA;No, 'cause we can do it underwater, can't we?
1779;MARISHA;Animal Shapes last for 24 hours.
1780;LAURA;Well, let's wait until we're going into the water plane before we turn into fucking whales.
1781;TRAVIS;Don't we have to examine shit first?
1782;TRAVIS;With our non-flipper hands?
1783;MARISHA;Yeah, he's gonna be showing us the stones first, right?
1784;MARISHA;So yeah.
1785;MARISHA;Jesus.
1786;MARISHA;I go in first.
1787;MATT;All right.
1788;MATT;So you guys follow suit, diving in, diving in, each one of you in the order you wish, eventually with Doty (splash) just sinking very heavily down after you.
1789;LAURA;He's coming?
1790;SAM;Oh, no.
1791;LAURA;Tary, shouldn't we leave him?
1792;SAM;How deep is this?
1793;MARISHA;I can't-- nope, he's a construct.
1794;MATT;Do you prefer Doty not to?
1795;SAM;I would prefer Doty not come.
1796;SAM;He can't swim, right?
1797;MATT;No, he can just walk across the bottom.
1798;TRAVIS;We're not going to tell you what to do here.
1799;MATT;Your call.
1800;SAM;I'm a little confused.
1801;SAM;We're going underwater now, but not to where we're going for the mission?
1802;MATT;Correct.
1803;MARISHA;The portal to the other dimension is underwater and through a rift.
1804;TRAVIS;Imagine endless water.
1805;LAURA;Just lots of water.
1806;TRAVIS;No possible-- bottomless.
1807;SAM;All right, then Doty can come this far.
1808;LIAM;To the rift?
1809;SAM;Just to the door.
1810;TRAVIS;We barely knew him.
1811;TRAVIS;Bring him along.
1812;LIAM;Wait by the gate.
1813;LIAM;Like a butler.
1814;SAM;Yes.
1815;TRAVIS;That was quick.
1816;LAURA;What if he gets rusty?
1817;SAM;I hadn't thought of that.
1818;LAURA;It might be smart to not have him join us.
1819;TALIESIN;The rusty Doty's another knot that you know.
1820;LAURA;Just leave him behind.
1821;SAM;The rusty Doty?
1822;SAM;(all laugh)
1823;MATT;What's your plan?
1824;MATT;Yes or no?
1825;SAM;Doty, you should stay behind.
1826;MATT;Goes to jump, like--
1827;SAM;Stay behind, and just take atmospheric notes, you know.
1828;SAM;Time of day, position of sun.
1829;SAM;Type of clouds.
1830;SAM;And if anyone tries to steal my stuff, describe them very well in the book.
1831;MATT;A little seagull flies overhead.
1832;MATT;(all laugh)
1833;SAM;It's all for color, for the book, you know.
1834;MATT;Another one.
1835;MATT;Just taking very, very good notes.
1836;SAM;Two chapters of seagull flight patterns.
1837;MARISHA;You're gonna have an excellent book on the mating habits of seagulls when you get back.
1838;MATT;Eat your heart out, Darwin.
1839;MATT;Doty's on the case.
1840;TRAVIS;Oh my god.
1841;LIAM;Love you, Matt.
1842;MATT;It's ridiculous.
1843;MATT;So you guys all eventually dive into the water, and as you do, you look down and there is essentially a 40-foot-wide gap in the beach here, just barely submerged beach, that coasts down and drops off directly down into this cylindrical section that is just open.
1844;MATT;And as you drift down, your goggles visible, you can see around you, dry, pale reef that slowly gives way to colorful, life-teeming reef.
1845;MATT;You see hundreds of fish of different sizes and colors, all darting in and out of the various gaps and openings in the side, you see vibrant plant life beginning to massively jut out from the side of this reef.
1846;MATT;Further down, you see eels twisting through, and bits of kelp and other long, underwater plant life tickle your body as you push past and drift, keeping track of where you're slowly sinking down, desperately trying to follow this dwarf that is no longer in view, he just dove straight down and is far more comfortable under the water than most of you.
1847;MATT;Eventually, the reef begins to cluster in tighter and tighter, and you start getting a little nervous as to if you're going to hit a bottom or hit a pinch point.
1848;MATT;And then suddenly it stops, the reef just ends, and you now are floating down into what appears to be endless dark ocean.
1849;MATT;And just below, you see just a faint bit of light, and you start noticing the dark color is because you're about to hit an extremely dense forest of underwater plant life.
1850;MATT;You watch as all of these long, thin tendrils of almost vines covered in elongated leaves begin to curl up around you, and you start pushing through, following this light, and as you get across to the edge, Keyleth, you're the closest ahead and you guys have just enough light to watch the bead of where Keyleth is.
1851;MATT;Keyleth, you can still see Durent and keep that pace.
1852;MATT;He leads you down over this bank of where the top of this underwater forest ends, and you see, attached to the reef above by a single pillar of stonework that seems to be built or carved out of the reef, emerges a spiraling tower that eventually ends on the floor of the ocean here.
1853;MATT;It's made of a yellowish-white sandstone-like color, there are pillars carved out of it, naturalistic, but also have almost a series of bevelled edges to them.
1854;MATT;Within the inside, there is a dull green glow that is pulsating, and as Durent makes his way down toward one of the many openings in the floors, you can see there is a very, very faint sparkling energy that seems to just drift up out of the center of this tower.
1855;MATT;As you make it further down towards the base, you now begin to see through some of the openings, the center of this tower is hollow.
1856;MATT;It is an exterior, like a very thin Colosseum-like structure that goes up for multiple floors, slowly pincering as it gets to the top, and it is just an open interior inside.
1857;MATT;As eventually you touch down onto the soft bottom of the ocean here and begin making your way, slowly swimming towards the interior, you can see a number of other similarly dressed Waveriders as well as armored guardians that stand, all with various trident or spear-like weapons.
1858;MATT;A number of them appear to be of varying races, human, half-elf, elf, it appears that Durent is the only dwarf you see in this vicinity, and a couple of them appear to be merfolk, like straight-up half-human, half-fish, tails, fins, gills, the whole circumstance.
1859;LAURA;What does their hair look like?
1860;MATT;(laughs) You see two of them, one of which is male.
1861;MATT;No visible hair on him, actually, just the frill that goes down his head.
1862;MATT;The other is female.
1863;MATT;Long, deep, dark blue hair that drifts past, and as she shifts and looks in your direction, you watch it hold in place and slowly shift as the water currents push through.
1864;LAURA;I just stare at her.
1865;MATT;(laughs) As you're entranced by this, your attention slowly glides over to the very center, the base of this temple, where you can see there are these three large, smooth, gray-ish rocks that are embedded in the ground, about five feet wide, and in the center of these three rocks, you see what appears to be-- it's almost like an oval shape, about ten feet tall, about five feet wide, that is crackling blue energy.
1866;MATT;This opening, here.
1867;MATT;And you can watch as occasionally clouds of black, murky soot or sand, deep, deep ocean sand, push through.
1868;MATT;You can see, as you get closer and peer in, this is a doorway into the plane, this is the rift.
1869;MATT;Unlike the one that you saw at Pyrah, which seemed to flicker and have a barely contained energy when you've seen it at its torn-open stages, this appears to be fairly contained.
1870;MATT;It's demure, there's not a lot of movement, it's just stationary, and the guards that surround it in the center of this temple all look inward, keeping vigilant watch.
1871;MATT;As you follow Durent, making his way towards the doorway, you can see within each of these three large, half-buried stones, there is a smaller, deep emerald green, almost jade-looking stone that is about that large that is embedded in each of these.
1872;MATT;Durent points over to one of them, and you hear him, through the water, the throat bead carrying the sound of his voice through, This is what you're looking for.
1873;MATT;This is a lodestone.
1874;MATT;Take your time, as much as you need, to study it.
1875;MATT;Find what you need.
1876;MATT;Let me know when you're ready to pass through.
1877;LAURA;Are they all the same color?
1878;LAURA;Every lodestone looks the same?
1879;MATT;Yeah, you glance through, they're all the same color.
1880;MATT;Slight variations, and the shapes change a little bit, some are perfectly spherical, some are a little oblong, just whatever shape it eventually hardened into.
1881;TALIESIN;Kind of a natural jade?
1882;MATT;Kind of, yeah.
1883;MATT;But like a dark, dark jade.
1884;MATT;Like Maori, New Zealand jade.
1885;LAURA;Not translucent at all, not--
1886;MATT;No.
1887;LAURA;Okay.
1888;MARISHA;Keyleth goes up and touches one and meditates on it for a second.
1889;MATT;Okay.
1890;MATT;As you put your hand towards it, you feel a very, very faint vibration, actually a very similar vibration to the throat bead.
1891;MARISHA;Really.
1892;MARISHA;Are the throat beads green?
1893;MARISHA;Do they look similar?
1894;MATT;At this point, now?
1895;MATT;You notice, yes, they're made of the same material.
1896;MATT;You see that a lot of-- the lodestones' main purpose is here, but a lot of the inherent magic of them, or at least the enchantment properties of it, it's a pretty big part of the general life here at Vesrah.
1897;MARISHA;Do the beads tend to react when they get closer to the lodestone?
1898;MATT;There is no change.
1899;MATT;But you do feel that faint hum and vibration of power of the lodestone that is embedded within.
1900;MARISHA;I turn to Durent.
1901;MARISHA;Whereabouts do they tend to be found?
1902;MARISHA;The lodestones?
1903;MATT;Well, I mean, all over.
1904;MARISHA;All over?
1905;MATT;Who knows where they've been dropped.
1906;MATT;The ocean tends to swallow things up.
1907;MATT;You might have to dig.
1908;MATT;Mostly we find them buried.
1909;MARISHA;Buried.
1910;TALIESIN;How heavy are they?
1911;MATT;Let me show you.
1912;MATT;And he goes over and grabs one and (strains) and pulls it out.
1913;MATT;The doorway flickers ever so slightly.
1914;MATT;He's like, It's fine for a moment.
1915;MATT;And hands it to you.
1916;MATT;You take it, and for its size, it is surprisingly dense.
1917;MATT;It has about twice the weight you were expecting, and your arms just (grunts) a little bit.
1918;MATT;Also, as you're holding it, you notice the clasp on your cloak is being pulled towards it.
1919;MATT;As you pull it away, and pull towards it, you realize these are actually fairly magnetic.
1920;TALIESIN;They're magnetic?
1921;MATT;Yes.
1922;MARISHA;Magnetic.
1923;MARISHA;Percy, do you have a compass?
1924;TALIESIN;I don't, but I can fake one pretty quickly if we have to.
1925;MARISHA;Really?
1926;MARISHA;You don't have a compass.
1927;MARISHA;Really?
1928;TALIESIN;We never needed a compass.
1929;TRAVIS;What do we even have you here for, I mean?
1930;TALIESIN;Is it possible-- well, we're too deep now, but--
1931;MATT;As you're having this conversation, you watch as Durent's patiently there.
1932;TALIESIN;You have a compass, don't you?
1933;TALIESIN;And I'm going to hand it back to him.
1934;MATT;No, but I need the stone.
1935;MATT;Puts it back inside.
1936;MATT;Okay, we're good.
1937;SAM;If I examine it, do I detect any magic on it?
1938;MATT;You do.
1939;MATT;Profoundly magical, this is a very, very strong natural magic source.
1940;TALIESIN;This is going to be weird.
1941;TALIESIN;I'm going to take out a chunk of Whitestone residuum and just compare the color and see if there's any relation.
1942;MATT;Make an intelligence check.
1943;TALIESIN;Look at my sheet.
1944;TALIESIN;That's a natural 20.
1945;TALIESIN;(all cheer)
1946;TRAVIS;The snitch returns.
1947;MATT;Interestingly enough, there are similarities.
1948;MATT;It is not the same material, but you've had enough time to study whitestone, and get a feel that there are-- this is your first inclination that there are more than one substance that seems to be related to the nature of magic.
1949;MATT;This is-- at least based on the ecology and what little bit of history you've picked up from the kraken and how long it's been around-- whitestone may be one of the more recent sources of this type of power, or variation on this type of power.
1950;MATT;But there are certain comparable facets of its ability, yeah.
1951;TALIESIN;It actually occurs to me that I might have some magnets on my person.
1952;TALIESIN;Can I make an investigation check?
1953;TALIESIN;I had quietly in my head been using them to keep my coat down when I was running around with the spider boots.
1954;LIAM;The magic of improv.
1955;TALIESIN;I wouldn't say it if it wasn't true.
1956;MATT;No, that's fine.
1957;TALIESIN;Can I make a roll to see if I happen to have some on me?
1958;MATT;I'd say you have them on you.
1959;MATT;You're Percy.
1960;MATT;It's fine.
1961;MATT;They're very simple magnets.
1962;TALIESIN;Yeah.
1963;TALIESIN;They might help with-- I'm going to try and see if I can use them as a very base dowsing rod for these stones.
1964;MATT;You notice that you don't-- any sort of pull you feel on the magnet doesn't seem to hit until you're within about a foot or so of the stone.
1965;TALIESIN;Okay.
1966;LAURA;I do have Locate Object.
1967;SAM;I pull out my compass and see if it works.
1968;MATT;Okay, you pull out your compass?
1969;TRAVIS;You have a compass?
1970;SAM;Sure.
1971;SAM;Yeah, I have a compass, by the way.
1972;MARISHA;Really, you have a compass?
1973;MATT;As you pull it out, you watch, as you stand there, it's confused, it's darting around and doing circles.
1974;MATT;As you begin to step in one direction towards one of the stones, it rights itself in its direction.
1975;SAM;Hm.
1976;SAM;Fascinating.
1977;LAURA;Nice.
1978;MARISHA;Will you keep that handy, you know?
1979;SAM;Oh, sorry.
1980;SAM;Yes.
1981;SAM;One second.
1982;SAM;Just, still pressurizing.
1983;MARISHA;Sure.
1984;TRAVIS;Equalizing.
1985;TALIESIN;In my head, you have zinc all over your nose.
1986;TALIESIN;There's just zinc.
1987;MARISHA;And a hula shirt.
1988;SAM;Oh yes, do you want a--
1989;TALIESIN;Yes, we're really pale people, this is probably a good idea.
1990;TALIESIN;No.
1991;MARISHA;I tap it, because I've seen other people do that, and I feel like that's what you do with compasses.
1992;TRAVIS;And it shatters.
1993;MATT;(shattering sound)
1994;MARISHA;Ahh!
1995;MATT;Yeah, it seems to be a functional compass.
1996;MARISHA;Do you want to be the compass man?
1997;MARISHA;Are you gonna man the compass?
1998;MARISHA;Be navigation?
1999;SAM;The leader?
2000;SAM;Absolutely.
2001;TALIESIN;The navigator, yes.
2002;SAM;The navigator.
2003;SAM;Sure.
2004;MARISHA;The navigator.
2005;SAM;Sure.
2006;MATT;All right.
2007;TRAVIS;Any other tests you brainy types want to do on these giant, green balls?
2008;TALIESIN;I feel comfortable.
2009;TALIESIN;We have Locate Object, we have a compass.
2010;LAURA;Yes.
2011;LAURA;Locate Object is concentration, and so is Pass Without a Trace.
2012;MARISHA;So when we get through the void, and maybe we can do a Locate Object and then Pass Without a Trace, and then I'll cast Animal Shapes, and then we go.
2013;MATT;Locate Object, by the way--
2014;LIAM;That is a lot of steps.
2015;LAURA;It's within 1000 feet.
2016;MATT;Yes.
2017;LAURA;Yes.
2018;MARISHA;But it lasts for ten minutes.
2019;MATT;It does, yes.
2020;LAURA;Yes.
2021;MATT;Okay.
2022;MATT;So.
2023;MATT;You guys ready?
2024;MARISHA;Yeah.
2025;SAM;Yes.
2026;LIAM;Eh.
2027;MATT;All right--
2028;TRAVIS;Are we ready?
2029;LAURA;Are we ready?
2030;MATT;Durent looks at your faces as you're all staring and goes, Okay.
2031;MATT;So.
2032;MATT;About time?
2033;LAURA;Have you seen a kraken?
2034;MATT;Oh yeah, I've seen it.
2035;LAURA;And?
2036;MATT;Oh, it's fucking terrible.
2037;LAURA;How big, are we talking?
2038;TRAVIS;Immense?
2039;MATT;You know this, this size?
2040;MATT;It's a lot bigger.
2041;LIAM;How many Grogs?
2042;LAURA;Big enough to swallow him?
2043;MATT;Oh, yeah.
2044;LIAM;Like ten Grogs long?
2045;MATT;Hundred.
2046;LIAM;Hundred Grogs long?
2047;LIAM;!
2048;MATT;It's hard, it's spatial awareness.
2049;MATT;Look, I'm not a science man like these two, but it's big.
2050;TALIESIN;I'm a science man!
2051;TRAVIS;Your beard is glorious.
2052;MATT;Thank you.
2053;MATT;Yours isn't too bad yourself, boy!
2054;MATT;He tousles it up.
2055;TRAVIS;Yeah, hold on.
2056;TRAVIS;Are there any barnacles down here I can put in that?
2057;TRAVIS;Is it fast in the water?
2058;MATT;I'd say it's pretty fast, aye.
2059;LIAM;And you've seen it leave these stones, these lodes?
2060;MATT;I've seen him through the door.
2061;MATT;Oh, I don't go in there!
2062;TRAVIS;Oh, yeah?
2063;MATT;No, I just watch the doorway.
2064;MATT;That's my job
2065;SAM;You don't watch him drop his lodes.
2066;MATT;I have not yet seen the kraken drop its lodes, no.
2067;LAURA;All right.
2068;LIAM;I have never felt more prepared than I do right now.
2069;LIAM;Let's do this shit.
2070;LAURA;Let's.
