;Player_Name;Transcription_Text
1774;LAURA;Oh! Plus two! 26, because I'm attacking with Aluneth.
1775;MATT;"Four of the ten kobolds in the room are destroyed as the explosion hits. You hear a bunch of screams in the corner as a number of them are annihilated. As you can see, the throne itself is melting in the wake of it. King Togwaggle. A three does not make it. So that's 26 fire damage to him.|And the violinist is ashes. As the flames subside, you watch as there's a kobold shaped skeleton clutching a now burning violin that tumbles into a pile on the ground. At which point, the other kobolds jump out, damaged and burning looking to King Togwaggle as he's sitting there, the edges of his chin beard burning and curled up. He has this giant shovel that he has resting at his side. And he glances up at his crown and goes ""Rakanishu, it looks like company we has. And You! No! Take! Candle!"" Slams the shovel onto the ground and stands up. Everyone roll initiative."
1776;TRAVIS;Oh my god. What the hell? What's Rakanishu?
1777;MATT;All righty. Wow, okay. So, 25 to 20, anybody?
1778;LAURA;22.
1779;TALIESIN;21!
1780;MATT;Oh wow, look at that!
1781;TALIESIN;It finally happened.
1782;TRAVIS;"""Finally happened."""
1783;MATT;All righty. Then 20 to 15?
1784;TRAVIS;18.
1785;MATT;15 to ten?
1786;JENNIFER;13.
1787;LIAM;Big ten, my man.
1788;MATT;All right. Greldamine, you're up first. You finished shooting the fireball, they're all now pulling out pickaxes and going (yelling) and they're all turning. They can see you and they can see you and the rest of you, currently now stuck in this hole in the wall right now. You're all locked in this pincered position.
1789;LIAM;Let's go, wee one.
1790;LAURA;Okay, ooh. How close are they all to each other?
1791;MATT;They're all about 15 feet from each other.
1792;LAURA;Fireball!
1793;MATT;All right! Roll the damage. Togwaggle does make his save this time.
1794;LAURA;34.
1795;MATT;34, all right. So that's 17 points of fire damage to Togwaggle. And the rest of the kobolds (explosion) (screaming). Annihilated.
1796;TRAVIS;The one syllable protest!
1797;MATT;Their pickaxes tumble off and some are stuck into the stonework. Surrounding, beginning to melt wax elements have now melted even further and are now beginning to coat the ground with soft molten wax. The entire chamber is now becoming a sticky wax base.
1798;LAURA;Oh. I may have melted all of our loot that we were supposed to take back.
1799;LIAM;It'll form back together though.
1800;LAURA;Yeah, he's getting his wax back, that's the important part! I am going to back away from the little crack in the wall and hide against the wall.
1801;MATT;So you're now moving out of the crack of the wall and moving into the chamber?
1802;LAURA;No.
1803;MATT;There's a giant, hexagonal, circular chamber, and the small crack in the wall where you guys were hiding.
1804;LAURA;All of us in this teeny crack?
1805;MATT;Yes. Except for you, you're actually outside of it and by one of the mounds that is slowly melting in front of you.
1806;LAURA;Okay, I guess I will step outside of the crack and try to hide behind a mound of something.
1807;MATT;Okay, so you dart off to one of the mounds.|You don't have any action to do a hide check, unfortunately. Using it for cover, hopefully. That ends your turn. Bundle, you're up.
1808;LIAM;Everybody say crack as much as you can.
1809;ALL;Crack!
1810;TALIESIN;Just for fun, let's do-- where is it? I keep losing everything I'm doing. I'm going to do a very standard Guiding Bolt. And a Sacred Flame attack. I'm going to go for a two-fer on the big kahuna.
1811;MATT;Those are technically both actions.
1812;TALIESIN;Oh they're both actions? I thought it was a bonus, never mind. This is so hard to do, it's been so long since I've done this.
1813;MATT;It's okay. Guiding Bolt?
1814;LAURA;(singing) Guiding Bolt up the butt!
1815;TALIESIN;I'll do a standard Guiding Bolt at this guy, and see what happens.
1816;MATT;Okay. Make a ranged spell attack against King Togwaggle.
1817;TALIESIN;Here we go, Guiding Bolt. That's a 19.
1818;MATT;Plus?
1819;TALIESIN;Guiding Bolt is a 25.
1820;MATT;That'll hit, go ahead and roll damage.
1821;TALIESIN;That's 4d6 radiant. Ooh! 16 points of radiant damage.
1822;MATT;Okay, and the next hit against him has advantage.
1823;TALIESIN;Yeah, the next hit against him has advantage, and yeah, I'm going to give myself a quick Healing Word as a bonus action because I'm really low.
1824;MATT;Okay. As a reaction, King Togwaggle's going to go ahead and use Vengeance of Rakanishu. After the Guiding Bolt slams into King Togwaggle, he lifts up his giant shovel in his hand and you watch as the interior of the lantern crown that he has begins to brighten and suddenly your chest bursts into flame. You suffer 14 points of fire damage and you are considered on fire. Until you spend an action to put it out, you're going to take 1d6 fire damage every turn.
1825;TALIESIN;All right. I am at 29 points of health, that's okay.
1826;MATT;All righty, so that ends your turn?
1827;TALIESIN;Yeah.
1828;MATT;All right, suddenly you watch across the chamber which you hadn't noticed before, there is a door that slams open and from the inside, from what little of bit you can see it looks like some sort of a latrine or like an open piss pot room.|Four kobolds start rushing out into the center of the chamber, their feet getting stuck in the wax, so they'll only be able to move at half their speed so they can't get up to anybody. They take their pickaxes and throw them! So they're going to throw three at you and three at you. Technically you guys would both have a little bit of cover because you're behind those, so I'd give a plus two to your AC for each of you. So the first three against you. That is going to be a 16, what's your armor class?
1829;LAURA;I did Mage Armor, so I've got 16.
1830;MATT;Correct, so with the plus two, it does not hit. The first one is deflected off the armor. Oh, that's going to be a natural 19, so that hits you.|You suffer nine points of piercing damage as one pickaxe hits you in the chest, clavicle area, you're like (grunt). The third one's going to throw and that is a 19.
1831;LAURA;That hits.
1832;MATT;So you take seven points piercing damage from a second pickaxe that jams you in like the hip area, it falls out, but the wound's open. The three against you. That's going to be a 15 plus four, that's 19?
1833;JENNIFER;I'm 17, I don't have any pluses, right?
1834;LAURA;Plus two!
1835;JENNIFER;Okay, so 19.
1836;MATT;Plus two, so 19, so it hits you exactly. So you take six points of piercing damage as one pickaxe grazes you across the neck and shoulder.|It hurts, you can feel the welt picking up. Second one is going to go ahead and strike you, that is going to be an 11. So, no. That one you dodge out of the way, and a third and final one is going to come for you. That is a natural 20! As you dodge out of the way and come around, there is one that takes both hands (grunt) (whooshing) and as you spin around to hear the scream it hits you right in the forehead. That's a six, that's 12, plus three. You take 15 points of piercing damage as your head is ringing from the impact of the pickaxe. Your vision blurs and doubles for a second as you right yourself and clutch onto the soft wax. You fall into a little bit, and pull yourself out. That's going to end the kobolds' turn, now it's King Togwaggle's turn. King Togwaggle is going to rush forward, currently it's only the three of you visible because nobody's come out of the chamber yet. So he's going to rush forward and get between the two of you and make a shovel strike on each of you. So the first one against you, that's a 27.
1837;LAURA;Oh god!
1838;MATT;I rolled a natural 19. You take--
1839;LAURA;He's at disadvantage though, because I'm a gnome. I'm very small.
1840;MATT;No. That is 15 points of damage, as the shovel hits you upside your head, and then attacking you. That is a 16 plus eight, that's 24.|That hits you. That's an eight plus six, that's 14 points of bludgeoning damage.
1841;TALIESIN;(groans)
1842;MATT;Ending their turn, it now comes to you.
1843;TRAVIS;Can I push out of the crevice and run at King Togwaggle?
1844;MATT;You push out and he's right there. You guys are all clustered right on the outside so he's easily within range.
1845;TRAVIS;I can get right on him?
1846;MATT;Yeah.
1847;TRAVIS;"Can I use my Hammer of Justice, ""Target a creature within 15 feet of you to make a constitution saving throw against your spell save DC or become stunned until the next round"" on my next turn?"
1848;MATT;Yes you can. All right, so. That is an 11.|What's your--
1849;TRAVIS;13! Yes!
1850;MATT;So as you step out of the crevice, you summon the radiant energy granted to you from the divine, and you watch as this giant radiant hammer, summoned from the sky, slams down and strikes the top of King Togwaggle's head. The crown goes off to the side for a second and he's like (grunting). He can't make words, his bell is rung. So he's stunned until the end of your next turn.
1851;TRAVIS;Yeah!
1852;MATT;All right, that's your action. You're there and you're up engaged with him. That finishes your turn. All right, you're up, Aerwin.
1853;LAURA;With stunned, if you hit him does it break the stun? Or he's--
1854;MATT;No, he's stunned, and attacks against him have advantage and melee attacks against him I'll double check, I'm pretty sure auto-crit.
1855;TRAVIS;Do I get a bonus action with that crazy move or is that it?
1856;MATT;You do, if you want to use a bonus action.
1857;TRAVIS;Yeah, I want to pour some Searing Smite into it as well.
1858;MATT;I'll let you do that, sure. Well, it's not a melee weapon attack, I think, unfortunately.
1859;TRAVIS;Oh that's right, never mind. That's what it is, your call.
1860;MATT;Stunned, incapacitated. Yep, so as an incapacitated creature, yeah.
1861;TRAVIS;Yeah.
1862;LAURA;So you guys, melee attacks are auto-crits on him right now.
1863;LIAM;Okay, and your buddy is there so--
1864;LAURA;Dagger, dagger, dagger!
1865;LIAM;Not hidden, can't do that, but you're still going to get sneak attack.
1866;JENNIFER;Dagger, I want to do the dagger.
1867;LIAM;Yeah, you're going for an attack. Is she at advantage because he's stunned and weird?
1868;MATT;Yes.
1869;LAURA;It's an auto-crit!
1870;LIAM;So roll twice. Oh auto-crit, so you don't even have to roll.
1871;LAURA;Yeah you do, you have to roll to see if it hits.
1872;LIAM;Well, yeah you hit, 16 plus eight, so 24.
1873;MATT;24 definitely hits. I'm checking to make sure I do this right.
1874;LIAM;So you roll--
1875;JENNIFER;1d4?
1876;LIAM;1d4, which is the triangle, the pyramid.|Roll that. Okay, now you roll your-- four, good.|Roll these guys. Okay, roll those.
1877;JENNIFER;Okay, all right.
1878;LIAM;Holy shit, that's a good sneak attack.
1879;JENNIFER;22.
1880;LIAM;22, wait, you double it, because it's an auto-crit, so 22, 44 plus the three, is 47.
1881;LAURA;Plus the poison damage?
1882;MATT;Plus a d8, which is doubled because it's an auto-crit, so roll a d8.
1883;LIAM;Oh, you have smoked this guy.
1884;LAURA;Yeah, that one, that one.
1885;JENNIFER;Five.
1886;LIAM;Ten.|57.
1887;TRAVIS;Jesus, 57 points?
1888;MATT;"So using the dagger you mustered from beneath the dragon, you jam it right up into the abdomen of King Togwaggle and while stunned he goes (choking) and you watch as some of his brackish blood (splattering) out of his mouth. He looks hurt, but is very angry. While still stunned in place, his eyes have locked in on you. You can see the bloodshot look behind the whites. He goes, ""No. Take. Candle."" Is that your turn?"
1889;JENNIFER;Is that the end of my turn? That's the end of my turn.
1890;LIAM;Yes, you can disengage as bonus action and get away from him so he can't hurt you.
1891;JENNIFER;I'll do that.
1892;LIAM;Dance back.
1893;JENNIFER;I'll dance back.
1894;MATT;He's stunned, he can't even attack her. So you move away from him. All right, so you pull away, pulling the blade out from the wound which now is like (dripping sound). Ending your turn, you're up.
1895;LIAM;How far away are other little guys from this one?
1896;MATT;They're about ten feet behind him, in the center.
1897;LIAM;Ten feet behind him? Then I will use my whirlwind warrior class ability, and I will start with the big man and move to his little buddies.
1898;MATT;Okay.
1899;LIAM;Okay? So here we go.
1900;MATT;So as an action you can make an attack against each creature that you come adjacent to.
1901;LIAM;So I'll start with him, yeah? So I get two attacks because of who I am, that is 16? Not great.
1902;MATT;You don't get two attacks of part of this, you get one attack against each thing you go across.
1903;LIAM;Okay.
1904;MATT;So you get one attack on him.
1905;LIAM;So am I at advantage because he's fucked up?
1906;MATT;Yes.
1907;LIAM;Okay good. That's better, that's 24 to hit, that hits.
1908;MATT;That hits, go ahead and roll damage.
1909;LIAM;Okay, here we go again.
1910;MATT;And I'll say with your movement, moving through you can hit four of the six kobolds.
1911;LIAM;Okay great. 14 on this guy. Keep going?
1912;MATT;So you're shifting on and you watch as Quazirat suddenly grabs his blade and begins spinning in a circle. You guys have to duck out of the way as he carves into King Togwaggle, carves through a bunch of the wax and begins burning into the center of the chamber and cleaves through, hopefully, four of these kobolds.
1913;LIAM;Ever hear of Baryshnikov? Amateur. Do I roll for attack on each one?
1914;MATT;Yes, you do.
1915;LIAM;Okay, here we go. First one, we get 18.
1916;MATT;Hits.
1917;LIAM;Second one, we get natural 20. Third one we get one.
1918;MATT;Nope.
1919;LIAM;Fourth one we get 28.
1920;MATT;Three of them hit, one of them is a critical.
1921;LIAM;Okay, so first one we get 18.
1922;MATT;18 damage?
1923;LIAM;Yeah.
1924;MATT;The first one you cleave the head off.|(squeal)
1925;LIAM;Okay, so second one critical so eight, 16, 18, 24.
1926;MATT;That one, the blade bisects him from hip to chest and he stumbles forward to the ground in two pieces.
1927;LIAM;Oh buddy. And the last one, 14.
1928;MATT;"14. That one the blade stops in his body and he's like (choking) ""Why?"""
1929;LIAM;Life comes at you fast.
1930;MATT;(growling) All right. That ends your turn.
1931;LIAM;Sure does.
1932;MATT;All right. Greldamine, your turn.
1933;LAURA;Okay. I'm going to try and take his crown off his head since he's stunned.
1934;MATT;Okay, what are you going to do, are you going to grab and pull it off?
1935;LAURA;Yeah!
1936;MATT;Okay.
1937;LAURA;Oh wait, no! Can I use Mage Hand to do it? Is that what Mage Hand does?
1938;MATT;If you want to do that roll an athletics check. Sorry, not an athletics, an arcana check to see if you can manage to pull it off.
1939;LAURA;15?
1940;MATT;15. You watch as the crown comes off and is now floating there as you're holding it with the Mage Hand.
1941;LAURA;I got his crown! I'm going to run across the room with the Mage Hand following behind me and start trying to bury it in wax on the other side of the room.
1942;MATT;Okay. So you're holding it in the air and trying to dig a hole in the soft wax?
1943;LAURA;Yeah.
1944;MATT;That will end your turn, Bundle, you're up.
1945;TALIESIN;It's going to take an action to put myself out, I assume.
1946;MATT;If you want to put yourself out.
1947;TALIESIN;I would like to put myself out.
1948;MATT;At top of the round, you do take three points of fire damage.
1949;LIAM;Stop, drop and roll.
1950;TALIESIN;Okay.
1951;MATT;You spend the round (yelping), putting the fire out on you.
1952;TALIESIN;Do I get a bonus action?
1953;MATT;You do.
1954;TALIESIN;So for a bonus action I'm going to cast Spiritual Weapon at 4th-level, because I think that gives me an extra d8 for spiritual weapon.
1955;MATT;It does, yes.
1956;TALIESIN;All right, so I'm going to cast Spiritual Weapon.
1957;MATT;And what are you summoning?
1958;TALIESIN;I basically want to summon what is basically a big chomping mouse trap.
1959;MATT;(laughing) All right.
1960;TALIESIN;I'm going to take a whack at the king's head with a giant--
1961;MATT;A divine mouse trap. It's beautifully carved, from ivory it looks like. The silver snapping mechanism, it looks like it was of elven make. It has filigree on it. As it appears you hear this chorus go (angelic singing) as it prepares itself.
1962;TALIESIN;I'm going to smack it right into him.|Does it auto-crit, if it hits?
1963;MATT;It's advantage on the attack and I think it'll be an auto-crit.
1964;TALIESIN;Oh, it's also advantage on the attack. I rolled a 17 plus--
1965;LAURA;Well you could get a 20.
1966;TALIESIN;Yeah, 23, but it's an auto-crit anyway.
1967;LAURA;Isn't it? It's an auto-crit?
1968;TALIESIN;He's still stunned. So that's 26 points of damage. (snapping)
1969;MATT;You watch as it snaps down and more blood spills out. And you hear the snapping of a bone and one eye closes in pain. He's still standing there and is furiously awaiting his return.
1970;TALIESIN;I'm going to back up a bit, with my movement. And get a little bit of cover.
1971;MATT;"The four kobolds see you running by with the crown gliding. They go ""No! Rakanishu! Save it!"" and they all throw all their pickaxes at you. That is 12? Misses you. First one hits soft wax. Second one is a 24."
1972;LAURA;Oh no!
1973;MATT;So you take five points of piercing damage.|Make a concentration check.
1974;LAURA;Oh, what a concentration check for the Mage Hand? Okay!
1975;MATT;I'm pretty sure Mage Hand is concentration.|We'll find out real fast here. No, it's not concentration, it lasts for a minute.
1976;LAURA;Okay good!
1977;MATT;Just lasts for a minute. So that one you took the damage. Third one, that's going to be a 17 plus four, that's a 21.
1978;LAURA;Oh no.
1979;MATT;So you take another four plus three damage.|That's seven points of piercing damage.
1980;LAURA;I turn and look at it right as it hits me in the face and knocks me out cold.
1981;TRAVIS;Oh it does?
1982;LAURA;(screams)
1983;MATT;You fall to the ground and the axe (pinging). There's a little trickle of blood down your forehead as you hit the soft wax, which does soften your blow.
1984;LAURA;Oh, it cracks my glasses.
1985;MATT;It does, one side is now shattered in a spiderweb, as the crown clatters to the ground. As it does the glass of the lantern breaks. All right, that's the end of the kobolds' turn. Your turn.
1986;TRAVIS;My turn?
1987;MATT;Yes.
1988;TRAVIS;Hold real still for me (whoosh). Two big attacks with the warhammer. I'm going to dump Searing Smite into the second one.
1989;LAURA;Advantage.
1990;TRAVIS;Oh advantage, that's right. I mean they're crits, aren't they?
1991;LAURA;Yeah.
1992;TRAVIS;So 18 to hit. 12 points of damage on the first one.
1993;MATT;All right.
1994;LAURA;No, it's a crit. Double it.
1995;TRAVIS;Oh yeah. 24.
1996;MATT;Whatever the dice was you double.
1997;TRAVIS;Yeah, oh I'm sorry, right. So 14 plus five. 19.
1998;MATT;19, all right.
1999;TRAVIS;21. 21 again, and I'm dumping Searing Smite into it. He does a constitution--
2000;LAURA;19.
2001;TRAVIS;Yeah, sorry, what'd I say?
2002;LAURA;19 again, you said 21.
2003;TRAVIS;Oh damn it. (laughing) Sorry.
2004;MATT;How do you want to do this? (cheering)
2005;TRAVIS;Stunned, I walk up with the warhammer, spin it in my hand, and do one, two, with the second one arcing up with all that radiant damage.|Coming under his chin, trying to change the way his pretty face looks.
2006;MATT;And as you do, frozen in place you see the neck muscles tensing against the magic, trying desperately to fight his way back and as the hammer swings up, the first hit clanks across the jaw, which you see (crunch) break and go slack.|The second strike, as you hit the jaw slams upward. You see teeth shatter from the sheer force of the impact. As the jaw slowly falls slack, both eyes are cross eyed, the forehead is pushed inward, and he gurgles before falling onto his back, onto the ground. Unconscious. And bleeding horribly. All right, that end your turn?
2007;TRAVIS;Yeah.
2008;MATT;"All right, at the end of your turn you glance over and you notice the mage is down and you watch the shattered lantern-- suddenly flames are beginning to emerge and swirl. You see all the nearby candle wicks that have been slowly burning away from the heat of the room, the flames are almost being drawn from the candles towards this lantern and this flame that is growing in the center. And you see all the kobolds are now going, ""Rakanishu, Rakanishu, Rakanishu."" That ends your turn. Aerwin, you're up."
2009;JENNIFER;We need to get to safety for a minute, and get everybody healed I think.
2010;MATT;You have two outs here, there latrine room, and there is the crack where you were in.
2011;JENNIFER;Latrine room.
2012;MATT;You go darting for the latrine room?
2013;JENNIFER;Yep.
2014;MATT;Okay, so you double dash around, leaping over the body of King Togwaggle, leaping off of the soft wax mound, out of the range of the kobolds that can get a swipe at you. Dart into the open latrine room, and as you dart inside, you see a makeshift royal restroom, complete with a terrible smell you'd expect from a kobold latrine.|There is a rickety wooden commode series, three of these nasty looking, supposed to look nice but aren't really nice at all kobold toilets. Even dangerous to sit in, they look like they have shards of wood and nails, jagged up. There is a rushing underground river that vanishes through a far wall. It looks like it's set up with the bars to be almost like a bathing apparatus.
2015;JENNIFER;(sighs) Man. Rushing river, bathing apparatus. Can I duck in there to hide?
2016;MATT;You could certainly try.
2017;JENNIFER;I'm going to duck in there and hide for a minute to get out of danger.
2018;MATT;Okay, so you get into the water and you get down into the rushing water. It's a pretty strong current.
2019;JENNIFER;All right.
2020;MATT;So you can hold onto one of the rails there, that can hold you in place. Okay, so you're there, keeping low in the water.
2021;JENNIFER;Do I have any more rope left? No I used it. I could tie myself up to rest for a minute? No, I'll just sit.
2022;LIAM;You've got six seconds, that's what your turn is.
2023;MATT;All right, that brings us then to Quazirat.
2024;LIAM;Right I see the little one go down, so I start hoofing it in that direction and I plant my hand right down on her little forehead and I use Gift of the Naaru. And you get seven hit points of life.
2025;LAURA;Yay, I'm alive!
2026;LIAM;But then I keep running past her as far as I can go.
2027;MATT;Okay. So you do that, you rush past, go to heal her. Two of the kobolds that you struck last turn that are in melee range with you swing out with their reactions to take an attack of opportunity.
2028;LIAM;That's fine.
2029;MATT;20?
2030;LIAM;Sure, that hits.
2031;MATT;You take five points of piercing damage.|Other one. Oh that's a natural one. He swings wide. You rush forward, between the two other kobolds, intending to get to her, heal her, and then continue to run. Which direction?
2032;LIAM;Towards the latrine.
2033;MATT;Okay, you go darting towards the latrine.
2034;LIAM;Which is technically fleeing, so do I need to make saving throw with sword?
2035;MATT;You would.
2036;LIAM;Okay good. No. That's not good. That's a four. YOLO.
2037;MATT;Adventurefury: Blessed Blade of the Thrill Seeker calls to you. And this day, glory must be found! YOLO, motherfucker.
2038;LIAM;Bozhe moi!
2039;MATT;All righty.
2040;LIAM;But am I out of movement and I'm stuck where I am?
2041;MATT;You've healed her and then you spin around, blade ready, and you're going to fight these kobolds and whatever that fire thing is that's growing.
2042;LIAM;Yes, I am.
2043;TRAVIS;Electric guitar in the background. (guitar solo)
2044;LIAM;I take the sword. (guitar solo)
2045;MATT;All right, Greldamine. You come to consciousness and watch as your friend spins around with his giant blade and start laughing in this face of this-- now you notice, swelling elemental entity that is drawing fire from all of the candles in the room and is growing by the moment.
2046;LAURA;Okay. I'm going to use Frost Nova and try to target the fire element and the other little things that are in the room.
2047;MATT;Okay, all right. So that's a 20-foot radius.|You can hit all the kobolds. All right, so roll 3d6 cold damage.
2048;LAURA;Ooh. 15.
2049;MATT;15.
2050;TRAVIS;Constitution saving throw.
2051;MATT;Sorry about that, microphone. And they have to make a constitution?
2052;LAURA;Constitution.
2053;MATT;For the kobolds, what is the DC on that one? Your spell DC?
2054;LAURA;My spell DC is 16. Oh, did it go up? No.
2055;MATT;"No, 16, so that's a failure on the first one. One kobold freezes to death, locked in place as they're frozen solid. That one does succeed.|Next one fails with a one and this Rakanishu fails with a six plus-- yeah because it's constitution he doesn't have-- it's a plus four, so that's ten.|So you watch, first off, Rakanishu takes double damage for that. Takes 30 points of cold damage being vulnerable to the cold. You watch as the fire entity (freezing sounds). The flames slightly flicker and pull in there, and the ice that's encased around it seems to create this orb or sphere that's holding it in place. The source of the fire that's drawing towards it seems to be temporarily cut off and all but one kobold are all locked by ice. One seems to break forth (growling and snorting) ""My candles now!"" All right, does that end your turn or do you-- you can still move."
2056;LAURA;I'm going to move, I'm going to run towards the latrine.
2057;MATT;Okay. Half your movement to get up from prone because you were unconscious. So you can get about ten to 12 feet. You rush over, you're about maybe ten feet away from it. But you're making your way as best you can!
2058;LAURA;Are there any candles around?
2059;MATT;There are dozens of candles.
2060;LAURA;Still?
