;Player_Name;Transcription_Text
0;MATT;Hello, ladies and gentlemen, and welcome to this evening's episode of Critical Role, where a bunch of us nerdy voice actors sit around a table and play Dungeons & Dragons. If you are returning, welcome back. For those who it's their first time watching us live on the stream, welcome to the chaos. So, before I begin, a couple of quick notifications I want to give you guys. We had our first subscriber giveaway hit before the show started at 4,200. It was LL1973. Turn the mic around. Oh, now you can hear me. Look at this! The magic of live. Live communication. You have a wonderful view of this fantastic midsection. It's delightful. There we go. Is that better?
1;ZAC;Yep.
2;MATT;Velcome. So, welcome to Critical Role, for those who didn't hear me before. D&D, voice actors, you know the drill now. So our first giveaway already happened tonight for the subscriber count at 4,200 to LL1973.|Congratulations. You're going to be winning a signed Player's Handbook of Dungeons & Dragons Fifth Edition, as well as a signed photo of the Critical Role cast. Our next one will be at 4,250, so, up to every fifty subscribers after that we will be giving away an additional Player's Handbook and photo signed by the cast.|Awesome times.|(cheering)
3;MARISHA;Awesome times?
4;MATT;Indeed, very awesome times.
5;MARISHA;Good times, good time together.
6;MATT;I think so, indeed. Also, as a heads-up to you guys, there will be no Critical Role next week because the San Diego Comic-Con is happening. Down in San Diego.
7;MARISHA;We're doing a panel, aren't we?
8;MATT;I know, we have a panel, though. We have a panel Thursday, I'll be on the main Geek and Sundry panel with Laura at 1-2 and then we have our actual full Critical Role panel from 4-5. So if you are going to be there, come see us at PetCo Park on Thursday.
9;LAURA;You don't need a badge.
10;MATT;Nope, you can just come and walk on in.
11;MARISHA;Yeah, it is at PetCo Park, so don't get lost looking around the convention center. Because it won't be there. It's at PetCo Park.
12;MATT;It's the big sports stadium, which to me is a wonderful irony of us giving a panel about Dungeons & Dragons in the center of a giant sports stadium. That's right! Indoor kids. However, however, they are also filming the panel for those who can't be there. The panel will be on the stream the following day, I believe, so check it out there, after, with the rest of the Comic-Con stream coverage. It'll be fun. Yeah, so that'll be good. The week after that, me and Marisha are going to be out of town in New Zealand, so this means a two-week period without Critical Role main-story stuff, and I apologize, this is all stuff that got planned before the stream even started. We'll be at a convention in New Zealand.|For those out there planning to come to Armageddon, please come see us, we'll be down there. It'll be fun for all New Zealand fans.|Otherwise, the rest of the Critical Role cast that are available will be here and will play some other sort of game together and generally interact with the chat and have a good time until we return. So.
13;MARISHA;We're working it out.
14;MATT;Yeah, we're getting the circumstance ironed out.
15;MARISHA, ORION;Hi, Liam!
16;MATT;We have Liam on Skype over here.
17;LIAM;Hi, guys.
18;MATT;What's up, buddy?
19;LIAM;Hi!
20;MATT;Liam, who's finishing up his vacation as well. As far as I understand, we have a--
21;MARISHA;How's New Jersey?
22;LIAM;I am deep in upstate New York on the Canadian border.
23;MATT;Slowly migrating into expatriotism. Don't go Canadian on us.
24;LIAM;It's frightening to drive here at night. I can't wait to do it at two in the morning.
25;LAURA;Yay.
26;MATT;Yes.
27;ASHLEY;I'm drinking out of your mug.
28;MATT;She is.
29;LIAM;My mug? Here's mine.
30;MATT;On river time, there you go.
31;MARISHA;On river time, what?
32;MATT;That is-- that's a mug.
33;MARISHA;Did you instantly turn into a 64-year-old golfer as soon as you went there?
34;LIAM;I'm on a river. I'm on a river.
35;LAURA;I'm on a boat. I'm on a boat.
36;MATT;So that's going on. Other things we want to mention. We'll have a special presentation at the break today. We're taking a break from the 826LA charity for another special charity that has been running for the past week known as GameChanger: it's a cancer charity and it's been working in conjunction with SquareEnix this past week. To raise money for cancer research, they've been doing-- if you donate $1 to it they're giving away codes for the first Deus Ex game for PC and a lot of other fun stuff. We'll have more information and a presentation for you at the break. So be aware that's the fun charity we're promoting tonight, so if anyone has the ability to give, please do, they're an awesome charity. We're also waiting on Sam Riegel and Taliesin Jaffe, they're both fighting traffic but will be here shortly.|However, let's go ahead and cut to the intro to give us a one-minute break, and then we'll jump right into this crazy, crazy episode. So see you in just a moment.|[no audio] Well, while we get that figured out--
37;ORION;Oh, is this a podcast now?
38;MATT;Apparently.
39;ORION;(old-timey voice) Old time radio.
40;MARISHA;Well, I think the intro--
41;MATT;Intro video's frozen.
42;ORION;Damn it.
43;MATT;Also, this is, as opposed to making it a surprise, this'll be our last game for a little while with--
44;LAURA;No, don't say it, don't say it yet.
45;MATT;Don't say it-- okay.
46;TRAVIS;If you say it, it makes it true.
47;MARISHA;Makes it too real.
48;MATT;Okay, you're right.
49;ORION;Ooh.
50;MATT;I'll hold off, all right.
51;LIAM;Unfortunately, Travis has to leave the show.
52;MATT;No, that's not true. Grog's ale still needs to be filled.
53;TRAVIS;Smash.
54;MATT;Indeed. So we'll patiently wait, folks, pizza at the ready. Now.
55;MARISHA;What's going on?
56;LIAM;Is there a full table behind this computer?
57;LAURA;Pretty much.
58;MATT;There is, yes.
59;LAURA;Travis is directly behind you.
60;LIAM;Am I in his chest again?
61;LAURA;Yeah, you might be even in his face at this point.
62;ORION;It's pretty good, though, I like this better than the iPad.
63;MARISHA;And we can see you more.
64;LAURA;Can you still see Travis?
65;MARISHA, ORION;Yeah.
66;LAURA;Oh.
67;MATT;It'll be fine.
68;ORION;How can we not see him?
69;MARISHA;Yeah. (laughs)
70;LAURA;That's true.
71;ORION;He's a mountain of man.
72;TRAVIS;I am Rushmore.
73;MARISHA;Travis takes up this side of the frame.
74;ORION;I'm Rushmore.
75;MATT;If we're having an issue with the intro video, do you want to just go to the game?
76;TRAVIS;We can do a live intro video.
77;ALL;(intro video music)
78;MATT;Grog! Goliath Barbarian.
79;MARISHA;(crow sound) (laughter)
80;MATT;-- and we're done.
81;TRAVIS;I'd been thinking that this had to happen at some point.
82;MATT;Yeah.
83;LAURA;Boomf! I was being you, Tiberius.
84;MARISHA;Yeah.
85;TRAVIS;We could totally do a Brady Bunch.
86;MARISHA;Ah ha!
87;LAURA;Light!
88;MATT;That was pretty good.
89;TRAVIS;You guys are on the bottom of the feed, right?
90;ORION;Right.
91;TRAVIS;So if you looked up and we looked down, we'd essentially be looking at each other.
92;MARISHA;Oh right, Brady Bunch style!
93;LAURA;(gasps) Oh, no way.
94;TRAVIS;Oh, hi guys.
95;MARISHA;Hi, Travis.
96;ORION;Is that how it looks?
97;TRAVIS;And then everyone looks to the right to look at Mercer.
98;LAURA;No, yeah, everyone looks to the same--
99;TRAVIS;Oh, we look right, you look left.
100;TRAVIS, MATT;No.
101;MATT;They look right. Everyone looks right.
102;MARISHA;"Everyone looks right? So if we're looking this way, """"Hi, Matt!"""""
103;MATT;And I disapprovingly look to my left. There you go.
104;ASHLEY;Are we still on?
105;MARISHA;Yeah.
106;ASHLEY;Still going?
107;MATT;Real-time Critical Role.
108;MARISHA;We're still kind of confused.
109;LAURA;I can't tell what happening.
110;MATT;So I figure if the intro video's not working, let's not worry about it. Let's just jump into the game and get this started. How about that?
111;TRAVIS;Yeah, why not.
112;MATT;Cool with that?
113;ASHLEY;Wait, can we show someone that's here that's really cool?
114;MATT;What's up?
115;MARISHA;Go ahead and bring him on?
116;MATT;Oh, well, we're waiting on the break, unless you want to do it now.
117;ASHLEY;Do it on the break.
118;ORION;So we have video problems?
119;MARISHA;You can come say hi.
120;ORION;I'm Periscope-ing until we're not having video issues.
121;MATT;Well, as far as I know we're on camera.
122;ORION;Oh, we are?
123;CREW;Yeah.
124;MATT;Yeah, just the intro video's not working.
125;ORION;Okay.
126;MARISHA;Oh, we probably could have been going for a while. We've just been like dicking around.
127;ORION;Bye, guys, we're live.
128;MATT;Ah, welcome to the chaos of live internet.|All right, so let's--
129;LIAM;I don't think we should go any more meta than it has to be.
130;MATT;Let's jump in, guys. Let's jump in. So a little bit of overview for those of you who are just joining us. At this point in the story, Vox Machina, this intrepid band of adventurers, misfits, whatever you must call them, completed an adventure through the Underdark, a very dangerous, cavernous--
131;LAURA;Oh, Sam's here.
132;MATT;Oh, we're gonna let Sam in.
133;MARISHA;Sam's here!
134;ORION;Yeah, he texted.
135;MATT;All right, so after completing this Underdark challenge, they discovered and managed to extract an evil artifact known as the Horn of Orcus that held great power and seemingly has a partner somewhere in the world that is unknown.|But the one they have acquired is indestructible, as far as folks know, and it was decided by the Council of Tal'Dorei and Vox Machina that it should be sealed away and hopefully forgotten for the rest of eternity. The best place to do so came up in the conversation to be the city of Vasselheim, which is on a different continent far to the northwest of Tal'Dorei, the kingdom where most of the story as to this point has taken place, to be sealed in what is referred to as the Platinum Sanctuary, the oldest existing temple to Bahamut, the good platinum dragon deity. So they were given passage on a skyship to cross the Ozmit Sea to Othanzia, the continent that houses the capital city, Vasselheim. So the group gathered together, rode on to the magically elevated skyship, and are traversing the ocean carrying the Horn of Orcus within this holy container. Hello!
136;MARISHA;Hi, Sam.
137;MATT;Sam has joined us.
138;SAM;Hi!
139;MATT;They found themselves over the ocean, suddenly attacked by a band of what seemed to be wyvern- and griffin-riding bandits. The battle took place on the top of the skyship, some of the magic being taken out, a few lives lost, but the party managed to persevere, take a captive, and continue on their journey, the Horn of Orcus and its container kept safe. And that's where we pick up and begin.
140;SAM;Can you say all of that again for me? (laughter)
141;TRAVIS;You don't listen, anyway.
142;MATT;No.
143;MARISHA;(laughs) You don't listen, anyway.
144;MATT;All righty, so as you guys have settled in, the Horn safe, you've taken a couple more days on this journey, what was told to be about a six-day journey across the ocean, six to seven days. Is there anything you guys wish to accomplish at this moment?
145;SAM;Are we in the air?
146;MATT;You are still in the air on the skyship.
147;SAM;Not much we can do.
148;MARISHA;Well, we just-- so we fought off the wyverns.
149;SAM;Oh, do we have one? We have one.
150;TRAVIS;Is the little magician halfling still being polite and brushing her teeth and stuff?
151;LAURA;Oh, that's right, our little halfling that we--
152;TRAVIS;Who you saved. Wuss.
153;MATT;Yes.
154;SAM;She's a mage, right?
155;MATT;That you saved. She is a mage, and she has also been bound, at the orders of the captain, so as not to cause any issues on the ship while she's there. So as to her future, after your conversation with him, as to whether or not she could work on this ship, based on the fact that their first meeting involved her and her band attacking and trying to murder his entire crew, Captain Damon was not too keen on the idea at the time being and decided to lock her up.
156;LAURA;Oh.
157;MATT;So. We shall see her fate in the near future.
158;TRAVIS;She's locked up.
159;LAURA;Okay. She's locked up.
160;TRAVIS;She's got tricks, though, right?
161;MATT;She has tricks, but there is an anti-magic brig built into the ship specifically for this purpose.
162;SAM;Ooh. Fancy.
163;TRAVIS;That's all I needed to know.
164;LAURA;Oh, that's good to know. I was going to pay you to put the kibosh on her.
165;ORION;She's negged.
166;TRAVIS;Cool.
167;MATT;(laughs) So. I'll say that Percy is continuing to read his book. The next few days pass without incident. Is there anything you want to accomplish? Anything?
168;ORION;You said the next few days without incident? Cool.
169;TRAVIS;Could I try to further my beard?
170;SAM;Oh, yes! Try to grow a beard.
171;MARISHA;Yeah, his beard. Let's go for the beard.
172;MATT;Go ahead and roll another percentage dice.
173;TRAVIS;Yeah! It's a d20, right?
174;LAURA;It's a percentage die.
175;TRAVIS;Oh, that's right, that's right. The two in a row. I remember.
176;MATT;Two d10s.
177;TRAVIS;I'm learning. I'm learning.
178;MARISHA;Yep.
179;MATT;First one and the second one.
180;TRAVIS;Three. Eight.
181;MATT;38. The little bit of peach-fuzz stubble on the chin of your goliath face begins to slowly grow. It's coming out colorless. It's almost translucent with a hint of gray and white.
182;SAM, LAURA;Ew.
183;TRAVIS;I'm a Targaryen, baby.|(laughter)
184;LIAM;That's hot.
185;LAURA;It's translucent, like--
186;MATT;A color is there. It's almost like fishing line is growing out of the bottom of his chin.
187;TRAVIS;Yeah.
188;SAM;Ugh.
189;ASHLEY;Whoa.
190;TRAVIS;Don't be jealous.
191;ASHLEY;Grog, it's sparkling. It's sparkling!
192;LAURA;It's really creepy, Grog.
193;ASHLEY;Hey, I feel it. It's like sandpaper, a little bit.
194;TRAVIS;Thank you. Thank you.
195;MATT;Keep in mind, goliaths, predominantly-- especially pureblood goliaths-- do not grow facial hair. The fact that this magical feat is even achieving any modicum of growth is in itself an arcane marvel, and who knows what detrimental effects this may have in the long run, going against your physiology.
196;TRAVIS;Oh, crap. It's all right. It'll make me look really wise, you guys. Nobody will know.
197;MARISHA;I have some beads. If you want, we can braid it and put beads in there.
198;LAURA;Ooh.
199;TRAVIS;I'm all about it. Beads and bells and shit?
200;MARISHA;Okay!|I braid Grog's beard.
201;TRAVIS;Give me a staff and I'll be Gandalf.
202;MATT;All right.
203;MARISHA;And put beads in it. And a few flowers, as well.
204;TRAVIS;Wait! Ooh, weird.
205;MARISHA;It looks nice.
206;TRAVIS;All right.
207;MATT;It takes you a lot of concentration to try and get any sort of braidage through the about an inch to inch and a half facial hair that is growing from his chin.
208;MARISHA;Looks good!
209;TRAVIS;It's really tight when you braid it like that. It pinches.
210;MARISHA;You'll get used to it.
211;LAURA;Maybe you can cast Grasping Vine on his chin and grow it out.
212;MATT;What could possibly go wrong? (laughter)
213;TRAVIS;Do it. Could be great.
214;ORION;I suggest against this.
215;TRAVIS;I thought you suggest violence.
216;ORION;No.
217;SAM;He encourages violence.
218;LAURA;I encourage violence.
219;ORION;I'm against this.
220;ASHLEY;Is it just violence?
221;LAURA;So we're healed. We're healed, right?
222;SAM;Oh, days have gone by, right?
223;MATT;Yeah, you guys have rested. Days have gone by, your spells have returned to you--
224;LIAM;Hey, DM, days have gone by?
225;LAURA;Trinket's feeling good.
226;MATT;Days have gone by at this time. You've continued traveling over the Ozmit Sea.
227;ORION;Are we nearing the destination?
228;MATT;I'll get to that in just a second. Do you have a question, Liam?
229;LIAM;No, not a question, but last night while Grog was sleeping-- I can see right up Grog's nose. While Grog was sleeping, I went and got a bit of rope from the ship and used my disguise kit that I have. I sort of frayed a part of the rope and spent about an hour using spirit gum to glue bits of frayed rope to Grog's chin into a small Gilmore-esque goatee. And he didn't seem to wake up, and I'd like to see how that worked out.
230;MATT;(laughs) All righty.
231;TRAVIS;I'm gonna do a sleep check or something, right? I can't let him survive that.
232;MATT;For this, go ahead and make a perception check with disadvantage.
233;TRAVIS;With disadvantage?!
234;SAM;Because you're asleep!
235;TRAVIS;One.|(laughter)
236;ORION;Get it out now.
237;MATT;You wake up the following morning and immediately run to the nearest reflective surface to check on yourself, and you have a glorious, dark brown, well-braided, mildly frayed, thick, coarse goatee braid. It goes about a good three to four inches from the bottom of your chin. And you are very proud.
238;TRAVIS;I knew it! I knew it! I am a special boy.|(laughs) (laughter)|Only this one strand is this color and everything else is white and translucent, whatever--
239;ORION;I think it looks good on you, Grog.
240;TRAVIS;Thank you! I wave my head and it whips around.
241;ASHLEY;(sings) I whip my beard back and forth.
242;TRAVIS;(sings) I whip my beard back and forth.
243;MATT;It stays taut on your chin. All right, so as you reach the middle of the sixth day of travel, the sky, which up to this point had been fairly sunny and clear, begins to slowly cloud over. The weather grows more gray, and the clouds themselves seem to cluster more into-- I wouldn't say a stormfront, but definitely a more gloomy atmosphere.
244;MARISHA;Can I do a nature check to see if this seems to be natural or arcane?
245;MATT;Certainly.
246;ORION;Nice.
247;LAURA;(sings) With her big fancy die!
248;MARISHA;Okay, that's a 10 plus-- 20, total.
249;MATT;All right. Looking at these clouds, it is a slow formation, and they aren't moving at an unnecessary speed or seem to have any ominous press towards you. It just seems like the weather itself towards this northern continent seems to be of a colder variety.
250;ORION;I'm going to sense the weather, I suppose, because this doesn't look fun.
251;MATT;Okay. The weather is cold.
252;ORION;Ooh, it's cold.
253;TRAVIS;So the weather outside is frightful?
254;LAURA;Good call, Tiberius. Good call. I agree, it is rather cold.
255;ORION;I don't like this. Scanlan.
256;SAM;Oi?
257;ORION;Like we were discussing earlier, would you be interested in the still-standing trade of my Ioun Stone for your circlet-crown thingy?
258;SAM;Oh, you know what, Tiberius, I have been giving this a lot of thought and consideration.|What's for lunch?
259;ORION;What would you like for lunch? I already ate.
260;SAM;Oh. No. No, I was done with the conversation.
261;TRAVIS;Oh, good diss.
262;LAURA, ASHLEY;Oh.
263;ORION;Well. Keyleth, if you could put a little slate up for me, I'd like to illustrate something for little Scanlan. And perhaps his tiny mind can comprehend it. (clears throat)
264;LAURA;Ooh!
265;ASHLEY;Hey, that's rude.
266;ORION;Would you, perhaps, do this?
267;LAURA;His tiny mind is exactly proportionate for the rest of his body, Tiberius.
268;SAM;Well, not the entire body.
269;ORION;I'm going to walk up to the hull and be like--
270;MARISHA;No! Write it right here! I throw up a slate.
271;ORION;Oh. (clears throat)
272;MATT;Okay. It's the strangest wall you've constructed, as up in the air on the ship that is mostly constructed out of iron and metal, there is little to no stone available of which you can sprout a Wall of Stone. However, there are weights set up on top, so what you create is less of a smooth Wall of Stone and more of a very thin, brittle shale wall that may function for the time being, but probably won't stand up for more than five to ten minutes.
273;ORION;I see. Prestidigitation. Some chalk.
274;MATT;All right.
275;ORION;You see, Scanlan, you've had this particular piece for over ten, let's say, matches or weeks. You have used it zero times. In over six battles, over the same course, using it zero times.|(laughter)|I, being a sorcerer, have a special ability called sorcerer points, where I can do multiple spells in a single round.
276;SAM;Yes.
277;ORION;Which none of you can do. Other than monks, of course.
278;LAURA;That's true. Brag about it, Tiberius. Just keep bragging about it.
279;ORION;When I can do multiple spells, like two, versus you, who can do one, that means that I can do one more spell than you can per round.|(laughter)
280;SAM;All right.
281;ORION;And every round after that. One hundred percent.|(laughter)
282;SAM;This is amazing.
283;ORION;Your utilization of the actual item has been equivalent to nothing. In the interest of the group and the use of items in general, it would be wise to switch it, because you have needed extra spells like Invisibility--
284;MATT;The shale wall cracks.|(laughter)
285;ORION;Several times.
286;MARISHA;I'm sorry.
287;ORION;Where my item would be more useful in general to you.
288;LIAM;May I ask, is magical ability inversely proportionate to wisdom?
289;ORION;Oh, me?
290;SAM;Who are you asking?
291;ASHLEY;Is magical ability inversely proportionate to wisdom?
292;ORION;Absolutely not. I am one of the strongest casters in all of Draconia, and it only takes the strength of my charisma to do my stuff.
293;LAURA;Oh. Everything makes sense now, Tiberius.
294;TRAVIS;So are you saying you want what he has back?
295;SAM;(laughs) I didn't recognize you, Grog. Is that you?
296;TRAVIS;It is I, Brad Pitt from Legends of the Fall.|(laughter)|My beard of glory.
297;ORION;That is a movie.
298;TRAVIS;It's an old bard's tale.
299;ORION;So, Scanlan. What say you?
300;SAM;Your mathematical skills have been quite impressive.
301;ORION;I don't like to show them off.
302;SAM;No, no. For a man of such low wisdom, you are proving wiser than I ever imagined.|(laughter)|I will gladly make this trade with you. You have convinced me.
303;LAURA;Hey.
304;MARISHA;Aww.
305;ORION;Oh, wonderful. Thank you.
306;SAM;Yes. Yes.
307;ASHLEY;Hey.
308;LAURA;That's wonderful.
309;SAM;All right. Hugs, hugs, hugs.|(laughter)
310;ORION;(explosion sound)
311;SAM;Now, what does this thing do?
312;ORION;Now you can store up to three level spells.|Three of them in there.
313;LAURA;Oh, it's better than the Pearl of Power!
314;ORION;And you don't have to expend spell slots to do the spells.
315;SAM;All right. Thank you very much.
316;ASHLEY;Hey.
317;LAURA;That's a good trade.
318;TRAVIS;Oh my god, that was so good.
319;ASHLEY;That was amazing.
320;ORION;You can put three Lightning Bolts in there and it costs nothing.
321;ASHLEY;Oh, math!
322;SAM;All right, all right. I'm man enough to admit that he's convinced me.
323;TRAVIS;That was so good.
324;ASHLEY;That was awesome.
325;TRAVIS;I don't know what you wrote, but it looked good.
326;MARISHA;Oh, man.
327;ORION;I'm sorry.
328;MATT;The Ioun Stone which you had taken, you place by your head and release. It seems to fix itself in the air and slowly rotate above your head.
329;ORION;It orbits.
330;MATT;Almost held in its own orbital gravity around your head.
331;LAURA;Ooh.
332;SAM;Pike.
333;ASHLEY;Oh. (laughs) Oh, wow. It's like you have a halo.
334;ORION;It is fancy.
335;SAM;"It's like a halo. Like your god has smiled on me, maybe, and said, """"He's cool. Go for it."""""
336;ASHLEY;Oh, wow. Well, I don't know if that's what it means.
337;SAM;Well. You know, religion is up to interpretation, so I interpret it that way.
338;ASHLEY;It is very cool-looking.
339;SAM;Thank you, Pike.
340;TRAVIS;"(laughs) So casual, her god. """"It's cool.|Go for it."""""
341;MATT;(laughs) Sarenrae. The she-bro you never had.|(laughter)
342;SAM;Sarenrae's my wingman.
343;ASHLEY;We cool, Sarenrae.
344;TRAVIS;I can't breathe.
345;MATT;Many a cart hold that bumper sticker. All right, so as this conversation comes to a close, the temperature in the sky has gotten noticeably chillier. And you swear for an instant you start seeing what looks like specks of white snow beginning to drift from the clouds ahead.
346;MARISHA;(gasps) It's snowing.
347;LAURA;It's snow, Keyleth.
348;SAM;(sings) I'm dreaming of a white whatever-we-celebrate.
349;TRAVIS;Festivus!
350;ORION;Festivus.
351;MARISHA;There was something I should probably tell you. In this area of land, in Vasselheim, on this continent, somewhere, I'm not sure where, resides the Fire Ashari. Somewhere in the town of Pyrah.
352;LAURA;What's that?
353;ASHLEY;Ooh.
354;LAURA;What are Fire Ashari?
355;MARISHA;Well, they're my sister tribe. They're a part of my sister tribe. I come from the Air Ashari.
356;LAURA;Right.
357;TRAVIS;Uh-huh.
358;MARISHA;Yeah, from Zephra.
359;ASHLEY;(whispers) Fire Ashari?
360;LAURA;So they-- oh.
361;MARISHA;Yeah, so there are Fire Ashari. So the point behind the Ashari-- I'm not sure I have expressed this to you all in the past few months.|The point of our tribe is we sought out the weakest points where the elemental planes start to bleed with our plane of existence, and these planes need to be protected, so our people have sought them all out in order to make haven there and be the protectors that we were all born to be.|And as part of my Aramente, I have to seek out each of the headmasters and prove myself a worthy leader.
362;TRAVIS;Ooh.
363;MARISHA;Which makes me really nervous.
364;LAURA;We've got your back, Keyleth.
365;ASHLEY;Oh, you'll do it. You'll totally do it.
366;TRAVIS;Yeah. Yeah, we can burn shit for days.
367;MARISHA;So I just thought, you know, maybe after we handle the Horn, maybe we can pop in. You know, since we're here.
368;LAURA;Totally. You know, if you want to, Keyleth, when we go, we'll all follow your orders and make it seem like you're an extraordinary leader of us.
369;TRAVIS;Ooh, yeah.
370;MARISHA;Oh. That could be good. Oh, that sounds fun!
371;ORION;Oh. Good idea, yes. Of course, I will be your mage guard.
