;Player_Name;Transcription_Text
476;LAURA;I know.
477;SAM;That's what you think.
478;SAM;My pickpocket fingers are faster than you could ever imagine.
479;TALIESIN;I really don't think they are.
480;TRAVIS;Sounds like a challenge!
481;MATT;At this point, Keyleth and Vax catch up to the rest of you guys.
482;SAM;I'll take that.
483;TRAVIS;How did it go?
484;TRAVIS;Did you kill the little black thing of death?
485;MARISHA;(slowly) No, I didn't.
486;TRAVIS;Vex gave Scanlan a gun.
487;TRAVIS;I don't think it's loaded.
488;MARISHA;Oh, god.
489;MARISHA;Be careful.
490;SAM;Does it look cool?
491;TALIESIN;No.
492;LAURA;We need to take care of that orb.
493;MARISHA;No, I tried to jam a piece of the magic glass.
494;MARISHA;The jammy magic glass into it and-- I'm probably lucky that I was able to pull away as quickly as I did, because I think it eats everything around it.
495;LAURA;So wait, it's still there?
496;MARISHA;Still there, yeah.
497;TRAVIS;Is it moving at all?
498;MARISHA;It's doing its really fast spinny thing.
499;TRAVIS;What about all the bodies in the room?
500;TRAVIS;Are they still like, (moans)?
501;MARISHA;I thought I could maybe go into my wildshape and bring down the building, I thought maybe if I collapsed the building, maybe it was drawing some sort of energy from the net of intertwined bodies, but I couldn't, because it was blocking all magic capabilities.
502;LAURA;Can I look over at Lady Briarwood and do a check on her to see if she looks stable?
503;MATT;Sure.
504;MATT;Which, at this point, just a note, in all the chaos and all the intent, trying to get things out of there, you're just now starting to realize that the Seeming spell that you placed on the whole party has also been canceled as part of whatever this trigger anti-field was.
505;MATT;So you all look around and realize, oh, we aren't a bunch of Percys and Cassandras.
506;TRAVIS;I'm beautiful again!
507;TALIESIN;Thank you?
508;LAURA;That's good, because I noticed your beard.
509;TRAVIS;That's right.
510;LAURA;That's right.
511;TALIESIN;Are you checking on Lady Briarwood?
512;LAURA;I am.
513;MATT;Trinket's nuzzling the body.
514;TALIESIN;Keep her unconscious.
515;LAURA;Trinket, careful.
516;TALIESIN;I'm going to try and wake Cassandra up.
517;MATT;Okay.
518;MATT;(Skype sounds)
519;SAM;It's the magic.
520;LAURA;That's magic.
521;MATT;All right, so.
522;MATT;You go ahead and check on her.
523;MATT;Go ahead and make--actually this is pretty easy, you just go ahead and take a moment, you just feel her for a pulse.
524;MATT;She is currently still alive.
525;MATT;And with a flash of divine energy just past the outskirts of this anti-magic field, you can see Pike's radiant ethereal form all of a sudden reconstruct itself.
526;LAURA, MARISHA;Pike!
527;ASHLEY;I'm back!
528;SAM;Oh, thank god.
529;ASHLEY;We were killing Lady Briarwood?
530;SAM;No, we're okay.
531;SAM;Everything's okay.
532;SAM;Thank Sarenrae you're back.
533;ASHLEY;Okay.
534;ASHLEY;Can I heal somebody?
535;SAM;We did that a bit while you were gone, but yes.
536;LAURA;But I'm still pretty low!
537;LAURA;If you feel like it, I would take it and I would be grateful.
538;ASHLEY;How's everybody else?
539;TRAVIS;Can you heal a couple of people?
540;ASHLEY;Yeah!
541;MARISHA;I'm a little shaky.
542;TALIESIN;I'm a little shaky, as well.
543;LAURA;Pike, heal us all.
544;LAURA;We love you.
545;ASHLEY;Okay.
546;ASHLEY;Let me do a Mass Cure Wounds.
547;ASHLEY;I have that.
548;LIAM;Gather together, everyone, gather together.
549;MARISHA;Group hug!
550;LAURA;Oh wait, but wait!
551;LAURA;Don't let Lady Briarwood in the circle of healing.
552;SAM;Wait, is she alive?
553;SAM;Did you check her?
554;MATT;She is currently alive.
555;MATT;She's unconscious.
556;MATT;And she's, thankfully from the blast and the sheer force of it, part of the wound was cauterized, but she has been bleeding quite a bit on the run down here, and she would probably need some sort of--
557;MARISHA;Should I stabilize her?
558;TRAVIS;Yeah, wait, stabilize her first.
559;LAURA;We're away from the fucking sacrifice area.
560;LAURA;Maybe we should just kill her.
561;TALIESIN;I want to quickly check my gun.
562;TALIESIN;Is Lord Briarwood's name still on it?
563;MATT;You go and inspect the barrel.
564;MATT;No.
565;MATT;Sylas Briarwood is currently erased from the barrel.
566;TALIESIN;Let's hold off just a bit before we kill her.
567;TRAVIS;I have some really dirty rags.
568;TRAVIS;Could I do a medicine check and try and stabilize her bleeding?
569;MATT;If you want to.
570;SAM;Dirty rags?
571;TRAVIS;18!
572;SAM;Do you have medicine skills?
573;TRAVIS;Zero!
574;MATT;So yeah, as you guys are having this conversation, Grog comes over and pulls out a mottled mass of really filthy rags from the Bag of Holding, probably used in various nose-wiping circumstances.
575;TRAVIS;Or other things.
576;MATT;But somehow it manages to stop the bleeding and keep her relatively stable for the moment, yeah.
577;TRAVIS;Okay, and then I take her by the foot and I drag her on her face away from the group.
578;TRAVIS;Very gently, but still by her foot.
579;MATT;Okay.
580;TALIESIN;Double-check.
581;TALIESIN;Perhaps gag her, as well.
582;TRAVIS;Oh right, yeah, she talks that shit, doesn't she?
583;TALIESIN;We don't want her speaking, and she only has one arm, so magic's going to be tricky.
584;LIAM;She can't do this kind of thing, but she can still talk.
585;MATT;Pike, did you say you wanted to cast Mass Cure Wounds, you said?
586;ASHLEY;Yes.
587;MATT;Okay, you can choose up to six creatures in a 30-foot radius, so it's your choice who you want to heal.
588;TALIESIN;She can't see us.
589;TALIESIN;Why are we holding our hands up?
590;LAURA;I don't know.
591;TALIESIN;Actually, you can see us on the screen.
592;TALIESIN;Never mind.
593;ASHLEY;I know, I have you guys on my iPad down here, but you're delayed.
594;LIAM;There's six including all of us.
595;ASHLEY;Okay, so I'll cure all the six people in my family.
596;MATT;All right, so that's 3d8 plus five for you.
597;LAURA;Wow!
598;LIAM;Pour one out for your homies.
599;MARISHA;Roll high!
600;MATT;Oh, to have a cleric in the group again.
601;TRAVIS;I know, right?
602;TRAVIS;Shit!
603;TRAVIS;Life!
604;LAURA, MARISHA;She's rolling.
605;ASHLEY;26!
606;ALL;Ooh!
607;ALL;(laughter)
608;MATT;Oh.
609;MATT;Let this be a lesson to all the people out there who think clerics are lame and nobody loves them.
610;TRAVIS;We love them!
611;TRAVIS;Can I tear a piece of fabric off of one of the three remaining fancy robes and I tie it around Lady Briarwood's mouth?
612;TRAVIS;But like-- (muffled) in, and you know like (muffled) in the teeth all-- she can't really enunciate.
613;MATT;Okay, so you pull it and you gag her around the side of her mouth and as you end up tying it, you see one of her eyes lulls open and she kind of, (coughs, sputters).
614;TRAVIS;(yelps) Shit, she's awake!
615;SAM, LAURA;Punch her in the face!
616;SAM;No wait, don't.
617;SAM;You'll kill her.
618;MATT;Up to you.
619;MATT;What do you want to do?
620;SAM;Blindfold her!
621;TRAVIS;I slap her.
622;MATT;(laughing) Roll a strength check.
623;SAM;Shit!
624;SAM;(laughter) He's going to kill her with a slap.
625;LAURA;She'll be knocked unconscious and she'll have to save three times again.
626;TRAVIS;21.
627;SAM;Oh that's good!
628;MATT;(whack) Right across her face.
629;MATT;You hear a resounding crack sound as it appears some part of her cheek bone probably is going to be fairly bruised tomorrow.
630;MATT;But she is straight to unconsciousness again.
631;MATT;(cheering)
632;TRAVIS;If you're curious, she's still alive.
633;TALIESIN;I can tell.
634;LAURA;She almost killed me.
635;MARISHA;Is she just unconscious?
636;MATT;She's still breathing.
637;TALIESIN;I'm going to try and wake up Cassandra.
638;MATT;Okay.
639;TRAVIS;I did bandages on her real good.
640;MATT;As you're standing in the tunnel, they're off to one side.
641;MATT;You go over to where Cassandra is.
642;MATT;You briefly set her down to have this conversation.
643;MATT;She's still bound on her arms and legs-- she was nearly hogtied by Grog when you guys finished up at the top of the temple.
644;MATT;She's breathing.
645;MATT;You can see, the dirt from being tossed to the ground is caked in on where the tear marks are down her face.
646;MATT;You shake her gently and eventually she comes to consciousness and her eyes roll around for a moment, she glances over at you.
647;MATT;Percy?
648;TALIESIN;We will have a discussion later.
649;TALIESIN;In the meantime, do you know what that thing in there is and how do we stop it?
650;MATT;I don't... what?
651;MATT;What's going on?
652;LAURA;The spinning orb of death.
653;MATT;She starts moving around, looking around the tunnel real fast at everyone.
654;MATT;What happened?
655;MATT;What's going on?
656;TRAVIS;You betrayed some bitches, that's what you did.
657;MATT;And as you say this, you see she reacts as almost someone had just punched her in the chest and the tears begin to flow down her face again, and she, I'm sorry.
658;TALIESIN;I'm going to slap her in the face.
659;MATT;Okay.
660;MATT;(slap) Go ahead and roll a strength check.
661;SAM;That's your sister, Percy!
662;LAURA;She might be unconscious too!
663;TALIESIN;Not with my strength!
664;TRAVIS;(jokingly) Natural 20.
665;TRAVIS;(laughter)
666;TALIESIN;16.
667;TALIESIN;Well, actually my strength is still thin because I still have a--
668;SAM;Oh!
669;SAM;Negative two strength, right.
670;TALIESIN;So, 15.
671;MATT;15, yeah okay.
672;MATT;You smack her to get her attention in this circumstance.
673;MATT;She stops for a second and gathers herself.
674;MATT;Her breathing slows and she stares off into space for a moment.
675;TALIESIN;I need my sister back.
676;TALIESIN;Are you awake?
677;TALIESIN;Are you a terrible person?
678;TALIESIN;Do I want to strangle you right now?
679;MATT;Probably.
680;TALIESIN;Good.
681;TALIESIN;Then we can work with this.
682;TALIESIN;They were building something down here.
683;TALIESIN;The Briarwoods are no longer a problem.
684;TALIESIN;They were building something-- what do you know about it?
685;TALIESIN;It maybe started, it seems to be affecting magic.
686;TALIESIN;I think.
687;MATT;I don't know.
688;MATT;They wouldn't let me near it.
689;LAURA;Don't lie to us anymore!
690;MATT;I'm not lying!
691;MATT;Do I have a reason to lie right now?
692;MATT;And she looks over at you with an intensity to her gaze that catches you not as desperation, but as passionate self-loathing.
693;LIAM;You seem to really believe your words, but you know your word is worth fuck all right now.
694;LIAM;Fuck all.
695;MATT;I know.
696;MATT;I know.
697;MATT;She leans her head down on the side of this cavern wall and stares off into space.
698;MATT;All that I know about this is that they've been building it under the guidance of some other person or entity.
699;MATT;They referred to him many times as the Whispered One.
700;MATT;They're very secretive about it.
701;MATT;The only reason I knew was because I overheard a few conversations and questioned them about it.
702;MATT;To which there was punishment.
703;MATT;But they mainly kept me to try and keep the people at bay.
704;MATT;My job was to keep in contact with anyone who would attempt to rise against them, and inform them.
705;MATT;I would prevent any surprises, although apparently (chuckles) and thankfully, I didn't do a very good job.
706;MATT;And she looks around the room at the rest of you.
707;SAM;Can I check my history memory banks to see if I know anything about the Whispered One or if that jogs any memory?
708;MATT;Roll a religion check, Mr. Bard.
709;SAM;Religion check?
710;SAM;Well, that's not good.
711;SAM;20.
712;LAURA;What?!
713;LAURA;Natural 20?
714;SAM;No.
715;LAURA;Damn it!
716;LAURA;I had a really strong reaction to that.
717;SAM;Oh.
718;TRAVIS;Yes, the whispers!
719;MARISHA;He's whispering about the Whispered One!
720;SAM;He's gone!
721;SAM;Where is he?
722;TRAVIS;This is the pre-show days!
723;LIAM;It's not new, it's just been a while.
724;TRAVIS;It's been a long time.
725;LAURA;Yeah, but he's on this side of the table.
726;TALIESIN;None of us have rolled this well in so long.
727;TRAVIS;We used to play-- don't over-listen to it!
728;TALIESIN;(starts singing In the Hall of the Mountain King)
729;LIAM;He is licking the inside of Sam's ear.
730;LAURA;Look at his eyes!
731;LIAM;Matthew is the Whispered One.
732;LAURA;He is the Whispered One!
733;LAURA;This is normally the time when Sam would--
734;SAM;It was all tongue in my ear the whole time!
735;SAM;(laughter) It was so dirty.
736;SAM;The Whispered One!
737;SAM;I have a memory!
738;SAM;I don't know where I learned of this knowledge-- I am very old-- but I did, at some point in my travels, I remember reading about something.
739;SAM;A lich king?
740;MATT;A lich entity, yeah.
741;SAM;Who wanted to be a god.
742;SAM;And his name was Vecna, and they called him the Whispered One.
743;SAM;That's all I remember, he tried to achieve great power, and I don't know if he was successful or not.
744;MARISHA;Oh boy.
745;LAURA;Cassandra, does any of that sound familiar?
746;MATT;Cassandra shakes her head and says, Honestly, I didn't know anything beyond the name.
747;MATT;I just knew they were very close with this individual.
748;LAURA;When you betrayed us, you said you were serving a higher purpose.
749;LAURA;Did they plan to sacrifice you to him?
750;MATT;I know there was a blood ritual involved.
751;MATT;I did not know more than that.
752;MATT;There was to be a gift of power should I give an element of my life to this ritual.
753;MATT;She shakes her head for a second.
754;MATT;She blinks her eyes, and she says, I don't feel like I was right in my head.
755;MATT;I look back on so many decisions I've made, and all the people that I've-- The tears just start flowing again.
756;LIAM;Insight check.
757;LIAM;(rolls) I'll take that.
758;LIAM;14.
759;MATT;14.
760;MATT;Best that you can read off her is there is a deep look of regret and sorrow in her face.
761;MATT;And you do notice that, through most of this conversation, as much as she's been able to talk to all of you, she has been unable to make eye contact with Percy.
762;LIAM;I'm going to walk over and plop down in front of her and say, you've backed a losing team.
763;LIAM;And that's not surprising, you having been through what you've been through.
764;LIAM;That's all gone now.
765;LIAM;Sylas is gone, Delilah is on death's door.
766;LIAM;Whitestone needs to be tended to and protected.
767;LIAM;Do you know anything that can help us save your birthright here and now?
768;MATT;I mean, you've already done half the job.
769;MATT;Her eyes look over at the unconscious Delilah in the hallway.
770;MARISHA;Cassandra, is there any reason why they'd want to sacrifice you in particular?
771;MATT;She thinks hard for a second, her eyes squinting.
772;MATT;I don't.
773;MATT;They spoke very little-- intentionally, I think-- of what they wanted to do.
774;MATT;To be honest, I think there was an element that even they didn't know quite what they were doing.
775;MATT;I was a tool.
776;MATT;I was to be used.
777;MATT;I had my purposes.
778;MATT;I did my best to fulfill them.
779;TRAVIS;I've got a question.
780;TRAVIS;Do you care if I smash the shit out of Lady Briarwood's head now?
781;MATT;She glances over at her, and with a stern look on her face she goes, Someone needs to avenge my family.
782;MATT;And for the first time she looks over and makes eye contact with you.
783;MATT;You feel a pulse in your hand, like a heartbeat.
784;MATT;(thoom) The gun itself seems warmer and warmer, and you guys all notice as a bit of smoke begins to billow out the sides of Percy's sleeves.
785;MATT;You hear a familiar voice creep up in the back of your head.
786;MATT;Percival.
787;TALIESIN;I walk up to Lady Briarwood.
788;MATT;Here at your mercy.
789;TALIESIN;I put my gun to Lady Briarwood's head.
790;SAM;Wait, Percy, you're going to shoot an unarmed woman?
791;TRAVIS;Hush!
792;SAM;Don't shoot an unarmed woman.
793;TRAVIS;Unarmed?
794;TRAVIS;She tried to kill us.
795;TALIESIN;You changed the deal.
796;TALIESIN;Take her name off the gun.
797;MATT;The deal was never changed.
798;TRAVIS;Who's he talking to?
799;MATT;The deal was made.
800;TALIESIN;I pull the gun away.
801;TALIESIN;Things have changed.
802;TALIESIN;We need to talk.
803;TRAVIS;All right?
804;SAM;Who's he talking to?
805;LIAM;I hold up my hand and shush the group with my hand.
806;MATT;You made a great sacrifice for my gifts, Percival.
807;MATT;Do not let it be in vain.
808;TALIESIN;(sighs) Did I even want revenge before I talked to you?
809;TALIESIN;Did I?
810;TALIESIN;I don't remember anymore.
811;TALIESIN;What does she die for?
812;TALIESIN;What do I even need?
813;TALIESIN;I want my country.
814;TALIESIN;I want my sister!
815;TALIESIN;I've killed two of those who have wronged me and nothing is better.
816;TALIESIN;Nothing feels better, nothing is avenged.
817;TALIESIN;What is this worth to you?
818;TALIESIN;And I put the gun back at her head.
819;MATT;Pull the trigger.
820;TRAVIS;I take out my hammer...
821;TALIESIN;Pull it back, put it to her, put it back.
822;TALIESIN;Maybe I will.
823;MATT;You're placing the gun against your own head?
824;TALIESIN;And back to hers.
825;LAURA;Percival, don't!
826;MATT;Percy, no!
827;MATT;Percival, don't do this.
828;MATT;We made a deal.
829;TALIESIN;I put the gun to the side-- no, I'm holding the gun on Briarwood.
830;TALIESIN;That deal was a soft deal.
831;TALIESIN;It was a dream.
832;TALIESIN;It was a vision.
833;MATT;What are visions if not a window into the future?
834;MATT;You understand so little, Percival.
835;MATT;Do not make me regret sharing this with you.
836;TALIESIN;I need more from you if you want anything from me.
837;TALIESIN;I don't trust you anymore.
838;TALIESIN;Besides.
839;TALIESIN;I put the gun to the hand of Lady Briarwood and pull the trigger.
840;TALIESIN;The gun's broken anyway.
841;TALIESIN;I drop it.
842;TALIESIN;I'm not satisfied.
843;TALIESIN;I want my money back.
844;MATT;(chuckles) The smoke still billows out from you at this point.
845;TALIESIN;It's actually also still around her, it occurs to me.
846;MATT;Go ahead and make a wisdom saving throw.
847;TALIESIN;Yep.
848;MARISHA;(mumbles) You have advantage.
849;TALIESIN;I have advantage!
850;TALIESIN;Thank you!
851;MATT;You do.
852;LIAM;I'm not doing anything, but I'm holding a dagger and just watching Percy, and aiming at Percy.
853;TALIESIN;Yay!
854;TALIESIN;20.
855;MATT;20.
856;MATT;You feel that warm pulse that was in your hand earlier that was coming from the gun?
857;MATT;It pulses like a heartbeat in the hand that was holding it, and for a second you feel like something grabbed your wrist and slapped it away towards your back, reaching for where Bad News is.
858;TALIESIN;Which does work.
859;MATT;And then you (grunts) rip control of your hand once again.
860;TALIESIN;Delilah.
861;TALIESIN;You are going to die tonight.
862;TALIESIN;Whether or not it is a merciful, quick death or a slow and agonizing one, controlled by something darker than I know, is entirely up to you.
863;TALIESIN;How do we stop that thing?
864;TALIESIN;!
865;MATT;Delilah, whose eyes are still rolling after all the shouting that's been going on as she comes into consciousness with a gag around her mouth and goes (breathes heavily, struggling) And her eyes dart around in fear.
866;MATT;You can see that her makeup has run down her cheeks from her own lamenting over Sylas's loss and the confusion over the ritual.
867;MATT;And the fear all of a sudden turns to seething, burning hatred as they dart around.
868;MATT;And then (struggles again).
869;MATT;She can't talk.
870;SAM;I will Mage Hand to remove the gag from her.
871;LAURA;Oh god!
872;LAURA;I pull an arrow and aim it right at her head.
873;MARISHA;Yeah, I prep my fire hands.
874;TALIESIN;I know the pain you're feeling right now.
875;TALIESIN;I know the rage.
876;TALIESIN;I know every moment of it, and I guarantee I can make it worse.
877;TALIESIN;I can make it so much worse.
878;TALIESIN;Fix this.
879;TALIESIN;And join your beloved.
880;MATT;As this is happening, the gag falls away from her mouth from the magic hand.
881;MATT;She's glancing at you and the smoke is now billowing up stronger to the point where you can barely see Percy's torso.
882;MATT;You can see his head now, and what little bit of a view you have, his eyes have gone completely dark.
883;MATT;There is just pitch black, completely encasing the entirety of his visible eye.
884;MATT;You can see his feet still dangling beneath the smoke, and his feet are digging and tensed into the ground.
885;TALIESIN;Delilah, don't make me hurt you.
886;MARISHA;I reach over and I grab Vex's hand.
887;MARISHA;And I look at her and I say, what do we do?
888;TALIESIN;Grog, be ready to restrain me.
889;TRAVIS;I'm ready!
890;LAURA;Percival Frederickstein von Musel Klossowski de Rolo III, you will fight this monster inside of you!
891;MATT;Delilah is looking at you right now and the anger and fury in her eyes clarified, she just looks up and, You've already taken everything from me.
892;TALIESIN;I really haven't.
893;TALIESIN;You still have your sanity and your life.
894;TALIESIN;I will take your life tonight, but I can leave you your sanity.
895;MATT;Interesting.
896;MATT;You seem to be struggling, Percy.
897;TALIESIN;Okay, I'm going to be an asshole.
898;TALIESIN;Fine.
899;TALIESIN;Fine.
900;TALIESIN;Casting Minor Illusion.
901;MATT;Okay.
902;TALIESIN;I'm changing my form into the screaming, writhing, slowly-melting visage of Lord Briarwood.
903;LAURA;Oh shit!
904;TALIESIN;And I'm just going to scream in holy high hell and pain.
905;MATT;Okay.
906;TALIESIN;Suck it, girl!
907;MATT;So Minor Illusion, as a limitation, it wouldn't be a full-body illusion, but you can take elements of your features.
908;TALIESIN;I'm in smoke.
909;TALIESIN;I'm just taking--
910;MATT;Yeah.
911;MATT;Where once Percy's face existed, it twists into this shimmering apparition of Sylas Briarwood looking down at her as his face contorts into horrible, screaming pain.
912;MATT;The head rises up and almost soundlessly, he screams out as the flesh begins to melt from the bone.
913;MATT;As it does, Percy's voice rings out in this cacophonous roar that shakes the cavern around you.
914;TALIESIN;That pain you're feeling, I've felt for years.
915;TALIESIN;Don't think I've imagined every way to hurt you!
916;TALIESIN;I could spend years hurting you before you die, in ways you cannot imagine.
917;TALIESIN;Now, how do we stop it?
918;MATT;I don't know.
919;MATT;I don't even know if it worked.
920;MATT;We've been preparing for this ritual for... five godforsaken years.
921;MATT;All to repay a debt.
922;MATT;And that's all.
923;MATT;You forced us.
924;MATT;It was too soon.
925;TALIESIN;Why?
926;TALIESIN;Why was it too soon?
927;TALIESIN;What were you waiting for?
928;MATT;We were waiting for a particular date.
929;MATT;There is a time each year in which the barriers between realms grow and grow very weak.
930;MATT;You recall Erevan's attempt generations ago to blur between the realm of ice and this one, which you call the Winter's Crest.
931;MATT;Well, this is too early, and you saw our failure.
932;MATT;He will not be happy, I imagine.
933;MATT;And I still owe him for what he gave me.
934;MATT;For what he gave us.
935;LAURA;What did he give you?
936;MATT;At which point, her eyes well up with tears, and she looks over.
937;MATT;He gave me my Sylas back.
938;MATT;And you took him from me again.
939;MATT;So do what you must do.
940;MATT;I know I've paid my penance, and I know that no matter what steps you take now, it will only drag you deeper into this dark hole you've drawn yourselves.
941;MATT;And you will hear me laughing.
942;TALIESIN;No, I really won't.
943;TALIESIN;Knock her out again.
944;TRAVIS;Oh.
945;TRAVIS;Fine!
946;TRAVIS;(punching sound)
947;MATT;Make a strength check.
948;TRAVIS;19.
949;MATT;19?
950;MATT;(impact noise) You hear (clinking) across some of the lower rocks as two of her teeth go scattering out the side of her mouth.
951;TALIESIN;Collect them.
952;TRAVIS;They're not pointy, right?
953;MATT;No.
954;TALIESIN;Check her person for anything.
955;LAURA;Oh, I will gladly do that for you.
956;TRAVIS;Hold on a second.
957;TRAVIS;Are you sure you don't want to smoke this bitch?
958;LAURA;I check her person for anything valuable.
959;TALIESIN;I think we're just going to throw her into the acid pits.
960;TALIESIN;No, I don't feel...
961;LIAM;What's the plan here, Percy?
962;SAM;I pick up the Pepperbox off the floor to give it to him, and I try to sneak out a bullet.
963;TALIESIN;They're different bullets.
964;SAM;I don't know that!
965;MATT;Okay.
966;MATT;Make a sleight of hand check.
967;SAM;Three!
968;TRAVIS;Shit!
969;SAM;Plus two!
970;SAM;Plus two.
971;MATT;So five.
972;MATT;(giggles)
973;TALIESIN;The three, in theory, is actually low enough to break it further.
974;MATT;Make a perception check.
975;MARISHA;Plus two, it's five.
976;TALIESIN;Fine.
977;LIAM;Natural one.
978;TALIESIN;Nope.
979;TALIESIN;That's a 16.
980;MATT;So you watch as Scanlan looks around, grabs it.
981;MATT;Picks it up and (clink) the full barrel comes off of the gun.
982;SAM;I back away from it.
983;LAURA;You guys, he's got smoke billowing out of him right now.
984;SAM;Kick it off away to the corner.
985;TALIESIN;Scanlan.
986;TALIESIN;Give me the other gun.
987;SAM;Oh, it's on the floor right there.
988;TALIESIN;The other gun.
989;SAM;You were talking to something out there.
990;SAM;What was it?
991;SAM;I was very scared.
992;SAM;I'm a little man!
993;TRAVIS;Just change the subject.
994;SAM;Who were you talking to?
995;TALIESIN;I need another gun.
996;SAM;Are you going to kill me with it?
997;SAM;(laughter)
998;TALIESIN;Maybe?
999;LIAM;I walk between them and say, Percy, what are we doing here?
