;Player_Name;Transcription_Text
292;LIAM;Is there anything else you can do that you haven't-- can you make an army of unicorns or a giant in a dancing dress, or is this the extent of what you can do?
293;SAM;I'd like to keep a few secrets, if you don't mind.
294;TRAVIS;Can you make fart sounds with your armpits?
295;SAM;Yes. I can bend my thumb all the way back.
296;LAURA;I pull out my crystal and I call upon the great power of Trinket. I choose you.
297;MATT;With a flash of deep blue and black light, Trinket emerges (bear noises).
298;LAURA;We have a mansion! You built a Trinket room.
299;SAM;You know what, I totally forgot to build Trinket a place to sleep.
300;LAURA;That's okay, he'll stay in Kaylie's room for the time being, and then--
301;SAM;No no, Kaylie's room is locked.
302;LAURA;Pike loves him, I bet he wouldn't mind--
303;SAM;Let me just think about this for a second.|There's the third pantry. The third pantry could possibly work. It has some just mostly-- no, no, it's full, we can't use that.
304;LAURA;Do you have any rooms with very high ceilings?
305;SAM;The front.
306;LAURA;The very front?
307;SAM;The front hall.
308;LAURA;But I mean somewhere I could put a bed for myself and Trinket with very high ceilings.
309;SAM;All right, yes, there's a whole basement area. It's a large space.
310;LAURA;Wonderful. I'll move my bed down there.
311;SAM;It's for training and working with weapons.
312;LAURA;That'll be perfect. Trinket needs to train.
313;TRAVIS;Yeah, I'll go down there and I'll stay with Trinket.
314;LAURA;All right.
315;TRAVIS;Yeah, I want to train a little, want to work out a bit.
316;LAURA;Totally. I understand.
317;TRAVIS;Yep. I need a target, though. Hey, can you call one of those little ghostly guys over?
318;SAM;You can have five of them.
319;TRAVIS;Yeah, right, fine. The first one of you that brings me a cow wins.
320;MATT;"They all look at each other. """"Right away, sir."""" And all five of them drift off. A moment later, they all return with a spectral cow."
321;MARISHA;Like five cows, they each return with one?
322;MATT;No, each one of them is just traveling with one cow, they've all brought you together one spectral cow.
323;TRAVIS;It's like a bunch of Mr. Meeseeks with cows. Do I get to pick a cow? There's just one cow?
324;MATT;There's just one cow.
325;TRAVIS;Right. So can I touch the cow on the head?
326;MATT;You touch it, and it has weight to it, it has surface area.
327;LAURA;No, we're killing cows, we're killing, we're killing poor servants--
328;TRAVIS;We're not killing anything! And I punch the cow in the nose.
329;SAM;Jesus!
330;LAURA;That's so dark!
331;TRAVIS;No, look, I'm just seeing what it is.|Stay, Bessie.
332;MARISHA;Grog, you just punched a cow in the face.
333;TRAVIS;What, I'm just seeing if it bled. Did the nose bleed?
334;MATT;There is no blood.
335;TRAVIS;I punch it again.
336;LAURA;Grog! Stop it!
337;TRAVIS;I took a really easy punch.
338;LAURA;Look, you're hurting it!
339;TRAVIS;No, I'm not. Is there any blood?
340;MATT;No blood.
341;LAURA;Trinket blocks it.
342;TRAVIS;Never mind. You know what, I changed my mind, I don't need a cow. I'm going to go stay in a normal room.
343;LAURA;No, Grog, actually, I think you should train for a little bit at least. Just come down to the basement and maybe train for a little bit.
344;TRAVIS;All right.
345;LIAM;I'm sorry, where did that cow come from? I call one of the servants over to me. Can you get anything? Could you get me a small squid?
346;MATT;"They all look at each other and shake their head. """"No, sir, we have limited resources here.|The cow, we happened to have one."""""
347;LIAM;Is that a real cow, Scanlan, or was that some sort of ghost cow?
348;SAM;Ghost cow.
349;MATT;At which point the cow disperses.
350;TRAVIS;I punched it so hard it exploded.
351;TALIESIN;The ghost of a dinner you've already eaten, come back to haunt you.
352;LAURA;I go down to the training room. And I stop the servant and go, can you bring down a bed for me?
353;MATT;Yes.
354;LAURA;Thank you. Grog, can we train, please?
355;TRAVIS;Yeah. You want to train with me?
356;LAURA;Yes, I think I need to train with you, specifically.
357;TRAVIS;All right. Always a good time to get better, I guess.
358;SAM;What's going on over there?
359;MARISHA;I don't know.
360;MATT;You guys walk out of the foyer into the main hallway, and at the end to the left you see a doorway appear where there wasn't one before. It opens up on its own, and as you walk you can see stairs that lead down and into a basement chamber that has a sand pit surrounded by brick. There are a series of wooden training dummies and various training accoutrements. There are chains hanging from the ceiling for lifting and climbing exercises. There is a basic set of weapons against the weapon rack and a basic set of armor on the other set.
361;SAM;Muscle-ups.
362;TRAVIS;Rope climbs.
363;TALIESIN;Are we really about to pretend to do Crossfit? Is that a thing that's actually about to happen?
364;SAM;Is there a big thing that says WoD on it?
365;TRAVIS;Wizard of the Day?
366;LAURA;The minute we get downstairs, I start pawing into the Bag of Holding.
367;TRAVIS;What are you doing?
368;LAURA;I just need to (grunts).|(a phone dings)
369;SAM;Ooh, how did you do that?
370;TRAVIS;That was awesome.|What did you grab?
371;LAURA;Oh, just this cleaning utensil, is all. Are we by ourselves? Nobody else came down, right?
372;MATT;Just the two of you.
373;LAURA;Yeah, I just wanted to do some cleaning with this broom that I--
374;TRAVIS;But this is where you train.
375;LAURA;I put it in the Bag of Holding before.|Maybe you can train over there on those dummies, and I can just sweep up some of this sand that's around in this area right here.
376;TRAVIS;I thought we were going to train. I thought we were going to fight.
377;LAURA;Yes. Well, Trinket actually wanted some training with his cannonball. If you will stand still so he can run into you a few times, that would be swell.
378;TRAVIS;I feel like there's a problem with this idea, but I'm not sure what it is, so I do it.
379;MATT;Okay. Trinket comes along with you and, in a very confused manner, attempts to train with you for a short time. It's been a while since you wrestled a bear, so it's kind of fun at times.
380;LAURA;It's fun, right?
381;TRAVIS;Look, I know I usually hit back, but apparently your mum thinks you can cannonball into me, so give it a go.
382;LAURA;Go ahead and try, Trinket!
383;MATT;"Trinket backs up (bear growling), looks over at you again like, """"Are you sure?"""" Across the sand flooring into a giant rolling attack towards you."
384;TRAVIS;Oh, fuck.
385;MATT;That is going to be... What's Trinket's attack bonus?
386;LAURA;Oh, God, you're really doing it.
387;TRAVIS;Yes!
388;LAURA;Yes, that's the point of this, to get Trinket to run into you is the point. His attack bonus is plus eight.
389;MATT;Plus eight, that's a 23 to hit.
390;TRAVIS;Yeah, that hits.
391;MATT;You go ahead and take seven points of bludgeoning damage.
392;LAURA;And you're knocked prone!
393;MATT;Go ahead and make a strength saving throw.
394;TRAVIS;(laughing) Okay. 26.
395;MATT;So Trinket rams into you, and you hold firm and flex. Conversely, the giant bear bounces off, stumbles back onto Trinket's butt.
396;TRAVIS;That was pretty good! I liked it a lot!
397;MATT;Licks you right along the face, beard cowlicks up a little bit.
398;TRAVIS;I think this might be a good look for me.|How do I get it to stay?
399;LAURA;While all that is going on, I have a broom in my hand.
400;MATT;You do.
401;TRAVIS;I start climbing all over the walls.
402;LAURA;I put it between my legs and try to sit on it.
403;MATT;All right.
404;SAM;Weirdly, I'm doing the same thing upstairs.|(laughter)
405;TRAVIS;Is one of your servants named Broom?
406;LAURA;And I jump in the air a little bit.
407;MATT;Hop.
408;LAURA;Okay. I say, up! Fly! Lift up! Fatty Arbuckle! Shenanigans! Ren and Stimpy, I don't know.
409;TRAVIS;Rotisserie chicken!
410;LAURA;Fuck! Grog.
411;TALIESIN;Perhaps it requires a bad Irish accent.
412;LAURA;(Irish accent) Fatty Arbuckle! (laughter)|Nothing.
413;MATT;Nothing.
414;TRAVIS;Do you usually yell when you clean?
415;LAURA;(groans) I put the broom on the ground. I walk over and I punch Grog as hard as I can.
416;TRAVIS;What was that for?
417;MATT;Grog, it's not very strong.
418;LAURA;It's not. I'm pretty fucking weak.
419;TRAVIS;No, I know, but I like to make her feel good about it. Ow!
420;LAURA;Sorry I hurt you, Grog, I know that was a very strong punch.
421;TRAVIS;I look at Trinket and wink.
422;LAURA;Are you guys good? Do you want to keep training?
423;TRAVIS;Yeah, what are you doing?
424;LAURA;Nothing! I put the fucking broom back in the Bag of Holding.
425;TRAVIS;You didn't clean very much.
426;LAURA;I figured the servants can do it. I walk upstairs.
427;MATT;Okay.
428;LIAM;Can Scanlan cast Sad Trombone?
429;SAM;We have a music room. I actually have a trombone.
430;MATT;That's true.
431;SAM;(sad trombone sound)
432;MATT;With Vex not there, Trinket gets a little antsy and eventually your training session with Trinket comes to an end as Trinket goes to seek Vex. You can finish your wall climbing in solace.
433;TRAVIS;All right. I'm good for the night.
434;MATT;Okay.
435;TRAVIS;I wanted that cow.
436;LAURA;I go find Keyleth.
437;MARISHA;Okay. I don't know, I'm just chilling.|I'm eating food.
438;TRAVIS;Eating food.
439;MARISHA;Relaxing.
440;LAURA;Hey! Actually-- no, I don't want to talk to you. Keyleth. What do you know about magical things? Like a lot?
441;MARISHA;I'm not great at identifying what they are. I can generally be like, that's magical! But I don't know arcane things, only natural-based magics.
442;LAURA;Oh, fuck. Thank you so much!
443;MARISHA;Why?
444;SAM;Anything I can help you with, Vex?
445;LAURA;Scanlan! I might need to talk to you, dear.
446;SAM;Should we retire to my room for this?
447;LAURA;Why, yes, we should.
448;SAM;(excited gasp) I was not expecting that.
449;MARISHA;Keyleth just picks up her plate and awkwardly leaves.
450;LAURA;I go get the broom from the Bag of Holding again.
451;SAM;I run up to my room to make sure that everything's neat. Light a bunch of candles.
452;LAURA;I follow him up and knock on the door.
453;MATT;Okay. The door opens up at the first knock.|(creak)
454;SAM;I'm lying in bed. Black satin sheets. Oh, I forgot you were coming!
455;LAURA;Wow. Well, darling. I shut the door behind me. I have a favor to ask you.
456;SAM;I should warn you, we're not alone. And I look over to the five musicians and I ask them to strike up a little--
457;MATT;A gentle classical piece with a small, low-timbre brass section comes in.
458;SAM;Little bossa nova.
459;MATT;Yeah, it's nice. It's not too involved, doesn't distract you too much.
460;LAURA;It's nice mood setting, I like it.
461;SAM;Whatever. It's, you know, it's my special place where I like to come and think about philosophy and life.
462;LAURA;You're so smart. I've always thought that about you, that you're very smart.
463;SAM;Well, many people do.
464;LAURA;Yes. I sit down next to him on the bed.
465;SAM;(gulps) It goes up and down a bit. It's a water bed.
466;LAURA;Cozy. Help me!
467;SAM;Is that--
468;LAURA;What?
469;SAM;Did we see that before?
470;LAURA;Maybe. Okay, Scanlan, I'm a terrible person, I know.
471;SAM;What did you do?
472;LAURA;I took a broom from a poor, poor dragonborn.
473;SAM;You took Gern's magical broom?
474;LAURA;Maybe.
475;SAM;Oh my gods.
476;LAURA;I know, I'm sorry, I know, I'm terrible, and now it won't work and it was pointless and I want it to work. Help me.
477;SAM;Because it flies?
478;LAURA;Because it flies, Scanlan.
479;SAM;What is it with you and flying?
480;LAURA;I don't know, there's just something about being up there in the air that makes me feel alive in a way that I've never felt before.
481;SAM;I could make you fly.
482;LAURA;Okay. Wait-- Oh, you mean. With your cube.
483;SAM;Yes, that's right.
484;LAURA;I'd rather you do it with this broom, actually. And not in any weird way, just to be able to help me make the broom fly. Do you know how to do that?
485;SAM;I will try. I will examine the broom and make some sort of check on it.
486;MATT;Make an arcana check.
487;SAM;Oh, that's not good.
488;TRAVIS;Should've come to me for that.
489;LAURA;Oh, no!
490;TALIESIN;It's a number.
491;SAM;14.
492;MATT;14. Okay. Looking over the broom, you can tell it's enchanted. There are runes along the sides of the broom. You do gather from the nature of the enchantment that it is an item that requires a spoken phrase from the wielder to initiate its magic. Short of an Identify spell, you would probably have to guess. If you know the Identify spell, that would be a way for you to.
493;SAM;I don't. Can I examine it to see if there's any markings, any hidden anything on it?
494;MATT;Make an intelligence check. Or, you know what, this would be specifically investigation.|Investigation check.
495;SAM;Investigation. 21.
496;MATT;"You do notice that many of the runes intricately carved on the side of the broom are-- they're part of the enchantment; however, there is a certain phrase that is not part of the enchantment. It's scrawled into and very cleverly hidden amongst the broom. It is not Common. What languages do you know?"
497;SAM;Common, Gnome. Pig Latin.
498;MATT;It is not a language you recognize.
499;LAURA;I speak Elvish, Draconic, Undercommon?
500;SAM;You don't see the words, though.
501;LAURA;But you saw it.
502;SAM;There's some words here that might be a clue to the code word. Basically, we need to find the code word. What do we know about Gern?
503;LAURA;Well, I tried Fatty Arbuckle. I thought maybe that was something.
504;SAM;Did you try the others? Coral? Carol?
505;LAURA;Coral. Carol.
506;SAM;You probably need to hold it.
507;LAURA;What was the... Oh. Coral! Carol! I don't remember the other one's name.
508;SAM;I don't either.
509;LAURA;Stimpy? Was it Stimpy? It was Stimpy!
510;SAM;Try: On Coral! On Carol! On Stimpy! On Fatty Arbuckle!
511;LAURA;Wait, but what does the word say? Where's the word?
512;SAM;I can't read the words.
513;LAURA;Can I find it? What is it?
514;MATT;Do you point it out to her?
515;SAM;I point it out to her.
516;LAURA;What is it?
517;MATT;It is Draconic.
518;LAURA;What does it say?
519;MATT;It's archaic Draconic. It's from the base root of the language, which is one of the oldest languages in civilization. It spells out, phonetically, the word for candle.
520;LAURA;That's smart. (hacking spit)
521;MATT;At which point, the broom jumps up in your hands, and almost lifts you off the bed for a second, and you catch it and hold it back down.
522;LAURA;(singing) Something has changed within me! Oh my God! Oh my God. Scanlan.
523;SAM;Weirdly, you are not the first floating chick I've had in my bed. But that is amazing! You're flying!
524;LAURA;I hug him. I hug him as hard as I've ever hugged Scanlan. I love you so much. You're my favorite person in the entire universe right now.|I owe you--
525;SAM;Nope. You owe me nothing. That's what friends are for.
526;LAURA;I love you.
527;SAM;I shake her little elf hand.
528;MATT;It's a pretty big elf hand compared to your tiny gnome hand.
529;SAM;Okay.
530;LAURA;I sit on it. How high are the ceilings in here?
531;MATT;How high are the ceilings in your room?
532;SAM;As high as they can be on the top floor.
533;MATT;For this room, because it is an extradimensional space, this room is probably a good 50 feet high. High ceilings, with drapery.|It's so garish.
534;LAURA;Can I sit side-saddle on it?
535;MATT;Yeah.
536;LAURA;(hacking spit) I don't remember how I said it before.
537;SAM;You're going to have to remember that now.
538;MATT;Better write that down. (hacking spit)
539;LAURA;Why didn't I choose something more fun to say?
540;MATT;Welcome to D&D. As the words emit from your mouth, the broom takes off, and you have to aim it a bit. You start going around in circles, slowly rising up towards the roof of the room.
541;LAURA;Yay, this is awesome! I'm really high!
542;SAM;I instruct the band to start playing Flight of the Bumblebee.
543;MATT;(whistling)
544;LAURA;Oh my gosh! Can I take my hands off?
545;MATT;"You do, and you start going, """"Whoa!"""" Go ahead and make a dexterity check."
546;LAURA;Oh my God. I probably should have been lower to the ground when I said that. Okay, that's fine. Oh, I'm still exhausted!
547;MATT;Yep.
548;SAM;Oh, shit.
549;LAURA;20.
550;MATT;That's fine. You're fine. A really bad roll might have had a circumstance, but you manage to catch yourself on the broom in time and, okay.|You're getting the hang of it. It's still not something you're used to, but it's fine.
551;LAURA;Can I point it down towards the ground and get lower?
552;MATT;You do. And you take a few minutes to figure out the pitch and wobble of it, and it's less of a directional flight, more than it is a combination of how you hold the front of the broom and concentrate on its direction. But nevertheless, a few moments pass, and you get the hang of it.
553;LAURA;Oh. My. God. This is the best day of my entire life.
554;SAM;You look great up there.
555;LAURA;Thank you. Thank you.
556;SAM;But you should not have stolen that!
557;LAURA;Oh, I know, I know, it's terrible!
558;SAM;He was our friend! He helped us!
559;LAURA;How bad of a person am I? I'm a horrible person!
560;SAM;We should do something to repay the debt!
561;LAURA;Well, I tried. I was going to give him a lot of dragon scales, and he wandered away!
562;SAM;We can't possibly find him now.
563;LAURA;Well, how do I help him? Because I feel terrible.
564;SAM;If we can't help him, you're going to have to help someone else to make up for the lost karma.
565;LAURA;I will help as many people as I can while I'm flying through the air.
566;SAM;Perhaps I will pick someone for you to help someday. To repay us both.
567;LAURA;I think that's a deal, Scanlan.
568;SAM;All right. I will mark that down.
569;LAURA;What are you, like, a hag now? I sit on it, and I open the door, and I fly through the doorway.
570;MATT;She drifts out of the room. The door (slam) shuts behind her.
571;MARISHA;You're going to be one of those Segway assholes now!
572;TRAVIS;Yes, totally!
573;MATT;You lean back in your bed, on your fine, black silken sheets, with Flight of the Bumblebees still blaring by the fireplace.
574;SAM;All right, guys, it didn't work, you can go.
575;MATT;They all get up. The music stops. And they all slowly drift out of the room, one by one.|Fireplace still crackling.
576;SAM;It's nice in here.
577;TALIESIN;I'm sitting wherever there's a lounge of any kind. I'm working in the sketchbook. Working on things.
578;MATT;Not a worry.
579;MARISHA;I'll be reading my alchemy book, because I have had so little time to catch up on my reading.
580;TALIESIN;We never talk anymore, do we?
581;MARISHA;We never do.
582;TALIESIN;Mmm.
583;LAURA;I'm so happy! It's the best!
584;MATT;So good!
585;LAURA;I'm going to try to sleep. It's going to be really, really hard because I'm so excited, but I really need to get some rest!
586;MARISHA;Did you feed the dog?
587;TALIESIN;Today? I don't know.
588;MATT;So, anyone want to do anything else? You going to go rest for the evening?
589;TRAVIS;I rest.
590;TALIESIN;I'm good.
591;MATT;All right. You all eventually find your ways to your rooms, happy and comfortable in the fact that no one has to take watch for this night. As you all get to bed, a few hours into the evening, Keyleth, you are just starting to doze off when you hear a knock at the door.
592;MARISHA;(gasps awake) Scanlan?
593;MATT;You open the door?
594;MARISHA;On my door?
595;MATT;On your door.
596;MARISHA;Who is it?
597;MATT;"""""Keyleth, it is Cerkonos. Please open up. I wish to speak with you."""""
598;MARISHA;I open the door.
599;MATT;"Okay. Cerkonos comes in. The first thing you notice-- previously, you had seen what was his burned-off arm at the shoulder. You can now see the flesh is extended and is currently very slowly in the process of regenerating his lost arm. And it catches you off-guard for a moment, and he puts his hand up and says, """"Sorry, it is not very presentable."""" And he still keeps his hand over it, slightly embarrassed by the mid-regenerative state of it. """"I'm sorry to have disturbed you, I come as unease has taken my mind."""" And he enters the room and closes the door behind him. """"May we sit?"""""
600;MARISHA;Of course, please, Cerkonos.
601;MATT;"He goes over and takes one of the nearby chairs and sets it down, places one across from him for you to sit, gestures with his one arm.|Sits down. """"I would not speak with those I do not trust. And I have seen your purity of soul, Keyleth. So I come to you with these concerns."""" His eyes trail off for a moment in the distance, and he gathers his thoughts and his words. """"Four years ago, a young woman came to Pyrah for redemption. A lost girl, cast out and wishing for acceptance. We, as we do with outcasts, took her in, taught her. And in time, called her one of our own, one of the Pyrah. In recent months, she began to grow distant, taking to staying in the Cindergrove unattended for days at a time. One afternoon, the mountain moved, angry with shifting fires. We felt a disturbance in the Gate, and when we went to investigate, there she was, commanding powers we did not know she had."""""
602;MARISHA;What kind of powers? Beyond those of druidic nature?
603;MATT;"""""These were the magics taken by man who defied the gods. These were the purest of ancient arcane threads. We watched as she reached out and tore open the Gate. She laughed as we called out to stop. But something terrible emerged from that wounded sky."""""
604;MARISHA;Thordak?
605;MATT;"""""This dragon you speak of, yes. I defended all that I could, but the power was too great, and unconsciousness took me. I awoke to my people in tatters, the fires untethered, and this terrible girl gone. It is both embarrassing and greatly alarming that we could be infiltrated by such an entity. That blame falls on me, as the headmaster, for not seeing this earlier."""""
606;MARISHA;You acted within the good nature of our people, there's nothing wrong with that. How old was this girl when she came to you? And how old is she now?
607;MATT;"""""When she came to us she couldn't be more than 15."""""
608;MARISHA;So she's 19, 20?
609;MATT;"""""Perhaps. She did not seem to blossom into womanhood as many do. We considered her more of a runt of her litter, if you will."""""
610;MARISHA;And what was her race?
611;MATT;"""""She seemed human."""""
612;MARISHA;She seemed human? What do you mean?
613;MATT;"""""We take many forms as druids. If she was indeed human, at that age, to command such power...|I do not know her true nature."""""
614;MARISHA;What was her name?
615;MATT;"""""Her name was Raishan. Anyway. I wish to tell you this because my heart is heavy with guilt, and I want you to know that even in places of comfort, family, be careful, keep those you know you can trust close. Be mindful of those that promise aid when they have not proven themselves.|If you have an instinct, follow it."""""
616;MARISHA;Are you referring to something in particular, Cerkonos?
617;MATT;"""""I just do not wish you to make the same mistake I did. Anyway, I thank you for your companions and you coming to our aid. It shall not be forgotten."""""
618;MARISHA;I shall keep an ear open for the name Raishan. If I hear anything about her, I'll send word.
619;MATT;"""""Should you need the aid of the Pyrah, though we are not much at now, come find me. I look forward for to you bringing Zephrah together.|You will make a fine leader."""""
620;MARISHA;Thank you, Cerkonos. And I'm glad that you're still with us.
621;MATT;"""""Kaitiaki, Keyleth."""""
622;MARISHA;Kaitiaki, Cerkonos.
623;MATT;Cerkonos leaves.
624;MARISHA;And I start poring through my notes for the name Raishan, because Keyleth believes she has heard that name before as one of the dragons, correct? One of the white--
625;LAURA;(whispering) It's the green one.
626;MARISHA;--the green one. Okay, okay.
627;MATT;That is true.
628;MARISHA;Do I have any other reference, would I know anything else about that?
629;MATT;That's all you know, is the name Raishan was used when the Conclave attacked Emon.|And it seemed the name belonged to the green dragon that initiated the assault where you guys were.
630;MARISHA;Fucking bitch.
631;MATT;So, these thoughts echoing through your mind--
632;TALIESIN;Streets will run green with revenge!
633;MARISHA;Yes, they will!
