;Player_Name;Transcription_Text
685;MATT;"""""I'm not going to leave the city right now to go find-- Look, I have two people I know that might be able to get what you need. But it's going to take time."""""
686;SAM;(sighs) I don't have time. (sighs)
687;MATT;"""""When did you pick up this habit?! I'm worried about you now, Scanlan."""""
688;SAM;I haven't picked it up. I'm trying to pick it up, damn it! It's the most difficult habit to pick up! Listen, can I confide in you, man to man, one on one, here?
689;MATT;"""""Certainly."""""
690;SAM;You're a fighter, you're a strapping young battle man, aren't you?
691;MATT;"(chuckles) """"I have been told this once or twice, yes."""""
692;SAM;I haven't felt myself recently. You know, we have these fights and some of them are pretty epic and there's monsters involved and I'm usually on my game, but lately I'm feeling a little off! How do you cope with that?
693;MATT;"""""Well largely by not using illicit substances?!"""""
694;SAM;Don't judge! Don't judge.
695;MATT;"""""I'm not judging! I'm worried about you. Like, if you don't even have a habit, why would you look for this? The Scanlan I knew, the one that hired me, he knew how to deal with this issue.|He got laid."""""
696;SAM;I don't really do that much anymore.
697;MATT;"""""Maybe that's why you're not feeling up to the task?"""" (laughs)"
698;SAM;That is a very fair point, Jarett.
699;MATT;"""""I'm just saying. Look, and I do not mean to talk out of turn."""" He sets his meal aside. """"But you are a man who walks, driven by his pelvis. Am I wrong?"""""
700;SAM;You're not wrong.
701;MATT;"""""Then what happens if the pelvis goes unused? Grows bashful?"""""
702;TRAVIS;Preach.
703;SAM;Like a fine instrument, it can go untuned. If you leave a fine violin without playing it for many years, it could wither and rot until you need to replace some of the parts. In a way, the same is true for my member. But the problem here, Jarett, is that I'm distracted. I'm distracted by things that haven't ever distracted me before. I've made a promise to someone to stay alive. I've never valued my own life before and when we get into the shit, I'm second-guessing things. I'm making stupid decisions that I wouldn't have otherwise made.
704;MATT;"""""Because suddenly you have purpose. Because you have a reason to come back."""""
705;SAM;Yes.
706;MATT;"""""That's not a bad thing, then."""""
707;SAM;I don't know how to harness that kind of stress.
708;MATT;"""""Do you have a keepsake of this reason to return, this person you made a promise to?"""""
709;SAM;Do I have a keepsake? I don't think so.
710;MATT;"""""Then you need to get yourself a keepsake!"""""
711;SAM;Well she's not around right now to get a keepsake from.
712;MATT;"""""Then something else that reminds you of her. Something that you can look at in that moment when you're not so sure."""""
713;SAM;How did you get so wise, Jarett?
714;MATT;"""""Drink a lot, listen to people talk. There are none wiser than barkeeps, my friend, and I have been friends with many a barkeep."""""
715;SAM;These are all good suggestions. But I'm a man of instinct, and my instincts said I need to supplement my body with some extra liquid courage.|So if you can please continue to look for me.
716;MATT;"""""I will continue searching and providing what you require."""""
717;SAM;I've heard that it can help people in moments of panic and stress.
718;MATT;"""""And I've watched it ruin lives near K'Tawl Swamp!"""""
719;SAM;I can handle a lot of things.
720;MATT;"""""You are a strange gnome."""""
721;SAM;Takes one to know one?
722;MATT;"""""Does not work in this circumstance but I applaud your attempt. It was good. I'll do what I can. But don't forget you have more than one reason to stick around."""""
723;SAM;I know. That's what worries me. I'll think about what you said. Maybe I'll go have a toss, see if that helps, too.
724;MATT;"""""Here, tell you what. Come here."""""
725;SAM;Yes?
726;MATT;"And he suckerpunches you in the face. You unexpectedly fall back. You feel the pulsing of the blood run to your cheek. Your eyesight goes white for a second. He goes, """"See, now you have to live to return the favor."""""
727;SAM;You! That was clever. I will definitely get you back.
728;MATT;"""""Good. I look forward to it."""""
729;SAM;Watch your back.
730;MATT;"""""I always do."""""
731;SAM;Get me some drugs!
732;MATT;Awesome. Grog.
733;TRAVIS;It's daytime, right?
734;MATT;Yeah, it's early morning.
735;TRAVIS;Is there a way I can find a courtyard or an open-air area?
736;MATT;There are a couple of courtyards within the perimeter walls of the castle. They have some small garden elements.
737;TRAVIS;If I get there, are there a lot of guards keeping an eye?
738;MATT;Not within the courtyard, no. Occasionally, there'll be one patrolling.
739;TRAVIS;Can I pee in the courtyard?
740;MATT;By all means!
741;TRAVIS;"I feel like I need to mark my territory.|This is home for us, and I peed all over Greyskull Keep. I left little puddles that y'all didn't know about. It's real important in case other goliaths come around and are like, (sniff) """"Nope, the wolf's here. I got to go elsewhere."""""
742;TALIESIN;I assumed it was shoddy masonry and everything was leaking.
743;TRAVIS;No, stealth roll, motherfucker. Can I take a leak on a wall in the courtyard?
744;MATT;Yeah and there are a number of walls to choose from: varying heights, different levels of masonry. You have the veritable pick of the litter.
745;TRAVIS;Can I find the highest wall with the most ornate decoration on it and go slightly off left? The way me member goes and make a little box right there? A little waterfall on the whitestone.
746;MATT;Certainly. You find the portion where the exterior wall has one little parapet-joining portion with the exterior of the castle itself.|There, you can see the masonry is fine, the stones themselves are clean-cut and joined properly.|There isn't a whole lot in the way of ornate craftsmanship on the exterior of the castle or the walls, but you feel, as far as your interest, Grog, this is a good wall.
747;TRAVIS;Very nice.
748;MATT;You mark your territory expertly.
749;TRAVIS;In a wide, arcing pattern, not like the one shot, like a nice, upside-down crown.
750;MATT;There you go, like a Cylon eyebeam. Yeah, totally. You do so with gusto. Congratulations.
751;TRAVIS;Thank you. Home.
752;MATT;That's how Grog spells home.
753;MARISHA;Stellar RP.
754;TRAVIS;How else do you spell home?
755;MATT;Unless there's anything else that needs to be done--
756;LIAM;I'm not done with my errands. Can I go find Kynan?
757;MATT;You can. Kynan, who is currently under the watch of Jarett at the moment, is asleep. You start walking towards the direction as Scanlan is leaving the exterior of the barrack training grounds.
758;LIAM;Hey, buddy.
759;SAM;Hi.
760;LIAM;You look a little rough. You all right?
761;SAM;I'm fine. One of our employees punched me in the face.
762;LIAM;Which one?
763;SAM;You don't want to know. It wasn't the cooking cook.
764;LIAM;You look really tense. You look out of character.
765;SAM;(growls)
766;LIAM;Oh dear. Head back. We're going to have that meeting soon. Get your game face on, yeah?
767;SAM;I will. I'll wash my face. Get to it.
768;LIAM;All right.
769;SAM;How are you doing?
770;LIAM;I'm good.
771;SAM;Yeah?
772;LIAM;Best I've been in a while.
773;SAM;That's good to hear. It's been a while since we had one of our depressing chats. You seem a little more chipper these days. Coming around to my perspective, are you?
774;LIAM;Can I make an insight check?
775;MATT;Yeah, make an insight check.
776;LIAM;Seems full of shit to me. I'm going to use luck. I've got it.
777;TRAVIS;That's your second luck!
778;LIAM;Who cares? This is a game. I'm with my friends. I'm having fun. That is an 18.
779;MATT;18. Are you deceiving him any?
780;SAM;No! Not at all.
781;LIAM;But does he seem confident and happy is what I wanted to know.
782;MATT;As much as he would in the given situation, yeah.
783;LIAM;All right. (sighs) I'm happy. I'm in love.
784;SAM;Really?
785;LIAM;Yeah.
786;SAM;Do I know the fella?
787;LIAM;Yeah. I'll tell you later, all right?
788;SAM;I want to hear details! Dirty, dirty details! Sweaty details!
789;LIAM;Oh, he is so hung. Unbelievably hung.
790;MARISHA;So much dick talk!
791;LIAM;I'll tell you later. I have to run an errand. We have to get to this fucking meeting, yeah?
792;SAM;Oh yeah. I'll see you there. Game face on.
793;MARISHA;Is this how they talk themselves up?
794;TRAVIS;Yeah, don't women talk about their vaginas?
795;LIAM;I'm talking about your goddamn antlers.|Jeepers. Off I go.
796;SAM;Locker room talk.
797;LAURA;Oh.|(laughter)
798;LIAM;(yells) No!
799;MATT;"The campaign is over. Whitestone burns in flames. You make your way there. Jarett, you can see, finishing a meal. Looks over to you. There's nobody else in the training area. It's still relatively early. You do, with your perception, see back on the main stone building, you see a few individuals walking back and forth in front of one of the windows. It looks like things are starting up over there for training for the day. Jarett finishes his meal, scarfs up the last bit of egg on the side of the plate, """"Hey!"""""
800;LIAM;Jarett!
801;MATT;"""""Yes!"""""
802;LIAM;Hey, I don't want to interrupt. Kynan, the new guy. Is he around?
803;MATT;"""""Probably inside, sleeping or waking."""""
804;LIAM;Okay if I go in?
805;MATT;"""""Sure. This way."""""
806;LIAM;Just be a minute.
807;MATT;"""""Sure, go for it."""" He sits back down. You head inside. The door's not locked. You open it.|You see ten different individuals that are all in the process of waking up. You can smell coffee.|Very basic breakfast meats being cooked. Some of them are around tables talking, hunched forward and laughing. As soon as you walk in, a few of them turn and look at you. Some don't recognize you, some do. You see, in the far corner sitting alone at one of the tables is Kynan, who is prison-style guarding his food and eating by himself."
808;LIAM;Right towards him. Hey.
809;MATT;"""""Hello."""""
810;LIAM;How are you fitting in?
811;MATT;"""""All right. Everyone here's been fine."""""
812;LIAM;You hanging back?
813;MATT;"""""I mean, as much as I need to. This is still a lot. Jarett's been good. He's been watching."""""
814;LIAM;He's a good man. Yeah, I get it. We killed another dragon.
815;MATT;"""""That-- wow."""""
816;LIAM;Yeah. I don't want you to question your decision here, all right?
817;MATT;"""""No, I mean-- I don't have anything else right now really. So, what's the question?"""""
818;LIAM;There's no question. But if you could, I have two favors I want to ask.
819;MATT;"""""Okay."""""
820;LIAM;First one is, after I leave here today, could you embrace these people?
821;MATT;"""""Yeah, I'm trying."""""
822;LIAM;Yeah, I know, and I know you have reservations, and I know that you've got guilt.|When I walk out of here, I want you to work on letting go of that. For real! Leap of faith kind of shit. Just let go of it.
823;MATT;"(sighs) """"Well, I'll do my best."""""
824;LIAM;I know. Scratch that, three favors.
825;MATT;"He looks down a little bit for a second seeming like """"oh boy."""""
826;LIAM;Yeah, I know I'm a handful. The second one, I don't even need for you to say anything about this, but you know the white-haired guy I travel with?
827;MATT;"""""Yeah."""""
828;LIAM;Yeah. He's got a sister, and I don't want you to do anything other than keep an eye on her and keep her safe.
829;MATT;"""""Okay?"""""
830;LIAM;"We're going into the lion's den. Soon, I think. And we'll probably come out of it, but just in case. She's got a lot on her shoulders; you know that. So just keep an eye on her. That's it.|All right?"
831;MATT;"""""All right."""""
832;LIAM;And the last thing. You've got those knives I gave you, right?
833;MATT;"""""Yeah."""""
834;LIAM;Yeah, hold onto them. I trust you. I need you to watch after one last thing thing for me, all right? It's very important. I wake up Simon, and I let him crawl down my arm. Do you see this guy?
835;MATT;"""""Yeah."""""
836;LIAM;He's been with me through a lot, and I don't want him at the bottom of a ditch.
837;MATT;"""""Are you sure?"""""
838;LIAM;I have never been more sure of anything in my life. I want you to have him, and I want you to take care of him.
839;MATT;"""""I'll do that. It'll be done. I promise."""""
840;LIAM;Kynan, I need you to believe in second chances.
841;MATT;"""""It's all I have to keep me going right now."""" He reaches his hand up towards the snake, and Simon leaps from from your hand to his and swirls down his arm. He looks confused for a second as it wraps around his waist and then forms into the shape of a belt. You now see a few other guys in the room, and the room's got a little bit quieter. They're all watching what's happening, """"What's going on?"""" He notices the attention and, """"I'll take good care of him."""""
842;LIAM;I believe you.
843;MATT;"""""I mean no offense. It's a lot of attention right now."""""
844;LIAM;I give a slap on his cheek. Remember everything I said, all right?
845;MATT;"""""Yeah, I will."""""
846;LIAM;You're a good kid. (whack)
847;MATT;"(soft chuckle) """"Same temple."""""
848;LIAM;I'll see you later, all right?
849;MATT;"""""Yeah. Definitely."""" And you head out. Okay.|At this point in time, a number of pages have been sent throughout the city to gather those who've been wandering about Whitestone, as you are being called to the meeting in the second floor war room held within the castle itself."
850;MARISHA;Second floor?
851;MATT;Same one where you met with--
852;MARISHA;Asum? That'll do. All right.
853;TALIESIN;Be ready for anything.
854;TRAVIS;Let's go Krogering! The best of everything!
855;MARISHA;Before we walk in, I grab Grog. How do you do it?
856;TRAVIS;Do what?
857;MARISHA;You're able to utilize your rage when necessary. How do you keep it suppressed when it's not needed?
858;TRAVIS;Ah. Well, good question.
859;MARISHA;Please enlighten me, Professor Grog.
860;TRAVIS;Right. It all comes down to one word, really. (clears throat) Family. Right, before I was a part of this group, I had no family. Pike took me in, I met all of you. And I had a purpose.|So before that, I would be down to fuck anything up, anytime, no problem. I still kind of am. But I realized that if I fly off the handle too soon, it screws over my family. That's no good, because I care about you. Most of you.|(laughter)|You're going to get yours. It's coming.|And I'm going to help you. And I'm going to high five you when it's done. But until then, you keep that shit tucked inside. Let it build. And then when the time is right, you let her have it. And I'll throw you into the fray, when the time is right.
861;MARISHA;Promise?
862;TRAVIS;Yeah, I promise.
863;MARISHA;Deal.
864;TRAVIS;Deal.|(cracking noise) (laughter)
865;MARISHA;Ow! Ow, Grog! Grog!
866;TRAVIS;Oh shit, sorry! I'm so sorry!
867;MARISHA;No, it's fine. I appreciate it. It's good.
868;TRAVIS;Oh, yeah. Bruises, right?
869;LIAM;She should really take one hit point of damage.|(laughter)
870;MATT;Sure, you take a hit point of damage.
871;MARISHA;Oh man, people are going to ask questions about that later.
872;TRAVIS;No, it's cool. You make up a really good story.
873;MARISHA;Sure. Yeah.
874;TRAVIS;But listen. If at any time it gets to be too much, you just go. We've got you.
875;MARISHA;Okay. I don't want to let you guys down.
876;TRAVIS;You won't.
877;MARISHA;Thanks, Grog. Okay. (clears throat) Let's do this.
878;MATT;"All right. You guys enter the war room, same as it was previously left. However, you are brought the image of the table in early morning: Allura, Gilmore, surprisingly, Drake Thunderbrand, Cassandra, as well as Asum, who's standing behind most of them, back to the window. They all, middle of conversation, turn, and smile as you begin to walk in. You see Gilmore nods to everybody. Gives an extra smile to you, Vax. Cassandra's waiting for the pleasantries to end. Allura comes up and takes your hand, and she goes, """"It's wonderful to see that you've returned safely. I've had many terrible thoughts that perhaps this meeting would not be as positive, and I'm very glad to know that I was wrong. And that you brought Kima back to us as well. Pike is safe as well. So congratulations, I guess, are in order. Come, sit. These circumstances do press our timeline a bit."""" And you see there are a number of other chairs already brought into the room, prepared for you guys to sit around together."
879;MARISHA;Is there anyone sitting next to Raishan?
880;MATT;No, actually.
881;MARISHA;I sit next to Raishan.
882;MATT;Raishan is not sitting. Raishan is standing with her arms crossed, leaning against the window.
883;LAURA;I want to stay standing as well.
884;MARISHA;Yeah, I move closer to Raishan.
885;MATT;Okay. As you approach, you see Asum's eyes watch you. Small grin on the face, and a little nod.
886;MARISHA;I give a nod back.
887;TALIESIN;I pull a chair out for Asum, and I'm going to offer him the chair and sit. And pull one out extra for myself.
888;MATT;"At which point Cassandra gathers all of your attention in the midst of this chaos. """"The excursion to Wildemount went well. As far as I understand, you are now one more dragon-slaying into this chaotic endeavor. Well done. Tell me, how did this happen?"""""
889;TALIESIN;A deal was made with the locals. We brought the dragon to an appointed kill spot outside of the city. We summoned a creature.
890;LAURA;With the Gate scroll that we showed you, actually.
891;TALIESIN;There was a battle. And we felled it.|That was more or less how it went down. It was a simple trap, it was elegant, and we barely survived.
892;MARISHA;I pull out the Spire of Conflux and hand it to her. We retrieved this in our spoils. You may recognize it as one of the Vestiges that we spoke of earlier.
893;MATT;"Cassandra takes it and says, """"It looks quite important. Allura."""""
894;MARISHA;Yes, I thought I was handing it to Allura.|(laughter)|Sorry. It was meant for Allura.
895;MATT;I can see how this would be confusing.
896;MARISHA;Yes.
897;SAM;You look just like Allura right now.
898;LAURA;Allura, is everything okay? Have you been through some shit, Allura?
899;MATT;"""""It's been a rough week."""" (laughter)|I almost did Allura, too. Next Halloween."
900;LIAM;Vax is leaning against the door to this chamber, by the way.
901;MATT;"All right. Allura takes it, inspects it.|""""This is a magnificent artifact. Well found.|Perhaps we'll take a look at it after the meeting together."""""
902;MARISHA;Sure.
903;MATT;"Cassandra gets everyone's attention once more, motions to the guards. The door that you're leaning by gets closed as the guards step out, so it's only you guys having this conversation. """"So, with another of the Conclave fallen, retaliation is imminent. And with Thordak already infuriated at the death of Umbrasyl, and we only caught but a glance of that anger, thankfully through the means of which Allura and Gilmore and others were able to cloak the city, I do not feel that will last the entirety of the time we would need to take a leisurely stroll through our next series of plans.|I fear that less protected cities may be in the path of retaliation before it finds its way to us."""" Allura speaks up at this point and goes, """"Thordak is a creature of infinite pride. And a slight such as this against the Conclave will most likely trigger the destruction of even more innocents. Both to satiate his anger and, I'm certain, to also draw us out. He is an intelligent one, as is the company he keeps. I've also reached out to other members of the Arcana Pansophical, and hope that they would come to our aid, but given the recent death of Vorugal, I do not know if they'll arrive in time to be of any assistance.|So we have to begin to gather our strengths, our allies. And honestly, I think we need to strike first."""""
904;TRAVIS;You do?
905;MATT;"""""Well, otherwise we wait for the fight to be on Thordak's turf."""""
906;TRAVIS;That's unexpected.
907;LAURA;Just pop on over to Emon, then?
908;MATT;"""""Well, we need a plan first. We need to gather those we've called to arms. We need to assess what strengths we have, and utilizing all of these things at our disposal, come up with an idea of how we're actually going to do this."""" Gilmore steps in and goes, """"If we are to strike, I agree it should also be very soon. We've pushed the boundaries of being on his peripheral even this long. And you say that he knows your faces, correct?"""""
909;TALIESIN;Yes.
910;MATT;"""""His gaze will now surely fall upon the seven of you, at the very least."""""
911;TALIESIN;It was inevitable.
912;MATT;"Asum steps forward at this point, from the wall, and begins to walk in front of you, Keyleth, and between Percy, """"The longer he remains as well, the more the landscape of Emon and the surrounding Bladeshimmer Shoreline begins to churn. Begins to boil with flame and toxic fume. He is scarring the surrounding land with his claws, his teeth, his flames, his roar, and those that follow in his shadow. His fearmongering has risen a number under him. A creature of such pride is eager to show that if you fall in such fear and do as he says, there are rewards. I'm sure you've come across many weak-willed individuals in your travels that would be eager to jump at the chance of working beneath such a powerful and dangerous creature."""" Allura steps in at this point now and says, """"Now I believe it is partially his essence, but the expedited rate of this elemental transition around him is based on the soul anchor that we embedded within him to keep him in the Fire Elemental Plane. This stone that resides in the center of his chest and belly. I believe this stone is somehow drawing elements of the essence of the Fire Elemental Plane itself into Emon. I mean, it's not unusual for the presence of a red dragon over hundreds of years to begin to convert the scenery around, but this speed... I can only see a connection between the enchantment that we hoped would hold Thordak at bay, and the changes we're seeing at the center of Emon and beyond. Now, it was never intended for him to leave that place, and I feel deeply responsible for many elements of the danger we now see in this world. I only know that I will do whatever it takes on my end to see that this comes to an end. Whatever sacrifice, whatever is necessary. I'm at your disposal. But the responsibility of the destruction is also our own. The longer we take, the more chance he will tear through Kymal. He will tear through Westruun.|He will tear through Daxio. He will begin to burn everything that Tal'Dorei is, until we show our faces."""""
913;LIAM;I am curious what the Master of Secrets thinks. Asum?
914;MATT;Asum is still walking a circle around the table.
915;LIAM;What do you propose we do?
916;MATT;"""""Hmph. Well, before we get to that, let us discuss things we have at our disposal, the information we have, and from that, we can garnish a plan. I am the Master of Secrets; I am not a Master of Warmongering and Attack."""""
917;TALIESIN;I get up, I walk to the window, and I look out the window. We're not going to be safe here for much longer, that much is certain. We will need to move quickly.
918;MATT;"Drake speaks up for the first time and goes, """"Aye, not to mention that slippery green drake is still out there somewhere, and we have no idea where it is. Two members of the Conclave are remaining."""""
919;TRAVIS;Well-- Ow! Right, yeah. Two.
920;TALIESIN;Do you think perhaps it's best to skip one and hope for the element of surprise? Maybe he thinks we're going to finish off his generals before we come to him. It may be a brief moment of surprise. If anything, maybe he's expecting us to kill one more, not go for the main prize.
921;LIAM;Cut off the head of the king?
922;TALIESIN;Maybe.
923;SAM;Thordak, from what I understand, is extremely powerful and influential. That Raishan dragon is a mere pittance in comparison. A small, exponential ant, a pawn, if you will, on the battlefield.
924;MATT;"""""I certainly hope so. And if that's the case, then I think you're right. Go for the king first. But we must do so with eyes all about us because the last thing we need is to be flanked by that beast in the center of our attack."""""
925;MARISHA;Exactly. We don't want to deal with two ancient dragons.
926;TALIESIN;Can we lure it somewhere else, perhaps?
927;MATT;"""""If we knew where it fucking was."""" Allura speaks up at this point and goes, """"Look. I know that Thordak's hate for me still burns, hence the reason why they went directly for my tower when they first arrived in Emon. The one trump card we do have in this is me."""""
928;LAURA;Do you want to offer yourself as bait?
929;MATT;"""""If need be. I'm not saying that's the right plan, but I'm saying it is one thing we can perhaps utilize in our plan, in our strategy."""""
930;TRAVIS;Is his hate for you?
931;TALIESIN;I think-- There was a ship in Draconia, a northern ship of some kind. I still feel there may be some sort of weapon inside it that may prove useful. It was a ship that had been dragged there by the white dragon. It's been bothering me. And then of course we have whatever it is we have downstairs. I'm not saying we should use it, but it is powerful.
932;LAURA;I don't know how we would use it.
933;TRAVIS;We can't move it, can we?
934;LAURA;We can't touch it.
935;MATT;"Gilmore pops up again and says, """"Exactly. We were poring over that thing for a number of weeks, until we had to build this barrier. And to be perfectly honest, I am sick of it."""""
936;LIAM;You've got nothing?
937;MATT;"""""Well, we understand it's a siphon. It's bringing the energy of the nexus somewhere. We don't know where the other end of it is. Or if it's even functioning properly."""""
