;Player_Name;Transcription_Text
2386;MATT;All right, you guys make your way up the rope ladders.
2387;MATT;This is indeed the ship that you made across, although it has a new paint job on it.
2388;MATT;It looks a little bit nicer, but it also seems to have seen some disuse.
2389;MATT;You make your way onto the board and there you can see familiar ship hands that go around, nodding to you out of recognition.
2390;MATT;Some of them are pulling up the rope ladders behind you.
2391;MATT;You see two on the bottom there are now unchaining from the edge of where it's latched onto the side of the ship, on each side, that keeps it latched into the skyport.
2392;MATT;And Captain Damon comes up to the top to greet you.
2393;MATT;Very well.
2394;MATT;I see that you've come to begin the journey.
2395;MATT;Well, it is a pleasure to see you all again, safe and sound, although you are missing one.
2396;MATT;Two, actually.
2397;TALIESIN;Yes, we're a bit thinner.
2398;TALIESIN;It has been difficult and we have friends elsewhere preparing for more difficult times.
2399;TALIESIN;Are you aware of what's going on across the sea?
2400;MATT;I'm very aware.
2401;MATT;That was the guild that owned the ship and ran our business disappeared in the attack, and we've been set adrift, making our own money and making ends meet in the meantime, doing odd jobs here and there.
2402;TALIESIN;Well, if you're interested, we are definitely moving towards correcting some of these problems.
2403;TALIESIN;Quickly.
2404;MATT;If you do, tell the guild that the ship crashed, because as of right now it's technically my ship.
2405;TALIESIN;Is this an insurance thing?
2406;MATT;I didn't-- the guild owned and ran the shipping business, but I mean--
2407;TALIESIN;Oh no.
2408;TALIESIN;Yes, I'm a deep believer in insurance fraud.
2409;TALIESIN;Of course.
2410;MATT;It's not-- (sighs)
2411;LIAM;We're friends here.
2412;LIAM;You're good.
2413;MATT;I'd like to know where we're going.
2414;MATT;As that is part of the deal to be kept secret until boarding.
2415;TRAVIS;Actually, if you don't mind, we're heading north.
2416;TRAVIS;Once we're away from port, we plan to inform you of our destination.
2417;TALIESIN;Tomorrow.
2418;MATT;North it is.
2419;MATT;Very well.
2420;MATT;And he pulls a whistle from around his neck and blows it really loudly and everyone unleashes the chains from the side.
2421;MATT;(clanking sound) They crash down, slamming onto the terrace deck below.
2422;MATT;The ship lurches and lifts up a few feet naturally and finding its own balance, based on the enchantment of the crystals.
2423;MATT;You can stay on the edge if you'd like.
2424;MATT;You're welcome to find your quarters down below.
2425;MATT;But we are about to make sail.
2426;MATT;He walks to the edge of the ship, the middle of the ship, the back where you can see he directs the position of it, and controls the crystals themselves.
2427;MATT;And the giant dragon-headed arbalist you see installed at the side.
2428;MATT;They're like the giant heavy crossbows that are bolted onto the side, these large spears-- the ones you were using in the fight before, they're nearly twice the size of what they were, and the front of them have this giant dark metal dragon head that is built around it.
2429;MATT;It's been definitely fitted to be a much more badass airship than you remember.
2430;MATT;It lifts up, and as the last bit of the sun disappears below the distant horizon and the city of Ank'Harel's lighting up for the evening time, you take up into the sky, slowly turning northward towards what you can see as barely visible, the silhouetted edge of the mountain range before you, the Agrad Mountains, making your way to the rest of your journey.
2431;MATT;"And we're going to go ahead and take a break; we'll come back here in just a minute."
2432;TRAVIS;One thing before we do: we forgot to mention that next week during Game the Game, thanks to Magic Puzzle Quest, Matt and Marisha, Taliesin, Liam, and myself will be joining Ivan and Becca for Game the Game, from 5:30 to 6:30, so make sure you tune in.
2433;TRAVIS;It's going to be a very special Game the Game.
2434;TRAVIS;Thank you, Magic Puzzle Quest.
2435;LAURA;Also thank you Backblaze!
2436;MATT;All right guys, we'll see you in a few minutes.
2437;MATT;Thank you, Travis.
2438;MATT;[break] Hello, and welcome back to Critical Role.
2439;MATT;So as we left off, Vox Machina is--
2440;LAURA;Wait, before we do that!
2441;LAURA;We forgot to mention at the top of the show.
2442;LAURA;There's only one week of preorder left on the bracelets and the pins.
2443;TRAVIS;Yeah, we wouldn't want people to miss out.
2444;TRAVIS;It's limited run.
2445;TALIESIN;I don't have a bracelet, but I have the pins.
2446;LAURA;He's wearing the bracelet.
2447;SAM;Laura, I did mention that while you were getting whispered to.
2448;LAURA;I know, you did.
2449;LAURA;I heard you, but, you know.
2450;LAURA;In case people were drowning you out.
2451;LAURA;And then we also have the limited items, which we only have a little bit left in the store: the nail wraps, and the patches that were limited edition at Comic-Con that are still there.
2452;LAURA;I think, still in the store?
2453;LAURA;So yeah.
2454;TALIESIN;Were the rings up in there?
2455;LAURA;The rings!
2456;LAURA;And the rings, the spinning rings.
2457;TALIESIN;Did they come back in?
2458;TRAVIS;And the mug, which is my favorite.
2459;TRAVIS;Okay, now we're good.
2460;LAURA;Okay, sorry.
2461;MATT;All right, no worries.
2462;MATT;Thank you for mentioning that.
2463;MATT;Vox Machina, as night has taken the sky and you lift up, heading northward, you watch as the glowing jewel of Ank'Harel begins to slowly grow smaller and smaller in the distance.
2464;MATT;Below you, you see a mass of black darkness.
2465;MARISHA;I want to take Percy to the front of the ship.
2466;TALIESIN;Ah!
2467;TALIESIN;That's my--
2468;MARISHA;Set it down.
2469;TALIESIN;I'll put it down, okay.
2470;MARISHA;And I want to--
2471;TALIESIN;(whispers) I feel so dirty.
2472;MARISHA;(whispers) Say you can fly.
2473;TALIESIN;No.
2474;MARISHA;Say you can fly.
2475;TALIESIN;No, because I'm not going to say that-- It's not true.
2476;TALIESIN;It's not true.
2477;MARISHA;Say you're flying.
2478;TALIESIN;I feel sick.
2479;MARISHA;(laughs) Damn it.
2480;LAURA;Don't throw up again.
2481;LIAM;While they're doing that, I'm actually flying next to the ship and praying for a while out in the dark.
2482;MATT;Okay.
2483;MATT;So yeah.
2484;MATT;You have very little idea of where you are other than watching the city slowly disappear.
2485;MATT;Above, as you look towards the front of the ship, where it's going, you can see little specks of light in the distance, almost like smaller cities or villages that slowly begin to move past and below you.
2486;MATT;And the stars in the sky breaking through some of the clouds that occasionally block as you progress.
2487;MATT;As the ship begins to rise about cloud level, you can see the very faint outline of the mountain range, and you then coast above it.
2488;MATT;As you begin to finally crest over the top of the mountain range itself, Captain Damon locks the ship steering mechanism in place and walks back to address all of you, and goes, All right, we're well on our way.
2489;MATT;We're heading north.
2490;MATT;We've been travelling for a number of hours now.
2491;MATT;Where are we going?
2492;TALIESIN;Before--
2493;MATT;(sighs)
2494;TALIESIN;I swear this is important.
2495;TALIESIN;Before we say anything, we would like to take a moment to meet the rest of the crew.
2496;TRAVIS;Yes, and all hands on deck.
2497;TALIESIN;To make sure that nobody suspicious has snuck on board and nobody is hiding their identity.
2498;MATT;Very well.
2499;MATT;He gathers the rest of the crew.
2500;MATT;You recognize a few of them.
2501;MATT;They have a few new faces, because they lost a few on the last journey.
2502;MATT;You individually meet each one with pretty heavy inspection from you guys.
2503;MATT;I want you to make insight checks, all of you, as you're inspecting this crew.
2504;TALIESIN;No!
2505;SAM;15.
2506;TRAVIS;19.
2507;LAURA;22.
2508;LIAM;15.
2509;MATT;All right.
2510;MATT;Glancing about, mostly human crew.
2511;MATT;There is one elf, a female, who's part of the crew, who handles most direct navigation with the captain now, and you hadn't met before.
2512;MATT;Her name is Julia, and she seems nice enough.
2513;MATT;There is a female halfling who has very nice, clean-cut hair, pulled into a heavy ponytail in the back.
2514;MATT;And as she smiles, you can see her somewhat broken and rotted teeth.
2515;MATT;As you guys give the whole look-over, she smiles and looks a little nervous at the rest of you.
2516;MATT;You take a closer look and you pick up on it, Vex.
2517;MATT;This is one of the bandits, the one you took captive on the journey over to Vasselheim.
2518;LAURA;The one that I harpooned!
2519;MATT;Yes.
2520;MATT;She apparently has become one of the crew now.
2521;LAURA;Wow.
2522;LAURA;Well, we vouched for her at the time.
2523;MARISHA;We wanted her, right?
2524;MARISHA;Are we cool?
2525;TRAVIS;She dies.
2526;TALIESIN;Good for you.
2527;TALIESIN;Excellent.
2528;MARISHA;What's her name?
2529;MARISHA;Did we ever get a name from her?
2530;MATT;Teela.
2531;ALL;Teela.
2532;MATT;Teera, sorry.
2533;MATT;R. Teera.
2534;MATT;I had it written down.
2535;MATT;I should look at my sheet first.
2536;TALIESIN;And there's no magic attempts to hide somebody's face or anything like that?
2537;MATT;No.
2538;MATT;You guys all give a good look and a very thorough inspection of the crew, and they all seem legitimate.
2539;TALIESIN;And this is everybody?
2540;MATT;Yes.
2541;TRAVIS;Captain.
2542;MATT;Yes?
2543;TRAVIS;Who is it that's in charge of your seaworthy navigations?
2544;TRAVIS;The newest member of your crew you mentioned?
2545;MATT;Well, that would be Teera.
2546;MATT;She's actually been all about this ocean.
2547;MATT;Not necessarily by skyship, but she knows the area as well, and has since studied up and has become a very esteemed member of our crew.
2548;MATT;He looks to her, and Teera's smile broadens again.
2549;MATT;That is correct.
2550;MATT;I'm happy to help in wherever it is you're looking to go.
2551;MATT;Where are you going?
2552;SAM;Shall we lay it on them, then?
2553;SAM;We're going to go near the island of glass, aka Glintshore.
2554;MATT;You watch her face go, and Captain Damon goes, Why Glintshore?
2555;MATT;That place is a rocky waste.
2556;SAM;Well, we're not going there.
2557;SAM;We're going near it to find a shipwreck.
2558;MATT;Shipwreck?
2559;MATT;There's probably hundreds of them!
2560;MATT;The place is dotted with reefs.
2561;TALIESIN;We're looking for a ship called The Shrew.
2562;MATT;So you're wanting us to take you to the Hespet Archipelago.
2563;MARISHA;Yeah.
2564;TALIESIN;There is another ship on the way there, as well.
2565;TRAVIS;Some say arch-ipelago, but yeah.
2566;TALIESIN;There may be trouble.
2567;SAM;The other ship may already be there, and if we can find the other ship, then we've found our destination.
2568;MATT;Right.
2569;MATT;The arch-ipelago.
2570;MATT;Let's see.
2571;MATT;We have no sundry we're holding, so we're at maximum speed.
2572;MATT;I'd say two, maybe three days of travel, depending on weather.
2573;SAM;Just to get in the area.
2574;SAM;It'll take us another day or two to find this ship.
2575;TALIESIN;Well, not necessarily.
2576;TALIESIN;Every day we scry.
2577;TALIESIN;Every day we hone in.
2578;TALIESIN;We keep following where they're going.
2579;MARISHA;Ideally, she does the hard work for us.
2580;TRAVIS;It's worth noting as well that if we do find this ship, we do not mean her well.
2581;MATT;I can only assume, going to Hespet.
2582;MARISHA;You seem very familiar with this place.
2583;MARISHA;Do you have more information?
2584;LIAM;Or apprehension?
2585;MATT;Hespit is a-- the whole network of islands there is a haven for criminals, fugitives, pirates, and everyone else who generally keeps away from the large continents.
2586;MATT;So you go without guard, stay without threat, you're likely to be bent into slavery, or end up left bleeding somewhere on the shoreline.
2587;TRAVIS;Is that a promise?
2588;LAURA;We're super powerful.
2589;LIAM;You do the flying.
2590;LIAM;We'll do the fucking shit up.
2591;MATT;We'll have to come in low, most likely.
2592;MATT;I don't want to try and draw attention to this ship, because I'm sure it would fetch quite a penny if it were to fall into the hands of--
2593;TRAVIS;I'm sure Keyleth would provide you with some cover as well.
2594;MATT;Well, that would be very much appreciated.
2595;MARISHA;I could do that.
2596;MATT;Thankfully Glintshore itself is pretty much useless to most of their standards of business practices.
2597;MATT;It's mostly ignored by them, from what I know at least of what they do, but still, just to be safe and be careful.
2598;SAM;Has Teera been around there?
2599;SAM;Does she know anything of that particular shipwreck?
2600;MATT;He's about to talk and Teera pipes up, I do, actually, and I will be guiding us directly to it, so don't worry.
2601;SAM;To the shipwreck?
2602;MATT;Not to the shipwreck, but to the Glintshore.
2603;SAM;Have you heard of that shipwreck?
2604;SAM;The Shrew?
2605;MATT;I have not.
2606;MATT;But there are plenty of shipwrecks in the area.
2607;MATT;I'm sure there's much to recover, if that's what you're looking for.
2608;LAURA;No, we'll stick with the Shrew.
2609;MATT;I'll take you where I can.
2610;TRAVIS;The island of glass, is it called that because of a glass production site?
2611;TRAVIS;(laughter)
2612;SAM;Yep.
2613;LAURA;Was that hard for you, Grog?
2614;TRAVIS;I hurt myself.
2615;MATT;Captain Damon says, I don't know the history, exactly, but at some point in time, something really bad happened.
2616;MATT;All the sand of the shores were fused into dark brown and black glass.
2617;MATT;It's a jagged landscape, leading all the way up to the mountain.
2618;MATT;The jungle is petrified and dead.
2619;MATT;It's not a welcoming place.
2620;MATT;I'm surprised why anyone would pay so much to go there.
2621;MATT;But I'm sure you have your reasons.
2622;MARISHA;Can I do a nature check to see if that sounds familiar?
2623;MATT;Sure.
2624;MARISHA;Beasts or something that would happen-- Heat, a lot of fucking heat.
2625;MARISHA;26.
2626;MATT;To fuse the beaches, or an island its entirety, would require such extreme, fierce heat.
2627;MATT;This is going through your mind as well, Percy, being a man who understands this science very well.
2628;MATT;Something very bad had to have happened here a long time ago on a very large scale to render an island pretty much covered in glass.
2629;LAURA;Do you think this is where they knocked Thordak down?
2630;LAURA;Didn't they fight Thordak in the ocean?
2631;MARISHA;That's what my thought was.
2632;MARISHA;Would a dragon's breath?
2633;MATT;A dragon's breath would fuse a small chunk of the beach here.
2634;MARISHA;What about if a bunch of sorcerers and magic users got together and made a big nuke?
2635;MATT;That's possible.
2636;MATT;Very little chance there would be any survivors.
2637;LIAM;Like a meteor or a comet from the sky.
2638;TALIESIN;Even a comet wouldn't be enough.
2639;TALIESIN;This is big.
2640;MARISHA;Keyteor.
2641;MATT;As you guys are having this conversation, he goes, The mountain still stands.
2642;MATT;The jungle still stands, though petrified and burnt.
2643;MATT;I know not the means that brought it to where it is, but it's been that way for as long as we have history on it.
2644;MATT;Long ago.
2645;MARISHA;How long ago was it?
2646;MATT;I'm assuming the Age of Arcanum if anything.
2647;TRAVIS;Right.
2648;TRAVIS;"You said we have quarters on this ship; do you mind if I sleep under the stars?"
2649;MATT;Be my guest.
2650;TRAVIS;Rocking.
2651;TRAVIS;Going to commune with nature in my own way.
2652;TRAVIS;Fart in the wind.
2653;TALIESIN;I'm going to be far away from that.
2654;TRAVIS;No one wants to join me?
2655;TRAVIS;Get all hippie up on the deck of the ship?
2656;LAURA;I'll do that!
2657;LAURA;I'll sleep out, and Trinket will want to do that as well.
2658;LIAM;I actually do, yeah.
2659;MATT;(bear noises)
2660;LAURA;Stars, Trinket.
2661;LAURA;Beautiful.
2662;LIAM;Speaking of heat, make with the bed farts, Trinket.
2663;LIAM;I get cold at night.
2664;SAM;Keyleth, make sure you learn your scrying spells for tomorrow.
2665;SAM;Do we still have that ball, the scry-ball?
2666;MATT;Yep.
2667;LAURA;We'll have two scrys tomorrow if you learn the spell.
2668;MARISHA;I could theoretically do three scrys tomorrow.
2669;MARISHA;I could theoretically do five scrys tomorrow.
2670;TRAVIS;I pay super close attention, but after we gave them the destination, did they tell us how long it would take?
2671;SAM;Two, three days.
2672;MATT;Depending on the weather.
2673;TRAVIS;What if we pass over the ship in the night?
2674;TALIESIN;Then we'll attack them in the night.
2675;SAM;How will we see them?
2676;SAM;Is there someone who stands watch at night?
2677;MARISHA;She knows where we're going, so she'll let us know if we get there?
2678;SAM;But we're looking for the boat, not the island.
2679;TALIESIN;The boat itself.
2680;TALIESIN;There's work that always needs to be done.
2681;TALIESIN;There'll be lights, unless they are hiding.
2682;LIAM;You can alert one of us if we come upon a ship in the night or day, correct?
2683;MATT;I have to sleep at some point as well.
2684;LIAM;Of course, but someone is awake?
2685;MATT;Deshall, who is my second in command, will take over while I'm sleeping.
2686;MATT;There will be someone here, along with a few hands, taking shifts as well at all times.
2687;MARISHA;I describe the ship to them from what I've seen.
2688;LAURA;But it's in the ocean, isn't it?
2689;LAURA;And we're very high above it?
2690;TRAVIS;Do we want to go lower?
2691;SAM;Yes.
2692;TRAVIS;How high off the deck, would you say?
2693;SAM;Off the sea?
2694;SAM;Three, maybe four feet?
2695;SAM;No.
2696;SAM;I don't know, couple hundred feet?
2697;SAM;You're the captain.
2698;MATT;We're okay for now.
2699;MATT;High is fine.
2700;MATT;But once we get close to the archipelago we'll want to make sure that we keep within 100 feet of the surface.
2701;MATT;I could take it into the ocean.
2702;MATT;This can work as a functional ship in the water.
2703;TRAVIS;Shut the hell up!
2704;TRAVIS;Well, we want to stay out, right now.
2705;MATT;Well then, you seem weary enough.
2706;MATT;You may have your rest, and rest assured that we'll be to your destination as soon as this ship can carry us.
2707;MATT;I'm going to rest myself.
2708;MATT;He goes down to his quarters and Deshall takes over, who is mid-thirties, grizzled, scruff on his chin, but put together well, hair parted to one side, not a man of many words.
2709;MATT;He takes over the helm and keeps it going through the night.
2710;MATT;You guys go ahead and rest for the evening?
2711;LIAM;I'm going to meditate for an hour before bed.
2712;TRAVIS;Could I take a shot of the sandkheg bottle?
2713;TRAVIS;I would like to slowly start building up an immunity.
2714;MATT;All righty.
2715;MATT;Make a constitution saving throw, Grog.
2716;LIAM;(Grog voice) Meaning I would like to get fucked up on a regular basis.
2717;TRAVIS;29.
2718;MATT;You drink it.
2719;MATT;You feel the sparkling numbness begin to spread across your throat.
2720;MATT;It's strange.
2721;MATT;It's weird.
2722;MATT;It's exhilarating.
2723;MATT;It triggers your adrenaline, and you almost go into a rage from the instinctual reaction of that sort of chemical release in your brain.
2724;MATT;You hold it in place, and you sit there a second and stare as it slowly goes down your system.
2725;MATT;You feel the warm, curling burn from inside your belly that fine alcohol gives you, that little shimmer of pins and needles down the back of your neck and your spine.
2726;MATT;Your vision begins to blur a little bit.
2727;MATT;It takes you a lot of alcohol to get trashed, but you're a little buzzed.
2728;TRAVIS;Sick.
2729;TRAVIS;Awesome.
2730;TRAVIS;Well played, sandkheg.
2731;TRAVIS;I go to sleep.
2732;MATT;With your nightcap, you are good to go.
2733;MATT;Looking under the stars, you finish your meditation.
2734;MATT;Everyone else, you go to rest fine.
2735;MATT;Throughout the evening you sleep.
2736;MATT;The last thing you see before you go to bed is the edge of the mountain range, late into the night, and a small sparkle in a crescent shape.
2737;MATT;You ask one of the hands to the side.
2738;MATT;He points over and says, The Bay of Gifts.
2739;MATT;This is the northern side where you see Shamal, the port city.
2740;MATT;That's the last little bastion of civilization of Marquet as it begins to approach from underneath as you all go to sleep.
2741;MATT;The continent is behind you.
2742;MARISHA;How many hours has it been?
2743;MATT;When you come to consciousness after the evening's rest--
2744;LAURA;I want to hold Fenthras in my hand and keep thinking about the things Saundor said.
2745;MATT;After a good eight hour rest for all of you to recover yourselves, hit points, everything, spells, you come to.
2746;MATT;The warmth of the sun is what kicks you into consciousness.
2747;MATT;It's been about 13 hours since you guys left.
2748;MATT;Eight hours of rest.
2749;MATT;You had five hours of travel northward until you began to reach the northern end of the continent on this skyship.
2750;TALIESIN;This might be the best sleep that we've gotten in months, at this point.
2751;TALIESIN;Like babies.
2752;SAM;Is it morning time?
2753;MATT;Yeah.
2754;SAM;You want to do that morning scry?
2755;MARISHA;Yeah, morning scry.
2756;TALIESIN;I'm going to sit down with a pen and paper, ready to write!
2757;MARISHA;Yeah, morning constitutional, here we come.
2758;MARISHA;Bust out whatever magazines they have nearby.
2759;MARISHA;Cup of coffee, first.
2760;MATT;All right.
2761;MATT;Using the same journal?
2762;TALIESIN;Let's use the gun now.
2763;TALIESIN;Let's go nuts.
2764;SAM;Now that it's been de-cursed, will that mess up--
2765;TALIESIN;It's got a lot of her work in it.
2766;MATT;All right, are you using the crystal first?
2767;MARISHA;Yeah.
2768;MARISHA;Crystal first.
2769;MATT;What's the crystal DC?
2770;MATT;Because it's not your actual spell, which I should have remembered last time.
2771;MATT;I mean, she rolled low enough last time that it wasn't an issue.
2772;MARISHA;It doesn't say.
2773;MATT;Okay, then it should be 15.
2774;MATT;That's a natural one.
2775;MATT;As you're concentrating on the scry spell, your vision once again is thrust through the clouds, thrown down over the ocean.
2776;MATT;You see for a brief moment a cluster of dark land, roughly in the shape of a bean or a cashew from this perspective, and then it flashes downward and you can see a ship.
2777;MATT;A ship that is on the water.
2778;MATT;It is stationary.
2779;MARISHA;Docked, like anchors down?
2780;MATT;Seemingly.
2781;MATT;The sails aren't up.
2782;TRAVIS;It's not at land?
2783;TRAVIS;It's in the water?
2784;MATT;Yeah.
2785;MATT;Your vision flashes again and you can see the crew have all gathered on the deck, though details of their visage are obscured by the spell.
2786;MATT;You see Ripley there with her cloak.
2787;MATT;She is talking to the rest of the crew and goes, All right, so.
2788;MATT;We've located it.
2789;MATT;We have eight hours.
2790;MATT;Gather your things and drink well.
2791;MATT;They all pull out these small vials, uncork, and drink down.
2792;MATT;They all nod.
2793;MATT;One by one, they start diving off the ship and into the water.
2794;MATT;Five people, you're not sure of the sex, and Ripley, dive off the side.
2795;MATT;"You're following her as she goes underwater; you can see the bubbles go past."
2796;MATT;Then the bubbles are no more and you watch as she is now breathing the water like it's air.
2797;MATT;Swimming downward.
2798;MATT;All of them are carrying, you see on the side, these heavy rock weights that are letting them guide down deeper into the water as it gets darker, until there's almost nothing to see.
2799;MATT;Then there's a flicker of light and you see Ripley is now holding her gun.
2800;MATT;There's a beam of light on the end of it that's giving them torchlight as they go deeper in.
2801;MATT;Then the spell fades.
2802;MARISHA;She's found it.
2803;MARISHA;She's there.
2804;TRAVIS;She's got it?
2805;MARISHA;She doesn't have it, but she's found the ship.
2806;MARISHA;She's right off the shore of the island.
2807;LAURA;Can you scry again immediately?
2808;MARISHA;She's under the water.
2809;MARISHA;I mean, I could.
2810;TRAVIS;How is she under the water?
2811;MARISHA;They all took water breathing potions.
2812;MARISHA;Her plus five other people.
2813;TALIESIN;Was there anything around?
2814;TALIESIN;Could you see the island in sight?
2815;MARISHA;I saw the island.
2816;MARISHA;It was dark in landscape.
2817;MATT;It was such a brief shot, because it wasn't the focus of the scry spell.
2818;MATT;Even the fact that you caught a glimpse of it was a strange side effect of the scry attempt.
2819;TALIESIN;Was the sun with the island, or was the sun away from the island?
2820;TALIESIN;Is there any way to even know that?
2821;TALIESIN;Were they on the north side or the south side?
2822;MATT;From what you can gather at this time, no.
2823;MATT;That's part of the scry spell.
2824;MATT;You wouldn't be able to tell.
2825;LIAM;I'm heading over to find the captain and the halfling to ask how far they estimate we are from the island.
2826;MARISHA;I heard Ripley say, We have eight hours.
2827;LAURA;That's how long the spell lasts.
2828;TRAVIS;I have two vials of underwater breathing.
2829;MARISHA;I'll take water breathing as a spell.
2830;LAURA;How many people can you cast it on?
2831;MATT;Water breathing as a spell actually lasts for 24 hours.
2832;MATT;The potions only last for eight.
2833;MARISHA;Is it concentration?
