;Player_Name;Transcription_Text
2933;LIAM;Yeah, is there any kind of bugs or any-- bugs.
2934;MATT;Make an investigation check.
2935;TALIESIN;Bugs or bugs.
2936;TALIESIN;I cast black light.
2937;MARISHA;Bugs and bugs and bugs and bugs-- I cast black light!
2938;LAURA;13.
2939;LIAM;18.
2940;MATT;Cool.
2941;MATT;So as you guys take a good ten minutes or so.
2942;MATT;As you're looking over the room, everyone's Alter Selves except for Keyleth's fade.
2943;LAURA;Yeah, we were close there.
2944;MATT;You guys were very close.
2945;MATT;But you glance around the room and it seems safe.
2946;MATT;You don't see any sort of signs of any spying.
2947;MARISHA;Tary.
2948;MARISHA;You look like yourself again.
2949;MATT;Oh, I'm about to feel a lot more like myself here in a second.
2950;MATT;And he starts going through the--
2951;LAURA;Not yet.
2952;LAURA;Just hold on one second.
2953;LAURA;Maybe I'd cast Identify on those, just before you eat another one.
2954;TRAVIS;Oh yeah.
2955;MATT;Oh, right!
2956;MARISHA;Tary.
2957;MARISHA;Tary.
2958;MARISHA;There are beds.
2959;MARISHA;And Keyleth goes and jumps up on a bed, and just starts jumping on them a little.
2960;MATT;Tary goes like-- leans into you and goes like, Is she hitting on me?
2961;MARISHA;As Keyleth jumps in the bed on the background.
2962;LIAM;It's hard to tell sometimes.
2963;LIAM;Just go with it.
2964;LIAM;Don't make any sudden movements, and let her get it out of her system.
2965;MATT;Right, right.
2966;MARISHA;Mattresses are springy here!
2967;LAURA;Wow.
2968;LIAM;What's the D&D equivalent of a glowstick?
2969;MATT;It'd be a Sunrod.
2970;TALIESIN;That's actually true.
2971;MATT;That is actually true.
2972;MATT;(laughs)
2973;TALIESIN;I'm going to gently pop her in the ankle to see if I can get her to just fall onto the bed and stop hopping.
2974;MATT;(falling and slamming noise) Percy just knocks you onto your ass.
2975;LAURA;Okay, Keyleth, okay.
2976;MATT;By the way, the buzz, if you will, the rush slowly begins to fade over the next minute or so.
2977;MATT;Taryon finishes his Identification and goes, Huh.
2978;MATT;Apparently these are receptacles to contain a fragment of refined soul.
2979;MARISHA;What?
2980;MARISHA;!
2981;MATT;Yeah, these were once living people.
2982;MATT;I'm going to be sick.
2983;LIAM;I start giving Keyleth--
2984;LAURA;(laughs) You just ate a person!
2985;LAURA;You just ate people.
2986;MATT;I know.
2987;MATT;I kn-- (nervous noises)
2988;MARISHA;I go with Taryon to puke.
2989;LIAM;Ooh, never mind.
2990;LIAM;I was going to give her a scalp massage, but ugh.
2991;TALIESIN;So does the Identification spell actually tell you the name of the person that you were consuming?
2992;MATT;Nope!
2993;MATT;And I'm glad!
2994;MATT;I don't want to-- I didn't-- I don't-- I'm sure they were a terrible person.
2995;MATT;If they're here they're probably a terrible person.
2996;MATT;They're probably terrible people, right?
2997;MATT;!
2998;TRAVIS;How many souls did you just buy?
2999;MATT;I don't know!
3000;LAURA;(gasps) Well, it was fragments, so maybe it's only like five souls, completely?
3001;MATT;Maybe?
3002;MATT;I don't know the logistics.
3003;TRAVIS;Like a whole family.
3004;LIAM;I mean, you were really up, though, when you were, you know, full there.
3005;LAURA;But does it heal you?
3006;LAURA;What do the fragments do?
3007;LAURA;I mean do the soul fragments just like--
3008;MARISHA;Yeah, what happened?
3009;MARISHA;What happened when that happened?
3010;LAURA;-- do you just feel better, are you healed or are you just not hungry anymore?
3011;TALIESIN;Sustained.
3012;MATT;Sustained.
3013;MATT;I mean, as far you understand, and from what you experienced there, any sort of hunger pains that would have existed there seem to have been staved off, and there is a--
3014;TALIESIN;(laughs) It's literally Soylent.
3015;MARISHA;That's really messed up, because now I'm hungry.
3016;MARISHA;(laughter) It's very hollow sustenance, I'm really hungry now.
3017;LAURA;Well, we're about to have a Heroes' Feast.
3018;MARISHA;Oh boy.
3019;TRAVIS;Back to the plan.
3020;LAURA;Back to the plan.
3021;MARISHA;Oh god, my throat's a little tight.
3022;TALIESIN;Scry.
3023;TALIESIN;You're going to be fine after you scry.
3024;LAURA;Okay, scry.
3025;LAURA;Let's scry on Hotis.
3026;TRAVIS;And then the Feast?
3027;TALIESIN;I'm going to give her a shot of something, just to calm down.
3028;MARISHA;Yeah, can you give me like, a minute?
3029;TALIESIN;Going to give her a shot of something.
3030;TALIESIN;Got to go back for more, soon.
3031;LIAM;Pours a soul in.
3032;TALIESIN;(laughs) Certainly spirits at the very least.
3033;TALIESIN;Soul and spirits.
3034;TALIESIN;I shouldn't be finding this as funny as I am.
3035;LIAM;Oh, it's very in-character.
3036;MARISHA;Keyleth paces back and forth for about five minutes, and then goes, okay, I'm good.
3037;LAURA;Let it settle.
3038;MARISHA;I'm great.
3039;MARISHA;Okay.
3040;LAURA;Grog, do you want to keep leaning against the door, maybe?
3041;LAURA;I'm just afraid-- I feel really uncomfortable in here.
3042;LAURA;Are there windows in the room at all?
3043;MATT;Nope.
3044;LAURA;Okay.
3045;TRAVIS;Can I touch the door with my pointy finger real quick?
3046;MATT;Yes, you do.
3047;TRAVIS;Is it burny?
3048;MATT;It is.
3049;LAURA;Maybe Doty can lean against the door?
3050;LAURA;Stand in front of the--
3051;LIAM;Hey yeah, Tarytown, can you have Dotes lean on the door?
3052;MATT;Which, by the way, as Grog does that, Doty goes-- into the door, and Taryon's like, Oh, Doty, you can stop doing that, but do lean against the door.
3053;LAURA;Does he take fire damage?
3054;MATT;Doesn't appear to be affecting him.
3055;LAURA;Okay.
3056;MATT;Though, over the next minute or so, you see parts of the back of his armor begin to glow a dull red to match the coloration of the edges of the buildings.
3057;LAURA;Oh shit, that's kind of cool.
3058;MARISHA;That's pretty cool, yeah.
3059;LAURA;Don't touch Doty!
3060;MATT;It's my favourite board game.
3061;ALL;Don't.
3062;ALL;Touch.
3063;ALL;Doty!
3064;MATT;Waiting for it.
3065;LIAM;Seems like a Catholic school game.
3066;LIAM;(laughter)
3067;MATT;All right, so, what are you doing?
3068;TRAVIS;Oh my god.
3069;LAURA;Oh no.
3070;LAURA;We're going to scry on Hotis.
3071;MARISHA;We're going to scry on Hotis.
3072;MARISHA;I'm going to scry, using my 5th-level spell, not the Scrying Eye because I want to use my spell ability, and it's going to be awesome, and I'm not going to be hiding from a soul that I accidentally consumed.
3073;LIAM;No, you're going to be bottoming out.
3074;MATT;Okay, hold on just a second.
3075;LIAM;Just need another soul, man.
3076;MARISHA;Let's add to Keyleth's guilt a little bit more.
3077;LAURA;It's okay, it was already dead, Keyleth.
3078;LAURA;Or maybe it was like the soul gems.
3079;TRAVIS;Yep, that thing was still alive.
3080;MARISHA;Don't say any of that.
3081;MARISHA;I've got to focus.
3082;LAURA;I'm sorry, I'm sorry, I'm sorry, I'm kidding, kidding, I'm totally kidding.
3083;LIAM;Here-- I'm sure it was somebody who murdered children, you know?
3084;LIAM;It was probably a major arsehole.
3085;LAURA;Yeah, it was probably a really bad person, and now they're inside of you.
3086;MARISHA;You know, not something else I'd want right now, no.
3087;MARISHA;None of these things.
3088;MATT;What level spell is the scry?
3089;MARISHA;Fifth.
3090;MATT;Fifth?
3091;MATT;As soon as you cast the spell and center your vision on the idea of Hotis, the spell immediately fizzles and dissipates.
3092;LIAM;Son of a--
3093;MARISHA;Son of a-- god--
3094;MATT;And you begin to remember, through your research of the rakshasa, up to a certain level of spells, 6th-level spells, they're immune to it.
3095;MARISHA;Damn it to the Nine-- or Second Layer of Hell.
3096;MARISHA;All right.
3097;LAURA;So, cast it at a higher level.
3098;MARISHA;So, I'm going to try again.
3099;LAURA;At what level?
3100;MARISHA;I'm going to-- we're in for the night, yeah?
3101;LAURA;We can be.
3102;LIAM;That's the plan.
3103;LIAM;That's the intention.
3104;MARISHA;We're going to eat a Heroes' Feast.
3105;LIAM;All topped off at the moment, so whatever you do, we'll make up.
3106;LAURA;Do we know if the Nine Hells have day and night the same way--
3107;TRAVIS;"I'm not topped off; I need four hit points."
3108;LIAM;I touch Grog's shoulder and I give him four hit points.
3109;MATT;And, just like that--
3110;TRAVIS;Thank you.
3111;LIAM;Ticklish.
3112;MATT;Yeah, a little bit.
3113;LAURA;Does this place have day and night the same way?
3114;MARISHA;We'll be eating a Heroes' Feast, correct?
3115;LAURA;Yeah, but are we going to scry first?
3116;MARISHA;Yeah!
3117;LAURA;Yeah.
3118;LAURA;Yeah yeah yeah yeah!
3119;MARISHA;Yeah yeah yeah yeah yeah!
3120;MARISHA;I'm going to do an 8th-level Scry.
3121;MATT;An 8th-level Scrying?
3122;MARISHA;On Hotis.
3123;LAURA;Shit!
3124;MATT;Okay!
3125;LIAM;Boom!
3126;LAURA;Eat it, Hotis!
3127;MARISHA, TALIESIN;Show me what you got!
3128;LIAM;Ho-dis!
3129;LAURA;Eat that scry!
3130;TRAVIS;He's rolling.
3131;LAURA;Oh god, he is.
3132;MATT;This time, you grit your teeth.
3133;MATT;The space is already prepared for the first ritual you did.
3134;MARISHA;I also give it a good ten minutes, let him get distracted and forget that he, maybe, just got scryed on.
3135;MATT;Okay!
3136;MATT;You close your eyes, and this time, remembering both the original conflicts with him in the Quad Roads, the battle, which you recall was at the base of a statue of Dispater, the archdevil of this sphere of Hell.
3137;MARISHA;Oh fuck, no.
3138;MATT;Way back when.
3139;MATT;You remember him falling off the top of the balcony with Vax--
3140;LIAM;Good times.
3141;LAURA;And then being stabbed by Scanlan.
3142;MATT;-- and using these memories, you focus on the essence of Hotis.
3143;MATT;Your vision suddenly pulls out of the top of this chamber that you're in, to a brief glance, just a flash over the horizon of the city, and there you see the ominous dark tower, for but a moment.
3144;MATT;Then there's a flash as your vision is pulled further into this cityscape of darkened, withering alleys, and the whole atmosphere as the core of this space that you guys are heading towards seems to be disheveled, ruined, destitute, and filthy.
3145;MATT;Your vision is dragged in that direction, to ground level, then below, and is brought, suddenly thrust into chambers, dark, bars, iron doors, a prison.
3146;MATT;A prison beneath the streets of the city.
3147;MATT;There's another flash.
3148;MATT;You see devils, dozens of them, walking guards, some larger than others.
3149;MATT;You see a flash of large, red leathery wings.
3150;MATT;You see something horned and dark, grinning beyond a metal door, and then beyond that door, there's another flash, and on the inside, you see tendrils of red flesh extending from the ceilings and the walls, all merging to a center small core.
3151;MATT;There you see this fleshy egg-like structure, about this large, that is suspended by these strands of muscle-y sinew, and there you see writhing and twisting within the membrane of this, a small, misshapen humanoid cat-like creature that is currently writhing on the inside.
3152;MATT;You can hear the faint squealing and screaming--
3153;LAURA;(high-pitched) Rakshasa!
3154;MATT;-- in pain as Hotis, not yet fully formed, slowly torturing its way back to its full physical form, is just screaming with hatred, awaiting the moments of vengeance once the torturous pain that currently consumes its existence fades and it can once more plot its return to the Prime Material Plane.
3155;MARISHA;But it was in a prison underground, under the tower?
3156;LIAM;In a Faberge egg.
3157;MATT;Underneath this portion of the city, or a little ways ahead.
3158;TALIESIN;Suspended by octopi.
3159;MARISHA;Holy fuck!
3160;TALIESIN;This is going to go great!
3161;MARISHA;Holy shit!
3162;LAURA;Anything else?
3163;LAURA;Anything else?
3164;LAURA;Anything else?
3165;LAURA;Did you see anything else?
3166;MATT;That's all you see.
3167;MATT;You just saw flashes just leading into this.
3168;MATT;You have no idea exactly where it is.
3169;MATT;All you saw were flashes of a prison under the city, and Hotis still incubating in this chamber.
3170;TRAVIS;We've got to get arrested.
3171;LAURA;Or become police officers.
3172;LIAM;Yeah!
3173;LIAM;Police Academy, that's the thing the do!
3174;TRAVIS;Keyleth will get arrested, no problem.
3175;MARISHA;Yeah, that's true.
3176;MARISHA;Just tell me to go do something in public.
3177;MARISHA;That's all you need.
3178;MARISHA;All right.
3179;MARISHA;So, I'm remembering, it seems like Hotis might serve the devil of this realm, the leader, the president, as you have said a few times, Grog.
3180;TRAVIS;Dispator.
3181;MARISHA;Mm-hm, Dispator.
3182;MARISHA;Seems like he serves him, and is in a prison.
3183;MARISHA;You know what's fun, I feel like a lot of the things we were looking for this whole time are all underground.
3184;MARISHA;It's like an underground city.
3185;MARISHA;Man, this is terrifying.
3186;TALIESIN;What if that means it's just as hot underground?
3187;MARISHA;(exhales) Well, the good news is, once we find Hotis, it'll be super easy.
3188;MARISHA;The bad news is, finding Hotis?
3189;MARISHA;Super hard.
3190;LIAM;Gotta find out-- I assume she's-- you've filled us all in on what you saw.
3191;MARISHA;Yeah, I'm assuming I translated.
3192;TALIESIN;So all we have to do is teleport through that tree that's underground.
3193;TALIESIN;We can send him a small bonsai tree, as a gift.
3194;MARISHA;(gasps) Oh my god, oh my god!
3195;LAURA;Yeah yeah yeah, then as soon as he wakes up--
3196;LIAM;We have to find the prison--
3197;TALIESIN;We have to find the prison, find out what it is, who runs it--
3198;LIAM;And then get in, get arrested, get--
3199;TALIESIN;Infiltrate, perhaps.
3200;TALIESIN;Call a favor.
3201;MARISHA;I have a weird feeling that this prison is run by Dis-- Lord Dispater himself.
3202;LIAM;James Spader.
3203;MARISHA;James Spader.
3204;TRAVIS;Wait, you said it wasn't fully formed, right?
3205;TRAVIS;It's still, like, in its goo phase?
3206;MARISHA;It is.
3207;TRAVIS;Am I the only one that feels like this is an awful lot of trouble for something that's not a problem yet?
3208;TALIESIN;The trouble is, once it becomes a problem, it continues to be a problem until you cut it off at the root.
3209;LAURA;He only stops when you kill him down here.
3210;LIAM;Right, Grog, it's two different sets of problems.
3211;LIAM;Here, he's a wee, wee bab in a chocolate egg, but getting to him is difficult.
3212;LIAM;If we wait, then he gets the jump on us when we're sleeping in our beds.
3213;TRAVIS;Not in a chocolate egg?
3214;LIAM;Not in a chocolate egg.
3215;LIAM;Then he looks like a guy in a mascot suit at a Winter's Crest fair.
3216;LAURA;Or like Gilmore.
3217;MARISHA;Or like Keyleth.
3218;TALIESIN;Or like Pike.
3219;LAURA;Oh, I can't even imagine Hotis disguised as Pike.
3220;MARISHA;I know, what a dick move that would be.
3221;LIAM;So, it's now or later, it's just a different set of problems, and now we know what we're doing at least.
3222;TRAVIS;Okay.
3223;MARISHA;So--
3224;TALIESIN;I may-- well, I'm tempted to head downstairs to have a drink, start scoping out and see who might know what's what about that prison.
3225;LIAM;I mean, we know fucking nobody in this city.
3226;TALIESIN;No.
3227;LIAM;And they all look like garbage, so why don't we just start with the garbage downstairs?
3228;TRAVIS;Small question: we checked in as-- you checked in as tieflings.
3229;LAURA;Yeah.
3230;LAURA;We have to re-alter ourselves before we go downstairs.
3231;TRAVIS;For bursts of an hour, each time?
3232;TALIESIN;Or we could just not talk about it and see if anyone actually notices, just see if anyone's going to be rude about it.
3233;TRAVIS;There's only a few rooms in this place, right?
3234;MARISHA;They keep a fairly close eye on their patrons.
3235;TRAVIS;I would think so-- ol' broken sausage finger may be sharper than we think.
3236;MARISHA;Hmm, I have a feeling there are more eyes on us here than we even realise.
3237;LAURA;Oh, I'm sure.
3238;TRAVIS;Hey, I'm really hungry, can we have that fucking Feast now?
3239;LAURA;Yeah.
3240;MARISHA;Yeah, and I make a Heroes' Feast.
3241;MATT;All righty.
3242;MATT;You guys go ahead and muster the Heroes' Feast.
3243;LAURA;I mark off 1,000 gold.
3244;LIAM;Extra hit points, no fear.
3245;MARISHA;Yep.
3246;LIAM;Lustrous hair.
3247;TALIESIN;Shiny fingernails.
3248;LIAM;Shiny fingernails.
3249;LIAM;Feel like you ate a soul.
3250;LAURA;Does that mean all of our heal-- our points are healed, or are we just--
3251;MATT;Well, if you guys take a full rest, you will.
3252;LAURA;Oh.
3253;LAURA;Oh, that's the question I wanted to ask you: did we know if here, night and day is the same?
3254;MATT;You don't know that.
3255;LAURA;No, that wasn't in any of his books?
3256;MATT;Make an intelligence check, actually.
3257;TALIESIN;That's 12.
3258;MATT;You really have no idea.
3259;MATT;I mean, there are beds, there are places to stay, and from what you can tell, there are-- there is traffic from creatures that travel from different planes, probably require sleep.
3260;MATT;So, whether or not there is a day-night cycle based on any sort of improbable sun, there probably are expected day-sleep cycles for creatures that need to sleep.
3261;TRAVIS;They pump oxygen in, you can stay up as late as you want.
3262;MATT;Yeah, it's fine.
3263;MARISHA;No windows.
3264;MATT;So Keyleth, roll 2d10.
3265;MARISHA;All right.
3266;TALIESIN;I'm so excited.
3267;TRAVIS;Come on, now.
3268;MARISHA;Big money, no whammies!
3269;MARISHA;That's an eight for one, and the other, not as good.
3270;MARISHA;Ten total.
3271;MATT;Okay, so everyone gets a bonus of ten-- that's an average, I guess.
3272;MATT;Close to average.
3273;MATT;So, ten maximum hit point increase to everybody for the next 24 hours.
3274;MARISHA;I also, at the end of dinner say, I would like to raise a toast.
3275;MARISHA;To Vox Machina: for going and being together all the way into hell and back.
3276;LAURA;Well, fingers crossed.
3277;LIAM;Well, let's not get ahead of ourselves.
3278;TRAVIS;We might not come back.
3279;MARISHA;Well, all the way to Hell and--
3280;TALIESIN;To hell!
3281;TRAVIS;Here.
3282;MATT;Thanks to the wonderful guidance of the Voice of the Tempest!
3283;LAURA;Okay.
3284;TRAVIS;(sighs) Oh Tary.
3285;MARISHA;Oh jeez.
3286;MATT;Keyleth of the Air Ashari and-- keep writing this down-- and to the majesty and the heroic and adventurous drive--
3287;MARISHA;Yes!
3288;MATT;Of Taryon Darrington!
3289;MARISHA;Of Tary-- Everybody, to Taryon Darrington!
3290;MATT;To me!
3291;MARISHA;And with that, I do Inspiring Leader, my newest feat since I'm a leader.
3292;MARISHA;(laughter)
3293;TALIESIN;What voice is this?
3294;MARISHA;Mine.
3295;TALIESIN;This is your Leader voice.
3296;MARISHA;This is why I'm a voice actor.
3297;MARISHA;And--
3298;MATT;So you cheer and talk for about ten minutes.
3299;MARISHA;Yes, cheers to Taryon Darrington and his glistening armor and his flowing locks of golden hair.
3300;MARISHA;And I continue for ten minutes about Taryon Darrington.
3301;LAURA;Wow.
3302;MARISHA;And his glistening boots of shining upkeep.
3303;MARISHA;And his--
3304;TRAVIS;He's losing hit points from this.
3305;LAURA;I want to throw up.
3306;MATT;And the whole time Doty's--
3307;MARISHA;Writing it all down.
3308;MARISHA;And then I give temporary hit points equal to my level, which is 17, plus my charisma modifier, which is nothing.
3309;MARISHA;So you get an extra 17 on that ten.
3310;MATT;That's temporary, though.
3311;MARISHA;Temporary.
3312;LAURA;Why are we inspired by hearing you talk all that shit about Tary?
3313;LIAM;Because it's in the spellbook.
3314;LAURA;I don't feel inspired.
3315;MARISHA;Well, because I would hope that with my, you know, Tary's golden locks of flowing hair and with my very impressive cape that I got, you know, for touring the world.
3316;MARISHA;Like a frequent flyer card.
3317;MATT;We'll say for the purposes of this, Taryon got 17 temporary hit points.
3318;MATT;(laughter)
3319;MARISHA;What?!
3320;MARISHA;No!
3321;MARISHA;You know what, Vex, I'm still, I'm still practicing.
3322;LAURA;You know what?
3323;LAURA;It's getting there.
3324;LAURA;Next time, share the compliments, make all of us feel cool.
3325;LIAM;And all this while, Vax has been staring at Taryon and imagining him with exactly half a beard.
3326;LIAM;(laughter)
3327;MATT;While Taryon notices you staring intently and she's giving this inspiring speech about how amazing he is-- Taryon looks over at you and goes, She's hitting on me.
3328;MATT;(laughter)
3329;MARISHA;With his belt that is bejeweled and his very bedazzled pauldrons and his--
3330;LAURA;So over this part.
3331;MARISHA;Very, very manicured cuticles.
3332;MARISHA;And I don't know what else to say for ten minutes about Tary.
3333;TRAVIS;Are we staying in?
3334;TRAVIS;For the, for a bit?
3335;TALIESIN;On the plus side, we're all very tired now.
3336;LIAM;What else is there to say about Taryon Darrington?
3337;MARISHA;Don't ask me.
3338;MARISHA;Please don't ask me.
3339;MATT;What are you guys doing?
3340;MATT;Are you resting?
3341;LAURA;I don't know.
3342;LAURA;Should we?
3343;LAURA;Rest?
3344;LAURA;I don't even know what time it is here.
3345;MATT;You don't.
3346;LAURA;It could be like early morning and we could rest and then wake up in the middle of the night.
3347;TRAVIS;We've only been traveling for like a few hours, right?
3348;LAURA;But it could be a completely different time here!
3349;MATT;Yeah.
3350;MATT;But it's more about your internal clock, whatever you want to do.
3351;TALIESIN;It took us quite a while to find this place.
3352;MARISHA;I've also expended my 6th, 7th and 8th-level spells.
3353;MATT;It took an hour, a little over an hour since your arrival.
3354;MATT;Since you guys did your transformations.
3355;LIAM;Yeah.
3356;LIAM;We went to bed, got up, and then-- what was that?
3357;LAURA;Oh, that was a burp.
3358;LAURA;I forgot we were filming.
3359;LAURA;(laughs)
3360;MATT;Yeah.
3361;MATT;You've had maybe three hours, four hours since waking up in the morning.
3362;LIAM;It's like noon in our internal clock, probably.
3363;LAURA;I feel like we should just fucking try to do something.
3364;TRAVIS;Yeah, so if we've got to find our way to some sort of prison, two options.
3365;TRAVIS;Get arrested.
3366;TRAVIS;Or ask people where people go who get arrested, which seems really fishy and stupid.
3367;MARISHA;It seemed like it was underground, almost spanning this entire city.
3368;MARISHA;We could possibly try and find a back entrance.
3369;MARISHA;I don't know.
3370;LIAM;We need to talk to somebody.
3371;LIAM;Just talk to somebody.
3372;LIAM;We can walk around for another two hours and wait until somebody gets the heebie-jeebies from us and fucks us up.
3373;LIAM;Or we can talk to somebody.
3374;LIAM;I'm going to talk to somebody.
3375;LIAM;(laughter)
3376;LAURA;Well, there's the owner downstairs, the creepy guy.
3377;LIAM;I've already left the room.
3378;LAURA;Oh, Jesus.
3379;TALIESIN;I follow him.
3380;LAURA;I follow.
3381;LAURA;Wait!
3382;LAURA;We're not altered!
3383;MARISHA;No, you're not.
3384;TALIESIN;No.
3385;TALIESIN;He already went down.
3386;MARISHA;You want to come back-- Vax, Vax, Vax, Vax!
3387;LIAM;Yeah?
3388;MARISHA;You're not altered!
3389;MARISHA;You're not altered!
3390;MARISHA;Hey!
3391;MARISHA;Hey!
3392;LIAM;I do a quick U-turn.
3393;TALIESIN;All right, we grab him, drag him back in.
3394;LAURA;Oh god.
3395;MATT;At which, as Tary goes, All right, Doty.
3396;MATT;Let him through, as you leave, Doty kind of moves away from the door and lets you by.
3397;MATT;As he bends forward with kind of the taut gesture of bowing as you pass by, you see his entire back is glowing bright red.
3398;MATT;(laughter)
3399;LAURA;Tary, can he heat up to the point that he doesn't work any more?
3400;MATT;I hope not.
3401;MATT;Probably not.
3402;MATT;I'm going to say not.
3403;LAURA;You made him, after all.
3404;LAURA;You would know.
3405;MATT;Right.
3406;MATT;It's fine.
3407;MATT;He looks over to Percival.
3408;MATT;Right?
3409;MATT;He's going to be fine?
3410;TALIESIN;Maybe flip?
3411;TALIESIN;Flip sides, just keep flipping the sides.
3412;MATT;Right!
3413;MATT;All right, Doty: chest against the wall.
3414;MATT;And Doty just kind of pancakes against the door a second time.
3415;TRAVIS;I wish I had some bacon right now.
3416;LAURA;Tary?
3417;MATT;Mm-hm?
3418;LAURA;Can you Alter Self again, on us?
3419;MATT;Let's see, I'm going to check the character sheet that I got sent.
3420;LIAM;You're god, you can do anything.
3421;LAURA;If we're screwed, we might have to be us.
3422;TALIESIN;We might have to.
3423;MATT;Well, he can cast Alter Self, he goes, I can technically do it one more time.
3424;LAURA;But you'll be out of other things you can do?
3425;MATT;I will be out of all my things.
3426;MATT;Of the big things.
3427;MATT;I mean, I still can-- He kind of jostles a satchel he has on the side, you hear a bunch of glass and things clinking.
3428;MATT;He says, I still have my accoutrements.
3429;MATT;But as far my devices to help you guys out, I'm kind of spent at that point.
3430;MATT;But--
3431;TRAVIS;You know, I still look the way I did when I checked in.
3432;TRAVIS;Looking like me going to go and do all the recon.
3433;MARISHA;I can do Alter Self at will, I'm just not the best person to talk to people.
3434;MATT;Why don't we let the two of them go?
3435;TALIESIN;(inhales nervously)
3436;LAURA;Oh god.
3437;MARISHA;Are you?
3438;MARISHA;Is that Grog and Keyleth?
3439;LAURA;Yes.
3440;MARISHA;Grog and Keyleth.
3441;MARISHA;Haven't done it for a while.
3442;MARISHA;Grog and Minxie.
3443;MARISHA;(laughs nervously)
3444;TRAVIS;What?
3445;TRAVIS;You and I, me and the tiger?
3446;MARISHA;Yeah, I'm not saying I'd be a tiger.
3447;MARISHA;I'm just hearkening back to our team-up.
