;Player_Name;Transcription_Text
2097;MATT;He'd probably be more help than I.
2098;ASHLEY;Okay.
2099;LAURA;Can you try just talking to Sarenrae?
2100;ASHLEY;I could try.
2101;ASHLEY;Of course, but maybe he will know which plane she's on and we can head there.
2102;ASHLEY;Sometimes she doesn't talk to me.
2103;ASHLEY;I can always try, since we're in here.
2104;MATT;What do you want to do?
2105;ASHLEY;I'll go ahead and try.
2106;ASHLEY;You know what?
2107;ASHLEY;Let me say a prayer real quick, Sheila.
2108;LIAM;Want to take a knee, everybody?
2109;ASHLEY;Percy, it's fine.
2110;ASHLEY;You don't need to.
2111;TALIESIN;No.
2112;TALIESIN;In for a penny.
2113;ASHLEY;Let's all take a knee.
2114;MATT;The tower itself is a fairly wide tower.
2115;MATT;30 feet high at street level.
2116;MATT;It's about 45 feet full height from where the baseline rising it was and the rest of the tower that's been assembled beyond that.
2117;MATT;On the inside, there are four floors, all of which have a hollow center about ten feet across, for in the center of the entire tower is one long, thin, ascending tower of what looks to be a sculpture of stone and gold and platinum-colored angels and clouds that all turn and twist.
2118;MATT;It rises up like this thin spire of sculpture, and there at the very top, you see the phoenix-like wings clutching the ruby stone at the top, the symbol of Sarenrae.
2119;MATT;"As you step to the base of this structure, which you haven't even seen finished; you left before this was completed."
2120;MATT;It's awe-inspiring to see this thing that you saw the very early stages of come into creation, and now it's strangely comforting to know that for all the effort that you put in, for all the strange responsibility you put on yourself, that none of this would get done if you weren't there, it's comforting to know that even without your presence, it can carry on to completion.
2121;MATT;And that as it is with worship, you don't need to helm it.
2122;MATT;Once you give it a shove, it carries itself forward.
2123;MATT;You close your eyes and you kneel below at the base of this amazing statue, one of the few only standing to her direct worship of its size, of any note to the world at this time.
2124;MATT;What do you say as your prayer?
2125;ASHLEY;Well, I'm back here, and this is so beautiful.
2126;ASHLEY;I'm sure you've seen and have... seen what's happened where we were, and I know the last time we talked, you warned me and told me that you wouldn't be there, but I think we're past the point of being able to do this on our own, just our mortal selves, and we need bigger help.
2127;ASHLEY;Might I ask for (sighs) your-- please help us.
2128;ASHLEY;I don't know what else to say.
2129;ASHLEY;This is beyond us now.
2130;MATT;As the words leave your mouth, yourself prostrate before the temple you helped build with your own hands, you open your eyes, but you see not the temple before you.
2131;MATT;You see, instead, around you essences of a vision that have been blurred at the edges, but now come clear.
2132;MATT;You see around you sandy shores, pearlescent almost.
2133;MATT;White sand that glitters in your presence, just at the peripheral, glass gems, diamonds, you can't tell, but the light that hits it seems to just sparkle and give off this light.
2134;MATT;You hear water around you rushing up and pulling back from the shore.
2135;MATT;You see statues, so many statues before you, and one that appears to be a glass fortress, a spire that rises up crystalline, translucent, but seeming to glow with the flicker of an internal flame's heartbeat.
2136;MATT;As you look up at the top of the temple, you see the wings unfurl, drift towards you, and you see coming towards you the physical form of the Everlight herself.
2137;MATT;Her darkened skin, her beautiful smile, her light hair leaving a trail of flame and gold and sunlight behind.
2138;MATT;She comes forth and drifts right before you and says, Then the time is right for us to meet.
2139;MATT;Come.
2140;MATT;Come and join me on the Island of Renewal, within the blessed fields of Elysium.
2141;MATT;Here, we can speak.
2142;ASHLEY;I immediately take a knee.
2143;ASHLEY;Thank you for letting me come here.
2144;ASHLEY;Just to see you, and-- we will come to you.
2145;MATT;Her hands reach out and clasp yours, and the warmth of her touch is hot.
2146;MATT;You feel like it's borderline burning, but it doesn't hurt.
2147;MATT;You instinctually, that animalistic essence of primal life tells you to pull back, but you don't.
2148;MATT;It's a comforting heat, like holding a cup of fresh, hot tea.
2149;MATT;She seems to almost lift you off the feet, up to her.
2150;MATT;And her size, which was so vast and immense seems to come to meet yours one-on-one.
2151;MATT;She goes, Then come.
2152;MATT;You have the tools.
2153;MATT;You have the means.
2154;MATT;I await.
2155;MATT;And as she lets go, you look down in your hand and you see what appears to be a small little piece of curved metal made of a bright, polished platinum, like a U.
2156;MATT;As you look up to her again, you're just staring at the statue.
2157;MATT;You're staring around the temple.
2158;MATT;You look down at your hand, but the item remains.
2159;MARISHA;She just gave us a key!
2160;LAURA;What happened?
2161;ASHLEY;Did you guys see anything?
2162;LAURA;We saw you praying and you had this crazy look in your eyes.
2163;LIAM;You looked blissful.
2164;LAURA;So happy.
2165;ASHLEY;Wow!
2166;ASHLEY;Well, I went there.
2167;ASHLEY;"I went to the Island of Renewal; that's where she is."
2168;ASHLEY;And she gave this to me.
2169;LAURA;What is it?
2170;MARISHA;Do I recognize what it is?
2171;SAM;It's an IUD.
2172;SAM;(laughter)
2173;LAURA;You're not here!
2174;LIAM;We all hear Scanlan Shorthalt's voice in our minds.
2175;ASHLEY;Over the earring.
2176;ASHLEY;Shut up, Scanlan.
2177;MATT;Structurally similar, I suppose.
2178;ASHLEY;No, it's not.
2179;SAM;Of course not.
2180;MATT;I can give, and I can take away.
2181;MATT;(laughs) It's different in the designs that have been crafted, that have been a little more crude.
2182;MATT;This has, once you reach out and touch it, it has that vibration to it, that hint of attuned activity to the metal, the pure metal, that definitely gives you some semblance of direction in your subtle understanding of the inner and outer planes and the general cosmology that surrounds Exandria.
2183;LAURA;She gave us a key to find her.
2184;MARISHA;She gave us a key to Plane Shift there.
2185;MARISHA;This is the tuning fork that I needed.
2186;LAURA;What the-- wow!
2187;TALIESIN;Let's let people know.
2188;ASHLEY;That was cool.
2189;ASHLEY;Vax, you have a very different relationship with your god, but-- awesome!
2190;ASHLEY;That was cool!
2191;LAURA;What was she like?
2192;ASHLEY;She was so beautiful!
2193;ASHLEY;And just glowed.
2194;ASHLEY;No!
2195;ASHLEY;And I just can't even describe it, she just glowed and it felt like-- do you remember the movie Contact?
2196;ASHLEY;(laughter)
2197;LAURA;Yeah!
2198;SAM;You mean the old scroll?
2199;ASHLEY;Yes, the old scroll Contact, where she gets to the beach and her dad is there?
2200;ASHLEY;That's what it felt like!
2201;LAURA;Wow!
2202;ASHLEY;I need to go back there!
2203;ASHLEY;Let's all go!
2204;MARISHA;Hang on.
2205;MARISHA;Do other gods live there?
2206;MATT;Make a religion check.
2207;LIAM;And we're waiting on a guy, too, aren't we?
2208;LIAM;The lady, Sheila, ran off--
2209;ASHLEY;23.
2210;MATT;23.
2211;MATT;She mentioned the blessed fields of Elysium.
2212;MATT;Sarenrae, as you know, the general understanding of her existence in the pantheon had been faded for a while.
2213;MATT;There was a betrayal to her in the Calamity and most of her following was annihilated.
2214;MATT;As gods, as they currently exist, their worship is what sustains their importance and viability in the various planes.
2215;MATT;She diminished, so her location, her home, has been kept from most existing scripture and worship both for her protection and those of her followers.
2216;MATT;So the existence of the Island of Renewal and where it may be have only recently come to your attention.
2217;MATT;The blessed fields of Elysium, though, they are a fairly well-known location in religious circles, and is also home to the Fortress of the Sun, the home of Pelor, the Dawnfather.
2218;TRAVIS;Holy shit.
2219;LAURA;That's convenient.
2220;MATT;Different area on the plane.
2221;MATT;The Fortress of the Sun.
2222;LAURA;(singing) Fortress of the Sun.
2223;MATT;The blessed fields of Elysium are an idyllic plane of good.
2224;LIAM;Are these things Pike knows because of her expertise, or does everyone in the world know a certain amount about?
2225;MATT;They know the gods, and they know the realms, but the name of the plane?
2226;MATT;This is known to her because of her study of religion.
2227;MATT;This is more of an academic understanding of the real essence of the gods, where they come from.
2228;ASHLEY;I didn't think it was going to work!
2229;ASHLEY;Sheila, I think--
2230;MATT;Sheila begins to return two minutes later with acolyte Vincent Clor, who's this mousy-looking guy.
2231;MATT;His eyes are smaller than they should be it seems for the size of his round face, he comes up with a big toothy grin.
2232;MATT;I was told that you were seeking my presence, wonderful Mistress Pike.
2233;ASHLEY;It's wonderful to see you, Vincent.
2234;ASHLEY;I'm so sorry she went to go get you.
2235;ASHLEY;I think we might be okay, and we got some answers.
2236;TALIESIN;We should probably tell them what's going on.
2237;TALIESIN;People should start to prepare themselves for what's coming.
2238;TALIESIN;We can't just keep this to ourselves.
2239;LAURA;This could affect everyone.
2240;TALIESIN;This is going to affect everyone.
2241;TRAVIS;(whispering) Tell no one
2242;TALIESIN;You're not here!
2243;TALIESIN;You went shopping.
2244;SAM;We're in the House of Lady Favors of Renewal right now.
2245;MATT;I'll get to you guys in a moment.
2246;ASHLEY;You, obviously, have heard of Vecna.
2247;MATT;No, I don't.
2248;LAURA;So there's this guy.
2249;LAURA;He's a shithead.
2250;LAURA;Okay, there's this guy.
2251;MATT;Right, okay.
2252;LAURA;He wanted to be a god, but he wasn't a god.
2253;MARISHA;Three mimosas later, and three hours later...
2254;LAURA;We explain the story of Vecna and tell him he's back.
2255;MARISHA;(slurring) And he totally didn't call us back!
2256;MARISHA;And I told him I'm not getting back together again.
2257;MATT;Sounds like a really, really bad man.
2258;LAURA;He's here.
2259;MATT;He's here?
2260;LAURA;He's here on this plane, and he's trying to become a god, and who knows, maybe he succeeded.
2261;LAURA;How long were we in the Feywild?
2262;LAURA;Do we even know that for sure?
2263;MARISHA;Did I figure that out with my check, or no?
2264;LAURA;What's the date?
2265;MARISHA;Yeah, how much time has it been?
2266;MATT;The date would be--
2267;SAM;Is there a calendar system?
2268;MATT;Yes, there is.
2269;LAURA;But we don't know it.
2270;TALIESIN;So he's going to tell us a date that will mean nothing to us because we don't actually know the date we left because we don't know how dates work.
2271;LIAM;I think it's Bidetsday.
2272;LIAM;Yeah, Bidetsday.
2273;TALIESIN;Bidusday, Bidetsday.
2274;LIAM;Let's see.
2275;LIAM;Bidetsday.
2276;TALIESIN;Bidusday, Biwhatsday.
2277;TALIESIN;Biheyhay.
2278;MATT;Hold on, I'm having to look it up because you did this to me.
2279;TALIESIN;This is like watching the DND icon crash.
2280;MARISHA;It's frozen!
2281;MATT;It is the 12th day of Misothar of 812 PD?
2282;LAURA;Oh, of course it is!
2283;LAURA;Does that sound normal to us?
2284;MATT;It sounds like the exact same day that you left, actually.
2285;TALIESIN;Well, that's convenient.
2286;MARISHA;It's the same day we left?
2287;MARISHA;Oh, cool!
2288;MARISHA;We lucked out!
2289;MARISHA;Yay!
2290;MATT;You did luck out!
2291;MATT;I was like, oh man!
2292;MATT;There's a chance they could show up and have missed the whole thing.
2293;MATT;I would have had to change a lot, but that would have been fun.
2294;MATT;That would have been fun.
2295;LAURA;For one roll.
2296;MATT;From one roll, yeah.
2297;MATT;Hey, Feywild's a dangerous thing when timetables--
2298;LIAM;Hey, buddy, you missed your window!
2299;ASHLEY;So basically, we're going to need a lot of help, and please stay in prayer.
2300;LAURA;Get ready to fight, Vincent.
2301;LAURA;Get ready to fucking fight.
2302;MATT;You look at Sheila and Vincent, who look like anyone's in-laws, and go, Very well, Mistress, right?
2303;MATT;Yes, we'll do our best.
2304;LAURA;PS, do you know anything about the fields of Elysium?
2305;TALIESIN;Did you just say PS to someone?
2306;TALIESIN;Did you say that out loud?
2307;MATT;Yes, they are a home to souls who champion the cause of good outside the forces of law and chaos.
2308;MATT;It's a beautiful place, from what the tales say.
2309;MATT;Many who go never leave.
2310;MATT;It's so beautiful.
2311;LAURA;What gods live there?
2312;MATT;As far as I know, only the Dawnfather himself.
2313;MATT;The Dawnfather is Pelor.
2314;MATT;That's all I know.
2315;MATT;My research is limited.
2316;LAURA;Right.
2317;LAURA;Should you tell him?
2318;ASHLEY;I don't feel like I want to.
2319;TALIESIN;Let's gather the boys and alert whatever government we can.
2320;LAURA;You guys, thank you for your help today.
2321;ASHLEY;It was wonderful to see you guys again.
2322;MATT;Of course, my pleasure, Mistress Pike.
2323;MATT;Good luck.
2324;MATT;Hopefully, you'll stop this thing.
2325;ASHLEY;Hopefully we will.
2326;ASHLEY;Please pray for us.
2327;MARISHA;Amazing work.
2328;MARISHA;If you need any landscaping done, don't be afraid to ask.
2329;MARISHA;Pike can get you in touch with me.
2330;LAURA;Melora is really good at it, too.
2331;LAURA;We should talk to Melora.
2332;MARISHA;Yeah, it's fine.
2333;MARISHA;We know people.
2334;ASHLEY;Thank you.
2335;ASHLEY;Keep up the good work.
2336;ASHLEY;You're doing, just, all the great stuff.
2337;MATT;Thank you!
2338;LAURA;I like the idea that anywhere we go, we embarrass the one person that knows anybody else.
2339;MATT;Yep.
2340;MATT;You're those friends.
2341;MATT;They smile and walk away, but Vincent Clor definitely seems a bit shaken by the knowledge that you just brought to him.
2342;MATT;But you make your way out of the temple.
2343;MATT;Where are you off to?
2344;MATT;What's your next direction?
2345;LIAM;I will note that Vax feels a slight sense of bittersweet pride at the amount of bliss that Pike just went through.
2346;LIAM;Just a little bit.
2347;MATT;You two.
2348;MATT;Where you going?
2349;TRAVIS;All right, so I know this guy named the Lord of the Quad Roads.
2350;TRAVIS;Back up.
2351;TRAVIS;While you were gone-- were you gone?
2352;TRAVIS;I'm not sure.
2353;TRAVIS;Did you know that I have this little magical thing?
2354;SAM;No?
2355;TRAVIS;No.
2356;TRAVIS;Okay.
2357;TRAVIS;(laughter) So because you kept my secret about Craven Edge, and you never told anybody about that, right?
2358;TRAVIS;Not one time.
2359;TRAVIS;Never told anyone.
2360;TRAVIS;I'm going to confide in you about this thing.
2361;TRAVIS;I found this little deck of cards, and I was like, oh, I'm going to pull a card out!
2362;TRAVIS;And I did, and I got a magic weapon!
2363;TRAVIS;I could throw it and it would start fighting and stuff.
2364;TRAVIS;But that turned to rust.
2365;TRAVIS;And so I was like, I wanted to pull more out.
2366;TRAVIS;But Vex was like, no, it's so dangerous!
2367;SAM;That's a good impression.
2368;SAM;She can be that way.
2369;TRAVIS;So I went to Vasselheim.
2370;TRAVIS;Actually, I was looking for you, you little shitstack.
2371;TRAVIS;And I was like, hey, I've got an idea!
2372;TRAVIS;(explosion) Boom!
2373;TRAVIS;In my head!
2374;SAM;I got it the first time.
2375;SAM;(laughter)
2376;TALIESIN;This is the best retelling of this ever.
2377;TRAVIS;I was like, I'm going to find a guy to pull out cards for me, see what happens!
2378;SAM;Because you were afraid or because she said you can't?
2379;TRAVIS;Well, I heard her nagging me in my head.
2380;SAM;Conscience.
2381;TRAVIS;Yeah.
2382;TRAVIS;(laughter) Sure.
2383;TRAVIS;So I got this drunk guy on the street and I was like, hey, pull out a card.
2384;TRAVIS;And guess what?
2385;TRAVIS;He pulled a card, and he got wishes!
2386;SAM;Did you get wishes?
2387;TRAVIS;No!
2388;TRAVIS;Because fucking I made him pick it.
2389;TRAVIS;So he goes, ooh!
2390;TRAVIS;And all of a sudden, he was in fancy clothes and he had a servant that appeared in the alley!
2391;SAM;Did he thank you?
2392;TRAVIS;He was like, thanks!
2393;TRAVIS;I guess I have two more of these!
2394;TRAVIS;And he fucking ran off!
2395;SAM;Wait!
2396;SAM;He took your cards and he left?
2397;TRAVIS;No, he pulled the one card and it disappeared in his hand.
2398;TRAVIS;Right?
2399;TRAVIS;And then he walked off.
2400;TRAVIS;But the point is: he's got two more wishes!
2401;SAM;On him.
2402;TRAVIS;Yeah!
2403;TRAVIS;And I told him, Grog!
2404;TRAVIS;Grog gave you those!
2405;TRAVIS;Remember me!
2406;SAM;Just so I'm clear.
2407;SAM;We're going to go, grab him, steal his wishes, leave him in a ditch somewhere.
2408;SAM;Is that the plan?
2409;SAM;What's our game here?
2410;TRAVIS;I'm not opposed to it.
2411;SAM;What's our game?
2412;SAM;What are we trying to get?
2413;TRAVIS;I thought, maybe, if we walked in and I had a title like Grog the Wish Giver, and we were calling to check in on him, that maybe it's time to pay his tithe to the Wish Giver, and maybe he would give us one of the two.
2414;SAM;Okay, so our game is to intimidate him into having him give you one of the wishes back.
2415;TRAVIS;Yeah!
2416;TRAVIS;Or pressure him.
2417;TRAVIS;Lay it on thick.
2418;TRAVIS;We could say like, Your fucking face is going to fall off if you don't give me one of your remaining wishes.
2419;SAM;What happened to the deck of cards?
2420;TRAVIS;Oh, I've still got them.
2421;SAM;Why are we going back to get-- oh!
2422;SAM;He has more wishes!
2423;SAM;Not more cards, he has more wishes!
2424;TRAVIS;Yes!
2425;SAM;And he should give one to us.
2426;SAM;What would you wish for?
2427;TRAVIS;Well.
2428;TRAVIS;(haltingly) For peace on Exandria, right?
2429;SAM;You don't seem enthusiastic about that wish.
2430;TRAVIS;I want to live forever!
2431;TRAVIS;Just never die!
2432;TRAVIS;I just want to him to go, you will never die.
2433;TRAVIS;I'm happy.
2434;SAM;That's a better wish for you, for sure.
2435;SAM;And we have two of them.
2436;TRAVIS;Aren't you really old, though?
2437;TRAVIS;You get company.
2438;SAM;That's true.
2439;SAM;It'd be nice having you around for a bit.
2440;TRAVIS;What would you wish for?
2441;SAM;Peace on--
2442;TRAVIS;I mean, enough of the bullshit.
2443;SAM;Yeah, well, probably.
2444;SAM;Do you just get one wish?
2445;SAM;Because I could be a littler taller, a little buffer.
2446;TRAVIS;Yeah, I think maybe you can get real descriptive with it, too, so you can make it real complicated.
2447;SAM;What would I wish for?
2448;TRAVIS;Maybe think about it while we're on our way.
2449;TRAVIS;Yeah!
2450;TRAVIS;How about we go and we pressure him and then if he doesn't bite, then we kill him.
2451;SAM;Take this hat, it's the Hat of Disguise.
2452;SAM;Put it on, and you can look however you want to look.
2453;TRAVIS;I want to look like me.
2454;TRAVIS;He's going to remember me.
2455;SAM;Well, then never mind that.
2456;TRAVIS;You're the idea man.
2457;SAM;I'm sorry!
2458;SAM;You're throwing a lot at me!
2459;TRAVIS;Warm it up, son.
2460;TRAVIS;Let's get the bad ones out of the way right now.
2461;TRAVIS;Shake it off.
2462;SAM;All right.
2463;SAM;What do we need to intimidate him?
2464;SAM;Do you need me to be your enforcer?
2465;TRAVIS;Yeah!
2466;TRAVIS;Or maybe my manservant.
2467;TRAVIS;Can you make me look really amazing?
2468;SAM;You already look amazing.
2469;TRAVIS;But rich and Wish Giver-y.
2470;SAM;Yeah.
2471;SAM;Take this hat and put it on.
2472;SAM;(laughter) And now you can look however you think you should look!
2473;SAM;(laughter)
2474;LIAM;Everybody at the table is broken!
2475;LIAM;(laughter)
2476;TRAVIS;I want to look like a sultan.
2477;MATT;It doesn't do anything.
2478;MATT;You have to attune to it.
2479;MATT;At this point in time, by the way, you watch as four armed guards start approaching.
2480;TRAVIS;I have a great record with these guys.
2481;LAURA;Oh no!
2482;LAURA;Oh no!
2483;SAM;Are they approaching us?
2484;MATT;They're approaching you, and two on the sides are spreading out, and two are walking up with purpose towards you guys.
2485;SAM;The popo.
2486;SAM;We haven't done anything wrong, we're just talking on the street!
2487;SAM;We're just two guys!
2488;SAM;Yeah!
2489;SAM;We haven't done any magic!
2490;MATT;As the two come to the flank and stop, hands on the sides of their spears, the two that walked up the middle, there's one that looks to be a captain of some kind and this one to his right who's dressed in standard guard gear looks like he's got a few long-healed scars and he goes, That looks just like him.
2491;SAM;Oh no.
2492;SAM;What did you do?
2493;LAURA;What did you do?
2494;MARISHA;You were with him as Tary!
2495;SAM;I wasn't there!
2496;SAM;(laughter)
2497;MATT;The one in adorned armor.
2498;MATT;Sir, might I have your name and purpose here in Vasselheim?
2499;TRAVIS;(high-pitched) Peter Frostbucket!
2500;TRAVIS;I seek Lord of the Quad Roads!
2501;MATT;(giggling) Make a deception check with disadvantage.
2502;TRAVIS;I don't need it!
2503;TRAVIS;Negative one!
2504;TRAVIS;(laughter)
2505;SAM;Oh my god.
2506;SAM;We're going to have to kill some guards, aren't we?
2507;SAM;(laughter)
2508;TRAVIS;Two and a one.
2509;MARISHA;They did that, not us!
2510;LIAM;Sarenrae comes down and says, never mind!
2511;TALIESIN;Your picture is going to be up in a small office by the gates.
2512;MATT;The captain-looking individual goes, Right, Mr. Frostbucket.
2513;MATT;We would like the both of you to please come with us.
2514;MATT;The two guards rush into your flank a bit and place their hands on your shoulder and your shoulder.
2515;SAM;Me?
2516;SAM;I just met this man.
2517;SAM;I've never seen him before in my life.
2518;MATT;You've been walking with him for 20 minutes.
2519;SAM;Thank you for coming over here.
2520;SAM;He was holding me hostage.
2521;SAM;He wouldn't let me leave.
2522;SAM;I'm a small man.
2523;SAM;I'm defenseless, and he was holding me captive.
2524;MATT;You make a deception check.
2525;SAM;Deception.
2526;SAM;Okay, 24.
2527;LAURA;Ooh, what is that eyebrow?
2528;MATT;It's a natural 20!
2529;MATT;He goes, Really.
2530;MATT;And what's your name?
2531;SAM;Gerald Butler.
2532;SAM;(laughter)
2533;MATT;Uh-huh.
2534;MATT;Well, Gerald Butler, the two of you should come with us.
2535;MATT;He turns around and starts walking away.
2536;MATT;The other guard with him, the one who spotted you earlier, walks with him, but keeps looking over his shoulder at you.
2537;MATT;He looks genuinely terrified of you.
2538;MATT;At this point, you realize, oh yeah, you've seen this guy before.
2539;MATT;The two other guards shove you forward, and as they push you a couple of steps in that direction, they lower their spears towards your back, Keep moving!
2540;TRAVIS;Oh, yeah, sorry.
2541;TRAVIS;Aside from the four around us, is anyone around?
2542;MATT;Yeah, there's probably roughly 20 to 25 different townsfolk.
2543;SAM;We just were walking down the street!
2544;SAM;What happened?
2545;TRAVIS;This is profiling.
2546;SAM;This is racial profiling.
2547;MATT;You carve a figure.
2548;TRAVIS;Thank you.
2549;SAM;You or me?
2550;SAM;All right.
2551;TRAVIS;I mean, mine's do one thing.
2552;TRAVIS;You've got options.
2553;SAM;All right.
2554;SAM;I will, I guess-- Jesus.
2555;SAM;It all seems so stupid.
2556;TRAVIS;I just want to go talk to the Lord of the Crossroads!
2557;TALIESIN;Critical Role: It all seems so stupid.
2558;MATT;Yep!
2559;MATT;That's our catchphrase now.
2560;SAM;All right, I will use some gigantic spell for no reason.
2561;MARISHA;Fighting gods one day, getting arrested in the street the other day.
2562;SAM;I can help me fine, it's you I need to deal with.
2563;TRAVIS;Manipulate that guy that recognized us.
2564;SAM;Sure, but I don't know what he knows!
2565;SAM;I don't know anything!
2566;SAM;All I know is he came over and fingered you.
2567;TRAVIS;He said, it looks like it's him.
2568;SAM;All right.
2569;SAM;I will-- Jesus.
2570;SAM;Okay.
2571;SAM;Fuck!
2572;SAM;I don't know what to do without causing everyone around us to die or be scared!
2573;SAM;All right!
2574;SAM;Is there a leader?
2575;MATT;Yeah, there's the captain.
2576;MATT;The one that looks scared looks over and says, Is your other friend around?
2577;MATT;The other big one?
2578;TRAVIS;Kind of blanched complexion, orange hair?
2579;MATT;Yeah with the--
2580;TRAVIS;Hits people in the face?
2581;MATT;That one.
2582;TRAVIS;Somewhere around here.
2583;MATT;Turns to the guard captain and goes, There's another one around here.
2584;MATT;Possibly two.
2585;TRAVIS;You know, the thing about that one, though, he doesn't like to leave loose ends.
2586;MATT;Make an intimidation check.
2587;TRAVIS;Goddamn it!
2588;TRAVIS;13!
2589;LAURA;Stop rolling that one!
2590;TRAVIS;No.
2591;TRAVIS;I stay with my dice.
2592;SAM;What did this other one look like?
2593;TRAVIS;This other one?
2594;SAM;Yes, the other one, what did he look like?
2595;TRAVIS;Very tall and metallic-looking.
2596;SAM;Metallic-looking?
2597;TRAVIS;Yep.
2598;SAM;You mean, the one we just saw around the corner?
2599;TRAVIS;We did!
2600;TRAVIS;I was not really aware at the time.
2601;SAM;The super scary one?
2602;TRAVIS;Yeah!
2603;TRAVIS;Well, now that you mention it, I felt a chill!
2604;SAM;Please believe us.
2605;SAM;There is an even bigger danger coming, and I think-- oh yes, it's right there.
2606;SAM;And I will Major Image what I think he's describing, which is a tall Iron Man.
2607;MATT;All right.
