;Player_Name;Transcription_Text
1291;MATT;"Retracted immediately. As she was here helping defend, she didn't waste her 8th-level slot, she is able to get you guys all flying for the moment and you all coast. As she finishes casting the spell, you could see some of the nearby wardens of the Platinum Sanctuary go, ""Um--"" ""I know it's arcane, shut up. It's fine."" You all take off the steps and begin to glide down over to the city, and there you can already see people are coming out of their homes. Exactly. So eventually, you find your way north to the Quadroads, towards the base of the Heaven Stair Mountain, where the temple resides. The temple looks like it's sustained a little bit of damage. It looks like a portion of the upper floor of the three-tier tower-- Colosseum-esque, but it does taper a bit towards the top. The top part has partially fallen in and it looks like it's seen wear and tear, but it doesn't look like it's been destroyed or anything. As you come up to the temple, you can already see there are refugees of homes that were destroyed from the incursion of the Braving Grounds that are being gathered in and the temple's filled with people. On the outside, you see Gesyra, the older woman who helped you found the temple and build it. As she approaches, she's now one of the Priests of Rebirth and has been working with you for some time and turns and sees your face. You can see her graying hair, which is bunned up very tightly in the back. She has her spectacles and she has the long robes of blue and gold. She sees you. ""My Pike!"" She rushes up and gives you a hug. She's much bigger than you, being a human, but her posture puts her almost on your level. ""I'm so glad you're safe."""
1292;ASHLEY;It's so wonderful to see your face.
1293;MATT;"""We've housed who we can. We're a bit at capacity at the moment."""
1294;ASHLEY;Okay. Well, it looks a bit better than I thought it would.
1295;MATT;"""We did our best to defend. Is it done?"""
1296;ASHLEY;It's done.
1297;MATT;"You see her eyes crack at that moment and tears begin to flow. She smiles. ""I knew you could do it."""
1298;ASHLEY;Well, we all did.
1299;MATT;"She looks around at the rest of you, pats you on the head for a minute and pulls away and goes, ""You get to wear the greatest outfits, don't you?"""
1300;ASHLEY;(giggles)
1301;MATT;"""Well, anything you need, food, we have room for a few more."""
1302;SAM;I would suggest that we-- there's bars here, right? In Vasselheim? They drink, don't they?
1303;MATT;Oh, yeah. There's bars here.
1304;MARISHA;Maybe they do a dry city after a certain time.
1305;MATT;Are you kidding me? Religion and alcohol go together perfectly. That's a time-honored tradition!
1306;SAM;Why don't we go find a tavern somewhere and let these people pick up the pieces, and give them their space?
1307;MARISHA;Do you need any type of water, or anything we can immediately assist you with?
1308;MATT;"""Clean water would be wonderful."""
1309;MARISHA;Do you have somewhere to put it?
1310;MATT;"""Just a moment!"" And she goes inside for a moment and calls out, four of the other lower acolytes of Sarenrae's temple, and they all have various buckets and reservoirs--"
1311;MARISHA;I burn as many Create Water spells as it takes to fill them up.
1312;MATT;They bring you inside, where there's the large statue of Sarenrae, where you had your first vision that called you to come find her. And there is a fountain as part of that and a reservoir in the bottom that has currently been mostly emptied to facilitate everyone here who needed water or to clean wounds. You help fill that and you very, very quickly manage to get the temple back to an easily sustainable level.
1313;TALIESIN;Pike?
1314;ASHLEY;Yes?
1315;TALIESIN;I could use your assistance. I don't think I should have this, and I need this to be taken away from me before I do something foolish.|And I hand Pike my contract.
1316;ASHLEY;(sighs) I take it. Percy, what is this?
1317;TALIESIN;This, I thought, was proof that I was in control of myself. But it's just a terrible thing waiting to happen.
1318;SAM;Ashley, I just texted you the contract.
1319;TALIESIN;Thank you. How do you have it on autosave?! Do you just have it?
1320;SAM;Yeah.
1321;ASHLEY;I mean, I somewhat know what it is.
1322;TALIESIN;I don't think it can be destroyed. But maybe it can be put far away.
1323;ASHLEY;I will keep this, at the very least, very far from you.
1324;TALIESIN;I have every faith in you. Thank you. I think I'm done with that.
1325;SAM;Pike, I have a porno book that I really think I shouldn't have anymore. Can I give it to you to take it away--
1326;TALIESIN;I'll take it away!
1327;SAM;Oh, you'll take it? Okay.
1328;TRAVIS;I would like to bid on it, as well. Yeah, I have some money still--
1329;SAM;It's not great.
1330;TALIESIN;Can you text it to us actually?
1331;ASHLEY;Could you text me the book?
1332;SAM;Sure.
1333;TALIESIN;That's a three jpeg, man. Sorry.
1334;MATT;So you guys go off to find a tavern and drink together?
1335;TRAVIS;Yeah.
1336;SAM;Yeah. We need to go have some toasts to Vax.
1337;LAURA, MARISHA;Yeah.
1338;MATT;All right.
1339;LAURA;You said Allura took Velora?
1340;MATT;Yeah. Well, at this point, she's probably still carrying her with you.
1341;LAURA;Oh, okay. I thought you said Allura took her away. Okay.
1342;MATT;Yeah, because Allura took her off of you-- You know what? No, she's probably being tended to at the Platinum Sanctuary at the moment, seeing to her wounds.
1343;LAURA;Did I just leave her? I feel weird just leaving her.
1344;MARISHA;She'll be fine. She'll be safe.
1345;TRAVIS;She's in some pretty solid hands.
1346;LAURA;I'll run back and talk to her.
1347;MATT;Okay. So you head back into the Sanctuary and retrieve her.
1348;LAURA;I'm going to make sure her wounds were tended because she was pretty busted up.
1349;MATT;She was. Thankfully, there are a number of clerics and healers available that can take a moment away from the wounded of the battle to deal with a little girl. And when you come to her, she's still a bit battered and bruised. But she's all right.
1350;LAURA;Is there anyone who can send me to Syngorn?
1351;TALIESIN;Why doesn't she stay with us for a while?
1352;MATT;You're asking this of anybody at the temple?
1353;LAURA;Do you think we should--
1354;SAM;We can take a day.
1355;TALIESIN;I think maybe a little time spent in our company, as opposed to your father's company, would not be the worst idea.
1356;LAURA;Maybe a message of Sending. Can anyone do that? Pike? Do you have the message of Sending?
1357;SAM;To whom?
1358;LAURA;To my father.
1359;MARISHA;To let him know that his daughter is still alive.
1360;ASHLEY;I don't have it with me, but I--
1361;LAURA;Okay. Allura, you've done it before.
1362;MATT;"""Yes."""
1363;LAURA;Could you send something to my father?
1364;MATT;"""I could. I could also bring her there, if you'd like."""
1365;LAURA;No. Velora, would you want to go home right now?
1366;MATT;"Right now she's holding onto your neck a bit. She looks at you. ""I miss you."""
1367;LAURA;I miss you too.
1368;MATT;"""Can I stay a bit longer?"""
1369;LAURA;Okay.
1370;MATT;"""Okay."""
1371;TALIESIN;I think that's a great idea.
1372;LAURA;I think so too. Allura, will you say that Velora is safe, and that I'll be paying a visit very soon to return her?
1373;MATT;"""I believe that,"" and for a moment she looks just beyond your eyes, squints, ""he's aware."""
1374;LAURA;Thank you.
1375;MATT;"""So to drinks?"""
1376;LAURA, TALIESIN;To drinks.
1377;MATT;"""I don't really drink. But after a day like today, I think I need one."""
1378;TRAVIS;Yeah!
1379;LAURA;Apple juice for you, little one!
1380;MATT;She giggles in your ear. All right.
1381;LAURA;I'm bringing my sister to a bar.
1382;SAM;Your nearly dead sister.
1383;MARISHA;Yeah. She's going to have to be introduced at some point.
1384;MATT;"Yeah. Allura takes a moment and squints her eyes for a second, apparently Sending another message, and then nodding. She leads you guys towards the Quadroads, and finds a pub called The Quarry's End. And it's not too far from Sarenrae's temple, which is why she chose it, and it looks to be like it was near a quarry that was built into the mountain that either dried up or was closed down for some reason, and then a tavern was opened instead as a means of still making money. It's super dive-y, it smells of stained wood and spilled wine. It's musty and perfect. And as you all come in, it's mostly empty, as people are still in the process of trying to figure things out. The few that are in there appear to be wounded soldiers that, as opposed to getting medical help, are in the process of drinking themselves into a numb state. But you find a table, you sit down, one of the barmaids comes up to you, goes: ""Drinking away the fray, are you?"""
1385;TALIESIN;I put, like, 20 gold on the table.
1386;MATT;"""Oh!"""
1387;TALIESIN;We will take the cheapest, worst beer you have, and a round for everyone in the bar.
1388;MATT;"""But of course, sir! My pleasure!"" Takes the coin."
1389;TALIESIN;If everyone's all right with that.
1390;LAURA;Of course, dear.
1391;TRAVIS;Can I also start pulling out the remaining eight expensive-ass bottles of wine from the bag of holding?
1392;MARISHA;Hell yeah! Drunk as shit! Now's the time!
1393;MATT;Within moments, your table is covered in terrible beer and really expensive wine!
1394;TRAVIS;Expensive-ass!
1395;LAURA;That's what you wrote down, too.
1396;TRAVIS;Expensive-ass bottles of wine.
1397;MATT;You pull two tables together and you guys are in the process-- You're a fair bit into your cups, and then the somewhat ajar door on the exterior slams open as the light filters in from the outside, and there you see standing the general half-height of an armored halfling, partially bloodied, armor dented as shit.
1398;TRAVIS, MARISHA;Kima!
1399;MATT;"Kima, as she walks in, sauntering in, with her blade being sheathed in the back of her giant scabbard, her Holy Avenger. ""Got your message, honey! Not going to pass up a drink after a day like this!"" (cracking) ""Ow, ow, ow!"" She comes and sits down next to Allura and puts her arm around her real fast. ""This is new!"" and points to the drink in front of Allura."
1400;TALIESIN;It's a special occasion.
1401;MARISHA;We're bad influences.
1402;TRAVIS;Yeah. Desperate times and all that.
1403;MATT;"""Good. I guess that's why we're friends."""
1404;MARISHA;I see you're working the late shift.
1405;MATT;"""Well, you know. When there's streets crawling with skeletons, I got to be there."""
1406;TALIESIN;Been having a good time, then?
1407;MATT;"""Oh, it's been amazing! It's been terrible! Terrible. But amazing!"""
1408;MARISHA;Well, we frontloaded our hours.
1409;LAURA;Can we have another cup?
1410;MATT;"""Yeah!"" The barmaid comes by, gets another cup, and leaves you guys all to drink and swap stories."
1411;TALIESIN;That thing that I was bugging you about?
1412;MARISHA;Which one? You bug me about a lot of things.
1413;TALIESIN;Well, that's fair. Now that I have a bit of alcohol in me.
1414;MARISHA;Yeah, and you ask me after I have a bit of alcohol in me. And I scry on Cassandra.
1415;MATT;Okay.
1416;TALIESIN;Oh god, he flipped a page. I hate that.
1417;MATT;You take a long, deep sip of your drink and then close your eyes as you complete the scrying ritual you've half-scrawled on the dark wood wall on the side of the tavern. Your vision goes cloudy, and you feel yourself being transitioned rapidly through wind and cloud as the temperature of your atmosphere begins to drop, and there, you begin to break cloud cover to look down upon Whitestone.|Your vision jumps once more to the exterior of the castle, jumps once more, and there you see, lying in bed, covers pulled up to her chest, with at least three different servants and one medical personnel there at her side, bag open, tending to her wounds. She's asleep, but she's breathing.
1418;MARISHA;Looks like she's been tended to like a proper de Rolo.
1419;LAURA;Did you see Kaylie and Gilmore?
1420;MARISHA;Did I see Kaylie and Gilmore?
1421;MATT;Not in the room, no.
1422;TALIESIN;She made it back to Whitestone. One would assume that's how she got there.
1423;MARISHA;She was not doing well. Gilmore was the most able-bodied. I'm assuming he got her there. I hope.
1424;TALIESIN;I'm sure. I have faith.
1425;MARISHA;I'll scry on the rest of them tomorrow.
1426;TALIESIN;I'm drunk. Don't get used to it.
1427;MARISHA, TALIESIN;Faithless until the end.
1428;MARISHA;Thank you, Percy.
1429;PERCY;Thank you, Keyleth.
1430;MARISHA;You taught me just the right amount of how to be a shithead. Just enough.
1431;SAM;We should toast to Vax'ildan, our fallen member.
1432;MATT;"At which point, Kima goes, ""Yeah, where is that asshole, anyway?"""
1433;SAM;He's really stealthy.
1434;MATT;"""Ain't that the truth. All right."" She grabs her cup."
1435;LAURA;Apple juice.
1436;MATT;She's holding a cup.
1437;SAM;What do you have, Ashley?
1438;ASHLEY;I have a cup, and it's a vintage cup. I don't need to talk about this.|(laughter)
1439;MATT;Glasses raised, and at this point as the glasses are raised, you can hear whispers off to the side. You glance over, and you can see one of the nearby tables, which is filled with four Bastions who had been drinking to the battle and have now taken notice and seemingly recognized who's at the table across the way. They're all staring, and they all grab their glasses and raise them, too.
1440;LAURA;To Vax'ildan. He was the best of us.
1441;MARISHA;The most selfless.
1442;SAM;The most frequently naked.
1443;MARISHA;Second to you.
1444;TRAVIS;The most frustrating.
1445;TALIESIN;The brightest and the darkest.
1446;SAM;That's true. To Vax.
1447;ALL;To Vax.
1448;MATT;"""So. What comes next?"""
1449;TRAVIS;What does come next?
1450;MARISHA;(sighs) It's hard to think after a day that feels like a week, like today.
1451;LAURA;Syngorn and Whitestone, I would assume.
1452;TALIESIN;Home for a bit, at least. And of course, everybody is welcome, always.
1453;MARISHA;I've got to get back to Zephrah.
1454;SAM;Do we have to check on Greyskull Keep?
1455;LAURA;In Emon?
1456;SAM;I don't know.
1457;LAURA;Someone should stay there.
1458;TRAVIS;We left it as an outpost. I wouldn't mind going back to Whitestone for a bit.
1459;TALIESIN;I'll also say, for those of you, especially. Grog, you have your freedoms, and if you wanted to become lord of Greystone and have a place of your own that you could invite us to, as opposed to wandering.
1460;MARISHA;Greyskull?
1461;TALIESIN;Greyskull.
1462;TRAVIS;(hesitant noises)
1463;LAURA;Or you could just hang in Whitestone.
1464;TRAVIS;I'll think about it. It seems like that has responsibilities.
1465;LAURA;The Grand Poobah has a lot of responsibilities, too.
1466;TRAVIS;I do. There is an updated tour.
1467;SAM;We'll go to Whitestone and figure it out.|That's where Kaylie is, right? We assume.
1468;LAURA;Potentially.
1469;MARISHA;I don't think I can go back to Whitestone with you.
1470;LAURA;Why?
1471;SAM;Oh, why? You've got to go back to your people?
1472;MARISHA;I have to go back to Zephrah.
1473;TALIESIN;Well, I think we're going to need help getting to Whitestone, and then I think it's going to take at least a day for you to regain the power to return to your people.
1474;MARISHA;Bad influences, all of you. Assholes.
1475;TALIESIN;We're not getting rid of you quite that easily.
1476;MARISHA;All right. One day.
1477;TRAVIS;If you can bear it.
1478;MARISHA;And then I want to not see your faces for a bit.
1479;SAM;Sure, that makes sense. Pikey-poo, where are you going?
1480;ASHLEY;Well, I'd like to come with you guys for a little bit because frankly, I don't really want to be alone for a while.
1481;TALIESIN;I don't think any of us do.
1482;TRAVIS;I pull her into the biggest hug.
1483;ASHLEY;Oh, P-- oh, Grog.
1484;TRAVIS;You almost called me your own name. It's okay. You'll be fine.
1485;ASHLEY;I was going to call you Poobah, but then I wanted to say your real name.
1486;MARISHA;We could go back to Whitestone whenever.|I've still got a little bit of juice left.
1487;LAURA;You've got enough juice to get us to Whitestone right now?
1488;MARISHA;I do, believe it or fucking not.
1489;TRAVIS;I don't. You gave us the option.
1490;MARISHA;What?
1491;TRAVIS;You said believe it or fucking not. I call nope.
1492;MARISHA;Oh, it was more of a rhetorical-- it's like a trick or treat-- why do we still try to explain things to him? I haven't learned.
1493;ASHLEY;Because he's learning.
1494;MATT;"Kima's clasping her cup and goes, ""I can watch this all day."""
1495;TRAVIS;Thank you, Pike.
1496;ASHLEY;He learns something new every day.
1497;TALIESIN;How did Whitestone look?
1498;MATT;It's blurred at a distance. Aside from the specific target of your scrying, you don't get much of a vision, just an idea of the blurry exterior.
1499;LAURA;Should we drunkenly walk to the tree?
1500;SAM;Are we transporting tonight? Why don't we chill for a night?
1501;LAURA;Don't you want to see your daughter?
1502;SAM;Well, of course, but I'm drunk and bloody.
1503;MARISHA;We can drunkenly walk there and take our time and enjoy the stars and we can-- oh! Scanlan--
1504;SAM;Did you have a drink?
1505;MARISHA;Scanlan.
1506;SAM;What can we do?
1507;MARISHA;We can do little arcane cantrips when no one's looking and break the rules a little bit. Of Vasselheim. Just cantrips, though.
1508;SAM;You're such a rebel.
1509;MARISHA;I know.
1510;TALIESIN;I forgot.
1511;MARISHA;What?
1512;TALIESIN;No, you're fine.
1513;MARISHA;What?
1514;TALIESIN;Nothing. You're fine. Love you very much.
1515;MARISHA;I've lost the love of my life today. I'm allowed to be belligerent.
1516;TALIESIN;You are.
1517;TRAVIS;Are we throwing caution to the wind?
1518;SAM;Sure.
1519;TRAVIS;I do have something that might up the party a little bit.
1520;SAM;Okay, what is it?
1521;TRAVIS;I reach into the bag of holding and I pull out a little leather pouch.
1522;MARISHA;Do you have that sandkheg shit?
1523;LAURA;No.
1524;TRAVIS;What?
1525;SAM;What is that? What have you got?
1526;TRAVIS;So I've got this little deck of cards and every time someone pulls from it, great shit happens.
1527;ASHLEY;I'm in.
1528;TRAVIS;One. Two. Scanlan?
1529;SAM;I've seen this before, haven't I? I think I was with you when you got the guy rich. Wasn't I?
1530;MATT;No, he was on his own.
1531;TRAVIS;He's the Lord of the Quadroads now.
1532;SAM;I was with him when he did one of them, though.
1533;MATT;You're semi-aware that there's something going on. Make an arcana check.
1534;TALIESIN;Oh, this could go so badly.
1535;SAM;15.
1536;MATT;15. Something creeping in the back of your mind, something you've learned, something you've heard, really tells you that this is powerful and chaotic.
1537;SAM;I'll watch for now.
1538;TRAVIS;You'll partake.
1539;SAM;Probably.
1540;TRAVIS;Three. Percy?
1541;TALIESIN;I think I've had enough for one day.
1542;SAM;If we're going to do that, we should go back to Whitestone first.
1543;TRAVIS;Why? This place is already fucked up.|Let's get it on. Keyleth?
1544;MARISHA;I am drunk enough to where I'm not going to stop it or argue against it, but I won't partake, so that's pretty good for me.
1545;TRAVIS;Why are you so resistant to gifts and wonder? Magic?
1546;MARISHA;Grog, you've had two weapons speak to you--
1547;TRAVIS;Don't be jelly.
1548;LAURA;Nothing powerful comes without a price. We saw that. We just saw that with the Raven Queen.|Power comes at a price. You think that wonderful things are going to be pulled out of your hands here, and there's going to be no consequences?
1549;TRAVIS;Pretty much.
1550;MARISHA;Grog, haven't we been through enough shit to know nothing's free?
1551;TRAVIS;What?
1552;MARISHA;Fuck it.
1553;TRAVIS;Here or Whitestone?
1554;TALIESIN;Oh, definitely not at Whitestone.
1555;TRAVIS;All right. Pike, you want one? (laughter)
1556;TALIESIN;I've always worried about the two of you.
1557;ASHLEY;Well, I think you should pick a card, and we deal with one as of right now. And then maybe I'll pick one later.
1558;TRAVIS;Well, jeez, I thought we were all having tequila shots and going crazy and taking pictures and writing our name on the bathroom walls, but it seems like everybody's lost their nerve. I put it back in the bag of holding.|(laughter and groaning)
1559;MATT;You're such an asshole!
1560;TALIESIN;You're such a dick.
1561;LAURA;Don't do it!
1562;MARISHA;You insult our resolve and hold out on us all at the same time?
1563;TRAVIS;The night's still young.
1564;ASHLEY;Ugh, just pick one!
1565;MATT;All right.
1566;SAM;We're traveling now? We're drunk!
1567;MARISHA;Yeah!
1568;TALIESIN;Let's drive a tree. It'll be fun.
1569;MATT;You all wander outside of the tavern, find your way over to the nearest tree that's functional. It takes you a little bit, because a lot of trees look thicker at a distance when you're drunk than when you approach.
1570;MARISHA;Yeah, no, this one won't work. No, this won't work. Sorry.
1571;TALIESIN;That's more of a shrub.
1572;MARISHA;Sorry. Next one. That one looks good.
1573;TALIESIN;Yes, that looks nice.
1574;SAM;That's a young boy.
1575;TALIESIN;Oh, yes.
1576;MATT;"Eventually, you find the tree that'll work, which is interesting, because you have this combination of people that are recognizing you as Vox Machina, as the whispered saviors of the town as you drunkenly stumble through the city streets, naught but hours after sealing a recently ascended god. It's strangely so perfect for you. As you approach the tree that you find that'll work, Allura has her arm over Kima. She's a lightweight.|""You go on ahead. We need to help here with the construction effort."""
1577;LAURA;You've got to get your construction on?
1578;MATT;"""No, we're just--"" And then Kima goes, ""Yes!"""
1579;TRAVIS;(laughing) She doesn't handle that booze very well.
1580;MATT;"""We'll see you soon. Travel safe, and thank you."""
1581;SAM;Love you.
1582;MATT;"""Okay."" (laughter)|Kima drags her hand. Kima's drank far more, but is sober. She can hold her liquor. ""All right, thank you, guys!"" And grabs her hand and pulls her off, and they both wave bye as they step back into the city.|You complete your spell, emerging from the exterior of the Sun Tree. Back in Whitestone, the comfort is here once more. It seems to be just past dusk at this point."
1583;MARISHA;(slurred) See? When you travel-- wait, no. When you travel west to east, you gain time. See?
1584;SAM;Yeah, you called it.
1585;ASHLEY;Time travel.
1586;MARISHA;(slurred) Happy hour is right now in Whitestone. Just saying.
1587;TALIESIN;Let's head home?
1588;SAM;That works.
1589;MARISHA;Okay. Heading home works.
1590;MATT;You guys make your way to the castle. Food is presented. Everyone's happy to see you back.|What do you want to do?
1591;SAM;Now or forever?
1592;MATT;Oh, we'll get to the forever bit in a minute.
1593;MARISHA;Cry myself to sleep?
1594;SAM;I want to go see Kaylie, I guess, if she's around. Are we hanging out together, or are we breaking off?
1595;LAURA;(quietly) Go see your daughter.
1596;SAM;All right. I'm going to go see Kaylie.
1597;MATT;"Okay. Asking around a bit, it doesn't take much to find Kaylie in your old room in Whitestone, the one where you both left when you first exited the group for a short time. She's in there, bandaged up, and looks like she's taking a dagger and throwing it into the wall, then walking over and pulling it back out, sitting back on the bed and throwing it, and it bounces off. The hilt hits. She's like, ""Fuck."" Picks it back up and doesn't notice you in the doorway. As she sits back down, she looks over."
1598;SAM;Hi.
1599;MATT;"""Hi."""
1600;SAM;You with a dagger in your hand's always a little scary.
1601;MATT;"""Why, does it frighten you?"""
1602;SAM;Not any--
1603;MATT;"""Boo!"""
1604;SAM;(yelps) Okay, it frightens me a little.
1605;MATT;She sheathes it on the side.
1606;SAM;You okay?
1607;MATT;"""I've had better days. I'm all right."""
1608;SAM;Good.
1609;MATT;"""You're alive."""
1610;SAM;Surprisingly, yes. We won.
1611;MATT;"""I figured, if you're standing here before me. That's good. Congratulations."""
1612;SAM;Thanks. I'm sorry that I had to go do that. I had to.
1613;MATT;"""I'd be disappointed if you'd've came back with me. More important things."""
1614;SAM;So what now? Do you want to go back to Ank'Harel and keep criming?
1615;MATT;"You watch for a brief second her tough exterior break, and you can see her eyes welling up a little bit. She looks at the ground for a minute, then looks back up at you. ""I'm glad you're safe."""
1616;SAM;I'm so happy I got to see you again. I thought for a second that when we said goodbye, it was the last time.
1617;MATT;"""I didn't. I know you too well, at this point. You're too much of a turd to die."""
1618;SAM;That's true. Only good people die.
1619;MATT;"""I'd like to go back to Ank'Harel. I don't know if this whole Meat Man thing's for me anymore."""
1620;SAM;Yeah. No, I hear you. I don't know if it's for me, either. It was fun.
1621;MATT;"""It was a lot of fun!"""
1622;SAM;It felt like we were killing time a little bit. There's something else that we should do. I don't know what. Maybe your thing won't be my thing.
1623;MATT;"""Let's find someone to pass on the mantle to, eh?"""
1624;SAM;That's a good idea.
1625;MATT;"""I think the Meat Man should be there, just not us."""
1626;SAM;Yeah, that's a great idea. We'll train a replacement.
1627;MATT;"""Still take a percentage. I mean, we worked this hard!"""
1628;SAM;Passive income, right? It's the dream.
1629;MATT;"""It's the meat and potatoes of any good business venture."""
1630;SAM;I should have thought of that. That's amazing.
1631;MATT;"""That's why the daughter's an upgrade. After that, I don't know. I hate to admit it, but--"""
1632;SAM;Did you finish school?
1633;MATT;"""No."""
1634;SAM;Do you want to?
1635;MATT;"""Yeah."""
