;Player_Name;Transcription_Text
1654;SAM;I understand. Thank you for your nimble fingers. Next time, I'll ask Percy to do it.|(laughter)
1655;TALIESIN;And it will explode.
1656;MARISHA;I make a tonic out of the glissfoil that I had in my pouch from the garden back in Emon. Pass it out, a little hangover tonic.
1657;MATT;It does help, actually.
1658;LAURA;All of us?
1659;MARISHA;Yeah.
1660;LAURA;Sweet!
1661;MARISHA;Just a little crushed herbs and water, like a tea.
1662;TRAVIS;A little hair of the dog, huh?
1663;LAURA;Thanks, Kiki!
1664;TRAVIS;Are we day drinking?
1665;SAM;Also, before we go to the meeting, I haven't used it in a while but I would like to use my Scrying Potion to-- not potion! The scry that I left at our Greyskull Keep so long ago, to kind of see what's going on at Greyskull.
1666;TALIESIN;Your scry pie?
1667;SAM;Yeah.
1668;MATT;Glancing at it this moment now, and it's about midday, you concentrate on what you left behind.
1669;SAM;Yep. We all know what it was.
1670;MATT;You have a brief view, a small windowed view of the kitchen before you. It seems to be currently empty.
1671;SAM;But still standing?
1672;MATT;But still standing. You do notice, in the sink there are some fresh dishes.
1673;SAM;Oh! Okay.
1674;TALIESIN;Squatters.
1675;MARISHA;It's fucking squatters.
1676;SAM;Or maybe our staff.
1677;TALIESIN;Unpaid now, so now they're squatters.
1678;SAM;Okay.
1679;MATT;(laughs) It's an important distinction.
1680;TRAVIS;Can you talk through your poop?
1681;SAM;No, no. Poo doesn't work that way, Travis.|It's a one-way street.
1682;TRAVIS;The finer points are lost on me.
1683;ASHLEY;You left it in the kitchen?
1684;SAM;I left it in a jar in the kitchen and I told the people not to open it.
1685;MARISHA;We only got a C on our general inspection rating.|(laughter)
1686;MATT;There's a parchment that's just nailed to the outside of the keep. At least it's good calligraphy. All right, so unless you have anything else to prepare in this time, most of the townsfolk are beginning to converge towards the square in the central-southern region of Westruun where you had the showdown battle with Kevdak outside of the Margrave's home. The now deceased Margrave. Everyone seems to have gathered together and there is an air of tension. As you approach, as folks are muttering to themselves, then it gets quiet as you all step into the central area.|There is still-- it's been pulled over, it was partially damaged before, but there is a large elevated platform that was used for speeches or celebration elements that has been, for the time being, fixed to allow you guys to stand up if you wish to address the rest of the folks.
1687;LAURA;Who wants to talk? Scanlan? You're so charismatic.
1688;TALIESIN;What are we going to say?
1689;SAM;I'm still reading my book. But, yes, we're just going to ask them a question.
1690;LAURA;I think we need to ask them where they want to go.
1691;TALIESIN;And if they ask what we think?
1692;SAM;We don't think anything. We'll support their decision, right?
1693;TALIESIN;I think something.
1694;SAM;What do you think?
1695;MARISHA;I guess I could talk to them?
1696;TALIESIN;I would like to build-- The death of a city is such a blasphemy. It is the murder of the dead. And I'm horrified.
1697;MARISHA;Percy, a city is nothing without living people in it. A city is made up of the people that live inside of it.
1698;TALIESIN;It is.
1699;MARISHA;We have to protect them first.
1700;LIAM;Percival's suggesting letting them live here, building something for them underground--
1701;MARISHA;Which we can facilitate?
1702;LIAM;Rather than running.
1703;SAM;We have a lot of other things to do-- let's talk to them.
1704;TRAVIS;How about Pike talks to them?
1705;ASHLEY;Me?!
1706;TRAVIS;Yeah! You were born here.
1707;LAURA;This is true! Pike? They know you.
1708;ASHLEY;(sighs) Well, I'm not very charismatic.
1709;SAM;I'll be with you.
1710;TRAVIS;But you're genuine.
1711;ASHLEY;Do you want to help me?
1712;LIAM;Exactly. You are genuine.
1713;ASHLEY;So we're telling them-- asking them if they want to stay. And if they do stay, that we could built them shelter.
1714;LAURA;Help them take shelter in the sewers. If there's danger.
1715;TRAVIS;The dragon's dead. We don't know if another one will come.
1716;LAURA;Can we ask before we go up on the stage if Kerr, if you're willing to help, should they want that? Is that something you could help us with?
1717;PATRICK;I would be delighted to help facilitate things between you and the community. I know a lot of people that have left will return. I don't doubt that for a second. But right now, everyone is scattered and scared. And a lot of families have been separated. A lot of people who would love to return here and rebuild the city, they don't know where their loved ones are. And I know that is preying on their minds more than their own safety, in some cases. I know most people are looking to leave and come back eventually. And depending on the resources, like what you've generously offered from the caves-- that will keep them from being refugees. They can continue to be a community in this other town, and then return, well-organized and with resources to build it. (sighs) I don't feel they're ready to do it here and now, though. I don't feel they're excited about that. I know that so many of them have people from their lives they're just missing.
1718;TRAVIS;And by the way, it's going to be a hot second before the carts come back from the cave, right?
1719;PATRICK;Yeah. Probably--
1720;MATT;Another day or two before they arrive, yeah.
1721;MARISHA;Can we even say that these people are in--
1722;ASHLEY;So are you thinking they won't want to stay, then?
1723;PATRICK;I know from speaking to a lot of people over the last couple of days, and even speaking to them last night, they're relieved that the dragon is gone. But they're worried about more in the future. But primarily, they're looking to be safe now, and reunite with their friends and family, and most of those people are in--?
1724;MATT;Kymal.
1725;PATRICK;Kymal.
1726;LIAM;I think we give them a choice. But I think, Pike, I think it's a good idea. I think you present the idea of staying and getting word to the people in Kymal that some of their loved ones are still here, still living. The dragon is dead.|Summon them back to rebuild.
1727;LAURA;How far away is Kymal?
1728;SAM;Two days' travel.
1729;TRAVIS;Wow. Fucking Shorthalt!
1730;ASHLEY;How do you know?
1731;LAURA;Was that in your book?
1732;SAM;My girl is there.
1733;LAURA;Your daughter's in Kymal?
1734;SAM;Yes. I'll be going there anyway.
1735;TRAVIS;Haylie? Maylie?
1736;SAM;Kaylie.
1737;MARISHA;And Kymal hasn't been hit yet?
1738;TALIESIN;Not yet.
1739;LIAM;Is Kymal bigger or smaller than Westruun?
1740;MATT;It's smaller than Westruun.
1741;LAURA;Well--
1742;LIAM;They're better off in Westruun.
1743;MARISHA;I'm afraid with each refugee we add to another city, we're only making it a larger target.
1744;TALIESIN;Which is why-- (sighs) There is no safe harbor right now.
1745;MARISHA;And there's no point in rebuilding--
1746;TALIESIN;There is.
1747;MARISHA;Why?
1748;TALIESIN;Because this is civilization. This is--
1749;MARISHA;There's no point in rebuilding right now when there's still three other dragons who will only come and go, 'Stomp, stomp, stomp! Dead!'
1750;TRAVIS;They might.
1751;TALIESIN;They might.
1752;MARISHA;They. Will.
1753;TALIESIN;No, they might. We don't know they will.
1754;PATRICK;If you were a dragon, what would you do?
1755;TALIESIN;I would hit the city where all the refugees are going. Because it would hurt more. I would not hit the city that's going to take 200 years to be a shadow of its former self.
1756;MARISHA;Yes, but you're also not a vain dragon who just had one of its allies taken out in this very city. These dragons are going to have a huge vendetta against Westruun now.
1757;TALIESIN;I may not have lost an ally, but I am a vain dragon.
1758;TRAVIS;Maybe they will, maybe they won't. How about for those who want to stay, we help build some fortifications. For those who want to leave, we'll protect them on their way there.
1759;LIAM;We're at wartime. The people can live underground. For now.
1760;TALIESIN;Building will give them something to do.|And if the dragon comes back, they will be safe underground. And if the dragon doesn't, we have saved thousands of years of inspiration and life. It's-- you can't just abandon something like this! There's too much here.
1761;LIAM;Otherwise, what else are we fighting for?
1762;TALIESIN;Otherwise, it becomes our friend Pike from Nowhere.
1763;TRAVIS;That would be bad.
1764;ASHLEY;That would be bad.
1765;LAURA;That would be terrible.
1766;TRAVIS;Scanlan, get their attention.
1767;SAM;Get their attention? All right.
1768;LAURA;And Pike, do you want to step up there?
1769;ASHLEY;Okay. I'll go, I'll go.
1770;SAM;I blow my horn to call the meeting to attention.
1771;MATT;(horn noise) Everyone gets really quiet. The two of you step up onto the platform--
1772;ASHLEY;(airhorn noises)
1773;MATT;"(laughs) It gets quiet. Everyone gets quiet.|You hear one voice in the back go, ""That's my Pike!"" As you immediately look over, you see at the far end is Wilhand, leaping up, trying to get a view between the crowd. Everyone's quiet, looking at the two of you, now on top of this platform. Which puts you just over head height from the rest of the folks, by the way."
1774;ASHLEY;(stuttering) Hello, everybody from the town.
1775;SAM;I'm doing sign-language interpretation.|(laughter)
1776;ASHLEY;I know I'm not one usually to speak up, but because I know so many of you and some of you are family-- (blows kiss) Um, we-- I'm sure you guys have heard because of the party and festivities from last night, the dragon has been killed.
1777;MATT;There's a cheer (crowd cheers), clapping--
1778;ASHLEY;And we know that some of you have stayed because if anything else, this is your home.
1779;MATT;Some murmuring.
1780;ASHLEY;And some of your family has left for Kymal?
1781;SAM;Kymal.
1782;ASHLEY;Kymal. But we wanted to give you all an option. And for those of you that do want to stay, we would like to provide you with an underground protection of sorts.
1783;MATT;(whispering and murmuring) Whispers through the crowds.
1784;SAM;As we speak, upwards of 40,000 gold are being delivered by your finest men. This, with our help, can help construct a sturdy underground layer that will shelter you if the dragon were to come back. It will take days, possibly weeks to construct this.|But if you wanted to stay, this would be your best bet. However, we are not forcing you to do anything. If you would like to go with the fellow refugees to Kymal, or find your fellow citizens scattered about, roving in the lowlands, that would be fine too. We need to come to an agreement today, so that we can help you do what you want.
1785;MATT;"One gentleman takes the stage next to you guys, man in his younger 20s, kind of soot smeared on his cheeks. Looks like he's a little weathered by the experience. Even though he looks young and thin, there is a general hardness to his face from recent experiences. He kind of raises up, looking at the both of you, below him: ""I, for one, miss my family and have no home to go back to. And the the homes that are empty in this town right now are empty because those who lived there are now dead. There are ghosts here I wish not to see every morning when I wake up. If I'm going to live here, I want to return with those that are important to me and build a new home, over the old. Now is not my time to stay.|Especially if more of those things are coming back.|If anyone wishes to come with me to Kymal, please, stand with me."" And he steps off the stage and make his way to the right side of the stage. Everyone in the crowd looks to each other, and few folks begin filtering off and gathering around him. I'd say about a third to half of the crowd begins to shift over as another person steps up right next to you guys, actually. This is a woman in her late 40s or so. She's wearing relatively nice clothing that's been kind of torn apart through constant use and not really having an option to change into.|She looks like she came from money, but has definitely been pulled down to the same level as the rest of the folks here; they're living in destitution out of necessity. Her hair's trying to be pulled up into a bun, but a lot of it is kind of falling around her face, and she's keeping this kind of poor facade of her previous life. And she stands up: ""I myself, my family's history is here in this town and I would be remiss if I didn't express my hesitation in leaving that behind, for the next roving horde of barbarians to rush in and take from us while we're away. Especially if this gold is to be retrieved, how do we know how much of that is to be distributed? How much was my family's versus yours? If we're to divide ourselves at this point, we're leaving ourselves open to inner conflict, lest we have a very clear idea where these funds are going. And I, for one, want to make sure I have a home when my family returns. So I'm not leaving. I'm not going to come back here months down the line and find four layabouts living in that home, made a complete mess of our things, and telling us it's now theirs. Those who wish to stay, stand with me."" (harrumphs) And she walks offstage, to the side--"
1786;TALIESIN;I'm going to get up on stage.
1787;SAM;(whispers) You don't live here.
1788;TALIESIN;The terrible woman may have a point.|(laughter)
1789;MATT;"""Thank you. What?"""
1790;TALIESIN;(sighs) Many of you are going to leave, and that's fair. And that's right, you're free to do so. I wish any of us could promise you safety once you leave this city. But there is no safety anywhere. The dragons fly freely. They may come back and wreak their vengeance upon the rest of Westruun once again. They may not. They may find new, fresh targets. We don't know. (long sigh) We will build an underground haven in case of attack, free of charge. We will make a place that is open to all. Since there seems to be some dispute about the finances, we will create a trust that will be used to help those who stay and help rebuild. It will be managed and it will be fair. And it will not go to titles. If you're properly titled, you'll have money elsewhere, and you'll figure it out.|(laughter)
1791;MATT;"You hear, ""Hmph!"""
1792;TALIESIN;New money.|(laughter)
1793;SAM;Old magic!
1794;TALIESIN;Old magic, new money from ivory towers.|I would urge you to stay. I would urge you to leave, collect your people and return. I would urge for one city not to be wiped from the map.|And anything we can do to make this at least livable while it is rebuilt, we will do our best to help. (sighs) It is such a victory for them if Westruun falls. And I sit back down.
1795;MATT;Make a persuasion check with advantage.
1796;TALIESIN;22.
1797;MATT;"There is a silence in the crowd and people have stopped shuffling from side to side. Some of the folks on the side of the gentleman began to shift back and people tend to stand up. And even the gentleman who was standing at the opposite side kind of ponders for a moment: ""Well, regardless of what happens, we have to get word out. We have to let our loved ones know what has happened, and that it's safe to come back. If you indeed can help us set this about, I'm confident we can keep out of sight. At least, hopefully."""
1798;MARISHA;I stand up on the podium. Um, sorry.|While the terrible man and the terrible woman both absolutely have a point--
1799;SAM;(whispers) He's not that bad.
1800;TALIESIN;(whispers) I'm that bad.
1801;MARISHA;I look at the man who's off to side. I agree with you that finding your loved ones is most important. I believe we can actually maybe do a little bit of both here and solve both problems.|Me, alongside with the help of other magic users, can help quickly build an underground bunker. And I would be willing to help escort any party to Kymal in order to help find your people.|Whereas I do agree, to an extent, with Percy that we should not let Westruun fall to this, this city is only as great as its people.
1802;LAURA;Woo! Good leadership! (laughter)
1803;SAM;That's definitely Vex.
1804;MATT;Some claps and a few folks kind of agree and nod their heads. The gentleman that you've been talking to kind of looks at you and he's very intently engaged and nodding in agreement.
1805;MARISHA;Uh. To Westrunn! Huzzah!?
1806;LAURA;Huzzah!
1807;TALIESIN;The awkward woman makes a fine point!
1808;MATT;"And the people eventually raise their arms, ""To Westruun!"" ""To Westruun!"" (laughter)|The clapping comes together."
1809;TRAVIS;Yeah, football rules!
1810;TALIESIN;Pike, do you remember that spell you cast on Greyskull Keep when it got hit by the dragon? The thing you did--
1811;LAURA;That was Divine Intervention, I thought.
1812;TALIESIN;Was that Divine--?
1813;MATT;No, she summoned a Planar Ally. That one was--
1814;ASHLEY;To help rebuild?
1815;TALIESIN;That was expensive, wasn't it?
1816;ASHLEY;No.
1817;MATT;That spell was expensive.
1818;ASHLEY;Yes!
1819;LAURA;It was, like, a thousand gold?
1820;MATT;That was Planar Ally--
1821;ASHLEY;What do you want to rebuild? I mean, underground--
1822;MATT;Depends on how long you want it to stay. So a task measured in hours requires a thousand gold per hour.
1823;TALIESIN;No, no, no.
1824;MATT;A task measured in days requires 10,000 gold per day--
1825;LAURA;(in alarm) No, no, no!
1826;MATT;Mind you, these entities can do some crazy stuff.
1827;SAM;Yeah. And we have 40,000 more gold coming.|That's four days of entities--
1828;LAURA;But I don't want to use up all the-- we can do that after things are--
1829;SAM;What else are we going to spend the money on?
1830;ASHLEY;I can try Divine Intervention again so--
1831;MARISHA;We don't want to rebuild a city that's going to be stomped by dragons in another three months!
1832;ASHLEY;No, just the bunker, right?
1833;LAURA;Just the bunker--
1834;ASHLEY;Not the city.
1835;LAURA;No.
1836;ASHLEY;Keyleth can make the bunker.
1837;LAURA;It's fine.
1838;SAM;For hundreds and hundreds of people?
1839;TALIESIN;Yes.
1840;MARISHA;Honestly, if we take a couple days, I can make a pretty extensive--
1841;TALIESIN;We're going to use a previously existing sewer system, and we're just going to reinforce it with pillars and then block off any of the sewage and re-route it, since it doesn't have to handle the load that it used to.
1842;ASHLEY;We're going to build a vault?
1843;TALIESIN;We're going to build a vault.
1844;PATRICK;While they're chatting, I'll step forward and I'll say: we all have a lot to think about.|Talk with your friends and neighbors and come to know your own minds. This is a decision that has to be made soon, but not on the spur of the moment. Thank you for coming.
1845;MATT;"One man in the front, an old friend of yours, his name is Joseph, puts his hand up, ""Kerrek! Of which mind are you? Are you staying or are you going? Are you going to escort, go along as an escort with this woman, or are you staying to protect us? Where you walk, I walk."""
1846;PATRICK;I am going to do what would be best for the town as a whole. I am not sure-- to a certain extent, I'll be led what is needed by the town.|If--
1847;MATT;"""What we need is a decision."""
1848;SAM;If I may, If I may, I'm so sorry, I know everyone's talking here. A city is not just a collection of houses and streets. It is a person of itself. And we can't go dividing it right now.|Everyone should stay here. Everyone should be a unit, a cohesive unit. And we: me, Keyleth, and one of your own, Pike, will definitely travel to Kymal to spread the word, if you give us a list of your ancestors, family members, friends, we can get word to all of them very quickly.
1849;MATT;Make a persuasion check.
1850;SAM;28.
1851;MATT;"Everyone in the crowd seems to nod, and the gentleman kind of nods his head to you, ""All right."" (laughter)"
1852;TALIESIN;You're a monster.
1853;PATRICK;Since you haven't been as present in the community for a while, if I am sure that things are adequately defended here, I might go myself to ensure the proper apportionment of funds and to talk to those of our townsfolk who have already left, and perhaps organize them a little more effectively so that they can return.
1854;MATT;"There's a few nods of agreement that spread through the crowd, and actually, the folks on the left side, with the woman that seemed to building tension and arguing amongst themselves over the ideas of that, seem to quiet a bit at you taking up that position. You guys notice this, too; there's a general respect for Kerrek that other folks don't seem to carry in this community. Everyone nods in agreement. ""Well, I have no objections!"" ""Neither do I."" The woman on the other side.|(huffs) ""Well, have no other choice, do we?"" Everyone nods, and they look up to the rest of you. Look to you. ""Then let's begin building."""
1855;LAURA;Bunker it is.
1856;LIAM;As all that starts to wind down, I ask my sister to point me towards Reginald's daughter.
1857;LAURA;Do you see her?
1858;LIAM;The one with the nice hair?
1859;LAURA;Yeah, that one. And the giant bag of gold.
1860;LIAM;I seek her out in the crowd.
1861;MATT;She's still looking up, kind of by herself in the crowd, clapping off to the side as you approach.
1862;SAM;I'm going to hang near him.
1863;LIAM;Excuse me, young miss.
1864;MATT;"""Yes? Hi."""
1865;LIAM;I'm sorry. We haven't spoken, but you spoke to my friends. You spoke to my sister. My sister looks very much--
1866;MATT;"""I can see the similarity, yes."""
1867;LIAM;I know the news they delivered to you. I am so sorry for your loss. Your father was very brave at the end. Impressively so, and I want you to know that. I've also recovered his body, and I thought to add him to the pyres that this city did outside the city, but I thought maybe you had a family plot or somewhere you'd prefer him to be laid to rest. I'll gladly take him there for you, or take him with you. Whatever you prefer.
1868;MATT;"""I'll come with you. I'd like to see him one last time. We have no family plot. We were meager folk. But he spent most of his life working in that field. I think it's only fitting that's where he spends the rest of his days. Show me."" And as you guys begin the building process, she follows you out to the field where she is shown the body of Reginald, and she takes a moment of quiet with him, and cradles his body. But there's a smile on her face, and she says thank you for letting her say goodbye face to face. With your help, you both bring the body back to the farmhouse where you had first met, and you spend the rest of the day interring his body within the hillside that is buttressed against the actual farmland that he tilled."
1869;LIAM;To lose a parent before their time is no easy thing. I'm very sorry for you.
1870;MATT;"""It's all right. He did good."""
1871;LIAM;That he did.
1872;MATT;"""Let's go ahead and make sure the rest of these folk have more to look forward to, shall we?"" She looks at you for a second, and you can see she takes a general scope of your expression and your emotional state, and even for a young girl, she has a stronger insight than you expected, and she puts her arm out and touches your shoulder and says, ""You carry too much sadness with you. You've done a lot of good. Let yourself-- Let yourself understand and accept the fact that you've done a lot of good."" And she starts walking back towards the town."
1873;LIAM;I linger for a bit.
1874;MATT;All right. Now. You guys begin the process of building this subterranean bunker. You take the first day, scanning through as a group, clearing out whatever creatures lurk beneath the city.|Nothing of severe threat lies down there to your power level, and you know, what once was a threat to you guys long ago, within the period of a day, you've cleared out a very, very sizable portion of the sewer system. And because it's been empty for quite a while, it's also not in a very terrible state either. I mean, it still needs to be cleaned, but that's also the specialty of those who can control water and air, let alone reinforcing the stonework that keeps the walls themselves sturdy, strong, able to support any heavy weight on the surface.|Within the next couple days, you guys continue the reinforcing process. People begin actually moving their supplies down underground and begin taking bits of furniture and elements that would at least make life down there more comfortable, or at least, a ghost image of some of the life they lived above. Because when you're down there, the comforts are what keep you going. But the people seem, as more and more of it comes together, folks genuinely begin to get a little excited at the idea of having a safe place to live for a while.|And you feel like this is doing some good for these folks at the very least. Whenever you guys would like to take your journey--
1875;TALIESIN;I would like to do a couple things just to the room before we do anything other than this to our houses.
1876;MATT;Certainly.
1877;TALIESIN;I would like on one wall to carve the names of every survivor who stayed in the city.|And on the other wall start--
1878;SAM;In Draconian.
1879;TALIESIN;In Draconian.|(laughter)|Terrible person. And on the other wall, start carving in the story of--
1880;MARISHA;Those we've lost? That's not what you were going to say.
1881;TALIESIN;What we've done to save the city, and where the story, and where the city came from, and what has happened, and make a place where other people, they can start carving in also the history and everything they need to say about the city, just one of the giant walls, I just want to start filling in with stories of the city.
