;Player_Name;Transcription_Text
0;MATT;Hello, and welcome to tonight's episode of Critical Role, where a bunch of us nerdy-ass voice actors sit around and play Dungeons and Dragons.|(heavy sigh) Every goddamn week. Anyway! Before we jump into the craziness of tonight's episode, let's get through some quick announcements, here! First and foremost, merch update. Laura, what do we got?
1;LAURA;"Well, those amazing David Mack posters that are only on sale-- well, okay, here's the thing.|The signed ones are only available for one more day; they're going away tomorrow, forever and ever and ever, amen. After that, the not-signed version will be available for one more week, and then those are gone forever and ever, amen. So if you want them, you should get them. We also have a bunch of other shirts, like the Scanlan t-shirt, and the Vox Machina t-shirt, and every other t-shirt that are so soft and comfy and cozy. And the Slayer's Cake apron!"
2;MATT;They're shipping soon, right?
3;LAURA;Those will be shipping soon. Those will be shipping-- yeah, pretty soon. Pre-orders are still available right now. With the posters-- I'm going completely out of order-- with the signed ones, it's going to take a few extra weeks to ship those because we all have to sign them. Just be patient.|We love you, and you will get them! The ones that aren't signed will get shipped out a little bit faster.
4;SAM;So one day for those.
5;LAURA;One more day! (singing) One!
6;MARISHA;Tell your friends! Tell your wives!
7;MATT;Perfect. Next update, we have Wednesday Club for next week.
8;TALIESIN;Wednesday Club! We're in an interesting transition point for a lot of shows on Geek and Sundry, so we thought we'd have a card party. It's not as sexy as it sounds.
9;MATT;I disagree, sir!
10;TALIESIN;Are you in? Are you down?
11;MATT;Yeah, I am!
12;TALIESIN;We're opening card packs!
13;MATT;I'm going to be there for this!
14;TALIESIN;Matt Mercer is going to join us for the Wednesday Club. We may have a few other guests.|You want to come?
15;LAURA;Can we all come and open card packs?
16;LIAM;Will you also someday have a Pog episode?
17;TALIESIN;We already did a Pog episode.
18;LIAM;Shut your mouth!
19;TALIESIN;We actually made it rain Pogs! It was great! You can come. We're going to have another Pog party!
20;SAM;You'll have lots of time after this, Liam!
21;TALIESIN;"Since the show is moving to its new time, 7:00-9:00pm, so we're going to be opening card packs. Talking about them, being really dumb and in our pajamas, and it's going to be great.|Definitely Matt, and there's going to be a bunch of people showing up; it's going to be great!"
22;MATT;That's so much of my childhood, you have no idea.
23;LIAM;What kind of cards?
24;TALIESIN;We're confirmed with some Jim Lee X-Men Series One. We're confirmed with some Superman vs.|Doomsday cards.
25;MATT;Any Marvel Masterpiece?
26;TALIESIN;We're working on Marvel Masterpiece.|Unopened. We've got some Kirby cards, some classic Avengers cards. We're doing a little bit of everything. We've got a couple we're working on, though. Marvel Universe Series One of Three is what we're really working on.
27;MATT;I'll talk more about it on the show, but I have a long history with those cards. All righty! Thank you, Taliesin! Signal Boost, I believe we had our recent episode went up this week with our fantastic Ashley Johnson! (cheering)
28;LAURA;It was so good!
29;MARISHA;Boosting Taliesin!
30;LIAM;Taliesin, you looked taller in that Signal Boost.
31;TALIESIN;I was wearing smaller people on my feet, so it helped.
32;MATT;He learned from the last episode, if you stack them in a trenchcoat.
33;LIAM;I just thought of four people that fit that bill and decided not to say any of their names.
34;ASHLEY;We had been planning for that episode, I remember talking to Marisha. I was like, I kind of want to boost Taliesin. We were like, everybody knows who Taliesin is.
35;TALIESIN;Over half those facts at the beginning are actually true.|Even if they've been goosed a bit.
36;MARISHA;They're peppered in between. The beauty of that is you're not sure which ones are true and which ones aren't! They're back and forth. The bees are true.
37;TALIESIN;The bees are true.
38;MATT;Two more people have to die before you eventually become the most interesting man in the world.
39;TALIESIN;One now.
40;MATT;One now? That's right.
41;TALIESIN;That's dark, but that's where we are.
42;LIAM;The guy who's running Canada is very young, so we're going to have to wait a while.
43;MATT;Last but not least. Couple things. Talks Machina, every Tuesday, 7:00pm Pacific Time here on Twitch and Alpha with our fantastic Brian Foster, talk about this episode next-- no, not next week, we're off next week because it's 4th of July. We'll talk about this episode and next episode on Talks two weeks from now. We'll see you then. Today, the Sagas of Sundry: Dread went up.|Which we're super excited about. For those who were here for International Tabletop day, Ivan van Norman ran me, Taliesin, Satine Phoenix, Amy Dallen, Amy Vorpahl through a very intense game of Dread, all being late 80s, early 90s high school kids going up to a cabin experience, and it was awesome. Well, we made a show! It was amazing.
44;TALIESIN, MARISHA;It's so good!
45;MATT;It's genuinely one of the coolest experiences I've ever had as a player in a game.
46;MARISHA;"I feel like we invented a new form of theater; it's weird."
47;MATT;If you have the opportunity, it's on Alpha.|If you have Alpha, go check it out. If you don't have Alpha, there's a 60-day free trial code.|What's the code?
48;MARISHA;SHIPMATES.
49;MATT;SHIPMATES.
50;TALIESIN;Only today, though. Today's the last day.
51;MARISHA;Until tomorrow.
52;MATT;"You have until tomorrow to try it out, so if you're like, ""I don't want to pay for Alpha!"" Well, you don't have to for 60 days now! Just put SHIPMATES in, and you'll be fine."
53;TALIESIN;This is the first time I've ever said this out loud: Seriously, go check out Alpha for this show. It's worth it. It's amazing. Oh my god!
54;MARISHA;Adam Lawson was the director. Sean and I were the producers.
55;TRAVIS;Is there any nudity?
56;TALIESIN;Yes, but probably not any you're going to be happy with. To be fair. I may make a post later on Twitter tomorrow or something to really talk about it.|I have a lot of feelings about this show.
57;LIAM;What's on your mind, Sam?
58;SAM;Nothing. The power's out at my house! Just distracted because I just came from my house, and the power was out, that's all. I'm worried about my kids. Are they going to have their little fans on tonight to keep them cool? Are they going to light candles in their room? I don't know!
59;TALIESIN;Are they watching Twitch by candlelight?
60;SAM;They are definitely watching Twitch.
61;LAURA;Can they have a pillow fort in the living room?
62;SAM;Maybe, if they can find the living room. It's dark!
63;TALIESIN;Just hear the sound of a wine aerator in the background.
64;SAM;Oh yeah, they have their wine aerator. They each have their cell phones. They're okay.|(laughter)|They aerate their milk.
65;MATT;That would be the worst sound. (bubbling milk sound) Anyway, that's enough of that, guys. Anyway. That's the end of our announcements.|And as such, that brings us to tonight's episode of Critical Role.|[music]|Hello everyone, and welcome back to Critical Role. Hope you liked our new intro, apparently. I guess they're having some tech issues trying to get the regular intro showing tonight. Little change for the evening. No biggie, mix it up a little bit. Anyway, so last we left off. Vox Machina, after discovering that the various siphon orbs, the one that was beneath Whitestone was one of many, and apparently were funneling magical energies from various arcane ley lines that exist across Exandria into some plane other than the Prime Material.|Through research and discovery, you found that this plane was the Shadowfell. Upon traversing this barrier and dealing with some cultists of the Whispered One, you discovered that Delilah Briarwood was still alive, and that there was a city in the Shadowfell beyond the boundary of these siphons known as Thar Amphala, an ancient city that had seen an ancient battle, but much had been rebuilt and constructed. There, in the center of the town, was the dark tower called Entropis.|Where, apparently, the Whispered One, Vecna, or something involved in a ritual was being completed. You began to make your way through this city, averting any sort of attention from most of the denizens in the sky and below. You squashed heads of a few cultists on the way, masqueraded as cultists, masqueraded as undead! Found the city itself shift strangely, using technology of the threshold crests that Syngorn uses, it transported itself out of the Shadowfell and somewhere else, where it began to snow. You made your way to the central tower, and deciding not to ascend it, took it to the ground with some Earthquake spells.|However, due to the magical defenses of the tower top, where the rituals were being completed, it seems the top of the tower was untouched by the spells, and lowered itself to the rubble of where it once stood. You then mustered your forces, rode up to the top of the lip of what remains of Entropis and joined in battle against Delilah Briarwood, a death knight, and the physical form of Vecna, the Whispered One himself. However, the battle did not turn in your favor, and in the process of the battle--
66;TRAVIS;That's debatable.
67;LAURA;Is it?
68;MATT;In some degrees.|Whether through bad luck or not fully understanding the scope of what you were up against, a number of you fell in battle, with one of them not being able to be restored, being Vax'ildan, who was reduced to dust by a Disintegration spell.|Realizing that your fortunes were failing, with Grog banished to another dimension and only barely returning in time, you joined hands and Keyleth attempted to travel you out of the plane to safety, of which Vecna attempted to stop with a Counterspell, and Scanlan attempted to stop that Counterspell with his own Counterspell, like a bard is wont to do. So you successfully transported, grabbing the corpse of Delilah Briarwood, who Percival finished off with a shot to the head. You found yourselves, last we left off, emerging deep into a wooded forest in some unknown location within the Feywild. Upon arriving, and glancing about, to see that you're still mostly intact, clutching the no-longer-living corpse of Delilah behind you.|Vax, not with you, and Vex, realizing, asked the question:
69;LAURA;Where's Vax?
70;SAM;I walk up to her and I set down his armor and don't say anything.
71;LAURA;What's this? Where is he?!
72;SAM;There's nothing left. He was obliterated.
73;MARISHA;Disintegrated.
74;LAURA;What?!
75;MARISHA;I saw it happen, and then I saw it happen.
76;LAURA;And we just left him there?!
77;MARISHA;No, we brought--
78;TALIESIN;We brought everything we could.
79;LAURA;Oh god! No!
80;TALIESIN;I'm so sorry.
81;LAURA;I was brought back and his soul is just-- where?
82;MARISHA;That's the ultimate question, isn't it?
83;LAURA;Can you bring him back?
84;ASHLEY;I don't know if I can.
85;TALIESIN;Can you, Keyleth?
86;MARISHA;I've never done this before.
87;LAURA;I go over and gather up all of his armor and start hugging it to myself.
88;MARISHA;I recently learned a spell that I could attempt, but it's nothing I've tried before, and it's expensive, and I'm already terrified of the fate and the hell that I might have brought him in his final moments.
89;TRAVIS;Well, what is it?
90;MARISHA;I think he saw himself die. I think. I'm so sorry.
91;LAURA;What are you talking about?
92;MARISHA;I cast Foresight on him. And I think there was a thing for a second. I haven't thought of those ramifications of something like that before. I think he was held and there was nothing he could do. What if that happened? What if he saw himself die?
93;TALIESIN;Then it doesn't matter yet, until we bring him back.
94;TRAVIS;Only matters what we do next, right?
95;TALIESIN;Let's bring him back.
96;TRAVIS;What's this new spell you were talking about?
97;MARISHA;I need 25,000 gold pieces worth of diamonds.
98;TRAVIS;What?
99;MARISHA;I need 25--
100;LAURA;Not just gold, you need diamonds?
101;TALIESIN;Where are we?
102;LAURA;I don't have-- I don't have that!
103;MARISHA;We're in the Feywild.
104;TALIESIN;We can find it, then.
105;MATT;As you look around at this point, for the first time really taking in the surroundings around you, you find yourself deep in a shaded, thick wood, where most of the leaves here are wide and triangular in shape. Where you expect to see deep greens, instead you see blues and purples.|You see the tips eventually coming to a midnight blue at the edge. There's a very faint mist that has gathered across the ground that stands about knee-height. The ground beneath you seems to have a somewhat crunchy sponginess to it with each step, though you cannot see where your feet actually touch the ground.
106;SAM;Is it all diamonds?
107;MATT;It is not all diamonds. You do hear the ever-present echoing distant hooting of owls.|(owl hooting)
108;TALIESIN;Well, now we know what to do. We were too late, and we have seen what we're up against, and now we need to focus. We can't let it be over yet. We need to focus.|We're going to find these diamonds.
109;LAURA;Was it her? Or was it Vecna?
110;SAM;It--
111;TALIESIN;Grog? Can you put her in the bag? And I toss him the body.
112;MATT;As the body of Delilah Briarwood, the head still scattered and divided right around the forehead, this giant cleft of her skull hemisphere is gone. Whatever matter was once there has loosely fallen out as she's been dragged from one location. You do see the left eye, which is not human, it seems, in appearance. The white is instead a sickly greenish-yellow, and the pupil is a cat-like slit of black, surrounded by a thin, greenish-blue tint. As soon as you look down and see the face, the eye which just looks upward at nothing, the dead body still, the eye twitches and shifts to look at you.
113;TRAVIS;Oh! (unhappy humming) Her fucking eye is still moving.
114;ASHLEY;Should we take it out?
115;SAM;Yes. It could be Vecna, watching us.
116;TRAVIS;Does it look reptilian?
117;LAURA;Can you put it in a bag or something? Cover it up?
118;SAM;Wait, can I take a closer look at it and see if I can, I don't know, identify it somehow?
119;MATT;Do you have an Identify spell?
120;SAM;No, but can I just see?
121;MATT;Make an arcana check.
122;SAM;Sure. Two! Plus five.
123;MATT;As you get down close to glance at the rather disturbingly bloodied face of Delilah Briarwood, the eye shifts back towards you. The closer you get, you watch as the thinning slit of the pupil seems to widen and focus on you. It's an unsettling presence. As you try and concentrate to see if there's any immediate signs of whether it be sigils or arcane marks that would mark it to be more of a magically enchanted object than an actual organic eye, nothing comes to mind other than the fact that it seems to be very intent on studying you back.
124;SAM;Can I try to remove it from the ocular cavity?
125;MATT;Using your fingers?
126;SAM;Yeah. My tiny, ocular hands.
127;MATT;Okay. Go ahead and make an athletics check.
128;SAM;Nine.
129;MATT;Okay, you (slurping).
130;SAM;I can inspire myself, I suppose.
131;MATT;If you want to. Up to you. How many more bardic inspirations do you have after the battle?
132;SAM;Two, right? I didn't Cutting Words anyone.|Those count as inspiration, right?
133;MATT;Yeah. Your fingers are now knuckle-deep in Delilah Briarwood's socket.
134;SAM;I'll inspire myself just to give it a serious try. That's plus ten, so that's a 19 plus, I guess, three for Jack of All Trades?
135;MATT;If you're not trained in it, then yeah.
136;SAM;22.
137;MATT;You begin humming your favorite eye-pulling song under your breath and with a horrible sucking sound, you pull the eye from her socket, leaving this trail of dark black and red viscera that dangles from it loosely. As you pull it free, whatever attached the eye to it seems to burn off and fall, leaving just the circular socket. I also need you to roll a wisdom saving throw.
138;SAM;Oh no! Insta-death.
139;TRAVIS;You're fine.
140;SAM;No, I'm not. Oh, is this magic?
141;MATT;It's not a magic spell, I'd say it's a magic effect, yeah.
142;SAM;Do I get advantage?
143;MATT;I'll say, as a gnome, for this, yes, you would.
144;SAM;Way better, but still terrible. 12!
145;LAURA;How bad was your first one?
146;SAM;A one!
147;MATT;So you watch as Scanlan pulls this eye out and looks at it for a second. For you, it's less of an actual voice, but these images come to your mind of all the terrible things that have happened in your life: the loss of your mother, the near-loss of Kaylie, the loss of your friends, every person that's ever mattered to you, you've seen slain before you or heard about. You could stop that from ever happening again. All the answers you could have. You would have the power to prevent any of that from ever happening again.|And it's so simple. It's so simple!
148;LAURA;Could we smack the eye out of his hand?
149;MATT;As this is happening, you watch as he's looking at it and this hand goes up and starts clawing into his own eye socket.
150;TALIESIN;I'm going to use every dex I have. I'm going to slap fucking hard.
151;MATT;Dex isn't going to help you so much as it's going to be a strength thing. Go ahead and make an athletics check. For you, for this, this would be an acrobatics to try and dodge out of the way.
152;TALIESIN;Strength check?
153;MATT;Athletics.
154;TALIESIN;Oh, athletics, that's better.
155;MATT;You're trying to slap it out of his grasp.
156;SAM;13.
157;TALIESIN;10.
158;MATT;You slap and the hand pulls back a little bit and he yanks it back. You can see a trail of blood beginning to pool out of the corner of the eye.
159;ASHLEY;Can I try to grab his hand and slap him across the face?
160;MATT;Yeah. This is the last chance anybody has to try and do this or Scanlan loses an eye. We're going into Event Horizon moment, here. Go ahead and make an athletics check.
161;ASHLEY;27.
162;MATT;Roll an acrobatics check.
163;SAM;It's the same thing, so it's 13.
164;MATT;As his fingers are digging into the socket and the other eye's just staring at this piercing circular gaze in his grasp in his right. You see the blood beginning to trail down his face in two different places. He's gotten his fingers partway behind his own eye. You rush up and grab him by the wrist, put your other hand right at the front of his face, pushing his nose and cheek up. You pull it back and you watch as, from behind the eyelid, his fingers slip out. He's fighting it with all his might. As you pull back, as soon as you get it free, with your other hand, you backhand. You knock the eye out of his other hand, and it goes (falling noise) and disappears beneath the mist.
165;LAURA;Can we see where it landed?
166;TALIESIN;Yeah, I'm going to follow the eye.
167;MARISHA;Do not touch it, Percy!
168;SAM;Can I see?
169;MATT;"The throbbing pain, and you're not able to focus in this eye at the time. You're effectively unable to see out of this eye really well until your next long rest. It's pretty damaged just from the brief grabbing. You could try to heal him, if you want. Your mind comes back to you for a minute. You're like, ""What the fuck is wrong with me?!"""
170;TRAVIS;What were you doing?!
171;SAM;It was speaking to me.
172;ASHLEY;What did it say?
173;SAM;I don't exactly remember, but it had some really strong arguments.
174;TRAVIS;Was it telling you to pull your own fucking eye out?
175;SAM;I guess, yeah. It was offering me things. It was telling me it could help. I've never felt that way before. It was amazing.
176;TRAVIS;Ew. Where did it go?
177;MATT;You said you were going to look in the mist for it?
178;LAURA;No, I'm not. Just holding onto--
179;MATT;The remains of Vax.
180;MARISHA;Keyleth goes over to Vex and curls up into her.
181;MATT;14. As you dive over in the direction of where you think you saw it go, the mist is thick, and you start pushing it away, and there is very dense underbrush and foliage that is gathered here that created the crunchy floor. Glancing through and pushing around, there's no sign of the eye.
182;TALIESIN;I need help finding it. I need help! Be very careful.
183;TRAVIS;I come over and start helping him look.
184;TALIESIN;I've got the flashlight box out, and I'm going to try and use this as a container if we find it.
185;MATT;Okay. You're not using the actual light, you're using the box? The thickness in the mist right now, the light would probably hinder your search than help it.
186;TALIESIN;Keyleth, can you thin this? We need to see. Make the mist go away.
187;MARISHA;What?
188;TALIESIN;(louder) Can you make the mist go away?
189;MARISHA;I don't know.
190;SAM;Can you try?
191;MARISHA;I half-heartedly do a Gust cantrip while still sitting next to Vex.
192;MATT;You watch as some of the mist dissipates and very quickly begins to roll back. The mist here is almost aggressive in its need to fill the space.|Like a lot of things in the Feywild, it almost has its own sense of nature and purpose. It's not going to let someone push itself back if it wishes to exist on the forest floor. As you're rushing in to help, because you've already made the investigation check and the mist is rolling in, and based on his inability to find it, you're not even quite sure where it landed. Make your own investigation check, but you're at disadvantage.
193;TRAVIS;Okay. Hey, that's high! That's not.|Three.
194;MATT;Okay. Over the next three or four minutes, as you guys pat through and tear roots apart and sections of the forest floor, there is no sign of where the eye landed.
195;ASHLEY;If I were to cast Locate Object, would that work?
196;MATT;You can certainly try.
197;ASHLEY;Okay!
198;MATT;You go over and grab your holy symbol and kneel to the ground, focus on whatever this dark relic is that seems to have plagued you in two different ways in the past ten minutes. As you concentrate, you feel the divine light of Sarenrae come and restore warmth from the center of this cold forest. You feel the energy flow through you and the image of her face descending from above, her mouth opening and she exhales this breath over you, and as it does, you suddenly can clarify your visual perception on this object. You know exactly the direction it is. You start walking in that direction. You push past Grog and push past Percival. You find a portion of the ground and you look, and it's not there, but you know it's that direction.
199;ASHLEY;I think I've located it. I can't see it, but I know what direction it's in.
200;SAM;Is it beneath the ground? Is it invisible?
201;ASHLEY;I don't know. So it seems like it's in the ground or it's been moved.
202;MATT;Trying to push aside the mist in the area, and it's all closed in now. The Gust cantrip held back what it could while you cast the spell.
203;MARISHA;I seem them moving in that direction, and once again, poof for them.
204;MATT;The mist separates again. You look, and you can see the direction where it would be, and as you glance over and focus your attention, it looks like between two of the roots, there's a portion of fresh dirt.
205;SAM;It burrowed!
206;ASHLEY;Okay, can I start digging?
207;MATT;You start scooping in.
208;TALIESIN;I have the box out, ready.
209;MATT;About three inches down, you scoop down and pull up a big handful of moist dirt and then there, you watch as some of it falls away. You see the wet exterior of the greenish-yellow eyeball.|It began to burrow. You see it glancing about. The eye is flickering around like it's rapidly trying to find a way out.
210;ASHLEY;I put it in the box.
211;MATT;You close the box.
212;SAM;I don't trust that thing.
213;TALIESIN;The burrowing eyeball? Are you sure?! (laughter)
214;TRAVIS;Holy shit!
215;SAM;I mean, I don't trust it near us.
216;ASHLEY;That's my favorite thing you've ever said.
217;SAM;Percy, I think you need to give it to me to hold.
218;TALIESIN;I think that's a terrible idea.
219;SAM;No, I can take care of it better than you.
220;TALIESIN;What makes you think that?
221;SAM;Just give it to me. Trust me.
222;TALIESIN;You're bleeding out your eye right now!
223;SAM;I want revenge on this eye. Give it to me so I can get revenge!
224;ASHLEY;Hold on. I cast Cure Wounds for his eye.
225;MATT;Yeah. The eye wasn't removed from the socket, but the damage that was around it seems to have healed up from the mild Cure Wounds. There's still the drying blood that has pooled down the cheek, but it appears that most of the initial damage has been sealed.
226;ASHLEY;Do you want me to hold it?
227;TALIESIN;I kind of want you to hold it.
228;SAM;I think I should hold it.
229;ASHLEY;I feel like I'm going to hold onto it in case it tries to attach itself to you again and you pull out your eyeball again.
230;TALIESIN;Yes, and that thing should be difficult to get out of. It it is a big case.
231;SAM;What if it can still hear us? Sense where we are?
232;TRAVIS;"It's an eyeball; it doesn't have ears."
233;SAM;That is true. That is a very good point.
234;TALIESIN;Well, if we're really amused by it, we just set off the light crystal that's in there and let it blind itself in there for a while. That would be funny. We have bigger problems. Diamonds.|And Delilah.
235;TRAVIS;Oh yeah, she still goes in the bag, right?
236;TALIESIN;Oh, yeah. We're going to want to have a word with her later.
237;MARISHA;Even beyond the diamonds.
238;TALIESIN;Vex. Vex. He needs you here, now. I need you here. We're not done. This is not over yet. We are in trouble. We need to find a city.|The two of you, I need both of you here.
239;LAURA;Of course, darling.
240;MARISHA;This was supposed to be a weekend trip.
241;TALIESIN;Nothing is ever what it's supposed to be.
242;MARISHA;Just a weekend trip.
