;Player_Name;Transcription_Text
1749;LAURA;DC. What do you mean?
1750;MATT;Your spell DC. At the top of your spell page.
1751;LAURA;Yes. It's 14.
1752;MATT;14.
1753;LAURA;Oh, I did get a-- I didn't add my spell attack bonus! Should I have done that?
1754;MATT;No, that's just to hit something with a spell.
1755;LAURA;Okay, cool.
1756;MATT;All right, so basilisk in front makes it, so it takes the eight damage. Okay, the rest of the duergar, they do make their saves, they take half damage. However, with the spray of arrows that comes flying out of the front of your bow, you manage to take out five duergar in one swipe. The others ones remain, damaged but still standing.|Also, now dexterity saving throw for you, Tiberius, and Grog.
1757;MARISHA;Natural 20.
1758;ORION;19.
1759;MATT;Nice. So both you guys take eight damage.|Grog fails, Grog takes 17.
1760;LAURA;I'm sorry, Grog.
1761;MATT;"""It's all right."" All right, Vex, is that the end of your turn?"
1762;LAURA;Oh, I move Trinket in, and I want to-- If I can get him to illithid, I want to get Trinket close, like kind of behind the queen. No, no, I want to get him near. That way he can flank.
1763;MATT;Okay, all right. That ends your turn.|It is now Lady Kima's turn.
1764;SAM;Ooh, I forgot about her.
1765;MATT;"Kima rushes in angrily. She has to make a saving throw. Succeeds against the basilisk, as it glances past. Rushes forward, in combat with both King Murghol and the basilisk. However, as she goes in for King Murghol, screaming, the blade of the greatsword arcing across the air with a divine glowing energy, you see it aiming for the king, but then looks to her side and sees this dangerous lizard creature, recognizing it in a moment, she changes her trajectory and swings next to the lizard with her first strike. That is a-- that hits. And that strike does just enough damage. She cleaves that basilisk in two with her first strike. With her first strike, using the inertia, she turns around and strikes at King Murghol.|However, King Murghol, seeing her come forward, takes his sword up and manages to parry hers to the side. Both of them lock for a second as he steps into her and kind of glares into her face. ""Oh, you're supposed to be downstairs for playtime."" Pushes her off with his blade.."
1766;MARISHA;Playtime? I don't-- (laughs) I know, all the ladies are like 'ew'.
1767;MATT;That brings us to Queen Ulara's turn. Queen Ulara is now standing over there with Trinket towards her back. As she instinctually does this, she goes ahead and reaches up, places her hand on the front of her robes. You can see this duergar woman with kind of long, reddish hair that she's let flow to the back, to the small of her back.|She stands up out of the throne. As she puts her hand on her chest, her form shimmers, much like you saw earlier on Tiberius, in your earlier battle. She moves back to there.
1768;ORION;As she does that, I try to Counterspell it.
1769;MATT;That's a reaction?
1770;ORION;Yep.
1771;MATT;Okay. So let's go ahead and do the contested roll.
1772;ORION;Contested roll.
1773;SAM;That was almost the name of this show. Not as catchy.
1774;ORION;DC equals ten plus the spell's level.
1775;MATT;Okay. So the DC is 12. Go ahead and you roll that.
1776;ORION;DC is 13. It's a third-level spell. Right?
1777;MATT;Blur is second-level.
1778;ORION;Oh, I thought Counter-- Okay, I see.
1779;MATT;Yes. So, Counterspell. Go ahead and-- Oh-- interrupt a creature in process of casting a spell. If the creature is casting a spell-- third level or lower, it fails and has no effect. So, yeah, it just counters it entirely. So, the-- her form begins to shimmer for a second. All of a sudden, Tiberius, your attempt to go ahead and counter the spell, that burst of energy you're trying to put through the Blur vanishes. She looks back at you.
1780;ORION;What do you think you're doing, lass?
1781;SAM;You still trying to be a god?
1782;ORION;I'm in that form still.|(laughter)
1783;MATT;Yeah. So with her sorcery points expended on that quick cast, she turns around for her main action, puts out her fingers, and you see these blasts of blue energy begin to rocket out from her fingertips, across the room, in what is a Chain Lightning.
1784;LIAM;Shit. He's got the iPhone out.
1785;MATT;So, this'll be towards-- actually, this'd be towards you, Vex, Kima, and Scanlan.
1786;LAURA;All right.
1787;LIAM;Did you say Vex or Vax?
1788;MATT;Yeah, Vex and Vax, both of you.
1789;LAURA;Wait, you're all the way over there.
1790;SAM;Yeah, you're all the way over somewhere else, right?
1791;MATT;Over there, yeah. Chain Lightning, man. It's a bitch. All right. All right, so. Vax, go ahead and make a dexterity saving throw.
1792;LIAM;Not good. Seven.
1793;MATT;Seven, all right.
1794;LIAM;Can I use Evasion, or-- Uncanny Dodge or Evasion?
1795;SAM;I gave you some dice. I gave you, I gave you some dice.
1796;LIAM;You did give me some dice.
1797;SAM;It's not going to be enough, though.
1798;LIAM;So now I'm at 13, but can I use Evasion or Uncanny Dodge? Evasion is for area effects, Uncanny Dodge is--
1799;MATT;Well, you've already used one for the area effect, the other one reduces the damage by half.
1800;LIAM;All right, Uncanny Dodge.
1801;MATT;Okay, so you're reducing the damage by half?
1802;LIAM;Yeah.
1803;MATT;Okay, so instead, you take 18 points of lightning damage. However, both Vex and Scanlan and Kima all have to make dexterity saving throws as well. She makes hers.
1804;SAM;Not great. 14. I have no dexterity.
1805;LAURA;16.
1806;MATT;16, okay. So you took, was it 18 lightning damage, I said?
1807;LIAM;Oh, I didn't add any dexterity. I add a 9 to what I got, which means I'm at 22.
1808;MATT;Just, you mean, your dexterity modifier? 22? Okay, then you would've taken half damage, make it quarter damage, so you take half of that even. So keep that in mind when you make your dexterity saving throw. So, that would give you total how much damage? So, it was 18 you took, right?
1809;LIAM;Yeah, and we halved it to nine. Five?
1810;MATT;So, 36 damage to Scanlan and to Kima, and to you, Vex. 36 points of lightning damage. That ends her turn. Tiberius, you're up. So you, it's your turn now, as you're now on top of the scorpion still.
1811;ASHLEY;It's okay.
1812;MARISHA;You're on top of me. I'm holding you!
1813;ASHLEY;I got you.
1814;ORION;Cool. This is-- there's still on the altar that's raised above-- and all that.
1815;TALIESIN;You've got a problem down there, to be fair.
1816;ORION;Where we're at?
1817;TALIESIN;You've got the witch problem to deal with.
1818;MATT;What do you got, Tiberius? Quick, before you miss your turn.
1819;ORION;I shall miss nothing. I'm going to stay right where I'm at.
1820;MATT;All right.
1821;ORION;I'm going to snicker, and I will (laughs) hand out, put out my hand, and give my little ring a rub, and let out a Fireball from it, right where no one else but these buttholes will get hurt.
1822;MATT;All right, so (laughs), I'd say probably a 20-foot radius around would put it about there.
1823;LIAM;(Tiberius voice) What is the Common word for it?
1824;ALL;(Tiberius voice) Butthole.
1825;MATT;So, as you polish off the ring and release it, the bead of red energy streaks across, blasting the floor, the secondary explosion, giant Fireball just bursts into the room, go ahead and roll damage on that.
1826;ORION;Six, I have enough, there's a four, this is terrible, help me count, eight.
1827;MARISHA;Okay, well, we have all these twos. Let's put the twos side by side. That's fun. Uh-huh.
1828;LAURA;Your turns are taking so long!
1829;ORION;18. 23!
1830;MATT;23. Okay. The rest of these duergar detonate, blasted away out of play. Just, their bodies go thrown against the walls and the various pillars in the room. There's two pillars over there, they're kind of holding the ceiling up. The rest of them just go thrown about the room. The queen takes a bit of the damage, but seems to shrug off most of it.
1831;ORION;I'm going to spend two sorcerer points. And I'm going to reach out my hand, and I'm going to form an ice knife and-- where is the queen, actually?
1832;MATT;Right there.
1833;ORION;Oh, very good. I'm going to throw the ice knife right there.
1834;MATT;Okay. Right there? All right.
1835;ORION;And I cast it at level two.
1836;MATT;All right. So you get to throw at a target, though, right? Or are you just throwing on the ground to do the radial? Okay, so you take-- you form the ice knife, you throw it, it streaks across, slams into the stone floor and explodes, sending shards of ice out. Go ahead and roll damage.
1837;ORION;Which is 3d6, because it's at level two now.
1838;MATT;Correct. Saving throw, which it succeeds.
1839;ORION;Much better. 14 points of damage.
1840;MATT;Okay. Both succeed for half damage. So seven points of damage to each. All right, got it, cool.|That ends your turn, Tiberius. Clarota, now--
1841;ORION;How do you like them apples?!
1842;MATT;Clarota steps forward-- Seeing the other mind flayer there, steps past and decides to go into a contest of wills against it.
1843;MARISHA;Contest of wills, staring contest, staring contest!
1844;MATT;All right, this is intense. All right.|Clarota is going to step forward and begin to intensely stare at-- you can see the air itself seems to shimmer and push, like a strange bubble shifting between the two of them at this connection point. Mind flayer, now one-eyed and seeping liquid from the side of its face, glares back at him. Fails his saving throw.
1845;MARISHA;That's right, he does.
1846;MATT;This mind flayer suddenly diverts its attention away from Clarota and towards the queen.|(cheering)
1847;SAM;The old Dominate.
1848;ASHLEY;Tight, tight, tight.|(laughter)
1849;MATT;That ends Clarota's turn. All right. The duergar would go if they weren't all blasted to hell. That brings us to Keyleth.
1850;MARISHA;All right. I'm going to go right for the king. You're coming for a ride, Tiberius. I'm gonna make a straight line. I have a 40-foot movement, pretty straight movement.
1851;ORION;All right! Let's get 'em!
1852;LAURA;Oh no, Tiberius fell off.
1853;MATT;There you go.
1854;MARISHA;Okay, I'm in melee, yeah?
1855;MATT;Yes, you are.
1856;MARISHA;All right, I'm gonna do my full three multi-attack.
1857;ORION;I'm maniacally laughing.
1858;MATT;You are going to have a disadvantage on the tail attack, because you have Tiberius on your back and you're trying to make sure you don't hit him with your tail.
1859;MARISHA;Okay.
1860;MATT;So, first two claw strikes.
1861;MARISHA;Okay, first one, probably not gonna hit.|12?
1862;MATT;No, that does not hit.
1863;MARISHA;Second one. 16?
1864;MATT;Does not hit. Clink, clink! Off the armor.|Tail strike.
1865;MARISHA;Tail strike. Two. Ten. Nothing.
1866;MATT;Yeah, unfortunately just his thick suit of armor-- you're just hitting at him with the giant scorpion claws, but nothing seems to be getting through.
1867;MARISHA;God, you're so heavy, Tiberius, god!
1868;MATT;You hear this clacking scorpion angrily (scorpion sounds).
1869;MARISHA;My balance is wonky.
1870;MATT;Pike, you're up!
1871;ASHLEY;All right, time for some healing. So pull me in there. I'm gonna do a-- I'm gonna do a Mass Cure Wounds. At level five gives, which I thinks gives-- thinks? Which methinks gives me 4d8? Plus my spell ability modifier. Okay, so--
1872;MARISHA;Get your heal on.
1873;LIAM;(Yoda voice) 4d8 you would give.
1874;ASHLEY;Oh, so, 20. 20 points of healing for whoever would like it.
1875;MATT;For everyone who's in the radius. Everyone but Grog, essentially, gets healed for 20 points.|Grog's too far away from you, unfortunately.
1876;SAM;Thank you, my love.
1877;MATT;All right, Percy, you're up.
1878;TALIESIN;All right, I'm going to just get-- just step into the doorway to take a look. I'm just stepping one step. And now I'm just going to shoot-- can I-- I'm just gonna try and-- The minute I recognize what a basilisk is, since I've faced them before, I'm going to do my best not to look and take a shot.
1879;MATT;Okay, so go ahead and fire with a disadvantage against the basilisk on the far end of the room.
1880;SAM;Don't you shoot me.
1881;MARISHA;Oh, that was a pretty one.
1882;TALIESIN;I get 16 at my disadvantage.
1883;MATT;16 at disadvantage? That does hit. Go ahead and roll damage.
1884;TALIESIN;Nice! I'll be taking another shot, too.
1885;MATT;Also, Tiberius, make another constitution saving throw.
1886;TALIESIN;Six points of damage.
1887;MATT;Six points of damage to the basilisk, got it.
1888;TALIESIN;I'm going to take another shot, though.|16 again.
1889;ORION;Ten.
1890;TALIESIN;16 hits. This time I do 12 points of damage.
1891;MARISHA;12 points?
1892;TALIESIN;12 points. And then I'm gonna duck back around the corner again.
1893;MATT;Okay. Cool. As you duck around the corner, you've gotten these strikes in, and as you're trying to-- as you finish your blows on the duergar king, Murghol, in front of you, you hear this clanking sound as Tiberius's now fully stone form falls off of the scorpion onto the ground, beside you.
1894;SAM;Oh no! He's stoned!
1895;ASHLEY;You turned to stone?
1896;LAURA;'Cause of the basilisk.
1897;LIAM;We've dealt with this before.
1898;LAURA;Basilisk blood, we can fix it.
1899;SAM;I think you pee on the body and it cures them.
1900;ASHLEY;Can I-- I can't, I have to go--
1901;SAM;Let's try it and find out.
1902;MATT;The basilisk now takes its turn.
1903;LIAM;(stone Tiberius voice) Please, no!
1904;MATT;Steps forward onto the edge. It's going to go ahead and-- it's gonna be for Lady Kima. It's going to attempt to make its stare at her. Lady Kima--
1905;ASHLEY;Close your eyes!
1906;LAURA;She's smart, she's closing her eyes.
1907;MATT;Lady Kima, who's currently in this blood frenzy against the king, unfortunately is not paying attention. Off to the side, the basilisk gets a glance out, which she looks at from the corner of her eye, she sees the movement over and has a hard time pushing through the stiffness as the gaze begins to take a clenching effect on her body.
1908;LAURA;Oh no.
1909;COMPUTERGENERATED VOICE;All set, let's go.
1910;MATT;Yes, thank you. Let's do that. Oh, Waze.|Why's my phone on? All right, so, that brings us to the-- Oof, okay.
1911;LIAM;(computer voice) I'm sorry, I can't help you with that, Vex'ahlia.
1912;MATT;This mind flayer, who's currently Dominated, steps forward and is going to attempt to make a tentacle grab against the queen. Queen Ulara manages to dodge out of the way, seeing this coming, and just backhands it, while taking a step back. Unfortunately does not cling with the tentacle. That ends its action. Yeah, unfortunately that didn't hit. All right, next, at the top, that brings us to Vax.
1913;LIAM;I'm hasted. I'm gonna try to go stealth again from where I am. So I'm stealth, 17-- 30.|Okay. I'm going to scuttle along the floor and leap on the back of the basilisk and try to stab it in the eye while looking at the ceiling.
1914;MATT;Well, at the start of your turn, it's within 30 feet of you and you can see it.|Are you going to--
1915;LIAM;Not look at it, no, no.
1916;MATT;Okay, so you're taking disadvantage on this attack. So you move behind, you're hidden.
1917;LIAM;15 for my first attack.
1918;MATT;Your first attack, that will not hit, unfortunately.
1919;LIAM;And second time, 19 for the second attack.
1920;MATT;That does hit, yes.
1921;LIAM;Okay. Feel for the eyes, stab it with keen dagger-- Four. 11.
1922;MATT;Okay. As you rush over, you take your first strike at the basilisk, you see it reel back and slap around its tail. You barely just get out of the way, and as you see its head turning around to attempt to glare at you, you instinctively take your offhand dagger and place it directly into the eye socket of the basilisk. It sinks past your fingers and you feel that warm rush of blood and gore against your hand. As you pull back, it just slumps to the ground.|(cheering)
1923;ASHLEY;We'll get you some of that-- we'll get you some of that blood. Blood! Basilisk blood!
1924;LIAM;I only moved ten feet. So who's stone right now? Tiberius and-- wasn't-- aren't two people?
1925;MATT;Lady Kima is mid-effect and Tiberius is solid stone.
1926;LIAM;I've got Haste on-- If I've got Haste on, can I get to Kima? 'Cause I've got haste boots.
1927;MATT;I would say, yeah, you could spend the rest of your movement doing that, yeah.
1928;LIAM;Okay, and I use my thumb to slide some of its blood off the blade and drip it onto her eyes.
1929;MATT;Okay. All right. That ends your turn. That brings us to Grog. Grog turns and is going to go ahead and go raging, frenzied, against the queen.|And a critical hit.|(cheering)
1930;MARISHA;He crit?
1931;ORION;Yeah.
1932;MATT;The first hit, she's gonna go ahead and use her reaction to do Shield, it's going to up her defense. First attack misses, so two attacks miss now and the last attack is a critical hit, which is nice. So that's a--
1933;MARISHA;No crits for you! Crit happens, whether you're here or not.
1934;MATT;All right, so that's 31 points of damage.|Oof, that's a hefty chunk. All right, that ends Grog's turn. That brings us to Scanlan!
1935;SAM;I'm next to the king, right? I'm near the king? Over there.
1936;MATT;Yep. You're right next to him.
1937;SAM;Okay. I just make eye contact with him and I mentally tell him that he really has the urge to try to do a headstand. Lay down his weapon and he really just wants to see if he can do it.|(laughter)
1938;MATT;Okay.
1939;SAM;Suggestion.
1940;MATT;Okay. (laughs) What's your DC?
1941;SAM;19.
1942;MATT;All right. This is through the hand cone?
1943;SAM;Through the hand cone, through the hand cone.
1944;MATT;Okay. That will be a 20, unfortunately.|Makes his saving throw. He glances back towards you with a look of confusion for a second. Looks at his feet and like begins to reach forward and then steels his mind and looks up at you angrily.|All right.
1945;SAM;Can I also, as my bonus action-- Who's around me? Who needs inspiration? Who needs inspiring? Who's-- yeah, oh, shit. I'll give Pike some inspiration, 'cause she's my awesome sweetheart.
1946;ASHLEY;What do I get?
1947;LAURA;You get 1d8.
1948;ASHLEY;Hey, thanks, man.
1949;MATT;Next up is King Murghol, who's furious now.|Both of his beasts have been slain and most of his men have been completely torn asunder by multitudes of arrows and fireball spells. He, now growing in physical form, on top of already the musculature he acquired from that potion, is going to make his three attacks against whatever is nearby. That's actually going to be-- actually, that's gonna be two strikes against you, Scanlan, since you just now tried to make him stand on his head, and one against Kima.|(laughter)|That is a 15--
1950;SAM;Hit.
1951;MATT;-- a 24--
1952;SAM;(higher voice) Hit.
1953;MATT;-- and against Kima is a 20, that also hits.|So all three hit.
1954;LIAM;Nobody puts baby in the corner.|(laughter)
1955;MATT;Oof, all right. So the first strike hits you for 21 points of slashing damage.
1956;SAM;Still alive.
1957;MATT;The next one hits you for 23 points of slashing damage.
1958;SAM;No longer alive (laughs).
1959;ASHLEY;You're no longer alive?
1960;LAURA;Are you unconscious?!
1961;MATT;Scanlan falls unconscious on the ground from the two strikes of the king. The third strike back towards Kima, who's currently seizing from the effect of the spell. She's restrained, so he has advantage.
1962;LIAM;But she's got the basilisk blood in her eyes.
1963;MATT;There's a process to undoing a creature into stone. To your knowledge, it does not seem to be having an effect. However, Lady Kima takes 22 points of damage. All righty. That brings us to-- Vex, you're up.
1964;LAURA;Oh, that's me. Every time!
1965;LIAM;I'm Vex.
1966;LAURA;No, you're not. Okay, I'm gonna hail, I'm gonna-- hail of arr-- no, yeah, Hail of Thorns? At level three.
1967;MATT;Okay, at who?
1968;LAURA;At the queen and the illithid. So, I should've transferred my bonus action over to-- but I didn't, that's okay. That gives me-- I should've done this before, I'm an asshole, I'm sorry.
1969;LIAM;But what about in the game?
1970;LAURA;That gives me 2d10.
1971;MATT;Additional damage to the arrow.
1972;LAURA;Yes.
1973;MATT;So it explodes around, right? All right, so, fire the arrow. So, as your bonus action, you go and you grab one of the arrows out from the back, and as you pull it back you can see a bunch of these little thorns begin to grow and sprout from the actual shaft of the arrow. You release it and as it arcs across--
1974;LAURA;Yes! Natural 20! (cheering)
1975;MATT;Against the queen. All right, go ahead and roll the damage for the arrow and the damage for the spell. And all that doubles.
1976;LAURA;Oh, awesome.
1977;MARISHA;(sings) All that doubles is gold.
1978;TALIESIN;(sings) Only shooting arrows.
1979;ORION;(sings) In a butthole.
1980;LAURA;Yeah, all of it doubles.
1981;MATT;The bonus at the end doesn't double, just the dice.
1982;LAURA;Oh, so, 36--
1983;MATT;36 points of damage. Yeah, plus the seven.|And then it does-- it explodes? In a radius. And it does the dice damage, the 2d10, to--
1984;LAURA;To everything within five feet.
1985;MATT;All right, so the mind flayer and Grog.
1986;LAURA;Oh, right, yeah, I should've hit the mind flayer with that arrow. No, it would've still hit Grog. Okay.
1987;LIAM;Grog is a tank.
1988;LAURA;They have to make a dexterity saving throw.
1989;MATT;All righty. Grog does not make it and the mind flayer does not make it.
1990;LAURA;Yes!
1991;MATT;All right, cool. All right, second arrow you can fire now if you want to.
1992;LAURA;Second arrow. I'm gonna fire from my flaming bow. I've got one shot on that left. At her again.
1993;MATT;All right.
1994;LAURA;And that's a 28.
1995;MATT;That hits.
1996;LAURA;And that's nine plus a ten, where's my ten? There they are. That's plus two. 11.
1997;MATT;All right. You see flames begin to burn up along the side of her robe and she's looking really flustered and frustrated at this point. All right, that brings us to Kima's turn. No. She's made of hardy stuff. Kima currently is fighting this, is going to go ahead and release an entire-- all of her attacks against the king Murghol as he's right in front of her. She has disadvantage on that, unfortunately, because she is restrained.|She's gonna make two attacks against him using Divine Smite, expending a 3rd-level spell. So that's 3d8 extra damage to each strike. So the first one hits. Both hit. All right. She's going to do it twice.|That's gonna be 6d8 additional damage.
1998;MARISHA;Ooh! That's hot.
1999;MATT;Oof. Okay. So, as Kima rears back, her first strike comes down and hits overhead, into King Murghol's armor, and as it does, it hits. The blade only goes about a few inches in, but then all of a sudden the blade heats up white-hot and actually buries itself an additional six inches into his shoulder. He screams out in pain, reaches up and grabs the blade and as he does, his hand actually burns in the process. She pulls the blade out, around and swings it down again, sinking another eight inches into the side of his torso.|This time with a giant arc of white divine light into the side. He looks like he's starting to bleed out from the two of the wounds really heavily. The king is looking a little rough. That ends Kima's turn. Kima's going to try and make a saving throw. Kima pulls the blade out, and turns to stone herself.
2000;LAURA;Oh shit. Shit, shit, shit. He's still at like really high health, too. The king.
2001;SAM;What, he is?
2002;MATT;The king is looking a little rough.
2003;SAM;You never know. He might just start doing a headstand.|(laughter)
2004;MATT;The queen's turn.
2005;LAURA;Oh no.
2006;MATT;The queen looks over at Grog in front of her, kinda frustratedly, uses a bulk of sorcery points, puts her hand up towards him as he's pulling his axe back angrily. He fails his save.|And he puts his axe back down and looks towards the rest of the group.
2007;MARISHA;Oh no! Not again!
2008;MATT;Eye color glazed over.
2009;SAM;He's so easily influenced.
2010;LAURA;No, he's under her control.
2011;MATT;"So that was her sorcery points, her quick action. She then says, ""We're not gonna die this day alone and I won't die. My love, I'm sorry, but there's much more work to be done."" And she raises her hand up and you see this buildup of green arcane energy at her hand. She turns it towards the rest of the group, faces it up towards the ceiling and releases this pulse of arcane, green, ill-looking energy that blasts into the stone ceiling. As it does, the stone itself disintegrates in a large chunk, and a glowing mass of seeping, hot, molten magma begins to pour into the room."
2012;MARISHA;Oh shit!
2013;ORION;Where's it coming from?
2014;MATT;It's now coming from right here.
2015;LAURA;Oh my god.
2016;LIAM;(sings) TPK. TPK.
2017;MATT;So now, magma is pouring onto the throne room from above. The giant fall that is on top of the fortress is now peering into the room.
2018;SAM;(high-pitched) Someone grab me and leave.
2019;MATT;That brings us to Tiberius, who is stone.|Clarota currently looks around and--
2020;ORION;Hold on. Am I conscious in stone form?
2021;MATT;No. You are a slate. You are a blue screen.|You are Grog after the intellect devourer.
2022;ASHLEY;Oh god, this is bad.
2023;MATT;Okay. (laughs)
2024;SAM;Pike, it's all on you, dude.
2025;MARISHA;Do you have water?
2026;ASHLEY;I can create it.
2027;MATT;Clarota steps back and grabs Lady Kima and begins dragging her back through the doorway.
2028;LAURA;Oh god, we've got to get out. That's a retreat.
2029;MATT;Pulling her down towards the stairway. That brings us to Keyleth.
2030;SAM;Keyleth. Keyleth. Get us out of here.
2031;MARISHA;Okay, okay, okay. I come out of the form.|Yes, thank you.
2032;MATT;It's a free action.
2033;ORION;Isn't there a dead basilisk right in front of us right now?
2034;MATT;There is a body of a dead basilisk on the ground, yes.
