;Player_Name;Transcription_Text
939;SAM;I had a question.
940;MATT;Yes.
941;SAM;Did we assemble a team of magic--
942;LAURA;To take care of the thingy?
943;MARISHA;Yeah, that we needed to-- we all need to take care of that.
944;LAURA;The marble of death?
945;MATT;So, throughout the week, Keeper Yennen, a few of the low-level arcanists that exist here--
946;LAURA;Didn't we send for Eskil Ryndarien?
947;MATT;You sent for him, but you know information right now travels at the speed of whatever it is you--
948;MARISHA;By mule?
949;MATT;Yeah.
950;TALIESIN;At speed of mule.
951;MATT;The speed of that as it continues forward.
952;MATT;You get word back.
953;MATT;Nothing from Allura Vysoren yet.
954;MATT;Eskil does respond, saying he is currently finishing up some personal business, but will make his way towards Whitestone within a couple weeks, with some of his compatriots who may also be of aid.
955;MATT;Information has been gotten across, but it won't be until probably after this festival for them to begin their investigation.
956;MATT;However, in the meantime, Keeper Yennen and a few of the smaller local arcanists do make a couple trips down to inspect the ziggurat themselves.
957;MATT;When they return, Yennen is at a loss.
958;MATT;Most of them don't quite understand the nature of the magic there.
959;MATT;It seems to be immobile.
960;MATT;It seems to be completely either negating, consuming, or preventing any sort of magical force within a specific radius of it.
961;MATT;A lot of their normal arcane methods of inspecting or divine methods of inspecting this site are not functional.
962;MATT;This is more like bring old tomes and research historical records of things that may be similar to this.
963;MATT;So when you bring up that you had reached out to Eskil Ryndarien with the information you had, you gather that will probably be a much more fruitful endeavor.
964;MATT;As of right now, no one has any clue what this is.
965;LAURA;And we searched the Briarwoods' library that they had gathered together that say anything about--
966;MATT;Yeah.
967;LAURA;Okay.
968;MATT;Some of the information you acquired from Scanlan's memory and a little bit of research into Vecna.
969;MATT;Very little information really exists, but as the keeper of secrets, you get the sense that most anything of importance in dealing with this ritual has been destroyed as part of its preparation because secrets are meant to be kept and hoarded.
970;MATT;So not much luck in that regard, unfortunately.
971;MATT;However, as the second week draws to a close, the Winter's Crest day comes forward.
972;MATT;As the morning crests into the proper Winter's Crest festival, you all awaken in Castle Whitestone to an unusually cold morning.
973;MATT;As you look out, there is a fresh dusting of white snow that has gently caressed the entirety of this valley and the entire city itself.
974;MATT;You all get yourselves ready, gather your belongings and preparing for the festival you've been helping get ready this entire week, you walk down towards Whitestone itself.
975;MATT;As you get to the outskirts of the city, you can already hear in the distance music beginning to play.
976;MATT;Blue and white ribbons are hung up all throughout the town, on the outside of buildings, outside of taverns, outside of even the remaining wreckage that is only partially built.
977;MATT;It seems that overnight, people just went through the town and decorated whatever needed to be decorated to wipe clean the memory of the recent trials and difficulty that everyone's undergone.
978;MATT;You begin to make your way towards the center of the town, to the town square where the Sun Tree is, and as you approach, you now see the source of the music, as a number of individuals in the town have brought out their instruments.
979;MATT;They're playing, some more discordant than others, but overall, a sense of joy as people for the first time in a long time are truly embracing this positive atmosphere.
980;MATT;You see children laughing and running through the streets.
981;MATT;You can smell fresh-cooked pies and various bakery items just filling the air around you.
982;MATT;Looking over, as you approach the Sun Tree, you can see where once bodies hung from its boughs, there now are strings of blue and white ribbons that are intertwined with each other, braided and set across from branch to branch.
983;MATT;You can see fine little glass structures that have been hand blown and left to drape from them to be part of the festivities.
984;MATT;As you begin to make your way up there, immediately people begin to notice your presence, and you can see people in the streets begin to gather up and begin cheering.
985;MATT;You hear voices mutter out, Vox Machina!
986;MATT;People start reaching out and shaking your hands.
987;MATT;Thank you so much, thank you.
988;MATT;You're taken aback by the attention.
989;MATT;It's reminding you a little bit of the awkwardness you had with the last Winter's Crest in Emon.
990;LAURA;Be on the lookout for eggs, giant frosty-looking eggs.
991;MATT;You make your way towards the Sun Tree and there you see Keeper Yennen is in the process of speaking with a few of the people that helped him with this entire rebellion, in setting up this event, and he greets you all as you approach.
992;MATT;Oh, my friends!
993;MATT;How wondrous.
994;MATT;Glad to see you are all wakened and ready and well rested, I assume.
995;TRAVIS;Yes.
996;MATT;Glorious.
997;MATT;Well, this is a day of celebration.
998;MATT;We've taken the time and mourning shall continue as needed, but today, today is to embrace what it means to be alive, to thwart the darkness and the evils that press upon the free folk of these lands.
999;MATT;And of course, to eat and drink until you are full and drunk.
1000;MATT;(laughter)
1001;MARISHA;Cheers to that.
1002;MATT;It will be a little bit before we get to the actual celebration speech, but in the meantime, go free yourselves, drink, be merry.
1003;MATT;There are a few events going on around you.
1004;MATT;And he points in a few directions, and you can see around you there are tables set up, there are individuals playing games.
1005;MATT;Immediately to the left, you can see there are two long tables set up and a stack of pies off to one side, looks like an eating contest.
1006;TRAVIS;I haven't eaten for a full day.
1007;MARISHA;In preparation?
1008;TRAVIS;Yep.
1009;MATT;You do see what looks to be a gentleman with a high box, with a very, very fine waxed mustache that is currently doing parlor tricks and magical presentations for people who are trading coin to be astounded with his illusions.
1010;MATT;You can see what looks to be a series of tables behind the Sun Tree heading towards the southeast side of it.
1011;MATT;You recognize better than anyone: these are central tables, relatively small, with a chair on each side.
1012;TRAVIS;Arm wrestling!
1013;TRAVIS;(laughter) Craven, I think-- oh wait, that's arm wrestling.
1014;TRAVIS;Go to sleep.
1015;MATT;The sigh is getting more and more impatient.
1016;TRAVIS;He'll get used to that.
1017;MATT;So these are the three first events you come across in your immediate vicinity.
1018;MATT;What would any of you guys like to partake in?
1019;MARISHA;I see the magic tricks and go (loud gasp) and run over, without saying anything.
1020;SAM;I tag along.
1021;TALIESIN;Oh, I'll go in for this one as well.
1022;MARISHA;Okay.
1023;MATT;As you guys rush forward, you come to the box.
1024;MATT;It's a relatively high box.
1025;MATT;It looks like it hasn't seen some use in a while.
1026;MATT;The gentleman sitting there, with longish hair, parted in the center, and combs outward.
1027;MATT;He's got a waxed mustache.
1028;MATT;He's wearing dusty presentational robes and he has on the top of it a series of small boxes and what looks like various tricks he has at the ready.
1029;MATT;There are three children off to the side with either their keeper or parents behind.
1030;MATT;Now watch, if you will, as this simple ball transports itself between the cups and yet find your eyes unable to follow.
1031;MATT;And he switches the cups around for a moment.
1032;MATT;(whoosh) (laughter) Where is the ball, little one?
1033;MATT;The kids deliberate and one goes, That one!
1034;MATT;Are you sure?
1035;MATT;They all shake their head.
1036;MATT;Oh!
1037;MATT;I'm sorry, the ball has escaped your vision once again.
1038;MATT;And they all they cheer.
1039;MATT;He lifts the other one.
1040;MARISHA;(gasps), are you a wizard?
1041;MARISHA;We've met a few wizards.
1042;MARISHA;No, are you a sorcerer?
1043;MARISHA;Because you don't look like a druid.
1044;MARISHA;This doesn't look like natural magic.
1045;MARISHA;What?
1046;MATT;I am what you refer to as an illusionist.
1047;MATT;And I can play tricks on your mind, your mind, your mind...
1048;MARISHA;(shouting) No!
1049;MARISHA;God, we've been through way too much of that here lately.
1050;SAM;It's entertainment.
1051;MATT;Playful!
1052;MATT;Playful illusions, not against...
1053;SAM;It's just a game.
1054;TALIESIN;Carry on.
1055;TALIESIN;It's good.
1056;TALIESIN;She's good.
1057;MATT;Keep her in check, please.
1058;MATT;You're scaring the children.
1059;SAM;It's not real.
1060;SAM;It's a game.
1061;SAM;It's going to be fine.
1062;MARISHA;(whispers) Okay.
1063;MARISHA;I don't trust this guy.
1064;SAM;Don't worry.
1065;SAM;Why don't you have Percival take the first turn?
1066;MATT;I'm also a diviner.
1067;MATT;I can look into your eyes and see your very future.
1068;TALIESIN;Not really.
1069;TALIESIN;It's okay.
1070;MATT;For a simple gold piece, you can test your skills against the transference of this ethereal ball.
1071;MATT;Or for five, I can look into your fate.
1072;MARISHA;(starts hyperventilating)
1073;TALIESIN;I'll do both, actually.
1074;MATT;Ha ha.
1075;MATT;All right.
1076;MATT;Takes the gold piece.
1077;MARISHA;I grab him by the scruff and I say, if you hurt him... You don't know what he's been through, okay?
1078;MATT;It's fine.
1079;MATT;It's all right.
1080;MARISHA;Are you working with the Briarwoods?
1081;MARISHA;Did the Briarwoods send you?
1082;MARISHA;!
1083;MATT;Can you please get her off of me?
1084;SAM;Hey, kids, this is why you shouldn't drink during the daytime.
1085;MATT;Anyway.
1086;MARISHA;Do your magic.
1087;MATT;So, sir.
1088;MATT;Takes one gold piece off, sets it aside.
1089;MATT;Now, the ethereal ball.
1090;MATT;This was taken from the Far Realms themselves, crafted in the ivy-covered hills in the far North End, the Feywild itself.
1091;MATT;How could you follow this, with but your simple vision?
1092;MATT;He places one cup over it, two cups to the side and begins shifting and shifting.
1093;MATT;Go ahead and make a perception check.
1094;MARISHA;Oh, him?
1095;MARISHA;Okay.
1096;TALIESIN;20.
1097;MATT;You see now, there's a couple moments where the ball shifts between cups and you get a really close idea of exactly how this works.
1098;MATT;And when he finishes, he looks to you.
1099;MATT;Now, where is the fey ball?
1100;TALIESIN;I would say it's to your right, right there.
1101;MATT;That one?
1102;MATT;(laughter) Are you sure?
1103;MATT;It could be anywhere on this table.
1104;TALIESIN;It could, but it's there.
1105;TALIESIN;Because it's not anywhere else other than there.
1106;SAM;I'm not so sure about that, Percy.
1107;TALIESIN;Well, you're welcome to go in, if you like.
1108;SAM;I choose the one on the left.
1109;TALIESIN;You'll have to give him a gold coin, though.
1110;SAM;Sure.
1111;SAM;(ding)
1112;MATT;He takes the gold coin.
1113;MATT;Do you wish to choose for this one instead, then?
1114;TALIESIN;No, I'm choosing on the right.
1115;MATT;Takes the gold piece.
1116;MATT;And with that-- You found it, yay.
1117;MATT;(laughter) He gives you five gold.
1118;MARISHA;I lean into Percy and I say: this guy's not a threat.
1119;MARISHA;He's okay.
1120;TALIESIN;Well, I am a dark evil demonic creature.
1121;MATT;As he gives you the five gold, he immediately takes it back.
1122;MATT;But you wanted to know your fate.
1123;TALIESIN;Yes.
1124;MATT;Step forward, young-- what's your name?
1125;TALIESIN;Just Percy.
1126;MATT;Percy.
1127;MATT;Please, present your face.
1128;MATT;As he reaches out, he begins to feel the bumps on your head.
1129;MATT;He begins to touch the outside of your face.
1130;MATT;He closes his eyes.
1131;MATT;Yes, yes, I can see into the very nature of your existence.
1132;MATT;You, young-- Percy?
1133;TALIESIN;Yes.
1134;MATT;Percy, Percy.
1135;MATT;Young Percy.
1136;MATT;You, you have hardworking hands, you've seen a lifetime of hard, hard work in the fields.
1137;MATT;But you wish to make your father proud, as does every son and you will-- as one day you will become... a well celebrated smith of horseshoes!
1138;MATT;Yes!
1139;MATT;Glory to Percy!
1140;SAM;Amazing!
1141;SAM;So accurate.
1142;TALIESIN;So accurate.
1143;MATT;He leans in and says, I could tell from the black powder on your hands that you've worked with a few pieces of iron in your time.
1144;TALIESIN;Very astute.
1145;MATT;(chuckles) Thank you so much.
1146;MATT;So, who's next?
1147;MATT;The children start rushing up and-- you guys wish to continue with this guy?
1148;MARISHA;No.
1149;MARISHA;(laughter)
1150;SAM;All right, we'll leave.
1151;MARISHA;I've seen enough.
1152;MATT;Okay, who's doing what now?
1153;TRAVIS;Does anyone want to get down to the pie contest?
1154;TRAVIS;I thought I might arm wrestle first.
1155;LIAM;I think you should arm wrestle.
1156;SAM;Oh yeah, I want to see this.
1157;TRAVIS;I'd like to arm wrestle, in case I need to eat my way out of sadness with pies.
1158;MATT;(laughs)
1159;TALIESIN;Turn your sadness into victory.
1160;TRAVIS;Yeah.
1161;SAM;I will also enter the arm wrestling competition.
1162;MATT;All right.
1163;TRAVIS;Yes!
1164;MATT;Okay, okay.
1165;MATT;So, as you guys step up, you can see there's a woman dressed in a rather simple barmaid outfit, leather apron on her side and she's pretty thick and rough-and-tumble with her timbre.
1166;MATT;She has her hair pulled up in a very tight bun in the back.
1167;MATT;She has a bit of a smudge on her chin.
1168;MATT;She says, All who wish to enter the contest please step right here, pay your entry fee!
1169;MATT;Graciously prove your might and your strength.
1170;MATT;Show that you yourself are responsible for the rebellion succeeding.
1171;MATT;Sees you.
1172;MATT;You!
1173;MATT;You wish to be part of this, yes!
1174;TRAVIS;Yeah, I do!
1175;MATT;Very well, very well.
1176;MATT;Ah, entry fee-- She leans in and gets real for a second.
1177;MATT;Entry fee is 25 gold pieces each.
1178;MATT;Winner gets free drinks and the pot.
1179;LIAM;I slap down 25 gold on behalf of Grog.
1180;TRAVIS;(excited gasp)
1181;SAM;You're paying for his entry?
1182;LIAM;I'm paying for his entry, sure.
1183;SAM;And mine, as well?
1184;LIAM;No.
1185;TRAVIS;Good man.
1186;SAM;I would like to-- I would also like to compete.
1187;MATT;(prolonged high-pitched giggle) Sorry.
1188;MATT;25 gold then.
1189;SAM;Here you go.
1190;MATT;I mean no offense, I just-- it's a cute beret.
1191;TALIESIN;(laughs) Wow.
1192;MATT;Other individuals come and enter and you can see as you guys are preparing for this event, you hear the rattling of chains nearby and you can see two guards stepping up with--
1193;LAURA;The other goliath!
1194;MATT;Goran Vedmeyer, who you've seen--
1195;LAURA;The Duke!
1196;MATT;Yeah, no longer Duke.
1197;MATT;Un-Duked.
1198;LAURA;Once you Duke something, you can't un-Duke it, Matt.
1199;MATT;No, he's been thoroughly un-Duked, trust me.
1200;MARISHA;The Duke that was formerly known as--
1201;TRAVIS;Duke Gonad.
1202;MATT;Yeah.
1203;MATT;He's brought by two of the guards and the guards whisper to each other.
1204;MATT;They bring out their own 25 gold pieces and they plop it into the pot.
1205;MATT;He's entering as our proxy.
1206;MATT;He looks around.
1207;MATT;Yes, what they said.
1208;MATT;She gives a nod.
1209;MATT;Well, I don't see why not, I suppose.
1210;MATT;All right!
1211;MATT;Other people end up gathering up their change and she goes over the sheet with one of her compatriots and they end up breaking off into teams.
1212;MATT;There are four tables set up and for this round, at least, this part of the festival, they break up in different parts.
1213;MATT;She calls out to one table.
1214;MATT;All right, we have a Jasper Leer to go against a Scanlan Shorthalt at this table.
1215;SAM;That's me!
1216;TRAVIS;Yay, Scanlan!
1217;MARISHA;Yes, Scanlan!
1218;MATT;As you're getting ready, you see a farmer-type individual.
1219;MATT;Clean, as dressed as he could be in relatively ragged clothes, but he looks like he's trying to be presentory for the festival.
1220;MATT;Grey beard, longish shoulder-length tousled hair.
1221;MATT;He walks up, pulling his wrist back, and he's got some good muscles.
1222;MATT;Looks like he's definitely been working a lot of heavy farmwork for most of his life.
1223;MATT;He sits down at the table across from you, gives you a look over.
1224;MATT;Well, shall we begin?
1225;SAM;Sure.
1226;SAM;Can I ever-so-covertly say to him, you don't want to beat a gnome.
1227;SAM;You don't want to beat a gnome.
1228;SAM;I'm casting Suggestion on him.
1229;MATT;I will say, go ahead and make a sleight-of-hand check.
1230;SAM;Oh, the worst.
1231;SAM;Shit.
1232;SAM;13.
1233;LAURA;What does it mean?
1234;LAURA;The eyebrows!
1235;TRAVIS;And the phone came out.
1236;SAM;Who knows?
1237;SAM;We'll find out when my arm gets wrenched off.
1238;LAURA;Looking at Jasper's stats, I can tell.
1239;MATT;No, what are you talking about?
1240;SAM;He's checking Twitter.
1241;MATT;Yeah, got to respond to a couple-- guys, give me a second.
1242;MATT;All right.
1243;MATT;So, he has his hand up, he looks you over with a look of intensity for a second.
1244;MATT;Put your hand up.
1245;SAM;Yes, sir.
1246;MATT;He clasps his fingers entirely around your hand at this point.
1247;MATT;As the intensity mounts, the crowd gathers around, everyone begins cheering, the barmaid steps up again.
1248;MATT;All right, two of you, hands together.
1249;MATT;And prove your strength... now!
1250;MATT;Go ahead and make a strength check.
1251;SAM;19.
1252;MARISHA;(laughs) Oh shit.
1253;MATT;You guys stand there for a second (groans) his arm begins to push on yours, begins to bend back a little bit, you reflex with might and begin to set him back up to the center.
1254;MATT;You've reached a standstill, once again, back at the center.
1255;MATT;His expression on his face looks frustrated and surprised.
1256;SAM;You weren't expecting this, were you?
1257;SAM;(pants) Neither was I!
1258;MATT;Make another strength check.
1259;SAM;Not as good.
1260;SAM;11.
1261;MATT;11.
1262;MATT;At this point, as you say that, he tenses and forces down your hand now, right at three-quarters to the table.
1263;MATT;Make another strength check.
1264;MARISHA;Come on, Scanlan!
1265;SAM;16!
1266;MATT;16.
1267;MATT;(groans) About to touch the knuckles--
1268;SAM;What is going on?
1269;SAM;I had-- This has never happened before.
1270;MATT;He's keeping his hand to his side, trying not to grasp the edge of the table, which is technically against the rules.
1271;MATT;He's looking around at everyone watching and realizes the sheer amount of attention that's put on the fact that this tiny little gnome is now keeping him at a standstill.
1272;LIAM;I shout out from the crowd, Scanlan!
1273;LIAM;Pike is here!
1274;LIAM;She's astral-projected in!
1275;SAM;Natural one.
1276;SAM;(laughter)
1277;MATT;With that moment of distraction, you look around and (wham) your arm hits the table.
1278;MATT;Cheers go on, everyone shouts happily.
1279;SAM;You idiot!
1280;LIAM;All the blood rushed somewhere else, that's not my fault.
1281;SAM;I had him!
1282;SAM;(groans)
1283;MATT;He lifts up his tankard to the side, someone begins pouring ale into it.
1284;MATT;He shouts his victory out, everyone cheers.
1285;MATT;The barmaid pats you on your back.
1286;MATT;You did good, you did good.
1287;SAM;I don't need your pity!
1288;SAM;Grog, kick this motherfucker's ass!
1289;MATT;Two more events go by, two more gentlemen have a showdown-- actually no, it's a woman and a man.
1290;MATT;The woman is a pretty tough-looking warrior, probably one of the guards of Castle Whitestone.
1291;MATT;She's still in partial armor, has been guarding the event, has taken her helmet off to be part of this event, taking a moment to relax.
1292;MATT;She goes up against another merchant of the town and just destroys him.
1293;MATT;The next bout is a man who, the way he's dressed, appears to be a blacksmith.
1294;MATT;He still has his leather gauntlets on, he takes them off at the table, takes off his leather apron and sets it to the side.
1295;MATT;Gets down and ready and looks around for his opponent and the two guards bring up the chained Vedmeyer, who then sits down at the table, the chains hitting against the sides of the wooden table top and coasting to the ground as they adjust.
1296;MATT;He puts his arm on the table with a thud, and has to bend over to even reach the other guy's grasp.
1297;MATT;You can see the look on his face immediately pale as he realizes who he's up against.
1298;MATT;It's two rounds and maybe 20 seconds tops before Vedmeyer slams him so hard you can part of the tabletop splinters inward and the guy brings his hand back with bleeding knuckles.
1299;MATT;He reaches over, puts his hand out expectantly.
1300;MATT;The barmaid hands him a tankard full of ale.
1301;MATT;He downs it in one gulp, slams it on on the table and stands back up again.
1302;MATT;He glances over at you and steps back into the crowd.
1303;MATT;The second round of the events go in.
1304;MATT;You are paired up with the gentleman who defeated Scanlan.
1305;MARISHA;Kick his ass, Grog!
1306;TALIESIN;Yeah!
1307;SAM;Put him in a body bag!
1308;TRAVIS;I sit down and I say, I feel really bad for you mate.
1309;TRAVIS;You know, my friend?
1310;TRAVIS;He's got hand herpes...
1311;TRAVIS;So do I.
1312;SAM;It's true.
1313;MATT;Make a deception roll.
1314;TRAVIS;20!
1315;TRAVIS;19 plus one!
1316;MATT;Natural one on his part.
1317;MATT;He looks genuinely frightened and is about to back up and get the attention of the barmaid who's running this event and he sees the crowd around.
1318;TRAVIS;I mean, you're a farmer, right?
1319;TRAVIS;You handle food.
1320;MATT;He spits in his hand, puts it out and grabs your hand.
1321;MATT;The barmaid once again.
1322;MATT;And-- prove your strength!
1323;MATT;Roll a strength check.
1324;MATT;He has disadvantage.
1325;TRAVIS;21.
1326;MATT;Natural one.
1327;MATT;He's already straining and the back of his knuckles are immediately up against the wood.
1328;MATT;You can see fear in his eyes and he's gripping, but he's also trying to move his fingers to make sure he doesn't make too much contact with your hand.
1329;MATT;Go ahead and roll another strength check.
1330;TRAVIS;11.
1331;MATT;At which point, he sees the grin on your face and gets his will back behind him and (grunts) forces you back to the center.
1332;MATT;Make another strength check.
1333;TRAVIS;Oh, shit.
1334;TRAVIS;Seven.
1335;MATT;Natural 20.
1336;LAURA;Oh no!
1337;MATT;He (groans) slams you right over on the edge of the table.
1338;MATT;Make another check.
1339;MARISHA;Come on, Grog!
1340;TRAVIS;23.
1341;MATT;19.
1342;MATT;Back up to the center, at a standstill.
1343;MATT;You see now the veins bulging at his neck, you can see now, his face is turning red from the strain.
1344;MATT;He's breathing heavily (pants) as he pushes again.
1345;MATT;Make another strength check.
1346;LAURA;Come on, Grog!
1347;TRAVIS;Eight.
1348;MATT;(chuckles) Eight.
1349;MATT;(groans) Keeping you right in the middle.
1350;MATT;Make another check.
1351;SAM;I hold up my hand and I use Minor Illusion to make it all dotted with herpes.
1352;MATT;He glances sidelong at your hand and (whimpers).
1353;MATT;I'm going to give him disadvantage on this one.
1354;MATT;All right, what did you get?
1355;TRAVIS;17.
1356;MATT;17.
1357;MATT;(laughs) With a disadvantage, he got a six.
1358;MATT;(groans) The hand goes at three-quarters.
1359;MATT;He's now looking at you, looking at Scanlan's hand, looking at you, looking at his own hand, he's really worried.
1360;MATT;Make another strength check.
1361;TRAVIS;It's slippery when the pores start to seep.
1362;TRAVIS;That's a one.
1363;SAM;No!
1364;TALIESIN;No!
1365;MATT;With a disadvantage, he gets a two.
1366;MATT;You guys are at the middle again.
1367;LAURA;Oh my god.
1368;MATT;Big struggle.
1369;TRAVIS;22.
1370;MATT;With disadvantage again, because of that-- though disadvantage is fading at this point.
1371;MATT;He got a 12.
1372;MATT;So yeah (groans), now he's back down.
1373;LAURA;Come on Grog, finish it!
1374;TRAVIS;22.
1375;MATT;He got a seven.
1376;MATT;He looks at you, looks at the hand, looks at you again and you can see in his face, the sudden look of acceptance as you stop playing with him and (whack) slam it really hard on the wood.
1377;MATT;You can see, he pulls away... (gasps) Wash it!
1378;MATT;Wash it, please!
1379;MATT;Wash it, somebody wash it!
1380;TRAVIS;You know, the cure for that is actually on my man Vax's groin.
1381;TRAVIS;It's very magical.
1382;MATT;He slowly backs into the crowd, looking very disturbed and disgusted as everyone else is cheering for you.
1383;MATT;A tankard is slammed before you, filled with ale.
1384;MATT;Drink up, you've earned it, champion.
1385;TRAVIS;I look at Gonad over at the side.
1386;TRAVIS;I drink it, chug it down, and hold up the finger at the same time.
1387;MATT;(laughs) He sits there and tenses for a second with a grin, as he growls, his cold breath in the cold Winter's Crest air dissipates up above him and he gives you a nod, the slow look of warrior intensity, but respect.
1388;MATT;You can see he's looking forward to hopefully this as much as you are, but he still has a battle to do himself.
