;Player_Name;Transcription_Text
2626;SAM;You've got to go back to your people?
2627;MARISHA;I have to go back to Zephrah.
2628;TALIESIN;Well, I think we're going to need help getting to Whitestone, and then I think it's going to take at least a day for you to regain the power to return to your people.
2629;MARISHA;Bad influences, all of you.
2630;MARISHA;Assholes.
2631;TALIESIN;We're not getting rid of you quite that easily.
2632;MARISHA;All right.
2633;MARISHA;One day.
2634;TRAVIS;If you can bear it.
2635;MARISHA;And then I want to not see your faces for a bit.
2636;SAM;Sure, that makes sense.
2637;SAM;Pikey-poo, where are you going?
2638;ASHLEY;Well, I'd like to come with you guys for a little bit because frankly, I don't really want to be alone for a while.
2639;TALIESIN;I don't think any of us do.
2640;TRAVIS;I pull her into the biggest hug.
2641;ASHLEY;Oh, P-- oh, Grog.
2642;TRAVIS;You almost called me your own name.
2643;TRAVIS;It's okay.
2644;TRAVIS;You'll be fine.
2645;ASHLEY;I was going to call you Poobah, but then I wanted to say your real name.
2646;MARISHA;We could go back to Whitestone whenever.
2647;MARISHA;I've still got a little bit of juice left.
2648;LAURA;You've got enough juice to get us to Whitestone right now?
2649;MARISHA;I do, believe it or fucking not.
2650;TRAVIS;I don't.
2651;TRAVIS;You gave us the option.
2652;MARISHA;What?
2653;TRAVIS;You said believe it or fucking not.
2654;TRAVIS;I call nope.
2655;MARISHA;Oh, it was more of a rhetorical-- it's like a trick or treat-- why do we still try to explain things to him?
2656;MARISHA;I haven't learned.
2657;ASHLEY;Because he's learning.
2658;MATT;Kima's clasping her cup and goes, I can watch this all day.
2659;TRAVIS;Thank you, Pike.
2660;ASHLEY;He learns something new every day.
2661;TALIESIN;How did Whitestone look?
2662;MATT;It's blurred at a distance.
2663;MATT;Aside from the specific target of your scrying, you don't get much of a vision, just an idea of the blurry exterior.
2664;LAURA;Should we drunkenly walk to the tree?
2665;SAM;Are we transporting tonight?
2666;SAM;Why don't we chill for a night?
2667;LAURA;Don't you want to see your daughter?
2668;SAM;Well, of course, but I'm drunk and bloody.
2669;MARISHA;We can drunkenly walk there and take our time and enjoy the stars and we can-- oh!
2670;MARISHA;Scanlan--
2671;SAM;Did you have a drink?
2672;MARISHA;Scanlan.
2673;SAM;What can we do?
2674;MARISHA;We can do little arcane cantrips when no one's looking and break the rules a little bit.
2675;MARISHA;Of Vasselheim.
2676;MARISHA;Just cantrips, though.
2677;SAM;You're such a rebel.
2678;MARISHA;I know.
2679;TALIESIN;I forgot.
2680;MARISHA;What?
2681;TALIESIN;No, you're fine.
2682;MARISHA;What?
2683;TALIESIN;Nothing.
2684;TALIESIN;You're fine.
2685;TALIESIN;Love you very much.
2686;MARISHA;I've lost the love of my life today.
2687;MARISHA;I'm allowed to be belligerent.
2688;TALIESIN;You are.
2689;TRAVIS;Are we throwing caution to the wind?
2690;SAM;Sure.
2691;TRAVIS;I do have something that might up the party a little bit.
2692;SAM;Okay, what is it?
2693;TRAVIS;I reach into the bag of holding and I pull out a little leather pouch.
2694;MARISHA;Do you have that sandkheg shit?
2695;LAURA;No.
2696;TRAVIS;What?
2697;SAM;What is that?
2698;SAM;What have you got?
2699;TRAVIS;So I've got this little deck of cards and every time someone pulls from it, great shit happens.
2700;ASHLEY;I'm in.
2701;TRAVIS;One.
2702;TRAVIS;Two.
2703;TRAVIS;Scanlan?
2704;SAM;I've seen this before, haven't I?
2705;SAM;I think I was with you when you got the guy rich.
2706;SAM;Wasn't I?
2707;MATT;No, he was on his own.
2708;TRAVIS;He's the Lord of the Quadroads now.
2709;SAM;I was with him when he did one of them, though.
2710;MATT;You're semi-aware that there's something going on.
2711;MATT;Make an arcana check.
2712;TALIESIN;Oh, this could go so badly.
2713;SAM;15.
2714;MATT;15.
2715;MATT;Something creeping in the back of your mind, something you've learned, something you've heard, really tells you that this is powerful and chaotic.
2716;SAM;I'll watch for now.
2717;TRAVIS;You'll partake.
2718;SAM;Probably.
2719;TRAVIS;Three.
2720;TRAVIS;Percy?
2721;TALIESIN;I think I've had enough for one day.
2722;SAM;If we're going to do that, we should go back to Whitestone first.
2723;TRAVIS;Why?
2724;TRAVIS;This place is already fucked up.
2725;TRAVIS;Let's get it on.
2726;TRAVIS;Keyleth?
2727;MARISHA;I am drunk enough to where I'm not going to stop it or argue against it, but I won't partake, so that's pretty good for me.
2728;TRAVIS;Why are you so resistant to gifts and wonder?
2729;TRAVIS;Magic?
2730;MARISHA;Grog, you've had two weapons speak to you--
2731;TRAVIS;Don't be jelly.
2732;LAURA;Nothing powerful comes without a price.
2733;LAURA;We saw that.
2734;LAURA;We just saw that with the Raven Queen.
2735;LAURA;Power comes at a price.
2736;LAURA;You think that wonderful things are going to be pulled out of your hands here, and there's going to be no consequences?
2737;TRAVIS;Pretty much.
2738;MARISHA;Grog, haven't we been through enough shit to know nothing's free?
2739;TRAVIS;What?
2740;MARISHA;Fuck it.
2741;TRAVIS;Here or Whitestone?
2742;TALIESIN;Oh, definitely not at Whitestone.
2743;TRAVIS;All right.
2744;TRAVIS;Pike, you want one?
2745;TRAVIS;(laughter)
2746;TALIESIN;I've always worried about the two of you.
2747;ASHLEY;Well, I think you should pick a card, and we deal with one as of right now.
2748;ASHLEY;And then maybe I'll pick one later.
2749;TRAVIS;Well, jeez, I thought we were all having tequila shots and going crazy and taking pictures and writing our name on the bathroom walls, but it seems like everybody's lost their nerve.
2750;TRAVIS;I put it back in the bag of holding.
2751;TRAVIS;(laughter and groaning)
2752;MATT;You're such an asshole!
2753;TALIESIN;You're such a dick.
2754;LAURA;Don't do it!
2755;MARISHA;You insult our resolve and hold out on us all at the same time?
2756;TRAVIS;The night's still young.
2757;ASHLEY;Ugh, just pick one!
2758;MATT;All right.
2759;SAM;We're traveling now?
2760;SAM;We're drunk!
2761;MARISHA;Yeah!
2762;TALIESIN;Let's drive a tree.
2763;TALIESIN;It'll be fun.
2764;MATT;You all wander outside of the tavern, find your way over to the nearest tree that's functional.
2765;MATT;It takes you a little bit, because a lot of trees look thicker at a distance when you're drunk than when you approach.
2766;MARISHA;Yeah, no, this one won't work.
2767;MARISHA;No, this won't work.
2768;MARISHA;Sorry.
2769;TALIESIN;That's more of a shrub.
2770;MARISHA;Sorry.
2771;MARISHA;Next one.
2772;MARISHA;That one looks good.
2773;TALIESIN;Yes, that looks nice.
2774;SAM;That's a young boy.
2775;TALIESIN;Oh, yes.
2776;MATT;Eventually, you find the tree that'll work, which is interesting, because you have this combination of people that are recognizing you as Vox Machina, as the whispered saviors of the town as you drunkenly stumble through the city streets, naught but hours after sealing a recently ascended god.
2777;MATT;It's strangely so perfect for you.
2778;MATT;As you approach the tree that you find that'll work, Allura has her arm over Kima.
2779;MATT;She's a lightweight.
2780;MATT;You go on ahead.
2781;MATT;We need to help here with the construction effort.
2782;LAURA;You've got to get your construction on?
2783;MATT;No, we're just-- And then Kima goes, Yes!
2784;TRAVIS;(laughing) She doesn't handle that booze very well.
2785;MATT;We'll see you soon.
2786;MATT;Travel safe, and thank you.
2787;SAM;Love you.
2788;MATT;Okay.
2789;MATT;(laughter) Kima drags her hand.
2790;MATT;Kima's drank far more, but is sober.
2791;MATT;She can hold her liquor.
2792;MATT;All right, thank you, guys!
2793;MATT;And grabs her hand and pulls her off, and they both wave bye as they step back into the city.
2794;MATT;You complete your spell, emerging from the exterior of the Sun Tree.
2795;MATT;Back in Whitestone, the comfort is here once more.
2796;MATT;It seems to be just past dusk at this point.
2797;MARISHA;(slurred) See?
2798;MARISHA;When you travel-- wait, no.
2799;MARISHA;When you travel west to east, you gain time.
2800;MARISHA;See?
2801;SAM;Yeah, you called it.
2802;ASHLEY;Time travel.
2803;MARISHA;(slurred) Happy hour is right now in Whitestone.
2804;MARISHA;Just saying.
2805;TALIESIN;Let's head home?
2806;SAM;That works.
2807;MARISHA;Okay.
2808;MARISHA;Heading home works.
2809;MATT;You guys make your way to the castle.
2810;MATT;Food is presented.
2811;MATT;Everyone's happy to see you back.
2812;MATT;What do you want to do?
2813;SAM;Now or forever?
2814;MATT;Oh, we'll get to the forever bit in a minute.
2815;MARISHA;Cry myself to sleep?
2816;SAM;I want to go see Kaylie, I guess, if she's around.
2817;SAM;Are we hanging out together, or are we breaking off?
2818;LAURA;(quietly) Go see your daughter.
2819;SAM;All right.
2820;SAM;I'm going to go see Kaylie.
2821;MATT;Okay.
2822;MATT;Asking around a bit, it doesn't take much to find Kaylie in your old room in Whitestone, the one where you both left when you first exited the group for a short time.
2823;MATT;She's in there, bandaged up, and looks like she's taking a dagger and throwing it into the wall, then walking over and pulling it back out, sitting back on the bed and throwing it, and it bounces off.
2824;MATT;The hilt hits.
2825;MATT;She's like, Fuck.
2826;MATT;Picks it back up and doesn't notice you in the doorway.
2827;MATT;As she sits back down, she looks over.
2828;SAM;Hi.
2829;MATT;Hi.
2830;SAM;You with a dagger in your hand's always a little scary.
2831;MATT;Why, does it frighten you?
2832;SAM;Not any--
2833;MATT;Boo!
2834;SAM;(yelps) Okay, it frightens me a little.
2835;MATT;She sheathes it on the side.
2836;SAM;You okay?
2837;MATT;I've had better days.
2838;MATT;I'm all right.
2839;SAM;Good.
2840;MATT;You're alive.
2841;SAM;Surprisingly, yes.
2842;SAM;We won.
2843;MATT;I figured, if you're standing here before me.
2844;MATT;That's good.
2845;MATT;Congratulations.
2846;SAM;Thanks.
2847;SAM;I'm sorry that I had to go do that.
2848;SAM;I had to.
2849;MATT;I'd be disappointed if you'd've came back with me.
2850;MATT;More important things.
2851;SAM;So what now?
2852;SAM;Do you want to go back to Ank'Harel and keep criming?
2853;MATT;You watch for a brief second her tough exterior break, and you can see her eyes welling up a little bit.
2854;MATT;She looks at the ground for a minute, then looks back up at you.
2855;MATT;I'm glad you're safe.
2856;SAM;I'm so happy I got to see you again.
2857;SAM;I thought for a second that when we said goodbye, it was the last time.
2858;MATT;I didn't.
2859;MATT;I know you too well, at this point.
2860;MATT;You're too much of a turd to die.
2861;SAM;That's true.
2862;SAM;Only good people die.
2863;MATT;I'd like to go back to Ank'Harel.
2864;MATT;I don't know if this whole Meat Man thing's for me anymore.
2865;SAM;Yeah.
2866;SAM;No, I hear you.
2867;SAM;I don't know if it's for me, either.
2868;SAM;It was fun.
2869;MATT;It was a lot of fun!
2870;SAM;It felt like we were killing time a little bit.
2871;SAM;There's something else that we should do.
2872;SAM;I don't know what.
2873;SAM;Maybe your thing won't be my thing.
2874;MATT;Let's find someone to pass on the mantle to, eh?
2875;SAM;That's a good idea.
2876;MATT;I think the Meat Man should be there, just not us.
2877;SAM;Yeah, that's a great idea.
2878;SAM;We'll train a replacement.
2879;MATT;Still take a percentage.
2880;MATT;I mean, we worked this hard!
2881;SAM;Passive income, right?
2882;SAM;It's the dream.
2883;MATT;It's the meat and potatoes of any good business venture.
2884;SAM;I should have thought of that.
2885;SAM;That's amazing.
2886;MATT;That's why the daughter's an upgrade.
2887;MATT;After that, I don't know.
2888;MATT;I hate to admit it, but--
2889;SAM;Did you finish school?
2890;MATT;No.
2891;SAM;Do you want to?
2892;MATT;Yeah.
2893;SAM;All right.
2894;SAM;Well, let's do that, then.
2895;SAM;You go to school.
2896;MATT;I'm not really made for a lyceum.
2897;MATT;We can go visit.
2898;MATT;I didn't expect you to recommend schooling!
2899;SAM;Listen, I've made a lot of mistakes in my life, and I don't want you to make the same ones.
2900;SAM;I love you, and I want to support you in whatever you want to do, at this point.
2901;SAM;My time has come, and I've done my thing, and my thing is done, and now I want to help you do whatever it is that you want to do.
2902;SAM;If that means I can be close to you, then great, but if it doesn't, then I'll come visit every once in a while.
2903;SAM;We made quite a bit of money as the Meat Man.
2904;MATT;Aye, that we did.
2905;SAM;And it's a good sum to get started.
2906;MATT;Would it be enough to pay for a right top-end education so I can gloat over all the other kids that are raised by the various lords and ladies of Emon?
2907;MATT;Become one of those privileged kids.
2908;SAM;You can have the best education.
2909;MATT;That's what I want to do.
2910;MATT;I want to rub it in their face.
2911;SAM;All right.
2912;SAM;Education for spite.
2913;SAM;I like that.
2914;MATT;That sounds like a Shorthalt endeavor.
2915;SAM;Sure.
2916;SAM;Whatever you need.
2917;MATT;She stands up from the bed and walks over and puts her hand on your shoulder in a pat, pat.
2918;MATT;She pulls you into a hug and rests her head on your shoulder and doesn't say anything.
2919;SAM;You won't have to worry about me anymore.
2920;MATT;I'm going to worry about you every day.
2921;SAM;Thank you.
2922;SAM;Thank you for coming into my life.
2923;MATT;Thank you for being enough of a shitbag to bring me into it.
2924;SAM;I'm so happy.
2925;SAM;I made so many mistakes, but it turns out that some of them weren't mistakes, after all.
2926;MATT;I'm still young and unlearned.
2927;MATT;Time will tell.
2928;MATT;She pulls you a little tighter in.
2929;SAM;I'll snuggle and fall asleep in the room at some point.
2930;MATT;She smells the alcohol on your breath and (groans).
2931;MATT;Go lie there.
2932;MATT;I'm going to-- (groans) She winces as her wound in her shoulder flares up.
2933;MATT;I need some fresh air.
2934;MATT;You go to sleep.
2935;MATT;Exhaustion hits you, and you end up passing out at the foot of the bed.
2936;SAM;I'm in my room now?
2937;MATT;Yeah, your old room.
2938;LAURA;I'm going to tuck Velora into bed.
2939;MATT;She's asleep by the time you get there.
2940;MATT;Travel and everything has tuckered her out.
2941;MATT;You tuck her in, put the blanket up.
2942;LAURA;I tiptoe out of the room, and I find Percy.
2943;TALIESIN;I'll be in Cassandra's room.
2944;LAURA;Percival?
2945;TALIESIN;Yes?
2946;LAURA;Could I talk to you for a moment?
2947;TALIESIN;Of course.
2948;LAURA;I completely understand if you want to stay with Cassandra for the night.
2949;LAURA;Would you mind not being very comfortable, though?
2950;LAURA;I was thinking of camping in the woods.
2951;TALIESIN;I think that sounds lovely, and you're always better than comfortable.
2952;TALIESIN;I had a thought, actually.
2953;TALIESIN;My god, it is hard surviving, isn't it?
2954;TALIESIN;Perhaps Keyleth could use a friend right now, and I know that you carry one with you.
2955;LAURA;Trinket?
2956;TALIESIN;Just for a bit.
2957;TALIESIN;I think she could use a companion who's not going to apologize or give too much sympathy.
2958;LAURA;Of course.
2959;LAURA;I send Trinket to Keyleth's room.
2960;MATT;As Trinket ascends the stairs, he looks back over the shoulder.
2961;MATT;(questioning noise)
2962;LAURA;She might cry a lot on you.
2963;LAURA;All right, dear?
2964;MATT;Makes it up the stairs.
2965;LAURA;It's going to be a lot harder to stay warm out in the woods now.
2966;TALIESIN;We'll figure something out.
2967;TALIESIN;I grew up here.
2968;TALIESIN;I'm used to it.
2969;LAURA;I wanted to remember how I used to camp with Vax when we were kids.
2970;TALIESIN;I'd like to see that.
2971;LAURA;I guess we go out and set up a little fire.
2972;MATT;You guys make your way into the woods and set up a camp for the evening's rest together.
2973;MATT;Keyleth, are you in your room?
2974;MATT;The door (creaks) and Trinket comes in and stares right at you.
2975;MATT;(slurps) And licks up the side of your face.
2976;MATT;Your hair sticks up for a minute.
2977;MARISHA;Oh, buddy!
2978;MATT;(bear noises) He leans in and plops down on the ground, a giant beanbag mound of bear fur.
2979;MARISHA;I cover Trinket with snot and tears as I sob into his belly.
2980;MARISHA;First night alone, but with Trinket.
2981;TALIESIN;Best teddy bear ever.
2982;MARISHA;Aware of the gesture.
2983;MARISHA;I cry.
2984;MATT;Eventually the exhaustion and the alcohol hits you, and you fall asleep, cuddled up in the warm embrace of a very fantastic, recently meteor-struck bear.
2985;MARISHA;Drool and eyeliner and dirt.
2986;MATT;Voice of the Tempest.
2987;SAM;You were wearing eyeliner to our fight?
2988;MARISHA;Remember, I charcoal war-painted?
2989;SAM;That makes sense.
2990;TRAVIS;Has everybody gone off?
2991;MATT;Pike actually would still be around.
2992;TRAVIS;I make my way sneakily outside.
2993;MATT;Pike, what are you doing?
2994;ASHLEY;There's a couple of things.
2995;TALIESIN;There's a lovely tea rose garden in the back.
2996;SAM;She's letting Grog go first.
2997;TRAVIS;Oh, really?
2998;ASHLEY;If you wanted to go somewhere, sneak away.
2999;TRAVIS;Oh, you know, I was just gonna, um.
3000;MATT;Who wants to go first?
3001;MATT;Pike?
3002;MATT;Grog?
3003;MATT;Who's going first?
3004;ASHLEY;Just for a little bit, for about an hour, I want to go-- not deep into the woods where Percy and Vex are, but somewhere that's pretty for about an hour, and I'll make my way back.
3005;MATT;As you're out there on your own, contemplating quietly, ruminating on the day, a faint howl finds the air, and stepping from the shadows, you see a large gray wolf: Galdric, the wolf that once belonged to the previous champion of the Raven Queen, Purvan, who was given charge over the forests on the outside.
3006;MATT;Saunters up to you.
3007;MATT;He is a large wolf.
3008;MATT;You are a tiny gnome.
3009;MATT;He steps up, sits next to you.
3010;MATT;In this little break in the trees where you can see the moon breaking through some of the passing clouds over Whitestone.
3011;MATT;The night is so cold, you can see your breath in the dark air through the beams of moonlight that make it through the canopy.
3012;MATT;As the wolf looks down at you, his intense eyes making a full scan of what you are, there's a recognition to his expression.
3013;MATT;The wolf looks back up.
3014;MATT;(howls) And gives a long, baleful howl, seemingly in remembrance and acknowledging that one with a familiar path to his has found his way back to the realm of the Raven Queen, as well.
3015;ASHLEY;You are a beautiful creature.
3016;ASHLEY;This might be strange, but I give him a hug.
3017;MATT;You hug Galdric.
3018;MATT;You're used to Trinket, who's pretty well manicured.
3019;MATT;Galdric, not so much.
3020;MATT;There are clusters of fur that are dirt-encrusted.
3021;TRAVIS;Shit in them.
3022;MATT;Probably.
3023;MATT;He's not a full, ruined beast.
3024;MATT;He lives in the forest.
3025;MATT;Smells of earth, dust, and nature.
3026;MATT;Doesn't seem to react to your hug, but allows it.
3027;ASHLEY;I sit next to him.
3028;MATT;He seems to share the space with you for the time that you're in the forest.
3029;MATT;Not a strong connection, but an acknowledgement, mainly focusing on the moon before it passes through the canopy and is no longer visible.
3030;ASHLEY;I came out here to build a little something, so I'm glad to have you out here for a little bit.
3031;ASHLEY;Thank you for staying with me.
3032;MATT;The one ear to the side perks open to listen to your statement, but the vision doesn't meet yours, still focused in space as it fades.
3033;MATT;You get the essence that the wolf acknowledges you.
3034;ASHLEY;(sighs) I feel like Grog would be so happy right now to be around a wolf.
3035;ASHLEY;I give him a scratch behind his ear.
3036;MATT;He actually seems to enjoy it and gives into it.
3037;MATT;One of the giant hind legs of the wolf--
3038;ASHLEY;Oh, that's a good boy.
3039;ASHLEY;I give out a little howl.
3040;MATT;He howls along with you.
3041;MATT;(howls)
3042;ASHLEY;That was for my friend Vax.
3043;MATT;The wolf gets up, circles you once, and makes his way into the darkness of the forest once more.
3044;ASHLEY;Goodbye.
3045;ASHLEY;After a bit, I head back.
3046;MATT;Okay.
3047;MATT;Grog?
3048;TRAVIS;I wander outside, where I'm by myself.
3049;TRAVIS;Do I see anyone?
3050;MATT;Make a perception check.
3051;TRAVIS;Like it matters.
3052;TRAVIS;Oh!
3053;TRAVIS;17.
3054;MATT;Glancing about, there are some of the Pale Guard around.
3055;MATT;Nobody that you would be looking for, necessarily.
3056;MATT;You seem to be open to do as you please.
3057;SAM;Yeah.
3058;TRAVIS;I pull a card.
3059;SAM;Yes!
3060;TALIESIN;I'm so proud of you.
3061;MARISHA;Wait, where are you?
3062;LAURA;Outside of the castle.
3063;MARISHA;In the middle of fucking Whitestone?
3064;MATT;Oh my god, Grog.
3065;ASHLEY;Wait, as I'm walking back, do I see him at all?
3066;MATT;(chuckles) Out in front of the castle, out in the courtyard area?
3067;TRAVIS;Yeah.
3068;TRAVIS;It's nighttime.
3069;MATT;Make a perception check, Pike.
3070;SAM;Make it good.
3071;TALIESIN;Roll a natural 20.
3072;ASHLEY;I rolled a natural 20.
3073;MARISHA;Shut your mouth!
3074;TRAVIS;I rolled a bunch of hit dice from our short rest.
3075;MATT;As you're quietly climbing up the walkway to the base of Castle Whitestone--
3076;ASHLEY;He's out in the open.
3077;MATT;Yeah.
3078;MATT;You do.
3079;MATT;You look up and see Grog pull a card from the deck.
3080;ASHLEY;I stand and watch for a moment.
3081;SAM;Oh, here's the deck.
3082;LAURA;Oh my god.
3083;LAURA;It is really happening.
3084;LAURA;I can't fucking believe--
3085;MARISHA;Travis, pull good!
3086;MARISHA;Oh, please don't bring pit fiends on our heads.
3087;TRAVIS;I might have.
3088;SAM;Negative two to everything.
3089;MATT;Hold on.
3090;MATT;Deck of Many Things.
3091;MATT;All right, so.
3092;MATT;Grog, what did you pull?
3093;ASHLEY;Oh shit.
3094;MATT;Void.
3095;TALIESIN;Oh no!
3096;MARISHA;That can't be good.
3097;MATT;I'm sure it's fine.
3098;LAURA;That's the worst one you could get!
3099;SAM;The crew's laughing.
3100;SAM;Something's bad.
3101;SAM;Something's very bad.
3102;TRAVIS;I'm pretty sure--
3103;LAURA;That is so bad!
3104;TALIESIN;Oh my god!
3105;TALIESIN;(laughs)
3106;SAM;Wait, Pike saw him.
3107;MATT;Pike.
3108;SAM;You get a reaction.
3109;MARISHA;Did our internet go?
3110;MARISHA;(screaming and groaning)
3111;MATT;Of all moments.
3112;TALIESIN;(cackles) This is your doing!
3113;MATT;While we're here, Grog, I'm going to read you the card.
3114;MATT;This black card spells disaster.
3115;MATT;Your soul is drawn from your body and contained in an object in a place of the DM's choice.
3116;MATT;One or more powerful beings guard the place.
3117;MATT;While your soul is trapped in this way, your body is incapacitated.
3118;MATT;A Wish spell can't restore your soul, but the spell reveals the location of the object that holds it.
3119;MATT;You draw no more cards.
3120;SAM;Wait, read it again.
3121;TRAVIS;I'll tell you.
3122;TRAVIS;My soul is drawn from my body.
3123;TRAVIS;My body is incapacitated.
3124;TRAVIS;It is placed within an object that the DM chooses.
3125;TRAVIS;A Wish spell will tell you the location of the object, but will not reverse the action.
3126;SAM;Can anything reverse it?
3127;MATT;Finding it and retrieving the object and restoring the soul.
3128;MARISHA;You fucking dick.
3129;MARISHA;You're a fucking dick!
3130;LAURA;Well, the campaign goes on for another-- I can't believe you just fucking did that.
3131;SAM;Wait, she rolled.
3132;LAURA;Ashley?
3133;SAM;She rolled something.
3134;SAM;Oh, that was her 20 from before.
3135;MATT;Looks like we may have her back.
3136;MATT;Hopefully, because this is going to be-- oh my god.
3137;MARISHA;It is bad!
3138;SAM;Oh my god, Travis.
3139;SAM;Why would you do that?
3140;MATT;Give me the card.
3141;MATT;Let this be a lesson to everybody out there.
3142;LAURA;Oh my god!
3143;MARISHA;You said you weren't going to bring the Deck of Many Things into the game, and then you did!
3144;MATT;No regrets.
3145;TALIESIN;Hashtag no regrets.
3146;MATT;No regerts at all.
3147;TALIESIN;Oh god, I can't even.
3148;LAURA;Is Ashley texting?
3149;TALIESIN;She's just yelling obscenities.
3150;SAM;Her internet just died.
3151;MARISHA;(mispronouncing) Worst fucking timing!
3152;MARISHA;Internet has gone!
3153;MARISHA;Timing!
3154;MARISHA;Worst fucking timing!
3155;TALIESIN;It's just obscenities.
3156;TALIESIN;That's all it is.
3157;MATT;So Grog, as you draw the card from the deck, your vision goes tunneled, dark, to a pinpoint: a singular pinpoint of deep, ruby red.
3158;MATT;And that's all.
3159;MATT;Your consciousness falls into a catatonic state.
3160;SAM;Does she get a reaction or anything?
3161;MATT;No.
3162;MARISHA;She doesn't get shit?
3163;MARISHA;She just watches?
3164;MATT;She sees it happen.
3165;SAM;With her 20, she saw!
3166;MATT;I know.
3167;MATT;She's aware.
3168;SAM;She can't yell?
3169;SAM;She can't cast something?
3170;MATT;No, because he pulled the card.
3171;MATT;It's not a big (grunts).
3172;MATT;It's a (flip).
3173;SAM;All right.
3174;MATT;All righty, so.
3175;MARISHA;I guess we'll add that to our to do list.
3176;TALIESIN;I'd like to think that in the next campaign, we're going to find you in a glass coffin like Sleeping fucking Beauty.
3177;MARISHA;Yeah.
3178;TRAVIS;My body's still there.
3179;SAM;She rolled a 17.
3180;MARISHA;So Grog's body is still there--
3181;MATT;He's catatonic until the soul's returned.
3182;MARISHA;Catatonic.
3183;MATT;To be fair, you've sealed Vecna.
3184;MATT;At level 19 and 20, this is not going to be an earth-shattering experience.
3185;MARISHA;Sure, it's just an annoyance.
